start	end	text
9229000	9235000	That was through DDR Freak advertising, like mad, and me pimping it on Understation Live, which was the other show I did at the time.
9236000	9239000	And we got 12, and we were like, double digits for episode!
9240000	9250000	We were so fucking excited, and now, thanks to podcasting and iTunes and getting on that wave, we were fortunate enough to get a few more.
9251000	9262000	But yeah, I think consistency is very important. If you're there for the listeners, they'll start to incorporate you into their daily routine and so forth.
9262000	9263000	Sorry, Irene.
9264000	9268000	No, I was going to say, yeah, it takes time to build a listener base and to, you know, get your groove.
9269000	9270000	I'm just trying to encourage you guys as a mailbag.
9271000	9272000	What's that?
9273000	9274000	I'm just trying to encourage you through your mailbag woes.
9275000	9280000	No, we still, even when we only get two emails, we appreciate them very much. So, awesome, awesome.
9281000	9282000	Quality.
9283000	9288000	Well, if you want to send an email, maybe next week we'll get a compliment for our friends from Multitap Podcast, or maybe for JBMon.
9289000	9290000	Maybe next week we will, but we won't be here to read them.
9290000	9296000	Oh, that's right. We'll be here next week to read them. Well, maybe it'll pile up and we'll have four emails and we'll be back in two weeks.
9297000	9298000	I know.
9299000	9301000	And then Rob will have to threaten Kardashian music.
9302000	9307000	That's right. You know what, Piper, did you know that one week on the show, I said, if we don't get four emails, I'm playing music from Kim Kardashian Hollywood during the show.
9308000	9309000	And we did get four emails and Rob played it anyway.
9310000	9311000	And it was glorious.
9312000	9318000	I did because the chatters were like, you're not going to do it. You're not going to, I dare you to do it. I dare you. So, I was like, don't test me. Here we go.
9318000	9324000	And you know what they said? They said, I was expecting it to be a lot worse. The music's actually not bad in that game.
9325000	9326000	It was bad. It was bad.
9327000	9328000	Well, that one doesn't feel bad.
9329000	9330000	All right.
9331000	9335000	Hey, pump it up, people. Not pump it up. The other game that's not DDR.
9336000	9337000	In the groove?
9338000	9342000	In the groove. Yeah. You should do Kardashian music in your game.
9343000	9345000	In the groove, Kim Kardashian edition.
9345000	9346000	In the groove, Kim Kardashian edition.
9347000	9356000	All right. Anyway, this is very random train to go on. All right, let's get to the FUs of the week because also since episode one, we have always done the FUs of the week.
9357000	9367000	Why do we do the FUs of the week on a video game show? Because sometimes we get angry and this is our moment to let it all out of our systems so that we don't rage on some noob on Xbox.
9368000	9369000	Because fuck you, that's why.
9375000	9383000	Here is justice. Here is punishment. This is fucked up.
9384000	9401000	My FU goes towards people who are so absolutely married to their, and I'm using a quoting here, faction that they refuse to remotely give anybody of another ideology a chance.
9402000	9411000	If you are going to be as head in the ground as you accuse your opponents of being, guess what? You're part of the problem.
9412000	9419000	We need to stop dividing lines between people and actually have conversations and be grownups instead of being little children pointing fingers at each other. The end.
9420000	9422000	Well, I'm sorry, Jamie, but for the Horde and that's that.
9423000	9424000	And you're a stinky, poopy head.
9425000	9429000	Well, I just got told. All right. Loki.
9429000	9438000	Um, I guess this FU in my car needed to, well, not even needed to, a valve adjustment that cost five minutes.
9439000	9441000	A valve adjustment sounds like something the guy made up. I'm sorry.
9442000	9450000	No, it's not actually. I researched this in the past when I was having problems and it's just, it's something that Honda fits need after they get to about, you know, the mileage they have.
9451000	9452000	And it's just the only, it wouldn't be that.
9453000	9456000	You're laughing, but it's true. They fucking do that shit where they just make up.
9456000	9461000	You're low on the exam of Elvis. Hello. You're low on blinker fluid.
9462000	9470000	Unfortunately, it's just because it takes, they had, it's in the manifold and they have to disassemble like part of the engine that it takes three and a half hours to do that.
9471000	9474000	So that it's all labor. Thank you. Labor being so expensive.
9475000	9476000	All right. Good health ain't cheap. All right.
9477000	9482000	Let's see. My FU of the week goes to a couple of things. They both have to do with the show I was doing last night.
9482000	9489000	So my character, I had to wear a lot of makeup for my character last night and like most of it came off, but the fricking eyeliner will not come off.
9490000	9491000	And it looks, I just looked like an emo kid today.
9492000	9494000	You know, if you had told me this, I would have brought my makeup over.
9495000	9499000	I don't, I believe me, I've scrubbed with like Cetaphil and all that stuff like over and over. Like this stuff will not come off.
9500000	9501000	Rob, admit it. You look fabulous.
9502000	9510000	I know, but I look like I'm like going to go to a fallout boy concert or something. I just don't, it's not, sorry to all the fans out there, but it's just like, this isn't really my look.
9510000	9517000	I just look really tired. I don't know. Anyway, uh, let's go to our guests. JV Mon, you have some FUs of the week you want to get out?
9518000	9526000	Uh, FUs of the landlord of the store I work at because he's not renewing the lease because reasons. So as of February, I'll be out of a job.
9527000	9532000	And this is the second time that this has happened to me last year because I work for FYI. I don't care.
9533000	9540000	The story I worked at in Westchester last year, they closed down because the landlord's like, fuck you, we're not renewing the lease. You've been there 20 years, no one cares.
9541000	9545000	So I got transferred back to the store in the Bronx and now the landlord there is doing the exact same thing.
9546000	9547000	That's what FYE stands for, right? Fuck you, eh?
9548000	9549000	Pretty much.
9553000	9556000	I don't think a FYE is from Canada. Okay.
9557000	9565000	And fuck you to Alamo Car Rental because when I went to get my car on Friday, I had to wait about 40 minutes to get registered.
9566000	9572000	And then they made us wait outside because they had no cars, but they were still taking registration for more cars.
9573000	9581000	And I was kind of like, oh, a car just came back. Quick, get in and run. And it's just like, I haven't had coffee in like five hours and I'm crazy.
9582000	9584000	And they don't have Dunkin Donuts here, so I don't know what you're going to do.
9584000	9586000	Starbucks? They have Starbucks.
9587000	9592000	Alright, moving on. How about Piper? You got some FUs of the Week you want to get out here? Something to make you Yanksty?
9593000	9594000	Does it have to be personal or can it be like famous names?
9595000	9596000	You can do whatever you want it to be.
9597000	9599000	I've got three quick ones. Fuck you Lindsay Lohan, you know why.
9600000	9602000	You know what you did.
9603000	9609000	Fuck you Phil Fish, I'm still mad and Bodily is like way better. I'm not even being professional now, Bodily is cooler than you.
9609000	9615000	And fuck you whoever assembled my 3DS. I want it back and I still hate you.
9616000	9620000	Alright, you got to follow that Princess Irene, last but not least.
9621000	9635000	Um, fuck you to my cat. Because he's a dick. He keeps knocking over my digital frame and I just want to punch him in his little cat nose. Because he's a jerk.
9636000	9645000	Yes, I am cruel to my cat. Aww, not really. And then an ambiguous generic fuck you to school related things.
9646000	9648000	Alright. And that's it. Very ambiguous.
9649000	9650000	Yeah, no one or a thing in particular.
9651000	9656000	Act Deft by the way, who is our Mexican listener. One of our Mexican listeners. We have a couple.
9657000	9658000	Just the one.
9659000	9665000	Just the one. But no, he's been here like every week for a very long time. So we kind of call him the one in Mexico.
9666000	9669000	But Act Deft for FYE says fuck you SA.
9671000	9672000	So there you go.
9673000	9677000	Somewhere between fuck you A and fuck you SA.
9678000	9679000	Fuck you SA.
9681000	9682000	Two levels.
9683000	9684000	That's deep man.
9685000	9686000	At least it's not like fuck your eggs.
9687000	9690000	Alan Alchemy in chat says, OLR debuting the new Fall Out Boy single.
9691000	9694000	Quote, if you think this podcast is long you should see the reasons I'm breaking up with you.
9697000	9700000	That totally sounds like a Fall Out Boy song.
9701000	9706000	God, are they the ones that have that song? Like there's a song on the radio right now and I swear it sounds like Fall Out Boy is one of those bands.
9707000	9709000	But it samples like Tom Diner. Tom Steiner. Do you remember?
9710000	9711000	I think it is.
9712000	9714000	Oh my God. I got so angry when I heard that the first time because like, you know, I'm hearing it.
9718000	9722000	And I'm like, oh fuck yeah, it's Suzanne Vega. And then it's like, I'm so mad.
9724000	9727000	And I'm like, what did they do to Tom Steiner?
9728000	9732000	At least you don't have to hear it about 50 times a day at work because it's on our audio loop at work.
9733000	9735000	So I hear it about 50 times a shift.
9736000	9740000	And every time I get fooled because I'm like, yeah, Tom Steiner. Wait, no, I should know better by now.
9741000	9744000	Oh my God. If I had to go through that, fuck yeah, euthanasia.
9747000	9749000	I don't know. I don't know. Alright.
9751000	9755000	Anyway, we just got a couple more stories for you guys and then we're going to open up the phones for you to call.
9756000	9761000	Yay. Tell us we're pretty. 1-877-GAME-OLR. Or maybe you have a question and you want to talk about something else in games.
9762000	9765000	You can look into our eyes longingly. Except you can't because we don't have a cam.
9766000	9771000	Yay. 2-800-GAME-OLR or a username on Skype, Orange Lounge Radio. But first, two more stories here. Loki.
9772000	9782000	So, since I was so excited about Forza Horizon 2, I'm a little disappointed that for whatever reason, I guess it's because they really want you to buy an Xbox One.
9783000	9788000	All the DLC that they're releasing for Forza Horizon 2 is only for the Xbox One.
9789000	9794000	The Xbox 360 version, not even part of the Forza rewards program thing that they have.
9796000	9804000	They basically just said, hey, we're currently planning to release DLC only for the Xbox One version of Forza Horizon 2.
9805000	9809000	Also, Forza rewards benefits are only available on the Xbox One version of Forza Horizon 2.
9810000	9814000	This means that Xbox 360 players will not receive Forza rewards credits or cars.
9815000	9821000	And they said progress in the 360 version of Forza Horizon 2 does not count towards your Forza reward tier level score.
9821000	9829000	Only progress in the Xbox One version of Forza Horizon 2 will count towards your overall Forza score and tier level and Forza rewards.
9830000	9831000	Yeah. Fuck you guys.
9832000	9839000	Thanks a lot, you know. It is your own fucking console. It's a first party game and you're not even supporting that shit.
9840000	9846000	You know how many people have an Xbox 360? It's like significantly more than have an Xbox One.
9847000	9849000	You're not going to win people over this way.
9849000	9850000	Yeah.
9851000	9856000	Like I want to get Forza Horizon 2, but you're right. All this stuff I'm hearing about how basically the 360 version is kind of gimped.
9857000	9859000	I'm like, well then I need to hold out until I have an Xbox One whenever that may be.
9860000	9863000	Exactly. And what if they do a game of the year edition later on like they did with Forza Horizon 5.
9864000	9865000	Or Forza 5, no.
9866000	9867000	Or any big game.
9868000	9869000	Alright.
9870000	9873000	Well, some sad news for those of you guys that like your magazines.
9873000	9881000	Like I know Dark Soccer loves her print media, but unfortunately another magazine going away and it's the official Nintendo Magazine in the UK.
9882000	9887000	We'll be shutting down on November 11th. This is announced by Future Publishing and Nintendo.
9888000	9891000	The magazine staff, however, good news, they're going to be shifted to other positions within the company.
9892000	9895000	So at least they're not using the, you know, redundancy. It's the UK, so it's redundancies.
9896000	9905000	Anyhow, from the website, quote, Nintendo will continue to speak directly to fans via Nintendo Direct, our social media, and online channels and public events.
9906000	9911000	Internet, internet, internet, expos. Right? Those are the four things they just said there.
9912000	9919000	So there it is. The unofficial Nintendo UK magazine stopped publishing in 2012, the same year that Nintendo Power ceased operations.
9920000	9926000	So that's unfortunate. The cool thing about this magazine, too, is I've seen some pictures when you stack the magazines all side by side.
9927000	9932000	Like the first hundred or so issues, like the Nintendo logo, and these last few were like a Wii U.
9933000	9935000	So they actually look kind of cool sitting on your shelf.
9936000	9938000	So that, you know, that sucks. That's a bummer.
9939000	9946000	And, you know, I don't know, like it's cool that you can get magazines on your iPad and all, but it's just not the same when sitting on the toilet.
9946000	9952000	It's not the same at all, because you're like, I have this expensive thing in here, and I don't want to get water on it accidentally.
9953000	9957000	All right. Anyway. There it is. Going away.
9958000	9960000	Darsaka, surely you're having a sad about that. I mean, I doubt you.
9961000	9966000	But I never actually read the UK magazine, so I'm slightly indifferent, but print media will always be awesome.
9967000	9970000	You can never digitize the smell of ink.
9971000	9978000	All right. Well, we are going to go to the Skype line, 1877 Game OLR, or our username on Skype, Orange Lounge Radio.
9979000	9980000	Let's see if anybody would like to call.
9981000	9983000	You can talk about anything we've talked about tonight, or maybe there's something else you want to bring up.
9984000	9989000	I don't know. But the phones are open now, so let's get to it.
9990000	9995000	While we wait for your calls, let me check with Loki and see if there's any last minute stories.
9996000	9997000	I'll bring up Twitter here.
9998000	9999000	Not yet.
10000000	10001000	They're going to do a comic for Valiant Hearts.
10002000	10003000	Are they?
10004000	10009000	I asked iOS game, and the thing that's coming out was it on PlayStation 4 and stuff, so they're doing...
10010000	10014000	Nice. That's right. Didn't the handheld Sony things do like comics? I remember the PSP did.
10015000	10022000	Well, yeah, and this is kind of cool because this is one of the... I think this was using that UBIARD engine, so that looked pretty neat.
10023000	10025000	Nice. All right. Well, we do have some calls coming in, so let's get to it.
10026000	10027000	Hi, you're on Orange Lounge Radio. Who's this?
10028000	10029000	It's Ranma.
10030000	10032000	Hey, everybody. I'm doing good. How is everybody there?
10033000	10036000	It's a full house tonight. We're great. A little hot in here, but you know.
10037000	10038000	Hey, Ranma.
10039000	10041000	You're still a dick, JB Mon.
10042000	10043000	Wait, why are you a dick? What'd you do?
10044000	10045000	For the buff boys comment.
10046000	10047000	Oh.
10048000	10049000	What else?
10050000	10051000	The private conversation on your Facebook that most of our listeners probably won't see. Sorry.
10052000	10054000	What's up, Ranma? To what do we owe this phone call?
10054000	10061000	Well, before we get into that, Rob, I want you to know you've had too much candy. You're not allowed to have any more.
10062000	10064000	But candy's delicious. Why can't I have candy?
10065000	10066000	I suggest I brought some over.
10067000	10073000	You know what? Fuck your rules. I'm eating candy right now. Fuck your rules. Fuck them.
10074000	10077000	Yeah, but that type of candy might get your ass beat, okay?
10078000	10079000	You're not the boss of me.
10080000	10081000	That's not my job.
10081000	10083000	Alright. What else is on your mind, buddy?
10084000	10093000	Oh, I was listening earlier. You were talking about the whole thing about Comic-Cons. I figured let me chime in real quick and give you the meat and potatoes of all of that.
10094000	10095000	Please.
10096000	10112000	See, I didn't go because I can't justify taking a day off of work just to stand eight hours on a line in a comic book shop for a three or four day badge where by the time I get to the front, they're sold out.
10113000	10115000	So that's my main reason for not going.
10116000	10120000	But as you saw, a picture went viral that a friend of mine took about the weapons.
10121000	10129000	Pretty much what was happening was you had a basic set of rules on the website, which did not reflect the rules on the mobile site.
10130000	10143000	So pretty much staff was pretty much confiscating weapons left and right, and people got upset that the confiscate weapons that people have been working on for days, weeks, hours, months, whatever.
10143000	10157000	Which I understand. But if the rules say that the weapons have to be made of cardboard or foam and you go out and start making things out of different materials to kind of make it stand out and they take it, you have no one except yourself but the blank.
10158000	10171000	Now, they were actually throwing them out for a little bit. The next day on Friday, they more or less cleared it up saying, well, if it looks too realistic, you're not going to be able to come into the Javits Center with it.
10171000	10174000	We're going to take it, tag it, and you'll be able to pick it up later.
10177000	10185000	This sounds like a mess, though. Doesn't that make you kind of question the organization of it, though? Especially with these people standing in line for forever. Come on.
10186000	10198000	Who has fun doing that? That pisses me off more than anything. I swear to God, if I go to BlizzCon and I have to stand in line all fucking day to get a badge, I'm going to be pissed right from the get-go after all the money paid for it or whatever.
10199000	10213000	Nothing drives me crazier than that stuff, so why couldn't they figure out a way to do that online and what have you. And then, you know, it's really crappy that they had that miscommunication between online and what have you. So, I don't know, that's kind of frustrating, too.
10214000	10231000	I know, and I've had a couple of staffers contact Comic-Con, and I posted the response emails on my website so people can see what was going on. It's pretty much, like I said, if it looks like a weapon, it will be confiscated, done and done.
10231000	10245000	But, Rob, you're sitting here complaining about what's going on with Comic-Con, which I understand, but I don't know if you know this, but the people that run Comic-Con are the same people that run PAX, so you shouldn't be surprised.
10245000	10264000	Touch. Brad from Pop Culture says, be glad you weren't at previous Dragon Cons. The line there used to be horrible. Yeah, I've heard stories. Yeah, thank God they fixed that up. This year was great. I walked right in. Just took me five minutes. It was awesome.
10265000	10281000	Which is good. I mean, a lot of conventions do that, but I'll admit, when I went to Comic-Con last year for one day, I got there about 10 o'clock that morning. I was in in about 15 minutes, because they kind of spread it out with the checkpoints in the Tap Your Badge.
10281000	10290000	And I guess this morning, yesterday, because it started raining pretty bad, arrows kind of huddled up together, and I'm just like, oh, good thing I'm not going.
10290000	10297000	Yeah, Bob Coffee in our chat says, be glad you weren't at Anime Expo this year. The line of, Line Con of Death. Yeah, I heard stories.
10297000	10310000	Oh, yeah, I kind of toyed with that. I made this meme called Line Con The Game, and it was like, easy, normal, hard, God Mode. I think I put that for God Mode, Anime Expo.
10311000	10322000	Now, the question everybody wants to know is, you know, for all the troubles of standing in line and having weapons confiscated, was there a ball pit to be given an hour in?
10322000	10328000	Um, actually, no. There was no ball pit this year.
10328000	10334000	What a failure of a con. Alright, I'm kidding, I'm kidding. Some people might have...
10335000	10344000	Trust me, your sentiments, it's echoed across everybody, and you know how it is, I can't stand this, I'm not going, I'm not going.
10344000	10350000	Monthly, you going to Comic Con? Hell yeah, I'm going! Exactly right, exactly. I'll be back, heck yeah.
10350000	10356000	Alright, Rob, I'm going to let you go to see if we can get some more calls in, but thank you as always, and Anime Jam session Tuesday nights here at VOG.
10356000	10363000	Doing a complete roasting of Comic Con, so bring some food, bring some steaks, bring some marshmallows, the flame is going to be mighty high.
10363000	10367000	And bring some Kahlua. Did you see those marshmallow shots with Kahlua in them?
10367000	10373000	Uh, no, I got something better. What's that? Quickly. Deep fried tequila shots.
10373000	10378000	No, I'm not a tequila person. What? What is this? It sounds amazing.
10378000	10381000	Deep fried tequila shots, yeah. Well, you know they do deep fried Kool-Aid, why not?
10382000	10385000	Why do I not have this in me right now?
10385000	10393000	You bake this, you take Pal Cake, and you cut it up into little blocks, you let the tequila soak in it, and then you deep fry it!
10393000	10396000	And add powdered sugar, just like mom used to make.
10396000	10400000	When you cook it, wouldn't the alcohol boil? Alright, forget it.
10400000	10406000	No, because the Pal Cake soaks so much of it in, and when you deep fry it, it's not it.
10406000	10409000	Alright, this ain't a damn cooking show, we'll talk to you later.
10409000	10413000	That's because Logie didn't bring any bacon!
10413000	10415000	There might have been bacon on that burger.
10415000	10417000	Yeah, it wasn't very good either.
10417000	10419000	Alright. Rama, bye!
10419000	10420000	Bye!
10420000	10422000	Alright, 1877 Game O, L, R.
10422000	10430000	Well, see, that's the thing, I used to get, they had those special triple, third pound burgers or whatever, and then they converted them into their new quarter pounders.
10430000	10435000	And the quarter pounder one, the difference was that they used red onions in it and stuff like that.
10435000	10441000	But now, and there's science, now with white onions! So basically it's a fucking quarter pounder with bacon and they charge extra for it.
10441000	10446000	Well at least it's not those frickin' onions that were dehydrated and shit, that stuff was nasty.
10446000	10452000	The bacon was not good though, it tasted really weird, and the white onions are not good either because they've been sitting there all day long.
10452000	10461000	Actually, true story, you know that that's what makes potato salad go bad is not mayonnaise or the potatoes, it's the onions being set out in the sun.
10462000	10466000	Be very careful if you eat raw onions that have been sitting out. Just sayin'.
10466000	10474000	Well, I will not touch potato salad because of the mayonnaise word, and you all know how I feel about mayonnaise, can't stand it.
10474000	10475000	It's amazing?
10475000	10477000	Mayonnaise!
10477000	10481000	Amazingly barf when I eat it, cause stuff is nasty.
10481000	10483000	And today's opposite day, so you mean it's great.
10483000	10486000	Now I hear there's a potato salad that's made with mustard, I'm okay with that.
10486000	10496000	No wait, when I make potato salad, I actually will use mayonnaise and mustard in it, because mustard will offset sweetness in some of the other ingredients.
10496000	10500000	And it comes out very balanced and very nice, that's how we do it in the south, just sayin'.
10500000	10503000	The way Rob feels about mayonnaise is the way I feel about mustard.
10503000	10507000	I won't eat mustard on its own, cause I hate mustard, but in potato salad.
10507000	10511000	See, it does seem like people are in one camp or the other, like you don't have a lot of people that are both, except Jamie.
10511000	10514000	Mustard is an ingredient, not a condiment.
10514000	10520000	When I make potato salad, I make it with potato, bacon, butter, salt and pepper, and I bake it.
10520000	10522000	Oh wait, that's a big potato.
10524000	10526000	I don't like potato salad.
10526000	10527000	Yeah, Piper?
10527000	10529000	Not just say this isn't a cooking show.
10529000	10531000	I know, right? Well nobody's calling.
10531000	10533000	We always talk about food.
10533000	10537000	You can always talk about potatoes, like I don't care, you know.
10537000	10538000	Never mayonnaise.
10538000	10541000	Does food never come up on multi-tap podcasts? Never ever?
10541000	10542000	I don't know.
10542000	10543000	Microphones.
10543000	10544000	Microphones, don't forget.
10546000	10551000	I have to go back to the backlog. It's all on YouTube, but we have to have talked about food at some point.
10551000	10554000	I'll just have to listen to every episode and find out.
