start	end	text
0	7000	Orange, Lounge, Radio
7000	14000	Visual Hosts, DarkSakura, Skie, and Loki
14000	27000	Tonight we interview Lunar Ray Games, creators of the kick-started title Time Spinner, a 2D metroidvania platformer coming to multiple systems next year. We'll have this and much more along with your questions in chat, calls and emails right here on the show, where every gamer has a voice.
27000	31000	Orange, Lounge, Radio
31000	47000	Hello my friends out there on the internet and welcome back to another week of the show where every gamer has a voice. It is Orange Lounge Radio Live with this episode number 571 for today which is October the 12th, 2014.
47000	54000	My name is Rob Roberts joined by my co-host. Say hello here in studio to the one and only DarkSakura or Jamie Summers.
54000	55000	Hi.
55000	56000	Hi, how are you?
56000	57000	I did a thing today.
57000	58000	What did you do today?
58000	59000	I slept a lot.
59000	61000	You slept a lot. Congratulations.
61000	64000	No, I did another thing today but you'll find out about that during what I played.
64000	73000	Oh my, okay. Well, you had a very me day and I had a very you day because to reward myself because we have a big show tonight. Tonight it's like OLR is taped in front of a live studio audience. We have so many people here in the studio.
73000	75000	You left track.
76000	89000	But since we have a busy show tonight and I did a performance last night because as you know I do the shadow cast theater stuff although as I announced on the show a couple weeks ago that's all going to be winding down very soon. So my next to last show was last night.
89000	92000	So I rewarded myself with tacos today. So I had a very Jamie day.
92000	93000	Tacos are amazing.
93000	95000	Tacos are great. So there you go.
95000	96000	Tacos are amazing.
96000	101000	Awesome. Alright, also amazing. Say hello to Techmaster Loki.
101000	102000	Hi.
102000	103000	Hi, how are you Loki?
103000	104000	Clean spam.
104000	108000	Clean spam. Are you getting attacked by the spam bots on your email account again?
108000	112000	I just haven't checked in like a couple days and so I have a million messages.
112000	120000	Uh oh. And it's like, you know, would you like to enlarge your penis or would you like to enter the lottery in Nigeria or whatever spams?
120000	126000	No, it's increase the value of your home. Mysterious water of life vanishes.
126000	132000	I love it when I get those emails that are like increase the value of your home. It's like, I'm a runner. Delete.
132000	139000	Delete. Alright, anyway, we do tape live every Sunday night at six o'clock Pacific, nine o'clock Eastern to the voice of Geeks Network,
139000	144000	vognetwork.com right after the Bobby Black Wolf show. We do have a very busy show tonight.
144000	155000	We have, as mentioned there in the intro, Bodhi Lee from Luna Ray Games going to join us in about 25 minutes here to talk all about what they're up to and their game time spinner.
155000	158000	That's going to be awesome. But here in studio, we have a very packed house.
158000	167000	I want to get to it here. Kicking off tonight, introducing our guests. First off, this is a name you might recognize if you've been listening to OLR for a very, very, very long time,
167000	174000	but she hasn't been here in way too long. So welcome back to the show. Princess Irene is here tonight. Hi, Princess Irene.
174000	181000	Hello. How are you? Doing pretty well. How about you? Good. Great. So we're all caught up. Let's move on. No, I'm kidding.
182000	191000	So, okay. So for those that haven't heard you on the show before, you've been a gamer as long as I've known you, which has been a very long time.
191000	197000	I remember we used to play DDR together and all that fun stuff. What kind of games do you like? Like, what are your favorite sorts of games?
197000	205000	Well, obviously, rhythm based games. That's kind of how we met. Well, not how we met, but a lot of our friends. I like RPGs. I like puzzle games.
205000	213000	I'm sounding like the, I don't know, stereotypical like girl gamer or something, but, you know, it's kind of on an independent case.
213000	221000	I just judge it based on like what I see. So, yeah. But you also play a lot of like recent stuff too, because I noticed before we were getting started here,
221000	228000	there was like a Smash 3DS brawl going on during Bobby's show. So yes. Yeah. Is that what you've been into kind of lately?
228000	239000	Yeah. I mean, um, you know, I'm Poe, so we just got a 3DS last year. We actually got two of them, but, um, I've been loving it, you know, and I've been trying to catch up on, on a backlog of games on the 3DS.
239000	246000	So that's been great. And yeah, I got, um, Smash Brothers for my one year wedding anniversary. So isn't that romantic?
246000	253000	Oh, congratulations. No, it is. It's awesome. Yeah. And you're, well, your husband's a giant nerd too. So, you know,
253000	264000	Yes. Yeah. The couple that plays together, stays together. Wink. Indeed. Going to our chat room over at live.vognetwork.com, you're getting a lot of welcomes there.
264000	272000	Like, yay, Irene. Yay. Hi Irene. Yay, Rice Princess. Yay, anniversaries. Cause you used to go by that name and then you switched cause you know, you can.
272000	279000	Yeah. I wanted to be less racist. No, I'm kidding. Thanks for remembering me guys. Oh, hearts and feels.
279000	287000	So while you've been gone, this is interesting though, because while you've been gone, I mean, I don't think you've been on OLR in probably at least a year and a half. It's probably been almost longer.
287000	292000	I think it's more than that. Yeah. It's been a while, but while you've been gone, you just decided to start your own show.
292000	303000	Not really. I was invited onto another show by another person who's here tonight. Um, and it's, it's just worked out. So yeah.
303000	312000	No, I th you know, we say support indie podcasting and I actually think that is like super fucking awesome that you're doing your own thing right now. Yeah. Cause you guys are focused on like retro type of games, right?
312000	321000	Um, most, well, we don't really like to call yourself a retro cast, but it ends up being a retro cast cause we're all like really old gamers.
321000	329000	It's usually what it is. Everything, you know, new is crappy and everything old is good. So kind of pretty much that's not true. Yeah.
329000	336000	Well, it's appropriate that you're here tonight when we're going to be talking to somebody who's developing a new game, but very influenced by the retro stuff.
336000	347000	I've heard a thing or two about this game. Let's be real. You actually put this on my radar. I'm glad you did. I'm excited. Me too. Yeah.
347000	355000	All right. Awesome. Well, let's talk to your cohost who's also joining us here tonight. Say hello everybody. I didn't ask if he has an alias. Do you have an alias that you use or should I call you by your name or what?
356000	365000	The universal handle is usually the mad piper. Okay. Whatever you find. So mad piper it is. How are you doing? I'm well. Yeah. Yeah. Welcome to the show.
365000	370000	Thanks. I'm excited. All right. Tell us a little bit about what you and Irene do on your show.
370000	377000	It's called the multi-tap podcast. It's on the Fistful of Potions network. You guys have the VoG network here.
377000	388000	It's mainly just, I don't know if we even have a theme really. It's a lot of tangentry and it's loosely based around older video games or newer video games.
388000	394000	Tangentry. Not familiar with tangentry. No, we only stick to business here. You're on the wrong show, buddy. I'm sorry to say.
394000	401000	I probably won't talk a lot. Well, okay. Since you guys are retro fans, what are some of your retro classics?
401000	408000	Because I've known her forever, but I've only just met you, although I've heard your show. But what are some of your favorite classics?
408000	417000	Goodness. I think I mention Super Mario RPG on every episode. Final Fantasy VII. Really like big ones, but there's some that just really stick out for me.
417000	421000	I'm really liking theater in them, though. But my poor 3DS is in the shop.
421000	422000	What happened?
422000	435000	So, I found out there's a numskull somewhere that built the 3DS and the motherboard is warped. So when it was in assembly, you know those little hooks that you can put a lanyard on?
435000	438000	Thank you.
439000	448000	So the motherboard was put on top of that. Or I guess one corner of the motherboard was kind of assembled on top of that. And so, it's having a hard time. It won't read the SD card anymore.
448000	453000	Now, you're getting some hellos in our chatroom over at live.vognetwork.com.
453000	457000	Ochikawa says, hello Piper, great radio voice. Link to podcast?
457000	458000	Oh, hi.
460000	463000	It would be, I guess, at fop.net. You can find it on the webpage.
463000	464000	Wait, fop?
464000	465000	Yeah, F-F-O-P.
465000	469000	Oh, okay. I thought he said something else for a minute there. I was like, the fap? What is this?
469000	474000	The fap net? If you listen to the show, you'll understand. You'll feel a sudden urge.
474000	476000	So, this is for fop?
476000	477000	This is for fop.
477000	478000	Okay.
478000	491000	fop.net, Fistful of Potions. Or I think spelled out fistfulofpotions.com. And then we're on the webpage or on iTunes or on YouTube. We have a playlist up on YouTube, so you can find it fairly easily.
491000	497000	Nice. Awesome, awesome. So, tell us about what you talked about on your most recent episode, if people would check it out.
497000	509000	We had actually, we went out of sequence, but we did episode Mighty No. 9 to celebrate Mighty No. 9 coming out, I guess, soon. So, we couldn't talk about that very much, so we just kind of talked a lot about Mega Man.
511000	512000	That's fine.
512000	516000	We had nothing else. But it was a good time.
516000	521000	We were going to talk about Mighty No. 9, but then we realized nobody's played it, so we'll just talk about Mega Man. It works.
521000	522000	Yeah.
522000	524000	Which one's the best Mega Man? Ooh.
524000	525000	Ooh.
525000	526000	You have to listen to the podcast.
526000	528000	I'm asking you now.
528000	529000	Oh, man. For me?
529000	530000	Yeah.
530000	531000	I like X.
531000	532000	You like X?
532000	533000	I like X.
533000	534000	Really?
534000	535000	But it's one of the few I've played.
535000	536000	You dare to not say two or three?
536000	542000	I've played one, two, and three, and X, and I think I loved X the most just from nostalgia's sake, from when I was little.
542000	544000	It did the most for me. You got armor.
544000	545000	Yeah, you did.
545000	548000	Extra, not back to canisters, what are those? Energy capsules.
548000	561000	I think two will always be my favorite, but again, I think that's a nostalgia thing. Like, I had played one when it was new, but then two is that game you saw in Nintendo Power, and you were like, this looks like a frickin' cartoon.
561000	575000	These graphics are so amazing. Oh my God, my mind is blown. And then the game comes out, and it really does, like, for graphics of the time, looked so good. Like, some of those, like, I remember the giant fish in Bubble Man's stage. That was amazing for us, right?
575000	579000	You gotta listen to the episode. One of our co-hosts is Bubble Man's number one fanboy.
579000	580000	Okay. Alright.
580000	582000	He said the right one.
582000	585000	That is something. Bubble Man's fanboy.
585000	588000	We also talk about Bubble Man's wiry remains.
589000	599000	Nice. Go to our chatroom over at live.vognetwork.com. Somebody over there, Raginator, is quickly registering for fap.com, so there you go.
599000	600000	Oh, man.
600000	612000	Agdeft says, I'm still waiting for Mega Man X20. Bochikawa says Mega Man 9. Oh, sorry, no, that's Mighty No. 9. So feels like classic Mega Man to me, even though you dash constantly everywhere.
612000	616000	Now, some people have played it because there's that beta for the backers of a certain level on Steam, right?
616000	617000	That's none of us.
617000	624000	Let's see. And Dungeon Buster agrees. Mega Man 2 is so good. Well, because you have good taste, sir. Alright.
624000	629000	We're going to move on. I'm going to introduce one other guy we have here. I told you guys it was a full house here tonight.
629000	639000	Not only do we have our friends here from the MultiTap podcast on FFFOP, but we have another old friend of OLR back tonight making his yearly visit to the studio.
639000	641000	Say hello, everybody, to JB Mon.
641000	642000	Hello.
642000	643000	How you doing?
643000	644000	Pretty good. You?
644000	645000	Pretty good. You?
645000	649000	Good. You just flew in from New York City the other day, right?
649000	654000	Yeah. My sister had gotten married this past weekend, so, you know, I figured I might as well show up.
654000	660000	Might as well. Well, that's I mean, that's still really awesome because you usually when you come visit your sister, from what I recall, is in the Bay Area somewhere.
660000	661000	Yeah.
661000	664000	And we're still a good two hour drive from the Bay Area. That's still, you know, dedication.
664000	666000	Like an hour and a half, two hours, depending on traffic.
666000	670000	Oh, okay. So did you get a lot of wine at the wedding?
670000	677000	Yeah. It wasn't like free bar for like liquor or beer, but like wine. They were just like cases and cases and cases of wine.
677000	686000	And, you know, today they were picking everything up. They had maybe like one or two bottles of wine left out of like 50, 15 cases.
686000	688000	And all the kegs were still almost full.
688000	689000	Nice. Nice.
689000	690000	My family likes wine.
690000	697000	Now, our other guests were promoting a podcast, and I know you used to do one, but your podcast list right now, right?
697000	698000	No, it started.
698000	699000	Oh, you did?
699000	700000	Yeah.
700000	701000	Oh, yay.
701000	702000	It's about one episode every month or so.
702000	704000	Okay. All right. Hey. Do it when you do it.
704000	705000	It's still about Eurobeat.
705000	706000	Yeah.
706000	707000	So.
707000	712000	Well, we have a lot of fans of like DDR, and so if you like that kind of music, this is going to be right up your alley, right?
712000	720000	Yeah. And we've sort of been inspired by Orange Lounge Radio, so we kind of get on the tangent train all the time.
720000	721000	Nice.
721000	724000	Because, you know, it's not a good podcast if you don't have tangents.
724000	729000	That's very humbling to hear that, although to be fair, I don't think we invented the tangent here at Orange Lounge Radio.
729000	731000	Hey, I'm giving you credit, so take it.
731000	733000	You know what? I'll take it. I'll take it. That's awesome.
733000	738000	So you guys, do you play a lot of the music, or you just talk about it, or how does that work?
738000	739000	Both.
739000	740000	Both?
740000	743000	Because, you know, you can't really just play the music straight for copyright reasons, so.
743000	744000	Right.
744000	748000	I like to think we got away with it for talking over it and keeping it in a low volume.
748000	751000	You know, just skirting the issue completely.
751000	752000	Sure.
752000	753000	It's like, this is a gray area.
753000	760000	This is a gray area. But, I mean, you tend to play stuff from, like, the probably, let's be real, most people probably haven't heard.
760000	761000	At least in America.
761000	762000	Right.
762000	763000	Yeah.
763000	764000	So, you know.
764000	768000	Although, recently in the past few years, Avex has been putting a lot of it on American iTunes.
768000	772000	So, it's kind of like, years and years and years, US doesn't exist.
772000	777000	And then, like, 2008, 9 happened. It's like, everything on iTunes at once.
777000	778000	Yeah.
778000	787000	Well, that's been happening a lot with, like, video game soundtracks and other types of things that, you know, I remember we used to have to, you'd have the one corner of the comic book shop that would have, like, the import CDs from Japan.
787000	788000	Yeah.
788000	792000	Where it's like, you have a Final Fantasy soundtrack and a, you know, a Hamasaki Ayumi CD, and that's about it.
792000	797000	Yeah, and then they'd want, like, $70 for five songs, and it's like, you're smoking crack.
797000	799000	That's still A-1 Comics.
799000	801000	Is that, you still do that there?
801000	802000	Except they do that for the bootlegs.
802000	811000	Well, and then I remember when it was the giant Virgin Megastore in, and this is not a place to buy Virgins, it was, you know, Richard Branson.
811000	820000	It was a Virgin Megastore in San Francisco, right, not far from the Metron, used to have, like, all the, not just the Japanese imports, but then it was all, like, the Euro, Euro singles.
820000	826000	So, it's like, if there's, like, a Kylie Minogue song you haven't heard, they probably have it at the Virgin Megastore, right?
826000	828000	I wasted a lot of money at Virgin Megastore.
828000	830000	Oh, you're a Kylie fan too?
830000	841000	No, I was an import, I was a Ministry of Sound fan, and I used to pick up a bunch of different mix CDs from all these European imports, and they're, like, I spent hundreds of dollars there.
841000	847000	No, no, no, no. Let's rewind this a little bit to the same era for me in Alabama.
847000	848000	Okay.
848000	854000	Oh, I could order this for $100 with shipping? I'm ordering the single.
854000	860000	Oh, my gosh, no way, no way. That's, like, that's how much it would cost to, like, get a game imported from Japan.
860000	866000	I can order a Super Famicom game for only $120? Yes, I'll order the Sailor Moon S Fighting Game.
866000	868000	True story.
868000	877000	Oh, my gosh. Go to our chatroom over at live.vognetwork.com. Let's see, Locopoco says, OLR perfected the tangent. Oh, well, thank you very much, I appreciate that.
877000	886000	SSG100Matt says, the things I'm hearing at a New York Comic Con is that it's a mess. Oh, JV Mon, you ran out of town the weekend New York Comic Con is happening, are you? How do you feel about that?
886000	895000	Around the time I was going to buy tickets, my sister's like, by the way, my wedding's the weekend of the 11th, and I'm like, God damn it.
895000	897000	You need to move your wedding.
897000	906000	That's kind of pretty much what I told her. I was like, it can't be the week before or after. She's like, nope, it's the 11th, and I'm like, well, you suck.
907000	914000	And I'm not gonna lie, I sort of considered it. I was like, do I have to go for the whole weekend for the wedding? Can I just show up that morning?
914000	919000	Well, then does that make it like, be honest, does it make you kind of feel better that you're hearing that New York Comic Con's a little bit of a mess?
919000	922000	Because you're like, oh, since I couldn't go anyway, fuck them.
922000	927000	That, and I hear there's like this whole nonsense with banned weapons, like if it wasn't made out of cardboard.
927000	930000	I saw like garbage pails filled with weapons.
930000	939000	Yeah, I think if it wasn't made out of cardboard or foam, they pretty much, I'm hearing conflicting reports, they either took it from you and threw it out or they took it from you and you got it back at the end of the day.
939000	943000	Either way, that's like, people work hard on that stuff. That's kind of BS.
943000	947000	Yeah, well, I mean, but if that's the policy of the con, you didn't read up on the policy or whatever.
947000	955000	But I also heard that they had like conflicting policies, like their mobile site said one thing regarding weapons and the actual like PC site said something else.
956000	962000	Maybe there's an overreaction too, because I don't know if you've been on Twitter this week or whatever, but people like legitimately went fucking crazy.
962000	964000	People went crazy on Twitter?
964000	965000	I know, right?
965000	970000	But did they have a ball pit? Was there a ball pit? Because that's really the most important part.
970000	977000	Hopefully Rama went. Hopefully Rama, actually, I think John from Critical Myth went, so we might get the ball pit report from John a little later.
977000	979000	I know that Kayla went.
979000	980000	Okay.
980000	983000	So I can ask her. She's actually cosplaying a couple of people.
983000	984000	We have spies.
984000	988000	Yeah, well, I know that the big stink was about them confiscating cosplay props.
988000	992000	Rana might have been too busy with that buff boys van outside of his place.
994000	998000	That's great that none of the listeners are going to know what that is. Let's see.
998000	1001000	Going to our chat room over at live.vognetwork.com.
1001000	1004000	Akdev says people went crazy on the internet? No way.
1004000	1010000	Dungeon Buster says the arsenal of foam freedom. So like nerf weapons were banned too? That would be really sad.
1010000	1012000	No, I think like you could only get through if it was foam.
1012000	1014000	Oh, okay. Well, that's good.
1014000	1015000	Nerf off the place.
1015000	1020000	Nerf weapons are fun. Like, why would you not have a nerf weapon? That's the honest question.
1020000	1024000	They just stuck to the policy. It's nerf or nothing.
1028000	1037000	Amazing. Alright, we're just about ten minutes out from our interview, but we're going to start tonight by going around and finding out for everybody here in studio.
1037000	1041000	How was your gaming week and what types of video games have you been playing this week?
1041000	1046000	Kind of establishing our frame of reference here before we get too far into the show. DarkSakura, start us off.
1046000	1053000	I played Super Smash Brothers because I woke up after Yom Kippur and found that waiting for me and I was like, ooh.
1053000	1061000	So I've got that. I'm trying to remember to finish playing Bravely Default, which I've been sort of, because I've been so busy at work I haven't really had a chance to.
1061000	1072000	Final Fantasy XIV, which I'm chopping down trees and stealing things from them. And today we did the thing. The thing.
1072000	1081000	We broke out the ignition pads to test them with DDR Max. So Dan and I played DDR this morning.
1081000	1085000	Wow. Like legit, like DDR Max on PS2?
1086000	1098000	On our JPS2, which is like, I can't, I'm old, I can't let my drawer out. You better sneak that disc in in five nanoseconds or that's going to go, no, I'm taking it back.
1098000	1106000	Wow. So our PS2 first model still works. Barely. So that's what we've been doing.
1106000	1108000	What made you decide to play that of all things? Was it just like...
1108000	1111000	To make sure our dance pads worked.
1112000	1114000	That's right. You guys have a move coming up.
1114000	1118000	We picked up three ignition pads at the thrift store for six bucks.
1118000	1119000	Really? I want one.
1119000	1123000	Well, one of them was given away. We have two left. I didn't break yours.
1123000	1125000	Why didn't you call me first?
1125000	1132000	You knew I had those because I put it on the internet three years ago. Look what I got at the thrift store by my house.
1132000	1134000	All I'm hearing are excuses. No, I'm kidding. It's fine. It's fine.
1135000	1140000	Let's be real. Me playing DDR is my big butt on the couch with the controller going up, down, left, right, up, up, up, down.
1140000	1147000	Well, you know what? When I clean out the closet, when we start getting rid of parts of the vault, then I'll call you.
1147000	1150000	We actually are going to be packing up the vault coming up this week.
1150000	1153000	I'll help you move, but if games go missing...
1153000	1157000	I'm not looking forward to packing the vault because we're not keeping the shelves.
1157000	1161000	Moving is punishment for murder in some countries. I'm almost positive.
1161000	1167000	I'm going to have to take pictures of the shelves and put them up somewhere before we disassemble the shelves and get rid of them.
1167000	1171000	We're probably going to be getting bins for everything, so we're probably going to go off on tangents and say,
1171000	1174000	Let's see if this game still works. Let's see if this game still works.
1174000	1177000	Oh, this is in the box. We could get $500 for this.
1177000	1180000	You should make a YouTube series out of this. I'm telling you, this is a golden opportunity here.
1182000	1184000	Effort.
1184000	1188000	I know. I know. It's so difficult. Anything else quickly before we move on?
1188000	1190000	I like pie.
1190000	1192000	Ricky, how was your gaming week?
1192000	1195000	I had programming. I didn't play anything.
1195000	1197000	It's still continuing on your programming request.
1197000	1200000	Wait, this is your time between jobs right now, right?
1200000	1205000	Well, not much. I start a week from Monday.
1205000	1207000	Okay.
1207000	1210000	Well, potentially start. It's either a week from Monday or three weeks from Monday.
1210000	1212000	Okay, whatever they decide, yeah.
1213000	1215000	But, I mean, just watching the kids.
1215000	1219000	But, yeah, lots of programming. I've been programming tools to make levels.
1219000	1221000	Nice.
1221000	1226000	I finished that, and I was converting some stuff over to make it work with the new stuff.
1226000	1231000	And I just found the mistake I made, so I had to go back and fix that.
1231000	1234000	But, yeah, that's what I've been working on.
1234000	1238000	I registered a site domain and a Twitter account.
1238000	1242000	Can you unveil the name of your company now, or are we waiting on that?
1242000	1244000	Well, I don't really have a company yet.
1244000	1252000	It's placeholder because in order to file a trademark, you have to have evidence that you're using it.
