start	end	text
5300000	5301000	That's a good company.
5302000	5303000	That sounds like my marriage.
5304000	5305000	No, no, no.
5306000	5317000	Definitely since you can export to Android and stuff, it's obviously something that pleases Google since you can have a lot more content on there.
5318000	5325000	And thank God that they're sane and don't require you to own an Apple to fucking publish to iOS. Thank you, Apple.
5326000	5328000	So, yeah.
5329000	5337000	Alright. Let's move on and talk about a game that I'm sure is going to be sucking down a lot of money because it has the name Final Fantasy in it.
5338000	5340000	So with that reason, people are going to be like, here's my money.
5341000	5345000	This is Final Fantasy Explorers, which is coming out soon in Japan. And this is...
5346000	5347000	Irene might be up your alley. I don't know because it is a 3DS game.
5348000	5350000	Actually, this might be more a Piper's thing if he's a big theater fan.
5351000	5353000	Final Fantasy Explorers, you heard much about this?
5353000	5354000	I have not yet.
5355000	5357000	Not yet? Alright. Final Fantasy Explorers is kind of like Final Fantasy meets Monster Hunter.
5358000	5359000	That's kind of what this is all about.
5360000	5361000	Because you know Monster Hunter is like huge over in Japan, right?
5362000	5365000	So they're making this game and it is coming out in Japan pretty soon.
5366000	5370000	But Final Fantasy Explorers is going to have some things that you don't typically see in 3DS titles.
5371000	5373000	For one of them, it's not going to have full 3D.
5374000	5376000	That's right. You're going to have a 3DS game with no 3D.
5377000	5378000	You can finally play a game on your 2DS.
5379000	5380000	Essentially, yes.
5380000	5384000	Well, now to be fair, I was kind of thinking, I was like, have there been other games that have done this?
5385000	5390000	And actually, yes. Pokemon X and Y had this too, where only the battles were in 3D, I think.
5391000	5393000	And then all the overworld stuff was in 2D, but let's be real.
5394000	5395000	You want to talk about a game that was for the 2DS?
5396000	5398000	That was just a Pokemon system was what that thing was, right?
5399000	5403000	So yeah, Final Fantasy Explorers, not going to feature 3D throughout the whole game.
5404000	5407000	However, it will feature support for, are you ready for this?
5408000	5409000	The Circle Pad Pro.
5410000	5412000	Did anybody pick one of those up when Kid Icarus was all the rage?
5413000	5414000	No.
5415000	5417000	But if you happen to have one, Final Fantasy Explorers will support that.
5418000	5426000	It should also be noted that the new 3DS and the features that are available on that system will also be supported by Final Fantasy Explorers.
5427000	5434000	Because the new 3DS will have that extra stick, so that can control the camera and the extra shoulder buttons will control the lock-on feature.
5435000	5440000	It should also be noted that the new 3DS still hasn't been confirmed for America, so...
5441000	5444000	But they like to wait until the last minute when announcing dates for things.
5445000	5446000	They kind of do, don't they?
5447000	5448000	I would not be surprised if we have that.
5449000	5455000	I mean, considering it's coming out in other places around the world this year, I would not be surprised if we get it this year.
5456000	5458000	You still think of the new 3DS as a possibility for this year?
5459000	5460000	I think maybe December.
5460000	5464000	I'm gonna guess that we'll get it before the end of the fiscal year.
5465000	5469000	I think we'll get it around the time that the next Pokemon game comes out, which is the end of November.
5470000	5471000	Okay.
5472000	5473000	But again...
5474000	5475000	What sells systems? Pokemon!
5476000	5478000	Pokemon could sell a lot of 2DSs too, you know?
5479000	5480000	Well, that's a win-win still.
5481000	5482000	That's true.
5482000	5485000	That's even more of a win for them because, guess what? You bought a 2DS.
5486000	5495000	And now if you really want to get the best bang for your buck to play the newest Pokemon game that'll come out in a year or so, you're gonna need the new 2DS.
5496000	5498000	Or the new 3DS. Or the new, new 3DS.
5499000	5502000	I really hope that they decide to maybe give it another name when it comes out here. I don't know.
5503000	5504000	They won't.
5505000	5510000	Alright, well let's travel back in time to a time when games, like, they weren't 3D.
5510000	5514000	You didn't have 3D games. Well, maybe you had Rad Racer. You didn't have that.
5515000	5521000	But it's time to visit gaming's archive and step into Jamie's vault before she puts the whole thing in a box.
5522000	5523000	Bunch of boxes.
5524000	5530000	And find one game notable of being the classic game of the week. And I noticed, Dark Soccer, your Capcom comes to an end this week.
5531000	5532000	I'd said that last week.
5533000	5534000	Oh, I forgot.
5535000	5537000	Because I have to put in a little bit more gap before I jump to CPS1.
5537000	5542000	Alright. So, uh, we're visiting something else this week, Dark Soccer. What is the classic game of the week?
5543000	5546000	Get Bass! Also known as Sega Bass Fishing.
5547000	5549000	Um, yeah. I picked it.
5550000	5556000	Basically, um, this was an arcade fishing game. It came out in 1997, um, for the Sega Model 3.
5557000	5564000	And it has been since ported to the Dreamcast, uh, it's on Windows, Xbox 360, PS3, and the Wii.
5564000	5571000	And this game was notable for coming with a special controller that you used as a fishing rod.
5572000	5576000	Um, I will be talking more about that later because it was awesome.
5577000	5579000	So basically, you just fish. That's all you do.
5580000	5584000	You, uh, you have to hook and reel and fish. You use different kinds of lures.
5585000	5590000	Uh, there's different stages of fishing, so you can actually get different kinds of fish based on what time you fish.
5591000	5592000	It's a big fishing sim.
5592000	5599000	And the thing is, I don't know how Sega did it, but they made it fun and not completely boring, like real fishing.
5600000	5607000	Um, especially when you would catch the fish and it would say, Fish Get! Well, on the Japanese version, anyway.
5608000	5616000	And then the person would go, Fish! So it's just such full of, uh, rather, uh, cornball stuff just from that era of Sega games.
5616000	5625000	Because you know what also else came out like soon after that was like Brave Firefighters and Jumbo Safari was out and all of those kind of weird games.
5626000	5632000	But, I don't even know why this game was so fun, but I don't really know many people who don't like this game.
5633000	5639000	It even had a sequel, which was Sega Bass Fishing Duel, which came out on PS2. It was a, uh, multiplayer.
5640000	5644000	And then there was a Rails crossover that was called Sega Bass Fishing of the Dead.
5645000	5652000	It was reported in 2012, but it was an April Fools joke. That would have, I would have absolutely bought it though.
5653000	5655000	And then of course we also after that had Sega Marine Fishing.
5656000	5661000	Now I will, this is why I picked this game. This is the game that gave us the fishing rod controller.
5662000	5664000	This is the game that created Rodcalibur.
5665000	5668000	I don't know if I've, I've probably told everybody what Rodcalibur is, I'll say it again.
5669000	5671000	About a thousand times on this show is Rodcalibur.
5671000	5675000	This is playing Soulcalibur on Dreamcast with the fishing rod.
5676000	5681000	You can swing the thing around like you're sword fighting and actually beat the game with the fishing controller.
5682000	5684000	Can you be, can you nunchuck me? Can you be Maxie?
5685000	5688000	I, actually I did beat it with Maxie, the first person I played with.
5689000	5691000	And then I also did beat it with Sophotia.
5692000	5697000	And, um, actually Waldo is remarkably good with the, uh, rod controller.
5698000	5700000	And all you do is swing it around like you're flailing to death.
5701000	5702000	And that's Rodcalibur.
5703000	5704000	The analog of button mashing.
5705000	5708000	Yes. I tried doing, um, DDR caliber once, that didn't work.
5709000	5715000	Uh, however, that's how I learned that my Dreamcast dance pads, that my, uh, corner buttons were analog.
5716000	5717000	Oh.
5718000	5719000	Sorry, I just...
5720000	5723000	I wanted that as, as, uh, my text tone for the longest time.
5724000	5728000	Would it have been wrong if in this game you could catch Echo the Dolphin?
5729000	5730000	Or what's that Seaman looking guy?
5731000	5734000	That's for, that's for Sega, that's for Sega poaching fishing.
5735000	5737000	That's for Sega deep sea poaching.
5738000	5740000	Are we sure this isn't bass fishing?
5743000	5744000	It was actually funny.
5745000	5747000	When I started, I looked up Get Bass first.
5748000	5751000	And, um, it actually was like nothing but bass playing videos.
5752000	5753000	Oh.
5754000	5756000	So then I had to put Sega Get Bass and then that's when I found it.
5756000	5759000	Get Bass, Get Bass and it's all Geddy Lee and...
5760000	5761000	Bootsy.
5762000	5763000	Bootsy.
5764000	5765000	I ain't Bootsy.
5766000	5768000	No, I found like two, two of the first videos out there were like Bootsy Collins.
5769000	5770000	So it was pretty cool.
5771000	5772000	It's because of parliament rules overall.
5773000	5774000	Yes.
5775000	5776000	I think, I'm looking at this and I think I still prefer Ocarina of Time.
5777000	5778000	I would, I would rather play that than this.
5779000	5783000	Well, you know, uh, we've been doing Classic Game of the Week since what, episode number 250?
5783000	5785000	So there's been about 300 classic games.
5786000	5787000	Pretty sure Ocarina of Time's been done.
5788000	5789000	So we're starting to, uh, you know, dig a little deeper.
5790000	5791000	These are the deep cuts.
5792000	5793000	These are the deep cuts.
5794000	5795000	Well, but...
5796000	5800000	As much as I've talked about Rod Caliber, I had to bring up the origins of Rod Caliber.
5801000	5803000	And this game is actually super fun if you're really drunk.
5804000	5806000	I still see shit like this in the arcade all the time.
5807000	5808000	And phish.
5809000	5811000	Rod Caliber is also an awesome porn star name.
5811000	5813000	I was going to say it sounds like a detective.
5814000	5816000	Like somebody you'd find on Matlock calling Rod Caliber.
5817000	5819000	What kind of Matlock are you watching?
5820000	5824000	That's on the, that's on the channels where you have to watch through the third party version of the show.
5825000	5827000	When we make Pixel shit it'll be starring Rod Caliber.
5828000	5829000	TV Land After Dark.
5830000	5831000	Is your PSP modded to play Rod Caliber?
5832000	5833000	Of course.
5834000	5836000	I'm going to get, uh, Bodhi to make Rod Caliber the game.
5837000	5838000	Very similar to Aseturf.
5839000	5840000	If you don't play, Rod Caliber plays you.
5841000	5845000	Alright, there it is. Your classic game of the week.
5846000	5847000	Sega Bass Fishing.
5848000	5849000	Phish!
5850000	5851000	Phish!
5852000	5853000	Alright, with that super bass.
5854000	5855000	I just, now I hear Nicki Minaj in my head.
5856000	5857000	Look at what you did.
5858000	5859000	I'm sorry.
5860000	5861000	Thank you.
5862000	5863000	Hey, but she's a great feminist icon.
5864000	5865000	Yeah, look at that booty.
5866000	5867000	Well, you know what?
5868000	5869000	My anaconda don't.
5869000	5870000	We're going to take a break.
5871000	5873000	And when we come back, who knows what song I'll burst into next.
5874000	5875000	We've got some rapid fire news as well.
5876000	5881000	The Fugu Question of the Week, Mailbag, FUs of the Week, your calls and so much more with our live studio audience here.
5882000	5886000	As we get into more of Orange Lounge Radio right after this quick break.
5887000	5888000	Don't go anywhere guys.
5888000	5902000	Welcome back everybody to Orange Lounge Radio, live with the 571st episode of our show for this October the 12th, 2014, already in progress.
5903000	5904000	We've had such a busy show so far tonight.
5905000	5907000	We're joined by our dear old friend of Orange Lounge Radio.
5908000	5911000	I'm not actually calling you old Princess Irene, but you know, the show is pretty old.
5912000	5915000	But from the Multitap podcast now.
5916000	5917000	And when do you guys put out new episodes?
5918000	5919000	Like when do you tape your shows and when do they go out?
5920000	5921000	I'm going to give that to Piper.
5922000	5924000	Piper's here from the same show.
5925000	5930000	Shoot. We usually record Sundays. We're never live though. That's not interactive.
5931000	5932000	So I think we try to put out Mondays.
5933000	5934000	Alright, cool. A lot of shows do Sundays.
5935000	5936000	So yeah, I know a lot of people.
5937000	5940000	There's a lot of people that I know that do their shows that are like, we listen to OLR, but we're taping then.
5941000	5942000	So I know how it goes.
5943000	5944000	As long as you put out.
5945000	5947000	That's fine. That's why we have the podcast so people can listen in all sorts of different ways.
5948000	5949000	It's a week so the marriage doesn't die.
5950000	5954000	And of course, JV Monn from New York City all the way to the other coast joining us here as well.
5955000	5957000	When's your show put out? Once a month. What do we do?
5958000	5960000	Every month or two. It's on iTunes, just Super Euro Power Hour.
5961000	5964000	Alright. So you're not going to tell us when the next episode's coming out? Just hurry up and wait?
5965000	5971000	I'm trying to get one out this week. Well, I'm trying to get one out this week because a friend of mine who's an indie Eurobeat producer lives in San Jose.
5972000	5973000	So it's just a quick drive.
5973000	5980000	And he's, for Super Eurobeat, he's known as Ken Blast, but if you're a My Little Pony fan and a Eurobeat fan, he goes by Eurobeat Brony.
5981000	5982000	Okay.
5983000	5986000	So if you type in like Eurobeat and the letter B, that's like the first thing you get on YouTube.
5987000	5988000	Alright.
5989000	5990000	He gets like 2 million plus views on each video.
5991000	5992000	Nice. Can we get a shout out?
5993000	5994000	He's doing something well.
5995000	6001000	So hey, since we had such a busy beginning of the show and if you didn't hear the first half, if you're just joining us now live on this Sunday evening,
6001000	6007000	definitely check out the podcast at some point. We had a great interview with Bodie Lee from Lunar Ray Games, talking about Time Spinner earlier on in the show.
6008000	6012000	That was awesome. In fact, it was so busy, I forgot housekeeping and a very important note.
6013000	6017000	And I mentioned this in a previous week, so just to make sure you guys know, we will not be here next week.
6018000	6020000	There will be no live OLR next week.
6021000	6024000	I might try to throw together like a best of or something for the podcast, but I really can't promise that.
6025000	6026000	It just depends on how much time I have during the week.
6026000	6033000	So sadly, I know a lot of you guys rely on OLR to get through your Monday and so forth. I'm very sorry we won't be here.
6034000	6045000	I will actually be in Las Vegas. I'm going to Final Fantasy Fan Fest this weekend, which is celebrating Final Fantasy XIV, which as you know is the MMO I kind of got addicted to ever since I left World of Warcraft.
6046000	6047000	Are you cosplaying?
6048000	6050000	No, probably not, because I don't have time to throw something together.
6051000	6052000	I can loan you my Homestuck cosplay.
6053000	6054000	Why would I dress in Homestuck?
6054000	6056000	I'm sure you'd make a great game.
6057000	6066000	Here's the thing. I want to do Hildebrand, which if you play Final Fantasy XIV is a hilarious character. He's all the funny quests.
6067000	6069000	But then I'm thinking like half the dudes will be cosplaying Hildebrand.
6070000	6071000	So you'd be his dad.
6072000	6080000	At first I thought you were making an age joke, but then I was like actually Hildebrand's dad is in one of the questlines. He's even like twice the awesome.
6081000	6082000	He doesn't wear pants either.
6082000	6089000	I have to tell you, you just wear the black hot pants. I have to tell you that the Hildebrand quest annoys me.
6090000	6091000	I don't think they're funny.
6092000	6093000	Really?
6094000	6095000	Stupid does not equate funny to me.
6096000	6097000	They're stupid funny to me. It's like Dumb and Dumber.
6098000	6103000	Yeah, and I tried to sit through one of those and left the theater when someone else paid.
6104000	6105000	You want to go see a sequel?
6106000	6110000	No. I feel bile rising up in my throat at the preview.
6110000	6116000	I love Jim Carrey. I will see anything Jim Carrey is in, and that's why I'm so mad that Kick-Ass 2 is still not on Netflix.
6117000	6122000	I was forced to watch The Explorers, and I really wish I hadn't.
6123000	6131000	I was going to tell you, I've had this idea for a long time of doing Final Fantasy XIV cosplay, but doing like low level craft cosplay.
6132000	6138000	As in just wearing like the stuff that, you know, because people do the real big elaborate ones, but you never have people just being the everyday people.
6138000	6144000	I really like the way the Gridania guards look. I think if I was going to cosplay something, I really like their masks and their armor and everything.
6145000	6146000	So you should do that. Be an NPC.
6147000	6148000	Okay, can I throw it together in four days before I leave?
6149000	6150000	I was just trying to say, all green clothing and bad posture?
6151000	6152000	Cactuar.
6153000	6154000	There you go.
6155000	6161000	Just get a green Snuggie and then sew it up in the back. You could do that. That wouldn't be too hard.
6162000	6163000	Oh my god, laziest cosplay ever.
6164000	6165000	A Cactuar?
6165000	6166000	That would be that bad.
6167000	6170000	You know, I'm not going alone. I'm going with Shane. What do you think you could convince him to cosplay as?
6171000	6174000	A Chocobo. Put a feather on his head.
6175000	6177000	If he's out there listening, he's going to be like, no.
6178000	6179000	Just carry a lantern around. You could be a lazy Tonberry.
6180000	6181000	Lazy Tonberry, yeah. There you go.
6182000	6187000	That actually, you know what? You know what? You know what? I could probably do a Tonberry head in a night.
6188000	6189000	Alright, we'll see. We'll see. I don't know.
6190000	6191000	We'll talk about it.
6192000	6198000	Unfortunately, if you want to get into, you know, wherever you're going, you kind of have to walk back and forth very slowly.
6199000	6200000	It's going to take you a while to get to where you're going.
6201000	6202000	I'll be Tonberry on Red Bull.
6203000	6213000	Anyhow, so we will be not here next week, but what a great time for you to sample other indie podcasts because there's lots of hardworking indie podcasters out there creating great content.
6214000	6215000	So our friends at Multitap, this is your week.
6216000	6217000	You could listen to us.
6218000	6220000	That's right. Listen to you guys. There you go. Are you going to get them for three hours?
6221000	6225000	Depending. We've done two-parters, so those end up close to four hours.
6226000	6227000	You could listen to two episodes.
6228000	6229000	Two episodes, and we release them in part the first and part the second.
6230000	6231000	Awesome.
6232000	6237000	Sounds like a plan. Sounds like a plan. So, yeah, we won't be here next week, but I will be back with all the details from Final Fantasy Fan Fest.
6238000	6245000	I'll try and get an interview. If I can get my butt up there and interview the developers, that would be fantastic. We'll see what happens.
6246000	6248000	So, there you go. That is why we will not be here next week.
6248000	6253000	But we are here this week, so we're trying to continue putting on a kick-butt show for you guys.
6254000	6256000	So let's get to it. Some rapid-fire news. Loki.
6257000	6261000	So, I just don't understand Nintendo sometimes, or actually most of the times.
6262000	6274000	But apparently, and I'm thinking that this is a little bit sensationalized, but apparently the GameCube adapter that they're putting out for Super Smash Bros. on Wii U only works with Super Smash Bros. on Wii U.
6274000	6290000	It will not work with existing Wii and Virtual Console games. Also, I don't know if it's going to allow you to use some in place of the Classic Controller or something.
6291000	6297000	I guess that was the thought, but now it's not. It's only going to be used for Smash Bros.
6298000	6305000	But I think it's only going to be used for Smash Bros. right now. I think later on they could come out with things that support it.
6306000	6313000	But I don't think they're going to release it only for Smash Bros. and say, ah, well, that's it. That's the last thing we're going to use it on.
6314000	6319000	I just can't see that. Maybe later on in a system update it will come out with support for it, but yeah, right now it's not.
6320000	6324000	I really think it should have been out of the gate, because you're really limiting your audience.
6325000	6334000	This is proprietary to our system, and then only proprietary to this game. That would be a waste, I think.
6335000	6346000	I think it would not be that difficult, because they had GameCube support for Virtual Console before, and all it's doing now is running through a stupid adapter that's converting it to USB.
6346000	6355000	How fucking hard can that be to get that to work? To shoehorn that in? I can't imagine it would be that hard. Just fucking map it to classic controller stuff.
6356000	6364000	I still feel like at some point we're inevitably going to get Virtual Console GameCube games, and this would be a very logical thing to use with it.
6364000	6373000	They're so backwards. It's just like, hey, it's not like a surprise that we're going to release this. You knew this for quite a long time.
6374000	6384000	You think you could have put one developer on shoehorning this into Virtual Console or for use with other games? I wouldn't have thought that would have been too difficult for you, but apparently it is.
6385000	6397000	Since clearly I'm never going to get a new F-Zero, because they're going to tease me by putting Mute City in Mario Kart or whatever the fuck they're doing, I can at least get F-Zero GX on Virtual Console would be nice.
6398000	6409000	And with that, of course, the rumored date of November 21st ended up being the release date for Super Smash Bros. in North America. Europe is getting it December 5th.
6410000	6413000	And, of course, the Amiibo characters will be coming out.
6414000	6419000	What do they do? We know they're coming, but why should I buy them?
6420000	6428000	They're literally AI characters that you can level up and that's it. It's fucking useless.
6429000	6436000	Cool. You know what? I have no qualms against getting some of those because they look cool and put them on your shelf and stuff, but as far as functionality goes, it's fucking stupid.
6437000	6441000	So, in other words, Amiibo is really more there for the figure collecting.
6442000	6446000	Yeah, it's figure collecting, but apparently later on you're going to be able to use it with Mario Kart and shit like that.
6447000	6457000	You know what it's for. It's just because they needed some shit to sell this stuff right now, and then later on when the new 3DS comes out with the fucking near-field communication shit, then it's going to drop.
6458000	6466000	Boom! New fucking Pokmon. Boom! Oh, look! Amiibo characters for every fucking Pokmon, and you know you're going to be buying every single one of those for $13 each.
6467000	6471000	Cha-ching! We're printing money again. That's where they're going to make their money. Fuck it. Who cares if the Wii U sucks?
6472000	6479000	You know what? We're making tons of money off these fucking toys. That is where they're going to go because it works for Activision and their goddamn Skylanders franchise.
6480000	6483000	Alright, calm down. We haven't calmed down until that press release comes out.
6484000	6489000	It's going to happen. Same with Nintendo DS and 3DS titles on the Wii U.
6490000	6492000	You know, if they can put Pikachu's face on it, they'll do it.
6493000	6495000	Yeah, Pikachu already. Pikachu's going to be one of those characters.
6496000	6506000	Alright, anyways, to go along with that, there was a little bit of speculation when Captain Toad's Treasure Tracker was coming out, and I remember saying that I don't fucking care when it comes out, but if you do care, it's coming out December 5th.
6507000	6508000	I care.
6508000	6514000	And it's going to be priced for $40, which, you know what? That's $20 too expensive, so just wait for the bargain.
6515000	6517000	But, Loki? Toadette's in it.
6518000	6522000	Oh, well I'm sorry. I guess that totally justifies the $40 price point then.
6523000	6524000	Now I don't care.
6525000	6527000	I was totally teasing. I hate Toadette. I really do.
6528000	6529000	I think it's whatever.
6530000	6532000	It's a totally irrational hatred. I can't explain it.
6533000	6535000	She's like one of those useless friend characters from Sonic.
6535000	6547000	Exactly. Toadette reminds me of one of Sonic's shitty friends. Like, she's in the wrong franchise. And I'm sorry if you're a Toadette fan, but I think, like, Double Dash just really left a bad taste in the beginning.
6548000	6552000	Toadette is just, it's all part of the same thing that they're doing with, like, even, like, Smash Bros.
6553000	6554000	Hold on, because Piper, it looks like I hurt Piper's feelings.
