start	end	text
1128000	1131000	But, you know, this is the way I would see them doing it
1131000	1136000	Stick to what you know, you know, like Final Fantasy X was okay
1136000	1137000	And XII was okay
1137000	1140000	But just, you know, that same type of thing
1140000	1143000	You don't need to go all full 3D where you can adjust the camera and stuff
1143000	1144000	Yeah, I know
1144000	1146000	XII's cool, though
1146000	1148000	But I'm excited to see what they do for XIII
1148000	1150000	But the battle system in Eternal Sonata is pretty awesome
1150000	1153000	Because it's like, you know, you're on a live playing field
1153000	1156000	And you run around, like, a la Kingdom Hearts
1156000	1157000	You have, like, five seconds
1157000	1160000	Yeah, but you have five seconds from the second you touch the controller to move
1160000	1161000	And you make all your moves
1161000	1162000	And I thought it was just pretty cool
1162000	1164000	Jamie, you really should check this game out, Eternal Sonata
1164000	1166000	You have to have a Japanese account to download the demo
1166000	1168000	Or you should just come over here and play it or something
1168000	1169000	It's great
1169000	1170000	It's like a Japanese RPG
1170000	1171000	Okay
1171000	1172000	But on the 360
1172000	1173000	So it's really nice looking
1173000	1174000	I thought the graphics were great, too
1174000	1176000	And the weirdest thing about the Japanese demo
1176000	1178000	Is it wasn't the Japanese demo
1178000	1179000	It was the US demo
1179000	1181000	Because it's Eternal Sonata
1181000	1182000	It's Trusty Bell over there
1182000	1183000	And it's all in English
1183000	1184000	I'm not complaining
1184000	1186000	So I don't understand why they put it over there
1186000	1188000	But the other thing I played, of course
1188000	1190000	I totally hopped on your account and grabbed it
1190000	1191000	Good, because that's
1191000	1192000	Yeah, yeah
1192000	1194000	Love that update, Microsoft
1194000	1197000	Really blocked those other accounts out there
1197000	1198000	Well, anyways
1198000	1201000	But I did get to play some more Super Paper Mario
1201000	1202000	I'm almost finished with it now
1202000	1203000	But it's fun
1203000	1205000	Still liking it
1205000	1208000	I also finally picked up Catan
1208000	1210000	The Xbox Live Arcade game
1210000	1211000	Wasn't feeling it
1211000	1215000	I mean, like, I'm very happy these types of games are coming to Xbox Live Arcade
1215000	1218000	But this particular one, I just couldn't get into
1218000	1219000	They need risks
1219000	1221000	Yeah, I want something I'm a little more familiar with
1221000	1223000	Monopoly, Risk, Clue
1223000	1225000	Oh my god, Monopoly with pillars
1225000	1228000	I understand this game is huge among strategy circles
1228000	1231000	And I'm probably getting angry emails from some British listeners right now
1231000	1232000	Where the game is big
1232000	1234000	But, you know, I just
1234000	1238000	I wasn't all into, like, the trade, barter, that kind of thing
1238000	1239000	Although I guess Monopoly is kind of like that, too
1239000	1240000	But I don't know, it's different
1240000	1241000	Trust me
1241000	1242000	I guess maybe I was just disappointed
1242000	1243000	Because somebody told me
1243000	1244000	Oh, you should play Catan
1244000	1246000	It's like Civilization
1246000	1247000	It's nothing like Civilization
1247000	1249000	To be honest, Civilization is incredible
1249000	1250000	What was I going to say?
1250000	1252000	Eternal Sonata actually looks better than Blue Dragon
1252000	1254000	You know, sadly enough
1254000	1255000	And then really quickly
1255000	1256000	Because I know we want to get into some gaming news
1256000	1257000	I won't take up the whole time here
1257000	1260000	But I downloaded some retro classics
1260000	1261000	I downloaded Double Dragon
1261000	1262000	I downloaded Centipede
1262000	1263000	I actually paid for them
1263000	1265000	I don't know why I keep dumping all this money into them
1265000	1266000	I mean, the remakes aren't bad
1266000	1268000	But it's just, you know, I play them once
1268000	1269000	And I hardly ever play them again
1269000	1272000	So I really need to just play the demo and be happy with that
1272000	1275000	But I do like the high def graphics on Double Dragon
1275000	1278000	And it was somebody other than Digital Eclipse porting it
1278000	1279000	So I was excited
1279000	1280000	I laughed at that
1280000	1281000	You didn't like it?
1281000	1283000	It just didn't seem...
1283000	1284000	I mean, it was okay
1284000	1285000	It was kind of cool
1285000	1287000	It just didn't quite seem right
1287000	1289000	Yeah, it is a little weird at first
1289000	1291000	Like, I don't know if you played the Centipede one
1291000	1293000	But they really changed that one
1293000	1295000	They totally made that, like, HD
1295000	1297000	They didn't just, like, I don't know
1297000	1299000	Put the old school graphics in 720p
1299000	1302000	They kind of redid the graphics there
1302000	1303000	It's kind of interesting
1303000	1304000	But I don't know
1304000	1306000	I'm a sucker for classics and all the retro stuff
1306000	1307000	So what can I say
1307000	1310000	And that's why I actually kind of enjoyed Aegiswing
1310000	1311000	I guess, I don't know how to pronounce it
1311000	1312000	Aegiswing I think is what it is
1312000	1313000	Aegis, yeah
1313000	1314000	Aegis
1314000	1315000	It's free
1315000	1317000	The multiplayer stuff is cool
1317000	1318000	It's a good old
1318000	1321000	It's just like a Gradius type shooter
1321000	1323000	It's like a throwback to 8-bit shooters
1323000	1325000	I thought it was gonna be more frantic though
1325000	1328000	Like, more, you know, crazy Japanese shooter
1328000	1330000	Like Ikaruga or something
1330000	1331000	But that's okay
1331000	1332000	I mean, I like, you know, I can't complain
1332000	1333000	It's free
1333000	1335000	I would put it on par with Heavy Weapon, honestly
1335000	1336000	And I paid 10 bucks for that one
1336000	1337000	Yeah
1337000	1338000	I thought Aegiswing was pretty fun
1338000	1339000	Stupid Heavy Weapon
1339000	1340000	I liked Heavy Weapon
1340000	1341000	It wasn't bad
1341000	1342000	It was certainly one of the better
1342000	1344000	Probably the best PopCap game on Xbox right now
1344000	1345000	Is Heavy Weapon
1345000	1346000	Anyway
1346000	1347000	So that's it
1347000	1348000	I'll shut up about my gaming week now
1348000	1351000	Let's talk about some housekeeping
1351000	1353000	No live show next Sunday
1353000	1354000	This is important
1354000	1355000	Sorry live listeners
1355000	1356000	We love you guys
1356000	1358000	But there will be no live show Memorial Day weekend
1358000	1360000	That's Sunday, May 27th
1360000	1363000	Because we will be taping that week's show
1363000	1365000	Live at FanaMe
1365000	1366000	We're gonna be at FanaMe
1366000	1368000	And we'll be there taping our show live
1368000	1370000	On Saturday, the 26th
1370000	1372000	That's May 26th
1372000	1373000	We'll be there
1373000	1375000	I don't know what panel room it is yet though
1375000	1376000	I missed that little detail
1376000	1377000	Zero
1377000	1378000	Or whatever
1378000	1379000	Not on stage zero
1379000	1380000	Not on stage zero
1380000	1381000	We report to stage zero
1381000	1382000	To find out where we're gonna be
1382000	1383000	Yeah
1383000	1384000	So we're gonna be somewhere
1384000	1385000	Look in your programs
1385000	1386000	We're gonna be there two o'clock
1386000	1387000	Probably
1387000	1388000	I wouldn't see why they wouldn't
1388000	1390000	Last year there was like a big room and two small rooms
1390000	1391000	And we were in the big room
1391000	1392000	So I don't know why we wouldn't be in the big room again
1392000	1393000	I hope
1393000	1394000	We'll see
1394000	1397000	If not we'll just have to fill all the butts in the seats in the little room
1397000	1398000	It'll be fun
1398000	1401000	So it'll be 2 p.m. on Saturday at FanaMe in San Jose
1401000	1404000	Hopefully we'll be at the same time as the Masquerade
1404000	1405000	No
1405000	1407000	We got a better time this year I think
1407000	1409000	Because last year we were like the same time as the Masquerade
1409000	1411000	And that really screwed our attendance numbers
1411000	1412000	We had only a handful of people
1412000	1414000	We love those of you that came and showed up anyway
1414000	1415000	Even though we were at the same time as that
1415000	1416000	But this year we're like at two o'clock
1416000	1418000	And I don't think there's a whole lot going on then
1418000	1421000	It's like right during the high traffic point of the day
1421000	1422000	So I'm really excited
1422000	1423000	I think we got a good time
1423000	1424000	I'm excited to talk video games
1424000	1426000	We're gonna do Ask Orange Lounge live
1426000	1428000	We have a lot to cram in an hour
1428000	1430000	So we're gonna do that 2 p.m. on Saturday
1430000	1432000	F-A-N-I-M-E dot com
1432000	1435000	If you want more information if you'll be in the San Jose area
1435000	1437000	So again that means no live show Sunday
1437000	1439000	If you do happen to be here Sunday night
1439000	1442000	You will hear the premiere of that episode
1442000	1444000	We will have that edited and ready to play
1444000	1446000	At our usual 6 p.m. time on Sunday
1446000	1447000	So that'll be your first chance to hear it
1447000	1450000	Just won't have that live interaction element with the chat room
1450000	1452000	Instead it's live in person
1452000	1453000	So that was fun last year
1453000	1454000	I'm looking forward to that this year
1454000	1455000	It'll be amazing
1455000	1457000	Are you cosplaying this year, yes?
1457000	1459000	If I can get my costume sewn this week
1459000	1461000	I wanted to do Balthier so bad
1461000	1463000	But it's just too complicated a costume
1463000	1464000	I can't do it in time
1464000	1465000	Don't buy any sort of 3D
1465000	1466000	Yeah, so
1466000	1467000	I don't know
1467000	1468000	Maybe I'll
1468000	1469000	I think maybe I'll just wear a shirt
1469000	1471000	That says this is my cosplay or something
1471000	1472000	Does that sound like a good idea?
1472000	1473000	You're not going to cosplay either, right?
1473000	1475000	No, I am not cosplaying
1475000	1477000	Alright, so yeah, no show Sunday
1477000	1479000	So we'll be back here live
1479000	1481000	Though I believe the date is June 3rd
1481000	1482000	We'll be here live
1482000	1484000	And that's that
1484000	1487000	So let's go into some gaming news
1487000	1489000	Roll that beautiful bean footage
1489000	1494000	Of course the big, big, big, big, big, big news this weekend
1494000	1496000	Is that Starcraft 2 was officially announced
1496000	1500000	Blizzard officially rolled out the teaser trailer
1500000	1502000	For Starcraft 2 in Seoul, South Korea
1502000	1504000	And of course Korea is a huge
1504000	1507000	I mean just a huge place where
1507000	1509000	Starcraft is still popular
1509000	1511000	It's been 10 years since the original game if you can believe it
1511000	1514000	And of course there was much speculation leading up to this
1514000	1517000	And Starcraft 2 was one of the things people speculated they would announce
1517000	1520000	People thought it was going to be World of Starcraft
1520000	1523000	Diablo 3, a new IP, or this
1523000	1524000	So you know
1524000	1526000	It was never going to be World of Starcraft
1526000	1527000	Oh, why is that?
1527000	1529000	They're not going to compete with themselves
1529000	1531000	Not going to compete with themselves
1531000	1533000	But then again, Starcraft 2 is going to be online
1533000	1534000	We know this, right?
1534000	1535000	Both, so
1535000	1539000	Comprehensive website set up at starcraft2.com
1539000	1542000	You can look at some of the clip art from the game
1542000	1544000	And some of the stages in action
1544000	1546000	You can look at the teaser trailer
1546000	1548000	Which you know, doesn't really show a lot of the game in action
1548000	1551000	But they do have on the site, they have another trailer that you can look at
1551000	1553000	Which does have some of the in-game footage
1553000	1556000	No word yet when the game will be released
1556000	1558000	It is going to be a PC release
1558000	1560000	They are not touching the console releases
1560000	1564000	Their FAQs kind of made it very vague if they would ever go to consoles
1564000	1566000	But just kind of knowing Blizzard's history
1566000	1568000	They probably won't, at least for a long time
1568000	1572000	So Starcraft 2 coming to PC soon-ish
1572000	1574000	Because they haven't said when
1574000	1576000	It could be Christmas, it could be next year
1576000	1578000	Soon is the ultimate answer
1578000	1580000	I would say next summer would be my bet
1580000	1582000	I would say like next April
1582000	1585000	The game looks very complete-ish though
1585000	1587000	And they had demos and stuff going
1587000	1588000	Christmas seems a little soon though
1588000	1590000	Especially when you consider all these games have been getting delayed lately
1590000	1592000	Like Spore and stuff
1592000	1593000	I don't know
1593000	1595000	Well Spore is pretty massive as far as what's involved with that
1595000	1597000	True
1597000	1599000	I don't know
1599000	1601000	Sooner or better
1601000	1603000	Let's see, Nm64 in our chat room says
1603000	1605000	Starcraft 2 will come out when it's done
1605000	1607000	GS68 follows up with Starcraft forever
1607000	1609000	Jvmon says
1609000	1611000	Starcraft 2 gets released
1611000	1614000	Thousands of babies die inside hot cars in South Korea
1614000	1616000	That's sad
1616000	1618000	Chainsaw Juggling says
1618000	1621000	I think Starcraft 2 is being funded by North Korea
1621000	1624000	So they can invade South Korea because everyone will be playing the game
1624000	1627000	I'd like to know what our Korean listeners think about that comment
1627000	1630000	You can address those cards and letters to Chainsaw Juggling
1630000	1632000	On behalf of Mailbag at OrangeLaunchRadio.com
1632000	1635000	Starcraft 2, you guys excited? I don't know if you guys play these types of games
1635000	1638000	No, absolutely not because I really don't care
1638000	1640000	You don't play RTSs at all?
1640000	1641000	I don't play Starcraft
1641000	1642000	You know what's weird?
1642000	1644000	Starcraft is the one Blizzard game I've never played
1644000	1646000	I played World of Warcraft a lot, but I never
1646000	1648000	I kind of avoided Starcraft
1648000	1650000	I know, I lose total gamer cred in saying that, don't I?
1650000	1653000	But face it, guys, there's only so many hours in the day to play games
1653000	1656000	But I'll check it out, certainly, for nothing else
1656000	1659000	And the fact that my current boyfriend's addicted to Starcraft
1659000	1661000	And I'll probably have to play it for his sake
1661000	1663000	I suppose Dan's probably gonna play it, so
1663000	1665000	Yeah, so we'll probably see it that way
1665000	1667000	It looks just like Command & Conquer, Tiberium Wars
1667000	1669000	I'm like
1669000	1671000	There's not really much you can do with the RTS
1671000	1674000	I mean, great, it'll have the Starcraft characters
1674000	1678000	And races and units and whatnot
1678000	1680000	Yeah, it is the same three races from the original Starcraft
1680000	1682000	Protos, Zerg, and Terrans
1682000	1684000	So, I mean, it'll be cool
1684000	1686000	I mean, it's great, it needs an update
1686000	1688000	It's been a while, so
1688000	1691000	I don't know, really, how much more excited could you have been
1691000	1693000	From Warcraft 1 to Warcraft 2?
1693000	1696000	I mean, it's like, eh, it's new stuff
1696000	1698000	Who's kind of the same game?
1698000	1700000	Kind of, yeah, exactly
1700000	1703000	But Warcraft 2 to Warcraft 3 was a huge change
1703000	1705000	That was a huge change
1705000	1707000	I don't know
1707000	1709000	Alright, forget it, forget it
1709000	1711000	Whatever, anyways
1711000	1714000	Now, coming, GameTap is really becoming
1714000	1716000	You know, the central
1716000	1718000	For, like, anything that's
1718000	1720000	You know, episodic
1720000	1722000	Or, you know, a bunch of
1722000	1724000	They're actually using it now to launch a bunch of new games
1724000	1727000	Including a new series from American McGee
1727000	1729000	Which, I don't know if you can be excited about it
1729000	1731000	He had a hit with, you know, Alice
1731000	1734000	Had a flop with Bad Day LA
1734000	1736000	As sad as I'd like to say that
1736000	1739000	But he is going to be coming out with a brand new
1739000	1742000	24-part episodic series
1742000	1744000	That's going to be Grimm
1744000	1746000	And it's based off the Grimm fairy tales
1746000	1747000	That sounds cool
1747000	1749000	In fact, they had some little artwork
1749000	1751000	Showing Pinocchio, so that's kind of neat
1751000	1753000	Is Hansel and Gretel in it?
1753000	1755000	Because I still want to push the witch in the oven
1755000	1758000	I'm sure it will be, but they didn't really specify
1758000	1761000	What series, you know, what stories are going to be in there
1761000	1763000	But, of course, they're all going to be kind of dark
1763000	1765000	And, you know, very Alice-like
1765000	1768000	And it says it's supposed to start in 2008
1768000	1771000	So, that's kind of neat
1771000	1773000	GameTap's becoming pretty awesome
1773000	1776000	I mean, it's already been, like, a pretty good service
1776000	1778000	And I know, God, you must think I'm on their payroll at this point
1778000	1781000	But I do think it's a really great deal
1781000	1783000	They're a good service
1783000	1785000	If something's quality, why not tell everyone, right?
1785000	1786000	Exactly
1786000	1788000	This type of stuff's only enhancing it
1788000	1790000	And I guess people are so resistant
1790000	1792000	Because they feel like they're paying for emulators
1792000	1794000	But, you know, these guys know what they're doing
1794000	1796000	They're really putting their all into it
1796000	1798000	So, a lot of folks probably would have given up by now
1798000	1799000	I like them
1799000	1800000	Well
1800000	1802000	Let's hope the game doesn't suck
1802000	1804000	Well, in some news of other things that don't suck
1804000	1807000	Since we've been on the Blizzard tangent for a little while
1807000	1812000	On the patch 2.1.0 for World of Warcraft
1812000	1815000	We will be getting Black Temple as an instance
1815000	1817000	For anyone who doesn't know
1817000	1820000	It was involved in the Outlands
1820000	1822000	Which was a zone that was added for Burning Crusade
1822000	1826000	So, you're gonna have to have, like, a huge ol' massive, you know, raid party
1826000	1828000	To be able to do it
1828000	1830000	But, there you go
1830000	1834000	There's also tweaking the
1834000	1838000	Some of the newer stuff in the Burning Crusade expansion
1838000	1840000	A new PvP arena
1840000	1843000	And epic flying mounts
1843000	1845000	The Nether Drake
1845000	1848000	Will be available with that patch
1848000	1851000	Except I won't be able to play that because I'm not a high enough level yet
1851000	1853000	But soon, I'm 51
1853000	1857000	Jewids are going to have their own epic flight form
1857000	1858000	Yes
1858000	1860000	It will be epic
1860000	1865000	And it will be like the warlock and paladin mount quests
1865000	1866000	Alright
1866000	1867000	So that's pretty cool
1867000	1870000	By the way, I forgot to say World of Warcraft during my gaming week
1870000	1873000	We're on a very aggressive recruiting campaign for our guild
1873000	1875000	We don't call ourselves OL Army
1875000	1877000	We have a different name just because we want to kind of blend in
1877000	1879000	We don't want to be an obvious radio promo
1879000	1881000	But if you want more information, please go to our forums
1881000	1883000	If you have, like, a dormant character
1883000	1885000	You're thinking about transferring
1885000	1889000	We totally want some non-dickhead people to play with
1889000	1892000	If someone would give me Burning Crusade, I'd play
1892000	1895000	I have not even touched the content for Burning Crusade at level 51
1895000	1897000	I just want to draw an eye
1897000	1898000	But that's the wrong side
1898000	1900000	I want a blood elf too
1900000	1902000	Maybe if you're nice
1902000	1906000	Somebody will bring that to you for, I don't know, solstice or something
1906000	1907000	Okay
1907000	1908000	Alright
1908000	1909000	I'll buy chocolate
1909000	1911000	I was going to say, um
1911000	1915000	I heard that a bunch of people from the old Deathcake guild finally
1915000	1918000	A bunch of people from the old Final Fantasy XI guild finally made the jump
1918000	1919000	Yeah, it's pretty cool
1919000	1922000	I will never, never jump into that
1922000	1923000	You need to
1923000	1924000	That's because of the wife
1924000	1925000	But here's the other thing I want to say
1925000	1931000	We posted a plug for our guild in the official server forums
1931000	1933000	And, like, within five minutes
1933000	1936000	Some twat responded with some negative comment to my post
1936000	1937000	You know, I'm like
1937000	1939000	God, I hate web forums sometimes
1939000	1940000	I hate twats
1940000	1941000	I hate the internet
1941000	1942000	I hate twats
1942000	1944000	Alright, anyway
1944000	1945000	Sorry
1945000	1947000	We can talk about other stuff now
1947000	1948000	Like this
1948000	1950000	Hey, before there was the WoW addiction
1950000	1951000	There was the music game addiction
1951000	1953000	Which a lot of us are still addicted to
1953000	1956000	And one of the granddaddies of the music game genre
1956000	1957000	Parappa the Rappa
1957000	1959000	Created by Masaya Matsura
1959000	1964000	He has talked about the Playstation 3 sluggish sales in Japan
1964000	1967000	And he's saying that's because the thing's a monster
1967000	1968000	It's a huge game
1968000	1970000	Or it's a huge system
1970000	1971000	He says, quote
1971000	1973000	It's not the size of the hardware
1973000	1977000	But of the AC adapter when talking about the Xbox 360
1977000	1979000	Who fuckin' who?
1979000	1980000	Isn't that crazy?
1980000	1981000	Get over it
1981000	1982000	My God
1982000	1983000	The AC adapter's too big
1983000	1984000	I can't develop for that system
1984000	1986000	Well, but here's the thing though
1986000	1988000	He doesn't talk about the Wii at all
1988000	1989000	Because he says, quote
1989000	1990000	The Wii is a, quote
1990000	1992000	Very good piece of hardware
1992000	1996000	And noting that the controls are pretty awesome
1996000	1999000	And he has said that he's going to be developing a game for the system
1999000	2000000	Quote
2000000	2001000	Soon
2001000	2002000	Maybe
2002000	2003000	My God
2003000	2005000	He jumps on the complete bandwagon
2005000	2008000	Like a whole fuckin' year and a half late
2008000	2011000	Oh, the AC adapter's too big
2011000	2012000	Get over it
2012000	2013000	Seriously
2013000	2014000	My God
2014000	2015000	It
2015000	2017000	So what if the brick is huge?
2017000	2018000	It does not matter
2018000	2020000	The Xbox was huge
2020000	2021000	I mean, come on
2021000	2022000	No one complained about that
2022000	2024000	The fact the size of the controllers originally were like
2024000	2025000	I don't know
2025000	2026000	Their own houses
2026000	2028000	It is a little weird
2028000	2030000	That is kind of a weird comment
2030000	2031000	But whatever
2031000	2032000	I mean, that's
2032000	2034000	Anyhow
2034000	2035000	That's how he feels
2035000	2036000	That's how he feels
2036000	2038000	Bitch and moan, people
2038000	2039000	But
2039000	2041000	So
2041000	2042000	Yeah
2042000	2047000	Apparently, BMG's got the rights now to distribute economic music online
2047000	2051000	I know you'll be seeing that popping up in iTunes and Rhapsody
2051000	2054000	And other online distributors
2054000	2056000	But of course
2056000	2059000	You'll be seeing stuff from Castlevania
2059000	2060000	Maybe some DDR
2060000	2063000	Maybe Silent Hill
2063000	2064000	Okay
2064000	2065000	So
2065000	2069000	I don't really have any specific dates on the releases yet, but
2069000	2071000	It's coming
2071000	2073000	That's pretty cool
2073000	2077000	Well, something that's a bit of a relief for a lot of people is that
2077000	2080000	They're saying that Rock Band is going to be affordable
2080000	2087000	Not the $150 to $200 that people were, you know, thinking that it was going to be
2087000	2091000	But there hasn't been anything specifically said about pricing
2091000	2099000	But it was said that they don't see a point in making a game that people are not going to be happy buying
2099000	2100000	So
2100000	2101000	Hopefully
2101000	2105000	I don't know what their idea of reasonable is
2105000	2108000	It'll be expensive
2108000	2112000	I could swing $100 for a game, but $150 maybe not
2112000	2114000	Well, I mean, if it has good peripherals, maybe
2114000	2115000	Let me put it this way
2115000	2117000	Okay, it's EA putting it out
2117000	2121000	EA has, as far as like, you know, pricing goes
2121000	2124000	Their games are a little on the high end
2124000	2126000	Even to retailers
2126000	2128000	But it's going to be expensive
2128000	2132000	They're going to milk any sort of money that they could possibly get out of this
2132000	2134000	Alright
2134000	2138000	Well, that's of course a game we're looking forward to in the far future
2138000	2141000	That game's probably, what, a Christmas release looking at?
2141000	2142000	Probably November-ish?
2142000	2143000	Yeah, probably November
2143000	2144000	Alright
2144000	2147000	Okay, so we're going to be looking at some media releases we have
2147000	2148000	We're going to run down some release dates
2148000	2150000	And we'll start in Japan
