start	end	text
0	3000	Orange Lounge Radio
7000	12000	There's your hosts, DarkSakura, Sky, and Loko
14000	18000	Tonight, May 20th, 2007, Blizzard officially announces Starcraft 2
19000	21000	Halo 3 gets an official release date
21000	25000	Project Gotham 3 is mistaken for a Sony game once again
25000	29000	Orange Lounge Radio
55000	57000	I don't have to go to work tomorrow
60000	62000	And I didn't go Thursday or Friday
65000	67000	I was supposed to go to a wedding and we decided not to go
67000	70000	So I went and did nerdy stuff yesterday
70000	72000	And slept a lot
72000	82000	I had time off set to go on vacation to L.A.
82000	84000	Actually, I think I was supposed to go to Disneyland
84000	86000	But this was a couple of years ago
86000	89000	This was before Disneyland was the cool thing to do between us
89000	92000	And for some reason or other the trip got cancelled
92000	93000	We didn't end up going
93000	94000	But I just kept the time off of work
94000	97000	And that was the same week that Final Fantasy XI came out
97000	98000	Oh God
98000	99000	I remember that
99000	102000	I sat at home and played Final Fantasy XI for like four days straight
102000	103000	Early days of your addiction
103000	105000	Oh, it was horrendous
105000	106000	Just looking back on that
106000	108000	I did that when Final Fantasy VI came out
108000	110000	Well, three over here came out
110000	111000	When I was in high school
111000	114000	And I stayed home with the flu
116000	117000	I had a fever
117000	119000	And it needed more Final Fantasy
119000	120000	I have a fever
120000	123000	And the only cure is more treasure hunters
125000	128000	I hate, hate, hate, hate, hate, hate the flu
128000	129000	I need cure three
129000	130000	Alright, anyway
130000	133000	Uh, Loki, Techmaster Loki is here as well
133000	134000	Yes, I am
134000	137000	Have you ever called in sick or used your vacation to play a video game?
137000	138000	Yes
138000	139000	What was that?
139000	140000	I don't remember
140000	143000	But you remember taking the time off to play it?
143000	144000	Uh, yes
144000	145000	Alright
145000	147000	You don't remember what it was, but you took off
147000	149000	I think I may have done it for San Andreas
149000	150000	Oh, okay
150000	151000	Maybe
151000	153000	Alright, you gonna do it for Grand Theft Auto IV?
153000	155000	No, because we'll be playing it at work
155000	156000	So it's not a big deal
156000	158000	You know a lot of people were pissed off
158000	161000	Because there were a lot of people that took the day off for the Halo 3 beta
161000	163000	And we're gonna talk more Halo 3 probably in part B tonight
163000	165000	But you know the Halo 3 beta came out
165000	167000	And a lot of people called in sick to work that day
167000	169000	Because they were gonna sit at home and play the Halo 3 beta
169000	172000	And then the damn thing didn't show up for like 13 hours
172000	174000	And people were pissed
174000	176000	You know, because they'd taken the time off work
176000	177000	But it's hard
177000	180000	I know it's hard to get upset when it's like, you know, kind of free
180000	183000	And they never promised it on a certain day to begin with really
183000	186000	You know, it's kind of one of those tricky situations
186000	187000	I don't know
187000	189000	But I thought that was interesting
189000	191000	So anyway
191000	194000	Alright, so we're gonna get into some gaming news tonight
194000	196000	But first we're gonna start it off with a little bit of
196000	198000	How was your gaming week?
198000	200000	No special guests tonight, but we do have the chat room
200000	202000	chat.orangelaungeradio.com
202000	204000	Harvey's here, Rob
204000	205000	Look at what?
205000	206000	Harvey
206000	207000	Who's Harvey?
207000	208000	Did you see the movie?
208000	209000	No
209000	210000	Invisible Rabbit?
210000	211000	No
211000	212000	It was a Jimmy Stewart movie
212000	214000	Oh, what's, no, a little
214000	215000	The Wonder Hamster?
215000	217000	No
217000	220000	You need to watch some classic movies every so often, Rob
220000	221000	Once in a while I do
221000	222000	Broaden Your Horizons
222000	224000	I do, I've seen like Casablanca
224000	226000	And the Wizard of Oz is one of my favorite movies ever
226000	229000	I'm going to find the DVD of Harvey and buy it for you
229000	230000	And you're gonna watch it
230000	232000	And Hitchcock, I love old Hitchcock movies like Psycho
232000	235000	Casablanca is so like, you know, the simple life
235000	236000	It's just like
236000	238000	Oh my god, there's this war going on
238000	241000	Why is that the inconvenience me?
241000	245000	Wow, my headache just came back
245000	246000	Good job
246000	247000	Alright
247000	249000	I just swallowed like five Excedrin
249000	252000	I'm looking at our chat room right now to see what's going on
252000	254000	Of course we do tape live on Sunday nights
254000	258000	And then release this to our audio RSS feed is the technical name for it
258000	261000	But most people just call it a podcast or a blog cast or whatever
261000	264000	Let's see, anyway, look in the chat room, what's going on
264000	265000	Gaming week
265000	266000	Huh?
266000	267000	Gaming week
267000	268000	Yeah, we'll get to that
268000	269000	Can't we say hello to the chatters real quick?
269000	270000	No
270000	271000	Alright, well
271000	273000	ActDeaf says I hope OLR cheers me up
273000	274000	Well, not with Jamie's current attitude
274000	275000	Hi
275000	276000	She won't be
276000	277000	She happy, dammit
277000	278000	She won't be cheering anybody up there
278000	280000	Be of good cheer or I'll kick your ass
280000	284000	Let's see, PK, I'm sorry, I always say his name wrong
284000	286000	Peaker Uno, I think is how I'm supposed to say it
286000	289000	Says we need to have an OLR me we suck at Halo game
289000	290000	Yes, we do
290000	294000	GS68 said Rob floods go faster at night
294000	296000	I guess in response to chat going Rob, Rob, Rob
296000	298000	You know Sauce was at Disneyland Friday
298000	299000	Lucky
299000	303000	No, and she said they closed down Pirates for the premiere and then they opened it back
303000	304000	up
304000	307000	Oh, the Pirates premiere was going on, that's cool, fun
307000	311000	Alright, we're not a Disneyland podcast, so tell us about your gaming week
311000	317000	Well, I played something like seven hours of, no not seven, because I took a break
317000	321000	I played a lot of Marvel Ultimate Alliance because I had to start over because there
321000	323000	were fingerprints on the rental
323000	326000	We get free rentals from Hollywood Video, so I just played a whole bunch
326000	332000	And I was very pissed off because I played Iron Man on the Mandarin stage
332000	337000	Only I used the Ultimate Armor because it looks a lot better than his dorky, you know, asshole armor
337000	341000	Sorry, I've been reading, I read a lot of comics
341000	345000	And so there wasn't any of the dialogue and I was like, well this is crap
345000	349000	And so I just went back to playing a whole lot of Deadpool because he's funny
349000	352000	And god damn stupid computer
352000	357000	You know, I had my computer on Power Saver because I was moving files anyway
357000	363000	So I also went to Pen-a-Go-Go
363000	367000	Which was this, I want to say it was big, but it really wasn't
367000	369000	It was like in a warehouse in Dixon
369000	373000	Well, actually the big, you know, hall at the Dixon Fairgrounds
373000	377000	For our international listeners, how can we describe Dixon, California?
377000	379000	Podunk
379000	382000	It's like going to the country
382000	384000	It's the suburb of a suburb, right?
384000	390000	You have like this old town and then you drive like five minutes and you have farm
390000	394000	Like Davis is a suburb of Sacramento, right?
394000	396000	Where the school is, where the first season of sorority life was, right?
396000	398000	So most people know UC Davis
398000	401000	Well Dixon is a suburb of Davis, okay?
401000	405000	So that's, to put it in perspective, like it's not even as populated
405000	407000	I apologize if we have any listeners in Dixon
407000	410000	I do love Mary's Pizza Shack, which is in Dixon, but that's about it
410000	413000	I went to this sweet stuff place, I think it was called
413000	415000	And it was really yummy and I had banana ice cream
415000	417000	Anyway, sorry, Pen-a-Go-Go, pinball
417000	421000	Okay, yeah, I'm actually pulling up the list of the games I played at Pen-a-Go-Go
421000	426000	And this isn't all of them because I did play a bunch of really old, old, old machines
426000	428000	Like the ones from before
428000	432000	Like, these are so old that they had the flippy numbers, you know?
432000	439000	Where instead of, you know, you have your LED screen, you had the flippy numbers
439000	441000	Wow, like the counters
441000	444000	And there was only one of those that was worth mentioning, which is called Skylab
444000	447000	And the cool thing about Skylab is that you have this middle section
447000	450000	That's got a line in between them
450000	452000	And you have five pinballs in there
452000	454000	And you have to knock five onto one side of it
454000	457000	And then you get like some special thing, only I couldn't do it
457000	463000	So I played Black Rose, which is a pirate theme with this huge, you know, big old pirate winch on the thing
463000	466000	And it has cannons in it and you have to like shoot down a pirate ship
466000	468000	Cool, pirate winches
468000	471000	And Centaur, which was a cool older table
471000	477000	It was before they had the big, you know, LED, the big display, digital displays and everything
477000	479000	And it was just the numbers and all that
479000	482000	And I played the new Pirates of the Caribbean machine, which is actually okay
482000	485000	But it wasn't quite as awesome as I thought it would be
485000	488000	And I kicked Dan's ass at Theatre of Magic twice
488000	490000	I love Theatre of Magic, that's a kickass table
490000	492000	Theatre of Magic is the most sexy pinball table
492000	495000	I was about ready to offer the dude four thousand bucks on
495000	499000	I was like, hello, my retirement money, give me Theatre of Magic
499000	502000	But no, I had to use it on school
502000	505000	But he did win, though, on the third game
505000	507000	But that's okay because I also kicked his ass at Adam's Family
507000	511000	God, I wonder where I could find four thousand dollars to buy a Theatre of Magic table
511000	513000	It's so tempting
513000	516000	Apparently it's one of Dan's buddies that owns the machine
516000	521000	I played Demolition Man and I thought it would be a great machine because I love ramps
521000	524000	No, suck-tastic
524000	526000	Much like the movie
526000	528000	Actually, I like the movie
528000	532000	Demolition Man is one of my guilty pleasures
532000	533000	Kind of like Me and Showgirls?
533000	534000	Yeah
534000	535000	Okay, yeah, gotcha
535000	538000	Just because I love the whole scene when they're in the car scene to old Oscar Mayer commercials
538000	540000	You know who really brought down that movie?
540000	541000	Who?
541000	542000	Sandra Bullock
542000	543000	It ruins everything
543000	544000	It's like poison
544000	545000	Everything she touches is poison
545000	547000	The speed was good, the first one
547000	549000	It had Denis Leary in it, though
549000	552000	Denis Leary is the reason to watch Demolition Man
552000	555000	Sorry to interrupt your report, but I have to ask Loki, do you have any guilty pleasure movies?
555000	557000	Guilty pleasure movies?
557000	560000	I guess Wild Zero, maybe
560000	562000	Dude, I love that movie, too
562000	564000	But there's that one
564000	566000	I have a new one, though, possibly
566000	567000	I have to watch it, though
567000	569000	Yo Yo Girl Cop
569000	572000	Oh, wait, is that the Sukebon Deca?
572000	573000	No, that was not a cop
573000	576000	It's the one about this Asian chick who fights crime
576000	580000	She's like a cop by day, crime fighter by night, which is kind of the same thing
580000	584000	But anyways, she fights crime with this metal yo-yo
584000	586000	Well, the yo-yo started off as a weapon
586000	587000	That's amazing
587000	589000	So, it's interesting
589000	591000	Okay, well, there's more games
591000	594000	I played Teenage Mutant Ninja Turtles, which is the worst machine ever
594000	596000	It's like it has action figures all over it
596000	603000	And the only cool thing about it is this rotating pizza spinner in the middle that will shoot the ball in different directions
603000	608000	I played Medieval Madness, but the guy who owned it put extra steep ramps in it
608000	610000	But I did break down the castle, that was cool
610000	612000	Pinbot
613000	616000	Fucking greatest pinball game of ever
616000	617000	No
617000	618000	Ever
618000	619000	But it was dingy
619000	620000	Actually, you need to come to my house and play Bride of Pinbot
620000	622000	Bride of Pinbot is actually better
622000	623000	I forgot you have Bride of Pinbot now
623000	626000	Yes, well, it's not technically ours, it's our friend Will's
626000	629000	But it lives in my apartment, my garage
629000	631000	Suddenly we're becoming a pinball podcast, but that's okay
631000	632000	Okay
632000	635000	Pinball is what I played before DDR, which is how I met all you guys
635000	637000	So, this is like going back to our roots
637000	638000	There's a few more worth mentioning
638000	639000	I played Hyperball
639000	641000	Hyperball is the worst pinball ever
641000	643000	Well, not really worst, it's the weirdest
643000	649000	Because you have this big open field and little holes around the perimeter of the thing
649000	653000	And you have to shoot the balls into the holes and they're like by the alphabet and it's really stupid
653000	656000	I played High Speed, which is one of the older ones
656000	657000	That was really fun
657000	658000	And Cyclone
658000	662000	High Speed was the other NES game that fucking no one played
662000	665000	They had Pinbot, and then Pinbot was so successful they made High Speed
665000	666000	But nobody played High Speed
666000	668000	But High Speed is a fucking awesome table
668000	669000	It is an awesome, that's why they made it a game
669000	671000	But Cyclone has, um
671000	676000	Now, Cyclone, it was one of the ones I used to play in Mobile at a Godfather's Pizza
676000	682000	And the marquee of it has a clown on it and this rollercoaster
682000	685000	And in the first row is Ronald Reagan and Nancy Reagan
685000	690000	But on the one in Mobile, someone duct taped over the clown because clowns are scary
690000	696000	And drew a beard with a big mustache and a cowboy hat on Ronald Reagan
696000	698000	So, that's always my memory of it
698000	700000	It's a cool table, I just hate clowns
700000	704000	There should be a pinball game where you just hit clowns in the face
704000	705000	That'd be fun
705000	707000	The biggest disappointment for me, well there's Fun House
707000	709000	Fun House is one where you can hit this
709000	710000	That's right!
710000	715000	I hate Fun House though, we almost bought one and I told Dan no because the freaking head scared the crap out of me
715000	721000	But the disappointment though is I wanted to see World Cup Soccer and apparently they sold it on Friday and I went on Saturday
721000	724000	Big Bang Bar, no one had any prototypes there
724000	728000	And Big Bang Bar is like, I've gotten to play a Big Bang Bar
728000	730000	That's the one where there's only like 20 of them in existence
730000	731000	16
731000	734000	And when Capcom closed down their pinball division
734000	738000	However, the rights to Big Bang Bar have now been made available
738000	741000	I think to Stern I think is going to be released
741000	742000	Don't quote me on that yet
742000	744000	But I think Stern's going to be releasing them
744000	747000	Time Machine is the other one I wanted to see
747000	753000	Jackbot, Black Knight 2000 and Doctor Who of course were the big ones that I wanted to see
753000	759000	Other than that, I've been playing stupid Flash games thanks to Loki
759000	760000	Sorry
760000	762000	That's okay, they're kind of addicting
762000	764000	I'm going to be doing that all day tomorrow now
764000	767000	Yeah, I was playing Flash games too
767000	768000	So what were you playing?
768000	773000	I played, actually, I played Crackdown
773000	776000	A little bit of co-op Crackdown, that was fun
776000	779000	I did try the Halo 3 beta once
779000	780000	It was okay
780000	785000	To be honest, it's exactly like the last Halo game
785000	788000	Gameplay-wise, they haven't really changed much
788000	791000	Which is fine, it was good to begin with
791000	794000	But I still really suck at Halo
794000	797000	I had trouble
797000	800000	The only thing I kind of regret is the loading screens
800000	803000	In some games, they usually show you what the button configuration is
803000	806000	I went in there and was like, how do I do stuff?
806000	808000	I had to kind of figure that out
808000	810000	And they still didn't really get the hang of it
810000	812000	Instead they have the message that says
812000	814000	Halo 3 Beta, love Bungie
814000	816000	I thought that was funny
816000	818000	So that was okay
818000	821000	I went back to playing Earth Defense Force 2017 again
821000	824000	And I got the fucking super awesome stationary guns
824000	827000	I'm going to be able to blow through Inferno difficulty now
827000	829000	Like, no problem
829000	831000	But those are cool
831000	833000	And then, what else did I play?
833000	835000	Oh yeah, I tried a little bit of that
835000	837000	What was it, Geasswing or whatever?
837000	839000	It was okay
839000	841000	Very bland, actually
841000	844000	The graphics in it were very kind of, ugh
844000	846000	Like I threw this together really quick
846000	847000	Dude, it was free
847000	850000	I don't care, I've seen better shit that's been free, okay?
850000	851000	You know
851000	853000	Warning Forever, that's free
853000	855000	And that looked a lot better
855000	857000	And there wasn't even any background on that
857000	858000	So
858000	860000	They should, simple, you know
860000	862000	They should have done all
862000	864000	Vectors would have been cool
864000	865000	Anyways
865000	868000	So, then beyond that stuff
868000	871000	I played a little bit of
871000	874000	Well, of course, Grand Theft Auto Vice City Stories
874000	876000	Still playing that
876000	878000	I'll still be playing that
878000	881000	Until, you know, Grand Theft Auto 4 comes out
881000	883000	I tried a little bit of Saints Row
883000	884000	That was fun
884000	886000	For some reason though, like
886000	890000	I really, I don't know if anyone has actually tried landing 360 systems
890000	892000	They are as finicky as shit
892000	896000	They will not land with each other if like something's different or whatever
896000	898000	Like Saints Row, we were trying to land it
898000	902000	One of the systems doesn't have the update for it yet
902000	904000	The multiplayer update that fixes the lag
904000	905000	One system does
905000	907000	It won't see each other
907000	908000	So that kind of sucked
908000	910000	Cracked down, we tried landing it again
910000	911000	And it won't see each other
911000	913000	Despite the fact that it's the exact same setup
913000	914000	And it worked the other day
914000	916000	So I don't know what the fuck's wrong with these things
916000	919000	But all I know is Microsoft did not make it fucking easy to land this shit
919000	920000	So
920000	921000	Fuck them
921000	923000	That's it
923000	925000	Alright, well, my gaming week
925000	927000	I also played the Halo 3 beta
927000	929000	And, you know, it's pretty cool
929000	931000	To me, my first, my initial impression was like
931000	933000	Okay, it's like Halo 2
933000	935000	Is prettier and with, you know, the shield
935000	937000	And other new X button features, right
937000	938000	That change up the game a little bit
938000	939000	But then I'm kind of thinking like
939000	941000	Okay, well Halo 2 is a pretty rock solid game
941000	943000	That people still play online
943000	945000	Like over and over and over again
945000	946000	Until their thumbs fall off
946000	948000	So if it ain't broke, don't fix it, right?
948000	951000	So I think, honestly, Halo 3 is going to be pretty cool
951000	954000	Now there were, like, I found the beta to be a bit confusing at first
954000	957000	Because I was trying to set up a game that would just be my friends and I
957000	959000	And like I couldn't, like, we could only like
959000	961000	Get the friends together to join other games
961000	963000	But I guess you can't really be picky choosy
963000	964000	Because it is a beta
964000	966000	They're probably trying to stress the stress
966000	967000	Yeah, it's probably what I meant
967000	968000	So I'm not going to complain about that
968000	969000	I was just like
969000	971000	Aw, darn, I wish I could have done it this way
971000	975000	But I did find that if I don't play ranked mode
975000	976000	If I just stay away from ranked mode
976000	977000	And play, like, the open mode
977000	980000	Generally you get people of a lower skill rank
980000	982000	Which is good, it's better for me to play on
982000	984000	So I played a couple games and it was a good time
984000	986000	Like the training stuff, or?
986000	989000	Yeah, I played, a random O.L.R. listener came in too
989000	990000	And I'm sorry, dude, I forgot your name
990000	992000	But somebody that was no O.L.R. listener
992000	993000	Came onto my friends list
993000	995000	We played a Halo 3 match together
995000	996000	We had a good time
996000	997000	I actually got more kills than him
997000	998000	So I was all, he's like
998000	999000	What do you mean you suck at Halo?
999000	1001000	So I was all excited, but it was just luck
1001000	1002000	And sometimes it's just luck
1002000	1004000	Especially when nobody knows the maps
1004000	1005000	Because they're all new
1005000	1006000	But I thought it was really pretty
1006000	1007000	I like that map where you play in the snow
1007000	1008000	It was kind of neat looking
1008000	1010000	And the shields look pretty cool
1010000	1012000	Like, you know, it's kind of cool
1012000	1013000	The game's going to sell like crazy
1013000	1015000	It's going to be Halo 2 all over again
1015000	1016000	But just a whole new thing
1016000	1017000	It's going to be huge
1017000	1019000	I mean, I wish I wasn't so ignorant
1019000	1020000	When it comes to first person shooters
1020000	1022000	Because a lot of them feel all the same to me
1022000	1023000	Because I don't play a whole lot of them
1023000	1024000	Like, I've played Quake 3
1024000	1025000	And some of the other Quakes
1025000	1026000	And, you know, a couple here and there
1026000	1029000	But, you know, Halo's just always kind of stood out
1029000	1031000	I hope it has a great single player, though, too
1031000	1032000	For those that don't necessarily like to
1032000	1034000	Go online and play random people
1034000	1036000	But I can't wait to have the college buddies
1036000	1037000	And I play in the game
1037000	1038000	It's going to be fun
1038000	1039000	Yeah
1039000	1040000	Let's see, other games I've been playing this week
1040000	1043000	I've actually went back to my PlayStation 2
1043000	1045000	And picked up a game that I played a lot of
1045000	1046000	When it first came out
1046000	1048000	But then they just kind of stopped
1048000	1049000	And neglected it when the Wii came out
1049000	1051000	And that would be Final Fantasy XII
1051000	1053000	And what motivated me to play this game again
1053000	1054000	Is you might remember last week
1054000	1055000	I had a bit of an emo week
1055000	1056000	And Miklotov was here
1056000	1059000	And he talked about how he bought me the Balthier doll
1059000	1061000	Who is, like, the reason to play Final Fantasy XII
1061000	1063000	Because not only is he sexy
1063000	1065000	But he's just, like, the most interesting character in the game, right?
1065000	1066000	He's awesome
1066000	1068000	So, yeah, I decided to go back to Final Fantasy XII
1068000	1070000	Because I want to play it through to completion
1070000	1072000	But I'm kind of one of those people that's like
1072000	1074000	If I forget what happened in the story
1074000	1076000	And it's been, like, you know, a good five months
1076000	1077000	Since I've touched the game
1077000	1079000	I have to go back and start from the beginning
1079000	1080000	So I started back from the beginning
1080000	1083000	But, God, the battle system in that game is great
1083000	1085000	I mean, it's like playing an online game
1085000	1086000	But not online
1086000	1089000	Like, where you get total control over all the other people
1089000	1090000	It's great
1090000	1092000	I forgot there's a few other things I did play
1092000	1094000	I played Eternal Sonata
1094000	1095000	Which they have the demo for
1095000	1097000	That demo is amazing
1097000	1098000	I loved it
1098000	1099000	Did you like it?
1099000	1100000	Yeah, it was pretty awesome
1100000	1101000	It's awesome
1101000	1102000	Oh my God
1102000	1105000	The Xbox 360 needs a game like Eternal Sonata
1105000	1106000	So bad
1106000	1108000	It's one of the types of games that Microsoft has been lacking in
1108000	1110000	Ever since, like, Xbox One
1110000	1112000	And, yes, I know there was, like, Enchanted Arms
1112000	1116000	But, seriously, this is like a great role-playing game
1116000	1118000	It looks to be shaping up to be one
1118000	1119000	I was so impressed with the demo
1119000	1123000	To me, this is how Square Enix should be doing their Final Fantasy games
1123000	1127000	I don't know how Final Fantasy XIII is going to be
1127000	1128000	It looks a little weird
