start	end	text
3361000	3364000	It's a lot it's not as easy as it sounds
3364000	3368000	You make it sound like some assembly is required
3368000	3372000	That's why I love living in the modern world where we have things called toilets
3372000	3376000	And not living in Japan where the public toilets are spot toilets
3376000	3386000	Rob you remember though it's not always a good idea to go behind Neil Bush and stuff especially if you're a woman because the drag queen fairy may come and turn you into a man
3386000	3389000	And then they'll make a movie out of that that's horrible
3389000	3391000	What movie was that again
3391000	3396000	I can't remember it was like penis envy that's what it was
3396000	3403000	Actually there's another thing it was a movie with Adam Sandler who's coming out
3403000	3406000	Oh is that the gay marriage one
3406000	3411000	The trailer already pisses me the hell off so fuck them
3411000	3420000	I'm willing to give the movie a chance to see what the message is in the end but yeah the trailer does make it look like I can't even describe it
3420000	3421000	It's very trivializing
3421000	3422000	Yeah it does
3422000	3424000	Draw Them Together did it first
3424000	3426000	Draw Them Together did it funny
3426000	3430000	I'll give the movie a chance but the trailer does not look promising anyway Logie
3430000	3440000	Screw all the software makers on the 360 for making it so fucking hard to do a system link game with your goddamn games
3440000	3445000	Stop having the patch shit so it's incompatible with unpatched shit
3445000	3452000	And then F.U. did my work for not actually having an internet connection in the one room there where we have the game consoles so I can just update them right there
3452000	3454000	So I have to take them home
3457000	3459000	Okay is it my turn to give an F.U.?
3459000	3461000	Well my first F.U. is to Draw Them
3461000	3462000	I don't like Draw Them
3462000	3464000	Nobody likes Draw Them and Draw Them is no fun
3464000	3471000	And then I have a second F.U. and this one's pretty serious so I have to kill the music here for a minute
3471000	3483000	I had to give an F.U. to myself because something really bad happened and it's kind of hard for me to admit this openly
3483000	3495000	But it's just a very difficult thing for me I have to give an F.U. to myself because I kind of like a Fergie song
3495000	3506000	I know I failed the internets completely I failed our listeners but I just like this new Fergie song this big girls don't cry
3506000	3516000	This is a song that's beautiful
3516000	3530000	So I like Fergie and for that I deserve to be mocked and made fun of openly by others and I hate myself
3530000	3532000	I'm pointing at you
3532000	3538000	Alright that's it more news
3538000	3542000	No I'd say we take an ice cream break
3542000	3547000	An ice cream break no we only have a few more stories six more stories we can do it
3547000	3557000	Fine fine fine well speaking of F.Us Sony is committed to the PS3 for ten years and beyond
3557000	3569000	Basically the S.C.E.A. president Jack Trenton is quoted saying we didn't get into PS3 for the first six months of 2007
3569000	3576000	We're into this for the next ten years and beyond a million units one way or another at this point isn't going to worry us
3576000	3581000	So this is what they're saying well our sales suck but we hope to make it up in ten years
3581000	3583000	Good luck
3583000	3587000	We're dedicated to this console to infinity and beyond
3587000	3592000	Has any console well I guess you know what it makes sense we kind of look at this and go oh ha ha ha
3592000	3601000	You know but come to think of it you know consoles live on even after the next generation I mean technically we are still in the PlayStation 2's life span right
3601000	3603000	They're still putting that crap for it
3603000	3613000	Exactly I mean and good crap we had God of War 2 we have this what the role playing game folks looking forward to Final Fantasy 12 is not that old all things considered you know it's console still got a lot of life left in it
3613000	3620000	So you know I could see how the console they can say it might be lasting that long before they you know put a bullet in it I don't know
3620000	3633000	Anyway sorry I was reading some chat room while Jamie was reading that story there and Mystic Gohan reminded me that big girls don't cry so I need to just suck it up here on the show
3633000	3658000	Also big girls and big boys alike love the Chronicles of Riddick or at least you know feel okay about it I don't know sorry bad segue but hey you know what even if you didn't like the movie the game wasn't bad there was a huge game that came out on the Xbox the Chronicles of Riddick game and guess what there is a next gen version coming out
3658000	3672000	The UK trade publication MCV has confirmed that Star Breeze is working on a new version of the game for next gen systems the game is called Assault on Dark Athena X and it's going to have a single player mode which is a little bit longer than last time
3672000	3681000	An all new multiplayer mode and a developers commentary mode so what does that mean you get running commentary while you're playing the game kind of like a DVD track
3681000	3695000	And man this part was such a bitch to program I swear code here and code this didn't quite work together so we had to do this to make them work and blah blah blah blah blah and the rest of us are going um yeah I don't speak your language
3695000	3710000	It's like Final Fantasy 7 and it's like yeah and then the scene where Eris dies oh crap that hasn't happened yet oh shit um forget I said anything about that that oh dammit
3710000	3722000	Good job Loki maybe hey maybe in that remake that they keep saying they're gonna do for you know the internet loves to rumor that one for the Playstation 3 maybe it can have developer commentary in it
3722000	3726000	And maybe my skin will turn blue
3726000	3729000	Maybe it will Jamie maybe it will
3729000	3742000	So Sony plans on bringing the pain to the Playstation 3 and actually the Playstation Network it's a game called Pain and it involves you launching a poor hapless victim into stuff
3742000	3745000	I'm gonna buy it
3745000	3753000	Wait is this the one where I saw a screenshot where it was just a guy on a like a slingshot and they were gonna fling him into a building or something
3753000	3765000	Pretty much and it has monkeys getting injured so injured monkeys people getting hurt sounds like a game I'm gonna buy so yeah that's gonna be coming out later on
3765000	3768000	It's like jackass but actually funny
3768000	3777000	Sort of um yeah I don't know it's just using the physics engine so you just you know launch your character into stuff to get him hurt as badly as possible
3777000	3784000	And they have different games like including like a horse mode or spank the monkey and mime toss
3784000	3786000	Hey I like that part
3786000	3796000	Dr. Burst in chat asks what's with the Sony bashing tonight dude this looks great pain looks great and we said the mystic sword looks cool
3796000	3800000	Heavenly sword and rat things
3800000	3806000	You're right I'm exposed I hate Sony haha got me
3806000	3827000	Well you know though speaking of games that I'm not buying Vivendi is putting time shift on PS3 so it will be up there with the PC and PC 360 I'm sorry Xbox 360 oh my did that slip out
3827000	3840000	Oh I was just gonna say I have a laugh sometimes with like gaming press out there they always make stories for themselves like this whole time shift is coming to PlayStation 3 it's always been scheduled to come out on PlayStation 3
3840000	3848000	You know even when when Atari had the rights for it but then it went away for a while
3848000	3850000	Thank you for reading the whole rest of the story for me
3850000	3854000	Oh sorry
3854000	3858000	You ass
3858000	3860000	I'm not on top of things
3860000	3862000	That's it
3862000	3864000	I only read my story
3864000	3872000	This is what you're gonna do Jamie you know what story he does next because you can see it so read ahead and when he starts reading it cut him off and finish it okay Jamie
3872000	3874000	You know I'm just gonna leave
3874000	3878000	No you're not you get about two minutes to prep because I have a story here first
3878000	3880000	No I don't care
3880000	3882000	It's about the PlayStation 3
3882000	3884000	Okay I'm gonna sit here and read my comics for the rest of the show
3884000	3886000	Alright
3886000	3904000	Here we go now this is something the chat room said earlier is that the PlayStation 3 needs a price cut and you know gamers have said this and you know you've written the magazines you've read it on your online game blogs and now it's publishers saying that the PlayStation 3 needs a price cut
3904000	3920000	Specifically Ubisoft and Yves Guillemont who is the president and CEO of Ubisoft has said that Sony will quote for sure have a lower market share than before because of the PlayStation 3's cost
3920000	3924000	And he said quote they have to decrease the price quite significantly
3924000	3926000	Very interesting
3926000	3931000	However Ubisoft is continuing to support the PlayStation 3 they're bringing an exclusive title to Europe
3931000	3943000	Don't know what that means it's an exclusive PlayStation 3 Europe title so those of you guys in Europe that always feel like you're getting pooped on and neglected Ubisoft is hearing your pain and is bringing you something exclusive
3943000	3947000	Of course we have absolutely zero idea what that is yet
3947000	3949000	Far Cry Cricket
3949000	3952000	Who knows Far Cry Cricket
3952000	3954000	It's Cricket in the Jungle
3954000	3956000	We'll see
3956000	3975000	Anyways so Sega is licensing the Unreal 3 engine yes the same engine that's been in practically everything lately but you know hey it's yet another game thoughts are though that it's going to be used in the upcoming I guess they're enhancing or remaking the Alien franchise
3975000	3977000	Like Alien Syndrome and that stuff?
3977000	3979000	No like Aliens as in
3979000	3983000	Oh the movies oh I didn't know Sega owned the rights to that
3983000	3985000	Now you know
3985000	3987000	Okay
3987000	3990000	Wait no that must be a different thing I'm thinking of
3990000	3995000	But they haven't made an Alien movie since the Winona Ryder one which was years ago
3995000	3999000	Well they made a crappy Aliens vs Predator movie and then they're making a sequel
3999000	4001000	Aliens vs Predator was fun
4001000	4002000	They're making a sequel
4002000	4004000	Speaking of guilty pleasure movies there we go
4004000	4007000	When Aliens make out with a black chick yeah
4007000	4010000	Or no I'm sorry that was a predator
4010000	4012000	I swear to god
4012000	4019000	Well at the end of the movie to spoil it for you the predator looks at the one chick and it looks like they're going to make out and then they don't
4019000	4021000	Oh so they don't actually kiss
4021000	4022000	They don't actually kiss
4022000	4023000	So you lied to me
4023000	4024000	It looks like they are
4024000	4026000	Thanks for spoiling the movie OMG spoilers
4026000	4028000	It's ridiculous it's a ridiculous movie
4028000	4033000	I would have liked to see like maybe Aliens vs Jason or something like that
4033000	4038000	Aliens vs Predator was like the big fan thing
4038000	4040000	Freddy vs the Predator
4040000	4045000	TigerClawnChat says the best Aliens was the arcade version from Konami
4045000	4047000	It was that's what I was thinking of
4047000	4054000	But Ross Steel UT says hey Tiger, Aliens vs Predator arcade by Capcom equals sex and act deaf degrees over in Capcom
4054000	4058000	No I was thinking of the Capcom one because it's all about playing through the game with Lynn Karasawa
4058000	4061000	With her freaking sword of death
4061000	4062000	Awesome game
4062000	4064000	Anything else about the unreal engine?
4064000	4067000	Sorry we cut you off but you deserved it
4067000	4074000	No it's going to be probably a first person shooter since people really like to think outside the box
4074000	4076000	Sonic 3D again
4076000	4084000	Did you happen to catch that video that was like the Sonic concept that they were going to do that was supposed to be based off the cartoon series?
4084000	4088000	Yes I actually did see that some YouTube-age I don't remember where I saw it posted
4088000	4092000	Where like Sonic moved a little more 3D but it was still like a platformer
4092000	4096000	That looked so fake to me that looked so incredibly fake
4096000	4101000	Because I cannot believe that they would make a game like that where Sonic moved like molasses
4101000	4103000	Because if you watch that video it was slow
4103000	4106000	I know which system they'd put it out on too, the CDI
4106000	4109000	It looked horrible
4109000	4112000	I don't know where did you see that YouTube posted?
4112000	4113000	Kotaku
4113000	4114000	Was it?
4114000	4120000	It looked fake I'm sorry it screamed of fakeness to me like they took some unknown game and sprited Sonic into it
4120000	4123000	I don't know I don't want to believe it because it looked horrible
4123000	4125000	Maybe that was the beginning of the end of Sega who knows
4125000	4129000	Let's see
4129000	4134000	I'm looking at what's in chat going on there
4134000	4140000	ActDeft wants to see a video game, Aliens vs Predator vs Marvel vs Capcom vs SNK
4140000	4143000	Well that would be the ultimate wouldn't it?
4143000	4145000	Alright and let's see
4145000	4148000	GS68 is kicking Sonic while they're down here
4148000	4152000	I tried the Sonic 360 demo and the controls nearly made me have a stroke
4152000	4156000	Heart attack, stomach acid overflow, HIV and loose stools all at once
4156000	4162000	You know what they need to have now that Sega is doing third party titles now?
4162000	4165000	Nintendo vs Sega
4165000	4167000	The fighting game to end all fighting
4167000	4169000	Dude Smash Brothers hello Sonic
4169000	4173000	No I'm talking about a bigger roster we're talking like hundreds of characters
4173000	4177000	We never did get the Namco Capcom game out here
4177000	4180000	Oh that's true the Namco Cross Capcom or whatever it was?
4180000	4184000	It was a big RPG I know someone who has it
4184000	4189000	I played the Playstation 2 Japanese one and I'm kind of glad that we didn't because it was kind of lame
4189000	4191000	It sounded so cool in theory
4191000	4195000	Bandit reminds us they do have Sonic vs Mario in the upcoming Olympics game
4195000	4197000	We talked about it a few shows ago
4197000	4199000	You know what I want?
4199000	4202000	I want another
4202000	4205000	Crap I just lost the game
4205000	4208000	I want another Strider
4208000	4215000	What was that ridiculous Sega fighting game that they had where you can actually play as a Daytona car and punch things?
4215000	4220000	That was in Fighter's Megamix which I have
4220000	4223000	That's the kind of ridiculous gameplay I want
4223000	4228000	I want you to be able to play as Rob the Robot or as one of the unicycles from Uniracers
4228000	4230000	This is something really ridiculous
4230000	4233000	Instead of Captain Falcon I want to play as the car
4233000	4235000	Exactly
4235000	4237000	I'll just turn around and use Nitro Boost
4237000	4242000	I want to play as a little spinny fire thing from Dungeons and Super Mario Brothers
4242000	4244000	I want to play as a Bob-omb
4244000	4248000	Where your final attack is explode
4248000	4250000	That's awesome
4250000	4252000	I guess it's break time boys and girls
4252000	4254000	We're going to take a quick break here
4254000	4256000	We'll be back with more of Orange Lounge Radio in part B
4256000	4258000	Lots of news coming up in part B tonight
4258000	4260000	We haven't even touched the Xbox 360 or the Wii
4260000	4262000	This has kind of been the Sony segment
4262000	4265000	We have lots of 360 and Wii news coming up in part B of Orange Lounge Radio
4265000	4267000	We'll be back right after this
