start	end	text
2150000	2154000	Because of course a lot of the games that come out in Japan we end up seeing here
2154000	2155000	Starting off on the Xbox
2155000	2157000	Or sometimes it goes the other way around too
2157000	2158000	It takes a while for the games to get over there
2158000	2160000	It just depends what system you're talking about
2160000	2161000	Starting off on the Xbox 360
2161000	2164000	Forza Motorsport 2 is coming out on the 24th of May
2164000	2166000	As well as NBA Street Home Court
2166000	2169000	Those are some popular titles over on this side of the pond as well
2169000	2171000	Coming out on the Wii
2171000	2173000	A giant name here
2173000	2176000	One patchy slap pachinko blah blah blah
2176000	2179000	Sammy's collection Fist of the North Star Wii
2179000	2180000	So I guess it's what?
2180000	2184000	Fist of the North Star pachinko games coming out from Sega on the Wii
2184000	2188000	You would think that they accidentally ran like two names together
2188000	2189000	But no, I'm looking at the box art
2189000	2193000	And it really is Fist of the North Star pachinko games on your Wii
2193000	2194000	Pretty awesome
2194000	2195000	That's crazy
2195000	2198000	If you like pachinko and you like Fist of the North Star
2198000	2199000	Hey, this is the game for you
2199000	2202000	Going on to some other systems on the Playstation 3
2202000	2204000	You're also getting NBA Street Home Court
2204000	2208000	For those of you that import your games that want NBA Jam for whatever reason
2208000	2211000	NBA Jam, sorry, NBA Home Court
2211000	2212000	Big difference there
2212000	2218000	Playstation 2, Killer7 coming out on the Playstation 2 by Capcom in Japan
2218000	2220000	I'm surprised it's not out there already
2220000	2223000	Medal of Honor, well that's on the Playstation 2, not the GameCube
2223000	2224000	Maybe it just took a while
2224000	2229000	Medal of Honor Vanguard, Shadow of Rome and State of Emergency Revenge
2229000	2231000	All coming out on the Playstation 2
2231000	2234000	As well as the King of Fighters Maximum Impact 2
2234000	2236000	But that's just moving into the best collection
2236000	2240000	That was already out there in Japan
2240000	2243000	State of Emergency Revenge
2243000	2244000	That's what it's called
2244000	2249000	Coming out on the DS you have a crossword simulator from Hudson coming out on May 24th
2249000	2253000	As well as Hoshigami is coming out on May 24th
2253000	2257000	Lots of DS games coming out including an Olympic training game it looks like
2257000	2264000	What is this called? Sansu Olympic Inkai-Koan, Tsuji de Kiteru Noriyoku Training
2264000	2267000	What is that? It looks like Olympic Training or something
2267000	2270000	Or maybe some other type of brain training game
2270000	2272000	It's definitely what it looks like there
2272000	2274000	Brain Olympics Training
2274000	2277000	Maybe that's what it is, Brain Olympics or something like that
2277000	2280000	So all those games coming out in Japan
2280000	2284000	I'm looking to see if there's anything on the PSP real quick this week
2284000	2288000	Oh yes a new Bleach game, Bleach Heat the Soul 4
2288000	2290000	Just what we need, more Bleach
2290000	2291000	More Bleach
2291000	2294000	Oh and my favorite title name of the week is actually coming out on the Sony PSP
2294000	2297000	It's Juiced Eliminator
2297000	2298000	That's great
2298000	2301000	That's actually a racing game and I think it might be something they have over here
2301000	2302000	It's already out over here
2302000	2304000	Yeah, Juiced Eliminator
2304000	2305000	I have a t-shirt
2305000	2309000	It makes it sound like your PSP will slice and dice
2309000	2311000	I still want WTF
2311000	2314000	Not Julian, you know, Eliminator
2314000	2318000	Anyways, this week the big game coming out of course
2318000	2320000	Will be Pirates of the Caribbean at World's End
2320000	2323000	Where you get to play as the whole crew
2323000	2328000	Including Jack Sparrow, which is not voiced by Jenny Depp unfortunately
2328000	2333000	You also get, of course, on 360, WarTech Second Orundo
2333000	2336000	It's kind of interesting
2336000	2341000	It's like a shooter game, but it's all boss fights almost
2341000	2343000	It's just one-on-one fights
2343000	2346000	Halo 2 for Vista, so that's kind of neat
2346000	2349000	Odin Sphere, I know a lot of people were waiting for this one
2349000	2352000	That one's finally making its way out here on PlayStation 2
2352000	2355000	Dawn of Mana, that's finally coming out as well
2355000	2357000	Got delayed a week
2357000	2359000	About time
2359000	2363000	Naruto Ninja Council 3, that's going to be coming out on the DS
2363000	2367000	Brooktown, hi, senior year
2367000	2370000	Yay, that's economic game
2370000	2373000	Please God, or whatever force is up there in the great beyond
2373000	2376000	Listening to our crappy little radio program
2376000	2378000	Please, I have one small request for you
2378000	2381000	Please, please, please God, who I pray to every night
2381000	2383000	Who is so great and holy
2383000	2388000	Please do not let Dawn of Mana suck balls like Legend of Mana
2388000	2392000	Please, please, please, blessed be thy name, amen
2392000	2396000	Okay, anyways, also coming out this week on the DS
2396000	2398000	Death Junior and the Science Fair Doom
2398000	2402000	And let's see, Marvel Trading Card Games also coming out on the DS
2402000	2407000	And the New York Times Crosswords on the DS
2407000	2410000	Hooray
2410000	2413000	Well, we got a bunch of other stuff coming out in the UK
2413000	2418000	Odin Sphere comes out on PlayStation 2 the 22nd
2418000	2421000	On the 25th, a whole crap ton of stuff
2421000	2425000	There's Crush for PSP, Custom Robo Arena on DS
2425000	2427000	Halo 2 Vista for PC
2427000	2430000	Mario Strikers Charged Football
2430000	2432000	Metal Gear Solid Portable Ops
2432000	2437000	Hopefully with the warning intact, the rating
2437000	2441000	Monster Madness on PC and Xbox 360
2441000	2443000	Naruto Uzumaki Chronicles 2
2443000	2446000	SpongeBob and Friends blah blah blah
2446000	2449000	Pirates of the Caribbean on multiple systems
2449000	2452000	And Valhalla Knights on PSP
2452000	2454000	I want to mention something real quick
2454000	2457000	I just happened to catch this on Kotaku
2457000	2459000	It happened to do with pirates
2459000	2463000	But if you happen to be going towards Disneyland anytime soon
2463000	2467000	And you have a copy of Pirates of the Caribbean at World's End for the DS
2467000	2470000	There are specially marked spots on the rides
2470000	2475000	Or near the attractions that if you have your DS copy there
2475000	2479000	It will actually download exclusive content for you for the games
2479000	2481000	I need to get the game and take it to Disneyland
2481000	2482000	That's kind of neat
2482000	2484000	That's actually a really neat kind of tie-in
2484000	2486000	I have to give them props for that
2486000	2489000	It's a little crazy, but I like that idea
2489000	2491000	Too bad it wasn't for a game I would play a lot more
2491000	2493000	But that's kind of cool
2493000	2495000	Wow, that's kind of smart, I like that
2495000	2498000	I'm looking at Chatroom here
2498000	2500000	And somebody was responding to my little prayer there
2500000	2503000	Unfortunately they have the generic O.L. Army recruit name
2503000	2505000	But O.L. Army recruit number 9148 says
2505000	2507000	Donamana does suck
2507000	2509000	Uh oh, we're in for trouble there
2509000	2511000	What can we do there?
2511000	2514000	Let's see, some of the folks talking about Halo 2
2514000	2516000	Let's see, some folks are saying here
2516000	2519000	Act Def says Critics on Halo 2 Vista, it stinks
2519000	2521000	Rama says the Critics don't know shit
2521000	2525000	Mind you these are the same Critics that talked shit about XP when it came out
2525000	2526000	So there you have
2526000	2528000	Or it could be The Critic because
2528000	2531000	The Critic also used to say it stinks
2531000	2533000	It stinks
2533000	2535000	Alright, there we go
2535000	2538000	So anyhow, moving on to other news
2538000	2540000	Going to Sony, we're on DS now
2540000	2542000	We're going to go over to Sony
2542000	2545000	Warhawk, what the hell is going on with Warhawk?
2545000	2547000	At the latest press event apparently
2547000	2550000	Warhawk is going to be back on Blu-ray now
2550000	2553000	There is going to be a Blu-ray disc version of Warhawk
2553000	2555000	After all, it's going to have extra materials
2555000	2558000	Developer interviews, behind the scenes footage
2558000	2560000	And a Bluetooth headset
2560000	2564000	But the weird thing is, there still is going to be a PlayStation Network version of the game
2564000	2565000	Yes
2565000	2566000	So that's kind of funky
2566000	2568000	But don't worry though, it's not that
2568000	2570000	It's only going to be like 40 bucks
2570000	2572000	Oh okay, well that's not so bad then
2572000	2573000	Yeah
2573000	2575000	Because the online one will probably be 20 or 30 anyway
2575000	2576000	Because they can kind of charge that
2576000	2577000	Yeah, like 25 bucks or something
2577000	2578000	So you get all this extra stuff
2578000	2581000	Well that's kind of interesting, that's an interesting way to do it
2581000	2584000	There's going to be a public beta of the game starting on May 24th
2584000	2587000	And if you want to sign up, you just have to head on over to the official site
2587000	2589000	warhawk.com
2589000	2592000	Already signed up, so I haven't been contacted though
2592000	2596000	Some good reviews of the game coming out of Sony Gamer's Day though
2596000	2597000	So we'll see
2597000	2600000	It'll be interesting to see what happens there
2600000	2603000	PlayStation 3 could use all these types of games
2603000	2606000	They need some good news very badly right now
2606000	2608000	And this is good
2608000	2610000	Again, I'm not trying to pick on Sony or anything
2610000	2612000	I'm a fan of all three of the gaming companies
2612000	2616000	But let's face it, Sony's kind of doing an uphill battle right now
2616000	2618000	So this is good, I'm glad
2618000	2621000	They need to kick it up a notch
2621000	2622000	Kick it up a notch
2622000	2623000	For their download content
2623000	2626000	I mean seriously, it hasn't really been that much on there
2626000	2629000	RawSteelUT in the chat room is dogging the game
2629000	2631000	Warhawk looks like a generic Battlefield clone
2631000	2634000	$40 for a game with no SP mode, fuck that
2634000	2638000	True, I'm not buying it, but you know, it's interesting
2638000	2644000	Anyways, if you like Warhawk and those online multiplayer only games
2644000	2650000	Guess what? SOCOM Confrontation is going to be coming out for the PlayStation 3
2650000	2653000	It's going to be an online only multiplayer game
2653000	2658000	And yeah, it's pretty much more Deathmatch and Captured Flag and all that fun stuff
2658000	2661000	But it's SOCOM and it looks pretty so
2661000	2662000	There you go
2662000	2666000	It will support I believe up to 32 players online
2666000	2670000	And yeah, it's just going to be
2670000	2672000	It's going to be very interesting
2672000	2677000	However, if you're not really into the multiplayer only SOCOM for PlayStation 3
2677000	2681000	There will be a single player game coming out later on
2681000	2683000	That will have online elements as well
2683000	2684000	So
2684000	2686000	I've never really gotten into this series
2686000	2687000	What is this all about?
2687000	2690000	It's just, you know, it's kind of like Ghost Recon
2690000	2692000	But, you know, sewing his own thing
2692000	2697000	It's, you know, Navy Seals military type first person shooter game
2697000	2699000	Before we get to the next story real quick
2699000	2700000	I just kind of want to pose this question
2700000	2702000	Because we kind of talked a little bit before
2702000	2704000	And I want to open this up to the chat as well
2704000	2707000	What kinds of stuff does Sony need right now?
2707000	2709000	Because we obviously have their Gamers' Day event
2709000	2711000	We have more news coming out of their Gamers' Day event
2711000	2715000	What sorts of announcements does Sony need to be making right now?
2715000	2717000	Or are they on the right track?
2717000	2719000	They need more releases
2719000	2722000	More content on their online service
2722000	2725000	If they can't do new games
2725000	2727000	Put out some demos or something
2727000	2730000	Or maybe some more, something that makes it interesting
2730000	2732000	Because right now they don't really have anything to download
2732000	2733000	It's been like one release a month
2733000	2735000	And it's been really slow
2735000	2738000	They need some more exclusives for sure
2738000	2741000	Because right now they're hurting
2741000	2743000	I mean, and I'm talking first party stuff
2743000	2745000	Not necessarily third party exclusives
2745000	2746000	They need more
2746000	2749000	Microsoft's kicking their ass as far as, you know, exclusives go
2749000	2752000	They've got at least one new exclusive every month
2752000	2753000	You know, one or two
2753000	2755000	And it's kind of hurting them
2755000	2758000	Because it's like, well, you know
2758000	2760000	There'll be a game that comes out on the 360
2760000	2762000	And then later on it'll come out on the Playstation 3
2762000	2763000	So you're actually
2763000	2767000	It's almost like that the Playstation 3 is Europe
2767000	2770000	The chat room is lighting up with comments on this one
2770000	2773000	Let me get their comments and I'll get to Dark Soccer's reaction if there is any
2773000	2775000	Looking at the chat room
2775000	2777000	Bandit says simply, a price cut
2777000	2779000	ActDef says more good games
2779000	2781000	Let's see
2781000	2785000	Jirardomo says hitstun Sony needs a game period
2785000	2788000	Because I guess hitstun said something about needing more games there
2788000	2789000	Let's see
2789000	2790000	Blaze says Sony needs a price cut
2790000	2791000	More download content
2791000	2792000	More big name titles
2792000	2796000	And needs to retain exclusives
2796000	2801000	Hitstun says actually Sony needs some Neo Geo CD backwards compatibility
2801000	2802000	Hell yeah
2802000	2803000	Let's see
2803000	2806000	Rossi says simply games
2806000	2807000	Who said
2807000	2808000	Somebody said something about more AAA titles
2808000	2811000	DustCap2 said more AAA titles ASAP
2811000	2815000	Kazurai says we're certainly not interested in gimmicks
2815000	2818000	I think that was GS68 changing their name there
2818000	2820000	So there you go
2820000	2822000	I think they need more triple X titles
2822000	2824000	That would work
2824000	2826000	They just need intelligence in there
2826000	2830000	Price cut seems to be the number one thing we're hearing in the chat room though
2830000	2831000	That's not likely
2831000	2833000	Chat.OrangeLaunchRadio.com
2833000	2834000	That's not likely to happen
2834000	2836000	It'll probably happen in the fall but it's not
2836000	2837000	I'd say Christmas
2837000	2839000	I think for Christmas to stay competitive I think you'll see it
2839000	2842000	I think they need more intelligence in their marketing
2842000	2846000	But I think the problem is I think Xbox will counter it with a price cut of their own
2846000	2851000	I'm just worried right now that they're getting hosed as far as exclusives go
2851000	2859000	Because it is Sony's fault because Microsoft actually is developing a lot of games in house for themselves
2859000	2861000	And they're not relying on third party exclusives
2861000	2862000	They've got their own
2862000	2867000	They've got themselves covered each month with a new game coming out from them
2867000	2871000	You know and you can't say that about Sony
2871000	2873000	I mean that's kind of the problem
2873000	2875000	It's like well we've got Halo 3
2875000	2877000	Well we've got Killzone 2 coming out
2877000	2878000	Okay great
2878000	2882000	I mean that's coming out eventually but that's way in the future
2882000	2884000	So I don't know
2884000	2885000	It's just kind of sad
2885000	2888000	I mean again you know I'm not trying to beat Sony when they're down or whatever
2888000	2890000	And I'm sure we've had enough of this on the program
2890000	2892000	Because I love Playstation 2
2892000	2894000	Such a great solid console
2894000	2896000	I'm still playing today
2896000	2897000	PS2 is awesome
2897000	2901000	You know I've been treating my Playstation 3 like my PSP
2901000	2904000	At one time I had quite a few games for it
2904000	2907000	I stopped playing them so I sold them back
2907000	2909000	And now I'm only playing like one game on it
2909000	2912000	Actually now on the Playstation 3 I'm not playing anything on it
2912000	2913000	I'm playing other systems
2913000	2916000	You know Motorstorm I got a little bored with it
2916000	2919000	And you know nothing new
2919000	2922000	I'm still playing lots and lots of Marvel Ultimate Alliance
2922000	2925000	Yeah but you're about ready to throw the six axis out the window right?
2925000	2927000	I know I'm ready to explode it into tiny bits
2927000	2930000	When I buy it I'm buying it on Xbox 360
2930000	2931000	Wow
2931000	2933000	Well you know I believe this week actually
2933000	2934000	I've got more controllers
2934000	2936000	I was going to say I think it was either this week or last week
2936000	2939000	That Marvel Ultimate Alliance Gold Edition came out for the 360
2939000	2944000	That's the other reasons I don't have to worry about spending the points downloading the characters I won
2944000	2949000	Because you know first thing I'm going to do is we can play through every level I can with Hawkeye
2949000	2951000	Our Sony fanboys can take comfort in this
2951000	2952000	I don't know how you guys feel
2952000	2955000	I'm the only one of the three of us that doesn't own a Playstation 3 yet
2955000	2956000	You're not missing it
2956000	2963000	I will go out and buy a Playstation 3 if Final Fantasy 13 stays exclusive to Sony
2963000	2966000	Because I'm that much a whore for the Final Fantasy series I will have to have it
2966000	2969000	And you know home looks cool and little big planet
2969000	2971000	You know those are all like extra yeas for me
2971000	2977000	With the things they want to do with Final Fantasy 13 I don't think there's processing wise a way it can be done on the other systems
2977000	2979000	And have it come out the way they want it to
2979000	2981000	So I'll be changing my tune single handedly by that game
2981000	2984000	I mean hell Final Fantasy 7 is the reason I bought a Playstation 1
2984000	2985000	Yep
2985000	2989000	So that ended up being an okay buy so hey why not
2989000	2991000	I need a new Jet Moto game
2991000	2992000	New Jet Moto
2992000	2994000	Less Sony bashing more stories
2994000	2996000	Let's throw a little bit of love Sony's way
2996000	3001000	Even so I'm not highly excited about this because I played the demo at E3 last year
3001000	3008000	But Heavenly Sword is they're stating that they may have multiplayer as downloadable content
3008000	3011000	Which is sort of interesting I guess
3011000	3021000	Still I mean they're saying that when they do it they want to make it you know full on multiplayer not just an afterthought
3021000	3026000	There's also rumors of you know a co-op and deathmatch but yeah
3026000	3032000	But the game right now though is from what I understand still on schedule for the September release
3032000	3033000	It looks awesome
3033000	3037000	Okay good good news there that's some very good news Heavenly Sword looks good
3037000	3039000	Yeah exactly they need to catch up with that September
3039000	3042000	It was like playing the singing level in Kingdom Hearts 2
3042000	3047000	Remember that was one small glimpse of the game it was like a year ago a lot could have changed
3047000	3049000	I hope I really hope
3049000	3053000	You know what's actually kind of exciting and this is kind of funny
3053000	3056000	Ratchet and Clank Tools of Destruction that game coming out
3056000	3061000	It's developed by the same people that did Resistance and they're actually using an improved version of the Resistance engine
3061000	3066000	It looks awesome so far it's very cinematic in the way that it plays and stuff
3066000	3070000	You know and I don't even I'm not really into that kind of you know Ratchet and Clank
3070000	3074000	But you know I'm almost kind of thinking to picking it up just because it looks awesome
3074000	3080000	Alright well sorry I promise that we wouldn't have much more negative Sony stuff
3080000	3089000	But I just can't not talk about this one and this would have to do with a recent PlayStation 3 promotion
3089000	3095000	And what happened is that there was an ad for
3095000	3100000	Okay basically it's on this Spanish website for Kia
3100000	3105000	Okay it was promoting the Kia car and I guess they're doing this promotion right now with the PlayStation
3105000	3111000	Because they're running this you know like I don't know maybe you enter to win a PlayStation 3 if you test drive one of their cars
3111000	3118000	But here's the thing in the ad they show the PlayStation 3 and then they show a screenshot on the TV
3118000	3125000	Of Project Gotham Racing 3 which isn't good because that's a Microsoft game
3125000	3132000	And is especially not good because this mistake has happened before on a different website
3132000	3134000	So wishful thinking maybe
3134000	3140000	Somebody needs to let the marketing department know that Project Gotham is not a PlayStation title
3140000	3141000	It gets even worse
3141000	3142000	Oh lord
3142000	3149000	Remember there's a Dutch magazine called Media Market that actually did a article on the PlayStation 3
3149000	3153000	And there's Project Gotham printed in their magazine
3153000	3161000	Damn somebody at Sony marketing needs to get fired right at Sony International Marketing
3161000	3167000	Well I think it's a lot of people because it's Kia but somebody I don't know where they're fucking up
3167000	3172000	It's just a bad mistake to make repeatedly like do it once and it's funny haha people forget
3172000	3179000	But do it now three times and people start to go what the hell seriously why can't people understand that Project Gotham is a Microsoft title
3179000	3184000	To be honest I'm going to get some hate mail for this one it's not even my favorite Microsoft racing title by far
3184000	3186000	You know there's just different types of titles
3186000	3188000	Do You For Speed Carbon was good
3188000	3189000	Really?
3189000	3190000	Yeah
3190000	3192000	I didn't play it very much I like Burnout that's my favorite I think is Burnout
3192000	3194000	Because I like to blow things up
3194000	3195000	There's a lot of need for speed
3195000	3196000	Burnout Paradise
3196000	3198000	Oh I fucking can't wait for new Burnout yay
3198000	3200000	I do like Burnout for exploding
3200000	3204000	Exactly Burnout has fire therefore it wins
3204000	3207000	I wish I could say the same for Full Auto although it wasn't bad sorry
3207000	3211000	So here's something else that's kind of funny a little story
3211000	3219000	Apparently there's some guy that uh some gamer that was kind of saying farewell to his Playstation 2
3219000	3222000	Because he has a brand new Playstation 3
3222000	3227000	I don't know why he decided to do this but he figured the best send off was to piss on it
3227000	3234000	And I guess he got drunk and you know pissed on his Playstation 2 and being the dumbass that he is left it plugged in
3234000	3236000	And basically knocked himself out after pissing on
3236000	3240000	Didn't mommy ever tell you don't piss on the electric fence
3240000	3244000	What was that episode of Beavis and Butthead where they were playing don't piss on the electric fence
3244000	3246000	No it was Ren and Stimpy
3246000	3248000	They were playing don't piss on the electric fence
3248000	3250000	Yeah there's a little song that goes with it I know
3250000	3251000	I remember the song
3251000	3255000	Dark Soccer you've had many consoles come and go throughout your house right?
3255000	3256000	Mostly just consoles come
3256000	3265000	Have you ever done this send off for a console have you ever you know pulled down your trousers and peed on a console to send it off
3265000	3267000	No because I'm not stupid
3267000	3272000	Especially if you're in your house why would you piss on it in your own house you stupid moron
3272000	3274000	God I'm gonna piss on it
3274000	3280000	You know usually when they break we gut them and try to do something neat with the husks
3280000	3286000	Seriously haven't you been paying attention to the internet the thing to do with consoles is to slam them with a sledgehammer
3286000	3288000	Put it on YouTube
3288000	3296000	And the best way to do that is to play the music from what was that scene in Office Space and recreate it out in the field
3296000	3298000	Oh with the copier yeah that was a good time
3298000	3309000	So anyway whenever we hear stories about dumbasses like this one it can make us feel anything else but anger and you know what that means boys and girls
3309000	3327000	N.M. 64 says Rob Roberts remember it's harder for females not really I mean you know she could take a dookie on it if she wanted to
3327000	3330000	Anyway dark soccer your F.U. of the week please
3330000	3342000	It goes to you I was going to say F.U. to the Pollen and Dixon for making me all stuffed up and getting all over my car
3342000	3347000	But no F.U. to Rob because you've never had to go out in the wild
3347000	3351000	You don't know that I went camping once
3351000	3357000	But you've never had well okay you've never been a woman going to the bathroom in the wild
3357000	3361000	Just squat behind a tree what's wrong with that
