start	end	text
7937000	7950000	Apparently, there was some talk about what's going on, and this was during a giant bomb livestream that was going on where Phil Spencer was on, talking about Microsoft kinda going back into the, growing, I guess, in the PC gaming space.
7950000	7957000	And they actually talked about Steam, which is interesting because Windows typically has tried to push their own platform, right?
7957000	7969000	So Phil Spencer did comment on this, and I gotta say, Phil Spencer does do a really good job handling the press and the media and kinda showing that he is a gamer that kinda gets it, unlike the guy before him.
7969000	7978000	But anyway, Phil Spencer did mention, I look at Steam today, it's on an incredible growth trajectory. It's a massive force in gaming, a positive force.
7978000	7983000	I think it will be bigger a year from now than it is today, and five years later it will still be bigger again.
7983000	7990000	I look at Valve as an important independent software vendor for us on Windows. They are a critical part of gaming success on Windows.
7990000	7998000	I don't think Valve's hurt by not having our first party games in their store right now. They're doing well. We will ship games on Steam again.
7998000	8003000	Hmm. And then he actually went on to say, talk about some of the shortcomings of the Windows Store.
8003000	8010000	They all haven't gone swimmingly. Some of them have gone well. Forza 6, Apex did well. Quantum Break wasn't our best PC release.
8010000	8015000	Killer Instinct did well on PC. Gears of War Ultimate Edition was okay. We definitely learned there.
8015000	8021000	And then one more comment on Steam here. There's gonna be areas where we cooperate and there's gonna be areas where we compete.
8021000	8025000	The end result is better for gamers. Ain't that the truth?
8025000	8037000	I like hearing Phil Spencer and hearing him talk. Even when I don't always agree with what Microsoft does, I think it's in a much better place now under Phil Spencer than it was previously.
8037000	8049000	Alright, let's get to the FUs of the week. Since I've messed up the flow of this show so bad, what better way to get things back on track than releasing a little angst?
8049000	8074000	FU to trying hard. Sometimes you try and it's just not good enough. So, fuck it.
8075000	8077000	Um, Loki.
8077000	8087000	Um, FU to the dinner place I went to, the Tofu. I don't even know, some Tofu place. Tofu is in the title. I should have really just said, uh, nope. Not going there.
8087000	8089000	Loki, what the hell were you thinking?
8089000	8090000	I don't know what I was thinking.
8090000	8091000	At least you got a Slurpee.
8091000	8096000	I did get a Slurpee. That was the best part. I should get another Slurpee on my way home. That's really shit.
8096000	8099000	They have banana flavor. That's my fucking favorite.
8099000	8103000	Uh, I don't remember a banana with cherry coke.
8103000	8107000	If you see banana, I want a text message. Banana's my favorite.
8107000	8109000	Blue raspberry. They may have banana.
8109000	8112000	Alright. That's it.
8112000	8117000	Uh, Misty. Since you're here, join in. FU. What do you want to say FU to?
8117000	8122000	I will agree with Jameis somewhat, especially when it comes to people's opinions of what you're doing.
8122000	8128000	Just fuck it. Do what you're going to do as long as it's not going to screw your health over or something like that.
8128000	8135000	Do whatever you- or infringing on somebody else. Do whatever the hell you want to do unless you're going to, you know, piss off somebody else.
8135000	8136000	Basically.
8136000	8141000	Alright. Uh, and then my FU of the week goes to, I think just kind of like, stress.
8141000	8145000	I just, oh my god, like, every little thing has been taking me off today.
8145000	8154000	I don't know if I'm just, like, having, um, the 90 day male PMS thing or what it is, but I swear to god, every little thing's been taking me off today.
8154000	8158000	And it's just been non-stop, so I think it's just all stress. So FU distress.
8158000	8164000	Alright, uh, just a couple more stories for you guys, and we're going to get to the Skype line over at 1877 Game OLR.
8164000	8167000	Our username on Skype, OrangeLoungeRadio.
8167000	8170000	Uh, but before we get there, just a couple quick stories. Loki.
8170000	8177000	Alright, um, so, you may remember there was that game, Allison Rowe, we talked about how it was cancelled.
8177000	8182000	Um, you know, basically it was like this, almost like an answer to PT.
8182000	8187000	However, you know, they were sitting, they were going to discuss why it was cancelled.
8187000	8191000	It doesn't really answer anything. Basically, their comment was, you know,
8191000	8202000	after long consideration between Team17 and ourselves, we have reached a mutual agreement to end our collaboration on publishing Allison Rowe under Team17's games label.
8202000	8209000	Um, sometimes things pan out differently than expected as game development and publishing have so many layers of complexity.
8210000	8217000	We'd like to especially thank everyone for their support throughout, and this has and always will be appreciated.
8219000	8221000	Okay, then what the hell does that mean?
8221000	8228000	What the hell kind of explanation was that? Sometimes mommy and daddy get very angry at each other and say things they don't mean.
8228000	8232000	Like, what the hell kind of explanation was that? That was weird.
8232000	8239000	Yeah, so it's like, uh, does that mean you're going to still make it?
8239000	8245000	I'm worried Resident Evil 7's not going to come out because it's too close to PT and that fucking game is cursed.
8245000	8246000	Swear to God.
8246000	8250000	Yeah, Dark Tetsuya in chat says, well, at least we have Resident Evil 7 to look forward to.
8250000	8253000	Look out. Be careful.
8254000	8262000	Well, something you do have to look forward to, if nothing else, is the console release of Stardew Valley.
8262000	8267000	That game, I still don't understand why Dark Sakura isn't playing because I do think she'd be a big fan of this, but we'll see.
8267000	8271000	Stardew Valley, I was waiting for a witty retort.
8271000	8277000	Stardew Valley was confirmed during E3 week. It's not like the game was there, but it was confirmed during E3 week.
8277000	8282000	Well, actually, I did see it at one of the press conferences, so maybe they had it on one of the kiosks on the show floor.
8282000	8285000	It was listed, it was under the Xbox Indie Games, I want to say.
8285000	8286000	Ah.
8286000	8290000	They showed that, because they also showed, uh, um, was it We Happy Few?
8290000	8300000	Yeah. So, Stardew Valley was confirmed. It will be coming to the Xbox One, the PlayStation 4, and the Wii U.
8300000	8311000	So, Stardew Valley will be getting some help with the ports from Chucklefish and Sick Head Games, and the game is expected to be out in the winter holiday season, although they don't say a specific date.
8311000	8315000	But, the author did say in his blog post that he posted on this,
8315000	8322000	I'm also excited about the possibility of utilizing special console features like the Wii U's second screen.
8322000	8329000	I hope he, this is one of those games that would really benefit with the whole, like, inventory management and stuff from a second screen,
8329000	8337000	so I really hope he's able to do what Minecraft could not do by actually implementing the second screen.
8337000	8340000	So, uh, Loki, have you checked out Stardew Valley at all?
8340000	8341000	Nope.
8341000	8342000	You really should. You guys are-
8342000	8343000	Nope.
8343000	8344000	Fail, fail, fail.
8344000	8351000	Okay, uh, well anyway, that's going to do it for the scripted news tonight, but it is about time for us to open up the Skype line.
8351000	8357000	That's right, it's that time of the show where we're going to take your calls on anything we've talked about tonight, or maybe something we missed.
8357000	8358000	I don't know.
8358000	8359000	Skype line is open now.
8359000	8363000	Orange Lounge Radio, all one word on Skype.
8363000	8367000	Please make sure you've tested your connection with Echo 123 before you give us a call.
8367000	8370000	That is Orange Lounge Radio, all one word on Skype.
8370000	8374000	And, well, it's lighting up already, so let's get to it.
8374000	8376000	Hello, you're on Orange Lounge Radio. Who's this?
8376000	8377000	It's Shane.
8377000	8379000	Well, hi, Shane, how are you?
8379000	8380000	I'm fine.
8380000	8383000	I feel like it's been a long time since we've heard from you. How's Ranger Pridecast going?
8383000	8387000	Uh, I'm sure it's okay. I haven't been on the last week, so.
8387000	8388000	Well, uh-
8388000	8391000	I need to mute my TV, because I don't want to hear me through the TV.
8391000	8395000	That's, yeah, you should probably, the first rule of calling into a radio show is to mute your radio.
8395000	8400000	I was busy playing Pokemon, so I didn't care to follow these rules.
8400000	8401000	That's no excuse.
8401000	8406000	And I know you were out of town last week, and I'd mentioned to the listeners, you unfortunately were in Orlan-
8406000	8413000	Well, I mean, you were in Orlando when everything happened there, but you were nowhere near that mess, thank heavens.
8413000	8421000	Yeah, three days of death is basically what I went into Orlando with, I guess, so it's not great.
8421000	8425000	Uh, yeah, there's not been a lot of good news coming out of Orlando, that's for sure.
8425000	8431000	But anyway, let's go on to happier things to take our mind off of all that craziness going on.
8431000	8433000	Video games, what'd you think of E3?
8433000	8437000	Um, you mean the Pokemon Sun and Moon show? It was pretty good.
8437000	8441000	So, let me guess, you called in tonight to talk about Pokemon Sun and Moon?
8441000	8443000	That is my first topic.
8443000	8446000	Alright, well, what would you like to say about Pokemon Sun and Moon?
8446000	8456000	Besides the fact that it looks amazing, I think that for the first time, probably since, I don't know, probably the first time period,
8456000	8467000	I think they're really doing a great job of making the entire game more accessible to people who are not as maybe into it.
8467000	8479000	And don't follow the sites to look up strategies for battling, or just have a very vague understanding of how Pokemon works.
8479000	8488000	I think this entry is really allowing a newer, bigger audience to come in and join the fun that we all have.
8488000	8491000	Why is that? What is it about this game compared to the others?
8492000	8503000	Well, originally, for the first six generations, if you are fighting a Pokemon, you know, you kind of should have an understanding of some sort of like, you know, the weaknesses to the elements.
8503000	8508000	Like if you are a water type Pokemon that you're using, it's going to be strong against fire.
8508000	8519000	Well, that's basically all you kind of know, unless you're like constantly looking up things on the internet about, you know, each move and all this.
8519000	8526000	Well, now what they're doing is not only, you know, if you look that up, you'll know that information.
8526000	8534000	But if you battle, say, like if I'm Popplio, because that's what I'm going to be is Popplio, and I'm fighting Litten.
8534000	8537000	Well, I know that my water attacks can be strong against it.
8537000	8547000	But now when I select that move after the first time I've battled against Litten, I will see on that move, it'll say it is super effective.
8547000	8553000	So no longer will you have to go back and forth trying to remember things like that. It's going to list it for you.
8553000	8559000	And another great thing is during the stream, Popplio leveled up and learned a fairy move.
8559000	8563000	Well, that's a newer, you know, typing that came out last generation.
8563000	8568000	And it's not good against fire. And it showed right there underneath it, not very effective.
8568000	8574000	So you know what moves are going to be, you know, strong against the Pokemon that you're fighting or weak.
8574000	8577000	They probably just figure everyone's going on the internet anyway.
8577000	8584000	Well, yeah, probably. But if you don't have access to the internet, what if you're on like a plane ride and you forget?
8584000	8593000	Another great thing that they've kind of streamlined is the fact that during the battles, without having to go through extra screens,
8593000	8598000	you can select each move and find out exactly how strong it is and what it does.
8598000	8605000	And they have a way instead of writing down on paper that I see all the time when I watch the video game tournaments,
8605000	8610000	they have a little icon of your character on the bottom screen that you touch.
8610000	8616000	And if you have any status effects, like if your speed has been lowered or if you gained attack power, it's going to show it there.
8616000	8625000	So that's brand new as well. And it just looks gorgeous. And I love all the new Pokemon and I want to collect them all.
8625000	8629000	Even the basic Pokemon that are in the game you're excited about?
8629000	8636000	Yeah, like, like Yungoos and the little, like, Donald Trump looking mongoose there.
8636000	8642000	No, okay, there's some, like, there's some parody Twitter account out there that already followed me.
8642000	8651000	That has to be a listener of this show because they tweeted something about it, but it's actually like a Yungoos that is like parodying Trump.
8651000	8655000	Yeah, I just blocked it. I didn't really care. That's annoying.
8655000	8659000	You already blocked, but it's Pokemon, Shane. Why did you block it?
8659000	8666000	If you're going to be annoying with Pokemon, I don't like you. So I'm not going to listen to you or talk to you.
8666000	8667000	You're so mean.
8667000	8676000	I just love that the 40 minute demo, the person playing had Popplio as his Pokemon. Like, this is, this is made for me.
8676000	8678000	I love it. It's so cute.
8678000	8681000	What about, um, what about Pokemon Go? How are you feeling about that?
8681000	8687000	Um, I'm fine with it. I mean, I'm still not in the beta, whatever. I don't care anymore.
8687000	8694000	I preordered my little Go attachment because I just feel like that's going to be beneficial.
8694000	8705000	And I'm interested in seeing how it's going to connect to Sun and Moon because during that presentation, they did say that there is planned connectivity somewhere down the line.
8705000	8711000	And it is not your Pokemon going between the two games. Get that fanfic out of your head right now because the two games...
8711000	8714000	I wouldn't want it. It's just Gen 1 Pokemon cares about them.
8714000	8721000	It's stuff I've been seeing on the Pokemon Go Reddit and stuff is just like, get that fanfic out of your head that is not happening because that would just, that's way too imbalanced.
8721000	8730000	The Pokemon in Pokemon Go, so I've heard, are a lot different than the Pokemon in the games. Like, as far as stats go and how you level them and all that stuff.
8731000	8736000	Yeah, I wouldn't even see a point in that to be quite honest. If it unlocks random little things, that's cool.
8736000	8746000	Yeah, that would be cool. Items or a secret little lair or something. I don't know. Something silly. Maybe like, Flare for your Pokemon Go profile or something. Who knows?
8746000	8747000	Yeah, that works.
8747000	8750000	Was that it or was there something else you wanted to talk about?
8750000	8760000	So the other thing is gaming related but not video game related. While I was gone, I played in this thing called an escape room.
8760000	8769000	I've never even really heard of them before but apparently they're all over the place and you have 60 minutes, you're locked in a room and you solve puzzles to get out.
8769000	8774000	And it is literally the coolest thing I've ever done.
8774000	8775000	Really?
8775000	8782000	I had such a good time. If you like puzzles and thinking, then you're just going to get a huge kick out of it.
8782000	8792000	The first one that me and my boyfriend did, we were in an art gallery, this very small art gallery and the theme was a heist.
8792000	8798000	And somebody had stolen a painting and we had to, it was currently being hidden there and we had to get it and get out.
8799000	8806000	So we're in this little room, there's just like six paintings on the wall and a barred door and we're like, we don't, we didn't really know what to do.
8806000	8812000	And time's ticking away and then you start like reading the placards and they lead to clues that are in the painting, like really small numbers.
8812000	8819000	At some point, we actually unlock the door next to us, which opens up into another room with all these different things.
8819000	8824000	And the coolest part of that one that we played, we played too, because we had so much fun the first time.
8824000	8829000	But the coolest part of that one was we had this number and we didn't know what to do with it.
8829000	8833000	There were no more locks that we could like twist to, you know, put the number in.
8833000	8843000	But he found this keypad on this bookcase and he put the number in the keypad and we hear a click and then we could slide the entire bookcase.
8843000	8848000	And this bookcase is big. It's like takes up half a wall, but we slid it over into another room with bars.
8848000	8853000	And that was so awesome. Like it just blew my mind that things like this exist.
8853000	8858000	Yeah. And actually a lot of people in chat are like, oh yeah, they got one in my town or what have you.
8858000	8862000	And yeah, these things are kind of like a trend across America right now. They're all over. I haven't done one myself yet.
8862000	8868000	And, you know, it's kind of one of those things I always saw and kind of went, oh, that could either be like really awesome or really freaking lame.
8868000	8875000	But you were, you were really excited about that. I mean, you said it's the coolest thing you've ever done and you hang out with me a lot and I'm really cool.
8875000	8878000	So this is cooler than that. Wow.
8878000	8882000	I just, I don't know what to say to that. That's a big ego.
8882000	8888000	Bobby Black Wolf in chat says they had one of these in the middle of the gaming floor at MomoCon.
8888000	8891000	So now this is the type of thing they bring to conventions and stuff, too.
8891000	8896000	I don't see that's that's my problem, though, is that this one is the first one I did.
8896000	8902000	And what I liked so much about it was that we were not even that's an escape room game.
8902000	8907000	Our rooms had multiple rooms attached to them to, you know, to go through.
8907000	8914000	The second one we did, it was me and Bobby and then these three other people, this family.
8914000	8922000	And the thing was like we had to escape from prison. So me and Bobby are in a jail cell and there's a wall dividing us and the other team who are also in a jail cell.
8922000	8929000	We had to work to get out of that to get into a boiler room to slide down a freaking slide into the warden's office.
8929000	8936000	So it's it's not just one room, but all these other places I'm hearing are like, oh, yeah, we just stick you in a room and you have to figure out all these puzzles.
8937000	8942000	I don't know. That doesn't feel like as cool to me. Well, I wanted to expand.
8942000	8947000	Orlando is the theme park capital of the world, so they kind of have to step their game up. You know what I mean?
8947000	8952000	Well, and this is in other places. I do have a couple in Sacramento, actually.
8952000	8957000	Yeah, there are some I know there's one right by the sushi place that that Shane and I've gone to several times.
8957000	8965000	There's one like literally right in that same shopping center. And then I imagine like didn't this whole trend start in the Bay Area in like San Francisco?
8965000	8969000	So I imagine San Francisco has to have some bang up escape rooms.
8969000	8976000	There's actually because I looked on Yelp last night or Jim did Flaco Jones.
8976000	8985000	And there's one here in my town of Elk Grove. And it's got the highest ratings of like all the local ones, all Sacramento, Roseville, all the our entire area.
8985000	8989000	Interesting. So, yeah, Bobby, I need to do it.
8989000	8995000	Bobby saying there's two of them in Atlanta. Oh, when I come out for Dragon Con, Bobby, I'll be fine, wouldn't it?
8995000	9002000	You know, you say that and I say that because I think it's really fun. But the problem is with these games is you have to have the right temperament for it.
9002000	9008000	You can't get frustrated easily. Are you saying are you saying that I might snap at Bobby Black?
9008000	9013000	Oh, I said I said that to you already. You'd snap at anybody. I don't know how you would do in these.
9013000	9022000	And like, as I found out when we were working with our team, if you've got somebody who's kind of bossy and thinks that they need to take charge, that's a hindrance as well.
9022000	9026000	I would never crazy. I would never do that.
9026000	9032000	All right. If that's what you think, we'll go with that, even though we know better.
9032000	9037000	All right. So I know the escape room concept is kind of interesting. It's like IRL type of stuff.
9037000	9043000	It's like video games IRL and a lot of I think I haven't done like phone apps and stuff to try to capture some of that same magic.
9043000	9047000	I'm sure it's not the same thing, though, because you're not like sliding an actual bookcase across the wall and all that stuff.
9047000	9055000	Yeah, I think there are things like that. And I you know, maybe I try them because I like figuring out puzzles so much.
9055000	9065000	Oh, one of the other cool things about the one that we did with the wall that slid, we also had to put together a puzzle randomly, but we couldn't find all the pieces.
9065000	9072000	And it actually like when you put it all together, it was like a riddle. So we had to figure out that puzzle without having all the pieces.
9072000	9077000	I was like, oh, God. But I got out because we beat we beat both of them, which was awesome.
9077000	9082000	So, yeah, Bobby Black Wolf in chat says escape rooms are the new team building exercise.
9082000	9087000	My girlfriend is doing one with her company in a few weeks. I've heard of that being used in like a corporate world, too.
9087000	9093000	How do they get you in the room? Do they say, here's this jail cell for you to walk into? Like what? How do they get you in there?
9093000	9104000	Well, the one that we went to, I see you're going in of your own volition, but it's just like a long hallway and all the doors on the outside.
9104000	9109000	They just look normal, look like normal doors. So they're just like, OK, you go in this room for the jail.
9109000	9114000	And they told us to go in one room and the other team or the other people go in the other room and then you get in there.
9114000	9122000	It's like, oh, this looks like, you know, a really run down prison cell. They did a really good job.
9122000	9127000	Interesting. OK. All right. All right. Well, I'm going to let you go so we can try to get more calls.
9127000	9136000	But thanks for the call. That was. Yeah, I feel like we do need to do an escape room, but I feel like it's only fun if I'm allowed to somehow livestream it or broadcast it.
9136000	9141000	But I feel like you're never going to be able to do one because when you're in there, they don't let you use your phone at all.
9141000	9146000	Yeah, I'm sure. I'm sure they don't like it's it's probably they probably watch you, too, huh?
9146000	9153000	Oh, yeah, yeah, because I actually tonight I called the one here in Elk Grove and I just asked some questions about it, like some escape rooms.
9153000	9159000	I guess they have the people like I don't know if you want to call them like monitors or whatever, but the person running the game for you.
9159000	9167000	Sometimes they're in the room, which I think is weird and awkward. But like the one I did and apparently this one here, they actually have cameras in there that they watch you from.
9167000	9174000	We didn't want you to wreck their shit either, you know. So, yeah, but they also can help you out with clues, like if you're stuck, they can see why you're stuck and give you a clue.
9174000	9181000	Interesting. Huh. All right. Well, I'm sure it's only a matter of time before I get convinced to go to one of these.
9181000	9184000	And I'm sure you'll call right back to tell everybody what a horrible bitch I was.
9184000	9188000	Oh, yeah. I'll be like, we didn't beat it because Rob threw a fit.
9188000	9192000	I just sat in the middle of the floor and refused to keep going.
9192000	9195000	Just lock me in here forever, you son of a bitch.
9195000	9199000	No, you'll just pout in the corner because nobody's listening to you.
9200000	9204000	Oh, Rob, I don't know. I'd rather do an escape room with like you than some random mofo.
9204000	9207000	That's true. Who do you want, me or a random mofo?
9207000	9216000	I don't know, because when we had the parents that were older and the girl with the broken leg, which was not helpful when we had to slide down a slide.
9216000	9218000	Don't be inconsiderate.
9218000	9221000	Well, she was inconsiderate to break her leg.
9222000	9228000	Like, they were a hindrance. They were an extra layer of difficulty on top of the difficulty we already had to work with.
9228000	9233000	So, you'd just be like, you'd up the difficulty by five because you were there.
9233000	9238000	Alright, I'm going to let you go so we can get more calls. We'll let people know how it goes. Alright, bye.
9238000	9239000	Bye.
