start	end	text
0	3000	Orange, Lounge, Radio
7000	13000	Here's your hosts, DarkSakura, Skie, and Loki!
14000	25000	Tonight, another E3 is behind us, and from Scorpio to God of War, and Breath of the Wild to Mobile Pokemon, there's a lot to discuss this week on the show where every gamer has a voice.
25000	30000	Orange, Lounge, Radio
31000	41000	Hello my friends out there on the internet, and welcome back to another week of the show where every gamer has a voice. It is Orange, Lounge, Radio, live tonight with episode number 646.
42000	49000	It's the same forwards and backwards for this June the 19th, 2016. This is the show after E3.
49000	56000	We're going to talk about video games, gaming culture, and the gamer lifestyle, probably a lot of the stuff that happened this week, because it's kind of a big week for games.
57000	68000	My name is Rob Roberts, based out of lovely Studio N7 here in Sacramento, California. You can follow me on Twitter, at Skie, S-K-I-E, and joining me, as always, my amazing co-hosts.
69000	74000	Say hello over there to this lovely lady who I went on a hot date with the other night. It's DarkSakura, Jamie Summers.
74000	75000	Hey.
75000	78000	Hey, hot date, because it's hot in Sacramento. It's always hot here.
78000	79000	It is.
79000	90000	So DarkSakura and I went and saw the Warcraft movie, which is actually kind of noteworthy because I never go to movies anymore, but Jamie was like, Rob, movie. Rob, movie.
90000	93000	He was like, no one wants to see Warcraft with me. Rob was like, I'll go.
94000	99000	Yeah, I'll go because Alan usually works weeknights, so we went.
99000	100000	We had a fun time.
100000	107000	Yeah, I got to say, you know, because we're going to get into a lot of E3 news tonight, and I know Warcraft is so last week, now that Finding Dory's out.
108000	113000	But I actually, like, the movie was better than I thought it would be, honestly.
114000	117000	It was really good if you know the lore.
118000	123000	Yeah, if you're a gamer. I would say even if you're at least a gamer and can kind of understand video game logic a little bit.
124000	127000	Here's your quest. Go to Dalaran. Here's your quest. Go back to here.
127000	133000	They definitely made a movie for Warcraft fans, which is why it's tanking in the US.
134000	138000	They changed some very important things in the first war.
139000	142000	I'm okay with the little changes. Things are going to happen for the movie's sake.
143000	148000	Well, plus, like, Garona in the movie was half orc, half human, and she's not that in the game.
149000	153000	But when the first game came out, she thought she was half orc, half human.
153000	156000	Spoiler alert. Well, the games are how old at this point.
157000	159000	Well, yeah, and it turns out she's half draenei instead.
160000	161000	And we'll join the movie!
162000	163000	Yeah, for like two seconds.
164000	165000	Well, yeah, and then they... I'm sorry.
168000	169000	They were in the movie.
170000	171000	They'll be in the sequel, you know it.
172000	177000	I was just surprised there were no night elves. I mean, they were kind of there.
178000	179000	They had high elves.
180000	181000	They had high elves.
181000	184000	But Alan was like, well, they didn't go to the other continent.
185000	189000	But there were some fan service-y things I was hoping to see that I didn't see.
190000	192000	But honestly, I'm nitpicking. Overall, I had a good time.
193000	194000	It was a fun popcorn flick.
195000	197000	What, a game that takes a couple weeks to play?
198000	199000	Yeah.
199000	200000	Into a couple hours.
201000	206000	If you're interested in Warcraft, I really think the movie is worth seeing. It really wasn't bad.
206000	214000	And even though, yes, I know I said it's tanking in the US, apparently it's doing phenomenal overseas, especially China, which is very interesting.
215000	219000	Because, you know, there's a lot of people in China, so if they're making a movie that's doing well over there,
220000	228000	perhaps we could see a sequel that is more Chinese-funded and possibly even directed, made, who knows? We'll see.
229000	235000	But I know the maker of the movie, Duncan Jones, said he wanted to do the Lich King story, which I would be all about that.
236000	242000	I would totally be down for that. That would be tremendous. Especially if we get crazy-ass Sylvanas.
243000	244000	That would make me extra happy.
245000	252000	That would be great. So, anyway, there you go. There's our hyper-review of Warcraft from our hot date on Thursday night.
253000	258000	Also say hello over there. Sadly, turn down our hot date, but that's okay. Say hello to Techmaster Loki.
259000	260000	I don't believe I was ever asked to go on the hot date.
261000	262000	You weren't!
263000	265000	You wouldn't have gone. I think we just knew you wouldn't go.
266000	271000	It's a weeknight, and you have the parental duties and all that, and B, it's Warcraft. You don't care about Warcraft.
272000	274000	See? See, I know Loki. I know Loki.
275000	276000	How are you otherwise, though? How was your week?
277000	278000	Eh, it was alright.
279000	283000	Happy Father's Day to you and, of course, all our daddy gamers that are out there listening,
284000	290000	including father figures, fathers of pets, mothers who also have to be fathers, all that stuff. Hope everybody's having a good day.
291000	292000	Are you having a good Father's Day?
293000	294000	Man, it's alright.
294000	295000	Yeah, it's okay. Does it suck?
296000	298000	Nah, I wouldn't go that far.
300000	306000	Start off with being woken up by a child who wanted to immediately sip, you know, where I was laying. I was like, ugh.
307000	310000	I'm like, get up, daddy! Get up! I'm like, no!
311000	315000	And then it's like, ah, the fridge is leaking. And I'm like, ugh.
316000	317000	And then...
318000	319000	Isn't this the one day a year when you're supposed to be allowed to sleep in?
319000	320000	It's like, I wanna go get shoes.
321000	327000	And then we had to go to the Palladio and I had to watch the kids while she picked out two pairs of shoes and some boutique.
328000	329000	Did you get shoes?
330000	331000	No, I didn't get fucking shoes.
332000	333000	That's not fair.
334000	337000	I didn't get shit. And then, I mean, I guess we went to Red Robin and she paid for lunch.
338000	344000	But technically my burger is free because I am one of those Red Robin royalty members so my burger was comped because I just happened to be on the tenth burger.
345000	348000	Okay, but Red Robin is like on the Loki list of fine dining restaurants.
349000	352000	It happened to be convenient nearby and it had something the kids would...
353000	357000	Like, she was like saying, well, if I was to pick a restaurant, I'd probably go to Land Ocean.
358000	363000	I'm like, can you imagine our kids at fucking Land Ocean, which is like, it's a seafood, surf and turf, like, restaurant thing.
364000	366000	It's like, you know, much higher end, way more...
367000	368000	Take them to Flame and Fire.
369000	372000	I'm like, no, that's not gonna fucking happen. We'll just go to Red Robin because they can get fucking grilled cheese there and that's it.
373000	374000	That's why I picked that restaurant, it's for the kids.
375000	376000	Alright.
376000	379000	And then I went to Random Restaurant for dinner, which, eh, I don't know.
380000	384000	They didn't speak English. Half of my dinner is, I don't know, some garbage.
385000	387000	And then the other half is actual edible, so...
388000	391000	I tried to warn you that, well, I warned you after you already went there.
392000	393000	That was in hindsight.
394000	396000	Yeah, I didn't have the greatest experience when I went there either, but anyway.
397000	399000	Well, I hope they're doing something nice for you for when you get home.
400000	402000	But anyhow, let's say hello as well.
402000	407000	We have a special guest in the studio joining us tonight, coming from a long way away to be on our show this week.
408000	409000	Say hello, everybody, to Misty.
410000	411000	Hello.
412000	414000	Hi, Misty. Long time OLR listener and fan.
415000	418000	I feel weird calling you a fan because, you know, we know each other well enough now, we're just friends.
419000	421000	But, you know, that's, I guess, how we got to know each other as you were listening to the show.
422000	423000	How long have you been listening to OLR?
424000	425000	2004.
426000	427000	Is your mic on, hun?
428000	429000	Make sure the switch is on over there on that mic.
429000	435000	Because for some reason we're not picking you up, but maybe we just don't have the, try again there.
436000	437000	How long have you been listening to OLR?
438000	440000	Technical difficulties, everybody.
441000	443000	She doesn't do the radio stuff very often.
444000	445000	So, actually, there is no switch on this mic.
446000	447000	Did the damn thing just cut out?
448000	450000	All right, well, that's what happens with live radio, is it?
451000	452000	Sometimes you have to switch things on the fly.
453000	454000	I have a backup mic.
454000	458000	I might. Thankfully, when the video game bang guys were here, we had to hook up like six mics.
459000	462000	So, we're good now. Try that one, Misty. How long have you been listening to OLR?
463000	464000	April 2004.
465000	468000	What the hell? That one's not picking her. Oh, because that one is still muted.
469000	471000	Okay, try one more time, please.
472000	473000	April 2004.
474000	475000	Thank God, there she is. There you go.
476000	478000	And still listening today, and here she is live.
479000	481000	You're a big music game fan, right?
482000	483000	Of course.
484000	488000	As part of your adventure out here to the West Coast, you went to round one in San Jose yesterday, right?
489000	490000	That's right. How'd that go?
491000	495000	Not bad. I mainly stuck to the Supernova 2 machine, but I did play some Crossbeats.
496000	499000	I sucked as much as usual at 2DX.
500000	503000	Gotcha. So, you got to play a little bit of this and a little bit of that.
504000	509000	Did you see all those zillions of crane machines that they had?
510000	513000	I know you're a big fan of Pikachu. Did they have Pikachu in some of the crane games?
514000	519000	Not that I recall seeing. I remember seeing Mario and Luigi, the little ones in one of them.
520000	522000	Oh God, those things are cute. I did see those.
523000	530000	Awesome. Well, I'm glad you could be here tonight, especially the week before our big 14th birthday, if you can believe it.
531000	532000	Would you buy us for our birthday?
534000	535000	I'm just kidding. I'm just putting it on the spot.
536000	537000	I was going to mention, there was one more thing I just remembered.
538000	539000	Yeah.
539000	544000	My dad had called me for Father's Day. He wanted to plan something, so we're not actually doing Father's Day this weekend.
545000	551000	We're doing Father's Day July 2nd, but he's like, it's a surprise. I'm not going to tell you what it is until later.
552000	560000	And then a couple days later, he told me, he's like, okay, so we're going to go to this place and race exotic sports cars.
561000	570000	So that's pretty awesome. So we're going to be taking, I would give a choice of like a Lamborghini or like, I remember the other, like some other kind of car.
571000	572000	I just saw Lamborghini. I was like, okay, cool.
573000	574000	That'll be fun.
575000	576000	And racing it around track.
577000	582000	You know, actually that made me think of the show yesterday, Misty and I were on a trip and as we were coming home, I was trying to point out to her, I was like, oh, look, look, look over there on the side of the road.
583000	586000	That's the indoor skiving place. That's the place I was talking about on OLR.
587000	589000	Misty was like, what place? I don't think I heard that episode.
590000	591000	You're just not caught up on the backlog yet.
592000	594000	Well to be fair, it was last week's show. You were mentioning it, right?
595000	596000	Oh, was it last week's show? Maybe. I don't know.
597000	602000	Keep in mind, approximately the time the show was starting, that's when I was heading out to St. Louis on the train.
603000	606000	Gotcha. Nowhere. I'm just giving you crap. It's quite all right.
607000	613000	Whenever I hear from people that are like, hey, glad to hear you're doing well. You know, I haven't listened to the show in a long time.
614000	618000	I'm like, it's okay. I don't like take it personally. It's a big commitment to be here for a few hours.
618000	620000	But we appreciate the commitment of those of you that are here for the show.
621000	628000	Those of you, especially live in our chat room over at live.vognetwork.com, because we do tape live every Sunday night at the Voice Geeks Network.
629000	633000	vognetwork.com, 6 o'clock Pacific and 9 o'clock Eastern, right after the Bobby Black Wolf show.
634000	636000	Some people making fun of the microphone issues that we were having a moment ago.
637000	641000	Stoppy in chat saying, this is false advertising. I thought every gamer has a voice here.
642000	645000	Look, sometimes it just takes a minute to get it all wired up.
645000	648000	Every gamer does have a voice. Just some of those voices can't be picked up by the microphone.
649000	656000	Exactly. That's exactly right. Some of them are broken due to technical difficulties. Would you expect anything less here on OLR?
657000	663000	And I also admit I'm not, I'm the only one that does not have a laptop in this room. How many people are all OMG-ed when she's here?
664000	666000	Wait a minute, wait a minute. I don't have a laptop either. I have a desktop.
667000	668000	Well, you have a computer screen, period.
668000	677000	I'm not, I got to admit, I'm not seeing a lot of stuff. I did, I do see SSG100Matt saying, confirmed, Misty carries an EMP device that kills mics on the fly.
678000	680000	So you're just being accused of causing the problems in chat.
681000	683000	I ride trains. I can't afford that stuff.
684000	688000	Plus you, you were here on the 10th anniversary episode. Is that the last time? That was the last time you were here, right?
689000	694000	Yes. 10th anniversary episode. This was a while ago. I don't, don't you like Studio N7? Isn't this a nice upgrade from where we were at before?
695000	697000	It is. Yes. It's very lovely.
698000	707000	Let's see. Also in chat over at live.vognetwork.com, SSG100Matt mentioning Loki's Father's Day should be like the God of War trailer, except they're hunting bacon.
708000	711000	I might want to hunt something. Just go to the store and buy it.
712000	721000	His mouth is full of meat, which is like a radio sin as he's trying to talk, defending the bacon thing.
721000	737000	All right. Anyway, uh, Misty, did you, did you get, I know you were on your way out here, but did you have time to get caught up in all the E3 hype or, or do you, I kind of get the sense you don't necessarily have to play the latest and greatest video games to be the gaming enthusiast you are.
738000	743000	You kind of have your own, like either, you know, games that are a couple of years old, like Pokemons or whatever that you're into.
744000	747000	I saw you yesterday while we were coming back. You were, you were rocking the Pokemon yellow.
748000	750000	And I was like, all right, this is old school. I liked it. I like it.
751000	756000	Well, I do have the, the Pikachu 3DS with the Pikachu theme. So I was like, complete the trifecta and get yellow.
757000	770000	You need a Pikachu invention is what you need over there, an intervention. That's okay. So what kind of games do you usually play like these days? Do you, do you tend to, do you play any of the latest and greatest stuff or do you more like to play the classics?
771000	772000	More classic stuff.
772000	784000	Yeah. Yeah. As, as an example, some of the time while I was on the train, I've got my uncle ditched a Vista era laptop on me, so I've got the step mania 3.9 running on it.
785000	792000	There you go. Now I know you love your music games because not only did you have to go all the way to round one, but here you are rocking step mania on the train. What is your favorite music game of all time?
793000	799000	I would say, I would say DDR if I had to pick a specific mix fifth because that was my new mix.
799000	808000	Okay. All right. You know what? Hey, this show would not exist if it wasn't for DDR cause that's how Dark Soccer Loki and I all met as I'm sure many of you know. So I'm very thankful to that.
809000	817000	What's your favorite DDR song ever? You can only pick one. If you say two, I will turn off that mic permanently.
820000	823000	I can't, I can't really choose. I am a labor after all.
825000	827000	Fine. Try. What's the first one that comes to your head?
830000	832000	I'm putting her on the spot people.
833000	834000	Let them move.
835000	838000	Yeah. Silence means let them move. Love this feeling.
841000	844000	If I have to say something, I would say, probably say before you.
845000	857000	Okay. That's a very good choice. Oh, that's a good, that's a classic. That's good. I kind of thought, I kind of thought you were going to say, you're not here because I always see you play in the Makiri Al Moka stuff on the supernova, but that's all right.
857000	865000	That's all right. Good pick. B4U is a classic. I think Dark Soccer, one of her favorites ever is Brilliant 2U Orchestra.
866000	871000	Yeah. So, and they're not too dissimilar, those songs. So a lot of rooted in the same stuff. So awesome.
872000	880000	All right. Well, Misty, I know you're going to sit in tonight's show. And, uh, even though I know you're more of a classic gamer, I'm sure you're keeping up and up on what's going on with the current stuff as we get into E3.
881000	886000	So feel free to, uh, lend your voice to the conversation. I promise chatters, I'm not going to cut her off tonight.
887000	892000	Yeah. And you guys in our chat over at live.fognetwork.com where Bobby Black Wolf is yelling, just say butterfly.
893000	895000	Oh, hell no.
896000	907000	She's like, please, I have taste. All right. Anyway, uh, let's, and Stoppy says, I like that one DDR song that's all electronic and it plays really fast and it has a techno beat to it.
907000	916000	Oh yeah. Candy. Clearly is that that's the one he's talking about. Right. All right. Let's get into E3 this week. So there was a lot of news that came out of E3.
917000	925000	Let's start kind of at the top of the show this week, talking a little bit about probably what were the big two that we were looking forward to going into the week, Sony and Microsoft.
926000	928000	Yes. I'm leaving Nintendo out in a moment. We'll get to them later.
929000	930000	What about Ubisoft?
930000	938000	Well, I figure a lot of those games kind of show up at Sony or Nintendo, or we'll get to them in the show later as well. We have a lot of those coming up.
939000	947000	We need to talk about how terrible the show was. Like seriously, it's like, they thought it was a good idea to do some stupid Just Dance number with giraffes and fucking, I don't know what it was.
948000	958000	And then, oh, by the way, a moment of silence for those people that died in Orlando. It's like, it was just such a weird juxtaposition. I mean, it's just like, before the dance number?
958000	960000	It was one of the more awkward tributes.
961000	963000	It's like out of all of them. It's like, oh, hey, by the way.
964000	970000	You know what though? You know what though? And I said my piece on that whole thing last week, so I'm going to try to not go back to a bad place with that.
971000	985000	But I was very moved with how much of an outpouring of support there was at E3 for, you know, what happened at Pulse Nightclub and, you know, the pain that the LGBT is feeling as a result of that and so forth.
985000	997000	It was kind of surreal to see things like Miyamoto wearing a rainbow ribbon and to hear Sony on stage at their press conference acknowledge our thoughts are with the LGBT community.
998000	1005000	It just kind of, I don't know, I just felt very like, wow, that was really great to just have that acknowledged. It really does mean a lot.
1006000	1012000	Ubisoft kind of had the tackiest one of the bunch, but I'm happy they acknowledged it at all, for what it's worth.
1012000	1013000	Sure.
1014000	1017000	So, anyway, so is that all you want to razz Ubisoft on was just dancing?
1018000	1021000	No, I've got lots more, but we'll go move on to the other ones.
1022000	1031000	Alright, can we talk about then kind of the big gaming console conferences? Again, I'll get to Nintendo later, but they didn't have a conference. They did a different thing.
1032000	1034000	So let's talk, and they kind of talked about one thing and a few other things.
1035000	1039000	So let's talk about Microsoft, I guess, was up first. And so Microsoft, what? They had a variety.
1039000	1046000	They came out and announced, hey, there's a new console coming out that you totally didn't know about because all the information leaked out, like, way before that.
1047000	1059000	But it's the Xbox One S. It is 40% slimmer. It's got up to a two terabyte hard drive, and it's available in August for $299. I think we're at least starting at $299.
1060000	1066000	And go buy it now until we give you a few more reasons not to buy it because that's coming up later in the show.
1066000	1073000	Yeah, it's called the Xbox One S because if you only give one shit about gaming, this is the console you're going to get.
1074000	1080000	But if you give two shits about gaming, boy, hold on to your butts because in 2017 we've got Project Scorpio on the way.
1081000	1086000	That was, I got to admit, that was a little weird to me. Like, I'm not trying to, like, there was a lot of stuff I liked about Microsoft conference.
1087000	1093000	That was weird to me that they're going to try to sell this Xbox One when they're saying an even better console is on the way.
1093000	1103000	But here's the thing, though. It's like, okay, let's pretend here. The games that they showed right now, which are running on that hardware, I'm assuming, look fine.
1104000	1110000	Why do I need to upgrade the hardware? They didn't give me a reason for it. They didn't say anything other than it's going to be more powerful.
1111000	1116000	Okay? What are you going to do with it? Are you going to be able to do 4K on everything? We're going to try.
1117000	1119000	Yeah, it's like, because...
1120000	1122000	But Loki, teraflops.
1123000	1124000	Yeah.
1125000	1129000	I just like saying that word. Dark Soccer, don't you like saying that word? Teraflops.
1130000	1131000	Not as much as I like Nagahide.
1132000	1135000	It's like a cross between terrible and a flop, so...
1136000	1141000	But Jamie, the Xbox Scorpio is going to have six teraflops of power.
1141000	1147000	It doesn't mean anything. That literally means fucking nothing. I mean, you can throw specs out all you want.
1148000	1155000	But here's the thing. Even when they're talking about cards, I want to say that they're similar to GTX 980 or something like that.
1156000	1164000	And those can't even run 4K at 60 frames per second for a lot of things. What makes them think that this is going to be able to do that?
1165000	1167000	Do you know what a flop is?
1168000	1171000	Yes, a teraflop is memory bandwidth.
1172000	1174000	A flop is a floating point operation.
1175000	1178000	Right. I know what a flop is, Dark Soccer. I host one every Sunday night.
1179000	1180000	No, that's a train wreck.
1182000	1183000	That's insulting to real train wrecks.
1185000	1186000	Witness a train wreck.
1188000	1189000	Let's see.
1190000	1194000	What about the whole... Okay, teraflops aside and the whole new console.
1195000	1202000	Again, as much as we're having a laugh here, I do enjoy my Xbox One. There were some games I'm really jazzed about.
1203000	1204000	Forza Horizon 3. Thank you very much.
1205000	1206000	Yeah, Forza Horizon 3 looks nice.
1207000	1212000	Love it. Love that series. What about the whole emphasis on the Windows 10, Windows Play Anywhere stuff?
1213000	1214000	They're really trying to get you to buy a Windows 10 PC.
1215000	1220000	Well, didn't Microsoft kind of already shove one down your throat if you have a Windows 7 or 8 PC?
1221000	1224000	Well, I have a Windows 10 laptop, but I can't run any of that shit.
1225000	1226000	If you don't upgrade, I'm going to kill you.
1227000	1228000	I can't run any of those.
1229000	1235000	I mean, that's cool, I guess, that you'll be able to play cross-platform with those games.
1236000	1242000	And they'll be available on both PC and their Xbox One and Windows 10 exclusive.
1242000	1246000	That was so fucking annoying, the entire thing. It's like, who gives a shit?
1247000	1252000	It's Windows 10 exclusive for a little bit, by the way. It's not a permanent exclusive.
1253000	1256000	It's exclusive for a little bit of time, and then it's going to go on the Steam.
1257000	1266000	So, I don't know, it means really nothing to me, but it's nice, I guess, at least when you buy it on one, you get it on the other.
1267000	1274000	All right, let me mention some other kind of cool things, just because I don't want to get branded a hater, just because I'm picking on a few things here.
1275000	1276000	But there are some other awesome things.
1277000	1284000	Dead Rising 4. Hello. Frank West is back. I feel a lot better about what I'm seeing with Dead Rising 4 than I did with 3.
1285000	1286000	That's true, yes.
1287000	1293000	So, I mean, it kind of feels like maybe the fact that they're putting Frank West in it is a little bit of the whole, let's go back to our roots type of thing, what made this series really fun.
1293000	1297000	So, that's encouraging, I think. So, I'm excited for Dead Rising 4.
