start	end	text
3110424	3110944	Give me back my son!
3138791	3140613	Actually, I think the reward's a pretty good idea.
3140974	3149343	I think the reward, you know, what better way to get all these guys to turn on each other than put a million dollars on the line, right?
3150164	3152967	It's actually a pretty smart move on Sony's part, if they do it.
3153688	3154188	If they do it.
3155049	3156049	But we'll see.
3157670	3160231	Yeah, I'm just  I'm so looking forward to the E3 press conference.
3160251	3162832	But anyway, I don't know what else to say about the situation at this point.
3162932	3168053	I feel like there's just  you just  like do you remember the Ricky Lake talk show in the 1990s?
3168093	3169094	Do you remember Ricky Lake?
3169114	3169654	I remember Ricky Lake.
3169674	3170014	Go, Ricky.
3170034	3171354	Do you remember Ricky Lake?
3171815	3178597	Do you remember how like whenever her guests would just get like totally out of control on the stage, she just got to be standing there with a microphone or jaws just all dropped like 
3179677	3180618	Like, that's me right now.
3180638	3181898	I'm out of my element.
3181978	3182558	Exactly.
3182619	3192623	Like, I'm just kind of looking at the stage and all these people fighting and Sony and Anonymous and Congress and I'm just looking and I'm just... My mouth just dropped and I'm shaking my head.
3192943	3195345	That's all I've got left to say on this situation.
3199542	3200643	So let's talk about something else.
3200703	3201303	DarkSakura.
3202244	3202504	Yes.
3202644	3203285	Oh wait, no, I'm sorry.
3203325	3203985	I have one other thing.
3204025	3204225	Sorry.
3204305	3204826	Whoops, my bad.
3204886	3205286	Whatever.
3205906	3208368	It's PlayStation related, but it's not about the hack.
3209229	3211210	It has to do with PlayStation Rewards.
3211990	3212511	Remember this?
3213071	3214892	Well, you may not because it never really happened.
3215172	3219015	But there was a beta program that ended on March 31st.
3219535	3229182	And an exclusive t-shirt was sent to the beta testers who got to one of the tiers in this PlayStation Rewards loyalty program.
3229622	3253580	and they were sent a thank you card saying wear it proud and yes they got a t-shirt from this Sony literally sent these people a t-shirt that pretty much says I participated in a Playstation beta and all I got was this lousy t-shirt that's awesome okay now DarkSakura sorry
3254928	3257818	Sony, you suck How about something free?
3258100	3260428	Something happy and free and not at all related to Sony
3261784	3263885	There is a Thor game.
3263925	3266567	It's a 16-bit browser-based platformer.
3267187	3270729	It is called Thor Bring the Thunder.
3271610	3274632	And it's basically like Thor but done Mega Man style.
3275472	3277433	So it looks pretty neat.
3279094	3280095	I think I would want that.
3281356	3285598	And there actually is a DS version.
3287219	3288320	Either out or to be out.
3289180	3290141	Yeah, it said May 3rd.
3290720	3292181	I was going to cue my wine.
3292221	3296543	If this is just a 16-bit game, why couldn't virtual console be used for something like this?
3296603	3297964	But no, that's too smart.
3298064	3300966	That would be something new and innovative.
3301006	3301426	I'm sorry.
3302867	3305568	I like the idea of at least a free game able to play online that ties into Thor.
3305588	3306569	Thor has the Rainbow Road.
3309610	3310791	I haven't seen the new movie yet.
3312672	3312912	Okay.
3314693	3315693	I hear it's not bad, actually.
3315754	3316394	In the comics.
3317154	3318835	Well, I'll go ahead and I'll use Ultimates.
3319495	3322997	He summons a freaking rainbow that brings Asgardian heroes to Earth.
3324217	3334422	He brings the mightiest warriors in all of reality on the Rainbow Road to kick ass for Norse justice.
3336551	3343834	and I always like that's very Norse and his level in Marvel vs. Capcom 3 has Rainbow Road in the background.
3345215	3346195	I think he's really Mario.
3346355	3348376	You know what my favorite part of the Thor movie is though?
3348636	3348836	What?
3349156	3350437	Give me back my son!
3350597	3351557	Oh, I'm sorry.
3351597	3351897	I'm sorry.
3351917	3353058	That wasn't Thor at all actually.
3353098	3356299	I've actually seen part of it but just for a cameo that makes me super excited.
3357240	3359581	Oh, the whole Avengers tie-in thing or something else?
3359601	3363242	Yeah, but one of my favorite Avengers characters popped up.
3363502	3363782	Okay.
3363842	3364503	Makes me super happy.
3364723	3365303	There you go.
3366650	3367450	Alright, moving on.
3367730	3368751	I'll give you a clue.
3371132	3371752	It's Mel Gibson.
3372852	3381595	Let's travel the world and see what games are coming out soon in a gaming store near you and what games you can play to help take your mind off of the Benny Hill theme song.
3383204	3387287	This week we've got some, actually a pretty decent selection of titles.
3387987	3389268	LEGO Pirates of the Caribbean!
3389729	3397794	Because you know there's a new Pirates movie, and there are LEGO Pirates of the Caribbean toys, so it only makes sense that there's a LEGO Pirates of the Caribbean game.
3398314	3403137	And that's out on PlayStation 3, Xbox 360, Wii, and DS.
3403177	3407961	There is some online co-op play, except if you're on the PlayStation Network, because you can't play on the PlayStation Network right now.
3408961	3415264	Brink coming out on PlayStation 3, Xbox 360, and PC this week.
3415425	3420307	Also with online co-op and multiplayer, except on the PlayStation 3 because the PlayStation Network is down now.
3420687	3421228	Alright, I'll stop.
3423249	3423909	Yu-Gi-Oh!
3424449	3428972	50s World Championship 2011 from Konami on Nintendo DS.
3430913	3434434	The First Templar from Calypso on Xbox 360.
3436756	3439018	and... Oh, I guess LEGO Pirates was on PSP.
3439178	3439959	How did I forget that?
3440699	3444682	Virtua Tennis 4 on PlayStation 3, Xbox 360, and the Wii.
3444822	3444902	And...
3451414	3453936	Dream Trigger, finally coming out on the 3DS.
3454496	3457979	Actually though, now that I've seen gameplay of it, I am not picking that game up.
3458199	3459160	What's Dream Trigger all about?
3459380	3462662	It was a music kind of shoot-em-up game.
3463443	3465104	But it was really weird looking.
3465625	3466986	I thought it was going to be kind of like Rez.
3467466	3483139	but it's not, it's like you have to tap the screen on the bottom and it creates like a little radar thing and you see enemies not my thing if it was like Rez I'm taking a peek at a little trailer here that's on the YouTube
3484600	3486440	Don't shut up.
3486480	3487261	I don't want to hear this.
3487301	3493882	And then, last but not least, MX vs. ATV Live coming out from THQ on PlayStation 3 and Xbox 360.
3494382	3498803	And of course, this is one of the first games that THQ is experimenting with their lower-priced games.
3499103	3503144	It's only $40 retail, and they're going to have download content every two weeks.
3503685	3509686	So, hey, if you want to support that type of thing and try to maybe get the prices of games down, then that'd be the way to go.
3511487	3512907	I hear it's supposed to be pretty good.
3513447	3515828	And that's it for this week.
3515848	3518329	I found a working where some dude isn't talking over it.
3518389	3518709	Hold on.
3519809	3527232	I really hate sometimes that literally anyone can upload things to YouTube because I hate the people that just take someone else's YouTube and do their own thing over it.
3527252	3528052	It irritates me.
3528092	3528352	Hold on.
3528372	3529952	Dream Trigger.
3530293	3530853	Dream Trigger.
3533604	3535606	The next generation of handheld shooters is here!
3536066	3537507	Mind Warping 3D!
3539949	3541250	Over 50 levels!
3543812	3545513	Collectible trophies and multiplayer!
3546014	3546694	Wait, trophies?
3546874	3547855	On a 3DS game?
3548195	3548656	Hold on.
3550757	3557522	Seems like on the bottom screen you have to tap it and you see where the enemies are on the top screen and then you have to shoot them.
3558323	3558603	Weird.
3560947	3570235	I mean, it might be cool, but it's just, you know... I've already gotten three 3DS games that I don't play, and so I don't really need to add a fourth to it.
3570435	3572437	So, you know, I'll wait until...
3575040	3578062	I'll tell you what, D3, because they're the publisher of that game.
3578462	3581143	You really want me to play a game on the 3DS?
3582044	3583925	You'll port it over Earth Defense Force.
3584825	3585946	Because that would be awesome.
3585966	3586806	You might get your wish.
3587266	3588847	At least bring the PSP version over.
3588867	3589327	You know what?
3589627	3592169	I'll get my PSP working again for that.
3593329	3596130	Alright, let's travel to Japan and check out the Japanese release dates.
3596150	3601372	This week on the Xbox 360, Major League Baseball 2K11 comes out on May 12th.
3601672	3609994	I should point this out, Portal 2 is out next week, and I wonder if that's a localization of the game, like if they've actually redone the voice acting and so forth.
3610534	3611174	I don't know.
3611675	3613795	It's in a lot of languages, let me put it that way.
3614035	3619177	Okay, well maybe it's just the same version we have here, it's just finally getting its Japanese release, I don't know, but...
3619797	3621919	I wonder what GLaDOS sounds like in Japanese.
3621959	3622279	That's all.
3622399	3623039	That's all I want to know.
3623319	3623960	But that's next week.
3624280	3630964	They should give her like an old Japanese man voice or whatever.
3632485	3641471	On the PlayStation 3, Major League Baseball 2K11 is out there as well as Suzumiya Haruhi no Tsuyasu comes out this week.
3641611	3642312	It's Haruhi.
3642952	3644513	It's the melancholy of Haruhi Suzumiya.
3644973	3647716	Oh yeah, this is the same anime manga universe.
3648017	3651261	So this is the game coming out on PS3 this week.
3651961	3653183	A whole game about that series.
3654604	3659250	There's also a box edition, a special box edition on that if you want to get that, if you're a big fan of the anime.
3660190	3661952	On the Nintendo Wii, nothing.
3662472	3665174	On the 3DS, Steel Diver is out this week in Japan.
3665655	3668997	Of course, that was a launch game for us here, but they're just now getting that in Japan.
3669618	3675703	And lastly, on the PSP, Planetarian.
3676223	3678425	and Shisana Hoshino Yume.
3678665	3679926	That's a charity edition.
3680166	3681067	I'm not sure what that means.
3681587	3684389	If that's a price reduction or something where the money goes to charity.
3685090	3694137	I don't have any translation on this but it does look like the game is kind of one of those like cyber anime space robot things.
3695017	3702644	and also another version of Suzumiya Haruhi is coming out there on the PSP as well.
3702704	3705947	And lastly, Makai Senki Disgaea 2 Portable.
3706007	3707068	Of course, Disgaea 2.
3707389	3709951	Getting a price reduction this week on the PSP in Japan.
3709991	3711533	It moves into the best series.
3712233	3712573	There you go.
3712593	3713614	There's your Japanese releases.
3713634	3713995	How about the UK?
3714015	3714155	Okay.
3715339	3716840	We do have a few things for the UK.
3717881	3720782	Let me look at my calendar, because it's going to be another week.
3721063	3722283	Oh, finals week, shoot me.
3723044	3731009	Okay, we have on the 9th, Hydrophobia Prophecy, and on the 11th, Alads Online.
3732670	3736012	And then on the 13th, we've got a few things.
3736052	3739774	We have Brink, Lego Pirates of the Caribbean, and that's it.
3742540	3746003	Just a few more stories for you guys, then we're going to get to the classic game of the week.
3746283	3750486	But first... Yes.
3752187	3761814	Apparently, though, and I kind of think I know what this is, Microsoft Game Studios Vancouver is working on a horror Kinect shooter game.
3765177	3769240	There's been rumors for a while now that they're going to be doing a Kinect Halo game.
3770305	3771365	That's probably this.
3771906	3781030	They're saying that the studio's mission is to push the limits of the proven and unexplored game development and show the world what's possible with Microsoft game consoles.
3781830	3788573	That's pretty generic sounding, but if I were to bet money, I would say it's probably going to be a Kinect Halo game.
3790093	3790513	You think?
3791174	3791494	Yeah.
3792014	3794135	There were the rumors before about that anyway.
3794695	3796316	It would be cool if it was something original.
3798583	3813424	or you know they want to be really cool not necessarily I'd want a Kinect version of this but TimeSplitters isn't getting a lot of love lately and I really love a new TimeSplitters game just saying
3815305	3817725	Alright, one other story for you guys.
3817745	3823126	This is another big rumor that's popped up this week and a lot of people kind of ignored it because of everything that's going on with the PlayStation.
3823186	3826327	And honestly, this is probably something that deserved to be ignored.
3827267	3833368	But apparently development kits for a brand new Microsoft consoles were in the offices of one of EA Studios.
3834028	3835229	This is according to a source.
3835429	3842530	They don't work for EA or Microsoft, but they did say that it came in a PC shell and it was shipped to EA last month.
3844011	3852015	I guess there's been rumors already about Xbox 360 dev kits and this was set to sort of dispel that rumor or what have you.
3852115	3852435	I don't know.
3852755	3856817	So of course people are now speculating is Microsoft set to reveal a new console at E3?
3857217	3864141	Well EA's Director of Corporate Communications came out and said in a statement to IGN that that story was quote a total fabrication.
3864181	3864781	It is 100% not true.
3864821	3864901	And
3868323	3874665	You know, there's absolutely no way is there a Microsoft console being shown at E3 this year.
3874825	3876786	I would bet a large sum of money on that.
3876906	3877186	Why?
3877606	3880147	Because Kinect has not lived out its full potential yet.
3880467	3882068	Microsoft's invested a lot in Kinect.
3882468	3884649	Kinect is still, what's that record it has?
3884729	3890871	The best-selling electronic gadget ever, or fastest-selling, I think, electronic gadget ever, more so than the iPhone.
3891591	3893472	It's been crazy popular for them.
3893812	3895974	But yet, that hasn't really reached its full potential.
3895994	3897695	And they're on a 10-year console cycle.
3897735	3900577	They've been stressing that, and that's the whole plan with the Kinect anyway.
3900598	3902199	Yeah, but Nintendo got away with not doing that.
3902479	3904761	But of course, Nintendo never said it was going to be a 10-year cycle for them.
3905001	3905601	Yeah, they never did.
3905862	3907023	So, you know, whatever.
3907463	3917851	But I just... No way are you going to see a new... I mean, of course you might see maybe a redesigned 360 or a 360 with Kinect built in.
3917911	3918191	I don't know.
3918211	3919713	You might see something like that, but I doubt it.
3919853	3920113	I think...
3920513	3929057	It's going to be just more Kinect support and now it's not going to be so much about the dance games, the biggest loser workout games and those things.
3929437	3938021	Now you're going to see the next wave of quote unquote hardcore Kinect games such as this rumored Halo reimagining that's going to be done with Kinect.
3938381	3940282	I think that's what E3 is all about this year.
3940682	3944404	Now how do we take Kinect to the next, like how do we make Kinect not so gimmicky?
3944804	3946065	because you haven't seen any Kinect games.
3946085	3947385	Just make it not gimmicky.
3947405	3948126	I mean, that's it.
3948206	3956369	I mean, what you need to do is, yeah, you realize that you can do, just because you can do something with the hardware doesn't mean you should do something with the hardware.
3956409	3960591	Like, I don't, before, you know, head tracking.
3961311	3970355	That's all you need to, like, for, I don't understand why that's not even available for most first-person shooters nowadays is just have that support in there.
3970435	3973397	Okay, it does a little bit of head tracking if you want to.
3974608	3974968	That's it.
3974988	3976249	That's all you have to add.
3976270	3987059	I mean, if you want to make it so you can throw a grenade by swinging your arm, then cool, but it's not really necessary because it takes a lot more time to swing my arm in a grenade motion than it would to push a button.
3990245	3997347	I think it's going to be all about maybe this head tracking or whatever else technologies are going to put in future games.
3997807	3999208	That's what you're going to see at E3 this year.
3999588	4004269	And of course, Dance Central 2 and sequels to the popular wave of first titles.
4004309	4008450	But really, what Kinect releases have we seen since Christmas?
4009210	4010911	Until now, very, very little.
4011091	4014112	I mean, especially that's not budget knockoff titles.
4014152	4017594	Now, granted, Child of Eden is kind of your lone standout.
4017614	4019515	But that's not a Kinect-only game.
4019555	4020815	That's a game that has Kinect support.
4021055	4022176	But that's okay.
4022676	4024297	I still would consider that a Kinect title.
4024417	4027598	Okay, well, since Christmas, here's what we've had.
4027678	4033399	We've had Dance Paradise, which was a terrible dancing game from THQ.
4034159	4039640	We had the Michael Jackson Experience, which was kind of like Just Dance in a karaoke game.
4040280	4047482	We've had Fantastic Pets, which was a THQ pet sim game that, you know, it's kind of dumb.
4047502	4050442	Every kind of game you've named so far is a derivative of one of the Christmas games.
4051742	4054203	We've had... We've got Two Dance Centrals and Connectimals.
4055282	4055662	Kung Fu Panda 2
4067950	4070412	Michael Phelps, Push the Limit, that's coming out in June.
4070552	4070792	Whoopee.
4070812	4071973	It's a swimming game.
4072073	4075396	Nothing, nothing, I mean, you're stretching to think of things.
4075536	4079639	I mean, there's nothing that just jumps out at you as like an OMG must own title, right?
4080040	4088186	I mean, all these are just, you know, little flashes in the pan because there's nothing else on Kinect right now and people are hoping that they'll buy this crazy shit.
4088587	4092670	You know, people that crave new dance games are going to buy this Dance Paradise or what have you.
4092870	4094031	Dance Paradise is terrible.
4094991	4096112	Don't buy Dance Paradise.
4096912	4097452	How does it work?
4097533	4101054	I don't even... Dance Paradise, it has your avatars in it, for one.
4101355	4103596	So that's how you know that they're not taking the damn thing seriously.
4104636	4110159	Two, it's basically... It's got this interface that looks terrible.
4111520	4117503	You're standing... These outlines of a person are sliding towards you down this...
4119983	4129705	kind of think of it like that hole in the wall show or something like that where you have to move and make a certain gesture or something like that isn't that kind of how Dance Masters works too?
4130885	4146348	sort of but Dance Masters is less you don't really know what's coming up I don't know it's it's an interesting idea but it's really way too Japanese skewed Dance Masters that's for sure but
4149981	4151362	Yeah, there's not a lot out there.
4151782	4152962	People are looking for stuff.
4154843	4159525	Sadly, Michael Jackson Experience is actually probably the best title out of the bunch so far.
4162086	4165207	Because, I mean, it's got Just Dance as the core to it.
4165307	4167988	Because that's basically what the game's built off of.
4175116	4182683	I was pissed at the experience, not from the dance moves, but from being forced to sing.
4183124	4186927	Those comments from our chatroom, chat.orangeloungeradio.com How can you be forced to sing?
4187248	4188289	The Kinect has a microphone in it.
4190322	4191022	That does suck.
4191163	4193544	You should be able to turn that off.
4193564	4197126	Going back to the original story, though, about the whole dev kit, actually, you know what's funny?
4197246	4200629	I don't doubt that there actually is a dev kit already at EA.
4201089	4216199	I mean, if they are going to announce something next year, which I'd see as a lot more viable, or maybe the year after, I mean, EA and Activision is probably your two biggest publishers, probably have to already be thinking about what launch titles they want to make for it.
4216599	4217780	These games don't take...
4218320	4218800	Thanks for watching!
4232165	4243635	Well, of course not, because, I mean, if anything, these are like alpha kits or something like that, because, you know, let's say that they're sticking to the, you know, five-year or ten-year console cycle, okay?
4243675	4258187	Well, the 360 was out in 05, and, I mean, the way prices are coming down on all electronic stuff, you know, God knows what technology is going to be in five years, or four years, I guess, almost five years.
4259368	4277141	I mean that stuff comes down in price so much I mean if they're like building it off of specs right now like say okay we're gonna have you know a gig of RAM in there or something like that well five years you might be able to afford 16 gigs of RAM for the price of that honestly though a lot of this depends on how much Nintendo ups the ante with what they're doing
4277501	4283867	because if they are hugely successful and they've upped the ante past the specs that 360 and PlayStation 3 has, it's going to force the other two to work faster.
4283907	4286629	Yeah, but I don't know if that's even going to be a big deal.
4286689	4291554	I mean, they're going to have a little bit of an advantage of being first out there, but it's all about how they grasp and use it.
4291734	4293636	But if they're just going to be like...
4294196	4300157	Well, we're out here first, so we're just gonna kick on back, because we don't have to worry about competition.
4300858	4314621	But here's the thing, though, they gotta be way ahead of the game, you know, because if it's just making it just a hair better than, you know, PlayStation 3 or 360, it's all gonna be gameplay then, and if they can't, you know, bring that to the table, then...
4316541	4325345	But I don't think gameplay is a problem for them because before they've all focused on gameplay and graphics have kind of taken a back seat.
4325405	4332727	So if they bring all the visuals and audio and stuff up to snuff, then they have a pretty good system there.
4333488	4334468	But they also can't.
4336510	4336730	We'll see.
4336750	4337070	We'll see.
4337090	4337711	All right, let's move on.
4337731	4339271	We got to get to the classic game of the week.
4359477	4369065	Every week here on Orange Lounge Radio, DarkSakura takes a stroll to the Classic Gaming Vault and digs in there and finds a game that she thinks, hey, you guys should be playing this game.
4369265	4373228	You know, there's no network, none of your newfangled networks right now to play things on anyway.
4373428	4374569	Except Xbox Live.
4375090	4377372	So you should go back and revisit this classic game.
4377492	4379073	DarkSakura, what is the classic game of the week?
4379253	4381455	The classic game of the week is Phantasmagoria.
4383677	4385218	Which was a weird-ass game.
4386716	4390339	Let's do some clips here, if I can get to the two point.
4390419	4394122	I picked one that had some music, but then it went right into more talking.
4395824	4406092	Anyway, Phantasmagoria was on seven CD-ROMs for the PC, and it was released in 1995, which was when I first played it.
4406112	4412278	That was my first full year of college, so it took a lot of time.
4412318	4413118	I should have been studying.
4413158	4413559	But anyway...
4414139	4415140	Victoria Winters
4436101	4442087	At any rate, like I said, it was on seven CDs because it was a lot of video, a ton of video.
4442767	4446571	And actually, most of it was filmed in front of a blue screen.
4446591	4459163	There was something like several hundred different actions that the actress, who was the main character in the game, had to do, like walking to an item, picking something up, doing something.
4459543	4484945	and also it had 550 pages of a script which is about four times the size of a regular movie script and an additional hundred pages of storyboards for the 800 scenes in the game it took four months of filming and 200 people were involved in the productions that's also including that's actually not including sorry the 135 people who were in the Gregorian choir for part of music
4485525	4487527	and the last scene took a week to film.
4488548	4501659	But anyway, it was developed by Roberta Williams who is, she's actually behind King's Quest and it was one of the goriest, most violent games to come out in its time.
4501699	4503400	I mean, it's got an M rating now.
4504101	4506322	It had... Can I look at some of these death scene YouTubes?
4506342	4508024	I want to see how gory this game is.
4508284	4508504	Okay.
4509045	4509585	Let's see here.
4509605	4510726	I want to see some of this here.
4512788	4513508	Let's turn it up.
4514029	4514149	Yep.
4521024	4524870	So she's walking in front of this mirror that's doing a little swirly gas thing.
4537669	4540433	Tonight for you a special feast Regina.
4540453	4542315	I prepared all your favorites.
4544517	4545739	Doesn't this look delicious?
4545959	4550685	For starters, giblets in a rich red marinara sauce.
4557216	4557697	Adrian and Gordon
4569901	4573224	And she's a paperback writer and he is a photographer.
4573284	4579109	So they buy this mansion that's owned by a 19th century magician named Zoltan Karnavash.
