start	end	text
10097	12258	Sky, and Loki.
13978	26383	Tonight, May 8, 2011, Sony is on day 18 of PlayStation Network outage, has a dev kit for the next Xbox been spotted at a game developer, and Club Nintendo makes a controversial change to their privacy policy.
31297	35900	Hello my friends out there on the internet and welcome back to another week of Orange Lounge Radio.
35940	38181	It's the show where every gamer has a voice.
38641	39502	My name is Rob Roberts.
39522	42884	I'll be joining you over the next few hours here live with my co-host with me.
43484	47427	Of course the one, the only, the awesome DarkSakura, Jamie Summers.
47487	47807	Heck yeah.
47847	48848	How are you doing?
49348	49708	Awesome.
49888	51990	And also very humble might I add.
52030	52530	Heck yeah.
54352	54753	TechMasterLoki
66707	66807	Hi.
90814	114528	Ooh, Shiny, another game, I'll go play that I mean, there's so much out there to play There's so many games that come out every week I mean, not just, like, you know, in retail But you have the download games that are available Well, you know, were available on one console And, you know, so on and so forth There's just so much to play PC and so on I don't always get around to everything But, yeah, I actually played Portal 2 to completion and beat it Yay!
115008	117550	So, I feel accomplished I don't know why
118550	119351	Also, it's short.
119391	119851	That helps.
120311	120531	Rob.
120891	121111	What?
121412	123453	The potato is not a lie.
124633	127295	I don't want to spoil it because I know there's some people that still haven't played it.
127615	132457	I have to say, the ending, well, I lulled at the very, very, very, very end.
132497	135319	But for the rest of it, I was kind of like, oh, that's it?
136199	137360	I thought there was going to be a little bit more.
137700	142263	But I think something in my head, I made up a plot point in my head that didn't come to fruition.
142603	144464	And I think that's why I was a little bit like, oh...
145004	145304	I see.
146185	148167	I was a little let down because I wasn't right on that point.
148207	154031	I was right on everything else, but then when the other thing didn't come true, I was like, oh, I guess I can't tell the future after all.
154672	165300	Alright, anyhow, join us in our chatroom, chat.orangelandreda.com as we do tape live every Sunday night at 6 o'clock Pacific, 9 o'clock Eastern at All Games Radio, www.allgames.com right after the Bobby Blackwolf show.
165620	165961	DarkSakura.com
180539	181200	Portal 2, Bejeweled
196875	215309	for real because it's supposed to actually drop enough blocks that eventually it just the game will crash on you well not crash but the game will just end because you don't have any more moves and that never happened so finally I just said forget it and went to bed and then I played Peggle yay Peggle
215737	216758	DarkSakura, DarkSakura
236852	237593	I've played that too.
237613	240557	There hasn't been a PopCap WoW marriage in a while.
240597	243320	Well, I mean, I guess there was the Peace Bloom vs. Ghouls or whatever.
243340	244121	Yeah, where was that?
244141	244902	Because I haven't done that.
245022	247766	Oh, it's in Hillsbrad Mountains.
247786	248807	Do you know where Terran Mill is?
249188	250489	It's not far from there.
251130	253353	I've been going around actually looking for Easter eggs.
254656	255717	DarkSakura, DarkSakura, DarkSakura, DarkSakura
283231	287717	Well, except I don't have the, um, the, uh... Yes?
291607	292668	All the Cataclysm one yet.
293408	296250	Because I skipped the Underwater Kingdom.
296731	302574	And I've just recently gone back so I could get my Exalted with them.
302615	305496	And now I'm just like, people take me on Heroics, please.
305657	308819	Well, I don't want to turn this too much into the WoW show because I already have a spinoff show for WoW.
308839	313442	But I do want to quickly say, you know, just even today, you do find new stuff in the game once in a while.
313462	315123	And that's kind of the fun thing about a virtual world.
315403	318966	No matter what MMO you play, I think this can really be expanded to any MMO out there.
319066	320807	Rift, Star Trek, whatever it is you play.
321287	323709	It's always fun to sometimes just go explore and find new things.
323870	329635	Even just today, Salacious Pop was like, Hey, Rob, I see this house here I've never seen before.
330275	331677	It's not really on the map or anything.
331697	333018	It's just up here in the hill.
333538	334960	And this guy wants junk boxes.
335000	336001	I can't figure out what he's for.
336321	337882	So sometimes you find random stuff.
337902	339544	Did you find the place where the animals have weapons?
340330	341171	No, where's that?
341431	346974	I'll find it during the course of the show, but there's a place that's like the only way you can get there is if you have a flying mount.
347535	350757	And I think at the part that you're normally there, you don't have one.
350897	352798	Actually, if I'm right, I think it's the Tauren starting area.
353599	358002	But it's one place up at the top of the map that you can only get there with a flying mount.
358082	361324	And then randomly, different animals are wearing helmets.
362045	364966	Okay, the prairie dogs wear helmets and carry knives.
365607	367568	The rabbits carry battle axes.
368129	369890	And the rats wear skull helmets.
370631	372813	and carry two double-barreled shotguns.
372954	373815	That's kind of awesome.
373855	376839	And they get bigger and then all of a sudden they'll shrink down and go to normal size.
377320	381105	And I'm also going to try to wake up early in the morning and do the Goldshire Children thing.
383292	387155	The only Easter egg area I've really explored was the one... It's right outside Stormwind.
387195	387836	It's up in the hills.
388136	389317	And there's all these sheep.
389598	392080	Just tons and tons of sheep that you can kill for the critter achievement.
392521	396504	And if you kill them all, though, the guy comes out of his house and he goes, What's wrong with you?
396545	397806	That's just wrong.
398747	400889	He starts yelling at you about what a bastard you are.
401109	403131	There's another place... But you kill sheep.
403451	404733	There's another place that has...
406674	407675	And this will be the end of it.
407815	409076	This one was one I thought was really nice.
409837	415060	There's a monument and a dwarf in red named Roush kneeling in front of it.
416021	420404	And it reads, rest in peace, Anthony T. Stark.
421124	422726	People were calling that the Iron Man thing, but it's not.
422766	424627	It was actually for a guy who was a friend of the developers.
425247	427349	And Roush was his character, the dwarf.
428069	430071	So they made him an NPC.
430411	430871	Very cool.
431071	432212	I thought that was a nice gesture.
432412	433133	And a smiley face.
433453	435974	I'll say this about another MMO, Final Fantasy XI.
436014	437815	You know, I played that for many years before I played WoW.
438155	441977	One of the things I used to really like about that is that I really like the ambience of that game.
442017	444278	You know, the graphics are more first person.
444318	446259	I mean, they can be third person depending on how you play.
446659	451321	But I just really liked exploring areas in that game because there were some really beautiful areas and great music.
451901	479677	and because of the way the game was designed you wouldn't always like see every area for a long time so as you were progressing which could sometimes take months and months you would find these new areas and hear new music and it was just really cool I mean it was a frustrating ass grind that's why I was so disappointed that 14 was such garbage I mean sorry to say what's going to happen to 14 we haven't heard of what's going on there in a while I don't know if they're going to try to reboot or what I don't know
480758	482160	DarkSakura, DarkSakura,
496218	498560	And not as pain in the ass as a grind.
498580	501761	Well, they did change a lot of stuff in XI since you and I left.
501801	503963	Like, the level syncing thing is huge.
504423	507685	But there's only so much you can cram into an old engine.
507745	509546	And that's where Warcraft's starting to have that problem.
509606	510847	I want much different outfits.
511467	512008	Seriously.
512348	515510	There's so many different armors that change your look in World of Warcraft.
516110	519032	But really, in Final Fantasy XI, it's just like...
520698	521919	Oh, I'm wearing the bondage gear.
522619	524060	Oh, now I'm wearing white mage robes.
524401	526802	They're just very few new things.
527743	530445	And you can tell what anybody is by looking at them.
530765	534588	And the other problem XIV had was that it tried to change it up too much.
534668	540311	Like, instead of being just a white mage and a black mage, now you could be a gladiator or a theramaterge.
540452	541072	Like, what?
541412	544134	That's not why I play Final Fantasy, to be a fucking theramaterge.
544174	547877	And seriously, what is the point of having the same races but changing the names?
548477	549378	That was retarded.
549478	549718	Silly.
549958	552138	Anyway, okay, enough MMO ranting.
552379	553079	Let's talk about other games.
553099	562921	By the way, I must say that my wife's character, well, before she had the hairdo change, but she looked like Mel's Taro Taro at one point.
563141	565121	Actually, no, she does look like Mel's Taro Taro now.
565241	566902	Wait, wait, your wife had a Final Fantasy XI character?
567142	569282	No, I'm saying she's playing Animal Crossing.
569342	574823	Her character in Animal Crossing looks like Mel's little Taro Taro because Mel looked like a little grandma.
574963	575644	Yeah, yeah, yeah.
575804	576604	That always cracked me up.
577504	577724	Awesome.
580555	581335	There are those days.
581495	587498	I'll see those sales on Steam where it's like, Final Fantasy XI is only $20 for the uber mega OMG I can't believe it version.
587859	589399	And I'm like, I kind of want to go back.
590160	591380	I kind of want to go back.
591400	591840	Resist, resist.
591961	593021	I will, I will.
593501	594022	All right, anyhow.
594762	595903	Loki, how was your gaming week?
595943	596583	What have you been playing?
597683	598584	Only really three things.
599845	605087	Wait, more importantly, the chat room wants to know for the betting pool tonight, what food did you bring to the show?
606348	607789	I brought a Carl's Jr.
607889	610470	Western burger.
610770	611230	There you go.
611270	614112	I don't think anyone guessed Carl's Jr., so we got a lot of losers in chat tonight.
614608	616149	I had a Red Bull last night because I was up until 4.30.
616409	617169	It's still the color of pee.
642620	643681	It is, but it keeps you awake.
644261	644662	I don't care.
644962	646062	It makes my brain function.
647163	647403	All right.
648004	648244	Video games.
648264	649225	What have you been playing this week?
650385	652567	Breakman in our chat asks, what's a Carl's Jr.?
652847	654588	If you're on the East Coast, I think they call it Hardee's.
654749	655149	Yeah.
655409	655729	Same thing.
657430	663314	Anyways, I played Portal 2, a lot of Portal 2, and progressing nicely through it.
663775	666817	See, I started off on the 360, but I decided, you know...
669023	671064	Here's how it went down.
672405	676228	It's not technically piracy, because I do own a copy of it.
676648	678749	Just I'm not playing the copy that I bought.
680270	682552	So I have the 360 copy.
682872	687935	I have the PS3 copy that I got for free through my work, which has the PC Steam copy.
688455	692278	But as you know, PlayStation Network is down, so I can't download my Steam copy.
692718	695560	So I pirated the PC copy, and I'm playing that.
696440	698142	So technically I own it on PC.
699083	700445	I just am not playing that copy.
701506	702026	But who cares?
702347	706531	I'm enjoying it just fine on my laptop because it runs very, very great.
706712	708313	I can max out everything.
709935	710055	And...
711980	713242	DarkSakura, DarkSakura, DarkSakura
730192	737516	Okay, so then beyond Portal, I've been playing Unpleasant Horse, which is awesome.
738196	742318	Especially throwing little flying horses into meat grinders.
745340	747061	And then, of course, Grand Theft Auto.
748301	748701	That's it.
749442	751743	Of course, it just wouldn't be a Loki week without Grand Theft Auto.
752008	753129	We always play Grand Theft Auto.
772889	774811	So just reiterating the same stuff.
774872	776834	I beat Portal 2, as I said at the top of the show.
776874	777795	That was a big accomplishment.
777855	779016	Still need to work on co-op.
779316	780377	Miklatov, I know you're listening.
780397	781238	You need to work on co-op.
782519	783621	I'll join you if... Will you?
784001	785382	Well, I've got my PS3 copy.
785783	787525	I'll join you once the network comes back up.
787545	788305	Yeah, screw Miklatov.
788326	788686	We'll do it.
788726	788946	All right.
788966	789166	All right.
789367	789727	Sounds good.
791028	793890	Anyhow, let's see what else I've been playing.
794010	795131	Or can't you do split screen?
795791	799593	You can, but one of our controllers, PS3 controllers, is still in a box.
800754	805657	Oh, well how can we get it out of this impenetrable cardboard box?
806537	811961	Oh, if only there were a way to break into the fortress that is the cardboard box.
811981	813522	Look, you dick, it's in a box.
813562	814943	We don't know which box it's in.
815344	816685	It's like playing a game show.
816825	819387	Well, there's a very simple solution to that.
819447	823450	One box has the PSN controller, the other box has the lube.
823770	825031	We don't know which box it's in.
825051	828333	You rip open all the boxes, dump them on the floor, and then you'll find it.
828814	829234	That's it.
830953	831213	Dirty Laundry
852751	853451	Of course!
853872	855813	You buy them nice things and they don't appreciate it.
855833	856373	That's a cat for you.
856393	862356	I was telling Rob earlier, I got Shermie this really nice series of cat beds that she'd just ignore.
862717	865758	And then I pick up this one for $13 on sale and it's her favorite thing.
866759	867319	Just give it time.
867379	868960	It is super comfy though.
869280	870261	I know these things take time.
870281	873663	It's like my cat, I got her a nice new bed and she was scared of it because it looked like a cat.
873983	874964	Shermie, do you like your bed?
877485	879666	Yeah, Dan says in the other room she slept on a box.
879966	880827	She slept on a box?
880847	880927	Yeah.
881260	881540	Dirty Laundry
897280	899162	No, you know what they use when there's no dirty laundry?
899443	900404	They use my chair.
901024	901124	Oh.
901665	902105	That's what they do.
902145	903246	Anyway, I don't want to talk about cats.
903266	903907	I want to talk about games.
904187	905429	But I also want to talk about this comment.
905449	906670	Miglatov just IM me.
906690	909092	He's like, well, just tell me when you want to play Portal 2 and I'll play.
909513	916079	But he also said, apparently I missed the remark about I'd go back for $5 to Final Fantasy XI if you would too.
916419	918081	Kind of like a suicide pact.
919422	920183	Oh, sad.
921485	922726	I like that reference.
922766	924028	Oh man, if I had the time.
924289	924990	I know, right?
925390	926812	Just for good old times.
927453	929056	Let's just go not have a life again.
929216	936066	And that's like so, I don't know, nonconformist because everybody's like, MMO?
936226	936466	Wow.
937808	939709	Fuck that, we're going to Final Fantasy XI.
940050	940350	What?
941290	944152	It's like, I don't know.
944212	945153	I miss Grandma Taru.
945253	946794	Okay, look, other games I've played.
946874	949495	Speaking of Final Fantasy, I'm still playing Final Fantasy IV on the PSP.
949796	951717	I play it for like 30 minutes before I go to bed every night.
951757	954278	It's a nice little way to kind of, you know, rest before bed.
954959	958001	Of course, I love that game on the Super Nintendo, so of course I love the PSN port.
958441	962283	And I'm doing kind of the Jamie thing where I have to play it chronologically.
962803	964885	Like, you know, where you guys are doing the Final Fantasy marathon.
964905	965065	Yeah.
965425	985734	well I'm starting with 4 and then I'll play the interlude and then I'll play After Years finally which I played like a little bit of on the Wii but I want to play it on the PSP because I love the new graphics and it really is just a great looking game and I hope people didn't overlook it because it came out the same week as Portal because that would just be I really want 5 and 6 to come out hey find us a Portal
986674	987235	Exactly.
987635	988015	Shiny.
989356	992158	Otherwise... Can't play Portal on a PSP.
992559	994240	That's most... Yeah, that's true.
994360	995701	You can't play Portal in bed.
996362	1000185	Well, actually, you probably could play Portal on a PSP if they hacked the...
1001505	1001725	StarCraft 2
1019472	1020093	StarCraft 2 Red Alert
1040230	1041991	StarCraft series is really like the old Warcraft games
1060526	1065910	Just, you know, I'm sure StarCraft fans get driven bonkers when I say that, but really at its core, it's kind of what it is.
1066270	1070733	You know, collection, build buildings, build units, attack, kill, destroy, and so forth.
1071394	1073395	So, that was my gaming week.
1073735	1077518	Join us in our chatroom at chat.orangeloungeradio.com if you want to chat with us with tonight's news.
1077558	1080880	We'll be reading random comments in chat throughout the show.
1083303	1087588	SilverSonic in our chatroom, for example, says, didn't you mean on Twitter that you played Minecraft?
1088549	1089550	I played that last week.
1089650	1091272	My review on Minecraft was last week.
1091392	1092273	And let me put it this way.
1092713	1093955	I didn't play it again this week.
1095091	1095892	This is Rob's Review.
1113326	1118229	If Minecraft weren't, say, little pixelated blocks and they were Legos, would that make the game more appealing?
1118309	1120470	I love the little Lego builder.
1120490	1121751	I love that app.
1121831	1123172	You can download this thing on the PC.
1123212	1124272	I think I mentioned this last week.
1124553	1136580	You can make your own little Lego things and then actually have them ship to you instructions on how to build it, because the computer program remembers how you built it, and I guess a logic thing, and they will send you all the appropriate bricks.
1136920	1140582	So it's like this thing for people to do 8-bit sprites in Legos.
1140802	1143203	That sounds more interesting to me than Minecraft.
1143323	1148424	It's way more interesting than Minecraft, actually, because I get something tangible out of it.
1149205	1156327	Not to knock people that spend a lot of time making stuff in Minecraft, but you know what would be awesome with Minecraft?
1156767	1163089	If you combine Minecraft, the world, and being able to build everything like that with ZZT, where you can actually make your own games.
1163109	1164929	Fuck yes, I would be all over that shit.
1164989	1166970	Oh my god, now we're talking.
1167410	1172133	I'm just shocked that there's Minecraft podcasts and all this stuff.
1172293	1177836	I've watched videos of people like, this is my basement.
1178477	1181539	I want to support all indie podcasters, so look, I'm not knocking it.
1181699	1182939	If you're into that, that's awesome.
1183080	1188103	I feel so not cool for not understanding Minecraft.
1188883	1189624	Thanks for watching!
1209757	1233511	and you know if I ever came across you know an extra 12 hours in a day where I could just sit there and build in Minecraft then yeah that might be a fun game for me but I just don't have the time although if you want to like say port that over Nintendo and put some Animal Crossing characters in that and sell it to my wife then I might get to play it a little bit more
1234111	1237092	Alright, going to our chatroom at chat.orangelogicator.com for some comments.
1237112	1240774	Kaijudo in our chatroom says, To understand Minecraft, you have to get the pay version.
1240874	1241655	It has a lot more.
1241715	1243015	The free version is a joke.
1243516	1247878	But yeah, but if the free version isn't that great, then it doesn't really make me want to get the pay version.
1247998	1248898	But I get it.
1249718	1250059	Let's see.
1250819	1260323	I apologize if I mispronounce this, but Entitilus says, What's the name of that 8-bit Zelda clone on the PS3 that came out a while back?
1260363	1260764	That was 3D.com.
1261664	1261964	Heroes.
1262164	1262364	Yeah.
1262945	1263785	That game was cool.
1263865	1264806	I want another one of those.
1266326	1267307	I'm surprised I never got sued.
1268007	1268308	Let's see.
1268508	1270409	BlackWolf in our chatroom says, It's okay, Rob.
1270609	1271689	I don't understand WoW.
1272069	1274030	Yet some people do WoW podcasts, too.
1274291	1275251	No, I'm with you, BlackWolf.
1275311	1277032	I don't understand WoW either, but you know what?
1277052	1278533	It's because you guys just aren't cool.
1279553	1280634	I'm sorry to say it.
1280734	1282795	Like, you know, I'm not... I still like you guys.
1282815	1283776	You're just not cool.
1283936	1288278	I just... I never understand... You know, just from looking at the outside in my...
1288658	1289499	S, Actdeft, Drew, Carameldansen
1309477	1310938	Here's the thing about WoW.
1310978	1312498	I'll just sum it up as fast as I can.
1312578	1315879	It's really about the people that I play with that keep me doing it.
1316179	1320180	Because if the people weren't there that I was playing with, I would have canceled my account a long time ago.
1320440	1322021	I got really close this past week.
1322101	1322561	Oh my god.
1322861	1325742	I got so frustrated at something in the game, I really wanted to cancel my account.
1325802	1331604	But I kind of have that podcast now, and there's also the community of people I really like that also play it.
1332685	1340759	and that's probably why the Minecraft people do their thing because they've got a community too but I'm just not able to be in that community because I'm a terrible terrible terrible artist
1342745	1343326	That's what it is.
1343486	1350391	Well, I'm just saying, you know, the best little taro house in Vanadil is not that bad of a name either.
1350912	1351172	All right.
1352813	1353354	Let's move on.
1353414	1354595	We need to get to some gaming news.
1354675	1355676	Quickly, housekeeping.
1355976	1357757	Visit our website, OrangeLoungeRadio.com.
1357797	1360880	Join us on Facebook, Facebook.com slash Orange Lounge.
1361280	1363262	And we're also on Twitter as OLR.
1363968	1365390	It's like we have a different username everywhere.
1365430	1367213	Sorry about that, but it's kind of a long name.
1367554	1370538	All right, let's get to some gaming news once again.
1371199	1373403	I think y'all know where we're going to go tonight right off the bat.
1374364	1375426	Let's talk about the Atari.
1376628	1377489	Fucking love Atari.
1377590	1378391	Combat rocks.
1380137	1383219	Station.com, part of Sony Online.
1383840	1387802	Apparently, Sony Online has gone down.
1388162	1393485	They suspended their services after they discovered an issue.
1393625	1403911	That issue being that their network was also infiltrated as part of that PlayStation Network infiltration from hackers.
1404391	1405772	Apparently, also, they...
1407133	1434189	lost 12,700 credit card account numbers and 24.6 million accounts were compromised that sucks and of course they're letting everybody know no this wasn't a second attack it was just part of the first attack yeah that makes it all better you know that they got it one swoop instead of twice because twice would just be ridiculous now wouldn't it um
1436337	1438598	So yeah, that does suck.
1439339	1447563	And they really haven't said what they're doing, at least on the Sony Online side.
1447703	1454587	I mean, I know there's a lot of stuff we'll be getting into about the PlayStation Network, but yeah, that sucks.
1455088	1461351	And of course, I think for the people that are playing the games on there, I think you're getting a free month or something.
1462612	1462772	Yeah.
1465349	1470612	It's just kind of interesting that this all comes out the week that, oh yeah, we're going to get the system back online.
1470732	1472332	Oh shit, we got hacked more.
1472472	1473313	But here's the thing, though.
1473773	1477154	It was from an outdated database, they said, from 2007.
1477755	1487019	And it says, of the 12,700 total, 4,300, I guess, were from Japan.
1488119	1491921	And then, I guess, some more from other European countries.
1491961	1493102	They're saying, though, that...
1495575	1509662	that the US credit and debit card numbers and expiration dates not the security codes were part of that database I actually have kind of a crazy question has anyone asked this question of Sony yet?
1509742	1515085	I'm not sure but I've got to put it out there why the fuck did they have credit card information from 2007?
1515505	1518626	why are they not required by law to purge that information?
1519387	1520187	why do they need it?
1520527	1522448	you don't need credit card information from 2007 do you?
1525051	1528635	I mean, maybe they need it for tax banking, balance purposes.
1528655	1530817	It might be a server backup or something like that.
1530877	1531317	I don't know.
1531818	1532779	Well, I don't care.
1532879	1534580	You should have to purge that by law.
1535742	1536442	I don't understand.
1536843	1547954	The only benefit of keeping information on this just comes from working with loans is that you can go back and find issues where people have done fraud and you have to track back data that far.
