start	end	text
6193988	6221700	the crossbar thing does not work for everything and Hulu Plus and Facebook and Twitter and all this other stuff they try to integrate into Xbox that crossbar thing does not work for it so yeah I guess you can set up a queue online to do Hulu Plus and that's kind of I guess the way you're supposed to do it but did you know that a lot of the stuff you can watch on the web you can't watch on your Xbox it's not licensed for playback on the Xbox more reason why Hulu Plus is kind of dumb sorry
6224968	6232939	or you can set up your queue and then download Tversity.
6233500	6240289	You can download, I'm sure, a streaming program and link it with that and you can actually stream all that stuff through there.
6241550	6246951	Some comments in our chatroom at chat.orangeloungeradio.com Blackwolf says, you have to give your credit card to get the free month.
6247091	6248092	Uh-oh.
6248172	6252173	Breakman says, I like Hulu Plus' TV selection, but the movie selection sucks.
6253013	6259854	Salacious Pop clarifies, the biggest draw to Hulu Plus is that they let you watch shows on demand that are still current from just last week, etc.
6260154	6262035	You know how else you can watch shows that are still current?
6262355	6262715	Torrents.
6264085	6292387	or most of them are on like CBS.com most of the CBS shows most of them are available that way but like the real real stuff like HBO if you want to watch I don't know what the Tudors or any of that Showtime we just got HBO actually because we upgraded our Comcast whatever because they're going to give us the same thing plus our phone for the same price we had already I wanted to see the Gaga concert last night that's the thing though they gave us HBO
6293496	6295157	But it doesn't work.
6296639	6298400	Because we were like, okay, what should we watch?
6298460	6299441	Oh, concert, okay.
6300062	6301343	We don't have anything else to watch.
6301823	6302524	So we clicked on that.
6303124	6304005	This channel's not available.
6305506	6308469	But they were supposed to give it to us free for three months.
6308849	6311531	So great, there's something else that's wrong with Comcast.
6311872	6312272	Hooray.
6312792	6314034	But hey, we have a DVR now, so that's all good.
6314054	6317577	Blackwolf in our chatroom says, or you could watch it on the TV.
6319309	6322670	If you want to watch a current show, you can turn on your TV and watch it.
6323290	6323931	That's a good point.
6324271	6326071	We caught up on The Office last night.
6326251	6327592	I watch Survivor live every week.
6327652	6328652	I don't have a DVR anymore.
6328992	6329733	I don't record shows.
6329773	6337975	So if I don't watch it live, I'm either watching it on CBS.com or Netflix or Hulu.com, the free version, or something.
6338856	6339636	Torrents are great.
6340196	6348939	Or if you want to get into this century with the piracy, Usenet or the file share sites are way better and faster.
6349383	6371837	by the way I think I should be on Survivor because like seriously this season is driving me bonkers because there's all these bimbos on that show that are totally being controlled right now I can't stand it I'm just saying if I went on that show I'd be the one in charge bitches better watch it that's right watch it that's it for tweets twitter.com slash OLR
6373597	6375278	Let's move on to some more news.
6375378	6378561	Listless coming up in just a moment, but first, a round of stories.
6379401	6380462	Yeah.
6380542	6385825	So Konami's planning this sort of party, or I don't know.
6387046	6392590	They're doing a pre-E3 show on June 2nd, I guess, a few days before E3 starts.
6393050	6394751	The event will be streamed online.
6394831	6396152	They haven't said which sites yet.
6396993	6398253	And there's going to be, I guess...
6400815	6415120	Like a sitting room where people can watch trailers for stuff and they're also going to have like parties in LA, San Francisco, Toronto, Sao Paulo and Mexico City and other cities.
6415680	6422943	They haven't really finalized this list of cities yet and apparently they're going to be inviting the press and stuff like that to these things.
6424443	6425084	Oh, I guess.
6425124	6426405	We need no fucking invite.
6428428	6436477	And, you know, I can understand that, you know, whole LA thing, because that's fucking far, and they're not going to pay for us to fly in there.
6436497	6439541	But San Francisco, man, that's like an hour or two away.
6440502	6440642	And
6442827	6443107	Whatever.
6443588	6443908	You know what?
6443948	6447952	I don't give a shit about your fucking Yu-Gi-Oh game that you have there.
6449033	6449314	So yeah.
6449714	6458002	And then I think also on their Facebook and stuff, they were doing this contest where like, be the ultimate Konami fan and tell us why you are the ultimate Konami fan.
6458042	6462567	You can win like an iPad or, you know, a trip to E3 or some crap like that.
6465489	6475713	More on that, I'm sure, as we get closer to those dates, because obviously they haven't really announced too much other than, hey, we're going to be doing our first annual pre-E3 show.
6479715	6481896	Maybe we can make a drinking game out of that, too.
6481976	6482496	That would be fun.
6484237	6484717	We could.
6484737	6486578	I mean, obviously they're going to be showing what...
6488777	6494158	The Melgar Solid Rising game, which still hasn't come out.
6494298	6496538	So that's probably one of the big things.
6496939	6499459	Silent Hill Downpour, that'll be another big one.
6503120	6504260	That's pretty much it.
6504660	6507300	I mean, I guess they're bringing No More Heroes over here.
6507340	6509221	They're localizing that for the PS3.
6510841	6511701	So they'll show that.
6514662	6514942	But...
6517040	6517400	and DarkSakura.
6545160	6547081	That's the hip thing to do in Hollywood these days.
6547101	6548201	Exactly, rebooting it.
6548481	6550762	I don't think it's that far off.
6550882	6555904	Obviously, it's going to be a hell of a lot of work, and I need to do that right now.
6556104	6557925	But first, you've got to get somebody's ear.
6557985	6559325	Good luck with that.
6559385	6564567	No, not actually, because do the pitch first, then get the person's ear.
6564667	6569689	Or copyright your idea first, and then... That's how you do it.
6570530	6571330	Do it the smart way.
6572370	6573931	Yeah, just because, I mean, come on.
6573971	6574191	I mean...
6575658	6581241	I actually did the math, and this is great, and might as well bring this up since we're talking about it.
6581361	6588385	And just to kind of show you real quick, or demonstrate how the franchise has fallen.
6588886	6590527	For example, I did the numbers.
6591247	6595770	According to the NPD reports, January 2011, this would be everything from 2010 and back.
6595790	6595850	Um...
6599815	6604339	Hotest Party 2 Hotest Party 3 Hotest Party 4 Hotest Party 5
6621074	6626598	2010, Dance Dance Revolution, remember their kind of reboot thing, 170,000 units.
6627198	6630000	And then on the PlayStation 3, Dance Dance Revolution, 60,000.
6630601	6633443	Compare that to, oh, and Dance Master is only 47,000 units.
6633563	6633783	Oh, wow.
6641289	6642610	Just Dance 2, 3.5 million units sold!
6661644	6663504	They're just not putting a lot of effort into it anymore.
6663864	6666885	Breakman in our chatroom asks, What the F is Hottest Party?
6666945	6668325	Is that one of those AO games?
6668725	6670786	Now that would be an awesome way to reboot the series.
6670826	6672746	Don't you agree?
6672826	6678247	DDR Dollar Bill in our chatroom says, I didn't even know DDR kept getting releases until someone gave me the Step Mania files.
6678287	6679247	Maybe that's part of the problem.
6679847	6683608	The community's been kind of, like if you go to DDR Freak, you'll see the tumbleweed rolling by.
6683648	6686008	I mean, there's not nearly the community there used to be.
6686028	6688489	But I don't think they really need necessarily the community for it.
6688649	6690989	There's not a big community for Just Dance.
6692506	6692786	True.
6693427	6695768	I mean, it's all about being current.
6695808	6700731	And I think what the problem's been is they've been trying to innovate with the series, and they just don't know how.
6700991	6704974	They don't really know which direction to take it in, so they're taking it in all the directions at the same time.
6705514	6713599	You know, they're like, okay, we're going to innovate by adding eight-panel dance mode or something like that.
6714139	6715560	No, that's not what you do.
6716301	6718462	They're trying to shove square pegs into the round hole.
6718562	6719143	Exactly.
6719883	6720543	That's the problem.
6720824	6721424	And I think...
6723256	6724498	I have some good ideas.
6724778	6729282	It's hard to describe them over the radio because it's all in my head right now.
6729662	6734767	And I've tried to sit down and type out what I'm thinking.
6735347	6739992	But if I can get what's in my head on paper, it's going to be awesome.
6740472	6741233	That's the problem.
6742594	6744315	But I have some fresh ideas for it.
6744335	6748339	So see if I don't get bored of this whole idea and actually...
6749500	6752528	Finish it and be able to pitch it.
6752568	6753270	It would be awesome.
6753410	6756277	But yeah, once again, they're not going to give a shit if they're just...
6759116	6760777	You know, if they don't want to try, then that's fine.
6760857	6768340	Some folks in the chatroom are commenting that folks moved on to other websites, like BomaniStyle and so forth, but those websites are not just about DDR.
6768760	6772021	And usually, DDR seems to not be the focus at all.
6772061	6772641	You know what I mean?
6772741	6774222	That's why DDR is continuing to plummet.
6774682	6775823	Other games might be doing okay.
6775923	6779804	Like, DJ Max Portable got released in the US because of the following it has here.
6780204	6782525	But, you know, DDR is a different game.
6782585	6783646	The thing is, though, it's...
6785007	6813195	Dance Dance Revolution was kind of like the innovator it brought people to the genre first and then now they have these other games out there and they're doing really well and that's not to say that Dance Dance Revolution can't do that well even if it did half as well it would still be way better than what it is now and so that's the thing all they have to do is figure out how to capture that audience and I think I know how to do that just based off of what they've done and what hasn't worked
6813815	6828332	and what has worked and you just kind of combine all they have all the pieces there it's just they're not doing it right well I want to know I hope you get your audience with Konami someday alright let's move on buy stock a couple more stories for you guys yeah buy stock I actually thought about buying stock in Sony
6828972	6832693	Just so I could sign a petition to shake up the management, but we'll see.
6833113	6833333	All right.
6834213	6837474	Anyhow, quick, quick story about Quake and Wolfenstein.
6837514	6842956	Yes, some old, old properties that are, you know, very near and dear in a lot of first-person shooter fans' hearts.
6843816	6850938	An interesting comment from senior producer Jason Kim when Shaq News spoke with id Software.
6850958	6851878	I call him ID Software.
6851898	6852818	Somebody call him id Software.
6853058	6853278	Quote,
6872913	6900695	I think we can freshen those things up we don't have anything in the works right now but I think when we start talking about different things we can do with the other properties that we have I hope people are receptive to what we want to do and what we think would be fun for players to experience coming out of id Software well I mean there was a new Wolfenstein game not that long ago and it wasn't very remarkable and then there was a Quake Arena on Xbox Live is pretty cool but the Quake 4 was not cool actually it was not that great because that was on Xbox 360 right yeah it wasn't very good
6901215	6902597	So, uh, yeah.
6902997	6903398	We'll see.
6903498	6906621	I mean, I'm all for going back to the drawing board with new ideas.
6906881	6908283	Those are two big properties.
6908343	6909825	I used to love Quake back in the day.
6910305	6912567	And Quake 3 and Quake Arena are actually a lot of fun.
6912608	6913869	Did you ever play Ascii Quake?
6915130	6916472	No, I never played Ascii Quake.
6917433	6919135	But, I remember the old Quake CD.
6919175	6920096	Oh, it's Gotcha Quake.
6920516	6920977	Gotcha Doom.
6922421	6949790	people have a lot of free time on their hands what can I say alright so speaking of a lot of free time on our hands a little segment we like to do on this show once in a while is a segment where we try to come up with the definitive list on a topic that's right after we're done tonight we are going to go through a list and find out the exact top three scientifically proven answers to a topic it's a process we call list lists
6953134	6956438	The way listless works, since we haven't played this in a little while.
6957159	6963387	We're going to give you a topic, and the topic tonight is Thing PlayStation Network Needs When It Comes Back to Make Me Care About It Again.
6964033	6991298	and then the four of us yes we're going to get someone online in just a moment the four of us will go around the room and each give our top three answers as to what should be on that list that will leave us with a list of twelve then the hard part oh this is the hard part but you know reality shows are all about voting things off so we each go around and take one thing off the list that leaves us with a list of eight that you the chatters get to vote on and you vote for your top three and that's it that's the list
6991974	6993115	That's the answers right there.
6993375	6999059	Tonight's topic, thing PlayStation Network needs when it comes back to make me care about it again.
6999359	7002201	You can give your answers in our chatroom at chat.orangelongeradio.com.
7002241	7008806	I can't guarantee we'll use them, but when one of our hosts is struggling to find an answer or if something gets duplicated, we'll usually turn to the chatroom.
7009266	7011588	All right, let's bring in our fourth person here.
7011628	7015851	I'm going to go ahead and give him a call.
7015871	7019253	Let me dip the music down here for just a minute so we can call on the Skype line.
7019273	7020174	I've got somebody set up here.
7020950	7021570	Hello.
7021951	7023031	Hi, is this Tiara?
7023671	7024292	Yes, it is.
7024372	7026713	It's the one and only Tiara, a.k.a.
7026813	7028694	Maren Marvel, joining us tonight.
7028794	7034957	You might have heard the commercial for Pop Culture Parlay in between the segments tonight if you were listening live.
7035597	7040480	Tell us real quick about your projects, Maren Marvel, before you play with us tonight.
7041246	7066467	Well as you know I steal Jamie about once a week and we do Comic Insanity which is a comics and kind of like a geek culture podcast where we talk about fun stuff and then there's Pop Culture Parlay which is just kind of a little bit of craziness where Weasel aka Jonathan Long who works for EA and myself kind of talk about different pop culture stuff like we've done like
7067087	7095248	Star Wars vs. Star Trek we've talked about the best Batman we've talked about all sorts of random stuff so it's it's just really really fun really really good time and that's on geek-life.com awesome well best of luck with all those projects you know I like to sometimes poke fun at the stuff you and DarkSakura do as the Giggling Girls show but actually you guys do very hard work so best of luck alright you ready to play listless with us tonight I sure am yay then I can play music again alright
7096209	7097329	DarkSakura, DarkSakura, DarkSakura
7119901	7120522	Mind Control via Nanobots
7136332	7137993	Mind control via nanobots.
7138013	7139355	How would that work with a playstation?
7139375	7142097	By the way, your answers can be as serious or as silly as you want.
7142357	7151424	Because I have a first model PS3, so clearly it has the hardware inside of it to create nanobots based off of data sent in through the PSN once it comes back up.
7151584	7153266	And what would be the first thing you'd mind control?
7153886	7155306	No, it would mind control me to care.
7155967	7157107	Oh, okay, I see, I see.
7157187	7158908	Yeah, it would mind control me to care.
7159148	7159988	Okay, there you go.
7160668	7162769	Alright, Mar and Marvel, we'll go to you.
7163229	7166430	What's your number three answer thing that PlayStation could do to get you to care?
7167250	7178674	Well, since there's all this talk about how, you know, our data has been, like, stolen, maybe they could give us, like, a year of free credit reporting so that we can keep an eye on our credit.
7179369	7186135	and make sure that those people that are stealing our information aren't buying things from Nigerians and stuff.
7186175	7192300	To be fair, they sort of did, but I think you're talking about something a little more intense than what this whole Debix thing is about.
7192360	7196784	Debix is credit monitoring, but not credit reporting, so there is a difference.
7197204	7197324	Yes.
7197364	7197905	All right.
7198405	7202587	Alright, just wanted to clarify the difference for our listeners because you know how internet people will be.
7202648	7206850	They'll say, Dear Orange Lounge Radio, your guest was uninformed.
7207010	7208611	Alright, anyhow, let's move on.
7208671	7211793	My number three answer, thing that PlayStation Network could do.
7212753	7217216	How about a PlayStation 2 emulator download for my collection?
7218156	7220478	They've been rumored to work on one of those for years.
7221418	7222679	I'd like to see that come out.
7222699	7224180	So PlayStation 2 emulator.
7224500	7226061	I don't care how they have to get it to work.
7226101	7227442	Just get it to work if you want me to care.
7229966	7232167	Up in the cap of members allowed in the PlayStation Home Clubs.
7250656	7251557	I like to say a billion.
7251577	7252337	That would be perfect.
7252377	7253699	That is a practical answer.
7253739	7254199	I love that.
7254219	7258603	Because right now in the Orange Lounge Radio Club, I'm allowed to have 25 people.
7258623	7260605	25 people does not include me.
7260625	7261866	I don't want to sound cocky.
7262347	7266291	We have a little more than 25 people that listen to this program that have a PlayStation 3.
7267171	7270575	So I would really like to be able to invite more people.
7270835	7273557	Because unfortunately, we've got a list of about... I shit you not...
7274258	7276339	More than 25 waiting.
7276480	7279482	I can't do anything with them because I'm limited.
7279802	7283224	Of course, I don't know what we would do in the PlayStation Home Club.
7283424	7285265	I just want to have a big club.
7287367	7289568	Let's go to DarkSakura.
7289608	7291650	Your number two answer for the list.
7291670	7293511	Thing PlayStation Network could do to get you to care.
7293951	7295692	Morph the system into a Dreamcast 2.
7297994	7301236	My husband left in the other room.
7301641	7303262	So it would just instantly transform.
7304083	7305323	And it's a Dreamcast 2.
7306564	7307144	Outstanding.
7307164	7310346	With a big Sega logo flipping off PlayStation.
7310466	7311647	Via a firmware update.
7311967	7312748	Via a firmware update.
7312828	7315810	Alright, MarnMarvel, your number 2 answer.
7317391	7322334	I would like a new attachment for the PS3 that serves frozen yogurt.
7327799	7330880	It doesn't have to be Pinkberry, you know, I'm not a snob here.
7330960	7333461	You're not asking for the world, just frozen yogurt.
7333481	7334801	Alright, I like that.
7335081	7337382	A new attachment that will serve frozen yogurt.
7337402	7338162	I like that answer.
7338782	7344284	Alright, let's see, my number two answer for a thing that they could do to get me to care about PlayStation Network.
7345404	7349065	Guardian Legend 2 released as a PlayStation Network exclusive.
7350708	7357956	Of course the greatest, most underrated 8-bit game of all time, Guardian Legend 2 would have to come out as a PSN exclusive.
7359622	7360042	That was weak.
7360102	7361423	I see what you did there.
7361483	7362423	Good one.
7362923	7364564	Loki, your number two answer.
7364584	7368605	Once again, I'd like to reiterate, I really don't care.
7381729	7383270	Thanks for watching!
7402435	7403455	See, I never understood that.
7403495	7408899	Let's just get rid of the whole Linux support instead of, I don't know, patching it so that it doesn't allow people to hack us.
7409199	7419426	You know, I can't for the life of me believe that amongst all this talk of frozen yogurt and mind control, Loki is the voice of reason tonight here on Orange Lounge Radio.
7420267	7421267	I don't care.
7421327	7422708	Am I in Bizarro World?
7422968	7424790	I don't want anything from them.
7425130	7425950	What do I want?
7426251	7428732	It's like a blowjob.
7428792	7429733	That's what you want.
7430053	7430393	No, I...
7433755	7435336	Sony Blowjob, really?
7437417	7439898	That would be unsatisfying, I can tell you that much.
7443620	7447402	Alright, here's the list as it is so far.
7447462	7449683	We disabled the good feature, you know.
7451264	7452605	We disabled the humming feature.
7453045	7454626	Mind Control via Nanobots.
7456417	7458218	We disabled the feature that will swallow.
7458278	7480131	Alright now, Mind Control via Nanobots, Give us a year of free credit reporting, PlayStation 2 emulator downloading, upping the cap of members allowed in home clubs, morph the system into a Dreamcast 2, new attachment that serves frozen yogurt, Guardian Legend 2 PlayStation Network exclusive, and bring back the other OS feature.
7480611	7482573	Alright, let's go around and get the number one answers!
7483493	7484794	from the folks here in studio.
7485054	7487056	DarkSakura, number one thing that could bring you back.
7487336	7488177	A year of Pinkberry.
7491820	7492801	A year of Pinkberry.
7492841	7499686	Would this actually come out of the PlayStation 3 like Marvel suggested or would this be just a coupon redeemable at your local store?
7499806	7506151	It would be like a card that's got like 365 charges on it for Pinkberry.
7506271	7506732	I see.
7506792	7509114	Because I like going to Pinkberry and listening to the music.
7509134	7509774	All right.
7510335	7511876	Mar and Marvel, your number three answer.
7513035	7520580	How about some free download content for people who, for like, you know, co-op games and games that you play online.
7520640	7527464	So since people have missed all that kind of stuff during this whole debacle, they can get some free download content and make up for not shooting things.
7528625	7530306	I'm sorry, of course that's the number one answer.
7530626	7534049	I just shortened that to free download content of good games.
7535069	7535289	Yes.
7537191	7539072	As opposed to like, you know, Undertow.
7539922	7560016	Free download content of good games My number one answer to the question By the way, I have to read this comment from Salacious Pop A Sony blowjob is $30 more expensive from a similar competent brand and the no toothy head feature has to be ordered from a neighboring store and costs even more
7562233	7568256	My number one answer for a thing PlayStation Network needs when it comes back to make me care about it again.
7568576	7569557	Drumroll, please.
7571858	7573118	Gay pornography.
7573498	7575079	Yay!
7576300	7578981	Which is even more funny than straight pornography.
7579688	7581489	Alright, that was my number one answer.
7581569	7583609	Gay pornography would get me to care.
7584030	7590912	Selling gay porn on the end... Okay, so all you straight guys at home, they're going, eh, fine.
7591152	7592753	Lesbian porn, galore.
7593293	7596534	Lesbos R Us is what the PlayStation Store renames itself to.
7596614	7596954	Enjoy.
7597814	7598174	Alright.
7600575	7604457	Loki, your number one answer for the thing PlayStation Network could do to get you back.
7606377	7607898	Just don't give a fuck about it.
7608258	7608378	Um...
7612412	7619881	You know, this doesn't even have to be free, and it's not even necessarily something that they give to me, but it'd be kind of cool if they put out a new AIBO, I guess.
7620602	7621323	I mean, I don't know.
7623045	7623766	Really, Loki?
7624747	7625227	Why not?
7625568	7627771	Okay, everybody, point and laugh at Loki.
7630814	7631374	I don't know.
7631414	7635076	I just, like, I don't care that their network's down because they never used it.
7635096	7639097	So the thing you want most in the world, Loki, is a new eyeball.
7640398	7641018	Not really.
7641378	7644560	Actually, I would like... No, scratch that.
7644960	7645800	Screw the eyeball thing.
7646521	7647401	Alright, alright.
7647641	7648021	Okay.
7648301	7650282	Thing I would like most from Sony.
7651042	7651963	Thing from Sony.
7654062	7658563	They have really no power to do this, but I would like the Clerks animated series back on air.
7659124	7661624	So maybe they could make that happen.
7661644	7662385	That would be awesome.
7663985	7667086	Alright, so get the Clerks animated series back on air.
7667306	7668766	Alright, much better answer.
7669687	7671567	Alright, so let's recap the list.
7671607	7673128	Here comes the hard part, you guys.
7673688	7675468	We gotta take one off the list.
7675508	7676729	I'm sorry, it's just the way it works.
7676809	7676969	It's a
7677597	7678879	It's tough love, folks.
7678919	7679520	It's tough love.
7679820	7681462	Here's the list as it stands so far.
7681863	7683345	Mind Control via Nanobots.
7683745	7685428	Give us a year of free credit reporting.
7685828	7687751	PlayStation 2 emulator downloading.
7688171	7690634	Upping the cap of members allowed in home clubs.
