start	end	text
6519640	6528680	here um yeah see this first one here from pop on jar or as i like to read his name popo and jar
6528680	6534040	it's the popo pop on jar estimates us surely you've seen this the most useless game accessory
6534040	6537800	ever and it's it's the game boat i remembered seeing that on the twitter and i just love the
6537800	6543000	picture because it's like the dude he's on a boat but yeah looks looks completely useless about his
6543000	6549080	use useless is that inflatable cart that i still kind of want the one that's coming out this week
6549080	6558680	yes uh mnzba sends us a tweet nintendogs blamed for an actual dog attack how in the hell does
6558680	6565320	this work yes uh let's see uh according to the daily mail this is in the uk megan walker was
6565320	6570040	peacefully playing a copy of nintendogs at a friend's house when one of the in-game dogs
6570040	6575400	barked at her but the bark was an earshot of the friend's bull mastiff a breed of dog that weighs
6575400	6582120	about 130 pounds the sound spooked the dog so much that it bit walker's face severing a portion
6582120	6588440	of her upper lip how sad the girl's grandma told the daily mail i think this game should carry some
6588440	6593160	kind of warning people should be told not to play it when there are dogs in the room i blame the
6593160	6597240	game for what happened to make it will eat your face if they hadn't been playing it i don't think
6597240	6602840	the dog would have gone for it you know lady maybe you shouldn't keep 130 pound dog near a
6602840	6608440	nine-year-old call it a hunch just a thought or one that's prone to eating your dog better just
6608440	6612840	thinking if you have a face eating dog you might want to keep it away from your nine-year-old
6612840	6619320	right i think a bull mastiff is the largest breed of dog good god they're huge crazy lady
6621080	6625880	i was bit by a dog when i was five it's not fun you're afraid of dogs i am actually like i i'm
6625880	6630280	getting better i used to be afraid of like all dogs but now it's just big dogs like if i was
6630280	6634760	around 130 pound dog i'd be running the other way i'm not even gonna lie but now like i'm at the
6634760	6641880	point where like alan has talked me into getting a corgi some corgis are adorable and they're little
6641880	6647960	and they're cute and they waggle and that's adorable they're super cute but i'm mostly a
6647960	6653560	kitty person uh blue swim is tweeting us namco bandai will be releasing the first sailor moon
6653560	6659640	game on the nintendo ds by year's end in italy no other details yet it will be the first new
6659640	6663960	sailor moon game since the series was relaunched internationally early this year so you can get
6663960	6670680	your sailor moon on um let's see spazinator is saying i'm doing all i can to promote olr on
6670680	6674920	facebook xbox live and playstation network hopefully it'll get you more listeners you sir
6674920	6680200	get a gold star thank you that's all we ask is to help get the word out about olr but of course i
6680200	6684040	need to say this not that i'm saying spazinator is doing this but just remember guys don't spam
6684040	6689400	you don't have to spam people because that just makes us look bad just saying tassel hoff
6689400	6697560	sends us a tweet hey olr i like it when people spell hey h a y hey hey olr what was a scene
6697560	6703160	in a video game that made you shed a tear or cry because of the scene oh we were talking about this
6703160	6710200	on warcraft the other night on vent games that made you cry that they were so sad um i probably
6710200	6715320	cried like twice during lost odyssey and i didn't even beat the game uh but just the end of the
6715320	6721240	first disc especially was very very sad um and i remember um i remember getting a little verklempt
6721240	6725080	at final fantasy 4 at the ending of that too most final fantasy games actually get me a little bit
6725080	6730360	verklempt loki was there ever a game that made you cry no he's saying no well he's sucked into
6730360	6732840	some iphone game he doesn't want to talk to you guys right now he's playing iphone games
6733400	6738920	uh dark sakura game that made you a little a little bit verklempt i've cried out of frustration
6738920	6746280	okay what game made you cry out of frustration oh a couple at least a few puzzle games and playing a
6746840	6750280	x-men versus street fighter with dan because i'd get so pissed off at him that i'd cry
6753080	6760040	i can admit it nice all right uh moving on to some other tweets uh oh we've been getting this
6760040	6764840	from a couple people actually akki ripper says it's a tweet but jeweled is free at the moment
6764840	6770360	at popcap.com that's right that's only for about another what two hours so sadly which i i got it
6770360	6773560	too late for the podcast ease but if you're listening to this now you can get bejeweled 2
6773560	6780200	free i gotta be honest though i mean how many of you don't already own bejeweled 2 in one way or
6780200	6784920	another i didn't really you can play it online for free you always could i wasn't interested
6784920	6791640	but i like the iphone one no i had it on my old ass phone back in the day i have it on the iphone
6791640	6797320	phone phone and the xbox 360 so i appreciate that they're giving away a free game but it's it's a
6797320	6803160	10 year old game you guys no but hey free games are free games i just feel like i'm being a digital
6803160	6809880	hoarder if i download that all right spazinator psn says fyi in homes theater there's an episode
6809880	6814520	of inuyasha streaming for free oh that's kind of neat that they're using the theater to stream
6814520	6820040	free like quote unquote real things and not just the in-house sony stuff like the tester
6820040	6823800	or whatever that's kind of cool i think they should do more of that in sony home
6825560	6831720	act def says uh kirby's epic yarn was supposed to be a new ip for nintendo so originally i guess
6831720	6835560	this wasn't even going to be a kirby game that's kind of neat he's actually linking us to a story
6835560	6842200	here i guess awata made some comments on this um originally let's see and it was revealed that
6842200	6846920	kirby was not going to be in the game and the original character going by the name of fluff
6846920	6852440	could have been the main character with the game carrying the title world of yarn instead which is
6852440	6857480	funny given the other article that said that it was inspired by a kirby commercial that they did
6857480	6865400	in japan in the mid 90s interesting uh let's see tiger claw sends us a couple tweets and i don't
6865400	6868280	remember either of these being on our show world so i'll go ahead and mention about these stories
6868280	6873320	real quick again from tiger claw on twitter uh nintendo patent shows the we fidelity sensor game
6873320	6879960	example so i guess the uh patent leaked out and it kind of shows how this uh thing works let's see
6879960	6886440	the vitality sensor measures a player's relax fluid sounds kind of gross it's just one of the
6886440	6892600	examples of the game it's calculated by measuring the cardiac cycle over a hundred pulses similar
6892600	6898040	to brain age this number can be compared to relax fluid of same age persons it mentions a stretch
6898040	6902280	game where players tilt the remote up and down to move a character while you're moving flying
6902280	6908200	character players have to adjust their breathing to match the ceilings dips and drops interesting
6908760	6913240	the character automatically moves that the screen scrolls to the right when you inhale you fire
6913240	6918520	smiling blobs hat up towards the ceiling it drops when you exhale this game uses the vitality sensor
6918520	6924840	to identify inhales and exhales interesting but again i i don't see how this is gonna like they'll
6924840	6930360	make a wario aware game out of this and that's it you know what i mean there's always a warrior
6930360	6935320	aware game for the peripheral then it'll be done also and i remember reading about this too and
6935320	6940200	this is always sad to hear about layoffs but microsoft's in-game ad unit apparently is shutting
6940200	6945960	down this month and this is a report in an ad industry trade publication ad week citing sources
6945960	6951160	close to the company and insiders of microsoft stating that massive general manager j.j richards
6951160	6954760	is now seeking new employment and other unit members have been reassigned throughout the
6954760	6958360	company so i guess only one person got laid off so i guess that's good that they were able to be
6958360	6963320	redistributed um microsoft apparently had been shopping around a massive buyout in the past few
6963320	6968840	months uh what this all boils down to though i guess it's conflicts with the xbox live team
6968840	6974520	because the xbox live team sells the ads directly on the xbox dashboard and doesn't really want the
6974520	6983320	competition with the in-game ads so there it goes bye there you go that's our twits tweets twats
6983320	6989320	for tonight twitter.com thank you guys for your tweets we'll see you next week on the twitter in
6989320	6996600	the meantime i'm gonna have to go back and uh wake up loki from his iphone awake hi and climber
6996600	7002280	it's awesome is that like crazy climber no it's like uh if you cross bionic commando with a ninja
7002920	7011800	and it's all like climbing really fast it's cool and it's free free is awesome free is awesome so
7011800	7020600	this is kind of neat apparently uh at&t uh u-verse is going to be offering um ip tv i guess or
7020600	7029080	streaming tv coming to your xbox 360 and this is coming in november apparently um customers are now
7029080	7036120	able to use their existing xbox 360 with a hard drive as a u-verse receiver so you will be able to
7036120	7043080	um i guess stream tv to it it says must have at least one standard receiver or dvr in order for
7043080	7050040	the xbox as a set top box to work and it says uh new fields will be displayed on the tv receiver
7050040	7055560	section and blah blah uh xbox connect our connection kit will include a installation
7055560	7065560	cd remote and dongle and dongle ah yes and so um i guess it's going to be coming very soon and i
7065560	7071960	guess with the new uh dashboard they'll be coming up probably very soon as well so um that's kind
7071960	7078680	of neat wish i had att u-verse because uh comcast sucks but um don't have that option right now
7082120	7087320	well i guess that's cool i don't know though it seems like with all these like apple TVs and
7087320	7091320	netflix and all this other stuff this seems to be a couple years late now you know what i mean like
7091320	7095000	when we first heard about it in europe it sounded awesome or was it japan that had this first i
7095000	7099560	don't remember it sounded awesome but now that we have all this other stuff that delivers tv shows
7099560	7104920	i mean there's only so many ways you can watch glee over the over the internet's you know what
7104920	7109560	i mean do we really need this one as well you know oh i forgot you're on the i hate glee bandwagon
7109560	7115320	now because the whole beatles no i was on the i hate glee bandwagon before then the show just
7115320	7121400	irritates me i i haven't watched it this season so i can't say but i always in my gut thought
7121400	7126680	that show was going to be like heroes awesome first season not so great which was glee i haven't
7126680	7132520	really been watching it lately though he's like heroes not the plot but just you know how heroes
7132520	7137640	this week on heroes it's gaga week you know how heroes had an awesome first season and then the
7137640	7143720	second season was like okay it was yeah there was the the chick that was like maya that was her name
7143720	7151880	she's like single-handedly ruined the show remember that my emo powers exactly i sucked
7151880	7158440	life out of you with my emo exactly yeah that was a terrible season and it just went downhill
7159240	7163240	just like an emo to ruin it for everybody nice
7165560	7170920	all right uh let's see oh i wanted to give a quick update real quick because i'm catching
7170920	7175480	up on my private messages that that whole um uh extra life thing i was reading about earlier
7175480	7180040	jessica went and got a tiny url for it so this is really easy if you want to participate and help
7180040	7188520	breast lol from understation live out just go to tiny url.com slash breast lol b-r-e-s-s lol
7189400	7192920	and you can help out and i'll put that on the twitter too just in case you kids forget
7193720	7197960	all right let's move on though to some other news this is about one of my favorite games rock band
7197960	7205560	yay rock band just hit 2000 download songs this week actually that's 2000 between download and
7205560	7211800	on disk but however you count it it hit its 2000 song this week potentially 2000 songs in your
7211800	7219400	rock band library yeah exact well and then does that even count the uh um the network the rock
7219400	7224120	band network or whatever i think so oh does it well still though it's still an impressive number
7224120	7229000	jimmy hendrix's are you experienced was the 2000th song if you care i was curious how many songs i
7229000	7236520	had stop by the way if you're curious how much those have been downloaded 75 million tracks from
7236520	7243160	the rock band store in the rock band network that's a lot of downloads speaking of uh download
7243160	7248520	content bon jovi's greatest hits album will be released november 9th but you know what if you
7248520	7253640	don't really want to go to the store and buy it you can just download it as dlc for rock band 3
7253640	7258600	uh soon after the launch of rock band 3 the greatest hits album by bon jovi will be rock
7258600	7264200	band 3 download content and i believe some of the songs are already in there but you can get the
7264200	7272360	full experience with the rest of your bon jovi favorites yay all right there you go bon jovi
7272360	7279320	coming soon to rock band dark sakura what do you got for us oh i've got more stuff how about for
7279320	7288840	those of us who are big fans of konami's uh other goings on before there was ddr the um x-men arcade
7288840	7295080	game remember the one that was two screen six player or one screen four player is going to uh
7295080	7302200	be out on xbox live arcade and playstation network yes i know right dips on storm dude it was all
7302200	7310680	about playing dazzler for me but it's going to be out guess when soon oh soon our favorite release
7310680	7317160	date it is all about playing dazzler which is the only game she was ever good in i think it's the
7317160	7321160	only game she was in so what about the whole six player thing are we going to get to play six
7321160	7327080	players online all at once it's going to be epic doesn't say possible i was hearing a rumor about
7327080	7335240	that yes they say it will retain six player co-op nice online that's right new york comic con was
7335240	7338840	this weekend so i'm sure where there's a lot of news coming out of the that that's comic book
7338840	7343880	related so that's kind of cool i just love this picture from the intro it's like storm just just
7343880	7350840	does not give a fuck she's not amused storm ain't having it no she's like because she's awesome
7350840	7356040	bitch please uh tiger call in our chat room says i bet that game will come out in time for the
7356040	7360040	release of the new x-men game what about the new x-men movie isn't there a new x-men movie coming
7360040	7365400	out next year like yeah yeah like it's a it's first class or something it's like a prequel
7365400	7371880	or whatever yeah you know they recast everybody there was a whole comic series called x-men first
7371880	7380200	class okay all the you know new original stories from the early days okay could be interesting i
7380200	7385960	suppose but it's going to be hard without patrick stewart as professor x i'm just saying all right
7385960	7388760	uh we're not gonna do list list tonight we're gonna table that to next week so let's move on
7388760	7397000	with some more news loki uh yes um so this is kind of cool uh apparently uh mega man legends
7397000	7404680	is going to be asking people to uh submit ideas for stuff that they want to see in the game um
7404680	7411000	they're going to be asking the community to actively participate in um different development
7411000	7416040	parts uh some of the examples that they had on the one page their boss characters uh voice actors
7416040	7422280	ideas they want them all and um of course that's why project is in the title they said it would be
7422280	7428120	a collaborative experience uh but not in the way mega man universe is instead i guess the community
7428120	7433080	will be able to actively actively participate in the development of the game uh capcom unity
7433080	7438760	website will be updated with a dev room where fans will be able to submit their gameplay ideas boss
7438760	7444520	ideas character ideas and more in the future fans will be able to vie for position in the game's
7444520	7451880	voice cast pizza man do do do do do some of these character designs are really cute the
7451880	7457480	fan submitted ones yeah they don't look bad i want to be a voice actor in mega man legends
7458520	7462600	well where do i sign up you just got the sign up with the website bunny girl
7462600	7467000	i don't want to be a voice actor for bunny girl sorry
7469160	7475800	but uh yeah it's kind of cool i wonder why all this audience participation in the game is it
7475800	7480840	just a gimmick to try and sell more copies or do you think they just really want fresh ideas or
7480840	7486520	what what do you think's the motivation behind this i'm not sure uh probably just you know more
7486520	7494200	of the meta stuff because everybody likes being you know able to contribute to a game and having
7494200	7500440	their credit and stuff and it's way better than having a name web 2.0 yeah kind of stuff yeah
7501160	7507960	that makes sense all right uh that way fans can't bitch if the game sucks because you made it made
7507960	7514440	it well it's all your fault the game get bad got bad reviews all right um i think this is kind of
7514440	7519160	strange um you know how there's the kindle right and i think dark soccer you you use the kindle
7519160	7523560	i use the kindle app on my phone is that just the same thing as a kindle i don't know well the
7523560	7529720	kindle itself is the device that amazon sells you know the large one has got internet access and
7529720	7534280	shit right i just have the app for it on my phone so i can read books oh okay what can't you use
7534280	7539880	iBooks for that not for books i bought through the kindle store ah got it okay well anyhow i
7539880	7544120	bought some of my schoolbooks that way so i can carry them around on my iphone got it all right
7544120	7549720	well anyhow um kindle is of course you know it's it's a device that you know most you read books on
7549720	7557160	it but now apparently there's some games showing up on kindle i guess uh scrabble is on kindle
7557160	7561320	right now i didn't even know that but yeah scrabble actually made its way to the top of the kindle
7561320	7568600	charts but um apparently some folks have ported zork one zork two zork three and mini zork to the
7568600	7573480	kindle i didn't even know there was a mini zork but yeah zork one zork two and zork three are now
7573480	7579080	all out on the kindle that's kind of awesome um now i don't think the kindle has too much in the
7579080	7583240	way of a keyboard so i'm not sure how awesome this is i mean i think it has some keyboard but it's
7583240	7589320	kind of small so i don't know how much fun this is to play but uh yeah it's out there and uh so
7589320	7595000	you are standing in front of a white mailbox don't get eaten by a guru you can experience it all over
7595000	7604120	again there it is let's uh go to the mailbag at mailbag at orange lounge radio.com and we're gonna
7604120	7614120	open up ye old mailbag dive in the one email one email one email but it's fantastic well to be fair
7614120	7618760	i failed on getting the show up on time so we'll probably have double the emails next week rob
7618760	7624760	fails sorry i was sick leave me alone he brought me he brought me pita chips so i sure did and
7624760	7632040	asoda hey olr crew azhp here if you may recall rob had mentioned a few episodes ago that poo
7632040	7637080	ping would be a funny name for social networking site for people on the toilet that's right because
7637080	7643240	of a ping.com remember well i'm sorry apple's ping well i decided to run with that idea and
7643240	7652920	i'm moderately proud to bring you www.poo-ping.com wow i whipped it together over about two weeks
7652920	7657640	though since i worked a full-time job i was only able to put an hour or two a day into it
7657640	7662920	its goal is to be like yelp for public restrooms through a number of factors prevent me from
7662920	7667480	devoting much time to it the aforementioned full-time job and my lack of any sort of prowess
7667480	7672520	relating to design related to design the site does not have any features currently it only supports
7672520	7676840	adding restrooms to the database and writing reviews for those restrooms a google account is
7676840	7681240	required to submit restrooms or reviews don't worry it's using google's official google app
7681240	7686840	engine api so you don't have to worry about me stealing your information or anything this is
7686840	7690200	just the first website i've written on my own it was basically just an excuse to learn new
7690200	7694360	programming languages for the technically inclined it's written in python using the google app engine
7694360	7701640	sdk with some django integration or is it django i don't know so it's not too well polished maybe
7701640	7706440	if i find myself unemployed in the future or if you hire jamie i can get back to it or she can
7706440	7711960	make it look pretty i appreciate it if the crew or the chat could throw out some ideas that you
7711960	7716280	would like to see on the site such as an iphone app google map integration foursquare style
7716280	7721160	check-ins a friends list twitter style updates experience points based ranking system for adding
7721160	7727320	restrooms etc i can draw you pictures of poop is that really necessary yes who knows i might one
7727320	7732200	day implement them anyway hope you enjoyed it as bare bones as it is your friendly neighborhood
7732200	7739320	programmer azhp that's pretty amazing i'm looking at the site poo-ping.com and my bathroom on it
7739320	7745320	there it is the site for picky poopers there it is it's actually there and there's already a one
7745320	7753640	review on there for next tag i don't and it just talks about where there's four stalls apparently
7753640	7759560	and uh there's paper towels is the hand drying mechanism and the faucet type and uh you can
7759560	7764760	actually write a review there and talk all about it in the comment on this restroom the faucet on
7764760	7769000	the left doesn't shut off all the way unless you push down on it harder restroom is fairly clean
7769000	7775240	and paper towels and toilet paper get restocked often i'm gonna review the toilet out back i was
7775240	7778920	gonna say i should review the the bathroom at jack-in-the-box i was at before the show tonight
7778920	7785000	because uh when i turned on the sink it was so it was like on full blast i got shot with water
7785000	7788760	and it just looked like i crapped my pant like the front of my pants and i was so mad
7788760	7794440	so i was gonna write a nasty review of the sink there i don't know the address for this place
7796440	7800360	uh-oh you have to look it up can i review my bathroom
7801640	7806040	you can put whatever you want in there you want your address on there there it is poo-ping.com
7806040	7810280	that's amazing i love when our show inspires these ideas that's that's the ultimate tribute thank you
7810280	7816040	guys so much so salacious pop is saying he just thought of a mailbag for you he didn't send this
7816040	7820840	in the email but i think this is a great question and i can't wait to hear the rants this inspires
7820840	7827160	dark sakura have you seen the new gap logo and do you feel the logo would be helped by comic sans
7827160	7834200	or papyrus what the fuck let me look at it their logo is pretty weak have you not seen the new gap
7834200	7839880	logo it's like crap i need a logo right now all this new controversy no just go to gap.com i'm
7839880	7845000	going and you can see it and it's there's their new logo it's in helvetica yeah that's it that's
7845000	7852520	not helvetica it's a gap with a box i like it job really because like all these designers everywhere
7852520	7860920	are pissed they have saying that it's way better no no no no it's i like the old one better but
7860920	7869880	this isn't bad the old one just was better it was more iconic i think i think the square is retarded
7869880	7875000	yeah i don't know it's not really no the old one was better
7876760	7881400	um i just got linked this uh website that apparently has all the sounds you need
7881400	7887560	to run a radio show here and so um we could list the uh gap logo on poo-ping.com
7893560	7896040	this is what i will say about this if i may
