start	end	text
2323400	2329640	for my stuff anymore now a cool statue maybe but um you know a lot of times it's not really
2329640	2333720	worth it although the little big planet 2 collector's edition looks pretty fucking awesome
2333720	2339240	um tron not so much frisbee in our chat says but does it come with a plate and a spoon
2339240	2344160	kind of in a reference to that dreamcast game the dark soccer has uh defective candy in
2344160	2348820	our term says my biggest issue with digital distro is if something happens to my computer
2348820	2352120	if I can re-download it I would do digital you know that's something that blizzard's
2352120	2356360	pretty good about though I mean even if you have these games from way before there was
2356360	2360720	ever digital distribution like for instance I see dan up there in his collection has a
2360720	2365380	warcraft 3 game and there's a serial number on that if he goes to battle.net and enters
2365380	2369500	in that serial number it'll get attached to his account and he could always re-download
2369500	2373080	warcraft 3 wherever he's at so it's kind of you know that is one thing blizzard's pretty
2373080	2376120	good about is that once you do have the game tied to your account you could always re-download
2376120	2383680	it anywhere kind of interesting so anyhow one other uh quick note here on world of warcraft
2383680	2389100	it was also announced by blizzard this week that they have surpassed the 12 million subscriber
2389100	2393600	mark that's right there are now 12 million subscribers for world of warcraft keep in
2393600	2397960	mind that's not just in the us this is uh partially attributed to the fact that wrath
2397960	2402840	of the lich king finally came out in mainland china just about a month ago and of course
2402840	2409080	cataclysm is coming out here soon so everybody's getting ready for that so who knows um yeah
2409080	2413240	this is interesting though the last time there was a big population increase announcement
2413240	2418820	was december 2008 when it got to 11 and a half million so a lot of folks at that time
2418820	2423240	thought oh wow it's topped off it's dying but nope they got up to 12 million this week
2423240	2427720	but probably not likely to ever get as high as 20 million as some people thought it once
2427720	2433960	would there's 20 million people living in australia just so you know come on australia
2433960	2441040	would what's the holdup there you go so uh yeah world of warcraft 12 million people that's
2441040	2445160	a lot of people playing but that is a worldwide number not just here in the us otherwise that
2445160	2449600	would be quite astounding uh i think there are still bigger games in china though i do
2449600	2453960	not think wow is the biggest game in china by far i believe lineage is still the dominating
2453960	2460640	game over there so weird yeah dark sakura what do you got for us some more stuff oh
2460640	2465080	i love stuff how about dc universe yay i'm really looking forward to dc universe online
2465080	2474920	well um you gotta wait no it's been delayed until spring 2010 no wait spring 2010 then
2474920	2486680	it's already out 11 no which means that uh it's gonna be a while however um the beta
2486680	2495520	is gonna be available in november that will be um if you pre-order the game then you are
2495520	2501840	uh guaranteed access to the november 30th beta so you have to have it you have to pre-order
2501840	2507280	before november 15th to make it into the beta so you can still get the game in november
2507280	2517000	you just have to pre-order the game to play the test game yes okay because i'm doing their
2517000	2522640	job right of course not i'm still very excited about dc universe online i'm sad to hear it's
2522640	2527480	getting delayed but at the same time there was another big mmo that came out very recently
2527480	2532720	that i said should probably be delayed until 2011 uh boy did they listen boy yeah boy did
2532720	2536280	they listen uh so you know what if that's what this game has to do to take the time
2536280	2542040	to get it right then you know what so be it if it's that much better they can always just
2542040	2548600	patch it later on that's right that's right it doesn't need to be finished patching finish
2548600	2553580	it's never finished it's an mmo we're always adding stuff i mean fixing things i mean making
2553580	2559640	it not shitty i mean tiger claw sharing a new sound effect for us uh i guess this is
2559640	2565160	the the sister to sad trombone to play when we have depressing stories like uh dc universe
2565160	2574160	online is delayed until spring 2011 oh that's not a new one this is called sad tuba.com
2574160	2580560	i just thought sad tuba that's just the price is right losing horn the price is light is
2580560	2584120	i thought it was going to be the sad trombone thing played on the tuba so i thought it would
2584120	2592520	be whatever that's the craziest dorkiest thing i've ever heard yeah i know i know anyhow
2592520	2598960	yeah let's move on quickly before i embarrass myself again yes so um this is kind of neat
2598960	2605800	on live apparently is ditching the monthly charge and they're going free um and apparently
2605800	2609880	they're also working on well they they talked about this they're working on a mini kind
2609880	2614880	of streaming console that's supposed to be manufactured soon apparently um the former
2614880	2621640	night 14.95 per month service i guess which was um through its founding members program
2621640	2630860	uh they have offered now a year of free service and apparently uh they're also going to be
2630860	2635160	offering a bunch of free demos and stuff to check out uh you can i think that the free
2635160	2641880	service is not free forever i think it's just um you know like a trial type thing and um
2641880	2647240	you can basically create an account with uh no monthly cost no credit card needed for
2647240	2653000	sign up and uh lots of free stuff to play and then the micro console it's gonna be like
2653000	2658160	a kind of a streaming box think of like a sling box or something like that with a controller
2658160	2664280	built in and you basically plug it into a tv i guess almost looks like maybe like a
2664280	2668960	was an apple tv or something like that yeah they were showing those at e3 it looked kind
2668960	2673320	of interesting the whole like plug into the tv stuff yeah i was like is this there's a
2673320	2676800	trick to this there's a computer in the box or something there's a trick i mean it's not
2676800	2681400	it's worked so far i mean they the apparently the stuff they've been showing is very low
2681400	2686200	latency so um apparently they got it to work over wi-fi now too like i remember one of
2686200	2691000	the big drawbacks originally was that it wouldn't work over wi-fi but now it does let's go figure
2691000	2696240	um well i mean that was certainly a drawback to online was this whole monthly fee like
2696240	2701600	really you're gonna like pay me a monthly fee to buy games seems a little strange it's
2701600	2705720	like you're having to join i'd like someone to pay me a monthly fee to buy games no i
2705720	2711080	thought that the monthly fee was just like to play whatever on their service kind of
2711080	2716160	no no no you still have to rent the games or buy the games and even when you buy them
2716160	2719540	it's only guaranteed for three years because you know you're playing on someone else's
2719540	2724440	computer so if the service ever gets shut down in three years or whatever then it's
2724440	2730200	it's gone so it's still a little bit iffy but if you're the type that just wants to
2730200	2736640	rent games or check out the game demos which certainly is useful um then it might be worth
2736640	2741760	it i still need to sign up and check it out i would like to make you use of the uh game
2741760	2746140	rental i think it might be kind of yeah the whole uh free demo thing might be kind of
2746140	2751140	cool because say for example you know you want to play like one of the new games that's
2751140	2755680	coming out recently or very soon or something like that and they have a demo for it you
2755680	2760260	don't want to spend time downloading i mean because some of these demos out there are
2760260	2765020	you know a few gigs in the download that it might take a very long time and then you have
2765020	2769980	to install it and that takes more time this you can just play it and go oh don't like
2769980	2777220	it go to the next one the no need to download install you know worry about doing all that
2777220	2782960	stuff just kind of play it as you go yeah and plus you could have like a crappy computer
2782960	2787740	and it still plays and that would be kind of cool to do with like say like an xbox 360
2787740	2792380	or something like that so i don't have to download the demo i can just boom play the
2792380	2796560	demo instantly i bet that i bet that's going to be a big feature in the next generation
2796560	2803940	of consoles maybe i've said i said a while ago that this is the games analyst in me one
2803940	2807980	of them probably playstation is going to be ballsy enough to try and go all digital just
2807980	2811540	cut out the physical media completely look out game stop that works so well for them
2811540	2819260	in the past i think it'll be different because it'll be that the problem with the psp go
2819260	2823800	is that it was really more lucky more well because it was more money for the removal
2823800	2827900	of the future but if they had charged like ninety nine dollars for that thing it would
2827900	2836540	have done great that's the difference so with the psp2 being announced next year i'm sure
2836540	2843940	we'll see what's coming well we will one thing we know is coming very soon is nba jam and
2843940	2847760	apparently uh lots of interesting stuff going on with nba jam i don't know if this was covered
2847760	2851180	last week or if it was this week or what but nba jam i guess got ended up getting split
2851180	2857420	off from the nba game on the 360 and the ps3 right yeah so now it's coming out as a standalone
2857420	2862500	game so that's kind of interesting and one thing uh we wanted to see an nba jam uh would
2862500	2866620	be hidden characters because you know the old school nba jam was awesome because it
2866620	2871260	had what it had like uh scorpion and some of the mortal kombat characters and what i
2871260	2874820	think bill clinton was in there somewhere right oh yeah well uh apparently this new
2874820	2881420	nba jam is is keeping with the political ha ha's and uh you can actually unlock obama
2881420	2887420	and uh sarah palin as playable characters so yeah uh there are it's out on the we now
2887420	2891500	so you can check it out and there's actually some codes have already been found on how
2891500	2900240	to unlock um certain things i guess you can get some furries and everything wow yeah i'm
2900240	2902920	trying to look at some of the things you can unlock here yeah it looks like you can unlock
2902920	2909500	some of the mascots there oh yeah they have the mascots available in the old ones a furry
2909500	2915820	dream you can have bush and chaney on your team why if because you want them to play
2915820	2921460	basketball bush has mad hoop skills of course there you go so i'm trying to look up some
2921460	2927400	of these codes where are they ah there we go you can unlock the beastie boys as a team
2927400	2933540	yeah it sounds like wow there's actually a lot of hidden people in this that's kind of
2933540	2941680	cool manute bowl is hidden in there good times um i was gonna say i don't know if you heard
2941680	2948720	about how close nba elite was to being released i mean to the point where an actual retail
2948720	2954560	copy of it leaked out like a disc because i guess they sent them to retailers and then
2954560	2960180	the retailers had to send them back oh wow and apparently according to the person that
2960180	2965080	bought one of the retail copies off ebay um the game was really buggy and really fucking
2965080	2971700	terrible like just all sorts of glitches and bad stuff in there um and then of course they
2971700	2979620	had nba jam on the ps3 with that um and apparently that was they have i guess some of the features
2979620	2984180	that they're talking about adding in now we're actually going to be download content in there
2984180	2988100	so they're saying oh yeah it's not done yet we're adding remix mode or whatever to the
2988100	2994140	game well actually we're going to release it anyways you just um now you're not spending
2994140	2999380	extra money for it or something uh tiger cloth sent me a link in our chat room at chat.org.com
2999380	3003340	and i remember seeing this early this week and kind of like rolling my eyes it's one
3003340	3010540	of these stories about um uh when people who don't play games talk about games oh yeah
3010540	3016540	did you hear about this this is on fox news game on sarah palin facing off against president
3016540	3023260	obama in basketball not on some court in washington or wasilla it's the new nintendo we version
3023260	3027980	of the video game nba jam and i apologize this is quiet head-to-head competition shooting
3027980	3033960	hoops along with a host of high profile politicians peter moore is president anyway they go on
3033960	3038540	to wonder if uh they're gonna make a bipartisan game and all this i'm just like really come
3038540	3043860	on anyhow they're pissed off because obama had some sort of super move and the rest didn't
3043860	3051260	so that's unfair they're biasing you know well he's the president and the rest aren't
3051260	3058660	i mean it's really quite that simple right in theory right uh anyhow rob what how about
3058660	3063300	something a little different how about something a little different more about the we well
3063300	3069820	we just had a story on the way but this is about capcom oh okay um there's going to be
3069820	3075260	some more um downloads coming up for virtual console of course this is uh particularly
3075260	3085820	um for the uh uk release um there is going to be um ghouls sorry ghosts and goblins which
3085820	3093280	we love in this house and 1942 will be available also um black dragon which is a little obscure
3093280	3100860	um they're also going uh they said they don't have a date yet on them but they're going
3100860	3107200	to be 800 points apiece and also other uh ones that uh were recently announced were
3107200	3116160	commando sonson and xx so x texas xx where's quiz and dragons i've been i've been asking
3116160	3122540	since the top of the show where's my quiz and dragons is that on the list no alas no
3122540	3126100	rob it is not on the list i like though that a lot of those games you're mentioning are
3126100	3129500	kind of like the ones outside the box like they're not like all the mainstream arcade
3129500	3134300	games i mean maybe like ghosts and goblins commando awesome but like you know sun sun
3134300	3138780	like what's next hiji maru remember that one hija maru hija maru that's it the the one
3138780	3142340	that's on the pirate ship i don't even think it came out in the us but it's an ultra kade
3142340	3148700	that's the only way i ever played it pingo pingo was a sega game wasn't it sega i was
3148700	3154460	just thinking of more obscurity there you go i like this but the there's a little bit
3154460	3158100	of delay between when we talk and when the chat room gets it so the chat room is commenting
3158100	3164100	on the whole fox news thing chat.orangecountry.com this is a good joke uh hits they're talking
3164100	3167700	about how you know obama gets the special move the republicans have nothing hits done
3167700	3174780	goes but all the republicans have an eight and steal get it it's a political joke come
3174780	3179180	on come on come on no matter what side of the political spectrum you're on that's that's
3179180	3185260	kind of funny i want abraham lincoln to be in nba jam i think they should do an all presidential
3185260	3190860	one that'd be awesome and why leave it to just us presidents why not why not do some
3190860	3196940	royalty as well that's right get margaret thatcher and queen elizabeth lady gaga while
3196940	3200900	we're at it should definitely be on a team i'm really surprised so with nba jam being
3200900	3205180	the way that it is you know where it's just you know static headshots and stuff like that
3205180	3209180	they didn't have a way to put yourself in the game i mean because all it really is it's
3209180	3214900	just your you know it's just 2d headshots because that will be nba jam people will have
3214900	3221140	like middle fingers up for haters man well you don't have to you don't have to have that
3221140	3224260	available online you can have that where you can just you know if you want to play that
3224260	3229740	yourself like my me characters those you know we have what upside down head we have you
3229740	3235820	know vagina person you know it's just ridiculous stuff penis face you know that's on it you
3235820	3240540	know they're walking through the meat parade no it's great because we were playing uh not
3240540	3244180	necessarily i don't really know if i have the penis one anymore but we were playing
3244180	3251060	uh mario kart wii one day and there my boss was watching and he's like did i just see
3251060	3259220	hitler in the background like yeah nice you might have and chuck norris well uh we have
3259220	3261980	a list list coming up i don't think we're gonna end up doing it tonight i think we'll
3261980	3264780	roll it over to next week when we actually have a special guest here but we're actually
3264780	3270100	gonna do a list list on character i most want to see in nba jam so you can look forward
3270100	3273380	to that we'll probably end up doing that next week i think we're gonna table that to next
3273380	3276300	week because we didn't end up having a fourth person here tonight we are gonna have a guest
3276300	3279540	next week i'll talk more about that a little later on in the show because it's it's very
3279540	3283780	exciting for very exciting reasons it's gonna be retro-tastic next week and i'll tell you
3283780	3287940	why exciting guest is exciting a little later on in the show uh in the meantime let's go
3287940	3292060	and travel the world and look at some release dates and what's coming soon to a store near
3292060	3299160	you loki he has lots of good stuff actually um because we're knee deep in releases this
3299160	3307500	week um starting off of course the big one medal of honor on playstation 3 xbox 360 and
3307500	3319180	pc um arcania arcania gothic 4 coming on xbox 360 super scribble knots now with adjectives
3319180	3326520	um coming out on nintendo ds this week um some slightly crappier games dealer no deal
3326520	3332540	special edition now with a plastic briefcase that you can hold your nintendo ds in that's
3332540	3338820	of course on the ds sled shred featuring the jamaican bobsled team wow that would have
3338820	3343900	been good like years ago um that's coming out wasn't john candy in the cool runnings
3343900	3348540	movie that was about the jamaican bob yeah that's how old that is that shows you how
3348540	3354700	old it was because he died what like 15 years ago god rest his soul he was an awesome comedian
3354700	3361620	but this is a terrible game and it's on the we um other fun stuff let's see disney sing
3361620	3372500	at party hits on the we and ps3 uh zuzu pets kung zu on nintendo ds and we uh or maybe
3372500	3377660	just on the ds vampire moon the mystery of the hidden sun it's another adventure game
3377660	3383740	on nintendo ds um you know frisbee in our chair room that's a damn good question is
3383740	3387500	deal or no deal still on i don't think it is like the syndicated one got canned this
3387500	3391700	year didn't it i don't know you know what's coming back though because i read game show
3391700	3397180	blogs one versus i think dylan or deal is still on there because now they're doing the
3397180	3401540	stupid thing where it's like the actual contestants are opening the cases i couldn't afford to
3401540	3404080	pay the models anymore that was that that was the syndicated one i don't think that's
3404080	3406980	on the air anymore i think that went off the air to make room for the this year's batch
3406980	3411900	of you know judge shows and all that but no i will say one versus 100 is officially coming
3411900	3415980	back to game show network and it has a new host it's not going to be bob saget you're
3415980	3421780	ready for this look who's guess who's hosting one versus 100 now arsenio hall tested for
3421780	3426860	it but no they passed over arsenio hall for ready get your groaning noises right oh wait
3426860	3431320	let me get sad tuba ready hold on hold on i need a sad tuba ready for this let me think
3431320	3440300	i'm trying to guess how terrible it could be um uh it's not mark mcgrath is it no it's
3440300	3445380	not he's i think he does the lyrics show yeah but he's still terrible okay no uh hosting
3445380	3451580	one versus 100 on game show network with a top prize of 50 000 down from a million carrie
3451580	3462820	and anaba from dancing with the stars oh huh yeah exactly dude she's she's the girl on
3462820	3466100	dancing with the star i'm telling you because you know it takes a real dancer to know how
3466100	3470900	to if you want to get one place bob saget you know who you need you need the pick what
3470900	3475820	tom berseron tom berseron yes exactly well he's busy hosting dancing with the stars there's
3475820	3480580	like the biggest show on tv now oh come on it doesn't take that long to host dancing
3480580	3484940	with the stars i mean come on he can fit it in his work day to go host that other show
3484940	3490780	i mean shit well that's like you know maybe four hours at the most it's crazy pants to
3490780	3494860	me though that the one versus 100 is like gone from xbox live so they can do this cheap
3494860	3498580	version on game show network with carrie and anaba you know what i mean no disrespect i'm
3498580	3502140	sure it'll be fine and it's gonna be you know for an original game show it'll be fine did
3502140	3506980	you know this is still sad totally random but it makes no sense because i i actually
3506980	3513580	saw this on um it was on the soup i think punked is coming back and they're having justin
3513580	3518980	bieber hosting it no that is a lie that has to be a lie i don't believe that that has
3518980	3526860	as much truth as the lapd buying all the jet packs that's how true that story is come on
3526860	3534140	no way justin bieber is too busy like he's making 15 year old girls panties wet all across
3534140	3539060	internationally that's that's his job he doesn't have time to do and seriously they have like
3539060	3543420	a bunch of other cast members from that 70s show that aren't working right now that exactly
3543420	3554220	hosts exactly come on all right sorry uh no that's okay anyways um other fun stuff that's
3554220	3558460	coming out this week okay well my other stuff coming out this week uh zusi pets a wild bunch
3558460	3563220	on the wii and ds and guess what you can actually buy a version with a stuffed hamster woo stuffed
3563220	3570700	hamster uh my baby my baby three on on the nintendo ds this is the game that actually
3570700	3576920	had a lawsuit um pending with it because majesco and apparently some other company were fighting
3576920	3585380	over the rights to my baby they're fighting over my baby um borderlands game of the year
3585380	3590180	edition coming out this week that's right borderlands with all the extra download content
3590180	3595300	all for 60 bucks that's on playstation 3 and xbox 360 seriously if you don't own this game
3595300	3599620	you need to buy it which i don't actually so this might be a good deal by it's fucking
3599620	3603340	amazing i'm gonna i'm gonna wait for the price drop the inevitable price drop that will happen
3603340	3607340	on this game um i think the original game has already dropped in price no but i can
3607340	3611100	get the one with all the uber content yeah right isn't there like a zombie expansion
3611100	3615220	or something yeah that was one of the first expansions i need that don't i it's it's awesome
3615220	3620820	it seriously is awesome um okay and then the invisimals coming out on the psp this week
3620820	3626540	that's right it's the game with the camera yay camera i've only been waiting years for
3626540	3632620	that stupid thing to come out on the psp and now you release it with a crappy ass game
3632620	3640540	by the way ipets coming out in the psp a couple weeks anyways yay terrible uh luffia curse
3640540	3646360	of the sinister rolls on nintendo ds wow isn't a luffia is old school isn't a luffia what
3646360	3655700	i use in the shower to watch that's a luffa okay uh canada hunt on the we that's where
3655700	3663140	you hunt canadians awesome really no it's not oh i was like damn if by canadians you
3663140	3671580	mean native wildlife in canada um like mooses and shit yes oh boring uh dragon's lair trilogy
3671580	3675780	this is awesome because it doesn't have three dragons there was no third dragon's lair i
3675780	3680420	bet one of them is space ace you are correct i'm like wait a minute there was no dragon
3680420	3686580	dragon dragon's lair three it's sort of dragon's lair it's dragon's lair in space oh sorry
3686580	3694940	uh lucha libre heroes del ring um that's coming out on uh xbox 360 and playstation 3 this
