start	end	text
0	20720	Tonight, October 10th, 2010, DC Universe Online faces a delay, OnLive gets cheaper to use,
20720	32080	and another classic arcade game is set for revival on this gents consoles.
32080	36160	Hello my friends out there on the internet and welcome back to another week of Orange
36160	37320	Lounge Radio.
37320	39960	We are that show where every gamer has a voice.
39960	44440	We tape live every Sunday night at 6 o'clock Pacific, 9 o'clock Eastern at All Games Radio.
44440	46760	And we don't forget the episode number.
46760	47760	www.allgames.com.
47760	49560	I always forget the episode number.
49560	52640	It's episode 385 for those that are still counting.
52640	56720	The smartass you hear over there in the corner is my lovely co-host, the one and only Dark
56720	58760	Sakura, Jamie Summers.
58760	59760	How are you?
59760	61840	I'm inhaling bacon fumes and it's not kosher.
61840	66480	I know, this whole room is not kosher at this very moment.
66480	70040	You're helping to balance, give this room kosher balance.
70040	74040	Say hello to the fan of double bacon pizza, Loki.
74040	76480	Because I've tried triple bacon pizza and that's just too much.
76480	77480	That's too much bacon.
77480	78480	And we did that on a large.
78480	83400	I mean, that was a lot of pizza or a lot of bacon because I remember we're like, I wonder
83400	87080	because there's a, there used to be a guy when I was working at Roundtable that would
87080	89320	order a quadruple sausage pizza.
89320	94520	It literally is like a three quarter inch thick layer of sausage that's just on top
94520	95520	of the pizza.
95520	98600	For those that don't know, Roundtable is a big pizza chain on the West Coast.
98600	100880	The whole West Coast or just California?
100880	101880	Mostly California.
101880	105600	You can make it work if you did extra cheese, triple bacon.
105600	106600	You're right.
106600	111200	The problem was it was too greasy and actually the point is actually you couldn't really
111200	112680	taste the pizza with the bacon.
112680	115780	This is actually really sweet because the sauce is really sweet.
115780	119560	But it might be able to work with like two and a half times bacon.
119560	120960	It would work if it was on a rack.
120960	124120	Do you remember there was an episode probably about two years ago, maybe a year ago, where
124120	126980	you brought like all these bacon dishes to the show?
126980	131240	Like I never thought in my life that I would ever say this is too much bacon.
131240	132240	That was last year.
132240	133240	That was too much bacon.
133240	134240	Was it last year?
134240	135240	That was my birthday last year.
135240	136240	That was actually really good.
136240	137240	That was a lot of bacon.
137240	138520	But there was so much bacon left over.
138520	139520	Yes, there was.
139520	140520	It was too much.
140520	142800	And you guys left it at my house.
142800	149400	I would probably do just like a meat party instead because seriously, bacon, even cooking
149400	152720	it the entire day, it just doesn't get, it's not very good.
152720	155040	Now steak party, that's good.
155040	158240	That sounds like a game that they should sell on the shelves of Target right between like
158240	160080	Blind Date and Mall Madness.
160080	161560	Meat party.
161560	163160	That totally could not be here.
163160	165600	I only eat meat once a month.
165600	167200	Well they'll have to be on that day.
167200	168200	All right.
168200	169200	Anyhow.
169200	170200	Hi.
170200	171360	I missed you guys last week.
171360	173880	My aim is still improving ever so much though.
173880	174880	But you know.
174880	175880	Oh we did fine without you Rob.
175880	176880	You can just go home if you want.
176880	177880	Okay bye.
177880	178880	No I'm kidding.
178880	182480	No well actually I turned on the show while I was at the airport just to make sure that
182480	184640	you guys like were alive.
184640	186400	Because you didn't trust us.
186400	189360	Well I don't, you'd never had done it before so I just want to make sure you didn't get
189360	190360	into a train wreck.
190360	191520	You know what I mean?
191520	194700	And then you guys, I heard like five seconds of the show, you guys were on the phone with
194700	198240	Aki Ripper and I'm like oh okay they're already into calls so they're done bye.
198240	199760	And then after that everything fell apart.
199760	200760	No it didn't really.
200760	201760	It's because I tuned in.
201760	202760	We kept losing the stream.
202760	204480	It's because I tuned in.
204480	206320	So what did I miss on last week's show?
206320	207920	I have not heard it yet.
207920	211240	And I apologize to the podcastees because they, I mean by the time they hear this they'll
211240	212240	be okay.
212240	213240	You missed Tiara.
213240	216000	Well I've talked to Tiara before.
216000	217000	I know she's a fun gal.
217000	218000	I enjoy her.
218000	219840	But you missed her fun hosting capabilities.
219840	222660	Did she did she do the Rob role where she kept you all in check?
222660	225200	Make sure you were following the show role?
225200	226200	Did she?
226200	227200	Yeah.
227200	228200	Yeah.
228200	229200	Great.
229200	233280	I'm sure that show was awesome.
233280	234280	No I'm kidding.
234280	237360	I think I skipped a story once and then we went back and did it.
237360	238360	All right.
238360	241640	Well I'm glad to hear things were good and that means I can take vacations more often.
241640	244080	It's better than the last time we tried to run the show without you.
244080	247280	Wasn't that the show where you ended up watching like a porno?
247280	248280	Yeah.
248280	249280	Good times.
249280	250280	Good times.
250280	255960	Well I went to Disneyland last week as you guys know and I had a good time and yeah I'm
255960	257680	fresh out of Space Mountain.
257680	260340	But Dark Soccer and I are still trying to get the December 17th thing to work.
260340	263880	We got to just cross the T's and dot the I's and all that stuff.
263880	267720	I have an annual pass again so going back won't be a problem for me.
267720	271560	And I saw some of the pictures from Electronica which started this week and they actually
271560	274720	have a whole little Flynn's arcade with like 80s old school video games.
274720	275720	We're there.
275720	276720	I know it's gonna be fun.
276720	277720	We're going.
277720	278720	Good times.
278720	279720	Anyhow.
279720	280720	No one.
280720	281720	No one.
281720	282720	No one.
282720	283720	And if they try.
283720	284720	Except maybe the bank.
284720	285720	Smite.
285720	286720	Maybe the bank.
286720	287720	The bank could stop us.
287720	288720	All right.
288720	289720	Smite.
289720	290720	Let's start off the show.
290720	291720	Let's see.
291720	292720	We've talked about food.
292720	293720	We've talked about Disneyland.
293720	294720	Is there anything else we talk about on this show?
294720	295720	Oh yeah.
295720	296720	Video games.
296720	297720	Once in a while we talk about video games.
297720	298720	How about Rainbow Farting Universe?
298720	299720	Here on the show.
299720	300720	No.
300720	301720	Seriously.
301720	302720	Someone.
302720	303720	All right.
303720	304720	I was at Outback last night for my one steak a month.
304720	305720	Quit.
305720	306720	I quit.
306720	307720	I'm going back to Disneyland.
307720	308720	And I did my.
308720	309720	And someone says, do you need anything else?
309720	310720	Do you want anything else?
310720	311720	I say, yeah.
311720	312720	Like a pony, please.
312720	313720	And she said, oh.
313720	317720	And the girl said, my friend Jamie always asks for a unicorn that poops rainbows.
317720	320560	And I was like, my name is Jamie.
320560	322200	And she's like, oh wow.
322200	326040	My answer would be, how would you like that cook?
326040	327040	I would.
327040	328040	I guess you had to be there.
328040	329040	All right.
329040	330040	It was funny.
330040	332040	I'm sleep deprived.
332040	333040	Rob got.
333040	334040	Rob brought me caffeine.
334040	335040	Unprompted.
335040	336040	Well here.
336040	338240	Well, cause I know it puts you in a good mood and I don't wanna have to deal with a bitch
338240	339240	Jamie all night.
339240	340240	Anyway.
340240	341240	Love hearts.
341240	343520	Um, here's the thing.
343520	344520	Here's the thing.
344520	348160	I see some folks in chat complaining that the podcast is not yet uploaded from last
348160	349160	week.
349160	352640	And I swear I'm not doing it out of a spite.
352640	353640	No, here's the deal.
353640	356080	I got like super sick.
356080	357080	I had to miss.
357080	358920	I missed a day at Disneyland due to being sick.
358920	363400	I made Alan go to the park without me on Sunday and I thought I was getting better come Monday.
363400	365940	But then like Tuesday, the day I was supposed to come over and get all the show stuff taken
365940	366940	care of.
366940	367940	I had the worst fever.
367940	371360	I had to call in sick to work and that that's a big deal for me to call in sick to work.
371360	372360	Cause I really don't.
372360	373360	Rob has amazing work ethic.
373360	376120	Fantastic rib places across the street from Disneyland.
376120	377720	Actually we did eat at Tony Roma's.
377720	382480	Yes, we did eat there actually.
382480	383480	That's right.
383480	384480	I haven't seen him in forever.
384480	385480	Yeah.
385480	386480	So, all right.
386480	387480	Anyhow.
387480	390920	Tony Stark's house of ribs.
390920	393520	All right.
393520	397800	I'm just reading the chat and a salacious pop is just going, wow, Rob, you can't.
397800	399880	I was, I was mean to Jamie.
399880	401520	I didn't mean it.
401520	402520	Come on.
402520	404160	You guys, I have to, I have to razzle on the show.
404160	405160	I got him.
405160	406320	I got last week to make up for.
406320	408880	Come on you guys.
408880	410320	And your, your mic sucks.
410320	411320	That is not a lie.
411320	412920	I went, you went to the place without me.
412920	413920	I know.
413920	414920	I'm sorry.
414920	415920	All right.
415920	418780	Let's talk about, cause we do talk about video games once in a while on the show.
418780	420860	How was your gaming week and dark soccer?
420860	421860	How was your game?
421860	423120	We, we really, really do need to get the mic cord.
423120	426560	I thought for some reason my cord here, I pushed it out last week.
426560	427560	All right.
427560	428560	We'll just get anyone.
428560	430120	I think it got loose is what it is.
430120	431120	It's loose.
431120	432120	Like a hoo-er.
432120	438760	Um, I, I was going to play Final Fantasy 13 and didn't.
438760	443840	Dan's been in there with our friend George over here playing Halo Reach all day and I
443840	448560	played Star Trek online and I'm doing, I've got actually until tomorrow to finish the
448560	455360	other three missions in this whole Breen thing so that I can get my free Breen tactical officer
455360	459460	because I have a shit ton of homework to do the rest of the week.
459460	462040	So J busy, Jamie is busy.
462040	464560	Um, I played lots of plants versus zombies.
464560	468560	I played in our bacular drop, which we know that is right.
468560	469560	Yeah.
469560	470680	The bonus moments in the game, right?
470680	472680	The precursor to portal.
472680	481640	Oh, the game that, oh yeah, I'm not any good at it and it's like, it's a neat concept.
481640	488240	I mean, but I'm glad that portal made it less, uh, Clippy, if you know what I mean with fewer
488240	490200	trolls in it.
490200	495520	Um, and then what else did I play?
495520	501120	Um, no, a lot of plants versus zombies, a whole lot of plants versus zombies.
501120	502120	You beat it yet.
502120	503120	I don't know.
503120	504120	Yeah.
504120	505120	Is it beatable?
505120	506120	I don't know.
506120	507120	Yeah.
507120	508120	You can beat adventure mode and then you do it again.
508120	509120	I've played it a couple of times, but never for an extended period of time.
509120	515500	So now I'm trying to do the, uh, the no fungus among us achievement where you don't use fungus
515500	517120	at night or something.
517120	519120	I don't know.
519120	525000	Um, no, no, I know I played something else.
525000	526000	I just can't remember what it is.
526000	528680	Dan's played a whole lot of Mega Man.
528680	529680	Like old school Mega Man?
529680	530680	Like NES Mega Man?
530680	531920	Mega Man 4 Game Boy edition.
531920	533380	That's random.
533380	535600	What makes a person think I want to play Mega Man 4 on the Game Boy?
535600	537000	He's been watching Mega Man playthroughs.
537000	538000	Oh, okay.
538000	540000	So my husband's a dork.
540000	541000	All right.
541000	542000	Heart.
542000	545240	I think the Mega Man collection on a GameCube is still an awesome game to have because you
545240	547800	know those GameCubes can, you can still play them on the Wii.
547800	548800	Yeah.
548800	551320	So it's still a good collection to have or the PS2, whatever, whatever one you want.
551320	555600	Some people don't like the GameCube one cause I think the buttons are swapped or something.
555600	556600	So but it's fine.
556600	557600	It doesn't bother me.
557600	558600	Either way is fine.
558600	559880	You're not bothered Rob.
559880	560880	No.
560880	564680	And um, I've been keeping Super Metroid all warm and cozy for you.
564680	565680	Awesome.
565680	566680	Yeah.
566680	567680	We played a little bit of that last.
567680	570440	Cause I wasn't here on the last show, but I don't know if you mentioned it, but yeah,
570440	571840	I came over at like that Tuesday.
571840	572840	We played some Super Metroid.
572840	573840	It was good times.
573840	575680	And we beat turtle after you left.
575680	576680	Did you?
576680	577680	Yeah.
577680	578680	Good times.
578680	581680	I had to switch to Donatello.
581680	583160	I like the long stick.
583160	584160	Oh my.
584160	585960	Loki, how was your gaming week?
585960	588120	Um, it was okay.
588120	589120	I didn't play a whole lot.
589120	592120	I played mainly uh, Grand Theft Auto.
592120	596080	Um, you know, more Grand Theft Auto 4, Lost and Damned.
596080	597240	Still play more multiplayer.
597240	602880	I am really pissing off my coworkers because I'm, I keep winning a lot and I've actually
602880	609100	had to draft up a printed out form letter for apologies for beating them at certain
609100	612180	things that I, I fill out.
612180	618160	So um, I don't know if that adds insult to injury or what, but it's what they requested.
618160	620360	So I'm sorry that you suck.
620360	624280	That sounds like you had to like make your amends to your coworkers.
624280	628400	Like it's because, okay, the game is so lagging out.
628400	633520	Like um, I think they shut down some servers or something when they're, when they moved
633520	636880	on to new expansion and Red Dead Redemption, that kind of stuff.
636880	642720	So the game, it gets a little laggy sometimes and sometimes things just seem to go my way.
642720	648080	Like um, you know, they'll be coming to attack me and all of a sudden a car hits them and
648080	654040	they get knocked over and I turn around and shoot them in the face or uh, I, you know,
654040	658960	my big thing now that I've been come, you know, kind of become fascinated with is climbing
658960	659960	up buildings.
659960	664440	Like I'm totally this like massive free runner in that damn game now.
664440	665440	It's ridiculous.
665440	667840	Like the, how the fuck did you get on top of that skyscraper?
667840	668840	It's like you're Spiderman.
668840	671360	It's seriously, I'm like Spiderman in that game.
671360	672360	It's ridiculous.
672360	679620	Um, and there's a lot of places in, especially in Algonquin that you can just climb up to
679620	684540	the top of buildings and there's so many like fire escapes you can get to and it's ridiculous.
684540	686760	So you had to write your coworkers apology letters.
686760	689760	Like were they like at the point where, we're not playing with you again cause you're a
689760	690760	jerk.
690760	692760	They're getting pretty pissed off at me.
692760	693760	It's bad.
693760	695840	It's, it sounds like you had to write your amends letters.
695840	699180	Like one of the things I was doing when I was sick is I was watching a lot of intervention
699180	703960	on A&E and one of the episodes I was watching was the follow up episode to the chick that
703960	704960	inhales computer duster.
704960	707840	Did you ever see this episode of the chick who inhales the computer duster?
707840	711760	It's like I'm walking on sunshine.
711760	712760	She's walking on sunshine.
712760	715040	It's like I'm walking on sunshine.
715040	718880	But anyways, inhaling computer duster, it's toughing.
718880	719880	It's toughing.
719880	722560	It's some way kids get high and it's really dangerous.
722560	723560	Don't do it.
723560	724560	Really, really dangerous.
724560	725560	Like you do a whipped cream.
725560	726560	I guess.
726560	727560	Yeah, like that whole thing.
727560	728560	So that's where that South Park thing came from.
728560	729560	Yes.
729560	730560	That's where the towel thing on South Park comes from.
730560	734120	But anyway, they had like a follow up episode to her and she, as part of the follow up,
734120	735260	she's, she's all better now.
735260	736920	So, you know, hooray for her.
736920	738480	And she's, she's not doing that stuff anymore.
738480	739600	One thing she had to do was make amends.
739600	741720	So she had to like write a letter to the police.
741720	745240	Like, I'm sorry, I put up a fight when you try to arrest me and dah, dah, dah.
745240	746720	And write to the people at Walmart.
746720	750020	I'm sorry that I would come in every day and buy 10 cans of computer duster.
750020	753160	So like it sounds like Loki is like having to write amends to his coworkers.
753160	757880	Like I'm sorry that I repeatedly beat your ass at Grand Theft Auto and I'm sorry you
757880	759520	can't handle it.
759520	762360	Sorry you suck.
762360	763480	It's not necessary.
763480	768480	It's only when like, you know, really ridiculous things happen that, you know, shouldn't happen
768480	770320	normally in the circumstances of the game.
770320	773640	So I don't know, whatever.
773640	777880	Other things I played other than Grand Theft Auto, I did play a little bit of Dead Rising
777880	778880	2.
778880	780840	And I really do mean a little bit.
780840	787960	I mean I only got to the part where they get into the, what is it, the shelter and that's
787960	788960	it.
788960	792800	I mean that's like literally five minutes into the game.
792800	793800	It's cool though.
793800	795400	I am really excited to play the rest of the game.
795400	798040	I just really pressed on time.
798040	802880	The other thing of course, obviously since I have my iPod with me a lot during work hours
802880	807880	and you know, when I'm watching the baby, I've been playing a lot of Geared, which is
807880	811280	a puzzle game with gears that you have to move different gears around to try to get
811280	812960	all the gears to spin.
812960	814520	And it's pretty fun.
814520	816720	It's kind of addicting.
816720	824940	I am digging though this one app on there called the free app watcher, or free app tracker.
824940	830060	And they'll basically track or let you know when apps drop in price to free.
830060	833280	So you can go on there and browse through there and download games that would normally
833280	837920	cost you money because they're either trying to promote them or whatever.
837920	843240	So that's kind of cool, a great way to get a bunch of free shit.
843240	844880	So yeah, that's pretty much what I've been playing.
844880	848440	I'm excited to get a new laptop this week that will actually be able to run Grand Theft
848440	852720	Auto on it so I can do my editing at work because that's really the only time I'd actually
852720	857480	have to do mods for the Xbox 360 version.
857480	861960	Plus I can run other things on there and I'm possibly going to download Minecraft now since
861960	863800	everybody keeps talking about it and I got to see what this thing is.
863800	867680	I somehow missed the boat on all this Minecraft stuff because it's just really happened in
867680	872160	the past couple weeks, but why is everybody all gung ho about Minecraft?
872160	874160	I somehow missed this while I was on vacation.
874160	877880	It went free for a while while they were fixing some server issues or something and once people
877880	879680	start playing they're like, oh my god, it's addictive.
879680	884720	It's basically a game you go in and you create stuff.
884720	885720	And then there's monsters.
885720	887440	There's a lot of games like that in there.
887440	889720	Well yeah, but this is really addicting apparently.
889720	890720	Okay, I'll have to try it.
890720	891720	I mean, don't knock it till you try it.
891720	892720	I've heard a lot of things about it.
892720	897160	To the point where there's someone like recreating the Star Trek Enterprise full scale in the
897160	898160	game.
898160	899160	That's cool.
899160	900640	So it's kind of like Legos but a game.
900640	901640	Something like that.
901640	904920	It's like Leo Universe, but not.
904920	909120	We've created a new game in the chat called Poopville.
909120	912840	I'm looking at our chat room chat.orangelandraday.com if you want to join us live on this Sunday
912840	916440	evening and that's chat.orangelandraday.com and I see all this talk about Farmville.
916440	918640	I think the whole talk about addiction and intervention.
918640	920920	My mom's addicted to Farmville.
920920	921920	Wow.
921920	924000	And I'm looking at a defective candy in our chat room.
924000	925000	That's not a name I've seen before.
925000	926000	I don't think so.
926000	927000	Hi.
927000	930180	I just shake my head with shame whenever someone comes in and buys one of those Farmville cards
930180	933920	for work and like wow people really do buy those.
933920	938280	But you know what actually I can relate this to Disneyland a little bit.
938280	942280	You know I do the pin trading at Disneyland and I always buy like a generic pin set to
942280	946800	trade away to people to because the employees trade with you and it's this whole little
946800	949280	like weird game you play while you're at the parks.
949280	953280	So I bought a pack of starter pins and you know what the pack was that I bought of starter
953280	954280	pins?
954280	956000	Club Penguin.
956000	960100	And like almost all day long people kept asking me like what are those pins?
960100	961100	What is it?
961100	964360	And I'm having to like explain Club Penguin to people which is weird because I've never
964360	965360	played it.
965360	970380	But it's one of those like Disney style Farmville-esque MMOs and they sell those cards right next
970380	971740	to the Farmville cards at the store.
971740	973760	But it's more for kids because it's Disney.
973760	976880	So yeah people actually buy that stuff.
976880	981720	But I mean the kids stuff I get because the kids stuff you really have to ration.
981720	985120	I get that a little more but the adult stuff it's like oh boy.
985120	986120	Oh boy.
986120	991680	Yeah so again if you want to join us in chat chat.orangelaundryday.com.
991680	993360	Anything else you want to mention about your gaming week?
993360	994360	Loki are you all done?
994360	995360	You all done?
995360	996360	I'm done.
996360	997360	All right.
997360	1000280	I don't think I have a whole lot for my gaming week I gotta be honest since I was out for
1000280	1003200	five days and then I was sick I didn't do a whole lot of gaming.
1003200	1004200	Just a lot of sleeping.
1004200	1008760	I did play some more World of Warcraft because you know I'm a little yeah shut up.
1008760	1012020	Hey my guild is nine of twelve now in ICC finally.
1012020	1013020	We're almost there.
1013020	1014020	Sounds like a Borg designation.
1014020	1015200	Doesn't it?
1015200	1018960	We just have to get Putricide and Cindergosa and then we'll be on our way to the Lich King.
1018960	1021120	So we're progressing along nicely there.
1021120	1025280	I did a 25 man run over the weekend that was it was interesting.
1025280	1028200	It got a little it was a little slow to start so in a little later than I thought.
1028200	1031260	I don't feel so bad about my Breen thing now.
1031260	1032260	What's that?
1032260	1033260	Your what thing?
1033260	1034260	Breen.
1034260	1035260	What's that?
1035260	1036260	They're a race in Star Trek.
1036260	1039640	Oh is this like a thing you're trying to like you have to grind a lot to get to play them
1039640	1040640	or?
1040640	1041640	No no.
1041640	1043800	And I'll tell everyone right now who's playing Star Trek online.
1043800	1047060	They have me they're having a special that if you do the Breen episodes there's five
1047060	1052480	of them when you finish the last episode you get a Breen tactical officer.
1052480	1053480	Only until the 14th.
1053480	1054480	Wow.
1054480	1055480	So that's what I'm doing.
1055480	1057240	Only I've got tomorrow to finish it.
1057240	1058240	Random.
1058240	1060620	I'm sorry but I'm saying now I don't feel so bad about my Breen.
1060620	1061720	That's all right.
1061720	1063760	There's holiday events and wow that are just as bad.
1063760	1066760	So yeah it's mostly been that because you know I was away for five days and then I was
1066760	1069160	sick and everything so I haven't been playing a whole lot.
1069160	1073000	Plus I spent a lot more at Disneyland than I should have.
1073000	1076380	So I've been scaling back in other ways like I was going to get the Castlevania game this
1076380	1079040	week but I've heard mixed things on it anyway.
1079040	1083480	I've heard it's not so hot like that's that's the general reaction I've been seeing on Facebook.
