start	end	text
5077400	5084040	1992 um it was only out in japan for the longest time on the super famicom and um it's super
5084040	5094480	fun it's the uh stars a guy named farts who actually the longest time it was but which
5094480	5103480	i used to laugh um a meteor falls and he goes to check it out and then oh noes we need the
5103480	5110520	crystals we have to uh seal x death which is the coolest name for a bad guy in a series
5110520	5118480	ever x death would you be afraid i might be afraid of x death anyway the cool thing about
5118480	5126980	this game is the job system um you your experience point and you battle monsters and stuff like
5126980	5133760	any final fantasy game you can get a chocobo and you get a ship and an airship and you
5133760	5139200	do different stuff this is the second one that uses the act of time battle where time
5139200	5144360	will flow continuously for both players and enemies which was first and final fantasy
5144360	5151400	4 which was 2 when it came out over here um the job system though is a really cool thing
5151400	5158800	because um you can gain different special abilities and sort of mix up your jobs um
5158800	5165080	you get ability points so you increase the job levels for different characters and you
5165080	5172680	can also say uh so you have a knight who also has white magic levels well then you become
5172680	5178600	a paladin for an example um you this is also the game that introduced the blue mage the
5178600	5185840	time age and the mind so that's why we have them in other final fantasy games um it was
5185840	5193440	a really cool game it had lots of cool characters you have uh lenna barks faris kriel they're
5193440	5200320	really cool um also a reoccurring boss which is what this music is is gilgamesh always
5200320	5205960	gilgamesh lots of gilgamesh battles um so yeah it's a pretty cool game um if you haven't
5205960	5210480	played it yet for the longest time you can only play it you know if you either had the
5210480	5216640	cartridge or had a really good emulator free japanese or it was translated um so it's really
5216640	5226680	cool um it was also one of and your microphone failed at this game what you can hear me now
5226680	5233640	i can okay well as i was saying it's one of the ones that was uh directed by sakaguchi
5233640	5240480	sorry and this is his favorite final fantasy game um all the character designs logo everything
5240480	5248400	was done by um Amano Yoshitaka Amano who is my hero and um the battle graphics are done
5248400	5258400	by Nomura that's pretty cool and um there had great music it's it's final fantasy it
5258400	5264660	was done by Uematsu there's a two disc album that came out with all the tracks on it which
5264660	5270440	i've got somewhere and then it also had a bunch of uh remixes there was a piano collection
5270440	5278160	final fantasy 5 and the remixes including final fantasy 5 mambo de chocobo we have since
5278160	5286240	seen it elsewhere um it's come out um on the playstation in japan um there was a final
5286240	5289520	fantasy collection that came out over here that had final fantasy 4 and final fantasy
5289520	5297880	6 on it it had a full motion video opening very cool and then we had the final fan the
5297880	5309880	final fantasy anthology um also on the playstation and uh they uh that's why they uh cheat where
5309880	5324000	they change the name to uh art and gill instead of guido um there was a playstation 2 release
5324000	5335480	there was a gameboy advance release that had uh an extra level and a new boss and they
5335480	5344360	were uh designed by Amano and then there was final fantasy 5 advance and uh it was really
5344360	5349200	cool there was however an automated it was called final fantasy legend of the crystals
5349200	5356440	that was an oav that was done by studio madhouse and uh it was the sequel to final fantasy
5356440	5367080	5 so there you go all right your classic game of the week boys and girls final fantasy 5
5367080	5371200	the one that was just too cool for america for so many years but finally square came
5371200	5376520	to their damn senses so there it is they were tired of you people just downloading roms
5376520	5381240	here shoot salacious popping our chairman says can i ask why we haven't heard of final
5381240	5386800	fantasy 5 or 6 for ds yet 3 and 4 remakes were white glove and awesome i would like
5386800	5390600	to see a 5 remake on the ds they're working they were working on one really there's a
5390600	5398440	talk of it but not just at last interview maybe they will be on the 3ds maybe that's
5398440	5403440	why it's been held up a little while that's right very special all right we're gonna take
5403440	5406880	a break here at orange lounge radio but never fear we'll be back in just a little bit with
5406880	5410480	plenty more of orange launch radio or rapid fire news twitter topics so make sure you
5410480	5414080	get those in at twitter.com slash olr if you have something you want us to talk about we'll
5414080	5417820	talk a little bit about what classic arcade game that has me very happy coming back to
5417820	5422120	xbox live arcade and playstation network and i'm sure all of you will too mega man legends
5422120	5427280	3 news the audience is in control yeah it's gonna be interesting we'll talk about all
5427280	5436240	that when we come back with more of orange lounge radio
5436240	5440400	and welcome back everybody to orange lounge radio we we are taping live on this sunday
5440400	5447320	evening october the 10th of 2010 happy 10 10 10 to all of you folks out there listening
5447320	5453200	we are taping the 385th episode of our show believe it or not and you guys don't hear
5453200	5456880	this on the podcast because sadly we can't put our break music on the podcast because
5456880	5460720	it's copyright but i had a few tells asking me about one of the songs we played in the
5460720	5465320	break there um there was a baba yetu from siv 4 because i know a lot of people are crazy
5465320	5469440	about siv 5 right now and i don't have that soundtrack but i have a siv 4 which by the
5469440	5473560	way if you went to video games live that's one of the songs they did at video games live
5473560	5477800	and it's it's such an epic great song i can play clips we can't get away with playing
5477800	5479440	clips let me play a quick clip quick clip
5479440	5493320	so you just hear the epic epicness in it it's like the music on the title screen which is
5493320	5496840	so yeah i love the civilization series what can i say i have yet to check out five though
5496840	5501320	it's all part of that whole like i spent all my money on disneyland this month so i haven't
5501320	5504280	purchased a lot of games but that's that's one of the ones i've got to look into getting
5504280	5511520	for sure so we'll see um by the way things going on this week guess guess what um is
5511520	5515480	happening this wednesday do you know what this wednesday is wednesday is a very important
5515480	5523640	day for me it is october 13th anyone anyone it is my you all right i was gonna answer
5523640	5527100	yeah because you know i told you before the show all right it's my 10-year anniversary
5527100	5531320	of playing ddr that's right 10 years ago on october the 13th was the first day i ever
5531320	5534480	played ddr which you know might not seem like a big deal to all of you because like you
5534480	5539060	know oh hey dancing arrow stomping game funny but um you know if it weren't for ddr this
5539060	5543360	show wouldn't exist i probably would not know jamie or matt if it weren't for ddr we probably
5543360	5546100	would have ran into each other in some nerd circle one way or another but it just would
5546100	5552880	not have happened the same way so um next week on the program to celebrate the 10-year
5552880	5558640	anniversary of me playing ddr we've actually invited a guest who was there that night because
5558640	5564280	it was her first time ever playing ddr she's going to be here next week on the show jessica
5564280	5567880	harper from understation live is going to be here in the house some of you guys know
5567880	5573520	her as iguana girl uh one of the admins of ddr freak for i believe a couple years so
5573520	5576840	she has a lot of dinner history so it'll be good times we're gonna uh have her on the
5576840	5581760	show and kind of look back on ddr and video games at large because i know she plays some
5581760	5586400	other video games too so we're gonna have a good time next week yeah so and and see
5586400	5589840	travis says i don't love understation live enough sometimes but you know what we're gonna
5589840	5593360	have one of the hosts right here on the show so it'll be a good time but this is heart
5593360	5598440	heart heart heart exactly heart heart heart love good times and he's welcome to come out
5598440	5602760	here anytime that's right if travis wants to fly his ass out to sacramento he's welcome
5602760	5607840	to come on the show anytime all right uh lumi's in our chat room says did you guys did you
5607840	5615520	lose a lot of weight during those 10 years playing ddr um no not now i wish i was playing
5615520	5621840	as much ddr as i was back then yeah that would help at the time heck yeah i was at my skinniest
5621840	5624920	when i first started playing ddr i mean that was around the time i think that was the same
5624920	5630360	time i was like dating a vegan who loved to cook and so like the worst food you ever eat
5630360	5634680	dating dating a vegan who loves to cook like you i will eat anything a vegan puts in front
5634680	5640240	of me because you know the worst thing that's in it is a vegetable or soy like it's terrible
5640240	5645880	it's not going to be like surprise cow brains or surprise it's the uterus of a duck you
5645880	5649360	know or something like that you know what i mean hey dan's had a cow brain i never heard
5649360	5656280	you complaining when i stuffed cow brains in the uterus of a duck right okay but i'll
5656280	5660400	tell you what i was like super thin back then when i was playing ddr and dating a vegan
5660400	5666360	like man that was that was crazy now i just now i eat at waffle square and and play world
5666360	5672280	of warcraft so i've gained a significant amount and now i eat double bacon pizzas exactly
5672280	5678600	which is funny because now i'm mostly vegetarian i know you're the one that's actually lost
5678600	5682680	the weight since those days some so you guys need to stop being vegetarian because i have
5682680	5688180	to eat more meat to compensate okay well yeah i'm not vegetarian i'm just i'm whatever i
5688180	5695000	eat meat like once a month all right anyhow i mean you know like cow flesh all right we'll
5695000	5700960	talk more about all that and and that stuff in a future episode uh next week here any
5700960	5706220	raw pictures up there i guess oh yeah jessica dug up like hecka old pictures on facebook
5706220	5714320	and and found i gotta see which one she put up there oh god oh next week's gonna be a
5714320	5719080	fun show it's it's one of me playing magenta at the rocky horror picture show yes thanks
5719080	5725160	jessica thanks so much for that all right you were so gorgeous uh let's move on let's
5725160	5730480	go back to gaming news and all that fun stuff here actually i want to talk more about robin
5730480	5734800	address no let's not i don't want to give people the wrong impression it's rocky horror
5734800	5741040	it's different all right uh loki start us off with some rapid fire news please well
5741040	5746920	during release um our releases this week i mentioned that the gears or not gears of worth
5746920	5752600	that'd be funny um borderlands game of the year edition is going to be coming out and
5752600	5757280	um well what's kind of neat about it is they just announced that the game of the year edition
5757280	5761040	of borderlands and this pisses me off because i bought most of the download content on its
5761040	5765820	own um will be coming with not only all the download content for borderlands but early
5765820	5772800	access to duke nukem forever in other words the demo so even more incentive to spend 60
5772800	5778000	dollars on the game most of you already have exactly yeah god i want that demo but you
5778000	5784320	know what though me being me um that demo will leak out and i'll be able to download
5784320	5790000	it so i don't care aren't you special i am special i'm thinking about but i don't know
5790000	5793240	how much i'd like borderlands but i hear it's like a first person world of warcraft with
5793240	5799040	guns borderlands is fun it's it's like yeah it's it's a first person shooter but it's
5799040	5807360	kind of a little bit of an rpg and there's a lot of like you know i'm looting i guess
5807360	5812120	so if you like loot it's a little bit like diablo i guess i like the phase walker girl
5812120	5822080	she's pretty cool yes she is pretty awesome i played the uh the hunter with a mordecai
5822080	5828160	yeah yeah with his raven of death uh that was awesome the the berserker guy is pretty
5828160	5833040	cool too act definite our chairman says damn it i got borderlands on steam for ten dollars
5833040	5839680	u.s that's why they put it on sale right before all this these announcements and jessica's
5839680	5844840	linking more old pictures of me she uh uh linked this one of me dressed up as brad for
5844840	5848520	the rocky or picture show and uh ezam in our chat room i hope i said that right he's on
5848520	5853560	ezam ezam and her chairman says for a second i thought it was what the buck hey hey watch
5853560	5858920	oh god did she just link that one yes poke of pokemon knight iraqi horror no i think
5858920	5864000	it was our final scene or whatever parade that was the game that was my 21st birthday
5864000	5869080	that was the pride parade in san francisco that was my 21st birthday or the i think the
5869080	5874720	day after my doing elbow right around there crazy stuff that was great um all right other
5874720	5879520	stuff uh dj hero 2 of course is coming out soon in a couple weeks hopefully i'll have
5879520	5886160	my next week i want it early um anyways they're going to be doing more bundles with the game
5886160	5891040	as well if you happen to skip the first game you're in luck especially if you're in europe
5891040	5894400	because the dj hero 2 bundles that will be coming out over there will be including a
5894400	5899280	free copy of the original game as well which by the way they are selling the original game
5899280	5906220	uh by itself in case you you know want to build your own bundle over here um in the
5906220	5912440	u.s. uh for another 50 bucks which is kind of a rip off if you ask me i believe though
5912440	5917440	if you pre-order through toys r us which no one's really doing that anymore because toys
5917440	5922600	r us is almost out of business um that's my only opinion really what makes you say that
5922600	5926920	no because i don't shop there anymore well because therefore the chain is out of business
5926920	5931000	because you don't shop there anymore the amount of crap i buy yeah i thought it was supposed
5931000	5938640	to be a cheap place to get diapers there is no cheap place to get diapers um but i think
5938640	5942880	if you pre-ordered there you also get a free copy of the game so it might be something
5942880	5951400	to keep in mind and then last but not least um with the release of the new mario anniversary
5951400	5959480	edition which by the way is just mario all stars but on the we now waiting not with extra
5959480	5964200	mario games no no not with anything not port of the super nintendo straight ass port of
5964200	5967200	the nintendo and it's not even the one that comes with mario something that they could
5967200	5972560	have i don't know put on virtual console for like ten dollars well maybe that's what they'll
5972560	5975120	do here in the u.s. because we haven't heard anything about this coming to the u.s. right
5975120	5979800	oh it'll come to the u.s. i guarantee it they can charge fifty dollars for something that
5979800	5985760	was really worth ten yeah they'll bring it out over here um but seriously nintendo we've
5985760	5990360	gotten into this conversation about how nintendo doesn't really they they do make new stuff
5990360	5995480	now but a lot of the stuff that they put out like hey look new mario game it's not really
5995480	6001640	new it's just ports of old games anyways that's not why we're talking about this we're talking
6001640	6004940	about this because they have a garish red looking console that's going to be coming
6004940	6011000	out over there instead to commemorate you know the mario 25th anniversary edition i
6011000	6017080	guess you know it doesn't have any cool mario graphics or anything it's just red and that'll
6017080	6023240	be coming out over there for uh 20 000 yen dark tetsuya in our chat room says great now
6023240	6027760	you're making me feel awful because i want this so bad you are an awful person if you
6027760	6031960	want this so bad stop it didn't even change the color of the light in the front you change
6031960	6036720	that to like red or something you know it's a collector's thing i don't know it's stupid
6036720	6041840	i think it should have a mario graphic on it yeah they should put some of these silkscream
6041840	6052800	some fucking shit on there we want stickers pimp my wee all right so loki will not be
6052800	6058320	pre-ordering one of these no why would i want yeah let me import a console from japan even
6058320	6064080	though i have a we already that i don't play anything on and then you know oh it's in a
6064080	6068680	wonderful red color that i really don't like that's awesome totally gonna put down four
6068680	6076040	i want tons of them all right some quick stories from me for you guys gears of war 3 uh is
6076040	6079000	gonna of course have multiplayer just like the other ones did there's gonna be a beta
6079000	6083400	of the multiplayer uh and epic games actually revealed this at an event this week um at
6083400	6086840	their headquarters uh this is the first time though that a gears war game is getting a
6086840	6091200	public beta so that's kind of cool uh gears war 3 is going to be coming out in the fall
6091200	6097480	of 2011 so the beta will be out sometime in the spring maybe they haven't said exactly
6097480	6102120	when next year they've just said next year there will be a beta so you guys can completely
6102120	6105840	base your judgments of the game off of beta because it's what a lot of people do a little
6105840	6112220	big planet too also delayed until next year maybe not as late next year i think i'm hearing
6112220	6117800	it's just going to be january probably they are not going to um actually release it this
6117800	6123560	year in time for the holidays and the reason why they don't want launch day passes patches
6123560	6127360	patches as i say passes patches uh quote we could have shipped it and it would have been
6127360	6132680	fine and this is a quote from the head of media molecule alex avens however we realize
6132680	6136900	that with just a couple extra weeks we can make the game super amazing adding the super
6136900	6141560	onto the already amazing which is this today this is something that will live forever and
6141560	6145880	the delay people will forget about i kind of like that he says that because that's a
6145880	6149820	that's a point we've brought up on the show before people don't forget oftentimes that
6149820	6154240	these games were delayed if they were that good like for example uh mario brothers melee
6154240	6158920	super or super mario brothers super smash brothers melee or whatever the one on the
6158920	6163700	we i was delayed like five times and people kind of just forgot by the time the game actually
6163700	6170280	came out you know what though i'm saying this is a good thing this is a good deal if it
6170280	6175360	keeps the game in good quality just like some of these other delays we've been hearing about
6175360	6179080	it's very interesting though that always at the end of the year delay delay delay it's
6179080	6182360	great that they're putting it out and so that we don't have any day one patches because
6182360	6186080	you know those people that don't have their playstations connected to the playstation
6186080	6192440	network anymore because of usb devices that they're using with their playstation 3 and
6192440	6198920	one more for me uh this is about a new shen moo game that's right there is that's right
6198920	6206880	there is a new shen moo game coming out it's coming out in japan this year shen moo town
6206880	6214640	is coming out on yahoo japan it's a mobile based social network mobage town that's right
6214640	6220720	the new shen moo game is a mobile game it's the third shen moo game there you go but they're
6220720	6225680	not calling it shen moo 3 but it's very i i don't know i still say this is a good sign
6225680	6228900	though if they're wanting to keep this fresh in people's minds this might be a good sign
6228900	6235480	so don't get too frumpy dark sakura no frumping over there but sorry it's not the game you
6235480	6241000	were hoping i was going to mention here on the show sad tuba all right dark sakura what
6241000	6248760	you got for us stuff and things how about um mega man stuff there's going to be a comic
6248760	6255640	out it's being put out by archie comics and um they are saying it's going to be faithful
6255640	6261920	to continuity so hopefully then again they also did that sonic the hedgehog ones that
6261920	6267160	i didn't think was very good nor the knight's one wasn't good at all um but it is written
6267160	6274480	by um ian flinn who's currently writing sonic the hedgehog um yeah i don't really have high
6274480	6280680	hopes for it the art looks interesting i mean protoman looks really freaking cool but i
6280680	6289720	don't know it might be okay we'll see when it comes out and in other news um typing of
6289720	6298440	the dead this is going to be a new version yay um it's typing of the dead featuring mina
6298440	6306960	no shuko i would be help if i could pronounce this properly featuring mina no shoku katsu
6306960	6316000	doniki um which is pretty much the dreamcast version with new words um except these look
6316000	6327480	like they're it says that everyone's job hunting diary so it's uh a job hunting site in japan
6327480	6333600	that they've teamed up with interesting so it's like um if they were to make a game on
6333600	6341880	monsters these are mini games in job hunting modes so you can type in words like disability
6341880	6350480	income and stagnant air interesting huh it's like these people never get a job they're
6350480	6357360	just playing games all the time and last but not least is more marvel vs capcom 3 stuff
6357360	6364600	we have new characters we have sir arthur and nathan spencer um arthur being from uh
6364600	6375800	ghosts and goblins which we talked about in part a and nathan spencer is uh from the uh
6375800	6387800	3d one i'm trying to see what this is hold on yeah that sucks i'm happy about arthur
6387800	6393400	being in it that's pretty cool so uh and we're also supposed to hear more characters later
6393400	6401000	on so that's pretty neat i i've already heard about people i care about that's it all right
6401000	6405080	looking at uh twitter we're gonna go to twitter actually real quick i wanted to mention this
6405080	6409080	uh because uh jessica's in our chat room tonight she's gonna be here on the show next week
6409080	6414440	she's plugging uh one of the other hosts on on understation life breastlil is uh i believe
6414440	6419000	this is part of extra life uh who's participating um playing some video games over the next
6419000	6423000	uh 24 hours i'm sorry not the next 24 hours but on the 16th and 17th gonna be doing some
6423000	6427000	video games and the donations will be going to seattle children's hospital um i can't
6427000	6430240	really read the link for you guys but it's in chat and i'm sure it's over on understation
6430240	6434040	lives website or on their facebook so go take a look at that um speaking of extra life i
6434040	6437880	know what's going on next weekend um i sadly can't participate this year i have some other
6437880	6442760	commitments um but i would definitely encourage you to uh look at some of the folks that will
6442760	6446600	be participating in that it's for a good cause and donate to somebody even if uh it's not
6446600	6451960	breastlil donate to somebody it's a good cause and uh gives gamers a good name it's it's
6451960	6455880	a good uh fuzzy wuzzy thing to talk about i was gonna say also there was a couple other
6455880	6460680	characters that they added tomorrow versus capcom oh what's that on top of um please
6460680	6465880	share yes please you mentioned uh magneto cool there's one that they added and then
6465880	6473480	uh the last one was um because i don't not recognizing the character uh modok says hisson
6473480	6480440	oh modok is you ever see the big giant head thing that's just a little harness yeah that's
6480440	6489880	modok okay but what's what's modok from from um various marvel comics really annoying character
6489880	6497880	it's like i'm gonna look i forgot what modok stands for hold on are we gonna can i go to
6497880	6505720	a twitter topics tweets time tweeters oh found it mental organism designed only for killing
6506280	6514280	twitter.com slash olr if you want that's you in a nutshell says loki all right going to our twitter
6514280	6519640	and looking at some of the topics um not a whole lot tonight but we will get through some of these
