start	end	text
2411640	2416600	it will too. And Bobby Blackwell in our chat room at live.vognetwork.com saying, I want
2416600	2421880	stage kit compatibility. I agree. I still want one of those stage kits, even though
2421880	2424600	that'd be a complete waste of money at this point. You could probably get them really
2424600	2431160	cheap now. All right. Also in last week's news, speaking of EA, I'm sure many of you
2431160	2436520	caught wind of this, even though this happened during GDC. And I don't know if that was an
2436520	2441280	attempt to not have this show up on the radar, but in this day and age of the internet, when
2441280	2447480	you try really hard to have something not show up on the radar, guess what? It elevates
2447480	2453460	it to people's radar that much more. And that's what happened when news came out that EA has
2453460	2463040	closed Maxis. Maxis behind the Sims 4 and of course the ill-fated SimCity reboot that
2463040	2468960	happened a couple years ago that, you know, didn't, it wasn't received too well because
2468960	2473040	of the always online component that not everybody was on board for. Well, and even like SimCity
2473040	2478280	or the Sims 4, like with all the removed features and stuff in there, it's like, come on. You
2478280	2483880	know, I mean, I have a hard time believing it was just Maxis going, you know, this is
2483880	2488800	going to be a good idea. I can't, I can't help but think that EA kind of pushed them
2488800	2493140	to do certain things that they did in that. That's, that's the other thing that's kind
2493140	2499700	of interesting or crazy to me and all this is that, you know, Maxis, you know, ate a
2499700	2504460	lot of controversy with the SimCity thing. And I don't know, when I still think of Maxis,
2504460	2508620	I have a very soft space in my heart because I think of all those amazing Sim games from
2508620	2513380	the nineties, like the original SimCity, even SimCity 2000, even though I didn't like that
2513380	2519100	one as much, but I know a lot of people did, but I think of things like SimAnt, SimEarth,
2519100	2524460	SimTower. I loved all those games and man, that was the heyday. And unfortunately, you
2524460	2529660	know, now they started going in this direction with the, the SimCity and I wasn't a big fan
2529660	2534040	of the whole always online thing because I think a lot of us, why did we love SimCity
2534040	2538820	the original? Cheat codes and making Godzilla appear whenever you want by typing certain
2538820	2543300	things in the keyboard. But in this day and age, and the way EA's model has been as of
2543300	2549400	late is now you can pay money to unlock all that. And people were not having that, but
2549400	2557640	I feel like that is part of EA's culture, not Maxis' culture. So there's something very
2557640	2565060	odd to me about the reason that that game flopped was probably more EA's influence than
2565060	2571500	anybody else. And so that's, what's very frustrating about this news, you know, and again, I'm
2571500	2576460	just sitting here in my spare room in Sacramento commentating on what I see. I don't know how
2576460	2581140	it works on the inside, but I still can't help but feel like every issue with these
2581140	2584260	games was something that was decided in a boardroom, not by a developer.
2584260	2589060	To me, that's kind of the same situation I think with Activision and Bazaar was, you
2589060	2593180	know, kind of that, oh, hey, we have an idea, you do this. And then like, it didn't work
2593180	2597860	out. And so they punished, they punished the developer instead, you know, even though it
2597860	2600100	was their terrible idea.
2600100	2605740	Kossin in our chat room over at live.vognetwork.com says, no shout out for Sim Farm. Look, I didn't
2605740	2611100	shout out Simcopter either. Okay, look, I just, I can't, can't name them all. Anyhow,
2611100	2616700	EA saying that today we're consolidating Maxis IP development to our studios in Redwood Shores,
2616700	2622300	Salt Lake City, Helsinki, and Melbourne as we close our Emeryville locations. Maxis continues
2622300	2626740	to support and develop new experiences for current Sims and SimCity players while expanding
2626740	2632260	our franchises to new platforms and developing new cross-platform IP. In other words, SimCity
2632260	2636660	isn't dead, the Sims isn't dead, but they're probably going to show up on mobiles.
2636660	2640580	Well, they already have. I think it's more of they're going to have different teams developing
2640580	2644700	it. And you know what, maybe that's better for that series. Maybe it'll end up being...
2644700	2649540	I still feel like if some of the same decisions are still made, it's not going to change a
2649540	2654300	goddamn thing. And you know that. So EA is going to have to take a different approach
2654340	2657860	with if they're going to move it to a different development studio, they need to let that
2657860	2662220	studio make the decisions. Well, whose idea was it for like Sim... I mean, I'm assuming
2662220	2667860	it started with like kind of Sims 2 and stuff, maybe even Sims 1 where they have like $400
2667860	2673100	worth of expansions and shit for like the Sims. Well, here's the other thing to keep
2673100	2679940	in mind though, is that the Sims at the time, and I think maybe still possibly eclipsed
2679940	2683260	by one of the Blizzard games like World of Warcraft, but I'm pretty confident in saying
2683260	2690180	the Sims is the biggest PC game of all time, or at least was for a very long period of
2690180	2694180	time unless something's eclipsed it recently that I'm not aware of. But I mean, when you
2694180	2699620	have the most popular game of all time, multiple expansions to that I think are justifiable
2699620	2704900	and fine, you know, whatever. Yeah, but when you have like a new expansion... It's not
2704900	2708500	that different from DLC today. It's not that different from DLC today. It's not that different
2708500	2713980	from EA DLC today. I mean, it's the same thing. It's just, you know, they supported
2713980	2720340	it with discs and that kind of nonsense. Yeah. So, I don't know. I just... This news hits
2720340	2725180	hard a little bit just because, again, I remember Maxis from the 90s and I used to love them,
2725180	2728460	but then, you know... It kind of went downhill with support, didn't it? Yeah, I just... I
2728460	2734500	hate to say it, but they haven't... Unfortunately, they haven't knocked one out of the park probably
2734500	2739860	since maybe what? Sims 2. Even Dark Sakura, that girl in the earlier years of the show,
2739860	2744380	she used to play the Sims all the time, right? Have you heard her talk about Sims 4? Maybe
2744380	2749500	once? She's kind of moved on. So, I think, unfortunately, that kind of says a lot about
2749500	2754060	what's going on. You're right. Spore... And it's so hard to say this because I think Will
2754060	2758900	Wright is a genius. I do, but Spore... We all know Spore missed the mark in several
2758900	2761500	places where it was just too disjointed. That's fine. I'm fine with Will Wright kickstarting
2761500	2767980	something if you... Yeah! Hey, why don't you, like, you know, come out with another
2767980	2774580	city simulator or something like that. Simulator City. Every musician has their not-so-great
2774580	2780140	album, so you know what? Every designer is allowed their not-so-great game as well, so...
2780140	2786380	It happens. It happens. Anyway, also, it's funny you should say that. Why doesn't he
2786380	2790220	go back? It sounds like somebody else might have actually put out the game that people
2790220	2794980	wanted. Bobby Blackwolf in our chatroom at live.vognetwork.com saying, apparently, Cities
2794980	2800820	Skylines, or whatever, is today a SimCity. A lot of people love it, and it just launched
2800820	2805320	last week. And TigerClaw says, yeah, one of the reasons is the Steam Workshop support.
2805320	2809460	People can mod it. And yeah, I'm... Somebody even tweeted me like, Rob, are you gonna play
2809460	2813580	this game? And I'm like, yeah, if I can look away from the MMOs for like two minutes, I'll
2813580	2818980	play this game. But I am very interested in the Cities Skyline, which sounds like opportunistic
2819020	2824860	as hell in a way, but hey, good on ya. You heard that all the people wanted this game
2824860	2829340	instead, so you went and made that game. Good for you. And it's getting very good reviews
2829340	2832540	from what I'm hearing as well. So maybe Cities Skylines is where it's at.
2832540	2839540	Yeah. So, anyhow, never... Bad decisions or not, it's never easy to talk about people
2839580	2844700	losing their jobs, so I hope all those people can find footing somewhere else, and again,
2844700	2848740	I know I realize, and I think a little bit realizes, it's probably not your fault if
2848740	2851680	you're a programmer or an artist or somebody on the front lines, it's probably not your
2851680	2855500	fault that SimCity went online, and I'm sure many of you internally often wanted to do
2855500	2859980	these questions as well. So, sorry to see that that happened. I hope you can find other
2859980	2864180	employment somewhere very soon, or venture out and open up a new studio, as we've seen
2864180	2867540	a lot of people doing, and a lot of those indie developers that were at PAX East were
2867540	2870740	part of that. Anyhow, let's move on to something else.
2870740	2873900	This is gonna be something a little different for the show. We haven't really done anything
2873900	2878900	like this before, but some big news came up during that week that I was at PAX East,
2878900	2882860	and this was so big that I was getting plenty of Facebook messages about it, like, Rob,
2882860	2885820	you gonna talk about this on OLR? You gonna talk about this? I was getting tweets about
2885820	2891500	it and so forth. So yes, we're gonna talk about it on OLR. And I think this news is
2891500	2897700	not on a lot of people's radars, and I actually got a tweet from our buddy YYR that said,
2897700	2902700	hey, Rob, can I do a special piece on this or something? Because I really wanna have
2902700	2906440	my say on this and explain this to everybody. And I was like, yes, we can have a foreign
2906440	2913180	correspondent now. We made it. We do. We have a foreign correspondent from New York. Is
2913180	2916560	that foreign? Well, foreign enough here for us here. It's a little outside the People's
2916560	2921640	Republic of Davis, but you know. So we are gonna go to our foreign correspondent to talk
2921640	2926580	a little bit about what is going on with Programmed World. And I'm gonna reiterate, I don't think
2926580	2932680	a lot of people are talking about this because this is very deeply rooted in our deep roots
2932680	2937240	of being a music gaming program, which is really where we started. So I don't think
2937240	2942080	this is popping up on a lot of people's radars, but I'm gonna ping it right now. So let's
2942080	2946400	go to our foreign correspondent, YYR, with more information.
2946400	2951960	The end of an era, Nostal Mix. This is an Orange Lounge Radio special report. I'm Aaron
2951960	2959020	Toplitsky. How far would you go to play a video game or to share it with the world?
2959020	2964260	Germany ceased production of Beatmania 2DX home versions in 2009. They continued yearly
2964260	2970060	updates to the game, each bringing lots of new songs and challenges. But outside of Japan,
2970060	2976800	they were impossible to find. A small group calling themselves DJ Hackers began to crack
2976800	2982580	these newer versions of 2DX, which were running on fairly ordinary PCs running Windows XP
2982580	2988020	embedded. They did release the cracked data for download on a private BitTorrent tracker,
2988020	2994260	but their true goal was to bring the full 2DX experience to arcades outside of Japan.
2994260	2999100	So while they soon had cracked versions of the game running on legitimate 2DX cabinets,
2999100	3001940	their efforts did not end there.
3001940	3007820	In Japan, Konami runs a network called eAmusement. At first, it simply tracked scores and clear
3007820	3013860	status for each song, but the online features were greatly expanded in later versions. Today's
3013860	3020340	Bimani games are continuously updated, each having dozens of unlockable songs, plus customization
3020340	3025900	features, in-game score comparisons with rival players, and even the ability to pay for your
3025900	3028980	games using virtual currency.
3028980	3034180	Konami's current business model actually revolves around the eAmusement network. Arcades no
3034180	3039820	longer pay for new versions of Bimani games. Instead, they pay Konami monthly for network
3039820	3046260	access, and also pay approximately 30% of each machine's revenue. Further, the latest
3046260	3050660	games need to be connected to the network just to function. If they can't connect at
3050660	3057020	boot time, they can't be played. In fact, arcades must have a current eAmusement subscription
3057020	3061700	and agree to these terms in order to receive the newest game versions at all. They can't
3061700	3064260	be obtained in any other way.
3064260	3069200	Several independent arcades in America have tried contacting Konami in an effort to sign
3069200	3073840	up for eAmusement, but none to date have received a reply.
3073840	3079120	Following many months of work, DJ Hackers successfully reverse engineered the eAmusement
3079120	3085080	network, and then set up their own, which they of course named after a song in 2DX,
3085080	3090760	Programmed World. They also found a source in Japan who could provide access to current
3090760	3096760	Bimani games. By late 2011, Programmed World had reached out to known locations outside
3096760	3102360	of Japan with 2DX machines, informing them that they could now run the latest, current
3102360	3107960	version. All they needed was their machine, a pair of card readers, a broadband internet
3107960	3113460	connection, a Linksys router, and a bit of cooperation. Programmed World offered the
3113460	3120460	service free of charge, and just as Beatmania 2DX 19, Linkle, was released in Japan, arcades
3120980	3127540	in America received it mere days later. This effort grew, and over time, Programmed World
3127540	3134540	added support for Popin' Music, DDR, Ubeat, SoundVoltex, GuitarFreaks, and Drummania,
3135420	3140460	delivering new versions of most games as they were released. Programmed World even added
3140460	3145820	some features Konami never offered, such as transfer of player song scores from one game
3145820	3147660	version to the next.
3147740	3153380	Then, seemingly suddenly, just over a week ago, the administrator of Programmed World
3153380	3158900	received a cease and desist letter from Konami Digital Entertainment Incorporated. Several
3158900	3163820	arcades serviced by Programmed World also received letters asking them to stop running
3163820	3170100	current versions of Bimani games or face potential legal action. Two days later, on the evening
3170100	3176820	of Sunday, March 8th, Programmed World permanently shut down. Devoted players convened online
3176820	3182940	asking why. It had become clear over time that as Programmed World expanded, and as
3182940	3187820	our communications became increasingly social, it was impossible to keep it a secret from
3187820	3193460	Konami. However, according to sources, Konami had been aware of the network's existence
3193460	3198700	for at least several years. Why did they wait to take action until now?
3198700	3204860	One possibility comes in the form of a Japanese chain of amusement centers named Round 1,
3204900	3210900	which in recent years decided to expand into the United States beginning in California.
3210900	3217380	These centers feature karaoke, bowling, billiards, darts, ping pong, and a large arcade packed
3217380	3223620	with Japanese games including the latest Bimani games. But through a special deal with Konami,
3223620	3230460	Round 1's Bimani games are all connected to the official Japanese e-amusement network.
3230460	3235940	As Programmed World continued to grow worldwide, reaching Europe, South America, and even parts
3235940	3241300	of Asia, Round 1 continued their expansion in the United States. They've already opened
3241300	3248300	locations in Texas and Illinois, and are coming soon to Washington, Massachusetts, and Pennsylvania.
3248420	3255420	They list Beatmania 2DX as a Round 1 exclusive game on their website. So, some players believe
3255420	3260340	that they may have seen Programmed World as unfair competition and asked Konami to
3260340	3262140	shut it down.
3262140	3266860	Another possibility comes in the form of an announcement quietly posted to Konami's website
3266860	3273540	less than two weeks ago, the opening of what they call e-Amusement Global Service. Further
3273540	3278780	details have been promised later this month, but what players are hoping for is that Konami
3278780	3284140	recognizes a global demand for their games and will begin to provide the service directly
3284140	3289540	to arcades around the world. However, whether they'll actually provide the service to locations
3289540	3294580	other than Round 1 remains to be seen. And even if they do offer the service to other
3294580	3300300	locations, there's no guarantee that the cost will be affordable enough for struggling independent
3300300	3301580	arcades.
3301580	3307880	Ultimately, these arcades, and their owners, stand to lose even more than the players.
3307880	3312460	At the very least, until we learn more about Konami's plans, all of the machines that were
3312460	3318620	connected to Programmed World must be manually downgraded to versions that will run offline.
3318620	3325540	The newest of these is over three years old. The situation for some venues is even worse.
3325540	3333060	The newly opened Nanuet Arcade in New York recently purchased DDR2014 and SoundVoltex3
3333060	3339260	machines. Both are still on their way from overseas, and without a network connection,
3339260	3341980	they can't be played at all.
3341980	3345260	For Orange Lounge Radio, I'm Aaron Toplitsky.
3401980	3405500	Do they have one in California? Because I'd like to go, it sounds awesome.
3405500	3411260	But anyway, I think that whole theory about Round 1 and the fact that, okay, if they are
3411260	3415660	embracing having these machines there, and they've made these deals with Konami, because
3415660	3419660	they know that, you know, Bomani games are still huge in Japan, and they want to be like
3419660	3425300	a Japanese center or whatever, maybe they've agreed to pay the proceeds to Konami, or what
3425300	3429940	have you, then if they're going to go to these other arcades and see, wait a minute, these
3429980	3434580	pirated versions of the game where they're not paying anything at all is running rampant,
3434580	3439780	then, you know, it's, or I shouldn't say pirated, because some of them are purchased legitimately
3439780	3445860	and on the network or whatever, but they're not paying that percentage to Konami, clearly,
3445860	3450780	so there is a different type of money exchange going on there. If they're all doing that,
3450780	3453740	then, you know, Round 1 probably did complain about a problem there.
3453740	3455860	It's a bowling alley, by the way.
3455860	3460820	But it says they have a multitude, probably like our bowling alley here has Laser X and
3460820	3463860	a big arcade and all this other stuff, so it's probably like a similar type of thing.
3463860	3469860	So, let's see, the closest place that they have one, which I'm wondering now that I see
3469860	3474660	this, if they've taken over a different location there, but apparently they do have them in
3474660	3480420	California. They've got one, I'd say probably the closest one would be in the East Ridge
3480420	3482220	Shopping Center in San Jose.
3482220	3485820	Yeah, they're all mentioning in chat that there's a bunch in California. Well, gee,
3485820	3486820	somehow slipped off my radar.
3486820	3488420	That's five. I wouldn't say it's a lot.
3488420	3489820	That's five's a lot.
3489820	3495580	Most are in Southern California. There's one in Santa Ana, one in Lakewood, Moreno Valley,
3495580	3496580	and City of Independence.
3496580	3498500	Fine, OLR Road Trip. We'll make this happen.
3498500	3504380	And actually, the one that's in East Ridge is coming soon. It's not even out there yet.
3504380	3509540	It's a slippery slope, though, because, like, I know when I went to Scandia back when they
3509540	3514100	actually still had the newer 2DX machines, I had a lot of fun playing it, and I really
3514100	3519860	enjoyed that. And, you know, I'm glad that they were able to provide that where Konami
3519860	3524820	would not put that out officially in the U.S. and was kind of holding that back from the
3524820	3529840	fans. So, in a way, you know, the fans are to thank for putting that together and having
3529840	3534620	it out there. But I think now that somebody's stepping in saying, I want to do it legitimately,
3534620	3536380	that's probably why it's taken away.
3536380	3540100	But it is lame, though, that we have these round one exclusive arcade game titles, and
3540100	3547960	here's what they have. Initial D8, Purikura, which is a photo booth, BeatMania 2DX, Pump
3547960	3554580	It Up Pro 50-inch Prime 2015, Transformers, and Pac-Man Smash.
3554580	3560420	Hmm. Well, I mean, when you consider that a lot of other arcades are really, like, you
3560420	3565100	know, kind of going downhill, unfortunately, I mean, it's not too, I mean, what, you have
3565100	3571020	Dave and Busters? I still think it's absolutely, it's, like, kind of a kick in the face of
3571020	3574660	all the people that have supported Konami all this time. It's like, oh, hey, fuck you
3574660	3578500	guys, you know. Oh, you still want to support us? Oh, fuck you. You know, we'll just go
3578500	3581620	ahead and give money to, because they're going to give us money to have this game exclusive
3581620	3586380	to this arcade. So, screw you guys. There's no answer to this that isn't going to piss
3586380	3591220	somebody off. Like, I, and I can honestly, I can honestly truly sit here and say, I see
3591220	3594980	both sides of it. And I think a lot of you out there, as much as maybe you don't want
3594980	3600660	to admit that, you know, you can see Konami's side of it, if they, the way Aaron put it
3600660	3604020	there with the whole agreement with round one, and that maybe round one's going to give
3604020	3607900	them that cut, and once it's exclusive detail, so for, in order for that to happen, the rest
3607900	3614380	has to get shut down. I mean, money talks, and I can see that. At the same time, you
3614380	3620980	know what we always say here on OLR? Hackers gonna hack. And so, where program world goes
3620980	3627700	away, there'll probably be another solution that's out there. But if this round one arcade
3627700	3633100	catches wind of this mom and pop arcade that suddenly is running a BeatMania 2DX, you know,
3633100	3637860	much newer version that is connected online on EMUs, they'll, the arcade will probably
3637860	3643660	get season assisted. I mean, if that's, if, it depends on how big of a draw and how important
3643660	3652060	that is to round one, but if this arcade chain knows there is a cult of music game
3652060	3657720	fans, and I say cult in a loving type of way, not in a, we're all gonna, like, you know,
3657720	3662820	take drugs and die kind of way, I mean, if there is this cult of people who love this
3662820	3669260	music games that will travel a great distance to come to our place, if we are the exclusive,
3669260	3674500	then there's perhaps a certain allure with that, where they want people to have to do
3674500	3675500	that a little bit.
3675500	3677700	They also apparently have Project Diva.
3677700	3684740	Oh, hell, I'm sold on that. I love Project, alright, anyway. Over in our chat room over
3684740	3689980	at live.vognetwork.com, YYR of course providing comments in the chat room there saying, the
3689980	3696700	people really screwed are the ones in countries not serviced by either EMUsment or round one.
3696700	3699900	That's a very good point, is that you might have places in other companies, which, which
3699900	3707160	is why it might be a good thing if this particular EMUsment global service ends up being a thing
3707160	3710860	and maybe in other countries where they don't have round one, maybe there will be another
3710860	3715300	option, or maybe, you know, if the mom and pop arcade wants to get on the 2DX, they can
3715300	3717300	join this EMUs global thing.
3717300	3720800	But here's what I do really like to happen.
3720800	3726660	If Konami's suddenly realizing that this shit is recognized on a global scale, and if music
3726740	3734100	games are experiencing a bit of a renaissance right now, is it too much to ask for a proper
3734100	3740700	goddamn Beatmania release on PlayStation 4 where, wait for it, I know this might be hard
3740700	3746060	to believe, but would it be too much to ask that we just get the same thing that Japan
3746060	3749780	gets? Would it just, I know this might blow people's minds.
3749780	3754640	This is something that might blow minds too, but couldn't you maybe do a digital only release
3754640	3755640	or something like that?
3755640	3758000	Hey, hey, the arcades are upgrading.
3758000	3764520	Let's send, let's push out upgrades that you can too by, you know, maybe it will be slightly
3764520	3767800	limited because, you know, they still got to have some sort of draw for the arcades
