start	end	text
5941760	5943340	That's totally a floppy disk.
5943340	5944340	What?
5944340	5945340	Right.
5945340	5946900	You mean that same thing?
5946900	5949420	How the fuck do you not know what a floppy disk is?
5949420	5951240	You're older than me.
5951240	5952500	Not to like put you on blast or something.
5952500	5954260	She's only interested in hard drives.
5954260	5955260	Yeah.
5955260	5956260	Hard drives.
5956260	5957260	I see what you did there.
5957260	5958260	Alright, look.
5958260	5960500	Can I talk about Jones in the Fastlane, please?
5960500	5964940	Not only was it a game that you could get on floppy disk, but it was on CD-ROM.
5964940	5968420	And if you got it on CD, it was completely voice acted.
5968420	5972780	All the little employees of the little places you would go on the board, such as Monolith
5972780	5977340	Burger and Socket City, would actually talk to you.
5977340	5980300	Oh, this does not sound good at all.
5980300	5982780	No, this game was amazing.
5982780	5983780	Was it?
5983780	5990980	Stop making fun of this game with, you know, Monolith Burger and Z-Mart and QT clothing.
5990980	5994540	Oh god, it's hurting so bad.
5994540	5998300	So what you did is you moved your little marble because that's what represented you
5998300	5999340	like a real board game.
5999340	6003460	You would move it around the board and as you went to these different places on the
6003460	6005140	board, you were a marble.
6005140	6009860	Yeah, you were represented by a marble, but you actually had a little dude on the screen
6009860	6014820	or doodad if you wanted to play, would walk like as the marbles going, the little dude
6014820	6015820	would walk.
6015820	6020220	It was on CD-ROM and it had voice acting and you were represented by a marble.
6020220	6027820	Because that was supposed to give it the board game feel also because we didn't want
6027820	6035380	to animate anything, but what board game has a fucking marble?
6035380	6037860	Your pieces will just roll off the game.
6037860	6040460	Mouse trap doesn't have a packman board game.
6040460	6043620	It's like a hundred marbles, but it's not your piece.
6043620	6045980	What activated the goddamn mouse trap?
6045980	6047460	It was a fucking marble, Irene.
6047460	6049940	But did it have one that you moved around?
6049940	6050940	I don't know.
6050940	6051940	I don't know.
6051940	6052940	Okay.
6052940	6053940	I fucking own the mouse trap.
6053940	6054940	Rob.
6054940	6057340	Don't fucking try to school me on my own games.
6057340	6058340	Okay.
6058340	6059340	Okay.
6059340	6062420	That is the least logical piece.
6062420	6063420	I feel like for a board game.
6063420	6064700	I'm going to put this on a board.
6064700	6066580	Thank God my board is completely level.
6066580	6067580	Oh, wait.
6067580	6068820	It just rolled off the board.
6068820	6071020	Oh, there I go down the hill.
6071020	6072020	Right.
6072020	6078180	That just would not be my first or second or like ten thousandth choice for a piece.
6078180	6080660	Anyway, monolith burger or something.
6080660	6081660	Yeah.
6081660	6082660	Burger time.
6082660	6087940	So look, you move around the board with your marble with and you're only limited by whatever
6087940	6090180	time is left in the week in a turn.
6090180	6093620	And when you move to a new location, you lose a little bit of time and you do things that
6093620	6095740	you would do like IRL.
6095740	6101180	You would work or you would try to get an education or you would just sleep all day.
6101180	6102180	You can also.
6102180	6103180	That's what I would do.
6103180	6104180	I know.
6104180	6105180	I know that.
6105180	6106180	So your marble wouldn't go anywhere.
6106180	6110020	Your marble would be calling the cable company going, I want my HBO.
6110020	6116060	I can't afford cable.
6116060	6120100	And then at the end of every turn, you would be going through the oh, what a weekend event
6120100	6124420	where you would lose money usually or you might gain money depending on what you did
6124420	6125420	that week.
6125420	6128180	What if you're sleeping and then how would you lose money?
6128180	6129420	It's like a monopoly.
6129420	6132980	You draw a card and you can win ten dollars in a beauty contest, even if you wouldn't
6132980	6133980	actually.
6133980	6135940	It's weird because I never left my house.
6135940	6140460	It's like, did they come into my house and see me on my bed and they're like, man, you're
6140460	6141460	so beautiful.
6141460	6142460	Here's ten dollars.
6142460	6143980	That seems kind of creepy.
6143980	6148220	Well, you would get little humorous anecdotes that was very common for Sierra at the time.
6148220	6152940	For example, you went to Las Vegas in a twenty thousand dollar car and then you came back
6152940	6155940	in a two hundred thousand dollar Greyhound bus.
6155940	6157460	That's huh.
6157460	6158460	Get it?
6158460	6159460	Clever.
6159460	6160460	You lost the car because you went to.
6160460	6161460	Yeah.
6161460	6162460	No, I get it.
6162460	6163460	I'm on board.
6163940	6165940	Dude, where's your car?
6165940	6169740	The object of the game is to be the first player to achieve one hundred percent success.
6169740	6176020	You reach four goals, wealth, happiness, education and career by having a certain amount of money
6176020	6182320	in the bank, happiness by getting other goals like acquiring goods and taking time off work,
6182320	6187420	education by going through all the university things and then career by climbing the career
6187420	6193780	ladder into management participation or whatever at the job.
6193780	6196180	So it sounds like the game of life.
6196180	6197180	It kind of is.
6197180	6199100	Monopoly and marbles.
6199100	6204500	It's like it's like life, monopoly and marbles all together without the pink peg and the
6204500	6206140	blue peg that you put in your car.
6206140	6207140	That's the only thing.
6207140	6208140	You have a marble instead.
6208140	6209140	No deal then.
6209140	6210140	All right.
6210140	6213020	Anyway, sometimes you can lose the game as well.
6213020	6218160	For example, you can get your money stolen by Wild Willy and Wild Willy may actually
6218160	6226340	rip off Wild Willy may actually rip you off at the low cost housing apartments and might
6226340	6228260	steal your TV and your VCR.
6228260	6229260	I'm sorry.
6229260	6230260	This is horrible.
6230260	6232880	I stole the TV.
6232880	6234980	This is no.
6234980	6238840	But Wild Willy can never get into the security apartments.
6238840	6242020	So there you go.
6242020	6246260	The game was notable for having a voice actors that were actually like they were actually
6246260	6249980	like motion captured and they actually would talk through some of the silly little jokes
6249980	6252140	in the game and so forth.
6252140	6256500	But if you were too poor for a CD-ROM drive, which a lot of us were at the time, you could
6256500	6258820	get the version that was on floppy disk.
6258820	6260420	Why did you look at me when you said that?
6260420	6261420	I'm just saying.
6261420	6262420	Fuck Rob.
6262420	6263420	Just wanted you to know.
6263420	6264860	Because you're a poor college student.
6264860	6268020	Just because someone lives in Section 8 housing doesn't mean they're a criminal.
6268020	6269020	Okay.
6269020	6270020	I'm just going to put that out there.
6270020	6272220	What a terrible game.
6272220	6273940	All right.
6273940	6277580	Going to our chat room over at live.vognetwork.com.
6277580	6281460	Bobby is saying this is the first classic game of the week where the host bashed a choice
6281460	6282460	frown.
6282460	6286820	Hey, first off, those two aren't hosts.
6286820	6288060	And now you know why.
6288060	6290660	It just sounds terrible.
6290660	6292180	And B, you need to play it.
6292180	6296780	And Bobby is actually going on to say, really sucks that people on the show are bashing
6296780	6298140	it and calling it horrible.
6298140	6299660	This game was actually really awesome.
6299660	6301420	And I actually agree.
6301420	6304620	It's you never, you weren't even around to play this game.
6304620	6306860	That's why you never got a chance to get obsessed with it.
6306860	6308540	Well, yeah, because I was poor growing up.
6308540	6310860	I had like a cardboard box for a computer.
6310860	6313900	So don't be mad at the people that can play Jones in the fast lane.
6313900	6320020	Just because to your description of the game, Rob, that's the only experience I have.
6320020	6322100	And it sounds preposterous.
6322100	6323100	It's not preposterous.
6323100	6324980	Do you want a handful of ketchup packets with that?
6324980	6328420	I read off the screen just now.
6328420	6331980	You lost me at marble is what I'm saying.
6331980	6334820	But do you not see the little animated characters that walk on the screen as well?
6334820	6338740	I do, but I also see the marble very clearly and it's kind of just clouding.
6338740	6340340	The marble's just distracting.
6340340	6342260	You are really bothered by that damn marble, aren't you?
6342260	6343260	I'm so fucking bothered by it.
6343260	6345540	You've lost your marbles.
6345540	6348340	You have a degree in junior college.
6348340	6349780	That's going to do a lot for you.
6349780	6350780	The junior college.
6350780	6355060	Oh, this was like in the what, 90s or something or late 80s?
6355060	6357540	Anyway, 1990 is when this game came out.
6357540	6359740	Yeah, so that would have actually had some value.
6359740	6362340	And he didn't get the job because he didn't have enough education.
6362340	6363340	Dumbass.
6363340	6365060	All right.
6365060	6366060	There it is.
6366060	6367060	Your classic game of the week.
6367060	6370260	Jones and the fast lane, which don't listen to these three.
6370260	6373060	This game is actually a lot of fun.
6373060	6375060	It's on YouTube, but you can also check out.
6375060	6378020	Apparently they did like a flash remake of it.
6378020	6381260	Not that long ago in 2006, I guess it was a little while ago.
6381260	6383980	They actually ported this like a version of it over to flash.
6383980	6384980	So you can check this out.
6384980	6389580	Although I don't believe that is something that is officially endorsed, but you can draw
6389580	6394060	your own conclusions by looking it up on like YouTube or I'm just checking out, you know,
6394060	6395540	it makes this game better.
6395540	6396540	Hmm.
6396540	6398100	It had amiibo support.
6398100	6400900	No, no amiibo support in this game.
6400900	6401900	And there you go.
6401900	6403820	That's why I just can't play it then.
6403820	6404820	All right.
6404820	6405820	Sorry to hear that.
6405820	6408660	I also probably can't play because my computer is probably way too fast for that now.
6408660	6412060	And you know, I want me to say, you know, those old games, you try to play them now.
6412060	6414300	It's just like, sorry, your computer's too good to play this.
6414300	6419060	I'm not, I don't think this particular game is available on like good old games, but one
6419060	6422940	of those ones that was archive, didn't they have like that big internet game archive thing
6422940	6425300	that, uh, oh, good question.
6425300	6429780	Uh, I w there were other Sierra games from that timeframe on it, so I don't see why Jones
6429780	6430780	wouldn't be on there.
6430780	6431780	We'll check it out there.
6431780	6435260	Lobby desk version, not the CD version, cause that would be too much space.
6435260	6436420	All right.
6436420	6438180	Not that much space nowadays on the internet.
6438180	6439740	So all right.
6439740	6440740	Well stay tuned guys.
6440740	6441900	We've got plenty more show to come.
6441900	6446380	We have some rapid fire news, the Fuqua question of the week and some more news mailbag a few
6446380	6447380	of the weeks.
6447380	6451020	And yes, a chance for you to call in when we come back after this with more of orange
6451020	6459640	lounge radio live the Boise geeks network.
6459640	6465780	Welcome back everybody to orange lounge radio live on this March the 15th of 2015 with episode
6465780	6469460	number 590 of our show in progress.
6469460	6473980	Uh, Loki here with me tonight, not here tonight, dark Sakura.
6473980	6479260	Um, but here joining us in studio, um, Irene and mystique who have for the first time in
6479260	6486720	our 590 a year history, uh, ruined the classic game of the week segment here on orange lounge
6486720	6487720	radio.
6487720	6488720	You're gonna have to get used to it.
6488720	6489720	That's all right.
6489720	6493180	Actually, we were talking off air a little bit about like, you know, I was kinda like,
6493180	6497420	now, now seriously now this is why people love this game with the whole like Sierra
6497420	6498420	era and all that.
6498460	6500660	But you were mentioning you play King's quest.
6500660	6501940	So you know that era a little bit.
6501940	6502940	I do.
6502940	6503940	I do.
6503940	6504940	Yeah.
6504940	6507460	I mean, who hates King quest King's quest for now I might let you get away with that
6507460	6511820	sass with Jones and the fast lane, but if this was King's quest for I talked about tonight,
6511820	6513340	I would not be having that sass.
6513340	6517700	There was one that I remember where like you start off in the town and blah, blah, blah.
6517700	6520920	And then there was this pier that you could walk to see that you could go on the ship
6520920	6523100	and then sail to another Island or something.
6523100	6527340	And then there was like this one part where this kid like tempts you to take a swim.
6527340	6528340	I'm almost positive.
6529260	6530260	I think it is five.
6530260	6534420	And then like you just jump in and you die and it's like, I'm pretty sure it's five.
6534420	6535420	Like I was so mad.
6535420	6539460	I was a lot of King's quest games though, but I just, I guess that was my first experience
6539460	6540460	and I was just so mad.
6540460	6544260	I was like, I was not expecting that cause it was just stupid.
6544260	6547460	There was a certain level of dark humor in a lot of those old Sierra games.
6547460	6551700	You know, it just, I didn't know what triggered it or anything.
6551700	6555100	It was just, I came out of the boat and he's like, Oh, it looks like a really nice day
6555100	6556100	for a swim.
6556100	6559620	I think I'm going to go commit suicide now.
6559620	6561540	You don't notice the little shark fan in the background.
6561540	6562540	Anyway.
6562540	6563540	No, no, I guess I'm stupid.
6563540	6564540	All right.
6564540	6568500	Uh, anyhow, I know you, you gals can't stay a whole lot longer, but I do want to make
6568500	6571060	sure Irene, you have a chance to plug cause you do your own podcast.
6571060	6573260	I want to make sure you have a chance to plug it.
6573260	6577220	Um, I just saw Piper not that long ago and I know he's on the show as well.
6577220	6578900	So tell us about, uh, multi-tap.
6578900	6579980	Oh, okay.
6579980	6582160	So it's like a video game podcast.
6582160	6584580	It's kind of retro, but kind of not.
6584580	6587620	Let me just kind of talk about whatever we want cause we're like that.
6587620	6593380	Um, so it's at ffop.net, which is short for fistful of potions.
6593380	6596220	You could also do fistfulofpotions.net, I guess.
6596220	6597220	I don't know.
6597220	6602780	Um, so come and listen to us cause we're cool and fun and interesting.
6602780	6607300	Now, now when do I get to come on your show and sass all the games that you like?
6607300	6608740	When the fuck ever you want.
6608740	6609740	Awesome.
6609740	6610740	I can't wait.
6610740	6614380	You won't because all of our games are perfect and beautiful.
6614380	6618220	Unless you're having the Super Metroid special when I'm there, I'll find something.
6618220	6619220	We might.
6619220	6621700	We love Super Metroid in the house.
6621700	6622700	I'd be okay with that.
6622700	6623700	I'd be okay with that.
6623700	6624700	All right.
6624700	6627860	Uh, anyhow, tonight, uh, we do not actually have a forum followup segment tonight since
6627860	6629420	we had last week's show off.
6629420	6632420	We're going to table that to next week, but don't forget that you can participate in our
6632420	6636560	forums over at vog network.com slash forums, and we will definitely post some followup
6636560	6639100	topics for us to expand the conversation on.
6639100	6643020	I'm really anticipating we're going to talk a little more on the forums about this whole
6643020	6647500	Konami and programmed world thing because, uh, just the fact that even I admitted there
6647500	6649280	really is not an easy answer to this.
6649280	6653220	I can really truly see like both sides of it where it's like on one hand, I understand
6653220	6657260	how, you know, Konami wants to protect, you know, some of the revenue that they get in
6657260	6661740	Japan and these other agreements, but at the same time, gamers desperate to play these
6661740	6664700	games that get their only option really cut off.
6664700	6666180	So I want to talk and dive deeper into that.
6666180	6669300	So we'll do that on the forums and we'll talk about some of that follow up next week.
6669300	6672380	Uh, but for now we have some rapid fire news.
6672380	6674340	So some quick news stories starting with Loki.
6674340	6675340	All right.
6675340	6679140	Um, so let's start off with, I'm pretty excited about this.
6679140	6683820	Goat Simulator is coming to Xbox one and Xbox 360 cause it runs like shit on my PC.
6683820	6689460	So I'm, I'm down with that and that's going to be sometime in April and they're promising
6689460	6692820	it'll be just as buggy as it is on PC.
6692820	6694980	Will it have all the extra stuff that they put in like the MMO?
6694980	6695980	I think it will, yeah.
6695980	6696980	Oh God, that's great.
6696980	6699100	So I will definitely be picking that up.
6699180	6704300	I think you would like, uh, Goat Simulator, Irene, it's a stupid, stupid game.
6704300	6705300	Yeah.
6705300	6706300	You like stupid stuff.
6706300	6707300	I do.
6707300	6708300	That's why I'm friends with you.
6708300	6712940	You fucking set that up Rob, that was your own fault.
6712940	6713940	I don't think you're stupid.
6713940	6714940	You're cool Rob.
6714940	6721260	And in fan service game news, uh, Oni Chambara Z2 is going to be headed, um, to North America
6721260	6722260	this summer.
6722260	6726960	Um, Europe, it's going to be out in the fall and if you're not familiar with Oni Chambara,
6726960	6732240	it's basically some chick wearing a really skimpy lingerie and a cowboy hat fighting
6732240	6734800	monsters with a samurai sword.
6734800	6735800	All right.
6735800	6736800	I'm in.
6736800	6737800	How's that different from Oni Chambara?
6737800	6739800	No, I know Oni Chambara.
6739800	6746200	They even have DLC outfits that include like one that's two strawberries and a banana.
6746200	6747840	That is all that's covering them up.
6747840	6748840	Two strawberries and banana.
6748840	6749840	Alrighty.
6749840	6760160	Um, and then on the 3DS, uh, Senren Kagura 2 is coming, um, this summer to the 3DS and
6760160	6763720	they're also having some special editions coming out with that as well.
6763720	6769180	Uh, the Double D and Happy Boobs edition will be coming out.
6769180	6771320	So it's about me?
6771320	6776560	It's about, yeah, it's about, uh, chicks that fight each other in their clothes.
6776560	6780640	All you single fellas, um, they're talking about me.
6780640	6788040	I don't know what you're talking about because I'm gay and I play this game, so it sounds
6788040	6789040	like fun.
6789040	6790040	All right.
6790040	6793320	But I'm also for equal opportunity, so I believe we should have men and the clothes fly off
6793320	6794320	as well.
6794320	6795320	I agree.
6795320	6796320	I'm all for that.
6796320	6797320	I would play that game.
6797320	6803920	That would be, um, uh, Akiba, Akibahara, um, or Akiba's Trip.
6803920	6804920	That's what it was.
6804920	6807080	Sexual Close Tossing Part 3.
6807080	6808080	I don't know.
6808080	6809080	Akiba's Trip.
6809080	6810080	That would be the one you'd want to play.
6810080	6811080	That's what it translates to.
6811080	6812080	Anyways.
6812080	6815400	Um, and then of course they have, uh, Chroma Squad that's going to be coming out April
6815400	6816400	30th.
6816400	6822600	This was the Kickstarter game that was kind of like a, uh, Super Sentai sim, if you will.
6822600	6829440	Um, and that's going to be coming out on PC, Mac, and Linux April 30th, so, um, Shane will
6829440	6830440	be happy about that.
6830440	6831440	I'm sure he will.
6831440	6835760	Um, talking about 3DS, uh, and the SpotPass.
6835760	6837380	There is a SpotPass exploit.
6837380	6841840	This actually pisses me off, kinda, because, and I know the old saying hackers gonna hack
6841840	6842840	and I get it.
6842840	6846480	And I also know it wasn't even a hack, it's just a glitch.
6846480	6847480	I know.
6847480	6848480	Well, it still sucks.
6848480	6853160	And I know this sucks for, uh, you know, people who might live in areas where they hardly ever
6853160	6857960	street pass with people, but look, one of my crowning achievements of PAX East is that
6857960	6863760	I finished all those fucking puzzles, finally, 1,502 pieces, mine.
6863760	6868400	I have every puzzle finished, including the one that those jerks at Nintendo dropped on
6868400	6873360	us Sunday morning, the day of the show, the new Monster Hunter puzzle, finished them all.
6873360	6877840	And now to hear that, oh, thanks to this exploit, people will just be able to do that.
6877840	6879560	Well, alright, alright, here's the deal.
6879560	6884280	Uh, you use your special Mii character, like, uh, the Abraham Lincoln Mii that's sent to
6884280	6888560	promote codename Steam in all the StreetPass minigames you own.
6888560	6895320	You turn off StreetPass and SpotPass, delete the Mii, close Mii Plaza, open it again and
6895320	6899400	reactivate, and the Mii character will come right back.
6899400	6903360	So you basically tricked the system into thinking you never got the character in the first place
6903360	6905840	by deleting all traces of it.
6905840	6910320	And, uh, there's, uh, more information on the glitch if you wanna see it on YouTube,
6910320	6913480	and I realize you might be thinking, well, then why are you sharing it here, Rob, on
6913480	6915120	how to do it if it makes you mad?
6915120	6919040	Because it's not like y'all don't know how to use Google, you'd find it anyway, but that's
6919040	6921080	essentially how you do it.
6921080	6922560	But, uh, you know what?
6922560	6926900	My achievement is better than yours if you do this to get all your puzzle pieces.
6926900	6928240	My achievement's better than yours.
6928240	6929240	Uh, nuh-huh.
6929240	6930240	How many puzzle pieces do you have?
6930240	6932240	Well, I'm gonna get them all now.
6932240	6933800	Yeah, thank you, Rob.
6933800	6934800	Ditto.
6934800	6935800	Cheating cheaters.
6935800	6936800	Alright.
6936800	6937800	Anyhow, well, you know what?
6937800	6940320	My 3DS has a dead battery right now, so you won't be getting any from me.
6940320	6941720	Did you even bring your 3DS?
6941720	6942720	No.
6942960	6944960	Mine played that for, like, five months.
6944960	6945960	Jeez.
6945960	6946960	Yeah.
6946960	6947960	Anyway.
6947960	6948960	Aw, you played longer than me.
6948960	6949960	I think this is really cool.
6949960	6955000	Um, this is an innovation in the arcade and, uh, in the arcade industry, and it has to
6955000	6960680	do with, uh, more, um, I guess, I don't wanna say, like, cross-play, but more, like, I guess,
6960680	6966320	synergy between your phone or smart device and the arcade game itself.
6966320	6970320	And who knew it's being brought to us from the music game world and an indie in the music
6970320	6973600	game world that we hear about all the time, Neon FM.
6973600	6977200	I mean, we were hearing about this game, like, 10 years ago, and it seems like now we've
6977200	6979920	got this arcade prototype that's going with it.
6979920	6983960	And the cool thing about Neon FM and what they're showing, and I gotta admit, I really
6983960	6989160	enjoyed this, was that, um, Unit E Technologies, who's, uh, making this game, they're going
6989160	6994040	to be linking the arcade version of the game and a smartphone version of the game.
6994040	6997640	So what you do is, I guess, you, like, you scan a QR code and you can get your avatar
6997640	7000440	and all your information in the game that it imports from your app.
7000440	7004880	But this is really cool as well, is that if the smartphone app recognizes that you're
7004880	7010480	near the machine, I guess, through a Wi-Fi connection or something that it would identify,
7010480	7015680	you can actually play the songs on your phone that the person is playing on the machine
7015680	7017160	at the same time.
7017160	7020320	And then the score that you get on your phone is displayed on the screen.
7020320	7025120	So like, remember back in the day when Para Para Paradise was the, Paradise, Para Para
7025120	7027520	Paradise was the big game that everybody was playing.
7027520	7028520	And like, what would happen?
7028520	7032440	One person would be dancing on the machine and everybody else behind them doing the same
7032440	7033440	thing.
7033440	7037600	Now it's kind of like that, but with your smartphone, you're playing the game and then
7037600	7039440	all the scores display on the screen.
7039440	7043600	So I think that's kind of, kind of neat, kind of a different way to do it.
7043600	7044600	Yeah.
7044600	7047720	So something kind of new and, you know, props to these guys for being the ones to bring
7047720	7048720	it to.
7048720	7053000	I'm glad they're doing it, but at the same time, I think it also kind of, I mean, not
