start	end	text
9325060	9327340	The nephew of the week is to vent.
9327340	9328340	But I will say this.
9328340	9331300	You know what's going to happen, Loki, is that, and this happens with a lot of kids,
9331300	9334500	around age like six or seven, he's just going to transform.
9334500	9338060	And suddenly it's going to be like, now the kid will be like a little brat.
9338060	9339060	And you won't be...
9339060	9340060	He already is!
9340060	9341060	It doesn't matter.
9341060	9342060	It doesn't...
9342060	9343060	I don't get the any of...
9343060	9344300	There is no upside.
9344300	9347020	He is a brat and fucking...
9347020	9348020	Just like daddy.
9348020	9350820	It's like, there is no upside.
9350820	9353260	All right.
9353260	9354260	I like that story.
9354980	9355980	Thank you.
9355980	9358740	I'm so glad you could talk about how Big Bird made you throw up here on the show.
9358740	9359740	Yeah.
9359740	9360740	Well, he didn't hug me.
9360740	9361740	If he hugged me, I would have been fine.
9361740	9364700	But I wailed for hours.
9364700	9368620	Now I feel like for your birthday, I should put on a Big Bird costume and come out and
9368620	9369620	give you a hug.
9369620	9370620	Don't take it there.
9370620	9371620	No.
9371620	9374100	So here's what I'll do differently.
9374100	9376860	Next time, if I were to do something differently, I wouldn't sit as close because I think if
9376860	9381360	we were sitting up like at the top of the, you know, the lower section or something,
9381360	9383140	it wouldn't have been so bad.
9383140	9385700	It's just that they're doing live pyrotechnics in the front.
9385700	9389020	He's never seen a show with live pyrotechnics and stuff.
9389020	9391700	And so it's a little bit, you know, frightening for him.
9391700	9392700	All right.
9392700	9393700	So at least you have a lesson learned out of this.
9393700	9394700	I understand that.
9394700	9398260	But yeah, and also the lesson is I'm not going to waste $200 on fucking tickets too.
9398260	9400500	They wanted $12 fucking dollars for popcorn.
9400500	9401500	I bought that popcorn.
9401500	9404740	I damn well am going to eat every single piece of that popcorn.
9404740	9405740	It's not gone yet.
9405740	9410700	But they seriously wanted like $15 for a fucking snow cone.
9410700	9412940	I mean, come on.
9412940	9416620	Speaking of stadium events and paying too much money, I want to give an FU this week
9416620	9419140	to the San Jose Sharks.
9419140	9420140	You're my team, guys.
9420140	9421140	You're my team.
9421140	9422620	You're my hometown team.
9422620	9426740	You got to break Alan's hockey cherry as well, going to his first Sharks game.
9426740	9429220	Did you have fun at the Sharks game, Alan?
9429220	9433140	I did, but I have to give a shout out to those seats we got.
9433140	9434140	Oh, yeah.
9434140	9439380	It would have been nice if they had won with those seats, but we were eight rows from rink.
9439380	9440380	Yeah.
9440380	9441380	No, that was awesome.
9441380	9442380	That was my buddy, Neil.
9442380	9444580	He's been playing in the zone since high school that helped hook us up with that.
9444580	9446620	So thank you.
9446620	9447900	Very appreciative about that.
9447900	9452560	But yeah, FU San Jose Sharks for just choking in the third period.
9452560	9455980	It was tied 2-2 at the end of the second period.
9455980	9462940	And then period three started and the Black Hawks were like, you know what, we're tired
9462940	9463940	of this.
9463940	9465500	We're just going to win now.
9465500	9466500	Yep.
9466500	9467500	Man.
9467500	9472320	But at the very least, the very least, because before the show, the Kill Time, because he
9472360	9475800	had a Batman shirt on that I just wasn't going to do.
9475800	9479560	So we went and bought Marvel shirts and so he got an Avenger shirt and I got a Deadpool
9479560	9480560	shirt.
9480560	9481560	So at least I have a Deadpool shirt.
9481560	9482560	At least you have a Deadpool shirt.
9482560	9485320	At least I have a Deadpool shirt and some popcorn that I'm going to eat no matter how
9485320	9486320	stale it gets.
9486320	9488960	Because I paid $12 for that fucking popcorn.
9488960	9493200	I am eating every piece of that popcorn.
9493200	9497040	Tigerclaw in chat says, what if your presence at the game is the reason why the team lost,
9497040	9498040	Rob?
9498040	9499040	Just saying.
9499040	9500040	Yeah, because that's two losses in a row now.
9500040	9502040	They saying you're a cooler?
9502260	9503260	You know what?
9503260	9504260	Don't go there.
9504260	9505260	I am.
9505260	9509760	I'm sorry if my radiant beauty and presence just throws the team off their game.
9509760	9510760	I can't.
9510760	9511760	I can't.
9511760	9515120	My friends are already suggesting that I'm the cause of the losses, but I'm telling you
9515120	9520320	four goals in one period and removing the goalie from the net so they could score on
9520320	9521320	an empty net.
9521320	9523320	These were not my decisions, people.
9523320	9524320	Not my decisions.
9524320	9528320	Anyhow, just a few more stories for you guys and we're going to open up the Skyline quickly
9528320	9529320	to get your calls.
9529320	9533160	I'm a little late here tonight because of the announcements we did live on VoG before
9533160	9537200	the show tonight, but I do want to at least try to get one or two calls in, especially
9537200	9541200	people might want to talk about GDC, South by Southwest, PAX, or one of the many things
9541200	9543200	that have been going on over the past couple weeks.
9543200	9546200	1-877-GAMO-LR or a username on Skype, Orange Law and Tradeo.
9546200	9550080	But first, before I get to those calls, a few more stories for you guys.
9550080	9551080	Loki.
9551080	9559240	So, Marvelous has just acquired G-mode and with that they've also acquired most of
9559240	9567240	Data East's intellectual properties, including Magical Drop, Joe and Mac, which, shit, when's
9567240	9573080	there been, when's the last time we had a Joe and Mac game, SNES?
9573080	9578560	Let's see, Fighter's History, Caveman Ninja, and BurgerTime, among others.
9578560	9579560	Yes!
9579560	9582040	So maybe we'll get another BurgerTime game.
9582040	9583040	Yes!
9583040	9585400	That'd be pretty sweet.
9585400	9586400	What else do they have?
9586400	9591480	They also have, I guess, Metal Max, I still remember that, and Vapor Trail.
9591480	9595120	So I wonder if we'll see some more games from that, hopefully, hopefully they do something
9595120	9596120	with it.
9596120	9597280	I mean, obviously they would do something with it.
9597280	9598280	Why would you purchase it?
9598280	9600200	Why would they buy it if they're not going to do anything with it, right?
9600200	9603720	Data East, so, uh, does that mean we're going to get a new Bad Dudes game?
9603720	9605320	Are we going to get a new Bad Dudes game?
9605320	9607080	Are they a bad enough dude to put out Bad Dudes?
9607080	9610000	Can we get a new Bad Dudes game, because that'd be pretty sweet.
9610000	9612760	I don't know, Bad Dudes is kind of one of the games, it actually wasn't very good.
9612760	9615000	Like I don't know if you ever played Bad Dudes on the NES, it really wasn't good.
9615000	9619880	I played Bad Dudes all the time, and I could never do a fucking Roundhouse game with it.
9619880	9620880	Never.
9620880	9623840	It was... it was too hard.
9623840	9630560	Alright, uh, this is interesting, something, it's a peripheral for the Oculus Rift, you
9630560	9632880	know, VR, it's where everything's going.
9632880	9634440	That looks like a creepy face.
9634440	9636440	Lots of people talking about the Oculus Rift.
9636440	9640840	Well that creepy face that Loki is referring to is Feel Real.
9640840	9647400	It is a Bluetooth add-on for the Oculus Rift that straps over your mouth and nose.
9647400	9651600	It looks like a creepy face that you'd be making out with.
9651600	9654480	It looks like a creepy like face that you would make out with or something.
9654480	9659120	Yeah, it does kind of look like something you would make out with, but uh, anyway, this
9659120	9665080	battery powered device will produce seven different scents.
9665080	9668440	Like smelly scents, not like money, but scents.
9668440	9674120	So it's smell-o-vision with this thing, with unique scents that you can smell.
9674120	9680640	So this mask will allow you to smell things like the ocean, a waterfall, or fire.
9680640	9687920	Also I guess this will produce temperature controlled air, mist, and vibrations.
9687920	9696120	So um, that's uh, that's something every game just gets one step closer to the holodeck,
9696120	9697120	doesn't it?
9697120	9701560	But now the holodeck will smell like fire and spray you with water and other temperature
9701560	9702560	controlled elements.
9702560	9706160	So you got to admit though, I mean, as much as we're kind of sitting here and making fun
9706160	9710360	of the way it looks and so forth, it does seem like a logical step.
9710360	9715000	If you're going to put this thing over your eyes and be immersed in this world with all
9715000	9720720	your vision, wouldn't it make sense that, you know, the temp, the other feelings besides
9720720	9724500	just your vision, your other senses are stimulated as well and it makes sense.
9724500	9728540	That would be cool except, you know, when I'm smelling fire in game and I just don't
9728540	9733340	realize that my house is burning down because I have a giant VR headset over me.
9733340	9738760	What if you're playing a very violent game on Oculus Rift and you're smelling blood?
9738760	9742700	Or people, you know, relieving themselves as you murder them, so.
9742700	9744220	That might be a bit much actually.
9744220	9748180	I don't, I think smell-o-vision, everyone tries to do smell-o-vision, I just don't think
9748180	9752420	it's going to work until you can get it to where you can simulate any smell.
9752420	9756700	And even then it's just, I think it's just too hard of a sense to do.
9756700	9759060	We don't understand enough about how it works.
9759060	9763460	Yeah, usually the smell-o-vision stuff is very limited but, you know, I think about
9763460	9767740	like some of the Disney stuff where they kind of like, you know, people love Soarin', right?
9767740	9770980	At Disney World they have Soarin' or Soarin' over California or whatever it's called and
9770980	9773160	they have it here at California Adventure as well.
9773160	9776720	Like a lot of people really like that ride because, again, a lot of your senses are being
9776720	9780780	stimulated because you have the vision, which isn't quite the same as Oculus Rift.
9780780	9782740	They need a better screen for that nowadays.
9782740	9785780	They're actually, they're refurbing it right now as we speak, it's down and the screen
9785780	9789980	is getting an HD refurbishment so, your wish is Disney's command, right?
9789980	9790980	The magic never ends.
9790980	9791980	It better be.
9791980	9797940	So, but then not only that but you have that sensation of flying which simulates your senses
9797940	9802260	as well and then, yes, even though it's limited, you know, you smell the oranges when you go
9802260	9805860	over the orange field and you smell the pine trees and you go over the pine field and I
9805860	9809980	think that's really why people love that ride because it's so many different senses all
9809980	9810980	being hit at once.
9810980	9812660	It's a nice air-conditioned building.
9812660	9814580	Yes, that is true.
9814580	9815580	That is very true.
9815580	9818260	No, or hardly ever a line.
9818260	9820740	Kaijuto is wondering, what if I'm playing The Binding of Isaac?
9820740	9821740	Well, you know.
9821740	9824780	Well, you're gonna smell a lot of blood and feces, I guess.
9824780	9826900	Here's the thing, too.
9826900	9827900	A lot of game.
9827900	9833180	He didn't mention what those other smells were, so it's ocean, fire, and vomit and shit.
9833180	9838740	Yeah, and a nerd expo, but no, here's the thing.
9838740	9843260	Keep in mind that the goal of the Rift is to not just port all the old games into the
9843260	9844260	Rift.
9844260	9846340	That's kind of doing it wrong, I think, in many ways.
9846340	9851260	Like, you know, we had that 8-bit Zelda experience in the Rift.
9851260	9855660	Look, Zelda was not designed to be a Rift game, but there are some pretty cool experiences,
9855660	9856660	you know, on the Rift.
9856660	9861940	I would love an 8-bit style game that would look like Zelda in the Rift.
9861940	9864900	Yeah, but it would have to be something that's kind of developed by that.
9864900	9868900	But I mean, like, for example, Bobby let me check out his Gear VR, which is the thing
9868900	9873260	that the Note 4 mobile device, you just pop it right in the headset and do it.
9873260	9874260	You know what I want?
9874260	9875260	What?
9875260	9876260	Like, super bad.
9876260	9877260	Stop interrupting my story.
9877260	9878260	Oh, sorry.
9878260	9882540	But I saw this Paul McCartney concert in it, and this Cirque du Soleil thing.
9882540	9887020	These weren't games, but they were experiences that, like Soarin' Over California, might
9887020	9890620	be kind of cool with the smell, but I just don't see where you could get that at a consumer
9890620	9891620	level.
9891620	9892620	And it would be very limited.
9892620	9894180	All right, yes, your Tangent Loki.
9894180	9895620	I want Zelda Maker.
9895620	9898500	Oh, if Mario Maker does really well, you want Zelda Maker?
9898500	9900340	I don't even give a shit if Mario Maker does really well.
9900340	9902160	I want Zelda Maker.
9902160	9903160	And then Metroid Maker.
9903160	9904980	Let's do all of those.
9904980	9908580	You know, if Nintendo was- Or Mario Kart Maker, they'd never do that,
9908580	9909580	though.
9909580	9913740	If Nintendo was listening to you on this program right now, Loki, they probably turned it off
9913740	9915300	about 90 minutes ago.
9915300	9917900	I'm sorry, they're throwing away money, okay?
9917900	9921660	You know, I understand that you really want to keep him happy, and that's fine.
9921660	9926020	He'll make his Mario games later on in Star Fox and all that fun stuff, but I'm sorry.
9926020	9934300	It's just not gonna- I love the guy, but it's just- I don't see those being successful.
9934300	9935300	I just don't.
9935300	9936300	But you know what?
9936300	9938100	Prove me wrong, please.
9938100	9939700	I hope that I'm wrong.
9939700	9943980	I just think it's gonna flop, and it's gonna suck, or it's just nothing's gonna ever happen
9943980	9944980	with it.
9944980	9945980	It's more of an experiment, and that's it.
9945980	9949380	Yeah, Dartitsuya is saying, are you sure you're not gonna dog on Zelda Maker if they do it?
9950100	9952940	All right, Nsj100Matt says, or Mega Man Maker?
9952940	9953940	Oh, wait.
9953940	9954940	Womp, womp, womp.
9954940	9959140	Well, hey, we could have had that at one time, you know, but that never-
9959140	9960140	That's the joke.
9960140	9963580	Well, technically they had that on PSP, but you know.
9963580	9967480	Back on the Smellovision real quick, Kaijuto is saying, didn't TGIF do smell stuff?
9967480	9968480	It was whack.
9968480	9969620	TV Guide.
9969620	9970620	I remember.
9970620	9974260	I wasn't alive then, but I remember the DVD release of this, where they kind of brought
9974260	9976700	it back for a little bit, and I remember reading about it.
9976700	9978660	Wait, how are you- oh, okay.
9978660	9984500	In the 70s, Pink Flamingos, the cult John Waters movie that's really explicit, right?
9984500	9987440	They had a whole smell- no, wait, no, it wasn't Pink Flamingos, it was one of the other John
9987440	9988540	Waters movies.
9988540	9990400	Was it Polyester?
9990400	9993540	One of them had like a Smellovision card, and when the DVD came out, you could actually
9993540	9996980	get the Smellovision card, came with it, and you could kind of experience it all over again,
9996980	10000400	and that was like John Waters' thing, was it was- and of course, some of them were like
10000400	10005880	roses and nice things, and some of them were like poop and offensive things that I would
10005880	10007900	advise you don't scratch and sniff.
10007900	10012080	But like, that was kind of a fad in the 70s and 80s.
10012080	10015380	So anyway, moving on.
10015380	10017140	Loki, one more story.
10017140	10022620	So hey, Rob, I hope you're happy we finally got a new F-Zero game.
10022620	10023620	What?
10023620	10025900	Why did we wait till the end of the show to talk about this?
10025900	10033420	Because it's actually, it's an unofficial port of F-Zero to the, what was it, the MegaDrive.
10033420	10035620	So G-Zero is what it's called now.
10035620	10036620	Oh, okay.
10036620	10041100	It doesn't have Mode 7, but it looks nice.
10041100	10042700	I wonder how that runs.
10042700	10045060	It's got to look kind of funky on a Genesis.
10045060	10046060	I heard it sounds good though.
10046060	10051580	I don't know, they don't have any video of it, but they were saying, you know, this is
10051580	10055880	cool, doesn't look bad either, colorful, fits the spirit of the original, and it says this
10055880	10059220	is beyond excellent, just the music alone brings tears to my eyes.
10059220	10061700	So you know what's kind of cool?
10061700	10068900	On the subject of this too, I watched a video of someone that had ported Street Fighter
10068900	10077740	2 Turbo Edition to the Virtual Boy, and it actually looked kind of cool.
10077740	10084780	So man, Virtual Boy, in some ways that thing was just ahead of its time, right?
10084780	10085780	I don't know.
10085780	10087780	I think they should try it again.
10087780	10092300	All right, well we're going to open up the Skype line at 1-877-GAME-OLR, or our username
10092300	10095460	on Skype, Orange Lounge Radio, all one word.
10095460	10099300	We are the show where every gamer has a voice, so call in and lend yours to the conversation,
10099300	10102820	anything we talked about this week, or maybe something that we missed.
10102820	10104980	The Skype line is open now.
10104980	10109180	Meanwhile, Loki, I don't know if you have any last minute stories, I think we touched
10109180	10113860	on, it was kind of a quiet this week, quiet week this week, because last week was kind
10113860	10117260	of busy, the week we were gone unfortunately, but we tried to hit on some of the big stuff.
10117740	10120020	I don't know if you have any other last minute stories, Loki.
10120020	10121540	I don't think so.
10121540	10122540	No?
10122540	10123540	Yeah.
10123540	10124540	No, that's all right.
10124540	10125540	It happens.
10125540	10128860	We actually are getting some calls coming in, so we can get to the Skype line.
10128860	10130060	Hi, you're on Orange Lounge Radio.
10130060	10131060	Who's this?
10131060	10133060	Yes, this is Azur Man.
10133060	10134060	Hey, what's up?
10134060	10135060	Azur Man.
10135060	10136060	What's on your mind, buddy?
10136060	10137060	Too much.
10137060	10138060	Two things.
10138060	10145380	You guys were just basically speaking earlier with the program world and the 2DX issues.
10145380	10149500	Yes, our special correspondent, YYR, bringing us the info on that.
10149500	10158700	Yeah, I kind of play on the East Coast at Chinatown Fair, and we kind of had that issue.
10158700	10164260	We had basically the machine for a pendulum for about a few months, and it was kind of
10164260	10170300	a big damper when everything was going down, but what I basically wanted to talk about
10170300	10181940	was that radio shows like this and other communities like Bimani style kind of keeps
10181940	10188780	people like me who like 2DX playing games like that and keeping ... I'm sorry, I'm trying
10188780	10189780	to get my thoughts together.
10189780	10199820	What I'm trying to say is that Konami really knew about this whole issue with the people
10199820	10205300	in America playing the game, but it seems that you might be right that round one might
10205300	10210860	want to try to have some sort of monopoly over it and maybe bring it over here, but
10210860	10216180	it's kind of depressing to kind of find out like you can't play it at all in the store
10216180	10217180	anymore.
10217180	10219340	Yeah, and you know what?
10219340	10224940	You bring a very difficult but logical point up that people have to consider whether they
10224940	10231020	want to hear it or not, and that is that Konami turned a blind eye to this for a very,
10231020	10232580	very long time.
10232580	10236780	I mean, even back when we talked about nothing but DDR, I mean, think about it.
10236780	10241580	DDR Extreme Machines weren't even supposed to be here in the US, and everybody had them
10241580	10247700	anyway, so Konami's turned a very blind eye to this for a very long time, and so for it
10247700	10252780	just now to have the rug pulled out kind of stings a little bit for a lot of people, I
10252780	10253780	get.
10253780	10256220	But on the other hand, I can also see why.
10256220	10260060	I don't want to villainize round one in this either because I could also see it from their
10260060	10264380	perspective where if round one is like, hey, if we're going to play by the rules, then
10264380	10266700	everyone else needs to play by the rules.
10266700	10271180	What I would love to see happen in this scenario, I think, I think, you know, what kind of has
10271180	10275780	to happen in some ways or else somebody's going to get pissed off is that we really
10275780	10281580	need to start tearing down these arbitrary region walls.
10281580	10285520	And we've been bitching about this on the 3DS and PlayStation and so forth about region
10285520	10288100	locking for the longest time, have we not?
10288100	10291020	And isn't this whole thing that we're talking about, isn't this just another form of region
10291020	10292020	locking?
10292020	10296200	I mean, isn't it time that Konami, I mean, and if the reason, if the real reason they
10296200	10300540	shut it all down was to launch E-Amusement Global and now great, everybody can have the
10300540	10306540	latest 2DX and everybody can play by the rules, then I think that is, in my opinion,
10306540	10307540	a happy ending.
10307540	10311140	Although some people may not like the fact that they have to do the 30% of the proceeds
10311140	10314900	and it may make it a little tougher for private owners.
10314900	10319580	I'm not sure I see a scenario where they can really win, but I think at least all the arcades
10319580	10321700	that want to run the machines can do that.
10321700	10322700	Yeah.
10322700	10324820	I mean, that's one of the issues.
10324820	10330860	I mean, it's really hard to get people outside of this small community to play, and I say
10330860	10335700	small because compared to the people who play other games like the Street Fighter community,
10335700	10340700	the Konami, Bimani's community is rather small.
10340700	10344540	And it makes it very difficult for them to kind of like come out with a system, like
10344540	10346380	I'm an arcade and played here.
10346380	10352100	I had a few friends who had their own arcades and they kind of brought them to big, like
10352100	10354900	flea markets and stuff to kind of like have people play.
10354900	10357860	And even though it wasn't, they were losing money on it, it wasn't making any money.
10357860	10362320	They still tried to keep up with the latest, you know, because the hardware wasn't really
10362320	10363320	the problem.
10363320	10370940	Once they bought the cabinet, buying the upgrades every single from overseas was rather cheap.
10370940	10378300	It was this new network, the EMU's network, where you can't basically play the latest
10378300	10383540	mixes without being connected to it, really makes it very difficult for them to keep up
10383540	10384540	with it.
10384540	10387580	And like, you know, I'm a big fan of all the Bimani music.
10387580	10391060	It kind of draws in, we even, I don't know if you're familiar with, we had something
10391060	10394220	over here called Ballmani.
10394220	10400980	There was actually one of the vendors here in, I think in Massachusetts, Ashley was able
10400980	10408140	to get Konami to send over Course K. And he also, he was one of the like DJs for a lot
10408140	10409140	of Bimani music.
10409140	10417100	He does Hippin' Above, he did, what do you call it again, Rising to the Sky, Rising in
10417100	10418600	the Sun.
10418600	10421980	And he was actually, he came here, he played a few of his mixes.
10421980	10423460	I took a few pictures with him.
10423460	10425020	He was really cool.
10425020	10429260	And they were trying to like see how people were, you know, they didn't like two years
10429260	10430260	of that.
10430260	10432540	The other year, I think, REU was supposed to come.
10432540	10435820	And it was really cool because they were trying to like see if, you know, if America would
10435820	10437940	like it, even though it was a very small group.
10437940	10441780	But after that, it kind of just fell apart and we didn't see much about that after that.
10441780	10445180	I think the store closed down and somebody else took over the store.
10445180	10451820	But you know, out of those 10 years, it was a big part of my like gaming, you know, life.
10451820	10455540	I mean, it was either that and Final Fantasy XI, you know, back and forth.
10455540	10459100	So this show wouldn't exist without that community.
10459100	10460100	It really wouldn't.
10460100	10464660	So, I mean, it pains us all to kind of see that Konami doesn't really want anything to
10464660	10465660	do with it.
10465660	10470700	But at the same time, you know, some of their games were a little half-assed.
10470700	10472780	Some of them were very half-assed.
