start	end	text
8502000	8508000	My FU of the Decade goes to people that steal things that aren't theirs.
8508000	8512000	You might remember this decade, my car was broken into a multitude of times.
8512000	8517000	We had these people talking about stealing Xboxes and so forth
8517000	8521000	that stupidly sign on to them online, stealing passwords
8521000	8523000	and using them to hack people's accounts.
8523000	8528000	FU to people that don't have the common decency to not touch shit that isn't theirs.
8528000	8532000	Oh, and FU to Proposition 8, that was pretty fucked up too.
8532000	8534000	Hey, back to the show.
8534000	8537000	How about the segment of the show where we open up ye old mailbag
8537000	8539000	and see what our listeners have to say?
8539000	8551000	That would be at our mailbag at orangeloungeradio.com address.
8551000	8553000	We have two emails.
8553000	8554000	Alrighty.
8554000	8557000	First one, hey, OLR, I was in Spanish class a few days ago
8557000	8559000	and thinking about the new year.
8559000	8561000	We should have been focusing on Spanish.
8561000	8564000	Then I started thinking about really crappy games with peripherals
8564000	8567000	that no one will buy like Band Hero and Tony Hawk Ride.
8567000	8571000	So my question to you is what are your peripheral predictions for the new year?
8571000	8573000	Personally, mine will be a knife and fork and stuff like that
8573000	8576000	for a new Cooking Mama game.
8576000	8579000	They've already done that actually.
8579000	8582000	Well, you know, there's actually a burger flipping ticket game
8582000	8584000	that came out in Japan.
8584000	8587000	I think that we're going to get Boonga Boonga for the home
8587000	8590000	and it comes with a real finger to butt peripheral.
8590000	8593000	Whatever happened to the table flipping game that was out in Japan?
8593000	8594000	I'd like to see that out of here.
8594000	8595000	It's out in Japan. That's about it.
8595000	8596000	What about here?
8596000	8604000	I wonder if Boonga Boonga is actually emulated in MAME yet.
8604000	8606000	Go get it. Go get it, Loki.
8606000	8612000	Because if it is, that would be one hell of a fun game to make a peripheral for.
8612000	8614000	Dot, dot, dot.
8614000	8618000	As far as the rest of the email, what I think next year as far as peripherals go,
8618000	8620000	you already know it's the motion sensing stuff.
8620000	8623000	Natal and the ice cream cones from Sony.
8623000	8625000	Those are going to be the huge things, game changers, that come out next year.
8625000	8629000	They're also going to come out with the, I think,
8629000	8632000	not just necessarily something that reads your motion,
8632000	8636000	but also, you know, I would actually like to see something
8636000	8643000	that doesn't necessarily view your motion as much as
8643000	8646000	checks your coordination, you know what I mean?
8646000	8650000	Like it gives you something like a full motion sensing DDR
8650000	8655000	where it gives you your commands and then you have to mimic exactly.
8655000	8661000	Or even, you know, or even charades online.
8661000	8662000	Could you imagine that?
8662000	8663000	You know what I don't want to see?
8663000	8665000	That would be fun. I like that charades online idea.
8665000	8668000	But what I don't want to see is this whole brain scanning thing.
8668000	8670000	Have you heard about the brain devices?
8670000	8672000	Like the game that you control with your brain and all this stuff?
8672000	8674000	I don't like that idea.
8674000	8676000	I don't like that at all.
8676000	8679000	I hope that isn't where peripherals go next year.
8679000	8681000	I just, I don't like the whole thought reading thing.
8681000	8684000	It's kind of a little freaky to me.
8684000	8686000	Call me a warrior or whatever.
8686000	8689000	I just, you know, just a little weird.
8689000	8691000	Anything else in the mail, Ag?
8691000	8693000	Yes. Well, there's still more to that one.
8693000	8694000	Oh, my bad.
8694000	8696000	Yeah, Rob, duh.
8696000	8698000	Sorry, I have to give you a hard time.
8698000	8700000	As soon as I can find where the crap my thing went to.
8700000	8702000	There we go.
8702000	8705000	Also, I wondered where you guys get your news from.
8705000	8707000	Do you have a set or are you all over the place?
8707000	8712000	My favorite right now is games with a Z traffic dot com.
8712000	8714000	Look it up. Thanks, Mike.
8714000	8716000	I think you just gave somebody a free plug.
8716000	8718000	Why not? I don't mind.
8718000	8719000	Alright.
8719000	8721000	You know, I go Eurogamer for a lot of my stuff.
8721000	8725000	I use Google Reader and I feed several different websites into Google Reader.
8725000	8727000	You know why Google Reader is awesome?
8727000	8732000	Because, like, anybody that tries to firewall access to certain sites at certain places,
8732000	8734000	Google Reader gets around that.
8734000	8736000	Yes.
8736000	8738000	Also, another one.
8738000	8740000	Hi, everyone.
8740000	8742000	This is from Spazinator, by the way.
8742000	8745000	Hi, everyone. Seeing as this is topics and questions may possibly run a little long,
8745000	8748000	I opted to send them via email rather than Twitter.
8748000	8752000	Seeing as it's the end of the year and traditionally everyone seemingly does a top ten list of some sort,
8752000	8755000	why not have the O.L. Army do one?
8755000	8757000	But do one with a twist.
8757000	8763000	What I had in mind was a list of top games that came out this year that you love to have
8763000	8768000	the Hillary Clintons and the Voldemorts of the world be forced to play nonstop for days on end
8768000	8769000	just to drive them all crazy.
8769000	8771000	Well, even crazier than they already happen to be.
8771000	8774000	Also, seeing as the year is virtually over, I have two questions.
8774000	8778000	Compared to 2008, how do you feel about 2009 fared in regards to game releases,
8778000	8782000	sales of both consoles and games, as well as improvements to consoles,
8782000	8786000	and or their online services, both in terms of actual hardware revisions,
8786000	8790000	or as well as firmware updates.
8790000	8794000	I have no opinion. It's about the same.
8794000	8798000	I've got to say, I think 09 has been a lot more disappointing than 08.
8798000	8800000	I think we've had a lot of disappointments this year.
8800000	8804000	Games getting pushed back, quality of games, you know, don't seem to be up there.
8804000	8807000	I mean, there's lots of exceptions to this rule, don't get me wrong.
8807000	8809000	Of course, there's been some real gems that have been released this year,
8809000	8813000	but I think layoffs, et cetera, it's been a lot of disappointment this year.
8813000	8817000	I don't think there's a lot of good that came out of this year.
8817000	8823000	Except for, yeah, I got nothing.
8823000	8826000	President Cat is the good thing that came out this year, that's it.
8826000	8829000	Two, and as far as 2010 is concerned,
8829000	8832000	is there anything in particular that's been announced that you three are eagerly awaiting?
8832000	8835000	Do you have any possible predictions for 2010?
8835000	8837000	Or at least something you hope to see happen?
8837000	8842000	I hope that we get President Cat.
8842000	8847000	To kind of piggyback on what Loki was ranting about earlier,
8847000	8849000	I would really like to see Nintendo come out at E3
8849000	8852000	and do the system they should have done last time.
8852000	8858000	I understand that Wii was their gamble, yay for them, they won.
8858000	8860000	I would like to see them kind of take that up to the next level
8860000	8863000	and catch up finally to where their competitors are at
8863000	8865000	as far as the hardcore gamers are concerned,
8865000	8868000	with the HD and the online and all that fun stuff.
8868000	8874000	It's not going to happen, but you asked what I want to see.
8874000	8877000	And I'm always a big fan of more retro goodness,
8877000	8880000	so I would like to see more retro games coming back,
8880000	8884000	this whole achievements and trophies and cooperative online play.
8884000	8886000	I'm a big fan of all that stuff.
8886000	8891000	I wish the Virtual Console had achievements within it,
8891000	8895000	or ways that I could experience all these old games again with friends.
8895000	8900000	As neat as Virtual Console is for some of the great retro games,
8900000	8902000	it feels very lazy to me.
8902000	8906000	It's just an emulator you're paying for.
8906000	8910000	And to be fair, Xbox 360 has a lot of these games in their arcade, too.
8910000	8912000	I'm not just picking on Nintendo here.
8912000	8914000	A lot of arcade releases on 360,
8914000	8916000	and Microsoft finally put their foot down on this,
8916000	8920000	was just retro stuff that would throw in some achievements.
8920000	8922000	I don't know, I just would like to see retro games.
8922000	8923000	It has been a decent year for retro gaming.
8923000	8926000	I think it has been a decent year, though, for retro gaming already.
8926000	8928000	Because we've gotten certainly a lot of nods,
8928000	8931000	I mean, Bionic Commando, and...
8931000	8935000	You know, I really, though, want to see something really innovative.
8935000	8937000	I want to see something really original.
8937000	8939000	I want to see a game.
8939000	8942000	I want to see working designs come back,
8942000	8944000	and bring out all the cool stuff from Japan.
8944000	8946000	That's what I want.
8946000	8949000	I'm holding my breath.
8949000	8952000	Is that it for that email?
8952000	8953000	Or is there more?
8953000	8955000	I think that's it.
8955000	8956000	All right.
8956000	8957000	Yeah, that's it.
8957000	8960000	Mailbag at Orangelaunchrater.com is the place to send your emails.
8960000	8963000	Now we'll get into the decade a little bit,
8963000	8966000	and I don't want to linger too long on this,
8966000	8969000	but it's interesting that we're getting to the close of another decade here,
8969000	8973000	the O's or whatever we're going to end up calling these in the past.
8973000	8975000	If you think about it, it started.
8975000	8978000	Let me just rewind ten years ago here,
8978000	8984000	and I realize the majority of our listeners are somewhere between 18 and 25,
8984000	8988000	meaning when this decade started, you were between 8 and 15.
8988000	8992000	So, I mean, games have kind of evolved with many of you,
8992000	8994000	and of course, not all of our listeners.
8994000	8997000	Heck, the hosts don't fit into that age bracket.
8997000	9000000	I'm considerably older than that, as we all are,
9000000	9004000	but I realize that that's where a lot of the listener base is,
9004000	9006000	and just how much games have changed.
9006000	9009000	Just to kind of rewind ten years and show you how far we've come.
9009000	9014000	Here are some of the big things that happened in the year 2000.
9014000	9018000	PlayStation 2 was launched in the year 2000.
9018000	9021000	That's when the PlayStation 2 came out.
9021000	9025000	Let's see.
9025000	9030000	Nintendo finally sold its 100th millionth Game Boy handheld console.
9030000	9034000	Sega launched Sega Net into the year 2000,
9034000	9038000	and that's when the Dreamcast Championships took off.
9038000	9041000	Some of the games that came out in the year 2000.
9041000	9044000	The Sims came out January 31st of the year 2000.
9044000	9046000	I think it was almost ten years old.
9046000	9049000	Thief 2 came out in the year 2000.
9049000	9051000	Vagrant Story.
9051000	9054000	EverQuest came out in the year 2000.
9054000	9056000	Deus Ex.
9056000	9059000	Diablo 2 was from the year 2000.
9059000	9061000	That game feels even older.
9061000	9065000	Final Fantasy IX had a release in Japan in the year 2000.
9065000	9067000	Chrono Cross came out in 2000.
9067000	9070000	Dragon Quest VII.
9070000	9074000	American McGee's Alice.
9074000	9078000	The Legend of Zelda Majora's Mask was in the year 2000.
9078000	9081000	What else we also had that year?
9081000	9083000	Seaman.
9083000	9085000	Was that really?
9085000	9089000	Seaman, do they have a lot of Dreamcast stuff on there?
9089000	9092000	Yeah, they account for Dreamcast on this list.
9092000	9097000	I think Seaman might have either been 2000 or 2001.
9097000	9100000	But yeah, the Dreamcast stuff was all early.
9100000	9102000	Escape from Monkey Island.
9102000	9104000	Tekken Tag Tournament.
9104000	9107000	Final Fantasy IX got its release over here too.
9107000	9109000	Skies of Arcadia.
9109000	9111000	Banjo-Tooie.
9111000	9112000	Here's some Dreamcast.
9112000	9115000	Grandia 2 came out towards the end of the year 2000.
9115000	9117000	Grandia 2, I played a lot of that.
9117000	9121000	I played through half of it in Japanese and then I was actually...
9121000	9126000	That's one of the games that I found out that my Japanese save file worked on the US one.
9126000	9128000	You know what else game did that?
9128000	9130000	Power Stone.
9130000	9132000	Wow.
9132000	9133000	So, think about it.
9133000	9134000	I mean, just to kind of go all the way back.
9134000	9139000	Ten years ago we were a completely different generation of video games.
9139000	9144000	Because the launch of the new generation, if you will, of games didn't really happen until...
9144000	9146000	What about 2005, 2006?
9146000	9150000	I think E3 is when we started hearing about this new round of consoles.
9150000	9151000	And then you go back.
9151000	9155000	I mean, heck, the GameCube just came out in, what, like 01?
9155000	9156000	Now we have the Wii.
9156000	9160000	I mean, we've gone through many, many different game systems in this generation.
9160000	9164000	So we would have had that all touched this last ten years.
9164000	9171000	We had the Dreamcast, the PlayStation 2, the PlayStation 3, the GameCube, the Wii, the Xbox.
9171000	9175000	Microsoft got into gaming in these past few years, or not even ten years ago.
9175000	9177000	And the Xbox 360.
9177000	9180000	And then, of course, I'm not even counting handhelds and the countless amounts of those.
9180000	9184000	And, you know, other one-off systems that came out as well.
9184000	9187000	So it's going to be interesting, you know, in the next ten years, in the next generation,
9187000	9191000	just how far games go will probably be another generation.
9191000	9194000	We'll be talking about the PlayStation 4 and other Xboxes.
9194000	9198000	And maybe other companies that decide to get into gaming.
9198000	9200000	Or maybe one of these companies will buy another.
9200000	9201000	Who knows?
9201000	9203000	It's going to be very interesting to see what happens.
9203000	9207000	Before we open up the phone calls, and yes, some folks in chat want to point out,
9207000	9209000	OLR started in 2002.
9209000	9215000	So while we didn't exist ten years ago, we're getting into our eighth year of broadcasting.
9215000	9216000	That's quite some time.
9216000	9219000	It's pretty impressive.
9219000	9220000	What do you guys think?
9220000	9222000	And I know this is a very difficult question.
9222000	9224000	This is a very difficult question.
9224000	9229000	But what do you guys think were some of the best games to come out of the decade?
9229000	9232000	The best games to come out of all freaking decade.
9232000	9235000	Knowing that you have all of those systems available to you.
9235000	9240000	Not just maybe what was important to you, but what you think was important to gaming in general.
9240000	9242000	The decade.
9242000	9245000	Loki, do you want to start? Do you have anything?
9248000	9251000	DDR Max 2 in the arcade.
9251000	9252000	Why is that?
9252000	9254000	It was fun.
9254000	9258000	It got people back in the arcade because you had stuff that you were working to unlock.
9258000	9259000	I don't know.
9259000	9262000	I like 5th Mix too. That came out around the same.
9262000	9265000	These were also games that brought us together.
9265000	9266000	We wouldn't have OLR.
9266000	9271000	As much shit as we give Konami and their music division now, ten years ago was a different story.
9271000	9273000	We praised them. We loved them.
9273000	9276000	But they made a lot of mistakes, sadly.
9276000	9278000	That it? Anything on consoles you want to mention?
9278000	9279000	Oh yeah, of course.
9279000	9283000	Like Grand Theft Auto, I want to say 3 I think was around that time.
9283000	9286000	I know definitely San Andreas was around that time.
9286000	9290000	And those are pretty significant.
9290000	9294000	Other things I played that were really fun, let me think.
9300000	9304000	I like Marvel vs. Capcom 2, but I can't remember when that came out.
9304000	9306000	I think that was around that time.
9309000	9312000	Gosh, I don't know. There's a lot of stuff I played.
9312000	9316000	It's hard to think back ten years. Everything I think about is more recent.
9316000	9319000	Final Fantasy X was pretty good.
9319000	9320000	Yeah, that was important.
9320000	9321000	That was pretty important.
9321000	9323000	11 for you. You spent a lot of time on that one.
9323000	9325000	I spent a lot of time on 11. That was fun.
9325000	9327000	First MMO?
9327000	9332000	Well, I played a little of my jerks online, but that sucked.
9335000	9337000	Gosh, yeah, it's tough.
9337000	9343000	Dark Sakura, anything you want to throw out there as far as your games of the decade?
9343000	9346000	Portal? Definitely Portal.
9346000	9348000	Seaman.
9348000	9350000	DDR?
9350000	9356000	Well, keep in mind, I got DDR for home in 2000 on Dreamcast.
9356000	9359000	Rod Caliber Rob.
9359000	9361000	Rod Caliber is important.
9361000	9363000	You remember Rod Caliber, don't you?
9363000	9366000	Yes, that's when you play Soul Caliber with the rod.
9366000	9369000	Yeah, exactly. Rod Caliber.
9369000	9381000	Also, I'd have to say, probably as far as shooters go, I'd say Ikaruga, getting Gradius 5.
9381000	9385000	There was a lot of good games that came out, though, in the decade.
9385000	9388000	So, I'd really say...
9388000	9394000	Well, if I say Portal, I should say Nurbacular Drop, because that's really the game that gave us Portal.
9394000	9401000	A lot of people thinking in interesting directions, especially with having the Dreamcast come out, the Naomi system, Hikaru after that.
9401000	9405000	Although, I still want Planet Harrier. Where is it?
9405000	9409000	It doesn't work. I tried it during the beginning of the show.
9409000	9410000	Damn!
9410000	9413000	Sorry, it still doesn't work in MAME.
9413000	9420000	As far as my answer to the question, I've answered this on another show, but to kind of repeat it here on Orange Launch Radio, I think I would split it up into a few categories.
9420000	9421000	Me and Skype?
9421000	9423000	No, you left yourself on.
9423000	9424000	Sorry.
9424000	9428000	Jamie's trying to have a sidebar conversation with me while I'm trying to talk on the internet.
9428000	9433000	Anyhow, what was I going to say? Oh yes, the game of the decade. Some things that came up.
9433000	9441000	My personal favorite game of the decade, I think, was probably Animal Crossing, was one I really remember.
9441000	9444000	I loved how you...
9444000	9452000	As much slack as that game got for running around doing nothing, if you really went far with it, where you could go into somebody else's village...
9452000	9456000	You brought your friend over with a memory card, and I remember we used to do this shit all the time.
9456000	9461000	Somebody would come over and we'd visit the town and try to get their townspeople to say dirty words and all this stuff.
9461000	9467000	It was just a lot of fun. And also the fact that it had all the retro Nintendo games in it before Nintendo started gouging the prices for all this stuff.
9467000	9475000	I just loved that game when it first came out, and it kind of sucks that the game's franchise has been milked through the DS and the Wii versions.
9475000	9477000	It's just not really as fun anymore as it used to be.
9477000	9486000	But that very first Animal Crossing that was on the GameCube in America, yes, I realize it's based off a Nintendo 64 game, but I'm not counting that because I didn't have an impact on our culture here in the US.
9486000	9492000	That first Animal Crossing on the GameCube, I think, was probably one of the best gaming experiences I had all decade.
9492000	9503000	As far as on a technical level, I know Loki's gonna kind of hate me for this, but I think Wii Sports, you have to recognize, is one of the best games of the decade because it got people to play games who don't play games.
9503000	9507000	You see Wii Sports in nursing homes, for Christ's sake.
9507000	9509000	But we didn't want those people playing games!
9509000	9515000	You still have to recognize, though, that's still money in the gaming industry that can someday make a game you might want to play.
9515000	9521000	No, it won't, because they'll be catering to these people that don't really care about games, but they like Wii Sports.
9521000	9532000	Okay, okay, hold on. But without Wii Sports, and basically the Wii in general, would we have Project Natal and the Sony ice cream cones, which may bring us the games you want to play, Loki?
9532000	9535000	I'm still skeptical on what they're gonna bring out.
9535000	9540000	I'm skeptical too, but there is a possibility it could be pretty fucking awesome.
9540000	9544000	And we would have Wii Sports to thank for that, like it or not.
9544000	9551000	Let's see, also I would say probably a good combination of both of those, both just personal favorite and I think it did a lot for gaming.
9551000	9560000	World of Warcraft. Haters gonna hate. I know there's a lot of people that are anti-MMOs out there, but I think World of Warcraft did amazing stuff for online games.
9560000	9568000	I think just for all, I think the way Blizzard kind of caters to the different audiences, Blizzard is like the best PC game maker.
9568000	9576000	They are. They don't make, name a bad Blizzard game.
9576000	9589000	I don't think there is one. Like maybe if you want to go back to like the Lost Vikings or shit that was out like years and years ago, but Blizzard, and to be fair, Blizzard doesn't make a lot of games, but World of Warcraft was great.
9589000	9596000	And they continue to make it better and the expansions have been good and I mean 11 million people play this game and sometimes people you wouldn't expect.
9596000	9601000	It's kind of created this whole new culture. It's been parodied on South Park and so forth.
9601000	9603000	Which was a very funny episode.
9603000	9609000	Yes, it was a very funny episode. I saw this list on Yahoo and I actually thought it was not a bad compilation.
9609000	9617000	A lot of times I roll my eyes at these sites when they want to do a top 10 games of the decade, but I actually think Yahoo did a decent job.
9617000	9624000	I wanted to share this with you guys. Again, this is coming from videogames.yahoo.com. This was their picks for the top 10 of the decade.
9624000	9632000	Number 10 from the year 2007, Super Mario Galaxy. I know Loki is a big fan of that, so Super Mario Galaxy from 2007.
9632000	9636000	That's alright. I'm just saying Super Mario Galaxy 2 is not going to be that great.
9636000	9639000	Number 9, Half Life 2.
9639000	9640000	Definitely.
9640000	9648000	I think sometimes I've forgotten about game from all of us console hoarding folks, but the orange box did bring this back to the forefront.
9648000	9651000	Half Life 2 is a hugely important PC game.
9651000	9661000	Just for the way it integrated story into the shooter game and the graphical level and just the fact that the game, you didn't really go from level to level.
9661000	9663000	You were immersed in the game.
9663000	9667000	I think it did a lot for gaming in that regard. That's a pretty good pick.
9667000	9671000	Some folks will probably put that a lot higher on their list. I don't know, but they put it in number 9.
9671000	9676000	Again, this list is coming from Yahoo video games and they write little blurbs with each of these I'm not going to read.
9676000	9680000	Wii Fit they put on their list in the year 2007.
9680000	9683000	This is the only one I take a little bit of issue with. I get why it's here.
9683000	9689000	They're putting this here for the same reason I named Wii Sports earlier because it opened up gaming to people that wouldn't usually play games.
9689000	9696000	But is it a game or is it something that uses a game console to accomplish what it really wants to do? I don't know.
9696000	9703000	I like this entry. I think this is often overlooked. Number 7, Bejeweled from the year 2001. The original Bejeweled.
9703000	9704000	I can see that.
9704000	9711000	I can totally see that too and I think a lot of folks forget what PopCap and casual gaming has done for gaming in this decade.
9711000	9713000	I think that's a very important game to note.
9713000	9717000	Number 6, they put Wii Sports. I don't think I need to say anything else with that.
9717000	9720000	Number 5, they put Halo.
9720000	9724000	I don't think the Xbox would have survived if it wasn't for Halo.
9724000	9728000	I think we'd be looking at the Xbox kind of like we look at the Atari Jaguar, honestly.
9728000	9736000	I think Xbox kind of pushed, and especially Halo 2, kind of pushed the Xbox to what ended up happening on the 360.
9736000	9741000	I think Halo was huge.
9741000	9745000	And certainly Yahoo and their video game related site does too.
9745000	9750000	You know Rob, it's all about Pest Society and Farmville.
9750000	9754000	And number 4 was Guitar Hero they put on the list.
9754000	9761000	And it's very interesting having done this as a music game based show when it was a very niche thing.
