start	end	text
4836000	4844000	And no word exactly yet when it's going to be coming, but apparently it was revealed on Major Nelson's weekly podcast
4844000	4856000	that Xbox's head, Aaron Greenberg, apparently is saying that Mass Effect 2, Splinter Cell Conviction, and Alan Wake,
4856000	4862000	and apparently also Crackdown 2 are scheduled for the first part of the year.
4862000	4866000	So, I guess Alan Wake isn't coming out later in the year like I had thought.
4866000	4869000	Probably second quarter, if I'd guess correctly.
4869000	4872000	Alright, well, some other games coming out before too long.
4872000	4876000	Resonance of Fate, some folks might be interested in this, is by TriAce.
4876000	4882000	This is already available as a demo on the Japanese PlayStation Network or the Japanese Xbox 360.
4882000	4886000	So, if you have a Japanese PSN account or you have a way of getting onto the...
4886000	4890000	I guess the Xbox is a little better now at blocking the non-Japanese stuff, but...
4890000	4891000	Eh, not very good at that.
4891000	4894000	Whatever you can do to get in there, you can do that to download that demo.
4894000	4898000	If you haven't already heard about this game, it's coming out from SEGA is publishing it.
4898000	4901000	It's kind of like a gunplay style RPG.
4901000	4909000	So, check that out, Resonance of Fate, now available in Japan or for those of you crafty folks over in other countries who know how to get in anyway.
4909000	4913000	LoL, Eye of Judgment, yes, it's coming out on the PSP.
4913000	4920000	But, no camera, no cards, and apparently, I'm not sure the UMD is really going to be there either.
4920000	4923000	Legends is just going to be on the PlayStation Store.
4923000	4925000	It's going to be there in the spring of 2010.
4925000	4929000	It'll have 300 digital cards, 30 that are unique on the PSP.
4929000	4931000	No UMD release expected at this time.
4931000	4933000	It's only going to be a digital download.
4933000	4938000	That doesn't mean it's only playable on the go, because remember, if you have a big enough memory card on the 3000...
4938000	4940000	That's all you need.
4940000	4942000	Is that included in the bet?
4942000	4944000	Ooh, good question.
4944000	4948000	No, and the reason why is because it's not as ridiculous as Eye of Judgment.
4948000	4952000	Whereas this, you know, is an actual game that can be played like a traditional game.
4952000	4957000	It's not something that's, you know, a card game with this extra camera crap that's added on top of it.
4957000	4959000	I will give Loki that. I mean, let's face it.
4959000	4965000	Part of what made the first game so preposterous was the fact that, you know, you're playing this card game with a camera, and I think that's why he took the bet in the first place.
4965000	4968000	PSP's deleting all that weird shit out.
4968000	4979000	Yeah, it's actually a game. It'd be almost like a translation of a Magic the Gathering game, whereas, you know, Eye of Judgment, I can imagine, would be played without the camera and all that extra crap.
4979000	4984000	Fair enough, guys. Let's just face it. Loki's never going to lose that bet. At least not in this decade.
4984000	4987000	It's never going to happen, period. They've stopped making the game.
4987000	4989000	Alright.
4989000	4993000	Silent Night is the name of a new expansion that came out on Quake Live this week.
4993000	4997000	And, as you can imagine, it makes everybody fit for the holidays.
4997000	5001000	Like, I guess if you want to shoot Santa Claus or one of his little helpers, you can kind of do that there.
5001000	5008000	It's going to be there for two weeks, and it's a remake of a Team Arena Distance Screams. They're now calling it Silent Night.
5008000	5013000	So, don't expect any new weapons or any significant changes to gameplay.
5013000	5020000	It's just like, you know, La La La, Winter Wonderland, etc., etc., candy canes and so forth for you to blow your friends away to.
5020000	5022000	Have fun with that.
5022000	5024000	Dark Soccer, what do you got for us?
5024000	5026000	Some stuff.
5026000	5028000	Stuff like and such as?
5028000	5034000	Well, Sega's having like a big sale in their Wii Shop channel.
5034000	5043000	You should have some of the games like Sonic 1, 2, 3, Gunstar Heroes, Streets of Rage 2, PLPO2.
5043000	5047000	Basically, they're going to be five bucks until January 6th.
5047000	5052000	So, each of them are three dollars less than usual, and I think they just want to make some money.
5052000	5055000	So, go buy them.
5055000	5065000	And as far as other stuff going on, there is a New Year's theme for free on Xbox Live, which it's pretty colorful.
5065000	5071000	Dan was using it for a little while. It has a big ball on top of the building. Ooh.
5071000	5084000	Also, they have some other things to go with the New Year that's supposed to, you have to pay for them, like the 2010 Avatar glasses.
5084000	5090000	And there's also the Deal of the Day stuff, like I believe it was the other day, it was Worms 2.
5090000	5092000	Some other stuff.
5092000	5102000	And then, last but not least, and actually this is I think the best news of all, is there is a country pack for Rock Band,
5102000	5108000	but who cares about the country crap because there's also a Paul McCartney set in there as well.
5108000	5117000	So, that's actually, it's actually December 29th is the country pack, which Alan Jackson's Good Time,
5117000	5124000	Cross Canadian Ragweed, Cry Lonely, Jason, Aldi and She's Country, Keith Urban, I Told You So.
5124000	5127000	That seems to be like the only good thing in the whole packet.
5127000	5132000	Kenny Rogers, The Gambler, okay, maybe Kenny Rogers, classic.
5132000	5136000	Martina McBride, this one's for the girls, Shania Twain, Any Man of Mine, blah, blah, blah.
5136000	5142000	But the Paul McCartney pack is going to be out on January 5th or January 7th for PS3 owners.
5142000	5151000	Haha, we'll get it first, Xbox, Xbox. You also get, for that set you get Band on the Run, the live, actually all these are live versions.
5151000	5155000	This is from the Paul McCartney New York City concert.
5155000	5159000	But there's Band on the Run, Jet, and Sing the Changes.
5159000	5169000	All of those are going to be 160, sorry, Xbox points or 200 Wii points each.
5169000	5177000	And these are actually, there's no telling if they're going to be available for Lego Rock Band.
5177000	5179000	Alright.
5179000	5183000	I can't wait until January 5th.
5183000	5187000	We'll start off the year with a bang, or a few guitar strums, whatever the case may be.
5187000	5189000	Let's get into some Twitter topics.
5189000	5195000	We've been taking some of your submissions over Twitter at Twitter.com slash O-L-R for some things we might have missed so far in the show.
5195000	5200000	And some random asked questions such as this first one from Blue Swim who tweets us,
5200000	5208000	If you could bring only one celebrity who died during the O's decade back to life, who would it be and why?
5208000	5216000	He continues on to tweet, I'd bring Heath Ledger back to life so he could reprise his role as the Joker in the new Batman movies again.
5216000	5225000	Gosh, I don't know. To think all the way back throughout the entire decade of the O's, that's a long time.
5225000	5229000	A lot of people die, death just kind of happens, so I'm not sure.
5229000	5232000	If you could bring back only one celebrity, he specifically said a celebrity.
5232000	5235000	Anybody that comes to mind for any of you?
5235000	5237000	I honestly, I'm drawing a blank.
5237000	5239000	I don't care.
5239000	5242000	Yeah, it's kind of a weird thought.
5242000	5255000	What if one of the celebrities that if they were suddenly back, if their very presence, alive, disrupted the entire time space continuum?
5255000	5257000	Or if they got brought back as a zombie.
5257000	5263000	No, Rob. Then we'd have to shoot them in the head and we couldn't remember them in a nice way.
5263000	5271000	I would like to see, um, God, the name escapes me right now, a totally famous guy, the guy that was with the NRA, not from my cold dead hands.
5271000	5276000	Charlton Heston, was that it? I'd like to see him reanimated as a zombie. I think that's the celebrity from the O's.
5276000	5281000	I want to see Brittany Whatcherfuck come back as a zombie so we can shoot her.
5281000	5284000	Rude, rude, rude.
5284000	5295000	You know, this is my whole thing. I understand mourning the loss of, like, someone's contribution, but you didn't know the person, you know?
5295000	5299000	Very good suggestion from chat. We have a couple people yelling out, Phil Hartman.
5299000	5302000	That was a very tragic thing that happened.
5302000	5309000	This is my whole thing. When people die, it's typically when they're supposed to.
5309000	5317000	Even if it might seem stupid, it's just, it happens when it happens, so I don't see any point in wishing for something that's not going to happen.
5317000	5323000	And since then, I really don't want to see anyone reanimated. I mean, just the whole zombie thing totally makes me want to puke.
5323000	5325000	Loki, was there something smartass you wanted to add?
5325000	5330000	No, I just had to see when someone died, so just checking real quick.
5330000	5331000	Dammit!
5331000	5335000	That was in 94. No John Candy, unfortunately.
5335000	5342000	I guess I'm going to have to go with my original thought, which was Michael Jackson, because I'd like to see him do his actual comeback.
5342000	5347000	And, you know, all sorts of fun that would be involved with that.
5347000	5355000	Alright, let's see. SSJ100Matt sent us this on Twitter, which is a link to a story.
5355000	5357000	Police followed an Xbox trail...
5357000	5360000	Oh, no, no, no, no, no! I take that back. I renege that.
5360000	5363000	I would like to see, um...
5363000	5365000	Oh, god, what's his name?
5370000	5373000	The chatroom is correcting themselves, by the way. Phil Hartman died in 98.
5373000	5377000	Yeah, not Phil Hartman.
5377000	5381000	The other guy, the other pitchman.
5381000	5382000	Billy Mays.
5382000	5384000	Hi, Billy Mays here.
5384000	5385000	As a zombie.
5385000	5387000	No, not as a zombie.
5387000	5391000	Did you see that episode of South Park? Brilliant, that show.
5391000	5394000	Anyhow, back to SSJ100Matt's tweet, thank you very much.
5394000	5401000	Sent us to a story from Lohud.com talking about police following an Xbox trail.
5401000	5406000	I guess because this guy in the Bronx was playing with a stolen Xbox 360 game system,
5406000	5412000	it led them to a stash of stolen property, 200 car break-ins, and a couple of burglaries.
5412000	5415000	They were very excited to recover all this.
5415000	5418000	They went to... Oh, I love when they give the address in the story.
5418000	5424000	It was 4064 Laconia Avenue in the Bronx is where all this stuff was hiding, apparently.
5424000	5430000	They got a search warrant. They traced through Microsoft and the ISP where this stolen Xbox was being played from,
5430000	5435000	and it led them to a GPS system, laptop computers, and all this stuff.
5435000	5443000	It looks like all this stuff was retrieved from 22-year-old Jeremiah Gilliam's bedroom.
5443000	5447000	To Jeremiah Gilliam, we say, uh-huh.
5447000	5449000	Next time, don't be stupid.
5449000	5455000	Stealing things is pretty stupid in the first place, but then when you go and play with the stolen goods on the internet,
5455000	5458000	that just makes you stupid or stupid.
5458000	5461000	But let's face it, you're pretty stupid when you're stealing shit in the first place.
5461000	5462000	That makes someone extra stupid.
5462000	5466000	He probably wouldn't think that they would be tracking the system,
5466000	5472000	and it's almost likely that they wouldn't know what the system serial number and that kind of stuff was,
5472000	5476000	but apparently they were able to track that via history and stuff like that.
5476000	5480000	Dedication to them for trying to get it back to the Xbox 360.
5480000	5486000	We got a link from DJ Rama S on Twitter. He's linking us to another local New York thing.
5486000	5489000	This is coming from Gizmodo, which is kind of interesting.
5489000	5493000	It has to do with the iPhone, which some would argue is pretty much a gaming device in this day and age.
5493000	5500000	Apparently, the iPhone is not purchasable on AT&T's website if you use a New York City zip code,
5500000	5506000	because according to a rep at, I guess, online, New York is not ready for the iPhone.
5506000	5510000	You've heard about all these types of complaints where in New York City they can't handle the iPhone bandwidth.
5510000	5515000	Calls are getting dropped left and right and all this crazy stuff, so yikes.
5515000	5523000	But their 3G is better. Their commercials say so. Am I to believe that Luke Wilson is lying to me?
5523000	5532000	I can't handle that. That's shocking that they would misrepresent themselves like that.
5532000	5538000	Just to point out, though, Gizmodo kind of continues to say that, hey, San Francisco also has a lot of problems,
5538000	5543000	and you can still get an iPhone in San Francisco, so why New York is being singled out, who knows.
5543000	5547000	I think it's probably just some type of weird, creepy bug.
5547000	5552000	I don't think AT&T is going to acknowledge that this has any weight to it whatsoever.
5552000	5555000	But apparently, also, Tigerclaw wants to add in our chat room.
5555000	5562000	You can still go into a phone and get a, or, sorry, still go into a phone, still go into a store and get the phone that way.
5562000	5565000	A little strange.
5565000	5569000	Anyhow, also going to some other news stories that were submitted.
5569000	5579000	Ray Ayanami sends us this link to Ketsuie, was announced for the Japanese Xbox 360s at what's called the Cave Festival.
5579000	5581000	So this is a shooting game.
5581000	5588000	Ketsuie Kizuna Jigoku Tachi Extra is coming out on the 360.
5588000	5596000	That'll cost you about $50, and it's another shmup that's coming to the Xbox 360, which has been getting a lot of those.
5596000	5601000	But you can see some screenshots online at this shmups.system11.org web forum,
5601000	5607000	where they actually show people playing at Akihabara at the Cave Festival this new game.
5607000	5610000	And there's even some footage on the internets, but there's a lot of background noise.
5610000	5612000	I don't want to play that for you right now.
5612000	5617000	A couple stories coming to us from Tigerclaw305, who is sending us some stories about, let's see,
5617000	5623000	Timegate has sued South Peak for royalties and breach of contract.
5623000	5627000	Apparently this is the folks who developed Section 8, Timegate Studios.
5627000	5630000	They have sued South Peak because of a breach of contract.
5630000	5639000	Apparently the publisher is withholding royalty payments and violates the deal with a PS3 porting deal with a Russian company.
5639000	5641000	My gosh.
5641000	5646000	Let's see, Timegate wants compensatory damages.
5646000	5651000	According to the report, South Peak says that because they got in 2008 Gamecock,
5651000	5656000	it exempts it from some of the specifics of the original agreement.
5656000	5660000	So yet more legal troubles.
5660000	5662000	It'll be settled out of court. They always are.
5662000	5666000	That's how those things go, yeah?
5666000	5668000	That's what'll happen.
5668000	5675000	Let's see, also what's also very interesting, the CEO of 3D Realms has teased a Duke Nukem resurgence.
5675000	5677000	Oh God, here we go again.
5677000	5681000	Apparently numerous Duke Nukem games are in various stages of development.
5681000	5684000	Gosh, does that include Duke Nukem Forever?
5684000	5690000	Funny that you should mention Duke Nukem because remember there was supposed to be the PSP and DS versions that were coming out in September.
5690000	5692000	Oh, but those have been delayed.
5692000	5693000	Just like Duke Nukem.
5693000	5700000	Now I want to point out the CEO of 3D Realms did go out of his way to point out Duke Nukem Forever was not technically cancelled.
5700000	5706000	Yes, we released the initial team, but that doesn't correlate to the demise of the project.
5706000	5707000	Great.
5707000	5712000	So this will be now what our third decade of Duke Nukem Forever rumors we're going to get into.
5712000	5715000	Goody goody.
5715000	5718000	Our good friend Marin Marvel has tweeted us and said,
5718000	5722000	What do you guys think about the Blizzard Authenticator?
5722000	5725000	I think it's a really good idea. I hate to say it.
5725000	5730000	I had my account hacked and I will never undo the Authenticator because of it.
5730000	5733000	Especially if you're an iPhone or iTouch user, it's free.
5733000	5739000	And to get a free pet out of it, and even if you don't have an iPhone or an iTouch, it's like $6.50 for the keychain.
5739000	5747000	Which, you know, considering they're also charging $10 for a pet, it's not a bad deal and it does keep your account relatively safe.
5747000	5754000	I think it's unfortunate that Blizzard won't do more against these gold spammers and things, but unfortunately what they're doing,
5754000	5762000	they're hacking a lot of American accounts and going into the games and rolling level one characters and doing all the shouts and so forth.
5762000	5763000	How well does the app work?
5763000	5764000	Huh?
5764000	5765000	How well does the app work?
5765000	5770000	Never had a problem with it. Pretty much all you do, you boot it up and it brings you up the code right away.
5770000	5772000	But is that one that you have to pay for?
5772000	5773000	No. It's a free app.
5773000	5774000	Well then I'll just download it right now.
5774000	5778000	Yeah, so I mean, honestly, if you have the iPhone or iTouch, there's no reason not to have it.
5778000	5784000	Except for, you know, if you're away from that device a lot, like especially if you're an iTouch user, you're not always with your iTouch.
5784000	5787000	But if you're with your iPhone, I mean, I have my phone with me pretty much everywhere I go.
5787000	5790000	So, I see no reason not to have it there.
5790000	5798000	But I just think it sucks that the burden is on me to prevent my account from getting hacked.
5798000	5804000	I do think some of the burden, I mean, I am, you know, you can point and laugh at me all you want for having my account hacked.
5804000	5806000	But I like to think I'm a pretty intelligent web user.
5806000	5809000	I know the basics about phishing and websites.
5809000	5813000	And I know, I do not to this day know how my account got hacked.
5813000	5817000	And it kind of freaks me out because I hope they didn't get my email or other things as well.
5817000	5820000	I just, I wish Blizzard would sue people.
5820000	5825000	I wish they would just start blocking IPs from maybe regions that are in America.
5825000	5827000	I mean, I hate to say it, but you know what?
5827000	5829000	There is WoW localized for other regions.
5829000	5834000	So, maybe it's time to start locking players out from certain regions.
5834000	5837000	I hate to say it, but if that's the way we're going to prevent.
5837000	5841000	But, you know, you can always IP spoof and all this other crazy stuff.
5841000	5844000	But I just wish the burden wasn't on us.
5844000	5847000	But hey, it's free.
5847000	5853000	Lastly, one more question from Jazajazz on Twitter.
5853000	5856000	Where do you think games are headed in the new year?
5856000	5860000	Digital distribution is going to be huge in the next decade.
5860000	5865000	I think a lot of these game stores are going to have to change their business model.
5865000	5867000	Or there's a lot to lose in the coming decade.
5867000	5870000	I think digital distribution is going to be huge in the upcoming next few years.
5870000	5872000	I think that's where games are headed, online.
5872000	5875000	Low-key Dark Soccer?
5875000	5878000	I agree. Honestly, we've been seeing it happen more and more.
5878000	5881000	Especially since Sony has been really adopting it.
5881000	5884000	Yeah, probably more digital distribution.
5884000	5886000	But I don't really think things are going to change too much.
5886000	5888000	They're probably going to try to push 3D.
5888000	5890000	Because that's the next big thing.
5890000	5895000	And now with the two...
5895000	5898000	I don't really see...
5898000	5900000	Truly next-gen consoles.
5900000	5903000	I found the Wii's kind of recycled hardware, if you ask me.
5903000	5908000	But now they're coming out with their 3D controllers.
5908000	5911000	So that's really going to be the pushes for 3D.
5911000	5916000	And you're going to see almost a new console generation being formed from this.
5916000	5921000	Yeah, I honestly would not expect to see all new consoles until 2013-14.
5921000	5923000	I mean, it's going to be a ways out.
5923000	5925000	Especially with these motion and stuff.
5925000	5926000	Except for Nintendo.
5926000	5927000	Unless...
5927000	5929000	I think Nintendo will have something very soon.
5929000	5932000	Unless this just flops and dies, you know.
5932000	5936000	And I think from Nintendo, I don't think we're going to see anything really new.
5936000	5940000	You know, it's probably just going to be an upgrade.
5940000	5944000	I want to point out some comments from our chat room on some of those tweets.
5944000	5947000	Misty wants to point out in our chat room, chat.orangelaunchreader.com
5947000	5948000	Fuck that, Rob.
5948000	5951000	I keep my eye touch with me all the damn time and in my pocket at work.
5951000	5954000	Because due to some shit that happened around work last year,
5954000	5956000	I'm paranoid about my eye touch getting jacked.
5956000	5957000	Well, that's unfortunate.
5957000	5960000	F you to those stupid people that caused you to be paranoid.
5960000	5963000	I get some people, yes, they do have their eye touch with them all the time.
5963000	5966000	But I also know some people that, you know, they only have it at home or at work.
5966000	5968000	You know, they don't really carry it with them everywhere.
5968000	5969000	So just...
5969000	5970000	You know what your habits are.
5970000	5974000	If you do have your eye touch with you all the time, then maybe the Blizzard thing is a good idea.
5974000	5976000	SSJ100matt kind of jokes.
5976000	5978000	I don't know if this is a joke or real.
5978000	5981000	But Blizzard banning IPs in Korea is an act of war, Rob.
5981000	5987000	I'm not saying ban Korea or whatever country you want to name from the games.
5987000	5994000	But if you have a game that has US servers that's meant to be played by the US that's localized for the US,
5994000	5996000	Korea gets their own version of the games.
5996000	5998000	WoW's been localized for China.
5998000	5999000	WoW's out another...
5999000	6001000	You know what I mean?
6001000	6009000	Unfortunately, if all the gold farming is coming from China, maybe it's time to put some restrictions down.
6009000	6014000	I think they also need to place some restrictions on, you know, who can do these shouts and chat and so forth.
6014000	6017000	Blizzard's done a really good job over the years, though.
6017000	6018000	I mean, let's face it.
6018000	6022000	Every time they evolve, the gold hackers and the gold farmers have to get a little smarter.
6022000	6026000	I don't want to make it sound like Blizzard's done nothing because they really have done a lot.
6026000	6030000	They've gotten smart about how they do trial accounts and a lot of the various aspects of WoW.
6030000	6036000	It just sucks that they just won't play hardball and start suing the pants off of some of these people that exploit their game.
6036000	6038000	You know what I mean?
6038000	6039000	I just want to see some...
6039000	6044000	I want to see heads roll over my account getting hacked.
6044000	6045000	All right.
6045000	6047000	That's going to do it for the Twitter topics for tonight.
6047000	6051000	Let's talk about some of the year-end news.
6051000	6058000	And we'll start off talking about some of our favorite games of the year and games you might call your game of the year.
6058000	6064000	In chat room, we're taking your submissions as well, and I'll try to keep an eye on the Twitter, too, for those of you that can't be in chat.
6064000	6067000	You know, what were some of your picks for the game of the year and why?
6067000	6073000	Usually, I find these game of the year picks to be a little silly because it's just one person's opinion.
6073000	6077000	So keep that in mind as we talk about our favorite games of the year.
6077000	6078000	We're just gamers.
6078000	6079000	We like what we like.
6079000	6085000	And this is our opinion for the game that you think was the most important game of 2009.
6085000	6086000	I'll start with Loki tonight.
6086000	6087000	What do you think, Loki?
6087000	6088000	What do you think were...
6088000	6090000	And if you have a couple, go ahead.
6090000	6093000	But what do you think overall was probably the biggest game of 2009?
6093000	6094000	Of 2009?
6094000	6097000	Well, probably Call of Duty Tomorrow Warfare 2 was, but I didn't play that game.
6097000	6104000	So the game I liked, or at least just if I was going to vote based on how much I played it, I'd say Grand Theft Auto.
6104000	6108000	Mainly the two expansions because that's what I was ending up playing.
6108000	6116000	And, you know, I think it's kind of neat because, you know, whereas before we wouldn't really see expansions for Grand Theft Auto.
6116000	6121000	We'd just see a couple other games kind of using the same engine, and still we may see that relatively soon.
6121000	6128000	But it was kind of neat to kind of expand upon the story and kind of bring different perspectives to it and whatnot.
