start	end	text
0	3000	Orange Lounge Radio
7000	12000	With your hosts, DarkSakura, Sky and Loco
14000	19000	Tonight, December 27th, 2009, Pac-Man might soon fight at Battle Royale.
19000	22000	Could your portable games soon be banned on airplanes?
22000	25000	We take a look back on the year and the decade in gaming.
25000	30000	Orange Lounge Radio
31000	36000	Hello everybody out there on the internet and welcome to another week of Orange Lounge Radio.
36000	43000	We are live with our 350th episode on this lovely Sunday evening, December 27th, 2009.
43000	45000	Yes, we're here for the holidays.
45000	49000	Broadcasting live every Sunday night, www.allgames.com
49000	54000	We're an All Games Radio affiliate and we're very thankful that they let us steal their bandwidth every Sunday night
54000	56000	to do our little program.
56000	62000	Joining you over the next few hours, myself, Rob Roberts, and of course the one and only, Jamie Summers, DarkSakura.
62000	64000	Stupid thread isn't working.
64000	67000	How are you doing? Are you posting on the internet? Is that the type of thread you're talking about?
67000	69000	No, I'm crocheting.
69000	70000	I see.
70000	73000	I'm being domestic, dammit. Who wants a hat?
73000	74000	Wow, that's a change.
74000	75000	Who wants a hat?
75000	76000	Me? No.
76000	78000	You'll get a very tiny hat.
78000	81000	Say hello to... I'll put it on my thumb.
81000	83000	Say hello to Tech Master, Loki.
83000	84000	Hello.
84000	85000	How you doing?
85000	86000	I'm alright.
86000	87000	Except we can't hear you at all. Is your mic on?
87000	88000	Yes, it is.
88000	90000	I don't know why we're not hearing you at all tonight.
90000	94000	That's the wonders of live radio, is that sometimes you get technical difficulties, things happen.
94000	96000	Sometimes people play with my volume, apparently.
96000	98000	Apparently. I don't know what's up with that.
98000	103000	I think what's going on is that behind our backs, DarkSakura's been secretly taping another show.
103000	105000	No! Not at all.
105000	107000	And he's been screwing with some of the audio settings.
107000	110000	I didn't touch Loki's. I mean, I don't know what you're talking about.
110000	112000	Try again, Loki. I think we'll hear you now.
112000	113000	Alright.
113000	114000	Now we hear you too much.
114000	115000	It's really loud.
115000	116000	We're good now.
116000	118000	How are you doing, Loki? How was your week?
118000	119000	I'm alright.
119000	120000	Did you have a good holiday?
120000	121000	Yeah, sure.
121000	124000	Did Santa bring you lots of good stuff for the holidays?
124000	128000	Pots and stuff to do yard work.
128000	130000	Dude, Santa brought you pot?
130000	132000	No, like pots and pans.
132000	133000	Oh, I see.
133000	136000	Just in time for New Year's, Rob.
136000	138000	Amazing.
138000	143000	Alright, let's go around and talk about our gaming week. So we always start off the show talking about what we've been playing this week.
143000	145000	DarkSakura, why don't you start us off?
145000	147000	Wow.
147000	148000	I played some.
148000	154000	And I downloaded Braid because it was really cheap for Insert Holiday Here.
154000	160000	And I also picked up World of Goo, which I started and then stopped.
160000	163000	Because I was like, oh wait, I have to do some stuff.
163000	166000	So I've got some new games that I just haven't played yet.
166000	171000	I also pre-ordered... I hate the word pre-order.
171000	176000	So I just ordered my copy in advance of Star Trek Online.
176000	185000	And apparently if you do the order through Amazon, or through I guess any of the others, you'll get like a thing to do the beta.
185000	186000	Nice.
186000	188000	So I'm going to be in the beta.
188000	190000	When's the beta start? I can't remember. There's so many like...
190000	192000	January something... something teeth.
192000	197000	It's like closed beta and open beta and retweet to get into the OMG Right Now betas.
197000	201000	Like there's so many betas going on. I feel like I'm in the 80s all over again.
201000	203000	And VHS is just around the corner.
203000	205000	It's January something teeth.
205000	207000	I see. Alright, thank you. That's so helpful.
207000	212000	But I also got Dan picked up for me.
212000	216000	Oh, by the way, it has to be the collector's edition.
216000	218000	Oh, for you to get in the beta?
218000	219000	To get in the beta.
219000	220000	I see, okay.
220000	221000	Which is what I got.
221000	223000	Which is what I imagine a lot of people are getting anyway.
223000	230000	And Dan picked up for me the Silent Hill game on Wii, so I need people to come over and hold my hand while I play it.
230000	234000	You know, I watched a friend play that game a couple days ago, and it was very strange.
234000	238000	Like I saw the nightmare sequence happen, you know, and it's weird.
238000	241000	It doesn't get all like rusty. It's just like snowy in that game.
241000	247000	And it was just running through doors over and over, running through doors, running through doors, running through doors, trying to avoid zombies.
247000	255000	I was like, you don't really run. I mean, you do run in Silent Hill, but this felt like an action game or something.
255000	258000	It was strange when I watched. I didn't play it, I watched.
258000	261000	It shatters your memories of Silent Hill. How about that?
261000	262000	Clearly.
262000	263000	Clearly.
263000	264000	You have a bug about to crawl into your hair behind you.
264000	265000	Just saying.
265000	268000	Gross! Gross! Our studio's infested!
268000	271000	It is not infested. Here's a tissue, you big baby.
271000	279000	There's bugs in our studio! Is that what you plan to end the decade with? Killer bugs, destroy the host?
279000	282000	Rob, it probably snuck into the window. Don't kill it, you big baby.
282000	286000	Hold on, I'm going to take a picture of it to show the listeners how big this scary bug is.
286000	287000	Oh, fuck.
287000	289000	Make sure to zoom in.
289000	292000	Anything else for your gaming week, DarkSakura?
292000	296000	I played the game where I laugh about Rob being a big baby.
296000	297000	Shut up, this is a big scary bug.
297000	302000	We also played some Marvel Ultimate Alliance 2, which was really good.
302000	307000	When I upload this to the feed, it's going to look like a big poop on your curtain.
307000	310000	Just kill it already, Rob. Is it a pincher?
310000	314000	I'm going to kill it. I don't know. If it pinches, I'm going to scream.
314000	317000	Here, give me the napkin. Hold my mic.
317000	320000	DarkSakura saves the day.
320000	323000	I should just let it do its thing.
323000	324000	Not even.
324000	325000	Don't.
325000	327000	It's a scary bug.
327000	329000	It's a pincher, it's fine.
329000	332000	But pinchers pinch. That's why they're called pinchers.
332000	335000	They're not called pinchers. They're called earwigs, I thought.
335000	339000	Now that our show has been sufficiently derailed for the decade, Loki, how was your gaming week?
339000	345000	It was alright. I didn't play a whole lot. I played more Grand Theft Auto this week, what level I could.
345000	346000	It went crunch.
346000	352000	And then I brought my 360 home hoping to play more stuff, but I just didn't because I ended up messing around with other things.
352000	358000	So I played a little big planet of the new Pirates of the Caribbean water stuff.
358000	365000	It's neat. Not as exciting as the paint-neater, but how can you top guns? You just can't.
365000	371000	So it's pretty cool, but I'm just not as excited.
371000	375000	And somewhere along the way, I downloaded some level creator pack or something like that.
375000	380000	They had a bunch of other stuff in there. I honestly don't remember doing that, but I guess I did at some point.
380000	382000	So that's kind of neat.
382000	388000	But I was going to play also Modination Racers, and granted I did all this like an hour before the show.
388000	393000	So I meant to play Modination Racers as well, because I'm in the beta for that.
393000	399000	However, since I haven't played a little big planet in forever, I had to download the updates, which took 15 minutes.
399000	401000	Oh geez, yeah, I can imagine.
401000	407000	You know what? Hey, props to them, because that means they have just been putting update after update after update on that game.
407000	409000	Tons of updates.
409000	416000	I think the last time I downloaded the update was update 1.05, and they're up to 1.23 now.
416000	418000	It's a bummer, though. It's not smart enough to just go,
418000	426000	Okay, I'm going to download the patch that takes you from 1.05 all the way up to, without having to download like five patches in between.
426000	427000	Something like that, yeah.
427000	430000	Sometimes PC games do that, especially like MMOs.
430000	433000	So then, like I said, I played the levels a little bit.
433000	439000	It's kind of neat. The water stuffs are, I mean, you can raise and lower the water. You have air that you can breathe in there.
439000	446000	You can suck up the bubbles much like you would in one of the other games out there that has the water stuff.
446000	447000	Sonic.
447000	449000	Sonic, yes. Perfect example.
449000	452000	And the Pirates of the Caribbean stuff is kind of neat.
452000	457000	The characters, obviously, they don't really have anything that looks too much like the stuff in the movie,
457000	465000	but the same typical plot. They have the two royal guards or whatever, the imperial guards or whoever they are,
465000	468000	from the movie are in there and that kind of thing.
468000	473000	I only got to play the first level, though, before I wanted to move on to other things.
473000	477000	Then I actually played a little bit on the arcade cabinet.
477000	487000	I had a friend over and we were testing out my newly souped up joysticks because I added octagonal restrictors in them now,
487000	491000	and also tighter springs.
491000	497000	So I did everything except take apart the actual pushbuttons to put a little paper in there and stuff.
497000	502000	Honestly, I just don't want to mess with that because I have a feeling it's going to fall apart after a while.
502000	503000	It's enough.
503000	508000	So I played Marvel vs. Capcom 1 and I'm not very good at it.
508000	513000	I like Marvel vs. Capcom 2, but I couldn't figure out why I didn't have it yet,
513000	516000	and it's because I don't have any Niomi games yet.
516000	521000	So that's why I basically spent most of the holiday doing was downloading Niomi games
521000	531000	and downloading Sega Model A games and zinc emulation games and all sorts of crap.
531000	539000	Oh, and CPS3 stuff, so I have Street Fighter 3 and JoJo's Bizarre Adventure and all that fun stuff.
539000	547000	So anyways, the actual game I did play, we played all the way through Simpsons the arcade game on MAME, so that was fun.
547000	549000	I love playing through there.
549000	554000	Nice. You know there's a Simpsons arcade on iPhone now, but it's not even the same thing.
554000	560000	It's just the same name, and I think it's definitely inspired by the old arcade game, but it's not the old arcade game.
560000	564000	And I think that's because this new one is EA, whereas the old one was Konami, right?
564000	566000	Because it was the same engine as Turtles.
566000	573000	So obviously they probably couldn't borrow the same code, but they did a game that feels very like it.
573000	576000	But instead of trying to save Maggie, I think it's Homer going after Donuts.
576000	578000	I don't know, I haven't played it. I've only read about it.
578000	583000	But I find it interesting that they are trying to cash in on that nostalgia a little bit in the very crowded iPhone market.
583000	585000	It was fun. I love playing the game.
585000	591000	I mean, we had a lot of fun playing it, so that was cool, and I'm trying to think of other stuff.
591000	596000	We were just trying a bunch of random games on there, but I still...
596000	598000	Ms. World Nude 96, my favorite MAME game ever.
598000	603000	Didn't play that, but the problem is, see right now, I'm going through my list of games I have on there.
603000	607000	Because there's a ton of games, first off, clones that I have on there that I need to get rid of.
607000	613000	And I got rid of them on one list, but I need to get rid of them on the list that's for my front end so that they don't display on there.
613000	618000	And then also, I have a whole bunch of Mahjong games and crap I'm not going to play.
618000	623000	So I have to go through and delete all that stuff or stuff that just doesn't work.
623000	631000	You know, delete the Simpsons Arcade 4 player version, because I only have a 2 player cabinet, so that's just completely useless.
631000	636000	So all that stuff. So I have to go through there and do that, because right now I'm trying to find something that's just...
636000	643000	Luckily I can skip via letter, but even still, it's just you're holding it down, scrolling through lists of stuff just to try to find anything.
643000	646000	You sound like me trying to organize my iTunes library.
646000	652000	A friend of mine inspired me to organize my iTunes a little better, and I've been trying to do that.
652000	660000	And it is a mess. Like, I have all these misspelled artists and albums and trying to get the right album art and things from compilations.
660000	665000	It's a pain in the ass. It sounds very similar, just what you're describing is going through that whole process.
665000	670000	Yeah. So it'll be nice when it's done, especially I'm really excited to try some of these new Niomi games.
670000	677000	Because a lot of them don't necessarily work, and you have one emulator for Niomi disc based games and Dreamcast games,
677000	682000	and you have another emulator for Niomi cartridge games, and some of those work and some of them don't.
682000	693000	So some of the ones that will work though, like Ikaruga, Marvel Vs. Capcom 2, there's some I haven't even heard of before.
693000	696000	Like a lot of these really crazy shooter games.
696000	709000	Then just some of the normal ones like Senkei no Rondo in Radio Allergy or Ratagy or whatever.
709000	713000	A lot of the cave shooters and stuff like that.
713000	715000	So that'll be kind of cool to put in there.
715000	725000	Especially now that I have the heavy springs on, the joysticks for really twitchy movements and stuff that'll really come in handy for shooters and stuff.
725000	729000	So yeah, lots of downloading stuff for the cabinet.
729000	732000	That's mainly what I've been doing during the break.
732000	738000	I still haven't played Borderlands. I was like, I'm gonna play Borderlands this break! I'm gonna do it!
738000	740000	I haven't done it yet.
740000	746000	And I even brought home Bayonetta. I was like, oh, I'm gonna play Bayonetta.
746000	755000	What was it? Otomedius Gorgeous, the Konami shooter that has chicks flying around. I was gonna play that.
755000	757000	Just didn't get around to it.
757000	760000	There's just too many games. You have too many games to play.
760000	765000	People sometimes forget. We do this podcasting thing as a hobby. We don't get paid to do it.
765000	769000	We're just gamers that do it for fun, just like many of you who listen to this show.
769000	773000	The folks that review these professionally, that do have the time to play every single game that comes out,
773000	779000	usually teams of several people, that's their jobs. That's what they do for eight hours a day is play video games.
779000	785000	Wish I could do that. But then again, keep in mind, those reviewers, they have to play eight hours of the bad games as well as the good games.
785000	793000	Well, one of my friends actually did some testing for a while. I was so sick of playing soccer.
793000	798000	Testing or reviewing. I mean, sometimes, you know, that's a discussion for a whole other show.
798000	800000	I wasn't even trying to get into strategy guides.
800000	802000	I remember that, yeah.
802000	810000	And they'll have you review. They'll just play through some of the most games. I still want to do that, though.
810000	814000	You should. It'd be fun. Anyhow, sorry, Loki. Anything else you want to say about your gaming week?
814000	825000	That's basically it. It's just lots of downloading stuff, and I'm sure none of that's legal because, you know, they're ROMs and whatever.
825000	832000	But you know what? I'm not going to go buy multi-thousand dollars worth of arcade boards.
832000	835000	Going to our chat room, the always present fourth guest on the show.
835000	840000	And if you are listening live to us on All Games Radio on this lovely Sunday evening, head on over to our chat room.
840000	843000	Chat.orangeloungeloungeradio.com is the easiest way to get there.
843000	849000	Or if you know your IRC, you just want to join the Game Surge Network on IRC gamesurge.net.
849000	854000	And we are in channel pound orange lounge is the name of our chat room.
854000	863000	Anyhow, reading some comments from chat, it went all the way back up here, talking about, I think Tiger Claw had said that it's appropriate.
863000	867000	Oh yes, what a way to start the last show of the new year or decade with a bug.
867000	874000	Going back to the bug. Because you know how sometimes, like, music will sometimes play when it's not supposed to here on the show.
874000	877000	Whoops, live radio! Shit.
877000	880000	It's the joys of live radio.
880000	887000	Also reading some comments from chat, Ray Iyanami in our chat room says, PS, get your asses to SVGL, Sunnyvale Golf Land.
887000	889000	There is a Simpsons machine here.
889000	893000	You know what's interesting? There is Simpsons machines kind of still out there all over.
893000	897000	I saw one randomly. I was at this hotel near Disneyland staying.
897000	899000	They had a game room in the hotel.
899000	904000	I haven't seen a game room in a hotel that wasn't a casino, like, since I was a teenager.
904000	906000	It's been a very long time.
906000	914000	One of the first times we went to Disneyland, there was a hotel that we stayed in that had a game room and I'd go down there.
914000	916000	I wonder if it was the same hotel.
916000	918000	Maybe, who knows. Was it near the convention center?
918000	920000	Well, the convention center wasn't built.
920000	922000	Oh yeah, that's right.
922000	929000	Anyhow, but the Simpsons arcade game, obviously a lot of people really remember this and it's still in arcades and probably still frickin' makes money.
929000	934000	But, you know, this machine at this particular hotel, their game room was in pretty sad shape.
934000	936000	Like, half the machines weren't working.
936000	942000	I think the Simpsons one was, but it was where the monitor was, like, so bright you could not...
942000	944000	Like, it's just faded over time.
944000	946000	But it hasn't faded dark. It's faded light.
946000	948000	I'm not sure what causes that. Maybe sun fading or something?
948000	950000	Even though it's in the dark room.
950000	955000	Well, probably what happened was it burned in and they just turned the brightness up.
955000	958000	Ah, I see. To try and avoid that. I get it.
958000	960000	My gaming week. Some of the things I played this week.
960000	962000	I did play a couple new games.
962000	965000	Obviously Steam is having an obscene sale right now.
965000	967000	As DarkSakura mentioned earlier, she picked up Braid.
967000	972000	I picked up Luminous because the basic and advanced pack were on sale a couple days ago for three bucks.
972000	977000	So I was like, eh, what the hell. I own Luminous on just about every other platform. I'll get it on PC as well.
977000	980000	So, you know, that was cool. It's the same game.
980000	986000	Certainly plays better than the iPhone one, although I still think the most underrated one is still the best one.
986000	988000	And that was Luminous 2 on the PSP.
988000	991000	I actually like the licensed music. Thank you very much.
991000	996000	And it's kind of a pity that it didn't catch on a little more or else maybe we could have had a Luminous 3, a real one,
996000	1002000	instead of just port after port after port of the same old game with some mediocre skins.
1002000	1005000	I mean, the skins that are in the game are okay. Nothing that special.
1005000	1010000	There's no shining. It's not even any Hollaback Girl, just so you know.
1010000	1012000	Other stuff I played this week.
1012000	1016000	Saw a demo for a game called Crayon Physics, which was also on Steam.
1016000	1019000	It was interesting. It was a very DS-inspired game
1019000	1024000	because you would basically have this little ball on your screen that, you know, you had to get the ball to the star.
1024000	1026000	And you did that by drawing ramps.
1026000	1033000	Or it was kind of interesting, like, you might have a little, like, a place where, like, a screw or a bolt is.
1033000	1036000	And so you draw a hammer or something around the screw.
1036000	1039000	And then it makes the hammer swing and, like, knock the ball.
1039000	1042000	Like it's croquet or something knocks the ball across the screen.
1042000	1047000	So kind of inventive, although it's kind of more the game I think I would imagine on the DS.
1047000	1051000	But certainly, you know, not everybody owns a DS, but a lot of people own a PC.
1051000	1054000	So this is a way for you to get into those kinds of games.
1054000	1056000	I felt the game was a little basic.
1056000	1059000	And the music was kind of crack.
1059000	1065000	Like, it was really, like, trippy, scary almost, how happy trippy it was.
1065000	1067000	It was a little bit frightening.
1067000	1069000	Best description ever. Happy trippy.
1069000	1070000	Happy trippy.
1070000	1074000	That's actually going to be 2DX 19th style or whatever they're up to now.
1074000	1076000	Happy trippy.
1076000	1081000	And DarkSakura holds up the thumb hat as she's talking there.
1081000	1085000	So happy trippy thumb hat, 2DX 19th style.
1085000	1087000	Let's see, what are the games I play this week?
1087000	1090000	Tekken 6 I checked out for a little bit.
1090000	1096000	I have to admit, my reaction to Tekken 6 after having spent a little time with it is,
1096000	1098000	lol what?
1098000	1103000	Like, that was honestly pretty much the reaction I had every few minutes we were playing Tekken 6.
1103000	1105000	Lol what?
1105000	1110000	Dude is wearing pink pants and shoots electricity out of his hands while he's standing in water.
1110000	1112000	Lol what?
1112000	1118000	There's a giant transformer guy who shoots laser beams into the floor that makes me fall through and I instantly lose.
1118000	1121000	Lol what?
1121000	1128000	The last boss looks like Zombie Big Bird 8, like, Ra from Stargate and is glowing blue.
1128000	1130000	Lol what is this game?
1130000	1132000	Did we have any Voldo?
1132000	1135000	Mr. Bondage Crotch?
1135000	1140000	There's 40 fucking characters in the game and, you know, Tekken has obviously been lol what for a little while.
1140000	1144000	It had the panda bears and the kangaroos.
1144000	1149000	Voldo was so caliber, but I know that they brought in, like, some of the really weirdo ones.
1149000	1151000	Well, of course, anything with Yoshimitsu in it is going to be...
1151000	1153000	The training dummy.
1153000	1155000	Did you play as Panda?
1155000	1159000	I didn't play as Panda. I played with my favorite tranny bitch, Anna Williams.
1159000	1163000	I'm telling you, in Tekken 6, she is one fierce transsexual.
1163000	1165000	Obviously, I mean, no disrespect.
1165000	1172000	She just looks like your stereotypical, like, wearing all the leopard stuff and the boots and all that.
1172000	1176000	Like, literally, one of her moves, you know how everybody has a throw?
1176000	1181000	One of her moves, she grabs the guy, slaps him three times in the face, and then throws him.
1181000	1182000	And then the other one...
1182000	1184000	She's always had that move.
1184000	1187000	She flips the guy over and, I swear to God, kicks him in the taint.
1187000	1189000	Like, get out of here!
1189000	1191000	Yeah, that's her.
1191000	1193000	Well, you know what?
1193000	1196000	I always thought that she was, like, an extra from Ab Fab.
1196000	1198000	You know?
1198000	1200000	Because we had to break out a cigarette and go,
1200000	1202000	I feel peckish.
1202000	1205000	And TigerClaws is saying about my Twitter earlier this week,
1205000	1208000	Oh, yeah, I read about your reaction. One of the characters is a tranny.
1208000	1212000	Not really. Just kind of has all those, like, stereotypes you would see.
1212000	1215000	I think, honestly, Anna Williams would actually best be described as,
1215000	1221000	if you ever saw the movie Angel from, like, 1981,
1221000	1225000	where she's a prostitute by night and an FBI agent by day,
1225000	1228000	that's the best way I could describe Anna Williams.
1228000	1231000	I know. Lul, what?
1231000	1234000	So that was pretty much my review of Tekken 6. Lul, what?
1234000	1238000	Although, I thought it was interesting that in certain parts of the game,
1238000	1242000	if you're playing offline mode, it kind of simulates an online mode.
1242000	1245000	You'll be playing against people with these fake gamer tags
1245000	1248000	that you're playing for promotions.
1248000	1252000	Like, I was watching my friend play, and he got into one of these battles,
1252000	1254000	and he was like, What the hell? I thought I was playing offline mode.
1254000	1256000	I don't want to fight people online.
1256000	1259000	You know, put the record at stake when you're not really, you know,
1259000	1262000	or just the fact that online players can sometimes be douchebags.
1262000	1264000	You don't really want to play with them.
