start	end	text
2337000	2341000	music game infused boost in a way and more fast-paced action.
2341000	2345000	It's kind of thought that maybe a sequel to that could be where this is going.
2345000	2347000	But if I seem to remember right,
2347000	2351000	the guy who originally made Pac-Man was involved with Championship Edition,
2351000	2354000	which might be part of the reason why it was so successful.
2354000	2359000	If he's not involved here, I'm a little worried, but who knows?
2359000	2363000	But could this be just, like, something very similar to that Pac-Man game that they had
2363000	2366000	that was originally supposed to come out on the GameCube and never did
2366000	2367000	or something like that?
2367000	2368000	Like the versus?
2368000	2369000	Yeah, like the versus.
2369000	2371000	It was out, but it was really hard to get, if I remember right,
2371000	2374000	because Dark Soccer was talking about playing it, I remember, years ago.
2374000	2376000	She was talking about, you remember Pac-Man versus?
2376000	2377000	Yeah.
2377000	2379000	Yeah, that was out, but it was kind of hard to find, wasn't it?
2379000	2381000	We had a bunch of copies of it.
2381000	2383000	I don't remember how, maybe a chatter remembers this better.
2383000	2385000	There was something you had to do to get it.
2385000	2386000	We had a stack of them and we're giving them out.
2386000	2388000	Yeah, but you had to get a copy of it somehow.
2388000	2391000	It was, you probably had that because of Game Store connections,
2391000	2393000	but there was a way you were supposed to get it.
2393000	2395000	I don't know if it was, like, a pre-order bonus or what.
2395000	2396000	I think it was.
2396000	2398000	I think it was too.
2398000	2402000	So, anyhow, who knows what this game could be all about,
2402000	2404000	but of course when I hear Pac-Man Battle Royale,
2404000	2408000	I don't know about you guys, but I think about the old Japanese movie
2408000	2411000	where they might strand Pac-Man on a desert island with his peers
2411000	2414000	and give him only a fan to survive.
2414000	2416000	Paper plate.
2416000	2419000	That would be pretty amazing if that was actually the case,
2419000	2420000	but I somehow doubt that.
2420000	2422000	Hey, I've won Paper Plate Battle Royale.
2422000	2425000	I just can't see an M-rated Pac-Man game for the life of me.
2425000	2426000	No.
2426000	2427000	Although it would be funny.
2427000	2431000	Well, how about something that is a little bit more on the mature level,
2431000	2433000	even if it's not M-rated?
2433000	2437000	My single favorite Castlevania game ever,
2437000	2440000	Dracula X Rondo of Blood,
2440000	2442000	is coming to Virtual Console.
2442000	2444000	It's about damn time.
2444000	2446000	But, um, guess where?
2446000	2447000	Hmm.
2447000	2448000	Australia.
2448000	2450000	Hence my comment before the show.
2450000	2455000	Well, which only they heard if you're live tonight, but that's alright.
2455000	2460000	Which is very interesting because Australia has been getting a lot of bad news lately
2460000	2463000	as far as video games go, so this is kind of interesting.
2463000	2470000	Well, the OLFC actually has a rating up for,
2470000	2477000	as is titled Castlevania Rondo of Blood for Virtual Console release.
2477000	2481000	I hope that we get it over here, but I don't know.
2481000	2483000	It's such a fun game.
2483000	2487000	I mean, I hate having to break out the PC Engine every time I want to play it,
2487000	2490000	or try to find the PSP version.
2490000	2493000	Honestly, I still prefer the PC Engine version over the PSP.
2493000	2495000	If this game were to come out on Virtual Console,
2495000	2498000	wouldn't it be the first PC Engine CD game to do so?
2498000	2501000	Didn't we get, um, Ys?
2501000	2502000	No.
2502000	2506000	I'm sorry, I've got Ys Book 1 and 2 on CD.
2506000	2510000	I can't remember. There's so many games on Virtual Console now.
2510000	2512000	I'd have to look at the list.
2512000	2514000	I think Ys has been revived on the DS.
2514000	2516000	I know there's been some newer games there, or PSP,
2516000	2519000	but I don't think the originals ever came to Virtual Console.
2519000	2521000	I could be wrong. Somebody in chat might correct us.
2521000	2522000	We'll have to check.
2522000	2523000	I don't think the originals ever did.
2523000	2526000	Chatters do our dirty work for us. Go check.
2526000	2528000	Well, we're trying to talk about the news here.
2528000	2530000	But the other thing I want to point out, I mean, honestly,
2530000	2533000	if it's coming to Australia and the technology is there
2533000	2535000	and the game is going to be ported to work,
2535000	2538000	don't you think it's going to come out here before too long?
2538000	2540000	I mean, isn't that just kind of a given?
2540000	2541000	The economy still loves us.
2541000	2544000	Very rarely do these games come out in one country
2544000	2546000	and then never come out in another. You know what I mean?
2546000	2548000	Why Australia first?
2548000	2551000	Well, it could just be that maybe that's where the news has leaked.
2551000	2552000	Maybe it's really planned for everywhere,
2552000	2554000	but the news has just happened to leak for Australia.
2554000	2558000	Possibly. Maybe they had to put in their request for rating,
2558000	2559000	like some earlier date.
2559000	2562000	Right, and these ratings requests are how game announcements
2562000	2563000	leak all the freaking time.
2563000	2567000	They've tried to take measures to stop that here with the ESRB in the States,
2567000	2570000	but that doesn't change Australia, Europe, and some of the other countries
2570000	2575000	where we get our titles spoiled from.
2575000	2578000	Well, you know, I'll have that in an instant.
2578000	2580000	I know. I will actually check that out too.
2580000	2582000	It would be finally a way I can actually play this game
2582000	2585000	because I didn't collect all these systems that Dark Sakura did.
2585000	2586000	I told you to come up and play it.
2586000	2588000	I know, but it would be nice to have it in my own house.
2588000	2590000	I mean, not that I don't enjoy spending time with Dark Sakura,
2590000	2592000	but it would be nice to fire it up whenever I want.
2592000	2594000	If I want to play at 2 a.m., I don't have to call you.
2594000	2596000	Wednesday.
2596000	2599000	I don't know yet. I might actually have that day off work,
2599000	2601000	so I'll let you know. Super.
2601000	2602000	The end.
2602000	2604000	Yeah.
2604000	2609000	So Namco, they've got a lot of great games out there,
2609000	2611000	and some of those you may have missed.
2611000	2613000	And some crappy ones too, just for the record.
2613000	2616000	Some crappy ones you may have missed and may not want to play.
2616000	2618000	Would you really miss them if they're crappy?
2618000	2620000	You may not know that you've missed them.
2620000	2622000	You may just want to collect the achievements and or trophies.
2622000	2623000	Exactly.
2623000	2626000	Well, you may get your chance to do that again,
2626000	2630000	because now they're going to actually be launching their back catalog
2630000	2632000	via digital distribution.
2632000	2634000	And this is going to be happening on a few different fronts.
2634000	2636000	Of course, the Xbox 360.
2636000	2641000	They're going to be putting up me and my beautiful Katamari
2641000	2643000	sometime in the first quarter of 2010.
2643000	2645000	And then on the PlayStation Portable,
2645000	2648000	me and my Katamari on December 22nd.
2648000	2651000	So it's already out there if you want to snag that.
2651000	2654000	And of course, you know, that being said,
2654000	2659000	they're also planning on putting out other PlayStation 1 and PSP
2659000	2662000	catalog titles as well on the PlayStation Network.
2662000	2668000	And there are also maybe other titles coming to the Xbox 360 as well,
2668000	2672000	but they haven't really named names yet.
2672000	2673000	So that's kind of neat though.
2673000	2676000	More Katamari or more of the old Katamari.
2676000	2678000	Yeah, but that was like the worst Katamari game in the series.
2678000	2681000	Both of those ones you named were like the low points in the series.
2681000	2683000	Personally, I did not enjoy Beautiful Katamari.
2683000	2690000	I have friends that say I'm totally not being fair to that game and so forth.
2690000	2693000	And maybe they think there's a grudge because of the history our show has
2693000	2695000	with that particular title.
2695000	2698000	But no, I think really you put that side by side with Katamari forever
2698000	2701000	on the PS3, and it just ain't no contest.
2701000	2702000	The PS3 one's better.
2702000	2705000	Even though the PS3 one is a rehash of some of the old stuff,
2705000	2707000	I still say the PS3 one's better.
2707000	2709000	And just wait for the PS3 one to drop down in price,
2709000	2711000	because it will pretty quick.
2711000	2714000	Because it will kind of fade off pretty fast.
2714000	2719000	And you probably will be able to pick up in the new Katamari game
2719000	2722000	for 20 bucks or something.
2722000	2726000	And that's about what you're going to pay for these re-releases.
2726000	2729000	So just be patient.
2729000	2734000	Very interesting how digital distribution is kind of best known for this year.
2734000	2737000	Breathing new life into games that had slipped off the radar,
2737000	2739000	which is exactly what Namco is doing here.
2739000	2743000	But I compare this to, you know how Steam is doing their epic sale right now,
2743000	2748000	where I swear they undercut this shit down to cost just to get people in the door.
2748000	2750000	They might even be taking losses on it.
2750000	2752000	I don't know what they're doing,
2752000	2755000	but they're just trying to get as many Steam subscribers as they can.
2755000	2761000	But some of the games they're selling would have fallen off the radar a long time ago.
2761000	2766000	For example, I think they were selling the LucasArts pack for like 3 bucks,
2766000	2768000	which was the Indiana Jones games,
2768000	2771000	and Loom and all that was on sale for 3 bucks the other day.
2771000	2774000	Well, you know, yeah that might be a steal,
2774000	2777000	but at the same time for the publisher and all the sales people involved,
2777000	2780000	that's 3 bucks they probably weren't going to get,
2780000	2784000	because these games are so freaking old, who buys them anymore?
2784000	2787000	But digital distribution kind of opens it all up.
2787000	2790000	Very interesting.
2790000	2795000	Anyhow, moving on to another story and talking about digital distribution of sorts.
2795000	2801000	There is a new just launched music game store inside the Xbox Live marketplace.
2801000	2805000	This just went live I believe on the 22nd, so it was a little bit earlier this week,
2805000	2809000	but now there is a music game store within Xbox Live.
2809000	2812000	You actually can look at individual stores for Guitar Hero 5,
2812000	2816000	Guitar Hero World Tour, Band Hero, Lips, Lips No. 1 Hits,
2816000	2820000	Lego Rock Band, Beatles Rock Band, whatever rock band there is.
2820000	2824000	They all have these special front end stores where you can actually sample music tracks
2824000	2826000	and download the songs.
2826000	2828000	You might be thinking, well I can already do that in the game.
2828000	2832000	Yeah, you can, but now you can also do it through the Xbox 360 interface,
2832000	2836000	which is kind of cool that you don't have to go find the disc to put it in the drive
2836000	2838000	to sample the latest releases,
2838000	2841000	because sometimes we might be rattling off the releases here on the show,
2841000	2843000	or you read about them on the internet somewhere and you're like,
2843000	2846000	I think I remember that song and I think I remember liking it,
2846000	2847000	but I don't remember what it sounds like.
2847000	2851000	Now you can just go onto your Xbox and look at the little 30 second sample.
2851000	2854000	Interesting how music and the Xbox 360 have been fusing together
2854000	2858000	a little more and more this year, not just with this, but last FM.
2858000	2861000	If you remember from E3 though, a couple years ago,
2861000	2865000	they said that that was one of the things that they wanted to do to begin with,
2865000	2871000	was offer the multimedia interaction with the games.
2871000	2874000	So there you go.
2874000	2877000	Yeah, so I have not checked out that storefront myself,
2877000	2881000	but I'm looking at some of the screenshots and it's nice that every game
2881000	2884000	kind of gets its own little look and logo and so forth,
2884000	2887000	but where's Rock Revolution?
2887000	2889000	Just kidding. I don't care.
2889000	2891000	Where's the dedicated store?
2891000	2894000	Oh yeah, in the clearance bin. That's where it is.
2894000	2896000	$4.99.
2896000	2899000	Xbox Live should have its own little clearance bin of sorts.
2899000	2902000	Here's our dumpster, I mean, clearance bin.
2902000	2905000	It kind of looks like Borderlands. It's like just this wasteland.
2905000	2907000	I've got a great idea for Microsoft.
2907000	2909000	You can do something similar to that with Project Natal,
2909000	2914000	where you actually dig through the clearance bin with your hands,
2914000	2917000	making different gestures using the Natal camera,
2917000	2922000	so you can find the Rock Revolution in there for $4.99.
2922000	2923000	Nice.
2923000	2926000	Yeah, no one would ever get it.
2926000	2929000	Let's talk about some news about a game no one cares about.
2929000	2930000	Okay, what would that be?
2930000	2934000	Champions Online!
2934000	2940000	Actually, there is going to be a new update and an iPhone app
2940000	2944000	and a recruitment initiative.
2944000	2946000	Please play our game.
2946000	2947000	I know, right?
2947000	2950000	There is Champions Companion for the iPhone,
2950000	2955000	which you can use to review your character and see your online status,
2955000	2960000	check your friends list, your mail, read news, it's free.
2960000	2962000	There's also a referral program to where you can invite a friend
2962000	2964000	to play free for 10 days,
2964000	2969000	and you will get a rare in-game action figure, boo,
2969000	2971000	and have some combat buffs.
2971000	2973000	Ooh!
2973000	2979000	And you also get another costume slot and 400 cryptic points,
2979000	2982000	so I guess that's kind of okay.
2982000	2987000	And then they did an Attack of the Misfit Toys event over the weekend
2987000	2993000	with new costume pieces, action figures, perks, that type of stuff.
2993000	2994000	Please come play our game.
2994000	2995000	I know, right?
2995000	2998000	We need people.
2998000	3001000	I think we had a story just like this a couple weeks ago,
3001000	3003000	but it was Age of Conan.
3003000	3005000	Very similar type of thing.
3005000	3007000	They're practically giving the game away to get people to play it.
3007000	3009000	They already know where it's going to come in,
3009000	3013000	and that's going to be with Star Trek.
3013000	3015000	That's what I'm holding out for.
3015000	3017000	Ironically enough, isn't that what got a lot of people to sign up
3017000	3019000	for Champions Online in the first place,
3019000	3022000	was guaranteed access to Star Trek Online's beta or something like that?
3022000	3025000	I remember if you got an Uber subscription to Champions,
3025000	3028000	you could play Star Trek Online early or something.
3028000	3030000	You know what, that wins the whatever award.
3030000	3031000	That should have been a warning sign right there.
3031000	3034000	Because I'm already getting a beta.
3034000	3037000	Our chat room's actually lighting up with comments on the last story
3037000	3039000	because we're a little bit behind.
3039000	3041000	It takes time for what we say to encode
3041000	3043000	and you guys to hear it through the All Games feed and so forth.
3043000	3045000	They're still talking about Rock Revolution a little bit
3045000	3047000	because I was giving it a little shit in chat earlier.
3047000	3048000	Rama in chat says,
3048000	3052000	Sorry, Rock Revolution was well worth the $5 I paid for it.
3052000	3054000	Brad from Pod Culture asks,
3054000	3057000	What sucked more, Rock Revolution or Yaris?
3057000	3059000	To be fair, Yaris probably sucked more.
3059000	3065000	Yaris, but for your suck to money value...
3065000	3066000	Yaris is free.
3066000	3068000	But here's the thing though about Yaris.
3068000	3073000	Yaris led way for a whole bunch of piracy on Xbox Live Arcade.
3073000	3074000	So thank you, Yaris.
3074000	3075000	I will say this too.
3075000	3078000	Rock Revolution was actually way better than Beaten Groovy,
3078000	3082000	which you would also pay, I think, $10 for on Xbox Live Marketplace.
3082000	3084000	That game was disgusting.
3084000	3086000	It was insultingly bad.
3086000	3089000	Whoever allowed that piece of shit to go on Xbox Live Marketplace
3089000	3091000	should be ashamed of themselves
3091000	3093000	and should consider possibly retiring from the industry.
3093000	3094000	It was terrible.
3094000	3099000	It's not that difficult to make a successful music game, Konami.
3099000	3100000	I mean, you've done it in the past.
3100000	3102000	You just kind of have to copy what you did.
3102000	3104000	But somehow you just fuck it up.
3104000	3105000	And I don't know how you do that.
3105000	3106000	It's like,
3106000	3108000	Ah, they won't get it over in America.
3108000	3110000	Let's make it all ghetto looking.
3110000	3111000	Yeah, that's awesome.
3111000	3115000	Way to shit on your fans.
3115000	3118000	And trust me, we're not into that over here.
3118000	3119000	That's other countries.
3119000	3120000	Yep.
3120000	3124000	Alright, we're going to travel around the world and look at some release dates.
3124000	3126000	Hopefully some good things coming out soon.
3126000	3129000	Although, then again, it's that time of year where probably there ain't shit coming out.
3129000	3131000	I don't know, Loki. Is that the story here?
3131000	3133000	I'm pretty sure that's correct.
3133000	3135000	There is nothing coming out.
3135000	3139000	And at least last I checked, there was nothing coming out.
3139000	3142000	And if there is anything coming out this week, it's probably crap.
3142000	3146000	But, I mean, I guess if you count Final Fantasy Crystal Chronicles,
3146000	3148000	the Crystal Bears came out today.
3148000	3151000	So that's something, I guess.
3151000	3159000	And supposedly this week, Divinity II Ego Draconis is supposed to be coming out on PC and Xbox 360.
3159000	3162000	I thought that was supposed to be next week, but hey.
3162000	3165000	I could be wrong because they move that stuff around all the time.
3165000	3169000	And also possibly Learn Chess and Learn Geography on the DS from Dreamcatcher,
3169000	3172000	which are probably something you can skip.
3172000	3177000	And then finally, Dreamer Zookeeper on the DS, also from Dreamcatcher.
3177000	3180000	And World Party Games coming to you on the Wii.
3180000	3183000	Yes, it's yet another party game collection.
3183000	3188000	And that's basically it, although don't be surprised if all those move to next week.
3188000	3190000	Really, it's the same story in Japan.
3190000	3192000	Literally not a damn thing coming out.
3192000	3194000	It's very quiet over there right now.
3194000	3199000	A price reduction on Tactics A2 on the DS is about all you got going for you.
3199000	3203000	And honestly, there's really not a lot to look forward to until January 9th
3203000	3206000	when Kingdom Hearts Birth by Sleep hits the Sony PSP.
3206000	3209000	That's probably the next big, big release over in Japan.
3209000	3212000	Yeah, I didn't find a damn thing for Europe, sorry.
3212000	3215000	It's just that time of year, folks, but we talk about them every week.
3215000	3219000	So this is a good week to go back and play the games you missed this year in 2009, yes?
3219000	3220000	Pretty much.
3220000	3221000	Pretty much.
3221000	3222000	Pretty much.
3222000	3223000	All right, so back to some news then.
3223000	3227000	Yes, so soon, and I'm not sure if this is actually going to happen
3227000	3231000	because I could think a lot of other people would be pissed off for other reasons.
3231000	3236000	But pretty soon, you may not be able to play your PSP or DS on airplanes.
3236000	3245000	Apparently, somebody is trying to consider a ban on all electronic devices aboard planes.
3245000	3253000	And apparently, the US Transport Security Administration is the one kind of doing that.
3253000	3261000	Apparently, there is a guy, Omar, I'm not even going to try to pronounce his name anyways,
3261000	3266000	the guy was arrested after failing to ignite an explosive device on Christmas Day on a plane.
3266000	3268000	Oh God, I heard about that on CNN.
3268000	3270000	So that had to do with electronic devices?
3270000	3274000	Yes, apparently, let's see.
3274000	3277000	One motherfucker always ruins it for everybody else.
3277000	3281000	You know how you can't take in water over a certain size
3281000	3285000	and your shampoo has to be in a clear bottle and in a plastic bag.
3285000	3288000	I'm not mad, I understand that they're doing it for our safety and what have you,
3288000	3292000	but it's because some asshole threatened to use it as a bomb
3292000	3296000	and said that you could use water as a...
3296000	3298000	It's just frustrating.
3298000	3307000	Apparently, it doesn't really say if it was an explosive looking like a device or something like that.
3307000	3310000	They probably don't want to tell you how he did it.
3310000	3313000	Good old fashioned American paranoia has been increased tenfold.
3313000	3318000	Following the incident, international flight passengers weren't allowed any personal items on their laps
3318000	3320000	an hour before the flight.
3320000	3326000	Full bag searches were instigated at the boarding gates and the ban on electronic devices has said,
3326000	3331000	to be a reaction to his ability to smuggle an explosive onto the plane.
3331000	3343000	This would of course mean any DS or PSP would be banned as well as anything from electronic books,
3343000	3346000	iPods, cell phones, other gaming devices, etc.
3346000	3348000	That's going to make flights so incredibly boring.
3348000	3351000	It's not going to fly.
3351000	3353000	Pun intended.
3353000	3360000	Honestly, I'm surprised he was able to do that because they scan all that stuff through...
3360000	3362000	Well, he was on an international flight.
3362000	3364000	He didn't get screened at a US airport.
3364000	3366000	He got screened at a Dutch airport.
3366000	3369000	I don't know what they do over there that's different than what they do over here,
3369000	3371000	but he didn't get in in the US.
3371000	3372000	You have a bomb.
3372000	3373000	No.
3373000	3376000	Okay, you may go.
3376000	3381000	You know, I really don't see them banning all electronics on planes.
3381000	3383000	I think that's a bit much.
3383000	3385000	And it's going to suck because I know a lot of airlines are looking into,
3385000	3387000	like I think Virgin Air or one of them,
3387000	3392000	if they're not already doing it was looking into like free Wi-Fi on flights now.
3392000	3396000	Like that's what the technology has gotten is you can get on the internet on flights,
3396000	3397000	which is pretty amazing.
3397000	3399000	And it would really suck to kind of rip that all away.
3399000	3404000	But at the end of the day, if there is a true threat, I suppose for lack of a better term,
3404000	3407000	to, you know, electronic devices on planes,
3407000	3411000	something that they can't screen for at the airport for God knows whatever reason.
3411000	3412000	Here's something.
3412000	3413000	A safety first.
3413000	3414000	Here's something to...
3414000	3416000	People didn't have laptops 20 years ago, 30 years ago.
3416000	3418000	Flights will still work, you know.
3418000	3424000	Well, what if some dude was to create an EMP bomb using electronic devices?
3424000	3427000	Can't detect that because it's not an explosive.
3427000	3428000	The plane would go down.
3428000	3429000	Exactly.
3429000	3430000	But that's the point.
3430000	3433000	They want it to explode or, you know, something.
3433000	3435000	Someone's probably thought of that.
3435000	3436000	They have something.
3436000	3439000	They don't advertise all their countermeasures.
3439000	3441000	I mean, for obvious reasons.
3441000	3446000	First of all, if anyone was going to actually be able to project an EMP
3446000	3450000	that would make a plane go down, it'd be a bigger device.
3450000	3453000	It wouldn't be something that could be hidden that easily.
3453000	3454000	I don't know.
3454000	3456000	I'm just playing devil's advocate.
3456000	3457000	No, I know.
3457000	3458000	It's just...
3458000	3461000	Although that really would be about the only thing I could think of.
3461000	3463000	SSJ-100 Matt wants to add.
3463000	3467000	Rob, he hid firecrackers in his crotch.
3467000	3471000	The Dutch screeners scanned him, but they wouldn't have found them unless they patted him down.
3471000	3472000	That seems so odd to me.
3472000	3474000	How a fucking firecracker gonna...
3474000	3477000	How many did he have in his crotch?
3477000	3481000	Maybe it was one of those things where, you know, it only takes a spark to ignite
3481000	3483000	if you have something flammable.
3483000	3484000	I don't know.
3484000	3488000	Obviously they're not telling you the details on what he was planning to do for obvious reasons,
3488000	3494000	but I still find it shocking that he was able to hide firecrackers undetected.
3494000	3497000	You know.
3497000	3500000	It sucks.
3500000	3501000	I don't know what else to say.
