start	end	text
14164	25632	Tonight, November 5th, 2006, more details on Wii's Virtual Console, movie news for Halo, Castlevania, and yes, Street Fighter, and are HD movies coming to the Xbox Marketplace?
27813	37720	Orange Lounge Radio Hello everybody out there on the internet and welcome to another episode of Orange Lounge Radio.
37760	42343	We are that internet radio program dedicated to all things video games and video gaming related.
42927	44547	Gaming Culture, Gaming Lifestyle, etc.
68832	70633	Actually, you redid the hair, though.
70653	71553	I like this new hairstyle.
71653	73154	Yeah, my hair is pretty now.
73374	77616	We need the new promo pics for OLR, because you have way different hair now, and I've got the facial hair.
78196	84279	The old picture is when I had fuchsia hair, when it was that bright pink and very, very curly.
84299	87721	And now I straightened my hair, and it's cherry red and black.
88361	90802	So I'll tell you what, chat room.
90842	94904	I'll put up the picture that I took with my smell phone earlier.
95624	97085	And hooray for being vulgar and offensive.
97405	97665	All right.
98347	99048	VULGAR AND OFFENSIVE
120939	128265	So remind the listeners, for those that are listening to Orange Launch Radio for the first time, because we get a lot of new listeners every week, especially thanks to XBStream.
128585	133609	We show up on these random Xbox 360s of people who download the program, and through iTunes we're always getting new people.
133869	137232	Remind folks what it is you do for a living and how you get some interesting insight because of it.
137692	143716	I work at a video distributor and a video game distributor, so we have a lot of contact with...
145094	174590	Big publishing companies out there like Microsoft and whatnot So yeah, every now and then we do this annual sales conferencing with the game publishers And they bring us free stuff Not so much this year though, they didn't bring us as much free stuff Poor baby Yeah, I did get a free shirt from Eidos, so for just cause And Nelly says this is a Russian propaganda shirt Or like a communist propaganda shirt, that's what it looks like
175134	176035	It's an interesting shirt.
176095	180518	I don't know why, but the look of it reminds me of those Che Guevara posters that you see.
181619	181919	I don't know.
182039	182640	Maybe it's just me.
182720	183140	I'm just crazy.
185396	187857	In all seriousness, we have no guest right now.
187917	194241	I think Miklatov's going to come in for part B. He's out eating food with some of the non-show people that hang out here at the apartment.
194981	197343	But we do have our chat room over at OrangeLoungeRadio.com.
197363	198063	Click on chat.
198103	202906	Always filled with lots of exciting people who apparently were cheering on the vulgar and offensive.
202946	205287	I see DMN was saying, yay, vulgar and offensive.
205347	207108	So, you know, they love it.
207248	211591	Just to let the chat room know, I am sending that picture to myself now via my email.
212391	213852	And so you will see it in a few.
214613	214833	All right.
214853	215173	Sounds good.
216140	224165	Anyway, by the way, the reason why I had Loki kind of tell what he does is because we have some interesting juicy tidbits tonight, some real good stuff.
224565	227347	But before we get to that, we have to talk about our gaming weeks.
227367	227847	We always do.
227927	229288	DarkSakura, how was your gaming week?
230649	233150	My gaming week, I didn't actually play anything.
233290	237973	I tried to play a little bit more PSU, but kind of got sidetracked.
238533	240054	I did get new games today.
242656	243136	I got...
245919	246859	What was the name of that game again?
248660	251860	No, it was... I can't believe I can't... I forgot the name of it already.
252280	254361	Oh yeah, Trauma Sensor Under the Knife.
255721	259582	So that I can, you know, cut into people and be the uber surgeon.
260942	272624	And I also, thanks to my dear, dear, dear, dear friend who I hope is listening, have the Final Fantasy XII special pack with the collector art book.
275842	276423	DarkSakura, DarkSakura,
303070	309794	So I get back and, you know, because she picked up my trauma center at the time, which I need to sort of pay her back for.
310555	314837	But she hands me the bag, and it's heavy.
315638	316278	And I'm like, what?
316859	317999	And then she starts running out the door.
318019	318740	I'm like, oh, my God.
319040	321642	So I chased her down and tackled her in the hall and gave her a big hug.
322042	322322	Hot.
323483	324463	Okay, whatever.
325404	329747	And then don't let me forget during the FUs, I have to tell the story of the Jehovah's Witness I own today.
330167	331948	Oh, it's very nice, though, of, you know,
332574	333474	That was very nice of her.
333494	334655	She's a very sweet friend.
334675	334915	She is.
335055	335635	She's very good.
335895	337535	If I could, I would do all the same for her.
337635	339336	So I'm making her a special Christmas present.
339536	339816	Right on.
340496	341716	I'm making it with finger paints.
343237	344157	How four years old of you.
344177	344777	Yeah.
344837	345898	Loki, how was your gaming week?
347598	348238	It was okay.
349599	351899	I finally got that to work.
352319	356921	Anyways, I tried playing as much as possible, but that did not happen.
357381	362062	So what I did play was Saints Row, which is pretty usual for the week.
363314	392121	and then of course I played this new game called Grand Theft Auto Vice City Stories I gotta tell ya, I've read a lot of reviews on this and none of them have covered multiplayer very well and because I play multiplayer on a consistent basis and I know everything there is to know possibly about Grand Theft Auto for the PSP I'm gonna tell you how the multiplayer is and why they did a lot of things badly for one
392938	403180	Anyone that's played Grand Theft Auto Vice City or Vice City Stories will know that the island that you start off on in Vice City is huge.
403440	408222	It is a lot bigger than the three islands combined in Liberty City.
409702	415123	Okay, that in mind, the multiplayer I was really surprised because they had six different maps to choose from.
415523	417024	Or at least that's what I thought that meant.
417644	422445	But apparently it's six different sets of spawn points
423519	424380	on the same map.
424640	437349	So no matter what you pick, you're on the full-size map, which sucks because when you're playing with six players or whatever, you may spawn on the other side of the goddamn island and it takes you like two to three minutes to get to the other side of the island.
438991	441432	Why the fuck they chose to do that is retarded.
441573	448097	I don't understand why they went ahead and decided, okay, it's a great idea to go ahead and let everyone run around the full map.
449058	450099	Okay, that sucks right there.
450660	451660	DarkSakura, DarkSakura, DarkSakura
473687	474388	DarkSakura, DarkSakura,
494827	495888	DarkSakura, DarkSakura, DarkSakura
522899	532224	But anyways, so you can't turn the power-ups off, but that doesn't really matter anyways, because they spawn about 50 miles away, so you'll never get to the power-up anyways.
533064	542729	Some of the new game modes, though, like with the Hunter, are actually pretty fun, except the Hunter controls are crap, but I don't know, it's still kind of fun to fly around in the helicopter.
543549	545290	But multiplayer is pretty good overall.
545390	550173	If they had only made the maps a little bit smaller, hopefully when we get to the next island, it'll be a lot better.
550653	552394	But right now, you know...
553456	556257	They don't really spend that much time working on the multiplayer, I'm afraid.
556417	560219	And all these reviews that have reviewed the multiplayer did not cover any of this stuff.
560279	561260	So, whatever.
562380	563501	Some comments from our chat room.
563581	564922	Zappy seems to agree with you.
565202	566462	Bleh, Vice City is meh.
566622	567663	Same old GTA.
568103	570384	Whereas SSJ100Matt seems to disagree with you.
570464	573286	I actually think having the full map and multiplayer makes it a lot more fun.
573666	573846	No.
574066	577908	If you want to join our chat, by the way, chat.orangelaunchradio.com Trust me, I play multiplayer every single day.
577928	582070	It does not make it more fun because you have to... Say, for example, you're playing a 13-minute game.
583208	586431	You have to spend a lot of time getting to where the other people are.
587231	591554	They also retweaked the weapons and how much damage they do.
591834	594276	Like the remote grenades, which used to be really devastating.
594596	596718	Now they're just like throwing a firecracker at somebody.
596758	597418	It's ridiculous.
597839	599660	It takes like four of them to blow up somebody.
599860	605144	And before, you can get hit from one of them from across the street and you're dead, which is awesome.
605684	606625	But I don't know.
606665	608466	I don't like how they retweaked everything.
608806	611368	And I really wish they had thought more about the multiplayer stuff.
611843	634084	I understand this is probably kind of an added on thing last minute but they really if they're going to put multiplayer in the game at least spend some time actually working out the tweaks working out the bugs in it because all those same bugs that were there in the first one are still there in this one so obviously they weren't working very well you know on this and we're going to probably beta test them more than they did
635183	636824	Why don't they fucking consult me?
636905	637945	That's what I want to know.
638206	645091	I've played this game more than anyone on the face of the fucking earth, and yet they do not consult me when it comes to their multiplayer in their game.
645151	650155	I can at least give them some simple advice like, maybe put an option where you can turn off the power-ups.
650196	651136	That might be smart.
652297	653378	No one cares what you think, Loki.
653398	655500	You're just some dumb podcaster, amateur...
656351	657171	Internet Journalist.
657311	660432	I will take anyone on in Grand Theft Auto, Vice City Stories, Liberty City Stories.
660612	661792	I will fucking kick your ass.
662252	662652	Anybody.
663132	664873	In the face of the world, anybody.
665013	665973	I will beat them down.
666113	669494	And this includes the development team of both Grand Theft Auto games.
670054	671154	I would kick their ass.
671674	671974	Wow.
672194	672754	Strong words there.
672774	673714	Challenge to anybody.
674014	674715	Strong words there.
675735	678295	You know, you're just begging for an ass kicking with a statement like that.
678395	679055	Oh, no, I'm not.
679315	680496	All right.
681296	682136	Is that it for your gaming week?
682839	683520	That's pretty much it, yeah.
706997	708478	DarkSakura, DarkSakura, DarkSakura
732492	737217	You know, graphics are only so much of a game, so that's really a minor bitch, all things considered.
737297	743023	Otherwise, and the music is not up to caliber with previous Final Fantasies in the series, in my opinion.
743323	746507	But otherwise, those are honestly two very small bitches in the scope of things.
746747	747808	The game is fabulous.
748729	750871	The combat system is genius.
751251	753474	The demo doesn't give...
754054	756895	you the full insight to the depth of the combat system.
756935	767801	The combat system is great because to me it's kind of like you're sort of playing Final Fantasy XI except you get to make everyone your bitch and do exactly what you want and you don't have to put up with retards.
767861	768401	It's awesome.
768461	768861	I love it.
769361	771342	So the combat system is brilliant.
771442	771802	I love it.
772103	776445	I know it's probably going to turn off some old school fans of the Final Fantasy series but it's a nice change.
776765	777405	I think it's great.
777965	779326	The characters are awesome.
779346	781127	The story is awesome and
782786	790215	I love Balthier, the pirate, he's great, and the story is a little tough to get into at first, I think, but it's great.
790255	796962	There's a lot of depth to it, and it's hard for me to say a whole lot about the story, because I'm only so far into the game, I've only had so much time to play it, but
797520	798621	Final Fantasy XII Final Fantasy VII
826315	827677	and I guess he got a prize for it.
827697	830039	I didn't know they were doing prizes for cosplayers, but whatever.
830119	831501	So, it was kind of anticlimactic.
831541	834004	And of course, they asked me if I wanted to get the guidebook.
834064	835345	I'm like, no, I have a game.
835706	836526	I have GameFAQs.
836727	837648	The guidebook is sexy.
837908	841152	I know the guidebook looks nice, but I just, I couldn't justify paying the money for it.
841252	843254	I just, when GameFAQs.com is available.
843474	843574	So...
846206	846846	That's all I can say.
847507	850088	Ranma in our chatroom says Gambits and License is crap.
850529	851169	I disagree.
851469	860695	The License board may not be the best EXP system, but the Gambits is really what makes the combat system great, because that's how you tell people to be your bitch.
861075	864217	Like, the Gambits is basically... For those who haven't played the game yet, the Gambits system basically...
864657	866679	DarkSakura, DarkSakura S, Actdeft, Drew, Carameldansen
889096	892277	So, like, I have her logic set to, okay, first, her highest priority.
892377	895217	If anyone is under 70% hit point, she cures.
895877	899738	If anybody is under 30% hit points and she's out of magic, she'll use a potion.
900498	902859	Then she will automatically cure silence.
903039	904159	She'll automatically cure poison.
904439	907519	Then her priority is to attack anyone I'm attacking.
907920	914981	Then, under that, the logic is that she casts protect on my main character, Vaan, who I use as my main character right now.
915501	915681	So...
916872	922013	It's kind of like, so it works, because that way she only casts Protect when we're not actually in battle, so she's not wasting MP.
922253	924033	It's great, so you can kind of play with this.
924053	927994	But the interesting thing about the way the gambits work, you don't have all the logic available to you.
928294	932135	Like, for instance, you start with, like, only a few commands, like, hit points below 70%.
933175	937376	But if you want to buy, or I mean, if you want to get hit points below 50%, you have to buy that.
937696	941777	Or if you want to get, like, you know, enemy is weak to fire, you have to buy that.
941857	944098	You know, it's kind of interesting, the way that all works.
944158	945618	So, I kind of think it's cool.
946198	946518	I like it.
947731	948492	That's just my opinion.
948532	949893	So I think the game is great.
951115	953277	It's just shy of being a 10 out of 10.
953538	954679	It's like a 9.9 out of 10.
954959	955480	It's wonderful.
955780	956401	You have to get it.
956481	963069	Even if you don't like RPGs usually, maybe the more action-oriented combat system in this will get you into it.
963249	963530	I don't know.
963990	964691	That's just my thoughts.
966021	973627	Jamie, I know when you played the demo, you said the combat system was junky, but I realized that... I believe that my words were the combat system was ass.
974187	974748	You know what, though?
975088	977730	The demo didn't do it justice because it didn't show you the depth of it.
977990	983274	It was just kind of like in the demo, it was like, run up to a monster and rely on the auto-attack thing and maybe use the magic.
983895	984655	It didn't do it justice.
984676	985076	I was just like...
985556	986937	Get the stupid thing off the screen.
986977	988098	I want my cutscene.
988298	991741	Believe me, plenty of cutscenes.
991881	992981	You know what I meant, though?
993001	994082	I meant the cut to battle.
994342	994503	Yeah.
994803	996364	The battle screen, I guess.
996384	998866	Well, it's interesting because it means you have no random battles.
998926	1000967	And that was kind of a frustrating thing in old Final Fantasies.
1001027	1003929	It's like, God damn it, I need to get to a save point because I need to go.
1004790	1005750	That's what you had.
1005931	1007612	You're walking towards a save point and then...
1008314	1015057	Do-do-do-do-do-do-do-do-do-do-do-do There was an item in Final Fantasy VI that removed encounters.
1015117	1016578	Yeah, but then you would never get any experience.
1016918	1019719	Yeah, but if you needed to get to town B quickly, then yeah.
1019859	1020159	That's true.
1020399	1022220	But in this one, at least you can see the enemies.
1022660	1024181	Oh, that is one other kind of minor.
1024861	1027723	You do go a long way between save points in some parts in this game.
1028323	1029924	The areas are massive.
1031404	1032165	It was the same with X.
1033504	1037047	What would you say was like the worst thing about Final Fantasy XI, Jamie?
1037227	1039308	When you played Final Fantasy XI, what was the worst thing about it?
1040149	1040930	Being a white mage.
1041390	1048515	See, but the nice thing is about Final Fantasy XII is that it's like you get XI's combat system, but you don't have to deal with people's attitudes.
1048635	1050176	You know, you set the gamuts and they do it.
1051897	1053959	If you want someone to be your white mage bitch, great.
1054259	1054679	You got it.
1054779	1056020	And no one yells at you to cure them.
1056060	1056621	They'll just die.
1056681	1057101	It's awesome.
1057461	1061484	So it's like 3D Chrono Trigger.
1062642	1064143	without Toriyama's artwork.
1081676	1110711	so no other games for me to review this week and probably for the next few weeks there won't be a lot that I'm playing although I do really want to get Elite Beat Agents and I did go to we were at the mall today and of course I had to look to see if they had Luminous 2 because I still kind of want it even if I am a little even if I am a little bit like see I thought for some reason Luminous was out this week I got mixed up so I have to wait for Tuesday but even though I am a little bit er at Luminous right now because the Xbox one was not all that I still really want Luminous 2 and somebody had shared the official website with me earlier in the week and you know
1110971	1112512	DarkSakura, DarkSakura, DarkSakura
1133417	1136859	or maybe somebody will get married or they'll have a baby.
1137199	1138299	Something really big happens.
1138819	1145062	So we here at Orange Launch Radio thought, hey, maybe we'll get involved in November Sweeps and we're going to have surprises throughout the month of November.
1145602	1147163	And tonight we have a surprise for you guys.
1147223	1149004	And this is something we've been hinting at for a little while.
1149764	1157328	But for those that just listen to us on our RSS audio feed, whether it be through iTunes or XBStream or however you're doing it,
1158806	1163068	Orange Lounge Radio is actually a live streaming radio station, 24 hours a day, 7 days a week.
1163148	1169750	This is just kind of the flagship show here on Sunday nights, which is then, you know, broadcasted over the MP3s.
1170370	1172771	But we do have live-only shows that air throughout the week.
1172831	1175652	For instance, Tuesday night, DarkSakura does her Pump Up the Volume.
1175672	1178013	It's just her, and she plays some indie band music for you guys.
1179093	1184195	Wednesday nights, my roommate Extrofer and I do a show called Guys on a Show, which is kind of about pop culture stuff.
1184953	1189174	And tonight, boys and girls, we're going to be announcing a brand new show.
1189294	1190274	So let's go to the tape.
1196335	1198195	Do you want to listen to me?
1199736	1201756	Because if you do, then I should warn you.
1201776	1206917	Because if you do, I should warn you.
1207177	1208497	You're going to hear all sorts of things.
1209837	1210758	Hits from the past.
1211878	1212838	Crap from the future.
1213860	1215362	Travis Donovan Live, coming to Orange Lounge Radio
1237153	1237973	Orange Lounge Radio
1261778	1264521	DarkSakura, DarkSakura, DarkSakura, DarkSakura, DarkSakura
1281656	1282277	Thank you for watching.
1282297	1282937	See you next time.
1310762	1311222	Halo 3 Halo 3 Halo 3
1340314	1358582	With such a date like this, you have to kind of wonder, okay, well maybe, I don't know, not quite positive on everything, but the date that I have in my system for Halo 3, and this is, you know, we haven't gotten, according to our email, we haven't gotten an official announcement.
1358602	1366445	Of course, Microsoft hasn't made an official announcement about the date, but from what we've heard from our guy inside Microsoft, March 14th.
1367677	1371520	Which makes sense, because that's when the big games came out last year.
1372161	1376304	March is usually the end of the financial quarter for a lot of these companies, including Microsoft.
1376944	1381768	So, March 14th, 07, should be seeing Halo.
1383817	1384558	Yeah, that's pretty cool.
1384798	1385538	Okay, now wait a minute.
1385558	1388160	I've got to stop you there because that's a really big thing you're saying there.
1388220	1396846	So, again, let's look at the evidence and why, you know, because most people are assuming that Christmas window for 07 is going to be the launch of Halo 3.
1397186	1403370	But now we've had several, like, random things pointing us to this spring 2007 date, right?
1403390	1408594	Because I remember a few episodes ago you had the marketing folks that came to your work and they told you spring, right?
1408614	1409754	Well, this wasn't the marketing guy.
1409774	1412516	This is their head of sales at Microsoft.
1414257	1415158	I can't remember his name.
1415178	1415998	I want to say Dave.
1416258	1422181	But anyways, he said March or April was the target date for Halo.
1422981	1434986	And this makes sense because, you know, how would you love to end your financial quarter than to say, look, Halo launched and we sold millions and millions and millions and millions of copies and that made our numbers look really good.
1436448	1440791	because they're going to have another one that's going to be in Christmas anyways, Halo Wars.
1440931	1443913	So you don't need two Halos, that's just overkill.
1445154	1445534	Interesting.
1446711	1448232	You know what's interesting?
1448272	1456897	Obviously, when you posted this in the show role thread, it was interesting because later the same week from a completely different source, let's just say I have a friend.
1457497	1461559	I know you all hate these friend of a friend things, but again, it's kind of one of those things where it starts falling into place, right?
1462040	1466382	I have a friend who has a friend who works for a certain company.
1466742	1473765	Large Magazine Company, who's had a lot to do with Halo 3 recently, pushing it, who also apparently said it's going to be spring of 07.
1473865	1475946	Well, of course it's going to be spring of 07.
1476626	1480207	Now, and I would think this makes very good sense.
1480287	1485609	It's not going to be February, because I thought originally it might be February or something like that, but February's usually dead.
1485649	1492132	It's kind of still that dead point from December to March, where nothing really comes out.
1492812	1492912	Um,
1494059	1494139	E.A.
1494159	1494519	Replay 2 E.A.
1494539	1494740	Replay 2
1524494	1529516	MVP07, NCAA Baseball, also that same date.
1530296	1539760	And then finally, Two Worlds for Xbox 360, which I think has been called the Oblivion Killer and whatnot, March 7th.
1540220	1541881	So lots of good stuff.
1542781	1548624	I think there was also NBA Street that we saw there, Home Court, but I think the date's been announced for that, so I didn't mention it.
1549464	1550505	But fun stuff.
1551065	1551325	All right.
1551949	1555794	Oh, and have you seen the picture of the helmet yet for the Legendary Edition?
1556134	1557616	I think I saw it on a blog somewhere.
1558237	1558878	It's interesting.
1558958	1559578	It's interesting.
1559598	1562922	I actually have that pre-ordered because I want that for my desk.
1563844	1564204	All right.
1565222	1566343	I hope that turns out to be true.
1566823	1569025	I mean, a lot of signs point to that.
1569125	1575651	Why the sudden magazine blitz right about now if Microsoft wasn't about ready to make a big announcement right in time for the PlayStation 3?
1575911	1577012	I don't know.
1577032	1579594	There's just a lot of things that kind of make that look probable.
1579794	1580835	I mean, we might be wrong.
1581696	1584478	It might just be a bunch of red herrings, but it would make sense.
1584558	1586960	It's not necessarily a case of we being wrong.
1587160	1590223	There are delay issues for different reasons.
1590263	1591304	I mean, it's just like, you know...
1591884	1595065	or folks are purposely trying to mislead us astray.
1595265	1602727	But at the same time, if these magazines are getting these premieres of the games and all this detail about the game, that would indicate to me the game is pretty close to completion.
1603047	1603527	I think so.
1603627	1605108	And here's the thing about it, though.
1605648	1613290	And no one seems to pay attention to the fact that a lot of times these releases are in two big chunks.
1613330	1617691	You've got the spring releases, which take place mostly in March.
1618311	1619752	DarkSakura, DarkSakura, DarkSakura
1646096	1653063	And then for the holiday season, you've still got your Halo Wars that you can also push out there as well.
1653203	1656646	So they're covered in both sections of the year.
1656666	1658809	I don't know, that makes sense to me.
1659409	1660190	We'll see what happens.
1661127	1662028	We will see you all in time.
1678383	1678864	DarkSakura, DarkSakura
