start	end	text
3162000	3168063	Are we going to go out on the 19th and do the thing with the camera like all the big blogs do and tape people in line looking stupid?
3168103	3169284	Like, oh, wait for PlayStation 3.
3169344	3170385	If I can make fun of them.
3170585	3171645	Do we really got to do that?
3171665	3173647	I mean, seriously, everybody else says that.
3174107	3180431	It's just like, that's like reporting on the fucking groundhog, you know, and seeing his shadow or not.
3180471	3181611	I mean, that's just retarded.
3181751	3184833	Actually, I have an idea, but I'll tell you guys off the air because I don't want someone to steal it.
3185153	3186394	I have a good idea for a parody.
3186754	3189496	Also, to answer questions from the chat room, um, uh,
3190014	3199277	The Manhattan stores, the NoHo one is $6.09, and the Midtown one is $10.28, so that you can look online and see what stores those are.
3199317	3199737	I don't know.
3200837	3202238	I just whispered my parody to Loki.
3202258	3202638	You like that?
3203138	3203498	I like that.
3203518	3205179	Okay, we're going to do that instead, okay?
3205219	3205559	All right.
3205939	3206699	So good luck.
3209540	3209900	All right.
3210260	3212841	I totally missed it because I was doing my job.
3214482	3218583	Anyways, there's some interesting things in, you know,
3219161	3229404	Japan might be waiting a little longer to get their PlayStation 3s because it looks like Japan's going to lose another one-fifth of their initial launch PS3s.
3229524	3234045	Instead of getting 100,000 units at launch, they're going to be getting closer to 80,000.
3234225	3237466	And that kind of sucks.
3237486	3243348	Apparently, production problems and having them, they need to allocate those to the United States.
3244408	3246789	So, oh well, kind of seemed
3247446	3252068	Same tune that Sony seems to be playing every week, so... Yeah.
3253349	3254029	Sucks to be them.
3254489	3257591	Sucks to be UK even more, though, because they have to wait until March.
3259795	3266817	Well, it sucks to be you if you don't live in New York City, because that's the only place right now where you can hit a PlayStation 3 kiosk, at least at the time we're doing this.
3266917	3271958	I'm sure they are slowly spreading across America, and we'll hit a store near you soon enough.
3272899	3274719	But this week it hit YouTube.
3274739	3282621	There's a clip of the PlayStation 3 kiosk at the Toys R Us in Times Square in New York City, a place I was at about one week before this happened.
3282661	3284302	It seems like I missed everything good in New York City.
3284562	3287083	I freaking missed the Wii's and Nintendo World by a week.
3287223	3288343	I missed this by a week.
3289019	3291740	and then I missed Digital Life by a week the other way.
3291820	3292780	I can't plan for shit.
3292820	3293340	I hate my life.
3294520	3298201	But anyway, if you want to see the clip, it's on YouTube and I'm sure linked from many gaming blogs.
3298761	3304382	And if this is showing up at the Times Square Toys R Us, I'm sure it's just a matter of time before it shows up at a Toys R Us near you.
3304562	3307383	So look out for it if you want to try out the PlayStation 3.
3308323	3311143	Although I don't see why anybody would really want to.
3311223	3316004	Because they can make their own informed decision on whether they want to get it or not.
3316124	3317425	My informed decision is poo.
3318385	3318745	Anyway.
3320339	3322121	Disney is having a cow.
3323502	3326785	They want Kingdom Hearts 3 now.
3327726	3334893	Nomura is saying that they're already working with Squeenix about making the third version.
3334993	3337795	In fact, if you get the new...
3339637	3341598	I don't want it right now though
3369460	3370060	Now, hold on.
3370100	3377142	You just poo-pooed the PlayStation 3, but the day Kingdom Hearts 3 comes out, you're going to be like, OMG, PS3 fangirl!
3377722	3379262	No, it won't be PS3 fangirl.
3379342	3380922	It'll be Kingdom Hearts fangirl.
3382223	3383923	I do not care what the platform is.
3384003	3387264	If it's got the game I want to play, I'm going to play the game I want to play.
3387704	3390364	It's not the system that is good.
3390464	3394325	It is the game that is good, that maximizes how well it uses the system.
3394625	3395945	The system is the tool.
3396285	3399186	And so far, no one has been able to put anything on it that's worth a damn.
3399867	3403111	Well, my only problem with PlayStation, you know, again, I stick by what I've said earlier.
3403151	3405635	I think a year from now, PlayStation 3 will be just fine.
3405675	3409420	But right now at launch, there is zero, zip, nada, nothing I want.
3409760	3413085	Because half the launch games you can get, and more than half you can get on another system.
3413585	3416028	And the ones that are exclusive make me go, meh.
3416950	3417150	Meh.
3417884	3421965	But, you know, I know there's stuff in the pipeline like this and Final Fantasy XIII.
3422525	3425786	And, yeah, all this crap is going to make me want a PlayStation 3 in a year.
3425846	3429027	But right now, I see no need to do this crazy campout crap.
3429427	3430107	There's just no need.
3430527	3439389	And I've listened to other folks, and even, I think, Loki, you said that you feel the need to get the PlayStation 3 so that you can do the journalist thing and report on it or whatever.
3439629	3440150	Fuck that.
3440490	3440990	Fuck that.
3442430	3444191	I've kind of gone that route anyways.
3444251	3445491	It's too expensive, and it's...
3446528	3447048	I mean, what?
3447369	3449170	Motorstorm is kind of the only thing I'm looking forward to.
3449390	3453412	I think people understand that we're not getting paid to do this.
3453472	3454893	We're just gamers like you.
3454973	3455634	So you know what?
3456034	3461317	If the real list is that we can't afford a PlayStation 3, I think the listeners will forgive us a little bit.
3461657	3462358	Oh, yeah, yeah.
3462418	3463718	Jamie, you're special.
3463759	3466000	I'm just saying, we will have a way to report on it.
3466140	3466540	All right.
3466580	3470322	So you're going to be our official PlayStation 3 wench.
3470763	3470943	Yep.
3471783	3472524	Lord help us all.
3472544	3472804	God damn it.
3473767	3476949	Yeah, we're sure to get an unbiased perspective on the launch games.
3476989	3478050	So I played Sonic.
3478350	3478990	It's crap.
3481072	3482733	I played Gran Turismo.
3482913	3483593	It's crap.
3484634	3485555	We'll see, we'll see.
3489458	3493901	Shadowslayer would like to point out they haven't said which platform Kingdom Hearts 3 is for yet.
3493921	3498824	We're kind of making this assumption that it's PlayStation 3, but they haven't really said exactly which platform it's going to be.
3498924	3500986	That's because Squeenix is sleeping in Sony's bed.
3501557	3504019	JV Mon says that Kingdom Hearts 3 needs a stitch level.
3504400	3504740	I agree.
3505320	3505841	Oh my god.
3505941	3506821	It'd be what?
3506881	3507662	Hawaii World?
3508343	3508843	Well, whatever.
3511505	3513106	Anyways.
3514207	3521113	So speaking of fun things to be coming out soon, well, maybe not so soon, but Castlevania.
3521633	3527758	The film's in the works right now and unfortunately it's being directed by Paul W.S.
3527958	3528959	Anderson who has
3529639	3541563	made such wonderful films before, and basically kind of describes the project as going to be an action horror movie in the vein of Underworld and Blade.
3543144	3544824	So, is he going to take a big poop?
3544844	3547725	There's two winners to be influenced, but actually Blade's kind of cool.
3548105	3556008	I don't know if he's going to take a big poopy on this, but I think it's going to be generic vampire hunting movie one, or whatever, 50.
3557289	3558549	So, like Van Helsing.
3559973	3562494	Yeah, actually Van Helsing is probably... That was a waste of a movie.
3564054	3564394	I don't know.
3564414	3565514	Okay, let me put it this way.
3565554	3569856	In the spectrum of video game movies, he's not the bottom.
3570156	3571596	So that's good.
3571916	3574137	I mean, he did do Mortal Kombat, which is pretty well received.
3574157	3575777	Mortal Kombat was Resident Evil.
3575797	3576677	A lot of fans of that.
3576777	3578318	Resident Evil, eh, not so great.
3578338	3580978	I mean, Mortal Kombat was cheesy, but, you know, whatever.
3581058	3581519	It was effective.
3581539	3582259	It got the job done.
3582299	3583139	Yeah, so...
3583692	3583852	What?
3583872	3584032	What?
3584052	3584132	What?
3610765	3611906	We'll have Kylie Minogue in it?
3612426	3612986	Probably not.
3613086	3616808	Actually, it's not really a sequel per se.
3617208	3619309	It's just another Street Fighter movie.
3619569	3622170	But this time it will be centered around Chun-Li.
3622930	3624331	So maybe they'll get Ming-Na Wen back.
3624391	3624731	I don't know.
3625091	3625872	She's still on ER?
3626172	3627052	She was a cute Chun-Li.
3627092	3627872	She was a cute Chun-Li.
3627892	3628613	So maybe she'll come back.
3628653	3628893	I don't know.
3628913	3629633	Is she too old now?
3630133	3630414	I don't know.
3630434	3630974	It's been a few years.
3630994	3632254	I don't see why she would.
3632274	3633475	She's pretty hot on ER, isn't she?
3634870	3635710	I don't watch TV.
3635750	3636191	There you go.
3636611	3638492	Mikotov says she's not on it anymore, so she's freed up to do this.
3638512	3641913	All they're going to do is just try to get Devin Aoki to do this, and that's it.
3641953	3646295	No, they'll get the chick from Crouching Tide, Zhang Ji, or whatever her name is.
3646535	3647195	Zhang Ji?
3647295	3647755	Yes, her.
3649296	3651017	She'd be cool, actually, because she's...
3652469	3654110	She looks way too innocent.
3654330	3660353	But of course, a lot of people are cringing at this news because, you know, it's Hyde Park Entertainment and Capcom, by the way, who are coming together to do this.
3660693	3666116	Apparently in this big 20th anniversary of all things Street Fighter, they want to get this movie out in time for.
3666136	3668737	They just wanted to kill it at 20, didn't they?
3669017	3673159	No, Capcom needs to step in and say, okay, you fuck this one up, we kill you.
3673539	3678762	We hire our special hitmen to beat you into pieces with, you know, a Hadouken.
3680673	3681794	We'll see what happens.
3682874	3683234	Let's see.
3684195	3686596	GS68 in our chatroom says, New Street Fighter movie?
3686796	3687476	Do not want.
3688397	3692098	And Justin says, Hey, we could look forward to Street Fighter the movie to the game.
3693079	3696180	You know what was sad, though, about the movie that they did?
3696440	3696680	What?
3696700	3698121	That was Raul Julia's last role.
3698241	3699101	Yeah, it was kind of sad.
3699401	3701242	It's like, he's going to die.
3702116	3704597	with that being his last movie.
3704737	3708978	But he did some movie for HBO as well that won a bunch of awards.
3709018	3715479	And I think the HBO movie may have technically been... Now, it's not a theater release, but I think the HBO thing was on after the Street Fighter thing.
3715539	3720260	So I think if you want to give him some more credit, you could use the HBO movies as his last movie.
3720320	3721840	I do have to say he did make a good bison.
3722540	3724481	He made a great Gomez Adams.
3724721	3725061	Oh, yeah.
3725321	3726141	I'll always remember him for it.
3726161	3727101	Tim Curry made a good Gomez, though.
3727542	3728182	Eh, never saw it.
3728982	3729482	All right, anyway.
3731863	3739388	Well, speaking of things that have nothing to do with the Addams Family, but has everything to do with things that our chatters seem to be going off on.
3739569	3745092	Loving the segues tonight, everybody, loving the segues.
3746233	3752578	Well, it looks like Microsoft and Peter Jackson have given up.
3754662	3760005	They've made the statement that they have halted pre-production for Halo 3.
3761626	3762946	Well, for the Halo movie, I'm sorry.
3763086	3767269	All we're going to get is Halo 3, basically.
3768029	3775453	They still want to do it, but they have to find people who are going to want to pay for it.
3778434	3779035	Well, that's too bad.
3779695	3781276	Which is stupid, because...
3782421	3786567	There's been a market for these type of sci-fi fantasy.
3787508	3790572	Isn't it kind of interesting that the Chun-Li movie can get made but Halo can't?
3790592	3796820	But I'll bet you the problem is you got Peter Jackson attached and they probably want a budget that's like 20 times higher than what the Chun-Li movie is going to cost to make.
3796860	3800605	And they want Chun-Li because it's going to be cute Asian girls in short dresses.
3801669	3803230	And there's no short dresses in Halo.
3815726	3821068	True, but look at all the hype there was around the Xbox live release of Street Fighter.
3821188	3823588	I mean, it shows that people are still nostalgic over this.
3823628	3826829	Remember, we're back on Major Nelson's blog every day.
3826909	3829830	Somebody was posting, where's Street Fighter?
3829890	3831070	We want Street Fighter.
3831090	3833571	And then when it came out, it was kind of like, oh, Street Fighter for like a week.
3833611	3836052	And then it was like, where's Luminous?
3836192	3837252	Where's Luminous?
3837292	3838712	Where's Mortal Kombat 3?
3840413	3843994	I do have to say, though, that Sharon is my hero right now.
3844014	3844434	Hmm.
3844938	3845538	Thanks for watching!
3869324	3874085	It came out, they have the preview in May, and it's coming out in... What was that game?
3874165	3875685	The motorcycle game with the chain?
3875925	3876806	Road Rash.
3876886	3878566	It was Road Rash, was the game.
3878866	3879946	I don't know, I like Road Rash.
3880646	3882607	No, we have a story about Road Rash later on.
3882647	3882947	Do we?
3883327	3883747	Exciting.
3883767	3885027	Alright, we'll get to that later then, sorry.
3886708	3892589	Anyways, speaking about things that are coming out later, GamePro Expo.
3893129	3894169	Is it the new E3?
3894589	3895029	Maybe.
3895769	3898810	But they're definitely stepping in to basically take on the
3899760	3902742	Big Show Event E3 General Mission or Industry Only
3920103	3920603	DarkSakura, DarkSakura,
3941215	3950043	By October, their Christmas games are already ready and they don't have to do this big push for having to create these E3 demos and having that pressure of having to build in April.
3950063	3958311	They can reuse the Tokyo Game Show and X06 demos or X07 by next year, so why not?
3958391	3961814	I mean, it's not really any extra work that they have to do.
3962543	3966985	But they're saying that's supposed to be centered around the Los Angeles Convention Center.
3967065	3971386	Of course, they're going to be doing some stuff as well, like tournaments and that sort of thing.
3972767	3976668	See, that's what makes me think it's general mission, because why would you do industry-only tournaments?
3976708	3977729	That kind of defeats purpose.
3977949	3982751	And it's supposed to take place October 18th, 19th, and 20th next year.
3984551	3985992	It's just L.A.
3986112	3986912	I'll probably go.
3987232	3988113	It sounds kind of exciting.
3988793	3989113	Definitely.
3989413	3989773	I'll be there.
3989994	3990174	Yeah.
3990514	3991214	So, I mean.
3991874	4001652	hopefully we're able to get in hopefully it's not, you know, by invite only like certain other conventions this next year will be but we'll see, we'll see alright, well
4002062	4005745	That's it for the news here in this part A of Orange Lounge Radio.
4005765	4009969	We're going to take a quick break and we'll come right back with more of Orange Lounge Radio.
4010209	4012771	For those of you guys listening live, we're going to do a music break here shortly.
4013051	4021779	For those of you guys listening to us on the audio download, we will be back in a couple of days because we split it up into part A and part B. And we'll be back after this.
4022703	4027666	Orange Lounge Radio is taped live on Sunday nights and is podcast to the world twice a week.
4028126	4032448	Stay tuned to our podcast feed for the conclusion of this week's Orange Lounge Radio.
