start	end	text
1700560	1712170	Pinball, Legend of Zelda, Ice Hockey, Donkey Kong But what's interesting, Japan is getting some exclusives They are the only ones that are getting Gradius And what's very interesting, I think, is that they're the only ones getting Super Mario Bros.
1713191	1716273	So, kind of strange there Oh, also, how could I forget this one?
1716293	1728904	Solomon's Key I played that game a lot I think those are launch games I thought it was until the end of the year I want to say they're launch games, because I think they're launching a little later than us And I think some of this other stuff are actually going to be coming out later for us
1729484	1730045	Well, we'll see.
1730065	1732547	Because Europe is getting some games that we're not either.
1733147	1733387	Right.
1734368	1737730	I want to say that, I don't know, it's going to be relatively soon when we get those.
1738071	1738591	Well, alright.
1738951	1744215	Now, what's interesting, speaking of the UK, they are not scheduled right now to get Donkey Kong Country, but the other two regions are.
1744516	1756845	All the regions, though, on Super Nintendo are getting F-Zero and SimCity, but then Japan's getting a whole lot extra Super Nintendo games, including Contra 3, Super Castlevania 4, Street Fighter 2, and Zelda A Link to the Past.
1757425	1762087	The only game for Nintendo 64 that's currently going to be available is Super Mario 64.
1762528	1766970	Then you go over to Sega Genesis and pretty much you get the same thing across all regions.
1767230	1777735	You're getting Altered Beast, Echo the Dolphin, Golden Axe, Gunstar Heroes, either Puyo Puyo or Dr. Robotnik's Mean Bean Machine, depending on your region, but it's pretty much the same game anyway.
1778195	1786421	Sonic the Hedgehog, ToeJam & Earl The only game that Japan's getting as an exclusive is Shadow Dancer Wasn't that the Shinobi sequel?
1786521	1791985	Yeah, that was the one with the dog That game was freaking awesome But yet there's no Shinobi listed, that's kind of weird
1792754	1793775	Shadow Dancer was a better game.
1794215	1794515	Oh, whatever.
1795235	1809562	On the TurboGrafx-16, all regions getting Bonks Adventure and Dungeon Explorer and Superstar Soldier, but Japan is exclusively getting New Adventure Island and Bomberman 94, although the other regions are getting Bomberman 93.
1810782	1814084	Victory Run, not coming to the U.S., but is coming to Japan.
1814164	1818666	I'm sorry, not going to Europe, but is going to Japan and the U.S., so.
1819452	1820652	I'm also going, where's Dracula X?
1844955	1846436	Not a lot of Castlevania games, yeah.
1846756	1857102	Only the one in Japan, so... Well, Super Castlevania IV, while it was a good game, you know, while they're looking at the... And they could easily encode it, you know, memory storage being what it is now.
1857503	1867509	They could easily move a whole CD game into... Because the thing that took up the most room on those discs was the Red Book Audio.
1869010	1872191	Well, we'll see what happens with the titles coming up in the future.
1872272	1874533	It would be nice if you could do full CD games, but who knows?
1875134	1878696	Imagine if they did a translation of Emerald Dragon or Star Parodia.
1878836	1879336	That'd be cool.
1881337	1883918	Alright, so that's all I've got to say on the Virtual Console.
1885739	1887420	Well, I've got news.
1888120	1893503	But this has to do with the visual end of our Nintendo friends.
1895164	1904408	Nintendo is basically going back and reconfirming that the Wii will be at 480p, even though the magazine suggested it would be at a higher resolution.
1907396	1910256	In the magazine it said the output would be in 720i and 720p.
1910296	1912717	That was a typo.
1913137	1916858	Yeah, they went back and Nintendo themselves said that.
1917298	1931381	Also for the UK, just to let you guys know, they are also saying that they're going to be releasing the component cable and the other peripherals that were rumored to not be released at launch in the UK.
1931461	1933002	So you should have no problem getting that.
1933022	1934342	You won't have to import that.
1937867	1938487	That's pretty cool.
1939368	1941329	I know there are some other secrets out there.
1941869	1948372	I still wish that Nintendo was going to give us some high def later on or something, but I know that's the typical fanboy.
1948532	1950793	Who says they can't?
1952354	1956176	Microsoft upgraded their display output, so why not?
1956956	1957676	They can do stuff.
1958517	1959657	Because it's just not their thing.
1959877	1960858	That's not their thing right now.
1961533	1968539	Yeah, but it may not be their thing, but it doesn't mean that a third-party publisher can say, I want to make my game 720, damn it!
1969680	1970441	We'll see.
1970721	1971642	I don't know.
1972162	1977186	Anyways, there's some other stuff released this week, actually, about the Virtual Console.
1977207	1981931	Kind of a little bit about how you'll be able to store your games and whatnot.
1982691	1984573	It's going to be interesting to find out, actually, that
1985592	1993996	You'll be able to store your games to the console itself, of course, the 512 megabytes built in, or the SD cards as well.
1994756	2003840	You will not be able to transfer your games to another console, where you can take your memory card and bring it over to your friend's house and play your Mario Brothers there.
2004360	2012144	But you can, however, re-download the games, kind of typical with Xbox Live Arcade and that type of stuff.
2013673	2041470	and um some interesting stuff they're talking about how the virtual console stuff you'll be able to use um the standard Wii Remote actually for NES games by turning it on its side which you know ever since I saw that Wii Remote and they announced the virtual console I knew they were going to be able to do that and as well as using the GameCube pads also if you don't want to spend money on the uh classic controller you can use that as well so that's kind of neat and um
2042386	2043767	Yeah, that's pretty much it for now.
2043807	2046548	That's all about the information that they have on that.
2048108	2050049	Comments regarding high definition from our chatroom.
2050729	2053090	PooEater says, I want the games to be reasonably priced.
2053110	2059232	I could give a crap less about $1,296,000,000 or whatever.
2059673	2061633	No, actually there was one other thing I forgot to mention.
2061653	2064094	They're going to have digital manuals for each game as well.
2064594	2065375	So that's kind of neat.
2065535	2066295	Oh, that is kind of neat.
2066595	2068776	That's like the iTunes books you get.
2069941	2078047	Wasn't there something, I don't know if this was just a rumor or something, wasn't there something a while ago about how Nintendo totally wanted to copy iTunes for a gaming type thing?
2078147	2081230	I don't know, maybe that's just some crazy thing I remember reading.
2081810	2082310	Was it Sony?
2082370	2082691	I don't know.
2083852	2085553	Somebody wanted to use iTunes as a model?
2086193	2089196	Yeah, they wanted to use iTunes as a model for their Gran Turismo store.
2090977	2092218	My bad, I got it mixed up then.
2093229	2094110	and DarkSakura.com
2115400	2128944	and it shows in the sound options menu that there's an SD card option in the menu and so it's being inferred that possibly you can pull MP3s from the memory card and play them as custom soundtracks in the game.
2129264	2142749	No official word from Nintendo just yet, but this screenshot sure does make things look interesting and since Nintendo has said that there's still some secrets yet to be revealed, this could be that one secret that maybe the custom soundtracks is a feature in the game.
2143249	2144009	Who knows?
2144548	2145329	But that would be kind of neat.
2146309	2150292	I like to use custom soundtracks on 360, unless I'm playing DDR or something.
2150332	2150912	Oh wait, no, just kidding.
2150952	2151693	I can't play DDR on 360.
2151973	2156196	Like Luminous, I can't do custom soundtracks on that, because that kind of would break the game.
2157096	2159758	But most of the other arcade games I like to use custom soundtracks on.
2162120	2170866	Well, speaking of additions to games at any rate, there's been another announcement of a character in Super Smash Bros.
2170926	2171286	Brawl.
2171746	2172867	Fox McCloud is showing up.
2173719	2179403	And from what I can tell, I think it's the version from the Star Fox Adventure series.
2180283	2187268	Also in the game is going to be Pit from Kid Icarus, Meta Knight, Samus in the sexy time zero suit.
2189189	2193211	There's also Solid Snake and Wario.
2196994	2199195	Which I am going to have that game so fast.
2199778	2202860	I was kind of disappointed that they didn't announce something new.
2203040	2204861	I mean, we've had Fox before.
2204881	2206282	Even in every single game.
2206422	2207943	Yeah, but, I mean, okay, big deal.
2207963	2211045	They gave them a staff this time, so... Ooh, staff!
2211145	2213267	It looked like it was the Star Fox Adventures.
2213907	2216309	Great, so they gave us a crappy game, Fox.
2216329	2219250	Great, thank you for reminding us that they made that game.
2219331	2219911	Seriously.
2222934	2227538	We appreciate you reporting it, but we can't help but feel a little disappointed.
2227578	2234843	We were hoping to... Well, I know you didn't plan it, Jamie, but... I was like, I didn't think that story... We did that on purpose.
2234883	2237464	I want the game anyway, but I personally don't care about Fox News.
2237485	2243749	We were kind of hoping that we were going to hear what the new secret character... Because they've said that there are going to be other third-party characters.
2243769	2248512	That'd be almost like saying, and our new secret character is going to be Luigi.
2248812	2250193	Didn't see that coming.
2251094	2252295	I want Raiden to be in it.
2252952	2253753	That'd be funny.
2254713	2262118	Our new secret character is... A defective NES card where you have to blow on it.
2262758	2264699	The new fighter is Pantsless Rage.
2265480	2265980	Oh, God.
2266541	2266881	Anyways.
2266941	2267721	Moving on.
2268702	2280249	So, anyway, some other interesting stuff about the Wii hit this week, in fact, in the form of an episode of South Park where Cartman's actually waiting for the Wii to come out at... It was quite funny.
2280589	2281030	And a...
2282017	2282077	E.L.
2282097	2282237	or E.B.
2310305	2311306	I about cried.
2311326	2315107	I about cried the last... I don't want to spoil, but it's not that big a deal.
2315388	2319149	Like the last minute of the episode when all the sea otter people were gearing up.
2319770	2320470	I about cried.
2320510	2321170	It was so funny.
2321951	2323011	This is making me laugh.
2323992	2327613	GS68 in the chatroom says a new secret character, Ken Kudaragi.
2327934	2328834	He wields a crayon sword.
2330835	2331255	He can't.
2331295	2331915	He's going to eat it.
2332336	2333696	Maybe Cartman's the secret character.
2333736	2334036	Who knows?
2334557	2335037	That's the joke.
2335983	2350612	It was interesting to have another game infomercial this year, but a lot of folks speculate, because the episode didn't really end this week, it's a two-parter, so a lot of people are saying that when Cartman actually gets to play the Wii, which will probably be next week, he's going to say, ah, it sucks, or something like that would probably be the big joke.
2351092	2354054	But so far it's looking like another video game infomercial.
2354414	2363080	But yet another episode this season I think was better than the Warcraft episode, but that's because Mrs. Garrison is my favorite character in the whole show, and it was pretty funny.
2363660	2364220	So, anyway.
2366109	2367029	DarkSakura, DarkSakura, DarkSakura
2390080	2391461	GameCube component cables
2412626	2417188	in response to the question that Game Informer posed, will component cables be available on day one?
2417228	2419588	Kaplan said, yes, at retail and online.
2419668	2424770	Best Buy, GameStop, Circuit City, and Nintendo.com if you still want to go the online route.
2425830	2431692	Then she went on to say this very other interesting piece about comparing virtual console pricing to lattes.
2431912	2433733	I didn't get that, but whatever.
2433993	2437374	I'm just happy to hear that the component cables will be found in stores.
2438875	2439695	That makes me very happy.
2441593	2442514	She's insane.
2442554	2443834	Does that make you a happy panda?
2444335	2444515	Yes.
2445715	2447296	She's a crazy, crazy person.
2448597	2448957	Anyways.
2449818	2450918	What the hell was that?
2450938	2457322	It was, no, I hit a button and it opened up my AIM and it plays a stupid song every time.
2457342	2463145	It's like, I love Gnarl Sparkly as much as the next person, but I'm tired of hearing that damn song every time I open up my AIM.
2463185	2464966	You must not like them very much because I don't like them.
2466747	2469028	No, I like, it's Danger Mouse.
2469849	2470489	I like Danger Mouse.
2472126	2482614	Speaking of things that aren't, I guess, quite as frightening as having your AIM play sounds when you don't expect it to, Akira Yamaoka is working on a new game.
2484276	2484716	Frightening.
2484996	2485417	Cool!
2485457	2486898	Silent Hill 5, finally?
2487138	2488099	Confirmation?
2488659	2488880	What?
2489400	2495005	It's called Otonari Yoku, which means adult power.
2496107	2497128	Adult Power, huh?
2497168	2498929	So is this one of, like, those games?
2499069	2503833	It's a self-help guide to improving your relationships through the mastery of rules and manners.
2504253	2505374	Boring!
2507015	2516262	But you know it's so quirky that it's gonna sell like a freakin'... I don't have... It's gonna sell like... Not in this country.
2516702	2517083	In Japan.
2518284	2519725	And, like, five people will import it.
2520165	2521626	And go, I can't read Japanese!
2522647	2525229	Why would Akira Yamaoka be producing a game like this?
2525976	2527478	Maybe he's trying to redeem his soul.
2529120	2531723	Oh, kind of like how he feels like... He's scared us from here.
2532065	2542271	He feels like all these Silent Hill games have condemned him straight to hell, so he needs to do something good for society, like something, you know, like, hey, train adults how to tell which one's the salad fork.
2542491	2544052	What the hell do you do in adult training?
2544352	2550615	No, I think that it'll do, like, it'll yell, manners, manners, manners, sirens go off, the world gets dark.
2551156	2554157	Have your grandma play this game so she doesn't go into Depends.
2554398	2558560	I mean, what exactly is going to be trained in this game?
2560177	2565381	Okay, first of all, when you get that old, it's not something you do on purpose, it's accidental.
2565781	2566842	Oops, I crapped my pants.
2569064	2570385	So that's not a good comparison.
2571385	2571906	Nonsense.
2571946	2573607	It's all about control.
2574148	2576149	The thought of crapping one's pants is rather disturbing.
2577370	2580312	Did you ever see that one episode of Jenny Jones with the adult, never mind, forget it.
2580532	2583074	No, it was, I was going to ask for Saturday Night Live.
2583915	2584715	Oops, I crapped my pants.
2584816	2585556	Never mind, forget it.
2586016	2586617	But I don't know.
2588238	2592762	I think that they need to make this game mandatory, though, for elementary school kids.
2594243	2595264	So, you know, in America.
2596424	2597946	So that everyone gets good manners.
2599107	2601769	Alright, yeah, you should be first in line to play this.
2602189	2602789	You know what?
2602929	2604971	I have really good freaking manners, okay?
2605632	2606832	I am so polite.
2607713	2613858	I hold the doors open for people, I smile and nod, and I don't call them shitheads when I think they're being retards.
2614859	2616720	You did buy me a maple latte, that was very nice.
2616780	2616940	I did!
2616960	2617741	See, I'm nice!
2619097	2620338	I am the nicest person.
2641736	2649300	So, you know, of course to get ready for this big holiday launch, you know, what is Nintendo doing to make sure that all those Wii's are going to make it to your stores?
2650181	2651982	Everything possible.
2652422	2654483	They are shipping it by any means possible.
2654543	2659666	Planes, trains, automobiles, ships, you name it.
2660107	2660607	Horseback?
2661828	2662148	Yes.
2662968	2666290	Little immigrants too, pulling the crates, you know.
2667030	2668491	Yeah, so any means necessary.
2668811	2671273	Not a huge surprise, but it's nice to
2671960	2672841	DarkSakura, DarkSakura, DarkSakura
2688511	2696197	Now, Miklatov, I'm going to embarrass you on the program a little bit because you have certain fears you've expressed to me before.
2696678	2701141	So how do you feel if I said that your Wii might be coming via UPS?
2701542	2703924	I would cry because I hate UPS.
2704404	2706826	But no, you haven't told me that you hate UPS.
2706846	2708467	You've told me you have a fear of UPS.
2708547	2709668	It's a little bit of both.
2709828	2710969	It's all from high school.
2711330	2712010	Tell us your fears.
2712591	2713431	Okay, my fears?
2714012	2716834	Okay, UPS, water, sheep.
2717496	2718196	Flying Bugs.
2718276	2719977	Okay, so water, sheep, and flying bugs.
2720237	2727939	So if a UPS man ever delivered you a fly-infested sheep that spat water at you, you'd cry.
2728639	2730080	I would probably just die on the spot.
2730100	2730960	That's like Silent Hill to you.
2731000	2732701	Okay, so why the UPS fear?
2732741	2734461	That has nothing to do with video games.
2734641	2735502	No, but I'm curious.
2736202	2736902	That's just like...
2737645	2751995	When I was in high school, my bus stop was next to UPS Center, and I was really weird in high school, and I figured that they were trying to take over the world, and so I was afraid.
2754897	2756838	You don't get much more stupid than I have.
2756858	2758960	What would that be, Universal Pwnage Service?
2759961	2761942	I don't know, I just hate them, and they frighten me.
2764545	2767308	I thought maybe like a UPS man beat you up once or something.
2767328	2771593	No, I just, you know, standing at that bus stop watching all the trucks go by.
2771893	2774856	And the best part was it was apparently next to a UPS center.
2775217	2776999	And I didn't know that, but I still figured.
2777179	2779101	Show me on the doll where the UPS man touched you.
2779401	2780022	Show me on the doll.
2780442	2780843	Nowhere.
2780883	2783566	I wouldn't let him near me because I'd kill him and then run away crying.
2786740	2789682	Usagi in our chatroom agrees UPS is the spawn of Satan.
2789902	2791683	I've never had a problem with UPS.
2791903	2792503	I hate them.
2792603	2795885	In fact, I've known some very attractive delivery folks from UPS.
2796145	2796545	No such thing.
2796645	2796966	You know what?
2797046	2800167	If they're attractive... At my old job, I used to have to sign for UPS all the time.
2800187	2801408	This is years before my current job.
2801468	2803249	I used to have to sign for UPS all the time.
2804309	2807171	If they're hot, that means they're really evil.
2808852	2809112	All right.
2810140	2812162	Sorry, we did get off the gaming subject for a little bit.
2812222	2812862	That's what I said.
2813002	2813523	Well, you know.
2813983	2822870	If people wanted to listen to a podcast where they talked about games and nothing but games, there's plenty of compact 20 to 30 minute podcasts out there you can listen to.
2823190	2826713	Where would you listen to fears about insects and sheep and water?
2826733	2827434	Exactly.
2827634	2834940	You listen to us because we're bloated and talk a lot about crap that has nothing to do with gaming.
2835500	2837321	Jamie, you're going to make me cry.
2837842	2839183	And when I cry, I get stabby.
2839762	2841663	I was actually imitating a goat, not a sheep.
2841783	2843124	You know what, they're close enough.
2843184	2843985	Did goats scare you?
2845086	2846707	You know what, I haven't been... What about llamas?
2847127	2847667	Llamas, no.
2847927	2850169	Okay, no, I'm really ready to get back in the game now.
2850189	2853051	Llamas have to do with Tempest, so there you go.
2853371	2854772	Where were llamas in Tempest?
2855072	2857914	Isn't that one guy that makes Tempest something to do with a llama?
2857934	2859315	Okay, I'm unplugging their mics here.
2859355	2860936	Wait, no, I have a question.
2860956	2863898	How do you feel about Circuit City and CompUSA employees?
2864698	2866539	I feel that they deserve to buy things.
2866799	2867799	Well, guess what?
2867879	2873360	They don't get to buy the PlayStation 3 and the Wii from their own stores.
2873740	2876321	It's not just the Best Buy employees that are getting shut out.
2876381	2876781	No, no, no.
2877141	2883543	Circuit City and CompUSA have enacted policies that will prevent their workers from buying the PlayStation 3 and the Wii.
2883623	2887144	If they get caught, they're going to be fired on the spot.
2887784	2889084	Best Buy employees aren't shut out.
2890402	2891683	Circuit City and CompUSA
2913212	2914313	DarkSakura, DarkSakura, DarkSakura
2942150	2942770	or Kmart.
2942850	2944671	I'm telling you, nobody's thinking about Kmart.
2945772	2946593	And with good reason.
2946893	2950635	But Kmart, I'm telling you, if I were going to be camping out for a PlayStation 3, I'd go to Kmart.
2950935	2951315	You know what?
2951355	2954217	I don't have to camp out for a PlayStation 3.
2955357	2956838	I don't either because I'm not getting one.
2957218	2958419	Oh, but I'm camping out anyway.
2959220	2968785	Well, you want to know what's funny is that when we ordered ours, we ended up actually getting money back on ours, so we actually paid less than everybody else because our credit card was special.
2969346	2972467	But speaking of special... Actually, I wanted to say real quick.
2972667	2972887	What?
2973248	2980811	Neologism, totally mispronouncing his name, 82, says Kmart is going to get like one PlayStation 3 and two Wiis.
2981131	2982972	Yeah, but I'll be the only one in line, so it won't matter.
2983912	2984452	So what does it matter?
2984992	2988354	But now everyone's going to listen to our podcast and go, Ooh, I'm going to beat Kmart.
2988454	2988794	Damn it.
2990275	2991335	You open your mouth.
2991355	2993736	If you live in the SAC area, you better back the F away.
2994520	2995880	I'm not telling you which Kmart I'm going to.
2995920	2996720	You better back that up.
2996981	2998741	I'm going to the one on How.
2999121	3000941	Yes, I'm going to the How Kmart.
3001241	3004502	Oh, wait, no, they turned that into a Home Depot years ago.
3004562	3005242	Never mind, forget it.
3005402	3007623	No, that was actually, I was like, oh, Rob is being clever.
3007903	3008523	Don't listen to me.
3008923	3009963	Yeah, don't listen to Rob anymore.
3009983	3010523	This is the JV show.
3010803	3016004	Oh, I'm going to the Kmart on, there's still the one on 80 and Antelope, right?
3016565	3017405	That's the one I'm going to.
3017525	3018785	Yes, that's the ticket.
3019225	3019625	Go there.
3020305	3021686	No, it's not on Antelope, it's Auburn.
3021846	3023386	Whatever, whatever, anyway.
3024142	3026623	Yeah, here's your Sacramento direction thing.
3027263	3032904	Okay, well, back to the PS3.
3033905	3036245	I hate you, Best Buy, you bitches.
3037086	3040166	Okay, I really don't hate any... Okay, I will rephrase that.
3040586	3043427	I don't hate any of the Best Buy retail employees.
3043567	3046188	I hate their upper management who decided this stupid thing.
3047332	3053454	18 stores are going to be doing midnight openings for the PlayStation 3 and they're not doing anything for the Wii.
3053954	3054594	You know why?
3054654	3055974	Because Nintendo loves us.
3056654	3058195	And they're going to make sure we get our Wiis.
3059455	3062676	So there are 18 stores total.
3062816	3064116	It's going to be in these cities.
3064616	3065657	Park Lane, Texas.
3067717	3069097	West Los Angeles, California.
3069617	3070278	Chesterfield.
3070618	3071458	Is that... Is M.O.
3071498	3071898	Montana?
3072658	3072898	Yeah.
3073899	3074179	No, M.O.
3074239	3074619	is Missouri.
3074659	3074999	Missouri.
3075019	3075819	I don't know why I thought that.
3076640	3103076	El Cajon, Superstition Springs, Arizona, Chapel Hill, Ohio, Ridgefield, Minnesota, Galleria, Texas, Butterfield, Illinois, West Hollywood, California, Ann Arbor, Michigan, Gwinnett, Georgia, Hialeah, Florida, South Tampa, Florida, Mount Laurel, New Jersey, Manhattan, New York,
3106250	3108733	Landmark Massachusetts, and Midtown Manhattan.
3109013	3110655	Seriously kids, why bother though?
3111055	3111515	Why bother?
3111615	3111936	Because...
3112797	3126388	Some kid with a minimum wage job and no life outside of that that plays video games all day long that can take the days off of work and ask his boss, you know, can I get Friday off work, is going to camp out for three days.
3126928	3128249	So you're screwed.
3128429	3129190	So why bother?
3129350	3134874	I mean, now that the list is on the internet of exactly which places are going to be doing it, people are going to be driving in from far away.
3135195	3136396	Somebody is going to beat you to it.
3136616	3137937	So I say why bother?
3139744	3145487	If anybody really wants the specific store number, just email us or something.
3146908	3149009	Just go to any big blog you look at.
3149049	3149830	They all have the list.
3150150	3154732	For the ones asking about West Los Angeles, it's store 109, whichever one that is.
3156493	3158634	So, yeah.
3158754	3159595	Have fun waiting in line.
3161499	3161960	Now, I don't know.
