start	end	text
3916573	3928823	Well, lately it's becoming more and more, quote-unquote, scrubbified with all these newbies trying to act like they know what they're talking about without asking questions beforehand.
3929404	3934408	So, I know, I'm one of the, quote-unquote, old-school people here,
3935526	3947608	And respect is still there, but these newbies coming up, they need to either just sit there and watch what's going on or ask sensible questions because this immaturity is just not working.
3948829	3953330	So do you have any final thoughts or words that you want to leave with the listeners?
3955150	3957470	All I've got to say is, Step Squad for life.
3958611	3959011	Works.
3960411	3960551	Yep.
3962214	3966517	And I'm going to go ahead and add my personal note that I totally 100% agree because Test Squad owns.
3967778	3968038	Thank you.
3969499	3971480	And we have more interview fun.
3971560	3971920	Yay!
3971960	3976343	So go ahead and for our listeners, go ahead and state your name and your history with the Bimani community.
3977384	3978084	Let's see.
3978104	3982667	I'm ShadowMeTwice and I like playing DDR.
3983127	3987390	And I've been playing DDR for like two years.
3988050	3989171	And yeah...
3991400	3993020	That sounds absolutely awesome.
3993680	3996641	So what is your participation with the tournament today?
3996681	3999801	Are you competing or moral support or immoral support?
4000822	4004442	Well, I guess I'm just here for moral support, just hanging out.
4005322	4009943	And if Dark Sound lets me, I might do my little old school routine from back in the day.
4010003	4012184	Otherwise, I'm just going to stand and hang out.
4015064	4016684	That sounds pretty groovy.
4017184	4019605	So what do you think of the competition so far?
4019665	4020625	How do you think things are going?
4021667	4026410	Well, I don't know too much about PA, but it looks pretty good.
4026750	4034515	I know I see some pretty good people here, like Virtu, and I know Mononeko Jazz is here, so he's good stuff.
4036317	4039639	I'm waiting for that freestyle, though, and I'm wondering if the webcam is working.
4040960	4045983	I know, I'll have to check on the cam, but from the last I heard, I think that everything is supposed to be a go, so...
4046827	4051750	So do you have any final words for the Bimani community or for our listeners or anything?
4052871	4056954	Yes, keep on playing the DDR and the Bimani.
4058015	4058415	Thank you.
4060616	4066220	Hi, go ahead and state your name and involvement in the Bimani community for the listeners.
4068222	4069182	Can you repeat the question?
4070703	4074085	For our listeners, what is your name or your nickname and...
4075678	4077539	Your history with the Belmont community, so the listeners know.
4079180	4085344	My name is Emphasis, and basically I just go to Sunnyvale Golf Land every Saturday.
4086785	4089047	So what's your participation in the tournament today?
4089927	4095111	Well, I just got to the second round, and I was first in qualifying.
4095131	4096852	That's for Perfect Attack?
4097272	4097492	Yes.
4098073	4099474	Are you doing a freestyle at all?
4100134	4100394	No.
4101455	4104337	So who do you think is your strongest competition in Perfect Attack?
4105575	4109796	Basically, Oki, because his scores in doubles Oni are insane.
4110697	4111037	Okay.
4111697	4115378	So, what's your view of the Bimani community as it is today?
4116278	4117279	It's getting worse.
4118719	4119299	Like in what way?
4120239	4125741	More, it's just, too much, as you say, drama.
4126821	4128002	Drama sucks.
4128302	4130903	So, do you have any final words for the listeners?
4132003	4132103	Uh...
4133639	4135440	Freestyle takes creativity.
4135540	4137321	PA takes nothing.
4137922	4139203	That's why I PA.
4140443	4140804	Thank you.
4142124	4143886	What's with all this hate for PA today?
4146087	4146967	It's really boring.
4146987	4147548	It was long.
4147808	4149609	Yeah, very long, like six hours.
4150269	4152031	It's as exciting as golf is.
4154432	4157454	There will be a tournament one day with exciting PA, I guarantee it.
4157878	4164102	I'm telling you, when they start doing the trivia questions mixed in with PA and start beating people with bats, when they get questions wrong, that will be the day.
4164762	4170046	It is something I would like to do for the next PA if we do a tournament here in Sacramento, which, by the way, we are trying to plan.
4170326	4172407	We'll have details on that for you as soon as we get them.
4173108	4175069	Nice little distant plug there.
4175129	4176050	And now back to the interviews.
4176910	4179192	This is round 20 million for the interviews.
4180072	4184015	Go ahead and state your name and your history in the Baymani community for the listeners.
4184810	4185971	I'm Paulo Zambrano.
4186252	4192377	I go in the DDR community as Rock My Socks Off, and in the Poetry Slam community I'm known as the Freaky Funky Space Monkey.
4192818	4194279	Isn't that a flavor of Ben and Jerry's?
4195140	4196621	I have no idea, but this guy was cool.
4196821	4197722	Alright, he sounds pretty cool.
4197742	4204289	And I've been involved in the Binami scene for about two years, although I've been playing DDR for about a year and three months now.
4205870	4209914	So are you in here competing or moral support, immoral support, observing?
4210778	4217784	Actually, it's really funny you bring that up because I'm doing a documentary about DDR in the Bay Area NoCal scene.
4218365	4220627	And let's see, I didn't pre-register.
4221167	4223489	I don't have a tripod, but I have a camera.
4223969	4231076	And the only way that Ruben or DarkSound is going to let me get in the actual pit area where all the freestyle action is going to go down.
4231456	4234899	So I actually register under freestyle, I suppose.
4235539	4241641	So I'm probably just going to register under freestyle and own the waste of time bracket just for the hell of it.
4243101	4246202	And who do you think is going to be your number one competition in the waste of time bracket?
4248582	4249203	I don't know.
4250763	4251943	All I know is I'm going to own it.
4252103	4253684	Let's just put it that way.
4253704	4255204	How's that for an honest answer?
4255664	4258465	So what's your view on the Beimani community so far?
4258505	4260685	I mean, especially in regards to that documentary you're doing.
4261386	4262926	It's hard to say actually because...
4263633	4285989	It was really, from what I could observe in the SF scene, it was really going down, then it was going up, with the whole rise of Riptide Arcade as being hailed as the golf land of SF, but I would have to say there's a lot less, I'm not sure, from what I could tell, unity in the community for so right now, because there's a lot of, I don't know, disenchantment, I suppose, and a lot of noobs getting in the community.
4286009	4288491	I'm not saying that's a bad thing, because we were all noobs, but...
4289031	4294453	It's a lot of cocky noobs and a lot of cynicism from the old schoolers, so that's what my take on it.
4295634	4300996	Would you have any advice for new players or just for the listeners in general?
4301056	4301597	Any final words?
4302977	4305939	Advice-wise, let's put it this way.
4306719	4313462	I'm still a noob, although, I don't know, different standards, but just keep doing it, keep trying.
4314602	4316143	Can I swear, actually?
4316303	4317464	Fuck what everyone else has to say.
4318952	4319673	And last words, uh...
4335077	4337958	Yeah, my doc is going to be out later this year.
4338978	4339618	Come see it.
4339718	4342559	I'm going to sell it to PBS and become moderately famous.
4343319	4344939	And, yeah, thanks a lot.
4345019	4346619	I like how he says he's not going to be famous.
4346659	4348640	He's just going to be moderately famous.
4348940	4351140	Like, you know, like a local celebrity.
4352681	4358522	Moderately famous, like the woman, the British woman that insults everyone.
4359642	4360822	I forget what show it's called.
4361622	4362703	You are the weakest link.
4362743	4363063	Goodbye.
4363883	4364243	That one.
4365889	4368111	He'll be more famous than that for a DDR documentary.
4368812	4370814	It's moderately famous because I don't know her name.
4372795	4373396	And something.
4375578	4376939	Damn it, now it's going to kill me all day.
4376979	4377920	My point exactly.
4379001	4379321	Shit!
4379421	4380302	Alright, back to the interviews.
4381463	4381783	Thank you.
4383064	4384926	And now we have more witty words of wisdom.
4385706	4387128	I dance to heal the world.
4388542	4392604	I prefer the Marilyn Monroe painting myself, but hey, to each his own.
4392684	4394405	I'm doing yet another interview, so...
4417145	4423346	If you don't mind, go ahead and give us your name and association and history of the Baymada community and whatnot.
4423826	4426127	Hi, I'm Megumi, also known as Sweet Megumi.
4426627	4428307	I am part of Pet Squad for Step Squad.
4430368	4432468	And what's your history in DDR?
4432708	4435609	I play DDR and I go to tournaments and I work for tournaments and stuff.
4435629	4440490	I don't usually enter them, but I'm there just... I'm interrupting this to say I looked it up.
4440530	4441530	It's Ann Robinson.
4441790	4442191	Thank you.
4442731	4443331	Ann Robinson.
4443751	4444171	See you, everyone.
4445132	4446294	and Always Friendly.
4446755	4447997	Yes, the girl in the pink.
4448498	4448699	Yes.
4449239	4450862	So, what do you think of the tourney today?
4451604	4452325	It's pretty cool.
4452365	4458676	There's a lot of people that I haven't seen for quite a while and I like the way Ruben has this set up as like, you know, the green room type of thing, so...
4460261	4464565	Who do you think is going to come out on top for PA or for Freestyle?
4464985	4467106	Of course I'd say Oki because he's my favorite.
4467667	4470309	And Freestyle, I don't know who entered.
4471670	4473591	If AJ's here, he'll probably win it.
4473691	4474732	If not, I don't know.
4476393	4482758	Do you have any final words for the listeners or for the community or any sage words of wisdom from observation?
4485680	4486320	I don't know.
4486440	4488061	Just play DDR.
4489694	4490835	Indeed, how honest.
4492636	4493677	And by the way, Stas Kwarant.
4494217	4496218	Yes, we do.
4497599	4498940	Anyway, thank you.
4500321	4501101	No problem.
4503263	4506565	And the newest in line of interviews for Orange Lounge Radio.
4506685	4510107	Go ahead and tell everyone who you are and a little bit about your involvement in the community.
4510583	4516046	What's up, yo, this is Jay Kinetic representing the SSF Step Squad family as well as the Step Squad Assassins and Pet Squad.
4516366	4521108	I've been playing this game since some of you didn't even know 1.5 was back in MGL so I could be considered an OG.
4522429	4527091	Basically, Step Squad was formed in order to bring more of a family element to DDR.
4527151	4534655	We wanted to be the alternative to most of the DDR free communities out there that are biased against gender, race, sexual orientation, you name it.
4535415	4564530	and we have about 30-35 players right now who are dedicated to the game as well as getting each other through tough times and just being there for each other like family I guess I have to say one thing that I need to comment is that the squeal of daddy in the background was Draconis' daughter Lily who is famous for she's also known as Fuzzy Half and is also famous for the quote this DVR sucks so I just thought I'd mention that because you can hear alrighty you sure nobody was tied up at the tournament or anything like that
4565208	4567469	There was no bondage going on at the tournament that I saw.
4567549	4568049	What a shame.
4568789	4579353	So, as far as tourney goes, are you competing or working or, you know, how's your involvement with this tourney here?
4579893	4583314	Today I'm out in my SSA uniform, I'm providing security.
4583394	4588876	We haven't had too many rowdy people, so I'm sitting here enjoying the Heineken courtesy of my friends Wendell and Cy, what's up Thieves Guild.
4589845	4591966	But normally I do compete in tournaments.
4592006	4599869	I didn't have time to prepare a routine this time, but the next tournament I'm looking forward to is Scandia or the Disney's Rave Tournament, where I might pull an improv, I don't know, as well as PA.
4600970	4605612	So far for the PA or the freestylers in each category, who do you think is going to come out on top?
4606072	4611534	I'm hoping that Jazz comes out on top of the PA-ers in this particular tournament.
4611835	4612955	Freestyle is still unpredictable.
4612995	4615516	I'm still not sure who's entered, so I'm going to try to keep a close eye on that.
4615536	4617277	We're going to be hanging out here until about 9 o'clock.
4617657	4618638	But it's always a good crop.
4618658	4622219	We have some of the most skilled freestylers out here today.
4622259	4626842	We got Rain from RTF out here, Fuzzy Hat from Step Squad, just newly inaugurated.
4626862	4627362	He's here.
4628022	4628443	Wendell's here.
4628463	4629523	I'm not sure if he's competing.
4629563	4631404	It's going to be hot competition as normal.
4632124	4637027	So what's your view on the Bitmoney community currently and what type of advice would you give?
4638059	4642004	Um, okay, if you're just starting out, the main thing is, just go for yours.
4642065	4645108	Just do what you want to do, and do you.
4645509	4649394	Don't try to emulate what you see in the videos exactly, but get tips from it.
4650035	4650756	DarkSakura, DarkSakura.com
4668730	4678593	I feel that there are a lot of online communities such as DDRspot.com, DDRfreak.com, and the Step Squad message board, plug ourselves in there, that provide a quasi-decent environment.
4678633	4686175	I say Step Squad out of the three does, but then again we're kind of a gay community in that respect because we only let in people that we know are people that are part of the squad.
4686195	4689916	It doesn't mean you can't visit, but the reason why we keep it that way is because
4690974	4697740	It gives all the players involved the chance to grow rather than having to deal with the prejudice and stereotypes of the DDR community at large.
4699221	4701663	This doesn't mean that the community at large is a negative thing.
4702383	4709548	Jason Ko, alias J-Dog, you may know him from the DDR Freak Boys, has encouraged a very large, very skilled community.
4709828	4715913	It just means that with that exposure that you get from interacting with that larger community, you may encounter more prejudice and more stereotypes.
4716193	4722457	Because for every one intelligent person there is, there's at least another nine who are like, Oh, I'm AZN and I'm Lee because I can pass all nine counters.
4722637	4723258	That sort of thing.
4723898	4734722	So, I feel that the community is growing and I hope to see it progress a little bit more in the United States, even though Konami of America can kiss my ass because they screwed us, but at the same time I still think it's going to grow.
4735442	4736242	I didn't get screwed.
4736682	4737422	I didn't get screwed.
4739143	4740003	Why weren't we invited?
4740663	4744745	I still think people are going to be playing it in the States, and if not, hell, I'll go play Pump It Up, I don't care.
4745605	4748526	So, do you have any parting words for the listeners?
4749489	4766996	Shoutouts to RTF, Gary, Shintenshi, NoSkills, pretty much everybody in there, Rain, this is way too many heads of shoutouts, StepSquad, THC, TCL, Tag, the DJ Trunks message board, Orange Lounge, where he put me on this interview.
4767136	4768796	I'm on my third beer, I'm about to go get a fourth.
4769457	4772318	Jessica, Under Sedation Live, go to that website.
4772578	4774159	That show is funny as hell.
4774179	4774959	Thank you, thank you.
4775119	4776840	Travis, Ross...
4778735	4780719	Shouts to NorCal DDR, keep it live, man.
4780739	4781801	These other people getting lazy.
4781841	4783164	Tequila, shout out to him.
4783424	4786830	Shout out to nobody but Jen representing NY and the whole movement, basically.
4788273	4788614	Thank you.
4789312	4789812	It's what I do.
4789832	4790673	Thanks for having me on, Jamie.
4790913	4791233	Always.
4819352	4821233	and getting some random interviews around there.
4821353	4823075	So you never know.
4823215	4824195	Yeah, you better watch out.
4824415	4827397	I'm going to be running around the bay with a tape recorder and I'm coming after you.
4828318	4833321	Anyway, a big hello to all of our new listeners tonight listening in for our coverage of the Dollar Mendy Tournament.
4833521	4839325	If you want to join our chat room, just join Channel Orange Lounge on any other side IRC server.
4839345	4843768	That's the server that hosts all the big Bimani channels like DDR Free, 2DX Styles, all those big channels.
4844148	4846730	We're on there too under Channel Orange Lounge.
4848184	4850946	And I'm being given some results from SoCalKicks.
4850966	4854848	There was another tournament that happened over the weekend, and that was the Power Station 2 tournament.
4855388	4865814	And in PA, the first place winner was Trunks, second was Frost, third was LazyPinoy, and fourth was... How do I pronounce?
4865854	4866595	I don't want to mess it up.
4866895	4868156	You've seen this before, I haven't.
4869830	4871271	Senai Butterfly, is that how you say it?
4871371	4871651	Thank you.
4872132	4875695	Freestyle, first place, Kenny Wood with Santa doing doubles.
4876115	4879278	In second place with Hungry Asian, he doesn't remember the song.
4879458	4881739	Then Jenith with Remember You.
4882380	4885823	And then Senai Butterfly again with Let's Talk It Over.
4885883	4890787	And there's pictures at 2dxstyle.com slash sck.
4891207	4894189	And it was all held on a fifth mix machine.
4895070	4896111	Pretty good stuff.
4898070	4904394	So, also I should plug our Bomani Music and More program, which is always on this network when we're not here.
4904874	4908717	All the music from DDR, 2DX, and Dance Mania series.
4909177	4910898	And there's other random stuff in there too.
4910938	4911879	Busta Groove, Parappa.
4911899	4912639	We are indeed random.
4912679	4914560	We'll play whatever the hell we feel like playing.
4914600	4917282	Bomani and More on a dialogue-friendly stream.
4917802	4920484	Yeah, I did Channel Orange Lounge on the other side of the RC.
4921285	4923606	And one other thing, the Monday night rebroadcast.
4923626	4929791	If you missed any part of this show, if you missed our first set of interviews, we had a lot of people in the first set of interviews, we do rebroadcast this show.
4929871	4932132	We'll be rebroadcasting these shows on Monday nights.
4932533	4938857	So tomorrow night on August 19th, tune in at 7 o'clock Pacific Standard Time for the rebroadcast of this show.
4939277	4940839	And actually, we'll be doing it twice.
4940859	4943561	We're going to rebroadcast it at 7 o'clock and 11 o'clock.
4944915	4946776	Because you're special enough to have it twice.
4973426	4974566	Oh, one other thing, the email.
4974926	4981668	Any songs you want to hear, any comments on the show, marriage proposals for myself or Jamie, send them along.
4982088	4983149	We'll just refuse them though, sorry.
4983409	4986350	Go ahead and send us some hate mail too because we need some comedy.
4986410	4988470	We did get some hate mail a couple weeks ago.
4988510	4989530	That was fun.
4990131	4994092	That guy was like, I'm not going to say anything because I'm nice and he was retarded.
4994192	4998673	Send all your love and hate mail to orangeloungeradio at yahoo.com.
4998693	5000133	That's all one word, orangeloungeradio.
5000973	5002794	You want to intro this next song for us, Jamie?
5003419	5005341	This is the one you were searching around for.
5005361	5006422	Let's just make it a surprise.
5006663	5007664	Let's just make it a surprise.
5007884	5009826	It's not the full version, but it's close enough.
5009886	5014071	We're going to take a quick break, and when we come back... More interviews!
5014111	5014752	Listless.
5015092	5016454	We'll do the interviews at the end of the show.
5016474	5017134	We're going to do listless.
5017154	5019237	We're going to do a really quick listless segment with...
5020054	5022557	Best DDR Background Best 2DX Song
5036974	5037875	was Absolute.
5038075	5038595	Absolute.
5038736	5042739	Best 2DX video was Love is Dreaminess.
5043139	5049645	And the worst Bomani song in history, next to Let Them Move, because Let Them Move is already assumed the worst Bomani song in history.
5049805	5050886	Bye Bye Baby Balloon.
5050906	5053008	Bye Bye Baby Balloon was determined.
5053028	5055069	So that song will no longer ever be on our playlist.
5055089	5056991	That song is banned from our playlist.
5057031	5057511	We will never play it.
5057531	5063656	I'd like to add the future song that should be added to that list, and that would have to be Crash.
5064097	5065258	That song is ass, and
5065798	5067581	I just hope it doesn't get worse than that.
5068543	5073631	The name, contrary to popular belief, is not after, you know, an accident, although the song itself is an accident.
5073671	5074453	I'm sorry, what'd you say, Matt?
5078710	5080471	God, this is awful.
5080571	5082153	Breakdown, then Crash.
5082633	5083454	What's the next one?
5084154	5084615	Stall?
5085275	5085996	Alright, I promise.
5086696	5090159	Basically, the name is a combination of crap and ass.
5090579	5090899	Crash.
5091360	5096524	When we come back, Listless, and you have to be, if you want to participate, this is an audience participation segment.
5096804	5101888	You have to be in our chatroom, Channel Pound, Orange Lounge, on any other side IRC network.
5102088	5103449	Chatroom gets to participate in Listless.
5103889	5106191	Best DDR background when we come back from this quick break.
5112096	5112796	Thanks for watching!
5176147	5177488	Thanks for watching!
5228766	5229428	Run for your life!
5229488	5230490	Run for your life!
5334975	5336038	Thanks for watching!
5605604	5606834	DJ Ranma S
5646330	5646973	Don't break my heart
5698904	5699865	Thank you for watching!
5768713	5770295	Thank you for watching!
5791729	5796351	Let's listen in on an Orange Lounge Radio staff meeting.
5822848	5824188	Do we care what people think of us?
5824848	5826689	No!
5826709	5828149	Do we want people to kiss our ass?
5828609	5831530	Yes!
5832690	5834551	Extreme Bomani Radio.
5834771	5837492	That's us, Orange Lounge Radio.
5838314	5841135	You are listening to Orange Lounge Radio.
5841655	5846236	Tonight we've been doing some of the Dollar Mendy coverage from that big tournament in Concord yesterday.
5846256	5849516	We're taking a break to do Listless, one of our favorite segments here on the show.
5849916	5856318	We're going to be talking about tonight the best DDR background, that little image that comes up when you start the song.
5856658	5861819	It's an artsy moment for DDR, kind of showing off the graphics capability, or whatever you want to call it, I don't know.
5862880	5867145	We were kind of debating, there was a lot of debate in house about whether we were counting the videos or not.
5867446	5872412	And we decided, no, we're not going to count the videos, we're just going to talk about the actual backgrounds themselves.
5872492	5875536	Maybe we'll do DDR videos at a later date.
5876077	5878540	Now what's going to happen, you guys in the chat room...
5879884	5881345	are going to be able to vote.
5881725	5893149	We will give each our top three, and then we're going to go through an elimination round, where once we have that big list of 12 songs, there's four of us participating, we each get to take one off of the list.
5893789	5896050	And then those of you in the chat room will get to vote.
5896150	5900891	You're going to send me a private message in the chat room with your vote, and that'll be the winner.
5901592	5903392	And then we'll get back to the last...
5906092	5906752	All right, paranoia it is.
5906772	5907413	Matt, let's hear yours.
5931946	5939393	Okay, mine has to go for In the Mood for Dancing, because you've got that chick leaning over, and it's got the cleavage shot there.
5939593	5940253	So, that's it.
5941054	5941795	Alright, fair enough.
5942495	5943817	Dave, let's hear your number three choice.
5944357	5948881	Mine is Abyss, because it's got the two yellow aliens, or whatever they are, in the blue background.
5949161	5950422	Good choice, Abyss.
5950823	5954506	My number three choice is Conga Feelin', because I like that chick.
5954546	5955647	It's very abstract art.
5955727	5957629	She's got, what the hell is that coming out of her mouth?
5957669	5958970	I like that Conga Feelin' background.
5960811	5961712	Okay, so number two.
5961732	5963714	Alright, let's hear the number two choices.
5964154	5965756	Brilliant to you for the mecha thingy.
5967878	5969459	Brilliant to you for the mecha dog.
5969920	5971381	You're being very old school tonight.
5973563	5974364	What do you mean tonight?
5974384	5975165	I'm old school every night.
5975205	5975946	That's true, very true.
5977037	5978698	Don't send me your votes just yet, chat room.
5978718	5979638	We don't have a list yet.
5980459	5981139	You can't vote yet.
5981519	5983641	We have to have a list, and then you vote off the list.
5983681	5983901	All right.
5983921	5984381	Yes, Matt.
5984901	5988983	This would be considered the most offensive background I could find in DDR.
5989044	5991185	That would have to go to OhNickPleaseNotSoQuick.
5991205	5992145	Ah, OhNickPleaseNotSoQuick.
5992165	5994767	With the guy in the fucking underwear with the pistol.
5994827	5996588	That's just disturbing.
5997608	5998068	Fair enough.
5998148	5999369	OhNickPleaseNotSoQuick.
5999649	6002070	Okay, mine is Secret Rendezvous.
6002231	6003271	Secret Rendezvous.
6003311	6003611	Two chicks.
