start	end	text
2031728	2032589	No, I interviewed Radical too.
2033069	2033609	Oh, okay.
2033870	2035071	Oh, you did them both at once?
2035411	2039034	Sort of, it was mostly Corey, but... Oh, okay.
2039075	2039295	Cool, cool.
2039315	2041136	I didn't hear Bradical, I heard Radical.
2041437	2042157	Like that was his last name.
2042177	2042878	Radical, Radical, Radical, Radical!
2042898	2044540	Like, the Radical Virtue!
2046149	2047429	The 80s are making a comeback, you know.
2048009	2049650	So what are you doing for the tourney today?
2050290	2051030	I'm doing PA.
2052150	2052550	Anything else?
2054411	2054751	PA.
2055771	2056051	Cool.
2056251	2056791	And how did you do?
2058211	2059072	Oki beat me by two.
2060772	2061492	But you qualified, right?
2062032	2062272	Yeah.
2062692	2063673	Cool.
2064373	2070674	So just give us a little bit of your Bimani history and what you might be well-known for, even though probably everybody already knows.
2071754	2074195	I started playing Bimani back in 99 with...
2076010	2077771	The good old Beatmania Complete Mix 1.
2077811	2080553	Yeah, it's very quick master up in this piece.
2082414	2083535	And then I played DDR.
2084036	2084516	It was lame.
2085416	2088419	Then I got bored with Beatmania and then I went back to DDR and I was like, wow, this is pretty cool.
2089599	2091361	And I took it like an ass for two years.
2092481	2094463	Took it like an ass, in the ass, however you want to put it.
2096484	2098485	And then here I am now.
2100307	2101427	Big name that I don't want to be.
2103889	2104970	Yeah, he's taken my place.
2106369	2107530	Care to comment on that?
2109171	2109591	About what?
2110252	2111333	About taking his place.
2112654	2113234	I feel honored.
2115055	2115376	Yay.
2116637	2120119	So, who do you think is going to come out ahead for freestyle today?
2120820	2121840	Come out ahead?
2124502	2127825	Call me stupid for saying this, probably one of the RTF peeps.
2127865	2130227	If Tran comes, he's pretty strong and everything.
2132528	2133229	Mel, maybe.
2134584	2134965	I don't know.
2134985	2136205	I'll see what RTF has in store.
2136826	2139167	If anyone from ASK comes, they got it in the pocket, too.
2139187	2140768	I don't know.
2140808	2142009	I might pull something out of my ass.
2142409	2143790	Make an ass of myself like I do all the time.
2145811	2147873	There's that comedy section, too.
2148673	2149273	Yeah, that's right.
2149454	2150234	I might pull out another.
2150254	2151555	I might pull out another.
2152015	2153456	Wow, Brad just got blammed.
2153476	2154216	That's pretty harsh.
2154917	2157939	Can somebody explain to me what a blam is?
2159420	2160320	Beats the heck out of me.
2161041	2161361	Okay.
2162734	2167096	I'm hearing some interesting noises coming from the side that I'm not going to comment on.
2168717	2172159	So, do you have any final words that you want to say for our listeners?
2173259	2179162	Um, I'm not that special, quit making me something special, I play a game, I pass the song, whoop-de-doo.
2180163	2180843	And there you have it.
2182064	2182844	Oh my god, I was first!
2182864	2186006	So, we have now yet another interview.
2186546	2190428	So, go ahead and state your name for our beautiful and talented listeners.
2191718	2193319	My name is Mr. Wendell.
2193339	2194341	I am part of the staff.
2194701	2196263	I don't think any yet.
2196403	2198606	It was outside guarding the people who had to be hid away for P.A.
2208713	2212694	That's the reason he could keep up that act the whole time, is because he had influence.
2212834	2217576	If he had been drinking a lot later, and he can really chug fast, I saw.
2217676	2219037	Wendell is the beer master.
2219097	2221818	Is he like that beer guy on the man show?
2222418	2226700	He's not quite like the fox, but he's pretty fast.
2227961	2230041	Alrighty then, let's hear what else Wendell has to say here.
2230982	2233523	For the Dallarmandy summer vacation...
2236095	2238819	That reminds me, did Dollar Mendy ever make an appearance?
2238839	2240240	Because he was supposedly in town.
2240461	2241242	No, he didn't.
2241422	2242163	What a bummer.
2242183	2244726	Are you just staffing the day and not competing, or are you competing?
2246289	2249453	I'm also competing.
2250641	2256945	and you're doing what's this?
2256965	2265771	I am doing single freestyle and comedy.
2268633	2272255	So what do you think is going to happen so far for Trader Day?
2272275	2277519	Who do you see coming ahead for Perfect Attack and who do you think is going to be your fierce competition for freestyle?
2278183	2283567	Well, there's a lot of really good double freestylers that, well, double PA-ers, I should say.
2284307	2289791	I mean, right now, I have in my jail this little twerp by the name of Emphasis.
2290311	2292493	You know, he kind of, like, beat me during the Royal Rumble.
2293273	2295495	And I had to, like, give him a pile driver, you know.
2296556	2298197	I have witnesses for that.
2298397	2300838	But he's a really good kid.
2301299	2302279	He can do doubles pretty good.
2302620	2307263	There's also another little kid by the name of Maneke Nekajavs.
2308092	2313895	He's kind of like tall, he's redhead, you know, looks like a monster, but he's like a teddy bear.
2318498	2323821	And we also have like that wacky little guy by the name of Okimoto.
2324141	2326723	Yeah, he, that boy, good.
2328166	2330868	And who do you think is going to be your competition in freestyle?
2331229	2334672	Well, there's a lot of really good competitors.
2335492	2342518	I see a lot of really good freestylers, but you have that Hypnotix dude.
2343219	2346081	He's got that Darren's Groove thing going.
2346621	2351085	I also see that Fuzzy guy, Fuzzy Torso.
2357220	2360182	or whatever he's got fuzzy on him.
2360342	2362123	I don't know, you know, that's not my thing.
2363483	2371388	We also have the crazy, wacky players, and yeah, they're going to be really, really good.
2371748	2379952	There's just so many right there that are really, really good, and I can't say that I have much competition for them, but I'll do my best.
2380573	2383014	I think you'll do a good job because that stuff's well-earned.
2384187	2389592	Well, we represent Step Squad as a good organization.
2390854	2391915	It's really all about family.
2392655	2399582	We do our best to promote peace in the community.
2401284	2408631	We go out there and promote the freestyle, make sure that nobody does them hand slaps, do them knee drops, bump their head on the floor like I used to do back in the day.
2409580	2417043	But, you know, we try to have fun and make it an entertaining scene when we do tournaments.
2417163	2418364	And just, hey, have fun.
2418444	2420025	So you're having a good time so far?
2420865	2424407	I'm having a very awesome, entertaining time right now.
2425147	2428708	Even though I'm kind of like running staff and running this little jail right here, you know.
2429009	2429949	I have my big old fan.
2430509	2431990	You know, guys try to escape.
2432230	2433010	I have the Wilson butt.
2433431	2434331	But, you know.
2435126	2436067	Ben What's Ben's online name?
2455186	2456367	I couldn't remember right now.
2456427	2457467	It sounded like Chubbs.
2457487	2457927	Was it Chubbs?
2457947	2458307	Did you remember?
2458327	2458728	Yeah, it was.
2458768	2459528	Okay, that's what I thought.
2459548	2461329	For a moment, my brain was like totally flipping.
2461449	2461889	That's what I thought.
2461909	2466071	But I heard this before the show and it was never made clear, so I thought we'd state that.
2466331	2467752	What are you doing here at the tournament today?
2468372	2475115	I'm competing in Perfect Attack and I'm part of the staff, moving machines, kicking people out and stuff.
2476355	2477796	Sounds like grueling work.
2478796	2479637	It's free pizza.
2480625	2482246	That's always a good reason.
2483126	2486107	So what do you foresee happening for Perfect Attack today?
2486147	2487408	Who do you think is going to come ahead?
2487488	2489129	I think Oki will sweep.
2493230	2494231	Oki's going to win first.
2494811	2495491	Corey's going to fail.
2496972	2497232	I see.
2498352	2501494	And what do you see happening for Freestyle Literature?
2502254	2506816	I haven't really looked over the list, but I'm pretty sure Fuzzy Hat will come up as some improv.
2508091	2514054	Uh... Hypnotics might win, and... Kyle Snyder will entertain us all.
2514514	2515595	But Kyle Snyder never showed.
2515615	2515895	Indeed.
2517035	2522978	Um, so just to go ahead and give everyone a little bit of history, you know, what's your history in the Demani scene?
2523598	2527140	Well, I've been playing at the Boardwalk three years ago, two and a half.
2528320	2532522	Uh... My first big tournament was March Madness, which was about six months ago.
2533182	2536964	Until then, I've been at every tournament, pretty much, since March Madness.
2537651	2538971	All right, well, thank you for the interview.
2539711	2540152	No problem.
2541732	2542812	More interviews, yay.
2543232	2543472	Yay.
2544413	2552454	I got another person to interview, so go ahead and for our listeners, state your name and your brief history in the Bimani community.
2552975	2553815	What's your favorite color?
2553835	2555415	My brief history in the Bimani community.
2556435	2557356	It's a community?
2559876	2560676	More like a commune.
2561136	2563257	Yeah, a communist party.
2564312	2564832	Let's see.
2565673	2566774	I'll tell you what it's more like.
2566834	2568255	You ever hear about Waco?
2568535	2569496	Big bread party.
2573839	2574259	Thank you.
2574299	2575019	Somebody got a bus.
2576260	2576781	Let's see.
2577321	2578942	I go by the name STI.
2581244	2582144	What, my brief history?
2583105	2593412	I'm one of the three original founders of Step Squad, which is me, Jay Kinetic, and Strider, Vegeta.
2594261	2594721	A.K.A.
2594761	2595161	Strizzy.
2597162	2597682	Let's see.
2599163	2607646	I've entered too many tournaments to count, and just now I've actually taken it seriously on freestyling.
2607726	2613089	So instead of just half-assing everything, I might as well do a routine.
2614569	2616890	Last time I got a routine, but I failed the song.
2617350	2619051	Oh well, giving another shot again.
2619271	2620272	So that's why I'm here.
2621032	2623693	What do you think of your competition for freestyle today?
2625633	2632198	The dudes from Ass is like really good, and I think there's like two other people that are doing the same song I am.
2634459	2638602	I've been practicing it today, but I've been moving alright.
2640564	2641845	I don't know, man.
2641905	2642665	Wendell's cool.
2643846	2649470	I don't consider him competition, so I don't care how high a place or whatever, and...
2651445	2653006	I don't even care about placing.
2653026	2656970	I'm just going to have fun, do what I'm supposed to do, and entertain people.
2658231	2661093	That sounds like a really good philosophy to have.
2661433	2668679	I've noticed that some people get really, really heavy on the competition, on the have-to-be-better aspect of me.
2668699	2670160	What do you think of that kind of attitude?
2671141	2673803	Yeah, it's like I had this mentality.
2673823	2678067	I was like, oh, man, I have to place top five, and I never end up doing it.
2678107	2679848	So it's just like, you know, forget it.
2679888	2680349	I'm just going to...
2681334	2687437	Do what I want to do, just dance and just entertain people, just show off some dance moves, whatever.
2688797	2689278	I don't know.
2689678	2691219	I'm just going to go do my thing.
2691239	2693159	I don't care if people don't like it or whatever.
2693179	2695761	As long as I have fun out there and I feel okay.
2695781	2697882	Do you have a final word for the listeners?
2699542	2700023	Yeah.
2702404	2702804	Word.
2705565	2705985	Indeed.
2706986	2707246	Thank you.
2707688	2711854	Alright, that's it for the first round of interviews there from Dollar Mindy's Summer Vacation.
2712435	2713436	And it was quite fun.
2713756	2713977	Yes.
2714437	2715519	What did you think of that?
2715599	2717141	Good group of people to interview there.
2717944	2719605	They were all very good about it.
2721126	2725248	Thank you all for putting up with me shoving a microphone up your nose or anything.
2725588	2729430	No complete drunks yet, but... Not yet, but we get them later.
2729630	2732471	But we do have more sets of interviews coming a little later in the show.
2732491	2735052	There's a great interview with Jahi in the second set of interviews.
2735252	2736033	Oh, that was fun.
2736513	2739795	And in the last set of interviews, you've got DarkSound.
2739815	2741676	You're interviewing him, the master of the tournament.
2742236	2746458	And the reason why the webcast on DDR Freak didn't end up happening...
2747038	2750619	So for those of you that were curious about what happened there, he gives the explanation.
2750679	2751099	It's all there.
2751119	2752559	We're going to play that for you a little later in the show.
2753119	2761141	In the meantime, if you weren't listening to the show a little bit earlier, we played for you Memories, the new Naoki featuring Paula Terry song.
2761421	2765042	And that was given to me from our chatroom comedian, Pyro Man.
2765622	2769203	And I promised him, since I played that, that I would play Destiny.
2769263	2770203	So I will play Destiny.
2770703	2776666	Right after Destiny, we've got two brand new 8th Style songs we're going to premiere for you right here.
2777247	2779448	Virtue from 2DX Style, big thank you to him.
2779568	2783750	Go ahead and visit 2DXStyle.net for all the latest and greatest 2DX news.
2785971	2786652	If you haven't already.
2787272	2791674	And we're going to hear some new stuff from 8th Style, thanks to those guys there.
2791754	2794396	So let's first hear Destiny and then we'll get to the 8th Style stuff.
2794696	2796577	Here on Orange Lounge Radio.
2813480	2814094	Thanks for watching!
2896297	2899338	Alright, as promised, here we go with some new 8th style tracks.
2899758	2904020	This first one is DJ Taka with M. And by the way, this is the first time I'll have even heard these.
2904420	2907642	Any of us in the room will have heard these live here on Orange Lounge Radio.
2907682	2910143	From 8th style, DJ Taka with M.
2971324	2972212	Thanks for watching!
3019195	3021316	from 8th Style here on Orange Lounge Radio.
3021336	3027779	That was DJ Taco with M. Big thanks to the folks at 2DXStyle.net and 2DXStyle.com.
3027919	3028639	They both work now.
3029340	3031240	And they've been yelling at me because I haven't been saying .com.
3031280	3032721	I guess that's how they're going to promote it now.
3032761	3034202	Although it was .net, but whatever.
3034922	3038864	Anyway, we were thinking, sounds a lot like V, doesn't it, that song?
3041246	3042967	That song is ass, okay?
3043107	3043867	That was crap.
3043927	3044888	What the hell is he doing?
3045208	3048470	I'm going to take a classical piano piece and add a beat to it.
3049050	3049490	Oh, gee.
3049790	3051911	Why don't you just throw Impolitary into there, too?
3051991	3052752	That would be even better.
3052892	3058895	That would make it sound... Chatroom is very... They're racking their brains trying to figure out what original piece that's based off of.
3058975	3060475	Bradley thinks he has it figured out.
3060495	3061116	Why don't you tell him?
3061456	3062396	It's from Moonlight.
3062416	3063417	It's another vibe rock.
3064139	3064779	DJ W with Gemini
3201181	3206626	That's DJW with Gemini, and we do believe the category for that will be elevator music.
3206746	3207767	God, that was awful.
3207867	3208427	I'm sorry.
3208447	3209508	No, that's mall music.
3209809	3210369	God.
3210469	3212451	Makes you want to take a nap or go shopping or something.
3212551	3213191	I didn't like it.
3213672	3215273	That's just my opinion here on Orange Lounge.
3215293	3216895	I preferred M much more to that.
3218116	3219197	I disagree with Loki.
3219357	3221038	I kind of dug M. It was cool.
3221078	3223460	I like that whole classical remake thing, but...
3224721	3226042	He does need to kind of reinvent it.
3226082	3226843	It's kind of been done.
3226883	3228784	We've had V, we've had A, Kakumei.
3229245	3231386	It's time, okay, M better be the last one.
3231426	3233188	It needs to go in a different direction from there.
3234389	3236750	Well, it's not that I don't like that genre of music.
3236790	3240393	I mean, Piano Ambient is awesome, but it's just he didn't do anything with it.
3240433	3241694	He just added a beat to it.
3241714	3247699	I mean, do a little bit more than just add a beat to the music, because it's really old.
3248419	3248780	That's all.
3248900	3249280	Quite old.
3250862	3256731	Well, I'm kind of wanting things to go back sort of old school, how the songs used to be in Beatmania.
3257171	3259555	I want 5-key style stuff, you know.
3261201	3261802	Thanks for watching!
3282446	3283307	I miss 5Key.
3283467	3284147	I miss it already.
3316801	3317582	Super Populence!
3317602	3318022	100 Combo!
3318042	3318622	Pretty good!
3346552	3362667	I don't wanna know what they say, no, no, I don't care They can't tell me nothing, I'm gonna go my way One, two, three, four, five, break the dollars, get out of here Come with me now, now we are going out
3382748	3389435	I know which way to go, just keep on going There is no time, no time to be wasted now 1, 2, 3, 4, 5, now is the time to get out of here
3409778	3414581	From StepSquad to OrangeLabs, this DDR sucks!
3414941	3415481	Holler!
3415661	3415741	P.S.
3415761	3416102	TTPO!
3425794	3430116	Our thoughts on the Mr. Brian and the Final Band with Crash from Euromix 2.
3430156	3431837	That song fucking sucked.
3432197	3434498	That was the biggest bit of ass except the guitar was cool.
3434718	3439921	Let's remove the Japanese singer and throw in a kindergartner who sounds like an old man singing crappy lyrics.
3440541	3441502	Breakdown.
3442202	3447605	Lyrics by Mrs. Kimball's kindergarten class sung by this stupid guy.
3447845	3448665	That's really what it is.
3448825	3449486	It's just crap.
3449526	3453508	Let's take a crappy song and add a crappy guy to it and we'll get some more crap.
3454583	3459288	Hey, why don't they just make another... I know, he could sing Firefly, too.
3459688	3461550	Or, I know, why not sing Dive?
3461811	3464894	I'm sure his voice would sound awesome on Dive.
3464954	3466696	Or True, you know, he'd be good for True.
3467497	3470720	According to the chatroom, it's white guys trying to do breakdown in English.
3471801	3473923	So anyway, wow, that was really bad.
3474023	3474163	So...
3476459	3493974	On behalf of Orange Lounge Radio, on behalf of the lovely DarkSakura co-host, on behalf of myself, Sky co-host, I would like to offer an apology for wasting one minute and 44 seconds of your life with that utter piece of crap song that is known as Mr. Ryan and the Final Band.
3494975	3497377	Will you please ever forgive us for that?
3497797	3498778	Send us money if you do.
3501833	3505136	Many can be sent to, you know, Jamie Summer's care.
3506017	3511243	Do I smell, yeah, DDR Max USA exclusive track.
3511303	3512725	Oh, no, wait, no, it wouldn't be exclusive track.
3512785	3515087	New original for DDR Max USA, though.
3515187	3516228	I can just see it right now.
3516268	3521674	It smells like the festering pile of shit that DDR Max USA will probably become.
3522655	3523656	Maybe not.
3523696	3524157	Maybe not.
3543171	3544853	I wanna do my fuck you of the week
3560526	3566089	Jamie likes to get all pissed off at something every week, and we call it Jamie's Fuck You of the Week segment.
3566209	3567070	I'm getting ornery!
3567350	3571872	She's not always the sweet, innocent moderator that you might think she is.
3571912	3573333	Bullshit, I'm sweet.
3574133	3578995	I try to be, but, you know, after keeping it pissed up inside, I have to let it out.
3580436	3583458	Okay, so, let's get to Jamie's F.U.
3583578	3583918	of the Week.
3585675	3594319	Okay, my fuck you of the week goes to, um, I forgot what my fuck you of the week was gonna be.
3594679	3599221	Oh yes, fucking Fantasy, in like seven of all things.
3599301	3611427	Okay, I've been, you know, Iguana Girl has been very nice to let me, you know, trade out my fifth style with her to play fourth style, so I've been, I said I'm gonna, you know, finally beat Fantasy and pass that back, because...
3613028	3622673	I haven't been playing 2DX that long, and I've always been slow with picking up some of the stuff for the running runs, although once I learn something, I really don't forget it.
3623734	3627096	So I've been struggling with fantasy, and I've been getting 72, 76, 78, 78, 78, 78...
3631398	3637479	Every damn time I play the song, so I want my fucking border bonus, and it's about goddamn time that I get it.
3637779	3638699	And then I can give it back.
3638819	3641100	Although, on a good note, I did finally pass a check or two.
3641940	3642520	Well, you go.
3643340	3651402	And I am probably about a couple weeks away from having my first seven-star beaten.
3652202	3652942	Yeah, you're very close.
3652982	3653662	I saw you play it today.
3653702	3654342	Voltage or Y31.
3654442	3657163	I have an F view of the week.
3658829	3670540	A big fuck you, this is going to be short and sweet, a big fuck you to Walgreens for not having any vanilla coke in stock today, and on top of that, not having any Pepsi Blue in stock today.
3671080	3673202	That stuff tastes like shit.
3673342	3676025	It's a good dessert drink for me, just let me have my fun.
3677418	3678098	It's good shit.
3678118	3682179	It tastes like someone ate a bunch of strawberries and cotton candy and puked it into a jar.
3682419	3688221	Well, regardless, Walgreens did not carry the puke in the jar that I happen to like, so a big fuck you to Walgreens.
3688941	3689981	Matt, you have a fuck you of the week.
3691181	3691821	Yes, I do.
3692422	3698063	My fuck you of the week... I had to give you a song, I'm sorry.
3698583	3699383	I hate this song.
3700163	3702424	My fuck you of the week goes to the Concord City Planners.
3703274	3705235	What the hell were you thinking with the streets?
3706135	3708997	Streets are supposed to have perpendicular intersections, okay?
3709197	3713899	This crap of winding streets that you have in there is just unnecessary.
3714339	3717741	I got lost about four times in Concord, and it should have been really simple.
3718341	3719842	Might I add that was on the same road.
3720851	3722552	Yeah, it was on the same damn roads.
3722752	3725133	I believe it was like Stratton or something like that.
3725533	3726973	It was just pathetic.
3727113	3732996	This road makes three different turns, and they have streets intersecting with it.
3733536	3734036	It's crap.
3734316	3735237	So, my F.U.
3735277	3735857	goes out to them.
3737117	3738158	It's raining crap.
3738538	3739258	Hallelujah.
3739438	3743420	Our chat room has some F.U.s of the week they want to dish out, so let me get to those.
3744142	3772263	SoCalKick says, F you JenimScream for not going to Power Station and F you DJ Ness for leaving early and fuck you PepsiBlue for making me sick and having a crappy cap that spilled on the cam I borrowed and it spilled on it and fucked the cam up, whatever that means PyroMan, our local chatroom comedian, would like to give a big fuck you to the Live365 lady that comes up whenever he tries to start the stream and it ends up delaying his stream by two minutes so, a big F you by them
3773943	3774864	And that's our Fuck You of the Week.
3775204	3778086	But my Love You of the Week goes toward Propel, put out by Gatorade.
3778647	3781889	This beautiful fitness water tastes like ghetto Kool-Aid and owns you for free.
3784311	3788494	Let's get to the second part of the Dallarmendy interview, shall we?
3789075	3789755	We shall.
3789996	3790476	We shall.
3790536	3791096	Here we go.
3791276	3795400	More of Jamie live doing interviews at the Dallarmendy tournament, which was just yesterday.
3796140	3796581	Yes, it was.
3796621	3797581	Here on Orange Lounge Radio.
3797842	3798142	All day.
3798242	3798382	All day.
3800889	3802029	I'm doing more interviews.
3802530	3809152	Anyway, go ahead and state for our listeners your name and a little bit of your history in the Bad Bunny community.
3811053	3817815	Yeah, I'm Hattori Hanzo, and I've been in the DDR community for about two years now.
3818735	3824277	I remember starting out when we had Sun Valley Mall out here in Concord on a USA mix machine.
3825120	3833005	and everybody's fan favorite Orochi would come and play all the time and would just scare everyone off the pad, which is okay.
3833225	3836506	We finally figured out how to play and we decided to go along with it.
3838227	3851295	I met people like Wendell and ShadowMeTwice and Draconis over at the mall and we became good friends once we got a machine over here in Mountain Mikes and from there it's just been...
3852156	3853497	So what's your plans for the tourney today?
3877276	3884060	Well, I'm judging freestyle today, because I don't play doubles, so perfect attack is pretty dumb for me right now.
3884920	3890784	And I really can't freestyle, so I decided to just be a judge, and that'll be it.
3892525	3895786	So, who do you think is going to come out on top for freestyle today?
3896867	3897347	Freestyle?
3897547	3899208	I don't know, there's some pretty good people out there.
3899228	3905392	I know there's Wendell, and you got Takumi coming up with something, and then we got...
3906304	3910207	Fuzzy, and you've already got some good names out there, so I can't really tell.
3911509	3915432	Well, overall, what's your opinion of the Beimani community as it is right now?
