start	end	text
0	15200	You kids and your fancy M2 SSDs and your PlayStation 5s and your always on wireless
15200	16200	connections.
16200	19720	Back in my day we had to run a cable from the kitchen to the living room, wait 30 seconds
19720	25200	for a modem to dial, prevent anyone from being able to use the phone and suffer the consequences
25200	26760	if someone tried to.
26760	28560	And we liked it!
28560	30240	This is your Old Man Yells at Cloud Update.
30240	33440	Now it's time for your hosts Rob Roberts, Jamie Summers, and Loki to tell you about
33440	37640	this millennium's gaming news, starting right now on the show where every gamer has a voice.
37640	45320	Hello my friends out there on the internet and welcome back to another week of the show
45320	47480	where every gamer has a voice.
47480	54460	It is another edition of Orange Lounge Radio, live tonight, episode number 878 for this
54460	57100	August the 1st of 2021.
57100	63700	My name is Rob Roberts and I'm joining you as always with my co-hosts, say hello to DarkSakura
63700	64700	or Jamie Summers.
64700	65700	Oh, hi.
65700	66700	Hello, how are you?
66700	67700	Um, okay.
67700	75380	It's been a busy, busy day, I was woken up by the sounds of the neighbors running power
75380	76380	tools.
76380	77380	Delightful.
77380	82900	Oh boy, you gotta love power tools, love to hate them that is.
82900	86700	I wanted to use the power tools on somebody's head.
86700	93020	I have to go right to our chat room tonight because She-Hulk 10 is in there in chat and
93020	97460	we love seeing She-Hulk every week, but with this comment that I actually didn't realize
97460	103700	saying woohoo, MTV is 40 and that's right, that would be right.
103700	108500	Not that I questioned She-Hulk's trivia, but I had that realization of like, oh my gosh,
108500	112580	that's right because MTV started 1981, August 1st.
112580	114980	And I watched it when it aired.
114980	117940	I don't think we had it on our cable.
117940	119220	We had cable at the time.
119220	120220	Yeah.
120220	125940	Like, uh, and they were doing like some deal where you got MTV like with your package.
125940	127260	I barely remember this.
127260	128780	Mind you, I was like five.
128780	130500	Yes, I would have been three.
130500	133340	So maybe I just am too young to remember it.
133340	143300	But I remember my, my uncle, I think turning it on to see what it was and watching the
143300	149340	first music video that they played, which, of course, was video killed the radio star.
149340	155700	So what are we going to have have now Internet TV killed video?
155700	159380	I think somebody made that song like Internet killed the video star.
159380	160500	I think that was a thing.
160500	162120	It might have been a parody or something.
162120	164460	Maybe one of those songs that we used to play on the old network.
164460	167700	But one of those songs they always attribute to Weird Al that he didn't do.
167700	168700	Yeah.
168700	169700	Yes.
169700	170700	Yes.
170700	171700	Like a mislabeled Napster file.
171700	172700	Yes.
173100	175460	Oh, he still jokes about that, apparently.
175460	177740	Yes, exactly.
177740	178740	But yeah.
178740	179740	I now I distinctly.
179740	182600	Why shouldn't why wouldn't they celebrate this with with they should celebrate this
182600	183600	with Al TV?
183600	185660	Yes, they should.
185660	187220	I remember Al TV.
187220	190020	I distinctly remember that special.
190020	194660	I think my dad thought he was funny and I thought he was funny, too.
194660	196780	And I but I definitely remember that video.
196780	202540	I remember seeing that video on MTV, that video killed the radio star because, I mean,
202540	207380	in the very beginning of MTV, the first few weeks, there were only like nine music videos
207380	208380	at all.
208380	212780	It wasn't until much later that, you know, it caught fire that all these other record
212780	217900	labels started doing more videos.
217900	223060	I always remember Martha Quinn and Kennedy later on.
223060	224060	Oh, yeah.
224060	225060	I remember Kennedy.
225060	228420	I talked to Kennedy once on a radio thing.
228420	229420	Years and years and years.
229420	230420	I was in high school.
230420	232820	I used to religiously watch remote control.
232820	233820	Oh, yeah.
233820	234820	That was awesome.
234820	235820	That was my jam.
235820	236820	Yeah.
236820	244780	And then, you know, it's what gave us liquid television, which was something I still kind
244780	245780	of miss.
245780	250460	There was another show that was on very briefly called The Idiot Box, and it had Alex Winter
250460	251460	as the host.
251460	252460	OK.
252460	254700	And I think they they only aired like all of two episodes.
254700	259820	But at the time, I was kind of a fan girl of Alex Winter.
259820	260820	So I watched it.
260820	261820	I mean, I thought it was pretty funny.
261820	269340	But there's also another show that I think turned into the kids in the hall.
269340	270340	The kids.
270340	273500	I don't think because the whole started on MTV, but you might be thinking of the state
273500	274500	because the state.
274500	275500	That's what I'm thinking of the state.
275500	276500	Yeah.
276500	277500	The state has a different group.
277500	280700	But a lot of those people went on to Reno 911.
280700	283260	A lot of the same people are.
283260	286660	I just remember the guy whose catchphrase is I want to stick my balls in it and he'd
286660	288940	carry around his little balls.
289060	294100	OK, believe it or not, we are a video game podcast, but the chat room is lighting up
294100	295380	about MTV memories.
295380	296380	So you know what?
296380	297380	I'll indulge it.
297380	301460	And to be remote control had an NES game that was awesome.
301460	304100	And I loved it because I also love that show.
304100	306900	That was my lifelong dream was to be the game show host of that show.
306900	308500	It might still be.
308500	309500	So fifth dream in our.
309500	311700	I remember Colin Quinn on that show, too.
311700	312700	Yes.
312700	315580	We do tape live, of course, every Sunday night at six o'clock Pacific, nine o'clock Eastern
315580	319500	at the Voice of Geeks Network, Twitch dot TV slash Vogue Network right after the Bobby
319500	320820	Blackwell show.
320820	324140	And you guys can chat along with our show, which fifth dream is saying some of those
324140	330380	weird channel services like Pluto TV has a 24 hour pop up video station.
330380	334620	Now pop up video, of course, is VH1 thing, but very closely related by MTV.
334620	336260	But yeah, it's all it's all MTV.
336260	337820	And I thought that was all part of Paramount.
337820	339960	All the MTV shows are on Paramount Plus now.
339960	341620	So I'm kind of surprised it's on Pluto.
341620	346420	But actually, now now that I'm saying it out loud, I think Pluto is also a Viacom thing.
346420	347860	It's just a very different thing.
347860	350680	But this that Pluto TV app is on your PlayStation.
350680	352100	It's on your Xbox.
352100	355700	It's it's one of the this is a weird niche thing now.
355700	356700	There's like three of them.
356700	359980	These free TV apps.
359980	365620	It's like old like it's basically commercially supported old ass movies like Netflix.
365620	367860	So you don't have to pay a monthly fee for it.
367860	371160	Or they also have like live TV.
371160	374160	And they have very niche TV stations.
374160	378440	Like there was one station on there that played nothing but RuPaul's Drag Race all day long.
378440	380360	Just Drag Race, Marathon 24.
380360	381840	I think they finally pulled it.
381840	383080	I don't know why, but they did.
383080	384680	But there was a Survivor one, too.
384680	385680	And there's all sorts.
385680	388680	There's an uncensored Hell's Kitchen, I think is on that same one.
388680	395760	So anyway, there's also getting me to sit down and watch TV, which it doesn't happen
395760	398520	unless it's Drag Race or Jessica Jones.
398520	399520	Yeah.
399520	403760	I think there's something to be said about turning on the TV and having that background
403760	407040	noise while you're folding laundry or whatever it is.
407040	409520	You know, sometimes you don't know what YouTube's for.
409520	410520	Yeah.
410520	411520	I think a lot.
411520	413400	You know, but I think these like Pluto TV and the etc.
413400	415200	I can't remember the names of the other ones.
415200	416280	To be might be another one.
416280	417280	I can't remember.
417280	418280	Sorry, guys.
418280	423040	That that kind of can also fill that with extremely niche things, kind of like how YouTube
423040	424040	can do.
424040	425760	You're absolutely right with that.
425760	429260	And Pod Culture saying Pluto had a Doctor Who channel, the next generation.
429260	430260	You're right.
430260	432100	I think there's like a Star Trek channel on there.
432100	433100	Absolutely.
433100	434100	Yes.
434100	436340	And the old school Nickelodeon channel is on one of those.
436340	439940	As long as that showed the tomorrow people, I'd be interested.
439940	440940	It might.
440940	441940	It might.
441940	442940	Look it up.
442940	443940	Look it up.
443940	444940	I want to see what else was.
444940	448780	What if there was like old British sci fi, like it played like Blake seven or something?
448780	451400	Honestly, it probably exists somewhere.
451400	455540	It might not be on that same app, but I bet that of course, that's a niche that somebody
455540	458240	you know who to ask our friends over British invaders.
458240	464480	They would know he could send our pals over their email about that.
464480	468240	Bobby Black Wolf speaking of an event where I sometimes see our friends, at least one
468240	469840	of our friends from British invaders.
469840	475520	Bobby Black Wolf says our Dragon Con panel is called Video Didn't Kill the Podcast Star.
475520	476520	So that's right.
476520	477520	There's there's a panel.
477520	478560	We're doing it again this year.
478560	481720	We've done it at least one other year, maybe two.
481720	486720	It's kind of about our transition from doing a long running podcast to the video format.
486720	487720	So you're right.
488200	490160	That name is kind of a little play on that as well.
490160	493020	So it's pretty, pretty fun.
493020	497840	So anyway, I should also mention, because you might be wondering, not joining us tonight
497840	498840	is Tech Master Loki.
498840	501040	You might be like, where's Loki go?
501040	502900	He just he had a family obligation.
502900	503900	It happens sometimes.
503900	506720	So he's just not here tonight, but he'll be back next week.
506720	508380	So it happens.
508380	510440	Sometimes we get to take a night off.
510440	513480	So Loki, Loki has the night off, but he'll be back next week.
513480	516160	So it's just dark Sakura and I feeling the love.
516200	517800	So tonight's the night.
517800	519560	It's just going to be the Dead by Daylight show.
519560	523680	You already I'm still working on that, too.
523680	526880	I need a co-host, maybe.
526880	530280	Maybe we'll indulge a little bit tonight, because without Matt here, we kind of have
530280	534400	a shorter list of stories that and I think it just kind of generally was.
534400	538680	There's some big things you talk about, but the whole scope of things was a bit of a slower
538680	539680	news week.
539680	542540	And I think that's just, you know, summer still being in full swing and all of that
542540	543540	stuff happening.
543540	544540	What's that?
544540	545540	Yeah.
545900	546900	That's just how it is.
546900	547900	Yes.
547900	548900	Just how it is right now.
548900	549900	Let's see.
549900	554140	Bobby Black Wolf with a very good point saying, thanks to data caps, I'll never have a streaming
554140	556940	channel on that I wasn't actively watching.
556940	557940	That's a very good point.
557940	563080	I don't watch a lot of the streaming stuff, but I'll watch it here and there.
563080	566060	But Twitch is a lot of my background stuff, too.
566060	571300	Like I'll put on a streamer that I like and I found a lot in the last few months ever
571300	576060	since Alan got me into freaking Dead by Daylight, you know, and I kind of found that whole
576060	577380	community in dark soccer.
577380	581340	I know this hits home for you, too, is it's like there's I don't know how I got so deep
581340	582340	with these people.
582340	586420	It's just endless amounts of content out there with all of that.
586420	592400	So well, and it's like now it's it's like, you know, I never, ever expected that when
592400	597540	I go into one of the the bigger guys chat rooms that I'd get, oh, hi, welcome in.
597540	599460	I'm glad that you made it to me.
599460	600460	Yeah.
600620	602500	I'm like, are we friends?
602500	604020	This is great.
604020	605020	Are we friends?
605020	608660	Which is interesting, Jamie, because to pretty much, you know, a lot of people that are here
608660	613400	on Sunday night, you you are a rock star and have been for many, many, many years.
613400	618180	So to be to be acknowledged by you for a lot of people here.
618180	621260	And I'm not trying to I'm not trying to completely gaslight you here, but I think this is like
621260	626940	one of those like, you know, in these parts, I when Senpai notices them, there's a lot
626940	628200	of people that are very happy.
628200	632820	So it's just it's it's neat that there are other I notice all of you chatters.
632820	634280	So Senpai noticed you.
634280	639200	Yeah, I actually it's funny, I'm I'm working on and this is just like a little aside.
639200	642200	I'm working on some bit redeems for my channel.
642200	644560	You know, like cheap stuff, right?
644560	647560	And one of them is Senpai notice me.
647560	648560	That's cute.
648560	649560	I like that.
649560	652200	I like I like the release.
652200	655700	I'm having like I don't stream a lot, a lot on my personal channel.
655700	659140	You know, I keep saying I need to do it more, but it's hard when Alan and I are sharing
659140	662780	that space and especially in the summer when it gets really hot.
662780	666220	But I think about those types of things and what to do for those regimes.
666220	670660	And I do like the streamers that have these really cute, like short little things that
670660	674460	they do, like one streamer that I watch a lot, does a little thing where he'll just
674460	675800	go boop and that's it.
675800	677380	That's like basically what you're doing.
677380	679380	And there's that's Nick.
679380	680380	Nick.
680380	681380	Yeah.
681380	682380	There's another one that'll get up.
682380	687060	Yesterday, one that Alan watches a lot, that'll just get up and hug like to stand up and do
687060	688060	a hug.
688060	689060	I like that.
689060	690060	That's cute.
690060	692300	There's some Laurie Bird does the vocoder singing.
692300	694580	Oh, that's cute.
694580	695580	That is really cute.
695580	702380	But but no, I've I you know, I've learned a lot actually just in playing Dead by Daylight
702380	706780	and about the stream set ups and everything from just watching other people and talking
706780	707780	to them.
707780	711140	I'm still behind on quite a few things because I game on a Mac.
711140	714340	You know, they're like, I can't run like chat bot.
714340	716940	I have to run cloud bot, you know, and I figure some stuff out.
716940	718980	I can't do some of the games.
718980	720980	And slabs is garbage.
720980	723460	Slobs, I'm sorry.
723460	726820	Well, by garbage, I mean, it doesn't see my stadia window.
726820	735140	And I do most of my gaming through stadia, which because of you, because I think it was
735140	741340	you that that suggested that I start putting stadia in my tags when I go live.
741340	745580	I have met other stadia Dead by Daylight players.
745580	747260	I am no longer alone in the world.
747260	748260	Thank you.
748260	749260	Thank you.
749260	750260	Thank you.
750260	751260	Yes, that was me.
751260	752260	I know.
752260	754500	I remember suggesting that because I said you have it.
754500	757060	You're a special snowflake in the stadia thing.
757060	758060	And I wasn't.
758060	759060	But I will say this.
759060	761820	I didn't think it would be other Dead by Daylight state.
761820	764420	I thought it would just be stadia enthusiasts.
764420	768100	There were a couple that were just stadia, but a couple were also dead by daylight.
768100	769100	Huh?
769100	770100	Well, there you go.
770100	771100	Yeah.
771100	773140	So other people are familiar with Miss Debbie.
773140	781300	I do find that I have good luck with the growth of my channel when I try not to stream one
781300	782300	thing.
782300	785340	Like, I don't get a lot of new followers when I play Final Fantasy 14 because I always play
785340	786900	Final Fantasy 14.
786900	791460	But like, one of the best nights I got a lot of new followers was when I did No Man's Sky
791460	793140	out of the blue for the first time.
793140	796780	I got people that watch a lot of No Man's Sky where it's like, oh, this is a new name.
796780	798420	Who is this doing this?
798420	804060	And I know this happens to Alan started playing his music games on Monday nights.
804060	807100	And he gets a lot like that spin rhythm.
807100	810540	He just randomly started playing on stage apparently has a rabid fan community behind
810540	811540	it.
811540	814220	Because when he streams that game, he gets all these new people that show up that will
814220	817640	that are looking for that game particularly and all the mods behind it and everything.
817640	825400	So it is it is interesting how I find that mixing that up does kind of let you get seen
825400	827920	by more people because your keywords change.
827920	828920	Right.
828920	832800	So when when I beat Fantasian because I'm getting close to that.
832800	833800	Oh, I bet.
833800	836960	I need to think of something new for for Tuesday fantasy zone.
836960	843160	So maybe I'll do Hataful Boyfriend again, or maybe I'll find something else who knows
843160	844720	you want my suggestions.
844720	848920	Do you want my honest suggestion live on air, even though, you know, you didn't ask for
848920	849920	it?
849920	850920	Sure.
850920	854440	We to me, Dark Soccer and chat room, feel free to agree, disagree.
854440	856800	To me, Dark Soccer, you're the queen of retro gaming.
856800	860960	It's one of the huge things that like you bring to the show, your knowledge, your depth,
860960	866520	your fandom for these sometimes downright obscure things that not the rest of us really
866520	867760	like know a lot about.
867760	870480	Like I am surprised you don't stream more retro.
870480	871860	I realize the setup.
871860	873940	You don't have the right capture stuff for that setup.
873940	878140	But I would almost say just cheat and use emulators because emulate it.
878140	879140	Yeah.
879140	880460	Chances are you own it.
880460	883020	So you're not really breaking the rules.
883020	888180	Like I might I might try to dig up, see if there's a version of Magic Engine that runs
888180	894540	and play through one of those translated like Rondo of Blood or something.
894540	895540	Yeah.
895540	897540	I think that would be fun.
897540	898540	Yeah.
898540	903780	Of course, it's just going to be me playing as Maria with her terrible singing.
903780	906620	But there's a lot of people that are probably never even seen it.
906620	910980	So you know, there was a Castlevania collection, though it had it on there.
910980	911980	Oh, that's right.
911980	912980	That's right.
912980	913980	Yeah.
913980	918980	So although I actually do kind of want to play, I've also been thinking about maybe
918980	922180	playing Jackie Crush.
922180	926820	Which is in the Devil's Crush family.
926820	929100	It was a SNES one that came out.
929100	930700	Oh, yeah, yeah, yeah, yeah.
930700	931700	Wow.
931700	932700	That would be awesome.
932700	933700	Yeah.
933700	934700	Mike Defton Chats is at this point.
934700	935700	I don't think most people will care if you use emulators.
935700	936700	No.
936700	941340	And especially if it's like the stepping stone to, you know, going, OK, there is interest
941340	942340	in this.
942340	946200	And now maybe I will make that investment in whatever capture card I need to hook up
946200	948400	the old Saturn or whatever it is.
948400	950860	I think that, you know, might be might be a way to do it.
950860	953700	So that'd be great if I can do Saturn emulation on my Mac.
953700	954700	That would be awesome.
954700	955700	Yeah.
956580	957580	Food for thought.
957580	958580	All right.
958580	960660	We're we're several minutes into the show and we haven't even gotten to the kickoff
960660	961660	topic.
961660	963860	But that's that's what happens when Loki isn't here to mediate us.
963860	966340	We will just talk about whatever we want.
966340	969900	I just picture his flat stare while we're jabbering and who am I?
969900	970900	Who am I kidding?
970900	975620	He's he's going to get off topic just as much so that's part of the charm here at Orange
975620	976620	Lounge Radio.
976620	977620	It is what it is.
977620	978620	All right.
978620	979900	Let's get into our kickoff topic tonight.
979900	983380	Actually, we kind of have a you know, this is eight hundred and seventy eight episodes
983380	984660	Orange Lounge Radio.
984660	988140	We've been doing the format with the kickoff topic at least as long as we've been on Twitch,
988140	989220	if not longer.
989220	992900	This doesn't happen a lot where the same thing needs to be talked about at the top of the
992900	996660	show two weeks in a row sometimes, but not a lot.
996660	1001340	We're in that position tonight because this is a very important shift in the industry
1001340	1002340	that's happening right now.
1002340	1005380	This is a very important reckoning for the industry.
1005380	1010660	And you notice I'm not saying one company, I'm saying the industry that I is playing
1010660	1013080	out through one company right now.
1013080	1016240	But Dark Soccer, if you don't mind, I will let you take it from here.
1016240	1017560	Oh, yeah.
1017560	1028840	So on this past Wednesday, hundreds of Activision Blizzard employees walked out and this was
1028840	1038960	after the lawsuit and Blizzard's rather dismissive release on terms.
1038960	1041780	You know, they're oh, we're sorry, but blah, blah, blah.
1041780	1046000	You don't say I'm sorry, but you say I'm sorry and don't do the shit again.
1046000	1054500	So at any rate, there was a walk out where they rallied in front of the Blizzard headquarters
1054500	1061980	in Irvine to protest their response to the discrimination and sexual harassment lawsuit.
1061980	1067460	It was attended by more than 350 people.
1067460	1069120	There were some signs out.
1069120	1072580	One of them said nerf male privilege.
1072580	1077720	Another one said unaccountable corporate bureaucrats are driving the best employees out of Activision
1077720	1079360	Blizzard.
1079360	1085500	The walkout started at 10 a.m. Pacific and ended at 2 p.m.
1085500	1092080	Also other companies were supporting the employees and actually sent food trucks out and catered
1092080	1093340	and brought porta potties.
1093340	1095980	Oh, I hadn't heard of that.
1095980	1096980	Interesting.
1097500	1106780	People were driving by and honking in support and there were people that spoke out about
1106780	1119080	it, but they wanted an anonymity for fear of retribution from the company.
1119080	1125940	And then, of course, on social media, there was, of course, a call to not cross the virtual
1125940	1128880	picket line by playing their games.
1128880	1134800	That's including Overwatch, World of Warcraft, Call of Duty.
1134800	1141940	And honestly, I don't think I have played an Activision Blizzard game since the deal
1141940	1148580	with the Chinese gamer with the free Hong Kong.
1148580	1155040	But yeah, I am completely with this kind of behavior, I don't care how much you love a
1155040	1162700	game, you know, this is something this gross behavior.
1162700	1170380	I mean, they say that boycotts don't really do a lot, but I think the walkout will do
1170380	1171820	quite a bit.
1171820	1180140	And I do think that people making an active and vocal choice not to put their money into
1180140	1188860	the company, while it may not be financially effective, I think it will be effective in
1188860	1189860	terms of commentary.
1189860	1191360	Does that make sense?
1191360	1192360	Yes.
1192360	1196360	And I think the good thing about the walkout, especially too, was something we were talking
1196360	1204040	about last week about how this is not a every Blizzard and Activision employee problem.
1204040	1208920	In fact, there are a lot of fantastic people working for Activision Blizzard who are sick
1208920	1210520	and tired of this crap as well.
1210520	1215960	And I think that walkout really sort of personified that, and I think helped a lot of people out
1215960	1221280	there who maybe hadn't gotten to that point yet really see that this is not an issue of
1221280	1223220	all the employees at Activision Blizzard.
1223220	1225180	This is a management issue.
1225180	1230520	I'm going to make a more extreme comparison though, and there were a lot of people that
1230520	1236720	didn't vote in the 2016 election, were they good people?
1236720	1238720	Because they partly enabled you-know-who.
1238720	1239720	Debatable.
1239720	1244940	But that my point stands.
1244940	1246660	Every scenario is different, right?
1246660	1249640	There are good people that do nothing.
1249640	1256240	I'm glad they're doing something now that they feel empowered to do it, but there needs
1256240	1263600	to be a degree of fearlessness when it comes to confronting any sort of abusive and oppressive
1263600	1264600	behavior.
1264600	1265600	Right.
