start	end	text
6397600	6403280	But sadly, the ideas were thrown away because of the controversial statements by the company.
6403280	6406920	You know, they had all the questions, the issues with all those shitty things that were
6406920	6408960	said beforehand.
6408960	6410600	That's why Nintendo pulled out, basically.
6410600	6415040	So I do have to explain a little bit of something about Shukan Bunshun.
6415040	6416080	OK.
6416080	6427520	Is that this magazine has been credited with bringing down a minister and a politician.
6427520	6431960	And it nearly broke up one of Japan's biggest boy bands.
6431960	6439800	So basically, the magazine does exposes and investigative reporting and typically has
6439800	6442200	a lot of clashes with Japanese government.
6442200	6443200	Interesting.
6443200	6444200	OK.
6444200	6449280	This isn't a tabloid.
6449280	6451440	This is like an expose magazine.
6451440	6452440	Interesting.
6452440	6453440	OK.
6453440	6454440	All right.
6454440	6455440	Good to know.
6455440	6456440	Yeah.
6456440	6460800	So it's it's it's a little more Teen Vogue and a little less National Enquire basically
6460800	6461800	or TMZ.
6461800	6462800	Perez.
6462800	6463800	Yeah.
6463800	6464800	Yeah.
6464800	6465800	OK.
6465800	6466800	All right.
6466800	6467800	In other rap.
6467800	6468800	Maybe a little more Al Jazeera.
6468800	6469800	Fine.
6469800	6470800	All right.
6471400	6474480	Hey, there's a lot of great stuff that Teen Vogue's done in the past few years.
6474480	6475480	All right.
6475480	6476480	Oh no.
6476480	6477480	Teen Vogue is amazing.
6477480	6478760	Anyway, what else is amazing?
6478760	6482440	The Simpsons arcade game is a great game from years ago.
6482440	6485200	In fact, oh my God, is that it's 30 years old.
6485200	6488020	It sure is as a 30 year old game.
6488020	6490560	And we had all those rumors going into E3.
6490560	6491560	In fact, they weren't just rumors.
6491560	6496480	We had a fucking trailer that leaked and still yet no announcement at E3 about the Simpsons
6496480	6497480	arcade one up machine.
6497480	6499120	Well, guess what?
6500100	6502200	We will never know what caused the delay.
6502200	6503480	Nobody's saying anything.
6503480	6509400	All we know is that arcade one up officially announced the Simpsons arcade retro cabinet
6509400	6513620	and it's going to have authentic artwork and relatively easy assembly.
6513620	6517000	You can start preordering the machine on August 16th.
6517000	6521040	We don't know how much the machine is going to cost, but just so you know, Turtles in
6521040	6526140	Time is six hundred and fifty dollars and that is a pretty similar sort of thing.
6526140	6529540	And there's only going to be one game with this, with the Simpsons, because a lot of
6529540	6532100	those cabinets have multiple games in them.
6532100	6533100	Not this one.
6533100	6537780	So, but I will say if there's any cabinet that people remember from their childhood
6537780	6540340	that they might, it might be this one.
6540340	6544980	Anyway, I am crossing my fingers and toes that this means that Tron cabinet isn't far
6544980	6545980	behind.
6545980	6546980	But you know what?
6546980	6548380	I'm not going to hold my breath either.
6548380	6552740	Oh, Orange Wright says, I heard this also has Simpsons bowling.
6552740	6554380	It has a track ball.
6554380	6555380	Interesting.
6555620	6558260	But yeah, Dark Tetsuya says, I don't know what happened to the bowling game.
6558260	6560940	I didn't see the trackball on the new picture.
6560940	6561940	Hmm.
6561940	6566060	I wonder if something is there about why it got delayed.
6566060	6567060	I don't know.
6567060	6568060	I don't know.
6568060	6569060	Just maybe it's an add on you have to pay for.
6569060	6572260	Well, but then you have to pay for that trackball too, which would be weird to install.
6572260	6573260	That's what I'm talking about.
6573260	6576260	You have to pay for like a trackball edition or something.
6576260	6577260	Yeah.
6577260	6578260	Yeah.
6578260	6580720	So Bobby Blackwell is saying the rumor is the Simpsons bowling is the license that got
6580720	6582900	revoked and that was an eleventh hour revoked.
6582940	6587300	So that might, we might be starting to put together why did this suddenly not get announced
6587300	6588300	at E3?
6588300	6589300	Aha.
6589300	6590300	But we don't have it.
6590300	6591840	We don't have a definitive answer on that.
6591840	6595300	We just, we just sort of are reading tea leaves there.
6595300	6598540	Anyhow moving on Dark Sakura.
6598540	6601220	So finally updates for Animal Crossing.
6601220	6602860	So maybe I'll check on my village.
6602860	6608420	The updates, well, it says the update is supposed to happen July 29th.
6608420	6610700	So I missed that.
6610700	6613540	And that there were going to be more updates later in 2021.
6613540	6615300	So hopefully they'll be good.
6615300	6617540	I mean, it's the fireworks and the seasonal items.
6617540	6622500	So I don't know if it's going to be worth me playing again.
6622500	6630540	And then Hot Wheels Unleashed is going to have some pop culture cars in it.
6630540	6637500	So among those is going to be the Turtles party wagon from Teenage Mutant Ninja Turtles.
6637500	6642900	Apparently Snoopy, I guess on the, on the doghouse, you know, the Red Baron.
6642900	6643900	Yeah.
6643900	6644900	Yeah.
6644900	6645900	Yeah.
6645900	6646900	The Red Baron.
6646900	6647900	Yeah.
6647900	6648900	A kit from Knight Rider.
6648900	6649900	The DeLorean from Back to the Future.
6649900	6650900	The Batmobile.
6650900	6654700	I don't know which Batmobile, but there is something in there that honestly is more exciting
6654700	6656700	than all of that to me, Rob.
6656700	6657700	Hmm.
6657700	6658700	A Fiat 500.
6658700	6659700	Well, there you go.
6659700	6661580	Cause I drive one.
6661580	6668000	Every time I see a Hot Wheel Fiat, I buy it for myself the same way.
6668000	6671100	Every time I see any kind of Mustang, I buy it for Danny.
6671100	6673540	He's got so many Hot Wheel Mustangs.
6673540	6674540	It's not even funny.
6674540	6675540	Nice.
6675540	6676540	Yeah.
6676540	6677540	All right.
6677540	6681580	Now, if we could only get like the Hot Wheels pinball would be set.
6681580	6684980	Sia Tabiri bringing us what else is with that Animal Crossing update.
6684980	6690140	You can now get Boba tea and cotton candy in the drawings during fireworks events in
6690700	6691700	Animal Crossing New Horizons.
6691700	6692700	Well, that's cute.
6692700	6693700	Well, crap.
6693700	6694700	I better play.
6694700	6695700	All right.
6695700	6700700	Hey, there's, there's something to do instead of Fantation one night or whatever you were
6700700	6701700	thinking.
6701700	6702700	Animal Crossing journey.
6702700	6703700	All right.
6703700	6704700	Hmm.
6704700	6705700	Anyway.
6705700	6706700	That one's even harder to get my stuff set up for.
6706700	6707700	All right.
6707700	6708700	All right.
6708700	6711380	Uh, let's travel around the world and check out some release dates of some games coming
6711380	6713100	out soon near you.
6713100	6715140	Um, I, uh, Loki's not here tonight.
6715140	6717680	I will try to do the U S dates here.
6717680	6722960	So I'm on August 2nd age of empires three definitive edition is coming out for windows.
6722960	6726260	I kind of think that's probably the temple release this week because I don't see a lot
6726260	6730940	of big, big stuff this week, although for windows and stadia, we do have grime is coming
6730940	6731940	out on the second.
6731940	6737360	Uh, we also have in sound mind coming out for windows, switch, PS five, Xbox series
6737360	6738360	X.
6738360	6740560	That is a horror game, uh, from, we create stuff.
6740560	6745280	Uh, and then we have the falconeer warrior edition on switch PlayStation four and PlayStation
6745280	6746280	five.
6746280	6748500	That is a, um, air combat type of game.
6748500	6752000	So, uh, that, that's it for releases in the U S this week.
6752000	6756240	Um, let me, let me get in my plane and fly over to Japan real quick and get some of the
6756240	6757520	releases over there.
6757520	6761640	Um, on August 5th on the Nintendo switch, we have the legend of heroes trails of cold
6761640	6763020	steel too.
6763020	6766080	We also have that falconeer game is out on the switch this week.
6766080	6769280	Um, and that's it on the switch.
6769280	6772940	Let me check the PlayStation four and the PlayStation five PlayStation five is getting
6772940	6774960	the falconeer as well.
6774960	6775960	So that is out.
6775960	6778540	There's also a special guilty gears.
6778540	6782060	There's not a guilty your game, but like a fighting stick coming out if peripherals are
6782060	6783060	of interest to you.
6783060	6786780	Uh, and then the falconeer, that appears to be the big release in Japan because that is
6786780	6788660	also on the PlayStation four this week.
6788660	6793300	But you can also get dirt five, uh, in Japan getting its release, uh, for Japanese audiences
6793300	6795260	on the PlayStation four this week.
6795260	6797480	How about the UK dark Sakura?
6797480	6802300	Just a handful on, um, uh, third August we have spirit fair.
6802300	6807740	On the sixth that we have blue fire and Zenjin, I reckon that's how it's said.
6807740	6810260	And on the seventh we have seven days to die.
6810260	6811260	How appropriate.
6811260	6812260	All right.
6812260	6813260	That's it.
6813260	6814260	All right.
6814260	6817180	Kind of a slower week, but understandable.
6817180	6820000	We'll probably get a little more as we get into labor day and all that.
6820000	6824520	So let's get back into just a few stories here, uh, and then we'll get to a listener
6824520	6825520	round table.
6825520	6828740	I know I saw at least one email before the show tonight and then, um, we'll see, we'll
6828740	6829740	see if there's any calls.
6829740	6830740	Why not?
6831180	6833660	Um, or any questions you guys might have in chat.
6833660	6837240	And then of course, uh, I might pull a few stories from our discord, although I kind
6837240	6840240	of pulled some to fill out tonight's show role, but, uh, I do encourage you guys to
6840240	6844080	join our discord and, uh, continue the conversation throughout the week, especially now that they
6844080	6845640	have threads.
6845640	6849000	Like w you know, what's funny is that when we first made the switch to discord, I kind
6849000	6850000	of joked with Bobby.
6850000	6853840	I said, discord kind of replaced our forums on VOG network.
6853840	6856120	Cause you know, that got overrun with spammers.
6856120	6857840	We haven't used those forums in a long time.
6857940	6862540	They, they honestly just shouldn't even really be there except for the fact that, um, we
6862540	6865280	dark, we post our story stuff.
6865280	6866280	That's it.
6866280	6867280	OLR has a secret forum.
6867280	6868280	We're still using it.
6868280	6872620	Um, but yeah, and I think some of that actually powers, I just email you.
6872620	6873620	I know.
6873620	6874620	I know.
6874620	6875620	Um, yeah.
6875620	6876620	Yeah.
6876620	6877620	Yeah.
6877620	6878620	Yeah.
6878620	6880160	Although it probably would be better if you could get back on the forums.
6880160	6882020	It's all in one place, but it's all right.
6882020	6885420	Honestly, we should just kind of all move it, but we can talk about that later.
6885420	6888380	Cause I kind of think we should just have a special discord channel.
6888380	6889940	Let's move to slack.
6889940	6891380	Well, why not discord?
6891380	6892420	We already have one set up.
6892420	6893420	It's the same thing.
6893420	6894420	I guess.
6894420	6895420	All right.
6895420	6898460	Um, any Hey, uh, DJ Rama S says one note.
6898460	6899860	It's what we have at anime jam session.
6899860	6900860	Actually.
6900860	6901860	I love one note at work.
6901860	6904860	I never thought about using it for my personal stuff, but I use it at work all the time.
6904860	6905860	I'm on a Mac.
6905860	6907860	Mac has Microsoft stuff.
6907860	6908860	Yeah.
6908860	6911020	I don't want to have to pay for one note.
6911020	6912020	All right.
6912020	6913660	If it, if it's going to make me pay for it.
6913660	6914660	All right.
6914900	6921020	Uh, let's talk about, uh, this story and, uh, it is, this was getting a lot of traction
6921020	6927500	on social media this week and it has to do with, uh, a new series reported for Netflix,
6927500	6932340	a live action Pokemon series for Netflix.
6932340	6937440	This is not necessarily from the minds behind detective Pikachu, cause that's where a lot
6937440	6941220	of people's heads win at first, which I thought detective Pikachu was cute.
6941220	6945180	Like, and I was like, if there's a live action thing behind that, I kind of would be into
6945180	6946180	it.
6946180	6947180	I think.
6947180	6948500	However, this is coming from Lucifer's.
6948500	6952700	So the people behind Lucifer, Joe Henderson, we don't know a lot else.
6952700	6955260	Uh, this is a report that came from variety.
6955260	6959780	Variety is a, I guess the expose, but of Hollywood.
6959780	6964060	So they run a lot like variety and deadline are kind of the big names in Hollywood, uh,
6964060	6966340	that talk about what's going on in the industry.
6966340	6970760	There variety is reporting that the live action Pokemon series is in the works at Netflix
6970800	6975400	with Joe Henderson from Lucifer on deck as writer and executive producer.
6975400	6976400	That's it.
6976400	6977400	It's in its early days.
6977400	6978820	We don't know the plot.
6978820	6981040	Is it the, is it detective Pikachu?
6981040	6982680	Is it the anime series?
6982680	6983920	Is it a new story?
6983920	6984920	I don't know.
6984920	6986040	It's in its early stages.
6986040	6987040	Nobody knows.
6987040	6990720	A lot of people are jumping to conclusions, but we don't know.
6990720	6997720	Um, however, variety is saying that the Netflix show, according to sources, would be a live
6997720	7003800	action series akin to the detective Pikachu film with Ryan Reynolds and justice Smith.
7003800	7008560	But I don't see when I hear that, I don't hear it's in the same universe or it's the
7008560	7009560	same thing.
7009560	7011820	I hear this is not an anime.
7011820	7016120	This is not a cartoon because Netflix has been doing a lot of animes and cartoons.
7016120	7019980	So I think some people could have inferred that, Oh, they're just, you know, gonna make
7019980	7022620	their own movie or their own series or whatever.
7022620	7024680	And that's not actually what's happening here.
7024680	7026640	So all right.
7026640	7034100	Um, anyhow, um, we don't know a lot else, so we have not heard a single person cast.
7034100	7036160	We haven't seen a single frame of footage.
7036160	7040560	I kind of think I'm, you know what, why not?
7040560	7042680	Like how bad could it be?
7042680	7043800	Famous last words.
7043800	7045320	I'm willing to give it a try.
7045320	7046640	At least let's see a trailer.
7046640	7049560	I again, I liked detective Pikachu.
7049560	7053840	I think a lot of that rest on Ryan and Ryan Ryan Reynolds, but I like, I haven't seen
7053880	7058680	it and I want to, you should, I liked the way conceptually they put Pokemon in the real
7058680	7061940	world as if it was just a thing that was always around.
7061940	7063600	I thought it was really cute.
7063600	7064600	So we'll see.
7064600	7070320	Uh, DJ Rama S in chat says the live action Pokemon series is a gateway to the smash brothers
7070320	7071320	movie universe.
7071320	7074160	Hey, Hey, I'll take it.
7074160	7076120	Um, SSJ 100.
7076120	7080520	Matt says with the success of detective Pikachu, I'm sure they fast tracked anything Pokemon
7080520	7081520	related.
7081520	7082520	Well, sure.
7082520	7085720	Things like Pokemon go, which I didn't get into that at the top of the show.
7085720	7088400	We're going to need some extra cause we need some extra stories.
7088400	7090440	We're going to have some extra stories in a little bit.
7090440	7095440	Um, we did have a hint of it and then a fifth dream in chat says it's a whole show with
7095440	7096440	only Bidoof.
7096440	7097440	Oh, my dream.
7097440	7098440	My dream.
7098440	7099440	The Bidoof show.
7099440	7100440	I will.
7100440	7104760	It's a, it's actually just a chat talk show with Bidoof, but, but, but, but you also need
7104760	7111240	like the, uh, like, you know how like at the end of He-Man they would have like the lesson.
7111240	7113280	You need that presented by a medkip.
7113280	7114280	I love it.
7114280	7115280	All right.
7115280	7120320	Uh, so anyway, uh, we'll, we'll hear more about that probably in a year.
7120320	7123920	If that, when somebody gets cast for this, I think once you start to hear what the cast
7123920	7126480	is, then you might know like what the story is.
7126480	7131200	So like if they cast an Ash Ketchum, then we know they're probably going around the
7131200	7134560	anime, but if they don't, then they're probably doing their own thing.
7134560	7136100	So we'll see.
7136100	7142220	If they do a Satoshi, then they're saying, we're going to do this the right way there,
7142220	7148680	but I have the, I have a feeling this is going to be very, uh, North America based, but maybe
7148680	7149680	I'm wrong.
7149680	7150680	Maybe I'm wrong.
7150680	7151980	That could be interesting too.
7151980	7153240	We'll see.
7153240	7154240	We don't know.
7154240	7155240	All right.
7155240	7158580	Um, how about, how about we do our extra stories now we're going to, we're going to break the
7158580	7163040	rules a little bit and insert two stories that are not in the sidebar.
7163040	7165740	So Dark Soccer, you just texted me something you wanted to talk about.
7165740	7166740	So why don't you go for it?
7166740	7167940	Cause I think it's funny.
7167940	7168940	I did.
7168940	7173260	I was poking at my Twitter for just a second and I saw that Ariana Grande was trending
7173260	7176300	and I'm like, what the hell is she done now?
7176300	7185620	Um, and it looks like that she is partnered with a Fortnite for a rift tour concert series.
7185620	7191980	Um, the series is scheduled for August six through eight with five show times over three
7191980	7193180	days.
7193180	7198820	So it's a musical experience they say with a special playlist and a playable character
7198820	7201060	that was inspired by Ariana.
7201060	7205500	Um, the character actually looks really cute and you're like wearing like this sort of
7205500	7209260	sparkly metallic holographic ish kind of thing.
7209260	7213340	And of course with her signature, like purple topknot, it is very purple.
7213340	7220660	Um, I'll just go ahead and read what exactly, um, this says, uh, Fortnite user, uh, apparently
7220660	7225620	they can schedule their showtime in Fortnite and then coordinate with their friends.
7225620	7233020	You go to rift tour.com for it and then, uh, she will be added to the games icon series
7233020	7237900	and then you get the items, uh, that are available from the item shop from her, including the
7237900	7244300	outfit and this like yellow piggy backpack called piggy smalls back bling and it's inspired
7244300	7248620	by her, her real life piglet pet for the record.
7248620	7251780	Don't forget a piglet as a pet, they will get big.
7251780	7263140	Um, and so, uh, this is a supposed to blow away Travis Scott's, uh, thing where they,
7263140	7268380	uh, basically broke the record for biggest live audience in Fortnite.
7268380	7274500	Um, so I don't know, it looks interesting that the trailer looks interesting.
7274500	7279780	Um, it's not enough to ever make me desire to want to play Fortnite, like in the least.
7279780	7283220	Not my gay ass is going to be playing Fortnite.
7283220	7285820	I said my gay ass is going to be playing Fortnite.
7285820	7293940	All right, well you do you, I have no idea what the fuck I'm doing, but I'll be there.
7293940	7295940	Nothing but the best for our queen.
7295940	7298140	All right.
7298140	7303940	You know, she has one song that I like only because it kind of grew on me because they'd
7303940	7306700	play it at Badlands every fucking time I was there.
7306700	7310760	I like, okay, Into You is like a quintessential like gay song.
7310760	7311760	That's a gay anthem.
7311760	7312880	I love that song.
7312880	7318500	It was, uh, um, No Tears Left to Cry, but I also really liked the video for it.
7318500	7320420	I liked the cinematography in the video.
7320420	7321420	Yes, that was good too.
7321420	7325220	I really liked Thank U, Next that spoofed all the nineties films.
7325220	7326900	I thought it was so cute.
7326900	7330740	The video for that was great and I actually liked the message of the song, but I don't
7330740	7331740	like the song.
7331740	7332740	Fair.
7332940	7336620	And then there was a song in DDR that just recently got pulled because the license expired.
7336620	7340420	It was, um, it wasn't Into You, but it was something else from that album.
7340420	7341420	Help Me, Bamani fans.
7341420	7342540	What was the song of hers?
7342540	7345900	It was the sci-fi video where she was shooting the aliens and stuff.
7345900	7350820	I can't remember the name of the song, her brother's in it too, but, but, uh, I can't
7350820	7352540	remember the name of the song.
7352540	7353540	Bad Gay.
7353540	7354540	Help.
7354540	7355540	That's okay.
7355540	7357820	I don't know what song is at all.
7357820	7364140	Are there, are there any, see it to be somebody in chat who knows their music help.
7364140	7365140	They break free.
7365140	7366140	That's it.
7366140	7367140	That's it.
7367140	7368140	How can I forget that song?
7368140	7369140	It's such a good song too.
7369140	7372140	This is the part where I break free.
7372140	7373140	All right.
7373140	7375500	Anyway, that's, that's, that's it.
7375500	7376500	I'm never doing that again.
7376500	7380940	If you could see, if you see me looking at my, my cam right now, I'm looking at you,
7380940	7381940	Rob.
7381940	7384260	I see you through the internet and I'm judging you.
7384260	7385260	Stop it.
7385260	7386260	All right.
7386260	7387260	I feel awkward.
7387700	7389660	All right.
7389660	7390940	Now my story.
7390940	7392620	So let's talk about this.
7392620	7397720	So a lot of people dunking on Niantic today on Twitter, uh, because of Pokemon Go, which
7397720	7399720	is still going.
7399720	7404420	But as it is August 1st, you may or may not recall Niantic said they were going to be
7404420	7409240	reverting some changes that they had made due to COVID and all this, they were going
7409240	7412100	to be reverting some of that on August 1st.
7412100	7416060	And a lot of people are pissed off that they made good on that promise today.
7416060	7422300	And the big one is you can no longer spin pokey stops or gyms that are 80 meters away.
7422300	7428060	The radius is back down to what it used to be 40, which is very similar to what, um,
7428060	7431900	uh, the, the, uh, range is always been an ingress.
7431900	7432900	Sure.
7432900	7436940	Lower it when we have new variants, you know, out and people are stupid.
7436940	7437940	Exactly.
7437940	7439500	You saw the Lollapalooza thing, right?
7439500	7440500	Exactly.
7440500	7441500	Well, I'm sorry.
7441500	7442500	Massive spreader event.
7443100	7446140	Vaccinations were required to get into Lollapalooza too, though.
7446140	7451540	Um, people, but anyway, um, the, uh, Oh, what was I gonna say with all that?
7451540	7455740	The, um, interface game?
7455740	7456740	Yes.
7456740	7457740	Radius?
7457740	7458740	Yes.
7458740	7459740	The, the, Oh yeah.
7459740	7463620	So, um, a lot of that was in response to COVID and all that.
7463620	7465620	Um, but I, here's the problem.
7465620	7467820	Here's the problem.
7467820	7471020	I think that change was never really about COVID.
7471020	7472420	It really wasn't.
7472420	7477740	Um, I think they made certain concessions so that people would keep playing the game
7477740	7481860	and so that they wouldn't complete, like obviously the remote rating was put in and all of that
7481860	7482860	stuff.
7482860	7487980	But, um, 40 meters is still a pretty, I just, I'm going to preface this, I'm not defending
7487980	7495380	what Niantic did, but I think the error is not, it's, it's, it's how they did it.
7495380	7496720	So they doubled the distance.
7496720	7498540	They said, because of COVID we're doing this.
7498540	7503160	And then they said, this is a change that's probably, that's going to be permanent, basically.
7503160	7505480	They went back on that.
7505480	7507140	That's the first mistake they made.
7507140	7512620	The second mistake they made was when they went back on it, they put, they, they used
7512620	7515420	COVID as an excuse.
7515420	7518780	That I think is the biggest problem they made.
7518780	7523700	They're they didn't, they never scaled it up, in my opinion, due to COVID to begin with.
7523700	7529380	And for them to now say, well, because COVID is, you know, uh, you know, we, we, we have
7529380	7535280	a different standards now, rules now, whatever, uh, we're going to take this part away.
7535280	7541040	And I think they're using COVID as a crutch and an excuse for something that was generating
7541040	7542040	revenue.
7542040	7544620	And that was people buying Pokeballs and things like that.
7544620	7550620	So, uh, that's the tacky part to me is that they never should have scapegoated it as a
7550620	7552260	COVID thing to begin with.
7552260	7555300	And they certainly shouldn't be doing that now.
7555300	7557660	And it's pissing off a lot of fans.
7557660	7558660	It's just rude.
7558660	7561380	I just don't, I don't think fans are going to stop playing the game.
7561380	7562540	I really don't.
7562540	7567540	Um, I even saw the guy from Serebii and I'm not, you know, I'm just saying big names in
