start	end	text
2265628	2269209	How can we better educate everybody on the coin line?
2269229	2272889	I bet there might be people listening to this show right now.
2272909	2273690	Very practical, thank you.
2273790	2276830	Oh, you mean like, tell them how can you...
2287049	2288450	It's like, uh-uh, they don't care.
2288470	2288891	They don't care.
2288911	2290852	They just want to give them their money.
2315936	2317405	Well, you know, one can't say...
2322023	2324365	Well, you know, there's a nerd fucking a syringe on here.
2324405	2326646	Do you really want your kid to play?
2326666	2327947	No, I'll play for him.
2327967	2336773	Well, actually, you know, I think that, golf fans especially, do they really want those angry people either yelling at the players or yelling at them?
2336813	2339695	They just say, oh, fuck the players, let them yell at them.
2340175	2341656	So, hey, good point.
2341756	2346920	I think there's a little more to that, because if people are yelling at the players, the players are obviously, you know,
2351838	2352418	It doesn't matter.
2352438	2354159	They're always going to get complaints.
2354239	2354979	It doesn't matter.
2355079	2357360	It's just a matter of who's going to complain.
2357460	2360361	So, sometimes they do, sometimes they don't.
2360381	2363502	Yeah, I mean, sometimes they do, sometimes they don't.
2364402	2368923	From my experience, either they won't do it or they'll take a long time to do it.
2369043	2369824	So, I don't know.
2369844	2373765	But, I mean, I think this is where stuff has been done.
2373825	2374685	But, I don't know.
2374805	2378406	As far as the whole coin line, it's more of an implied thing that
2381765	2386867	you know, set rules that anyone has to follow according to mine you know, they can just say fuck off, I'm gonna play right now
2387806	2391049	I don't know about those people who just jump off coins and leave.
2391110	2397055	Now that's something else that bothers me that I see, and this happens at the really, really crowded places.
2397075	2401099	Say, an arcade in the Bay Area is the very first place to be a brand new machine.
2401619	2403081	Fifty coins up on the damn machine.
2403101	2404822	You have no idea who's going when.
2404863	2412550	Somebody will just put their coin up there, they'll leave, they'll go play some better games for an hour or whatever, then they'll come back and go, oh, by the way, it's my turn.
2415471	2415851	I don't know.
2415871	2420254	Do you think that if somebody puts a coin up, they should be obligated to wait there until it's their turn?
2420414	2423916	It's like they're paying their dues, they should wait there to go?
2423956	2425697	I don't want to play it that badly.
2425717	2426357	Not necessarily.
2426417	2433721	I always end up leaving coins on the machine, and I'll just say, okay, there's two people in front of me, that's enough time to play one game fair, fair, and come back and watch.
2434081	2438703	You know, I kind of estimate how much, you know, how many people are going to be in front of me, and then I'll go back.
2439044	2442846	What I use when I put my coin up, go play something else, come back, there's no coins on the machine.
2442886	2443366	What do y'all do?
2444762	2445842	and that will be his pocket.
2445942	2460645	Like, if there's ten coins up on the machine, like three or four weeks ago, and I was exalting all these people on the boards, the Sack of Money boards, we're talking about, God, I hate how people just put their coins up and then leave and come back after an hour.
2460665	2464366	They go, oh, it's my turn, because even though they've turned ass about five times.
2464766	2472908	So what I do is I put my coin up, count how many are before, and as soon as that person's done playing, I yell out through the whole arcade, I'm next in five people!
2473689	2475070	No one takes my turn.
2475430	2478091	And then so everyone knows just like when my turn is.
2478111	2478992	And it's worked every time.
2479012	2482294	That's why, that's kind of similar to what I try to do when I get in the coin mine.
2482394	2486216	If I put my coin up, I go, okay, who is the last person to put their coin up?
2486276	2488497	I'm going after that person, the hell with the rescue.
2488597	2493280	Although, I almost got killed by a little kid, a little, I think a little four-year-old threatened to cut me.
2493320	2493800	It's fucking awful.
2493840	2496021	And when I, I got up there and said, I'm playing.
2496081	2501444	Because this person, but they're joking that she starts on a, yeah, yeah, yeah, yeah, yeah.
2508476	2509417	Thank you for watching!
2534262	2543064	Have you guys heard of any other methods of keeping track in the coin line besides, or I'm sorry, keeping track of when you're trying to exploit the money besides coin lines, finance sheets?
2543684	2545124	Brad has a smart ass comment.
2545224	2547505	I know I punch you in the face.
2547545	2548025	Thank you.
2548045	2548805	Thank you, Brad.
2548845	2550746	How about maturity?
2550786	2552146	How about some maturity?
2552206	2560728	I think that's really the thing that's important here because if somebody else is trying, if, you know, before you're asking, you can say, you know, I know when my turn is.
2560788	2562668	If somebody's wrong, I'm not going to apologize.
2564076	2564756	and so on.
2587396	2589857	Yes, and that's where our emotions start to crash.
2589877	2592338	The times I try to be nice, that's exactly what's happened.
2592398	2594399	And then it's like, okay, why did I bother?
2594439	2595459	Why should I be nice?
2595479	2597100	That's my education by gunpoint.
2597280	2606643	So what they need to do is have just like the customer service desk, that Target and that Deli and stuff, the now serving sign is take a number.
2607384	2615889	I was actually thinking that would be a great system to use in a tournament, actually, because I don't know how many tournaments you guys have been into, the PA portions.
2615909	2617770	We're going to tap and everybody's qualifying.
2617890	2622793	It's like, they'll call the next person, and the next person, Oh, that guy's playing Parapara right now.
2623154	2626215	We've got to go get him when their game's finished.
2626456	2630638	And everybody's standing around there waiting for two minutes.
2633353	2634554	That would be a good idea to use.
2634574	2640878	Use the little pull tabs things, or not necessarily the pull tabs, but have the little counter, and it's like, your number is so-and-so.
2640978	2647522	So when it's about four people before you, you better be waiting by the machine, because you're trying to qualify or you're out.
2647562	2651525	I thought that was a good way to speed up urban snack trends in the future, getting around those mistakes.
2651545	2654367	But do you think that would work in a normal arcade setting?
2654407	2655708	I don't think so.
2655728	2657969	You go through a lot of that stuff.
2658009	2659770	And then who's going to pay for that?
2659850	2662212	And I'm going to have to take five in a row, so I
2674298	2675219	Do I have to?
2675259	2675659	Oh, yeah.
2675699	2682283	So like having those little numbers at Carl's Jr.?
2683704	2685826	Well, what happens to those numbers at Carl's Jr.?
2685846	2686426	They get stolen.
2686446	2695352	How many of those A-hole hecklers, though, are going to just take numbers and go away, though?
2695392	2696413	Eh, let's just put this way.
2696433	2699255	The problem's never going to go away.
2699275	2700356	People are too tempted.
2703138	2704039	Thank you for watching!
2731877	2736079	You know Mom, unless it's our machine, we can't really establish anything.
2736099	2740981	We can try to do a lot of stuff, but you know, it's not our machine.
2741121	2745102	I know we care about it, but we can only do so much.
2745182	2746703	It's not our machine.
2761338	2762399	That's all they care about.
2762419	2768562	They don't care about you and your feelings, and they don't care about if you spend five dollars or five people.
2768662	2769082	Exactly.
2769122	2770122	It's not our machine.
2770563	2774284	We can't, you know, make any kind of fool over itself.
2774925	2778406	Shouldn't our data have to take that extra responsibility when they buy a video machine?
2778787	2779827	What, fix the goddamn thing?
2779847	2780727	Maintain the goddamn thing?
2780788	2781788	Oh, you mean work?
2781868	2783549	No, what are you talking about?
2783589	2785290	I'm talking about the lines.
2785350	2785630	Uh-oh.
2788668	2793409	I think games have had this problem since Street Fighter 2 came out.
2793489	2795210	I guess the token line kind of evolved.
2795230	2797870	They are a family amusement center, correct?
2797950	2800991	So they should be doing something to manage it.
2801091	2803791	I think that falls under the line of customer service.
2803911	2807552	And as usual, most places have poor customer service.
2807692	2813934	And there's nothing you can do about it until somebody either gets killed or gets sued or gets fired.
2813954	2814694	Don't forget about it.
2814714	2815434	I mean, look at this.
2816198	2817920	People don't know how to take turns.
2818240	2819942	I mean, we learn that in kindergarten.
2820122	2823606	How sad is it when we can't take turns?
2824206	2826508	People don't understand the concept of taking turns.
2826949	2827549	That's really sad.
2827569	2830572	Why are these people working for a living?
2830612	2832634	They understand, they just don't want to do it.
2832654	2836939	You know, people fly our planes, you know, serving our government.
2837519	2839201	Running our country.
2843412	2845994	Yeah, I'm not that cool.
2846094	2847815	I don't have that great of a job.
2847855	2849536	Hey, it's just a cross-section of America.
2850077	2851578	Well, cross-section of all you people of America.
2851618	2863386	Alright, anybody else want to say anything on the coin lines, taking turns, things we should have learned in kindergarten, things on that note?
2863446	2866988	And on that note, we're going to take another break.
2867008	2867668	We'll be right back.
2870169	2871011	Thank you for watching!
2955960	2957707	Thank you for watching!
3033993	3034854	Thank you for watching!
3351994	3359977	Warning, Orange Lounge Radio, on a music and more program, might be dangerous for you to listen to in the kitchen.
3360418	3370522	We have reported incidents where exposed listening to this program in the kitchen has caused people to bust out a sharpie pin, draw arrows on the tiles, and start stomping away.
3371442	3375004	A friendly public service announcement from Orange Lounge Radio.
3375644	3378665	We are back here on Orange Lounge Radio Live.
3380871	3383313	I want to turn the mic over to Mr. Paul, a.k.a.
3383333	3387155	Pauliver, to talk about Drama Drama Revolution.
3387235	3393139	Yes, that would be all of the drama that goes on on the online community, on all the different bulletin boards out there.
3393159	3398162	Paul's volunteered, I guess, every week or even help us out with this.
3398182	3400063	You know, there's a lot of stuff every weekend.
3401846	3403267	There's a lot to enter, so.
3403307	3411655	Well, every week, if there's enough material, material pending, and Paul's attendance to the show, uh, pending or whatever, Paul wants to give a wrap-up.
3412075	3414037	And we're going to call it Drama Drama Revolution.
3414057	3416419	So go for it, Paul.
3416880	3425808	Last time on Sack of Money, Antonio and Meg, and Marikano and my boy, were infuriated by a girl who turned into a giant dragon eating them both.
3429332	3431313	and Nathan McClossett playing Delta Flavor.
3431333	3441219	Then DarkSakura came in, using her mod power, killed them both, and we tried to, you know, steal some order in the whole thing, but it didn't get any greater.
3441259	3446823	And then, on New York Rim, I couldn't read anything with the golden summary, and I got
3464124	3464804	I mean, God.
3465484	3466205	Everyone's just gone.
3466225	3466945	Everyone died, I mean.
3467065	3471005	Any other words you want to wrap up for us?
3492629	3494610	Alright, we'll go on to our revolution.
3494630	3502733	Thank you very much for all your support.
3502893	3503573	Irene has a joke.
3503593	3505494	Alright, we'll cut the joke and then we'll come back.
3505534	3509075	We'll take a quick break and then come back for the top of the hour.
3509695	3510255	Or whatever.
3511556	3512536	Yeah.
3512556	3515637	You want to tell your joke?
3515677	3517658	What do you call a deer that has no eyes?
3518522	3518902	What?
3519303	3520304	No idea.
3520604	3524748	What do you call a kid that has no eyes and no legs?
3524768	3525088	What?
3525448	3526589	Still no idea.
3526670	3527430	Oh, I got loose.
3527590	3528211	All right.
3528331	3528771	Okay, go.
3529192	3529392	Okay.
3529472	3534156	Anyway, we're going to do another song, and we'll be back.
3534196	3534697	Here we go.
3619139	3621540	DarkSakura, DarkSakura, DarkSakura
3641816	3644097	You're very famous in the Bomani community for something, Irene.
3644117	3646697	I don't know if you want me to bring this up on the show, but I think it's funny.
3646717	3649158	You want to tell us about it, what you're famous for in the scene?
3649178	3650578	Yeah, I think maybe you should explain it.
3650598	3652358	You want me to explain it?
3652378	3655399	Well, we had this tournament in Sacramento back in October.
3655419	3658180	We are S.C.A.T., Sacramento's Cosplay Internment.
3658200	3659280	No dirty connotations at all needed.
3659380	3662280	And you happen to be one of our judges from Resale.
3662320	3662380	Yes.
3665361	3667883	We ended up having an equal, I believe, male and female judges.
3667903	3669624	No, we had more female judges than male judges, didn't we?
3669704	3673987	I don't remember, because we had you, we had Iwana Girl, Sharks Girl, and DarkSakura.
3674027	3674847	Yeah, we had four.
3674867	3676368	Jamie was a judge.
3676408	3678070	Jamie was a judge, yes, actually.
3678970	3681131	But you were the infamous judge on Freestyle.
3681152	3681412	Yes, yes.
3683937	3688298	Because you wrote on somebody's card, I would have given it a higher score.
3688338	3689758	What was it you wrote on his card?
3689858	3694839	I believe a higher score would have been given if Mira wasn't being what I wrote.
3694899	3696400	And I gave them a score of 80.
3696800	3697100	Yes.
3697340	3698280	Which is a bad score.
3698300	3700120	Which is a B. You know, what's wrong with a B?
3700160	3700821	You know, but anyway.
3700841	3702561	But you took a lot of heat.
3702601	3704781	Well, you didn't take a lot of heat for this movie.
3704801	3707302	All of Sacramento took a heat for it, but that's okay.
3707382	3709242	And you know why I didn't take a lot of heat?
3709282	3709482	Why?
3709622	3710423	I don't know.
3710483	3711743	I don't know.
3713487	3717031	You know, so, yeah, anyway, I guess I didn't say what I didn't say.
3717451	3718713	Yes, I am, but I like this.
3718813	3721175	Like, I don't care about if people get mad.
3721195	3722497	Well, what do you want to know?
3734386	3740448	or what do you have to say to the people that are like, what the hell are you thinking is a mirror thing and why would you give it a lower score?
3740548	3741909	And of course you use mirrors.
3742109	3743069	Well, like Brad Pitt.
3743229	3743949	Fuck the police.
3744129	3747611	Well, um, I can judge however I want to.
3747631	3753233	That was one of the criteria of judging was judge however you want to and don't be biased or anything.
3753253	3756254	You know, mirror is a boring thing to me.
3756354	3760815	Everybody uses mirror and it might face them towards the audience, but I don't give a shit.
3760895	3762636	Practice it backwards, you know, and
3763975	3771481	Yes, it was all the same shit, and it was good, and I gave him a high score, 80 is a high score, you know, that's a B, like I said.
3771521	3777225	So, you know, and then he wanted to be a whining, complaining shit, you know, and I'm like, whatever, I don't care.
3777245	3779366	I'll do what I want, I'll do what I want.
3779586	3779766	Uh-uh.
3779806	3783449	Yeah, so, you know, that's all on that, I guess.
3783849	3791134	Okay, well that's how you're famous in the community, so I thought we could explain that for everybody.
3791154	3792455	Yeah, that's the only way I'm famous.
3798405	3804288	I, you know, yeah, Dave showed me this ForthMix extra challenge mode.
3804568	3808010	As long as I'm in VR, I never checked out this challenge mode thing on ForthMix.
3808030	3808130	Why?
3808170	3809311	It's from the last week.
3809351	3809591	What?
3809611	3810171	Forget it.
3810231	3813153	Sorry, I wasn't here, really.
3813193	3819436	No, but it's weird because it, like, one of them, they didn't want you to hit the same arrow twice.
3819456	3822738	They had to play 59, and you couldn't hit the same arrow twice.
3822798	3824099	It was really weird.
3824239	3826140	And the next last one they just did was, uh,
3826775	3828396	It was, have you never been to Noah?
3828516	3836361	And you had to hit 350 perfect, and it was all just running left and like, yeah, 16th notes, just all the way down.
3837782	3842005	But it was just like, it was just like left, down, left, down, left, down, and really quickly all 16th notes.
3842045	3844547	It was pretty weird, and I thought it was stupid, but anyway.
3848246	3849266	Okay, oh great.
3849286	3852628	Did you have that sound effect of a screeching train coming to a halt?
3852768	3854169	That's what I'm doing right now.
3854229	3856570	I know, I don't have the screeching train, but I do have it.
3856670	3860331	I'm going to get one of those, because I'm going to be stopping the show.
3860351	3861032	That works pretty good.
3861072	3862933	It's bringing the show to a halt like I am all the time.
3862953	3864513	You know what other great sound effects I have?
3864593	3867034	I haven't found a use for this yet, but you know what?
3867094	3872197	If Irene ever pisses you off, you can just, you know, say, Hey, Dad, what's up?
3872217	3872337	Yes.
3872357	3872577	No.
3872657	3874318	Anyway.
3878263	3881026	I will be doing the fucking... Sorry, anyway.
3881106	3883028	I'm getting away from Inside Joke City.
3883128	3885730	And I'm talking about, oh, Polyglass Krispy Kreme.
3885770	3886291	I saw that.
3886551	3887052	You see?
3887112	3888593	He picked up the whole thing.
3888633	3889934	But none of us were looking.
3889995	3890595	You little man.
3890655	3895440	He wants to say something, but he can't because he has a mouth full of those, you know, those you can't see.
3895480	3896521	He's not a fat guy.
3896581	3897982	He's a very skinny, white guy.
3898002	3898863	Yeah, I love Krispy.
3899023	3900204	Okay, anyway.
3909107	3912868	Anyway, anyway, eat him and fuck him!
3917589	3919790	Um, this is my Arunco guy.
3920290	3921430	Can you say your guy?
3922911	3923731	Yes, Rob.
3923911	3926612	I'm surprised you haven't found out by now.
3926852	3931593	Thanks for finding out about our temporary goals here at Orange Lounge.
3931633	3934594	Anyway, speaking of Orange Lounge and everything, um...
3935282	3938584	Outside of this talk show, the whole rest of the week, we have a music program.
3938604	3940986	We are all sorts of Amani music, 24-7.
3941006	3947010	We throw in some Dance Mania tracks, some other stuff and some random games like Parappa, Bust a Move.
3947030	3949332	You know, all those other games that kind of led us to playing DDR.
3949372	3953495	I don't know about you guys, but before I was playing DDR, I was playing Bust a Move, Flash, Bust a Groove, too.
3953515	3955356	So, I'll find out.
3955376	3959119	So we have some songs in from that to kind of remind you of those days.
3959179	3960360	And we have a segment called...
3961098	3962858	Not in any of the money game, but should be.
3963219	3970940	And one thing I've been hearing from some people who have been listening to the stream pretty frequently is like, you've had the same damn two songs all week long.
3970980	3977122	You had Republic at Ready to Go, which was my choice, because I thought that was a pretty cool song for guitar freaks to be a really good song.
3977202	3986504	And also it's kind of got, it's got that vibe of it used to be a 90s hit, you know, a one-hit wonder band, and they've disappeared off the face of the planet.
3986524	3989245	Republic has nowhere to be seen anymore, which is totally...
3989861	3993444	Just like every other DDR band and song I've seen.
3993544	3995585	It's just some one-hit wonder band that's not around anymore.
3995606	3998087	So I thought it would be good for DDR.
3998127	3999749	And Jamie's pick was Shannon.
3999769	4000429	Let the music play.
4006022	4009003	What songs should be in the damn game that's not already?
4009143	4015866	And my choice for this week is actually going to be an old, kind of dating myself here, Yaz with Don't Go from the 80s is going to be my pick for this week.
4033993	4035334	You know that song?
4035394	4035855	Yeah.
4036055	4036956	Oh, I know that song.
4036976	4037196	Yeah.
4038016	4039037	I'm a girl.
4039097	4039678	Anyway, yeah.
4039698	4040579	That's a good song, though.
4040599	4041960	That's a good choice.
4042240	4045503	Because, I don't know, I kind of hear it as a 2DX song.
4045523	4047084	I think that's a good choice, but it fits perfectly.
4047104	4049006	What song do you think should be in a Bomani game?
4049026	4050928	What Bomani game do you want?
4050968	4053590	Well, I chose something for 2DX or, you know, 2DX.
4061207	4064148	And I chose a song called You're Not Alone by Alice.
4064688	4066228	That's because nobody knows that song.
4066368	4067029	I know that song.
4067489	4068289	Yeah, nobody else.
4068849	4069409	Which is okay.
4069469	4073190	And, yeah, like, nobody knows the song, but it's a good song.
4073210	4073450	Sheesh.
4073470	4077651	Why do you think this song should be in the air?
4077671	4079052	Because it's a good song.
4079172	4081012	I think it fits perfectly, um, that track.
4081132	4084593	I'm not playing You're Not Alone right now, am I?
4091489	4095273	Well, I know that maybe everybody out there has heard those songs, though.
4095333	4096114	Yeah, I know.
4096154	4100198	Well, if they hear it, they'll probably understand why.
4100258	4102119	So you think all of you know Longstreet?
4102139	4103020	Yeah, I think so.
4103040	4105663	Like, everything from the girls is in TVXQ.
4106003	4108185	I think that's kind of the genre, isn't it?
4108205	4110107	Like, five items.
4110127	4110327	Cool.
4110347	4110708	Cool.
4110908	4111228	Perfect.
4111548	4111708	Okay.
4111728	4112469	What about you, Brad?
4112509	4113170	What songs?
4115461	4126108	Okay, I just played DS with the three guys last night, but the one I don't want to... You can have your Crystal Nuts more than you, but Crystal Nuts song, uh, I'll... I don't know what it is.
4126148	4127429	Name of the game, yeah.
4127469	4128429	That should be in 3DX, though.
4128469	4131111	If there was any song I would like to have in 3DX, that would be the one.
4131131	4132092	That's just perfect.
4132172	4137635	It's got, like, all the great scratching along with just some great, you know, sounds almost like a tax song or something, you know.
4137655	4140617	I don't know if you want to play that for the audience or not.
4140637	4141778	So I'm going to pull up my list.
4141838	4142298	Let's see.
4142994	4144636	Let's just save it on my computer here.
4144936	4147017	It's in the directory there.
4148839	4150480	This makes for a wonderful radio.
4150540	4152602	Anything else you want to say about the song?
4152622	4154563	Which role is it called again?
4154583	4157205	Name of the game.
4157225	4157786	Name of the game.
4158666	4161288	Anything else you want to say about it?
4161388	4161829	It's good.
4161869	4163790	Oh, and it's kind of like a slide work.
4163810	4164170	Slide work.
4178112	4181195	What song and number money do you want?
4181215	4186019	Well, actually, one is kind of a little bit different.
4186039	4189522	It's the J-Trance, as I like to call it.
4189602	4191143	You mean, what was it?
4191243	4196607	It's M Above and Beyond by Amy Hamasaki.
4196647	4203253	Yeah, nobody in the VR community has ever heard of Amy Hamasaki.
4207611	4208631	I don't care.
4208651	4212772	DJ Big M should be here at the year's end.
4212852	4213832	And above and beyond.
4213912	4214753	Above and beyond.
4215313	4218133	I can totally see this in the next year.
4218213	4221554	You know, we're very, uh, fans of the DWI festival.
4221594	4223235	Actually, I've been on it, really.
4223255	4226235	Covered most of the, uh, cover songs we've got connected to these.
4237432	4238513	Oh, naturally he did this.
4238633	4239453	It's really awesome.
4239473	4242875	I have like almost every song I've heard in a year, actually.
4242895	4243136	Cool, cool.
4243156	4243916	What about you, Paul?
4244416	4244797	What song?
4244817	4246738	Well, this is a popular J-pop song.
4246878	4250020	It's been popular a long time ago.
4250080	4251701	I think it's really going to get old.
4251761	4254182	It's really rare and nice when people find you to play.
4254202	4257665	It's called Butterfly by a little band called Smile DJ.
4271597	4275080	I just wasn't born, I guess, when I was 15.
4275280	4276180	No, I knew that.
4276240	4281604	But if I came out, you know, only a couple years ago, I knew like several years ago.
4281624	4284406	But I was going to bat.
4285307	4286268	I don't care.
4286848	4287248	Yeah.
4287268	4288009	You know what they did?
4288049	4289830	Baby got fat.
4289850	4295234	Wasn't that on the King of the Hill thing when they did the DR parody on King of the Hill?
4295274	4298176	Yeah, but hey, if there's a one-hit wonder in this world...
4298852	4307602	The only other Sir Mix-a-Lot song I remember is that Jump On It or something like that.
4307682	4308844	Am I the only one?
