start	end	text
4309124	4311086	Yeah, but I didn't listen to Crap.
4320713	4323075	I'm sorry, in the 80s, it was all about Paul Adler.
4323155	4326138	Oh, actually, Paul Adler was like 1990, but anyway, who's coming?
4326318	4327379	Is anybody else?
4327439	4328100	Who else is out there?
4328120	4330222	Get the, get the, get the other row.
4330242	4330722	There you go.
4344952	4353194	We want to hear what you guys think is, uh, should be in the money this month, already in the money.
4353234	4354015	Who wants to go?
4354055	4354895	Why don't you go?
4354915	4355175	Go ahead.
4355195	4362937	Alright, what I think should be the new VDR song or something that's coming out this year is Baby Box's Love and Ecstasy.
4363037	4363257	And why?
4371753	4375216	DJ Ranma S, Actdeft, Drew, Carameldansen DJ Ranma S, Actdeft, Drew, Carameldansen
4395112	4399333	The song Freaky is kind of like MC Hammer, but you can't touch it.
4399413	4399593	It is.
4399613	4400253	Super Freak?
4400273	4401853	Super Freak, yeah.
4401873	4405794	So that's Disqualified.
4405814	4408275	Dave don't give a damn about the show.
4408315	4410675	He just wants to show it.
4410695	4411035	Yeah.
4411075	4418277	We're getting a suggestion from the chat room that in 2DX would be anything but that violinist trance shit.
4418757	4422098	And I think you would be referencing Vanessa May, who is...
4424116	4424636	DJ Ranma S, Actdeft,
4448382	4450443	I think I'm pushing the 800 song mark.
4450683	4452944	Oh, actually, you're probably about right.
4452984	4453164	Yeah, 1,000.
4453445	4454645	Well, I have 769 right now, I believe.
4454685	4458867	Are you talking about your own little collection you have on your computer?
4458887	4465050	Just basically, you're trying to compile everything.
4479542	4482703	Fan-made steps that are out there, and official ones, and stuff I'm making.
4482723	4488786	Another one that's pretty funny is called Duck Toy.
4488926	4492168	I don't know, that's by Hansenberg, it's like a rape song.
4505740	4507241	I don't know that one.
4507421	4508823	Then ERA, Big Cool Fat Mix.
4508883	4509863	That means Big ERA.
4510164	4512125	That's also a rotation on the station right now.
4512145	4516449	We decided we'd throw in some, they're kind of related to Bomani, but not really things.
4516529	4518210	So we have some remixes in there.
4518250	4520332	People kind of get sick of us now.
4520352	4520973	I'm working on it.
4520993	4522114	Yeah, you come in the file.
4522134	4522854	You come in the file?
4522974	4523094	Yeah.
4523154	4524976	Any other news in the community right now?
4525036	4525737	Emulation-wise?
4525777	4529400	Emulation-wise, the melting pot's down because Team Violet's hot down.
4529460	4531081	Actually, this is now that DDR Maniac
4535588	4542252	.NET, Holy Mayhem, Mirafor, Dance With Intensity, so you can actually use the file converter and download the program again.
4542792	4548535	It's probably all going to come up tomorrow since that's when the month is up and, you know, the bandwidth is probably gone.
4548555	4549316	Right, right.
4549356	4549616	Cool.
4550016	4550236	All right.
4551877	4554199	What do you think?
4554219	4554979	Should we take another break?
4555059	4556520	Any other songs anybody wants to add?
4557280	4559261	No, I think that'll do it for now.
4559482	4560202	Okay, come again.
4564605	4567246	You know what would be great, Mom and Dad?
4583315	4587437	You know what everybody would be saying if you started pairing to that song?
4587577	4593981	All right, we're going to take a quick break, and we'll come right back with more madness here on Orange Lounge Radio.
4594021	4594441	See you later.
4705808	4706949	Thanks for watching!
4872561	4873902	Thank you for watching!
5035845	5040027	Let's listen in on an Orange Lounge Radio staff meeting.
5054436	5059179	Extreme Babani Radio, that's us, Orange Lounge Radio.
5059319	5063141	You are listening to Orange Lounge Radio, episode number two.
5063201	5064922	Here we are, back and done.
5065817	5068460	Matt wanted to get in on the fun earlier.
5068500	5072603	We were doing the FU of the week, kind of trying to fill in for Jamie's absence this week.
5072623	5073524	She's off to Anime Expo.
5073544	5076307	She wasn't able to do it FU of the week, so we had one for her.
5076347	5080731	And Matt also wanted to get in, and he had a little bit of a wrap, as you must have seen.
5081638	5086522	Yeah, so my rant would be for those people that like to cut through the machine, namely Peripera and Dior.
5086542	5092686	Peripera, I always find people walking too close to me and end up backhanding them and that kind of thing.
5092826	5097990	Really, I don't care because if they're dumb enough to walk that close, I really don't care about hitting them.
5098010	5102033	But then you get those people who get pissed off when a game hits because they're walking too close.
5102113	5103534	And I actually tested this today.
5103594	5111040	I stood in the middle of a Peripera machine and stuck my arm out, and it actually, it's inside the machine, so these people are walking way too close to the machine.
5111835	5112315	and I hate them.
5112575	5113496	I hope they all die.
5113516	5116657	That pisses me off, too, when people do that on DVR.
5116777	5117937	And little kids do this all the time.
5118377	5126279	You'll be up there dancing, doing your thing, and then suddenly, you know how there's that little space between where the machine is and where the pad is?
5126319	5128540	A little kid decides that's the fastest way for them to go.
5128560	5132041	They'll run right between you and the machine when you're trying to play.
5132221	5136623	Like when you're in the middle of an Oni course or something, they just run right through the machine.
5136643	5137203	What the hell is that?
5141624	5161689	I gotta say though, ever since bad parenting, what Dolphin did a little while ago is that they took these little wooden platforms and kind of stuck them in between the machine and the pads, which actually I think really helped that because now little kids, if they want to do that, have to take a step up.
5161789	5165510	And I think most little kids are too lazy to do that, so they go around now.
5165550	5167831	So I guess problem solved in some aspects.
5167851	5171152	But now ParaPara seems like it needs some kind of moat built around it or something.
5172172	5174554	Seriously, I kept hitting this guy in the head.
5174614	5176895	You were hitting a guy in the head?
5176975	5177596	Well, okay.
5177636	5178356	He was bending over.
5178376	5179397	Was he four feet tall?
5179617	5182939	No, he was bending over and helping an old kid with a sumo machine.
5183019	5184360	And, you know, I hit him in the head.
5184480	5187982	I hit another guy, you know, in the ass because he was, you know... Hey!
5188022	5188082	Hey!
5195507	5196467	Thank you for watching!
5221286	5223929	Any suggestions on how a golf player can fix this problem?
5224229	5224509	Yeah.
5225170	5229394	Oh, well, there's no way to fix this problem.
5229434	5231856	Just, you know, people need to watch where they're walking.
5231896	5232637	I don't walk in front.
5232657	5233938	I mean, especially like mo-caps.
5233958	5236561	I mean, like walking in front of someone and playing mo-cap boxing.
5237041	5239604	I mean, if you don't want to get hit, don't walk in front of people.
5239644	5240685	Mass Execution.
5242376	5244697	I love all these practical solutions you guys come up with.
5244717	5245438	Rearrange the game.
5245458	5247338	You can't stay on the heat.
5247378	5248699	Get out of the kitchen soon.
5248999	5250160	I agree with you.
5250200	5252260	They should definitely rearrange the game.
5252280	5254921	Since MoCap's not working, why not put that there instead?
5254961	5256122	Put Parapara where MoCap was.
5256142	5263685	That's a good idea, but the thing about why they put Parapara and DDR and stuff in the area that they do is because there's arching, and they cannot fit through the arching.
5263705	5265926	I mean, I don't know why they don't just...
5271225	5272227	That's too high tech.
5272247	5275130	They have to pay an expert to do that.
5275190	5275670	I don't know.
5275690	5276651	This is what they're saying.
5276671	5280375	But that's why they keep them in that central area when you first walk in.
5280395	5281417	Nobody cuts through sumo.
5292786	5294867	You know, it's because I beg to differ.
5294968	5296789	I think sumo is a very gay game.
5296829	5300673	I mean, you've got this big red ball that people are sitting in.
5300813	5303155	It's somewhat fashionable.
5303175	5303755	Fashionable?
5303956	5305677	Fashionable.
5305757	5306238	Uh-huh.
5307759	5308720	Where is Shibamon?
5308780	5310221	Anyway, he should be on this show.
5312003	5313144	Shit, I just don't like myself.
5313224	5313704	I hope not.
5314725	5315326	Oh, okay, good.
5315346	5316387	Shibamon, where are you?
5322055	5323816	You know what's even worse than that?
5324237	5324637	What?
5324777	5326858	Kids that mock you when you're playing.
5327779	5328980	I have one of the worst, Brad.
5329000	5330160	Get Brad in here for a minute.
5330281	5332702	I want him to tell a story.
5332762	5334944	We have the worst hecklers this week at Golfland.
5335004	5336244	I want Brad to tell a story.
5336264	5339807	Brad, tell our listening audience about the hecklers at Golfland this week.
5339827	5340747	They were especially awful.
5340767	5346271	Well, there was these cavemen and they were like bouncing up and down behind me saying that they were, you know,
5349629	5355811	I was mad because I was losing, but I was asking the only love without getting any, you know, good sort of thing.
5356231	5359191	And so I said, you're even better than I was.
5359732	5360352	I don't know.
5360372	5361652	But I didn't say anything to him.
5361812	5366033	I just, well, I just stuck my finger on him and it happened to be the middle finger.
5366193	5368734	And he said, oh, you can't put me off.
5368754	5369834	So I did it again.
5369934	5373415	And he said, hey, if you do it again, I'm going to kick your ass.
5373435	5374915	So I did it again.
5374995	5376776	And I said, fuck off.
5376876	5377136	I'm going to
5377788	5379169	DarkSakura, DarkSakura, DarkSakura,
5403621	5415686	They didn't do anything, but I guess, you know, you get four or five guys together and they think, oh, it's only one guy, so, you know, what is it, Strength and Numbers or something like that?
5415726	5419447	Yeah, that really works, right.
5419467	5421848	Can't they know to drive Strength and Numbers?
5422188	5423129	Yeah.
5423269	5426530	Can't they know to drive Strength and Numbers?
5426550	5427891	No, it sure does.
5428991	5429231	What?
5429251	5431152	Can't they know to drive Strength and Numbers?
5434990	5439193	I have never been officially a droid addict, really.
5439473	5446077	Well, actually, I think the problem has kind of gotten better as far as people mocking me.
5446137	5453001	I mean, I remember we used to be playing on USA Mix and stuff back when we had 4th, you know, and just swapping off of that.
5453481	5457604	And I actually had, you know, little kids trying to pick fights with me.
5458384	5459145	For no reason.
5459265	5462707	I was just playing the game, and they just come up and try to pick a fight with me.
5463007	5463908	You know, I just kicked their ass.
5463968	5464168	I'm like...
5465057	5466537	Where the hell did you come from?
5466838	5472439	And then, um, Hulk Knight, you know, Eric was there, and then, uh, he's like, so, what the hell?
5472459	5472959	What's a kid?
5472999	5474820	And he's like, no, you and I are crackheads.
5474980	5477440	And he's like, dude, Matt, where'd you find this guy?
5477480	5478301	He's just hilarious.
5478741	5482242	And the Hulk Knight kind of does look like a crackhead, but that's okay.
5482322	5484122	Yeah, but... But he's a great guy.
5484162	5484882	He is, he is.
5485122	5487723	Yeah, I mean, he only teased because we love him.
5487823	5488143	Exactly.
5488183	5492704	But, you know, I haven't had any kids in such a fight with me, especially little kids.
5492725	5493525	That happens all the time.
5493585	5494485	I mean, seriously.
5496883	5499605	Hey Brad, you look like a Kraken.
5499665	5502526	Remember that one kid?
5506489	5508831	You know that one, dude?
5508931	5512954	Remember he was making fun of any of his youth and someone else?
5513034	5519658	And then... Yeah, and then he goes and plays on DDR and we come up behind him and we tease the crap out of him.
5519858	5520719	I mean, we are mature.
5520819	5525342	And then we all kind of go away because we found something more interesting to play for five minutes.
5525382	5528344	I mean, when I say we all, that means there was like about five, six, seven of us.
5528954	5534861	And then this little kid, when we're not looking, gets on the machine and starts playing, as if we're not going to notice.
5534941	5539247	And I remember, we all got up there and started cheering him on, going, yeah, go, da, da, da.
5539527	5543011	And then he failed his song, and he ran to the bathroom and cried.
5543292	5546956	Yeah, and we were like, you're so awesome, I want your kids.
5548693	5555180	I think the worst thing that ever happened, or not really the worst, but actually probably the most recent, was playing the machine.
5555380	5564170	I had this guy, they're just like standing there kind of mocking me, jump up right in front of me with the camera, flash, and then jump off the machine.
5564610	5565591	And he did that twice.
5565771	5566853	I had people like...
5567353	5571274	I have this black guy, you know, he's standing there, and he's like, who's there, what's going on?
5571294	5576876	Then him and his friend show up, and it's like, pretending to freak me, and she's like, what the hell are you guys doing?
5577117	5578497	They're just acting like total assholes.
5578517	5580858	Why didn't you jump on that shit, man?
5580878	5584779	They're like, oh, freak dances, oh, oh yeah.
5585660	5587300	I hope they just want my side, man.
5587340	5592542	Yeah, you know, that's a reference to a movie, I'm not really just, yeah, okay.
5598772	5608078	You know, that reminds me of an earlier incident I had online with people, which kind of took me away from people, like, what are you going to do with that?
5608098	5611880	I was playing Grameen one day, and the guy said, Jamie got kicked out of golf class.
5611940	5614201	He was like, they're coming up, lost my Grameen.
5614261	5617003	I was like, that one must be quarter black.
5617443	5618804	I'm convinced now.
5619004	5620345	I was playing some Grameen songs.
5620365	5623947	That was exciting, but I didn't think it was going to be that bad.
5624027	5627149	Wait, they were saying you were a quarter black, or they were saying Jamie was a quarter black?
5630651	5631673	Are you a quarter black?
5631693	5632975	Well, I like it, you know.
5633276	5633817	Okay, yeah.
5633897	5635480	Anyway, let's change the topic now.
5641205	5644888	Well, I got physically removed by somebody from the VR machine.
5644968	5647109	How did you get physically removed?
5647129	5650892	No, a guy jumped up onto the stage and grabbed me and threw me off the machine.
5651413	5653294	I was physically assaulted on the machine.
5653654	5655215	Were you raped on the VR machine?
5655235	5657497	No, guys, like I said, straight to numbers.
5657537	5660699	I got ten guys together and I'm like, hey, look, there's one person playing an arcade game.
5660719	5661500	Let's make fun of him.
5661880	5662861	And he said, you can't.
5662901	5663641	Let's gangbang him.
5663661	5663961	Yeah.
5663982	5665102	So I failed my course.
5665122	5666423	That's why I pissed on him.
5666523	5668285	I didn't care that he was being a jerk.
5668305	5668825	I was just like,
5669005	5682376	I failed the course, I was away from the dollar, so I pushed him and he said, oh no, you're going to hit me, but his friend stopped him, I guess, and I was like, yeah, you don't want to start shitting with me because I'm white and skinny.
5682456	5689983	Yeah, I could hit you with my lanky skills, really.
5692065	5693486	Matt has brought with him to the show.
5694175	5696676	This week, a lovely VCD.
5696796	5699216	You explain what the hell this is, Max.
5699276	5699817	I really don't.
5699837	5700857	I still haven't figured it out.
5700897	5704558	I watched 10 minutes before the show and I still haven't figured it out.
5704578	5708339	Actually, what this is, it's a VCD, actually two VCDs.
5708359	5712800	We've got one that's called Parapara Dance and one that's Parapara Stadium.
5712860	5714981	Everyone knows what Parapara Stadium is.
5715021	5718622	It's just Parapara all-stars doing the routines for different parasols.
5719301	5720562	So you can learn them.
5720582	5727148	But the first CD, Peripera Dance, is a bunch of different clips from this one variety show that's actually on TV.
5727228	5731172	It's starring Takura Kimura.
5731613	5732694	And this guy, that's it.
5733482	5736424	Yes, I believe it's Takuya Kimura.
5736464	5738005	Just thank you.
5738306	5739747	Alright, that's it.
5739807	5750735	Anyways, what this guy is, is he's a singer and actor from Japan who in the 90s started doing hers on TV and actually kind of made it popular again.
5751235	5755076	And so we've got a clip, I mean, because this guy, he plays a character called Bucky Camara.
5755116	5758797	Now, we have to remember that this is radio, and the audience can't see what we're playing.
5758817	5766599	Now, the people in here can see what we're playing, because it's on a giant monitor here, but we kind of have to do the best we can to make this radio-friendly segment, so you might have to explain what's going on.
5766619	5769280	Okay, well, basically, the scene starts off, it's kind of...
5774199	5787047	So what I'm going to do is, I'm sorry if they have a class that actually shows these people with almost looks like springs on their arms that actually, you know, kind of like those muscle springs to strengthen your arms.
5787067	5789208	Kind of like buns of steel, that sort of thing?
5789249	5790049	Yeah, that type of thing.
5790309	5795793	Anyways, so let's get started off with them and doing this, and I'll kind of narrate this as it's going along.
5795833	5796393	So here we go.
5796413	5799635	And you have to spin up.
5802893	5803954	And we need the volume.
5806936	5809597	Okay, so basically things getting faster and faster.
5809617	5813159	We're kind of speeding up the film here in a ridiculous fashion.
5813179	5814100	This is goofy.
5814200	5817422	Yeah, it's a Japanese goofy style here.
5818042	5820384	And the springs are breaking dramatically.
5821504	5822845	Because, yeah, it's a humus tour.
5823025	5826828	And now enters Buffy.
5826848	5830190	Whose theme song is Maya Fierce?
5835256	5855516	and they're showing us a statue of him, a bust of him and out he comes with the Iron Paragunther with the lights everywhere and stuff and a poopy bottle and now he's going to do a passport turn the beer which I must add, I like this car, I think it's awesome
5860615	5861516	Here he goes.
5861656	5862857	Oh yeah.
5862897	5863937	Michael Korsnick.
5863957	5865298	This is one of those guys.
5865318	5870942	Definitely.
5871002	5871823	He's my idol.
5871863	5876046	Yeah, how come the English school in New York has an idol like an ass?
5877707	5880849	I mean, all the schools in the United States.
5880869	5882830	No, no, I think, I figured it out.
5882910	5886413	It was cool because he has 50 hot Asian women behind him.
5886453	5886993	That's why.
5889489	5897773	Anyways, this is pretty much the normal part of the video, him doing this routine, which is... He's just got a lot of style.
5897793	5898813	He just is very cool.
5898953	5901734	And now it gets ridiculous.
5901854	5908577	It's showing him perfecting his technique, his end pose, as you might say.
5908597	5910098	Now he's getting ridiculous.
5910238	5911358	It's a Kofu Haramata movie.
5922799	5924140	He's poking past lasers.
5925481	5927963	He's got people fanning him down, his arms and stuff.
5928003	5929424	He looks like Gatsby right there.
5929684	5933366	And now he's gonna do the traditional kung fu thing with the candle and moving fast.
5934147	5935268	And blow his candle out.
5942133	5943213	And he's still dancing.
5946256	5949538	In the classroom, I might add, with all the disco lights everywhere, out of nowhere.
5950882	5955046	Now everyone's stopping, he's ripping off his shirt, and under his shirt is that spring.
5957888	5959870	He's putting the metal things on there.
5959930	5962873	And they're taking the springs off.
5963313	5964474	They're taking them off.
5964514	5967897	And now he summons for his assistant, some hot bathing shirts.
5968017	5969598	And here he goes.
5969859	5973742	Oh, and his final move, and the dress comes off.
5978468	5980549	Everyone cheered because it's so stupid.
5981289	5984030	All the Asian women cheered because they got to see a panty shot right there.
5984050	5984531	Marilyn Monroe.
5984551	5985391	I know the Marilyn Monroe.
5986271	5988292	All right.
5988412	5989572	Let's do one more question.
5989592	5990913	Any more of this crap?
5991293	5992373	Yeah, worst radio ever, guys.
5992393	5993313	Worst radio ever.
5993454	5993814	Okay.
5993834	5994754	That was great.
5995594	5999215	We're being experimental, damn it.
5999235	6000576	So let's give it one more chance.
6000676	6003017	I really wish I could all see this because this is actually...
6004369	6006751	Maybe we can put some still images up on the site later.
6006832	6008393	Yeah, you need to rip some of this.
6008473	6009875	I'm going to put this on the site.
6010215	6010675	Oh, definitely.
6010695	6012657	You know, I may want to rip.
6012978	6022227	Okay, and now we're going to have the theme's inside of a club, and there's some J-pop singer who I have no idea who it is.
6022287	6024609	And the theme appears to be some sort of cover of EQ Up.
6034441	6047493	And he comes out doing his Night of Fire bit.
6047633	6050936	And there's Persistence raging out of stage now at Phantom of the Opera.
6051736	6053098	Or Phantom of the Parapara.
6056020	6057341	Phantom of the Para, guys?
6062373	6066095	And he walks through microphones right here for no apparent reason, I don't know why.
6066155	6068496	And then he walks away.
6068536	6072077	Then he can, uh... He's doing a pose and the camera swings.
6072137	6073958	And he's doing another turn.
6074038	6075219	Okay, one more here.
6075299	6077440	Okay, we can only do one more.
6077500	6079260	If I can cover V2 up, I think.
6091435	6095738	DJ Ranma S, Actdeft, Drew, Carameldansen DJ Ranma S, Actdeft, Drew, Carameldansen
6113493	6117294	And there's old people playing croquet, and there's a guy in a coat that you can't see his face.
6117354	6119235	And that's his trademark whistle there.
6139446	6141187	Oh, get out of here, Robin!
6141327	6142568	I guess in the dark.
6142668	6143429	It's dark!
6143489	6151654	And all of a sudden, the outside becomes... Is this the life in the yard?
6151834	6154716	And he's doing another fire again.
6166625	6170466	And he's noticing people aren't dancing, and they're staring at him like a nut.
6170686	6175067	And the old guy recognizes him as Bucky.
6182268	6185349	And so he's going to put in a tape that the old people can dance to.
6185489	6188990	Oh, I see, because old people don't listen to CDs, they use tapes.
6192065	6201035	Night of Fire Upward Version Nothing is more funny than watching a bunch of old people terror in a facility.
6218809	6220969	This is what you're going to look like in 60 years.
6220989	6223710	This is Milpita's stall plan in 60 years.
6223750	6226111	Alright, everybody give a big hand for Madness.
6226151	6228391	We're getting a comment saying, this is sad.
6242998	6244680	Alright, that about sums it up.
6244760	6250866	On that note, we're going to go ahead and take one more quick break and then we're going to come back and wrap it all up here on Orange Lounge Radio.
6343854	6344921	Blow my whistle, baby
6542441	6545904	We often wonder how some of those Bomani songs are chosen.
6551970	6552811	We think we figured it out.
6552831	6553852	Orange Lounge Radio.
6567779	6572301	You are listening to Orange Lounge Radio, just about at the end of our second show.
6572741	6576162	I am your host, Rob Roberts, or you might know me as Skye.
6576182	6579643	DarkSakura, Jamie Summers, is not here this week because she's at Anime Expo.
6579924	6581604	So filling in is the lovely Irene the Rice Princess.
6581624	6583585	And of course, we also have in studio many, many guests.
6583645	6586626	And I'd like to thank all you guys for coming this week, as she did last week.
6586646	6593048	We've got Matt, we've got Paul, we've got Brad, we've got Bradley, who doesn't say anything, but he gives moral support.
6593088	6595729	And in the other room, we've got Glenn and Dave.
6595769	6597030	Dave's coming in the room right now.
6598564	6603966	I guess I thought I'd ask you guys at the end of the show, but I really should have asked you guys at the beginning of the show.
6604006	6604646	How was your week?
6604686	6606887	Anything exciting going this week?
6606907	6609068	Anything you want to talk about openly on the radio?
6609148	6610008	I work all day.
6610028	6610768	Parking every day.
6611049	6611489	Parking?
6611549	6613249	Freaking Brazil.
6613489	6614930	And Sunsplash Parking.
6614990	6616450	Their whole parking lot was full.
6616510	6618351	Parking across the street was full.
6618371	6626074	If you wanted to get to the Sunsplash, you either drive around the parking lot for half an hour like I did, or you go park across the street at the hotel, which probably also was full.
6626494	6626634	Wow.
6627342	6629263	What was something going on there today?
6629283	6630884	Yeah, it's called the water park.
