start	end	text
7044714	7047275	And then this year would be my second favorite E3.
7047516	7052179	I felt that I just... I got to do so much this year that I hadn't done in years past.
7052219	7057683	And I was keeping myself so busy with stuff that I was very pleased with the show this year.
7057703	7059384	And I think there was just a lot of good tech to see.
7059804	7062045	Because I don't think last year's show was very good either.
7062125	7064907	That would probably be my second least favorite show next to the 06 show.
7065787	7066648	So I would rank them 04, 10, 05, 09, 06.
7068689	7074312	Well, I can't really rank any of mine.
7074452	7077253	I mean, there's good experiences and bad experiences.
7078294	7080555	And not all of them I link with the convention itself.
7081596	7083897	So I would say...
7086966	7093448	I think that I really did like 2006 just because I got in a ton of awesome interviews that year.
7094588	7099310	And the year before that was pretty cool too because I piggybacked on my friend's press pass.
7100710	7102551	And the year before that was great because it was my first E3.
7104171	7104932	and I got in.
7105152	7112661	I'd actually have to say though that my favorite experience of all the E3s was meeting Koji Kondo and getting it.
7112741	7117647	I found the little book with his autograph and that was just fantastic for me.
7117667	7122713	Of course, Dan, his highlight is, well, the picture that's up there of him meeting Yu Suzuki.
7123954	7141015	I know that other than that though I did have a really massive migraine and having aching feet was kind of suck and Paris Hilton sucked but you know what was actually cool was meeting the Harlem Globetrotters oh cool and they were doing that charity thing so that was pretty cool
7142171	7143953	Takeo Rei sends us a message on Twitter.
7143993	7147056	Have you seen the Penny Arcade comic about the E3 press conferences?
7147136	7148117	Pretty accurate retelling.
7148537	7150759	Oh, God, yes, I did see that, and it was great.
7150879	7151620	I laughed so hard.
7151660	7157645	Somebody actually sent that to me on my phone while I was at E3, and I love the Reggie Fils-Aim in the middle panel.
7158085	7163270	New Zelda, new Goldeneye, new Kirby, new Metroid, new Kid Icarus, new 3D shit, no glasses.
7163630	7164551	Santa Claus is real.
7164591	7166813	He's in our booth, and he's giving out fucking hand jogs.
7167094	7168395	Nintendo bitches, we out.
7169597	7172422	That's a great retelling of what actually happened.
7173183	7174625	That's going to do it for Twitter topics tonight.
7174666	7176569	Twitter.com slash OLR.
7176609	7178212	Thank you guys who submitted topics tonight.
7178933	7180255	How about some more news?
7180396	7181498	Loki, what you got for us?
7182597	7183037	All right.
7183558	7184338	Well, let's see.
7184418	7187161	There's some stuff I kind of talked about a little bit earlier.
7187741	7196448	Ubisoft, they had a lot of things that were announced during their press conference that kind of had people scratching their head because they weren't really video games, perhaps.
7196528	7198730	I mean, they were sort of...
7199530	7200451	and DarkSakura.
7221874	7223715	They're going to be having a beta coming out for that.
7223795	7227717	You can test it out on this fourth quarter of this year.
7228497	7234720	Shootmania, which is going to be the new kind of first person shooter type of game that you'll be able to create custom levels for.
7235100	7238182	They're going to have a beta for that sometime the first quarter of 2011.
7238502	7242924	And finally, Questmania, which is going to be kind of like their RPG maker type of game.
7243384	7245465	That will be available for beta at some point.
7245665	7246526	They haven't really said when.
7247046	7247386	DarkSakura,
7271218	7278041	BattleTag is a game that is basically laser tag.
7278081	7286504	You've got a vest and these pistols that you run around with and these different targets that you can use for checkpoints or whatever.
7286524	7287885	You can create your own games out of it.
7289505	7294906	and it ties in with your PC which is kind of the scorekeeper, kind of like the game master for the stuff.
7295426	7296547	And so they announced that.
7297127	7297987	It's kind of neat.
7298467	7301768	It's something you would probably see at like Kensha Hall if there was a Kensha Hall anymore.
7303448	7306129	But that's something else coming out later this year on PC.
7306609	7313210	Not really like a game per se that you can't like just play like a first person shooter game with it on your PC.
7313590	7317371	It's actually just something that uses your PC for like scoring which is interesting.
7317691	7325137	and then the game that was pretty much the Wii Vitality Sensor but not, Energy.
7325838	7336827	And apparently Energy was a game that had a sensor that you would put on your finger or penis because you know that's going to happen and you would use this to kind of relax.
7336867	7339309	They had a breathing exercise that you could do.
7340249	7343292	They made Joel McHale do that because he was hosting the whole event.
7344092	7347154	and, um, it's interesting, I guess.
7347394	7347774	I don't know.
7347894	7349254	It's supposed to make you feel good.
7350775	7351916	Make you feel real good.
7351936	7355017	Which I guess putting your penis in the sensor might do that.
7355117	7355477	I don't know.
7355977	7357618	And that's why Santa Claus is at E3.
7357798	7358498	I did post that.
7358558	7360639	I'm like, well, energy, what are they thinking?
7360959	7361900	Time to penis is what?
7363254	7366496	Vatra Shattered Memories, Silent Hill Homecoming
7389172	7416640	also missing from this Silent Hill and this is huge Akira Yamaoka is not going to be a part of the new Silent Hill game so this means the new replacement will be Daniel Licht he does the theme song for Dexter the TV show and he also has done Hellraiser and Children of the Corn so I guess that's kind of cool sadly it's going to be not the same without Akira Yamaoka but at the same time I'm looking forward to seeing what Silent Hill and New People's Hands is going to be
7417541	7432834	by the way the story if you haven't seen the trailer yet it's about a prison inmate in the transport vehicle basically overturned or something and now he's in the fog of Silent Hill which I noticed looked a lot like the movie so I guess they're incorporating the movie into the canon or something I don't know so
7433454	7455679	they are talking about evolving the combat in a different direction as opposed to doing one or the other from the previous games so I don't know DarkSakura I know you're a big Silent Hill fan are you are you hopeful about the new Silent Hill game are you kind of like oh too much has changed this isn't gonna be Silent Hill anymore I'd really have to see I'm gonna reserve judgment
7456360	7456900	Fallout New Vegas Trailer
7476480	7481888	Everything at Bethesda was appointment only, and I didn't see that trailer online, no, because I haven't even played Fallout 3.
7482029	7485414	Well, the trailer was online, and it was great.
7485594	7485814	Cool.
7486215	7487116	Yeah.
7487256	7488438	It was pretty funny, actually.
7489520	7491323	Bobby was telling me it was very neon in there.
7492512	7503961	Yeah, well, Fallout Online is actually starting to solicit for betas, for their open beta.
7504882	7515411	So, if you go to the Fallout Online website, you should, actually I filled out the little form, it's just like a little form, you sign up for their mailing list and they'll send you information on the beta.
7516151	7516552	Eventually.
7519474	7529322	But Interplay had some legal issues for a while, but now it finally seems like it's going forward, so let's hope so.
7529882	7533665	I could deal with some post-apocalyptic killing of people.
7535939	7536760	Too many MMOs.
7537840	7538281	So many.
7538581	7540002	I'm still stuck on Star Trek Online.
7540062	7540863	Nothing's going to get me off of that.
7540903	7541963	I know you are.
7542123	7544265	But it doesn't mean I cannot flirt a little bit.
7544745	7547047	I'm not in a serious, committed relationship.
7547848	7550009	I have an open relationship with Star Trek Online.
7551971	7553432	You can look, but you just can't touch.
7553972	7555153	I can touch all I want to.
7556994	7557615	I'm trusted.
7558635	7559516	I'll always come back.
7562668	7566609	Alright, let's go to one more news story and then we got the mailbag coming at you.
7566689	7575271	Mailbag at OrangeLoungeRadio.com One of the things that was shown off during the Konami press conference is of course Def Jam Rapstar.
7575691	7580312	What's kind of interesting though is they're going to have this whole online aspect.
7580332	7591074	A lot of community features, different taunts and stuff like you can do rap battles or whatever and actually record different things and
7591594	7592937	Have a community.
7593177	7598366	I guess there's going to be Def Jam talent scouts and stuff like that.
7599328	7603014	Keeping an eye on the good rap star players and whatnot.
7606310	7627527	I don't know, it's a lot of community stuff, which is really cool You know what's interesting is that Def Jam Rapstar actually looks like a really solid game It's a bummer that I'm not as interested in the content there, you know, I can't rap, please But it actually, you know, just kind of looking at it and watching other people playing it and then hearing about all this community stuff I was kind of like, why can't some of the other music games...
7628087	7629168	Take a page from this.
7629308	7633691	Konami, seriously, you have this framework built for Rapstar.
7634511	7638894	Just now make it into a singing game and call it Karaoke Revolution.
7640075	7645278	Or you put this next to the Glee game that they were also showing off and the Glee game looks pathetic.
7645958	7646599	Absolutely pathetic.
7646619	7655865	The Glee game is just a simple try to grab at the market for the Glee stuff because those damn Glee albums are at the top of the charts.
7657698	7660020	Great, we have people covering songs and it's popular now.
7661841	7662221	I don't know.
7664462	7665143	It's interesting.
7665403	7673028	But if they actually put out a solid music game and supported it with enough download content and had all the community stuff, I think it would do really well.
7675279	7683923	I agree, because yeah, the Def Jam game actually, it actually, I gotta say this, I actually kind of wanted to play it, you know, in the privacy of my own home when nobody's watching.
7684083	7686104	I kind of want Irene to play it.
7688585	7689505	She would be a lot of fun.
7689766	7691046	You know, my birthday is coming up.
7691486	7696208	Maybe I should ask the birthday fairy for some Irene playing Def Jam Rapstar.
7696469	7699010	She could get discovered by a Def Jam scout talent.
7699690	7704032	You know, they had some Rapstars actually there at E3 doing the rapping.
7705097	7705878	Lucha Libre AAA
7724435	7734222	They didn't just have the game at Konami's booth, but then I guess the developers or somebody else had a whole huge area right behind it where they were doing the whole who's going to be on the box for the game.
7734383	7734783	That's awesome.
7734823	7737365	And just all these wrestling matches going on all day.
7737765	7745731	I guess I was glad it kind of drew people in and kept them away from other stuff, but I was just like, dang, there was a heck of people over there.
7745751	7750214	I didn't realize wrestling was so popular.
7750234	7750915	Yeah.
7751515	7753035	Anyhow, let's go to the mailbag.
7753376	7763298	Mailbag at OrangeLoungeRadio.com Every week we dive in the mailbag and read emails for you guys.
7763318	7769600	I'm going to take over this week since DarkSakura is still a little bit rough over there with her voice.
7769780	7770980	So hopefully she'll be better soon.
7772580	7774101	Although I should say there's not a lot to read.
7774121	7778522	I'm very disappointed in the listenership that during E3 week there's only two emails.
7779682	7780683	that you guys want us to read.
7781063	7783264	I'm hoping we get more this week after the wrap-up show.
7783304	7784324	Please send us some emails.
7784364	7788807	Mailbag at orangeandre.com I especially want to hear from people who have never emailed us before.
7789147	7790387	Because sometimes we get these emails.
7790407	7792308	I've been listening for two years and I've never emailed you guys.
7792348	7792788	Why not?
7794229	7795290	We want to hear from you guys.
7795310	7796350	What do you guys think of E3?
7796430	7797451	Come on.
7797511	7800512	We won't make fun of your spelling and grammar too much.
7801032	7801533	We promise.
7803394	7811440	First email from Robert M. Do you think the announcement of Portal 2 and Steamworks for the PS3 is related to the introduction of Steam on the Mac?
7813521	7814482	Yes and no.
7814602	7817484	I don't think they're necessarily directly related.
7817644	7821908	I think it's more of a, you know, hey, yay, Valve and PS3 are playing nicely.
7822588	7827612	But I think definitely it is a huge card in Steam's pocket that it's multi-platform.
7828801	7830221	I'm going to go off in a different direction though.
7830261	7838463	Speaking of gaming on the Mac and so forth, one thing we haven't talked much about, that OnLive was there at E3 and they had a pretty big presence.
7839063	7842404	And from the demos they were showing, it looked pretty good.
7842864	7845764	The games were playing pretty well over those little console boxes.
7846104	7849885	And apparently the system is out now on the PC and the Mac.
7849945	7854806	And apparently, I'm even seeing the feedback on Twitter and so forth, it actually runs pretty well.
7855888	7857089	Well, I'll be damned.
7857169	7858330	I know, I'll be damned, huh?
7858411	7858831	Who knew?
7859652	7859972	Who knew?
7860353	7867500	But as far as Steam goes, you know, I think certainly Steam is trying to expand all these different places because it definitely looks good for them.
7868300	7872164	I don't know why I went on the tangent of online, but I guess just the whole like new stuff on the Mac.
7872565	7875207	Mac gamers, what a niche audience.
7875267	7875728	No, I'm just kidding.
7876028	7878050	Mac gamers have had a lot to celebrate this year.
7878070	7878751	I'll tell you that much.
7879271	7879772	That's for sure.
7882480	7889944	Going to this other email from Brian S., who didn't have a fancy little nickname, but we'll say Brian S. Hey, OLR gang.
7889984	7893385	While reading the news on the PS Move and the MS Connect, I started wondering.
7893725	7899508	These two items are really just expensive peripherals for a console, but have any console peripherals really been successful?
7900088	7904390	Sure, during the NES era, I loved Power Glove and Play Track and Field on the Power Pad.
7904730	7908172	But just like ROB, they never have more than one or two games for them.
7908692	7911894	Ignoring peripherals that are specifically made for a game, i.e.
7911974	7925300	music and dance genre games, most peripherals like the Super Scope, Sega CD, 32X, PS2 Hard Drive, iToy, and probably quite a few others I can't remember, seem to lack support and third-party game development initial launch titles.
7925681	7929583	Do you think the same could happen to Kinect slash Move if initial game sales are low?
7931153	7956674	um no I say well I say yes as far as at least the move is concerned um I think though it's it's tricky because you say well you can count these games but you can't count these well-selling games I mean I realize that the music and dance things are a little more niche but if you look at connect as like really opening up the exercise exercise gaming thing then it's a little niche too well let's look at the Wii Fit balance board they use that in a lot of games
7958484	7961466	I mean, it's an add-on thing, but they use that.
7961987	7964308	Wii Motion Plus, it's being used in a lot of things.
7964989	7970633	And iToy was used a lot more than I think you might be giving it credit for, especially in games for the younger audience.
7971893	7979759	I mean, those aren't really specialized peripherals or anything, but if you think about it, a lot of the stuff that they put out that's specialized peripherals, I mean, it's specialized for a reason.
7979799	7981020	It's only going to be used for a few things.
7981620	7996588	I mean, I understand what you're talking about, like the whole eye toy and the PlayStation eye camera or the Xbox 360 motion camera, which was a big waste of money, and I need to turn that in for some, like, store credit somewhere, because, man.
7996848	7997969	Oh, what a waste that turned out being.
7998009	7998609	Yeah, exactly.
7999269	7999510	So...
8001451	8002652	Yeah, I mean, I understand that.
8005213	8007575	Expectations, I guess, for that were a little bit greater than they were now.
8007595	8020503	Because I think with the PlayStation, well, even with the motion camera on the Xbox 360, I think they were thinking it's going to be doing these kind of Kinect things, but it just doesn't have the technology to really support that.
8022357	8031401	YYR in our chats is saying yes, absolutely yes to this question of will the same fate be met if initial game sales are low.
8031741	8034903	He's saying this is why Kinect should be $99 and not a penny more.
8035383	8043967	I agree that if they don't have a really awesome game pack in with this game or with Kinect, the $150 is unfortunately past the sweet spot.
8045917	8062994	a lot of people are going to be in for an unpleasant shock too that if Kinect is $150 and it's sitting right next to a Wii that's also $150 there's going to be people out there that don't realize you need an Xbox 360 to actually use Kinect and it's going to be depressing for some people
8064260	8064740	Thanks for watching!
8093514	8101398	DarkSakura and Sky, I hope you're both feeling better.
8101618	8103039	If not, I hope you get well soon.
8103279	8103719	Aw, thank you.
8103879	8105320	I'm doing much better than I was the nightly show.
8105400	8109422	I am better, it's just that my throat was really damaged and it hasn't fully healed yet.
8110416	8112897	and that's from Brian S again and also one more thing.
8112957	8113377	P.S.
8113737	8117679	Part of the reason I wrote this email was to have a reason to write I love to power glove.
8118059	8118680	It's so bad.
8119860	8120340	There you go.
8120420	8121561	That's your emails for this week.
8121621	8127883	Mailbag at OrangeLoungeRadio.com Please fill up our mailbag and so that way when DarkSakura's voice is all better she has some work to do.
8128744	8130805	We like giving DarkSakura lots of work to do, don't we?
8131665	8137247	Alright, some more gaming news for you guys and then we're going to open up the Skype line at 1-877-GAME-OLR but don't call yet.
8137287	8137968	It ain't open yet.
8138428	8138748	Loki.
8140101	8166163	one of the last things that they showed off during the Ubisoft press conference and they didn't really show anything they just kind of hinted at that it's coming the Michael Jackson game the one that was rumored to be in development is now being developed by Ubisoft and no word exactly on what it is but it's something that's possibly going to be some singing dancing game that does support the Kinect I think it's very sad that it's not Sega
8167301	8167921	PSP, Wii, and DS
8187586	8191969	Anywhere they can milk that guy for more money in the afterlife, they will.
8192369	8192790	In other words.
8193891	8194051	Yeah.
8194331	8194711	Am I right?
8195532	8195892	You're right.
8197133	8200395	Hey, this is pretty cool because I remember these games.
8200415	8201136	They were a lot of fun.
8201516	8203717	Apparently, Burger King is going to be coming back to the 360.
8203757	8205379	That's right.
8205719	8209241	The Burger King guy is coming back, and this time it has to do with Kinect Games.
8209261	8209982	Buying all of them.
8210482	8211383	Every single one.
8211543	8213164	I don't care how terrible they are.
8213304	8214425	I am buying all of them.
8214585	8218828	No news on the details, no news on the style, no news on the number of games.
8219429	8232139	All that's being said so far is from Burger King Chief Marketing Officer Mike Capit saying, Our first endeavor with Xbox 360 took the gaming world by storm, so we couldn't pass up the chance to come together on another cutting edge program.
8232479	8240646	During this year's promotion, our guests can look forward to an even greater adventure that will stimulate the imaginations of gamers and entertainment lovers of all shapes and sizes.
8240666	8240926	They were so...
8241346	8243467	Like, Sneak King was so creepy.
8243527	8244467	You don't understand.
8244527	8247588	You cannot get more creepier than that game.
8247928	8249468	It is absolutely worth the money.
8250729	8251949	I don't care how terrible they are.
8252249	8254510	Because terrible games can sometimes be good games.
8255250	8257811	Like, for example, Driver 3.
8258191	8258851	Terrible game.
8258911	8260911	Let's not forget, the games were $5.
8262692	8260911	$4.
8263472	8264372	$3.99.
8263952	8264372	My bad.
8264392	8264372	$4.
8264512	8266873	It was an amazing deal.
8267133	8268654	Hopefully they're just as expensive this year.
8269274	8269814	That'd be great.
8273722	8275624	That should be the packing right there.
8275964	8276404	There you go.
8276464	8278406	There's your reason to plunk $150 on Kinect.
8280288	8281389	There you go, skeptics.
8283071	8285333	Sneak King 2 featuring Kinect.
8285694	8287135	I think it's going to be pretty awesome.
8288216	8290198	I have high hopes for the Kinect.
8291219	8293762	Don't screw me again, damn camera games.
8295365	8309893	I learned my lesson with I actually bought the camera for every single damn system they've all failed me so far except I did not buy the camera that was on the Wii because I don't like exercise games but whatever anyways so yeah
8310453	8314096	There's some more features being announced for LittleBigPlanet 2.
8314257	8316819	Lots of cool stuff that they're showing in the whole community features.
8318801	8322985	One aspect they're saying that, of course, getting revamped is all the stuff that they had.
8323665	8327128	It's going to be easier to find players' creations.
8327829	8331533	And, of course, they're going to have a different interface now.
8331633	8334996	No longer will you have to search across planets to find different levels.
8335796	8339078	and you'll be able to actually bring them up in a list.
8339398	8342500	Also different metrics like genres, keywords, etc.
8343320	8347402	And they're also saying that they're going to be
8349133	8349993	www.lilbigplanet.me
8369402	8373965	And in it, of course, you can see the pages in the browsers.
8374646	8381210	The games will be automatically queued up the next time you play your game if you pick different levels on there.
8381651	8389236	Also, you can just, I guess, print out one of the QR barcodes assigned to each level and you pop it in front of your PlayStation Eye.
8390097	8391579	and your creations come up.
8391879	8401854	That'd be kind of cool if you made some games or whatever, put it on your business card, put that little barcode on there and then people can scan your barcode or your business card and your level pops up.
8403096	8407139	Or, Rob, let's think here for a second.
8408100	8410421	Wouldn't it be awesome to get LittleBigPlanet 2?
8410501	8414404	You make business cards with, say, our website on it with that barcode.
8414504	8422769	And when you load that level, it has a bunch of information about our website, the podcast, all that stuff in the level.
8423010	8424691	It's like a playable business card.
8424771	8427032	Or those shirts we've been talking about doing for seven years.
8427072	8428953	You could put the barcode on the shirt.
8429394	8431035	Or maybe we need OLR pants.
8432996	8436737	So that way the barcode is on the butt, and it could be, here, scan my butt.
8438038	8443599	And you could play LittleBigPlanet 2, the Orange Lounge Radio Experience, using your butt.
8445040	8445900	I think that's a great idea.
8446420	8447440	We need to oil our pants.
8447740	8451381	DarkSakura, do they let you make your own pants with logos on the butt?
8452602	8453262	It wouldn't be hard.
8454226	8456207	There's gotta be a way to do it.
8457248	8461030	I mean, who cares about shirts when you can have OLR with a barcode butt?
8461631	8462191	You can do that.
8462391	8467975	You can do, I think, on those cafe press and stuff like that, you can do boxers and stuff.
8470336	8472798	OLR underwear with the barcode on your butt.
8472818	8474499	It wouldn't be too hard to design a transfer.
8476040	8476660	It really wouldn't.
8477261	8478742	That's an even better idea.
8479062	8480303	I wanna play the OLR level.
8480343	8481303	Pull down your pants.
8488735	8490016	Oh, this is just wrong.
8492477	8493998	I'll show you my little big planet.
8498961	8500162	That's what you say on the back.
8500222	8501663	It would say little big planet.
8502023	8503904	And on the front, it would just say big planet.
8508767	8510047	With two moons that orbit it.
8510568	8510928	All right.
8514110	8515190	I'm in a room with children.
8518270	8521855	Tonight's show has been way too serious.
8522276	8523357	E3 is serious business.
8523417	8527823	We needed some barcodes on your ass to break the tension a little bit.
8528243	8531768	SSJ100 Matt asks, will that barcode make it easier to friend your butt?
8532952	8535233	Maybe that's what Nintendo plans to do with Friend Codes.
8535253	8538774	We need to have a repeat of the Seaman video.
8539554	8540494	Maybe after the show.
8540554	8540875	I know.
8541035	8541535	Maybe later.
8541795	8542295	We'll do that.
8542495	8542915	Maybe later.
