start	end	text
9532	36687	Thank you for watching!
39164	41788	Hello, my friends out there on the internet.
41808	46094	Welcome back to another week of the show where every gamer has a voice.
46114	48438	It is Orange Lounge Radio.
48478	55629	We're live once again tonight, July the 13th of 2025, episode number 1054 of our show.
56130	57431	My name is Rob Roberts.
57451	67787	I'm here with you every week to talk about video games, gaming culture, the gamer lifestyle, gaming recipes, gaming movies, gaming gossip.
67767	68428	What else?
68448	69429	What else, DarkSakura?
69449	70912	The one and only DarkSakura, Jamie Summers.
70932	71813	What else am I missing?
71833	78122	Gaming... Gaming... Ballet moves?
81207	81447	Why?
81948	83971	Oh, DarkSakura, you have a hard Discord on mute.
84191	84872	I can see the icon.
86574	89058	Oh, sorry.
89078	89459	No, you're fine.
89479	91401	I was like, why isn't she helping me out?
91642	94245	I was going to say gaming games.
94265	95327	Oh, gaming games, yes.
96100	100587	and strategies and ballet games, which I think there's like three.
100607	101047	That's right.
101207	102069	Gaming strategies.
102129	102569	Yes.
102629	106395	My favorite band is a code in Akari Warriors, ABBA.
106735	109239	That's a code you can use in Akari Warriors.
109259	110341	There's a gaming strategy for you.
110361	113165	Gaming pinball table sucks.
113185	113886	Oh, that's right.
113926	117291	I heard the pinball table's not good, but they didn't have it at Southern Friday.
117311	118633	It's not that it's not good.
118793	120235	It's just it's not great.
120451	122313	They didn't... When I went to Southern Fry, they didn't have that.
122333	124155	That was one pinball table I was hoping to see.
124176	125577	But they did have that Elton John table.
125617	126078	It was great.
126198	126939	I did like that one.
126959	128140	Oh, I fucking love Elton John.
128160	128461	Yeah.
128681	130904	I like... I would love one of those.
130984	132866	It was so much fun when I could hear it.
132886	133267	Yeah.
133487	133747	Yeah.
133847	138773	No, it was... They had that thing on full blast at Southern Fry, and I enjoyed that table a lot.
138793	143539	I noticed that Jersey Jack tends to make these very, like, lights...
143519	149327	Show, Fireworks, they do the light show type of pinball tables, and I'm all for it, quite frankly.
149367	151070	I've got a couple of Jersey Jacks.
151190	154315	Yeah, we have Lord of the Rings.
154435	155877	Lord of the Rings was Jersey Jack, I think.
156117	156698	I'm not sure it was.
157579	159282	And we have Pirates of the Caribbean.
160504	160604	Nice.
160624	162206	And a couple of the Jersey Jack ones.
162647	163067	Love that.
163548	165050	All right, and gaming pinball.
165070	167394	Sadly, they have descended into madness.
168936	172581	All right, let's say hello as well to the one and only Techmaster Loki.
173017	173297	Hello.
173498	175481	Loki, we don't talk to you about pinball a lot.
175501	176182	Do you like pinball?
177484	181291	I still have that pinball table that I'm building that I... That's right.
181311	182192	Well, it's been a year.
182412	185097	It's been a year since I got it.
185117	188643	And it's been like a very long time since I've worked on it.
188723	190566	Just because it's so big and messy.
190766	191127	Yeah.
191147	194452	It's sitting on the DDR machine right now, the kit.
194472	199260	But I do need to go back to it, assuming that it's not all destroyed.
199443	201166	What was the last time you played that DDR machine?
201186	202988	I know not during this summer.
203009	203389	A long time.
204331	204972	It's been a while.
205492	207716	Yeah, I played it, I think, last year.
208437	209418	I haven't played it this year.
209739	213705	Certainly not any time now because it's incredibly hot in the garage.
214046	215448	But it's been a while.
215468	224742	A friend of ours on... Hey, I was going to say, talk to Dan because we put up a split in our garage and that thing stays Arctic and it wasn't that bad.
225515	236590	Yeah, I mean, if I do anything in the garage, I'd be building an office in there so I can do streaming without people coming into the kitchen and screaming and yelling and microwaves and air fryers.
237832	241196	Extra talk to Dan about that because we have a really, really good mini split.
242418	243319	Okay.
243339	245422	And gaming garage tips.
245662	247705	And we insulated our garage to build our arcade.
248606	249868	Gaming central air.
252025	280176	Anyway, hello to those This is the BGHVAC channel For all of your video game HVAC needs We also do pipe cleans and duct cleans We love to talk about And we use that microscope thing that we set down the thing to see if you've got spiders We love to talk about sucking and blowing here on Orange Saunders Radio Of course we're talking about air Anyway Talk about the gaming industry She does
282518	284520	It's gone from suck to blow.
288765	297596	Commenting live on the show, of course, all of you in our chat room because we do tape live every Sunday night at the Voice of Geeks Network, twitch.tv slash VOG Network.
297616	302882	That's Voice of Geeks Network, 9 o'clock Eastern, 6 o'clock Pacific, right after the Bobby Blackwolf show.
303222	310551	Bobby Blackwolf was back tonight after his little vacay last week because he was working hard up in Minneapolis, Minnesota.
310531	333872	DarkSakura, DarkSakura
333852	337317	and actually no, but he takes his time for all those lovely people to donate.
337337	338038	What about being a slow walker?
338639	342384	Anyway, so congrats to Bobby and everybody at GameStone Quick.
342424	347271	I think we have a story later on it, but I think y'all know they raised like over 2 million bucks, which is great.
347291	348793	So we'll talk more about that later in the show.
348853	359168	But yeah, kudos to VOG Zone, Bobby Blackwolf, who was a part of all that that went down up last week in Minneapolis and online everywhere.
359738	360099	All right.
361080	363383	Big thanks to those of you that are live in our chat room.
364024	366027	S2100 Matt says he's a speed reader for sure.
366167	373798	Oh, I did see that one donation that was posted to our Discord that I think was during a Super Metroid run where he did do speed reading.
374178	376481	So I guess that comment can stand.
376762	378925	I will not be striking that comment from the record after all.
379325	380447	So there you go.
380427	400782	DarkSakura, DarkSakura,
400762	429385	S, Actdeft, Drew, Carameldansen
430343	437890	Another piracy website went down for the Nintendo Switch because, you know, they're always combating piracy.
438530	450461	So NSW2U is one of the, I guess, I don't know, more popular ROM sites for the Switch.
451121	459068	I don't know, but apparently it has been captured by the FBI, according to the domain now known
459706	465896	Popping up a website has been seized page.
465916	468079	I mean, yeah, that's... That's it.
468119	469301	Kind of makes sense.
469321	473868	Stop pirating your games because now the FBI is coming after you.
474108	480919	Do it less of a flashy way instead of having a big public website that everybody can see and expect it not to go down.
480999	483503	Like, it's... I mean, that's just...
484529	489577	Whatever, but Yes, I'm sure that has ended piracy for good now, right?
490358	498731	I'm sure that taking down this one website in no way will ever cause the Switch piracy scene to come back.
498871	501255	It's been completely defeated at this point.
502163	508899	Um, yeah, I mean, obviously, I don't endorse piracy of new stuff and things that are on the market.
509319	518601	I know there are people trying to sort of like defend what was going on as sort of like a, God, what's the defense they usually use about pirating the new games?
518621	520425	Is it game preservation?
520405	524169	But that doesn't make any sense if a lot of these games are still for sale.
525110	526392	Corporate sabotage, I'm down for that.
526512	535402	I mean, I guess, but hearing about all the layoffs that happen in the industry, unfortunately the wrong people are never held accountable when games don't sell well.
535422	538585	So I'm not a fan of piracy of current stuff.
538605	546955	Now, if we're talking about, if this were a news article about a Nintendo 64 ROM website got shut down, I'd be a little more like, what the hell?
547035	549838	Because these games are not actively making money and all that stuff.
549818	552505	but we know that does still happen.
552906	555913	Nintendo of course being one of the most litigious but you were going to say Loki?
556013	566038	There was one recently it wasn't like it was an indie game essentially so what it was is it was a beat-em-up game that was being done I
566018	593038	I still can't play it without the chipsets.
593660	594323	You can.
594443	599225	They have a special retroarch thing that they built.
599245	600008	They've emulated it?
600342	602144	they finally have emulated it?
602164	617101	they did and I mean if I don't know where you would find it on the internet maybe if someone archived it somewhere on a website with an app named for the internet archive organizational website are you talking about?
617121	627193	I'm going to say this every version that I have attempted because I really wanted to play Paprium has been non-functional
627410	638483	it's mostly functional from what I've heard now someone was selling theirs for like 800 bucks at CalX last year hmm
639188	651453	Mike Deft in chat brings up an interesting perspective saying a phrase I always hear when trying to justify piracy and specifically, especially for Nintendo stuff, excuse me, is it's morally correct to pirate Nintendo.
651473	658227	Now, I don't know about that statement, but I do remember the perspective that Mike Deft lives in Mexico.
658207	663875	And from what I recall, and please correct me if I'm wrong, it's hard for me to keep tabs on every country in the world.
663895	671685	But if I recall, there was a big hubaloo because Nintendo does not have an official distribution presence in Mexico.
671705	676872	Therefore, everything in Mexico is way more expensive when it comes to the games.
677312	684602	And so it brings back to mind a sort of similar feeling I used to have in the PlayStation era.
684582	694111	When, you know, when I would pirate DDR games, and I didn't, I would buy, I would buy the ones they made for the US, I bought Konami, I bought US Mix, I bought Beatmania.
694591	699515	But when it came to like DDR, third mix, fourth mix, I pirated those and I did not apologize for it.
699636	707423	Because my perspective was, if, if Konami wanted me to buy those games, they would release them here in the US.
707443	711786	Now, I do understand music licenses probably made some of that stuff difficult.
711827	713968	I have a better understanding of some of that now than I did then.
714089	714589	But
714569	720014	I still would support DDR where I could when it was legally available for me to do so.
720034	721516	We bought the PC version.
721656	722497	I mean, come on.
722777	723538	Yeah, that's true.
723578	725220	How much more can we support?
725240	727522	We supported the Mr. Spanky DLC, okay?
727582	728563	How many people can say that?
728583	728803	Anyway.
729684	737192	Mike Deft in chat says, a Switch 2 with Mario Kart is almost $800 US dollars, maybe around $750.
737612	740695	So I kind of...
740675	751311	I get it a little more from that perspective because it's like that's not fair that they should have to pay twice as much as we do in the U.S.
751331	754195	just because they don't have an official distribution system there.
754536	761406	So I understand where that gets a little bit trickier and probably where some of the justification for websites like this start to pop up.
761426	765332	However, if you are going to justify your piracy –
765312	787118	DarkSakura, DarkSakura,
787098	794391	I say in Deft's case, and people like Deft, like, you never had the opportunity to fairly buy the game anyway.
794411	796455	So I think it is a different argument in that case.
796896	807615	Yeah, and I mean, and even saying that you should feel responsible for some of that, I don't, I mean, piracy isn't even enough to make a dent in game sales, I think, for the most part.
808517	808617	Yeah.
809440	811543	Yeah, I wouldn't feel bad about it, honestly.
811864	819716	I mean, it just... Especially with just how they're treating the industry with their pricing and stuff like that.
820116	821398	Certainly, they're trying.
821739	830352	They feel that they've earned this goodwill that they're going to now exploit and see what they can do to drum up more profits, but it's...
831850	832411	I don't know.
832431	839820	I think if it's fairly priced and it's more convenient, like with Steam and stuff like that, it's a no-brainer.
839940	849832	A perfect example, look at how many games I've purchased on Steam that I don't even play, but I purchased them anyways because they look interesting.
849872	856660	It's that kind of on-a-whim impulse buying that that platform lends itself to.
856640	880622	an $80 game is not going to be an impulse buy for me so like it really needs to be good and that's the thing is a lot of these games and a lot of these you know studios looking to keep pushing that retail cost of that game up okay but my standards for your game are going to be a lot higher than every time you bump that price up my standards for what that game needs to be is going to be incredibly high and if we find that you just don't
881632	884877	Live up to those standards, then yeah, your games are going to fail.
885838	899658	I mean, there's a story we have we're going to be talking about a little bit about game delays and the whole thing with that, but one of the things that the complaints on there is like, well, yeah, but the previous game didn't do well, and it's these people's fault for that.
899678	905767	And it's like, well, yeah, but if you look at what the complaints were on that previous game, it was the monetization in it, not the actual game itself.
905827	909512	It was how you shoved monetization in, and that was the publisher's.
909492	912168	Charged $70 for a free-to-play game.
912269	913476	I've definitely heard that before.
913879	914724	Yeah.
914744	916414	Yeah, or, you know, there's...
917221	921887	There's games that have spent $800 million to be developed and still not done yet.
922568	925091	There's that type of stuff too.
925411	927954	I realize people have strong feelings on this issue.
928215	932860	Again, I don't endorse piracy of current stuff for most people.
933081	940630	I do try to understand the different angles because I also recognize it's a part of our industry we have to deal with.
941183	950571	You know, we have to kind of figure out, I think if you want to get down to, you know, trying to be successful in the industry, you have to get down to the reasons of why do people do this.
950591	954775	And, you know, I think we just talked about one when it comes to the international folks, for sure.
954795	967086	And, you know, some of the, you know, distribution and, you know, do games, are they, you know, affordable, you know, based on local, you know, economies and so forth.
968046	969908	And then I think, you know, there's,
969888	975478	I think there are some people out there, though, that just pirate because they're trying to build up an impressive collection of stuff.
976300	982932	And they have the means and whatever to support otherwise, and they are actively hurting the industry.
983633	987981	And I think game companies have to kind of think about how do they get around that.
987961	991347	and they try with things that are happening on the Switch too.
991768	993732	But again, we have a story coming up later.
993892	1000725	I don't mean to make this whole thing a teaser for later in the show, but it is what's going on this week that may be where that whole system is backfiring in a really bad way.
1001847	1004232	So it's just, it's...
1004212	1007337	It's not something you can look away from and it will disappear.
1007858	1009501	It's something that's always going to be there.
1009581	1018936	We kind of have to figure out how do we live with this and how do we make people choose to do things the way that will make these companies money.
1019317	1022963	I guess maybe the best analogy I could give is Napster.
1023584	1031632	Everybody used to download, well, not everybody, but most people used to download music all the time on Napster, MP3s, just albums, you name it.
1032233	1051633	And it wasn't until the record companies kind of figured out how to legitimize that sort of immediacy of Napster and a one-click purchase system, which really, I believe iTunes was the first to do that, that once, I know once iTunes became available, I used that and I stopped using Napster.
1051613	1074786	DarkSakura, DarkSakura, DarkSakura
1075137	1078763	This is the file stuff, but viruses are written per system.
1079084	1080106	Yeah, I guess that's true.
1080587	1086477	I mean, when you have, at the time, a small user base, no one on a Mac was worried.
1086497	1087939	Don't download executables.
1088661	1089362	So, yeah.
1090103	1090564	But...
1090544	1099237	I'm just trying to make the point that it's like when this piracy was rampant everywhere, the industry sort of had to figure out how to embrace that.
1099257	1105506	And maybe to the point we were talking about earlier, maybe there needs to be a better system of worldwide distribution.
1105606	1109953	However, I keep contradicting myself tonight because we live in that kind of world.
1110473	1112316	I can't blame anybody.
1112296	1123793	for not trying to do distribution worldwide in a system that involves the US at this point in time because of everything fucky going on with tariffs and all that stuff.
1123813	1125375	So what a mess.
1126537	1127038	What a mess.
1129141	1131624	So like we said, this both sucks and blows.
1132706	1133527	We're getting it all back.
1134128	1134909	Uncontrollably.
1135270	1135751	All right.
1135771	1137153	Well, let's talk about our gaming week.
1137173	1139576	So what were the types of video games that we were playing this week?
1139616	1140818	DarkSakura, we'll start with you.
1142232	1147726	Mass Effect, and Dead by Daylight, and Palia.
1148408	1150052	That's about it.
1150072	1155786	And believe it or not, I am going to have to become more of a gym rat.
1158078	1162388	I will try to find ways to gamify my workouts.
1162408	1166537	And if anyone has ideas apart from using Nerd Fitness, let me know.
1166557	1177521	I would love to gamify my working out because I have to start doing one-sided deadlifts with a 50-pound kettlebell and I don't have a 50-pound kettlebell.
1179391	1184725	I don't really have a lot of advice except the one you already know, which is closing my Apple Rings.
1185066	1186168	I do that one.
1186188	1188755	But I've been going to the gym a couple times.
1188815	1190058	Not a lot, but a couple times.
1190540	1192645	And I try to make sure I close my rings.
1193207	1194410	I work out at home.
1194811	1196134	And I, of course, go to ballet.
1196114	1226121	but and this is just more of like a life thing but you know I have that injury to my leg and I had been sitting down and doing a lot more gaming because I couldn't get up and really do a lot of stuff until I started physical therapy but now he says that I'm getting a lot stronger and I only have one more appointment left to do oh nice great yeah so I'm looking for I want to start actually doing the Pikmin thing since I downloaded it I just need a walking buddy not in this heat
1227653	1230036	Call me in September.
1230997	1234121	I'll walk inside an air-conditioned mall like the old folks.
1234161	1235342	Thank you.
1235362	1237885	That's why mall walking is legit.
1237945	1240268	I don't know why mall walking is associated with old people.
1240368	1243251	Try living in Phoenix or here.
1243391	1244953	Yes, mall walking works.
1245093	1248617	We should do an 80s-style mall walk and everyone be all 80s.
1248637	1251060	I feel like I've seen that on TikTok.
1251361	1252682	There is a club that does that.
1252702	1256867	Probably not here, but that does the 80s-style mall walking.
1257421	1284677	I would be so down yeah all right S2100 Matt says I went mall walking today see it's still still a good thing all right uh Loki I think it's your turn um well I just played Minecraft this week I put together a big giant arena a battle arena type thing uh so that was like over 100,000 block build or something like that so I got that done and now I am working on developing uh
1285315	1287338	Mob Waves that you would fight in it.
1287418	1293727	So kind of working with command blocks and stuff like that and designing what that's going to be and balancing all that stuff out.
1293867	1296030	So that's what I've been working on this week.
1296070	1300997	That and, you know, between all that watching stuff on Summer Games so quick.
1301297	1302479	Nice.
1302499	1304001	Do you have a particular run you really enjoyed?
1305243	1306304	I like the Bellator run.
1306324	1309348	I watched that where they did like eight different decks or whatever.
1309669	1311471	So it was interesting to see them play that.
1311692	1312032	Nice.
1312957	1315279	Alright, my game of the week.
1315439	1318962	Kind of still on the ones I've been playing a lot recently.
1318982	1320924	Diablo 4, Season 9 is continuing.
1320944	1323326	I did hit level 60 and I'm in the Paragon levels now.
1323366	1324628	I'm up to about Paragon 30.
1324988	1333436	I just got to Torment 1, so just working on my character for the season and trying to unlock all the silly things that I like to do in that game.
1334156	1337239	Also, a little bit of Final Fantasy XIV, but just a little bit.
1337259	1340382	I think I'm just kind of at the point where I'm waiting for the next patch, to be quite honest.
1340362	1344531	Actually, I'm just waiting for the next expansion to be quite real.
1344732	1347297	I don't know a nice way to say this.
1347357	1349823	I think Dawn Trail has just kind of been a bit of a flop.
1350865	1354092	But the bar for Final Fantasy XIV is also very high.
1354673	1360125	I just think that game has been so good for so long that it's not that...
1360105	1386045	Dawn Trail is necessarily like a bad game it's just bad for this game um and it just it hasn't it hasn't really lured me back in the way most of the other expansions did to be quite honest um but there's still I'm still paying for a sub so I still am signing in occasionally to try to get an upgrade to the house I'm still trying to get my crafting to 100 and at some point I'll want to get all my jobs up to 100 but I'm just kind of waiting for the rest of the systems to
1386025	1408708	Rob, after five minutes, were you like, let's get it?
1408688	1411051	Uh, but then, uh, let's see.
1411071	1411672	I've also been playing.
1411792	1416818	Oh, but you know, I have been, I've been speaking of emulation and all that.
1416978	1421624	I have been living it up and my dolphin emulator playing fantasy star online.
1421744	1422185	Yes.
1422205	1426230	I'm playing fantasy star online game cube, uh, via the emulator.
1426250	1428953	Uh, there's a server that you can connect to for that.
1428973	1431456	And I've been playing with friends just a little bit, uh,
1431436	1454794	DarkSakura, DarkSakura, DarkSakura
1454774	1480663	I beat all the forests, I beat the dragon and now I'm working on the caves and god those quests get so much longer once you get to the caves because of the fact that those rooms just constantly spawn those fucking shark things over and over and over and over again but yeah PSO is still fun 20 years actually more than 20 years after that because the original was 25 years ago probably so I'm thinking about the GameCube version but yeah
1480643	1500103	PSO for life literally um I think that's about that's about it fantasy life I'm gonna finish that hopefully in the coming days all right uh we are going to get into some more news we got a lot of gaming headlines for you so let's get to it Loki what is on deck for gaming news tonight
1500809	1520674	I think I'll go for a walk I feel happy
1521616	1548214	their funding obviously was pulled for their game and it was cancelled but they're now looking for other studio partners to work with to develop stuff so that's good and maybe at least the game will get brought back in another studio or something like that or maybe they can spin it into something, who knows but at the very least Romero Games is not closed so that's good that's good
1550523	1559082	I think that's very good but are they gonna so if the funding for their game got cut are they still gonna be able to release that though?
1559281	1560823	Well, I don't know.
1561183	1567231	They said the project funding was pulled and their game was cancelled.
1567591	1575061	It says, due to confidentiality agreements, we cannot disclose the publisher's identity, though some may infer from the public information.
1575341	1575781	Interesting.
1576743	1580988	It says, as a result, we have now had to reassess our entire staffing from our studio.
1581549	1588377	Remember, our game does not close, and we're doing everything in our power to ensure that it does not come to that.
1588357	1591967	and any suggestion otherwise is factually incorrect.
1591987	1593893	Hmm.
1593913	1594334	Hmm.
1594354	1600130	Interesting, except, you know, so it's like this game you know nothing about had something happen to it and we can't talk about it.
1600231	1602918	So there's the news.
1602938	1603159	Yeah.
