start	end	text
3023755	3032470	I know that they keep the information about the person that trades stuff in because of different laws regarding stolen goods.
3032610	3042286	But in this case, if it's just that you traded in something that was banned, I don't know what they could really do there.
3042767	3043508	I mean...
3044197	3068601	I don't know I don't know if they'd pursue it it's that whole thing so GameStop from what I understand will not take a game that is sealed they will not buy back a game that is sealed um because the chance is too high that it was stolen off a shelf but what ends up happening is that some people find it under the Christmas tree or whatever and they try to sell it back and because they're like I already have this game or whatever and then GameStop won't take it because
3068581	3070523	It's stupid anyways.
3070543	3077891	I mean, the whole problem was created by Nintendo in the first place to try to combat piracy, but really you're doing more harm to the consumer.
3078371	3092646	Once again, going back to the whole adage with DRM anyways, a lot of the times it's a legitimate consumer that gets punished more over this DRM than the actual people pirating those games.
3092726	3094808	Because the people pirating those games...
3095311	3117623	they're playing it on a modded Switch that's probably not connected to the internet so for them, they're not really going to run into any problems but the consumer that is using that card yeah, they will run into problems, which sucks it to me communicates that Nintendo is not doing this right but yeah
3119105	3120567	Let's see.
3120907	3122249	Very interesting comments in chat.
3122349	3126655	S2100Matt says, I knew someone who bought a hearing aid off of a dead person.
3126715	3127977	The family sold it.
3127997	3131562	That's actually not that uncommon, though, because that's just medical equipment.
3131582	3141956	And when grandma or grandpa passes away, quite oftentimes there's an estate sale and wheelchair, hospital bed, all of that ends up being up for grabs and people need that stuff.
3142116	3146682	It's a weird-ass fucking reflection of the society we live in.
3146662	3151168	But yes, the hearing aid doesn't surprise me, honestly.
3151208	3153652	There's a charity group in Alabama.
3153732	3174762	It's how my mom got oxygen tanks and a walker when she had gotten out of the hospital that will take in donated, you know, whether they're from the deceased or old surplus or what have you, and then loan them out for free to people who need them indefinitely.
3175687	3203365	um interesting Ranmari says maybe they don't want the game because some cruel motherfucker gifted them a crazy bullet hell game well that's absurd bullet hell games are fun they're frustrating but you should at least try them anyway uh that's when you that's when you create the service we'll adopt your unloved bullet hell games for free you're just giving Ranmari Idea a sign for their next convention to walk around holding um
3204509	3211878	TheGorilla72 says, so why does GameStop sell me new games that are open then?
3211898	3213499	Is that still a thing that GameStop does?
3213560	3215221	I thought they were told to knock that off.
3216723	3219887	Honestly, y'all, I have not bought a game in GameStop in so long.
3220307	3220808	I don't know.
3220928	3222390	I can't tell you the last time I bought a game there.
3222610	3224132	They use it for displays.
3224432	3225994	Wow, Gorilla says they sure do.
3226244	3231815	They have a display copy because manufacturers are being cheap.
3232236	3236504	They don't send display copies for these stores.
3236545	3244320	So they have one that's out there and then they keep everything behind the counter because they don't want live product out on the floor for a lot of that stuff.
3244300	3254293	They should get the person that draws all the fake box art at GameStop to... Just don't buy games from GameStop.
3254393	3255335	There you go.
3255375	3257798	That just saves yourself.
3258439	3264547	Honestly, it really doesn't make sense to do it anymore unless it's ultra convenient for you.
3264627	3267050	Just go purchase it from anywhere else.
3267491	3270354	Purchase it off Amazon, purchase it from wherever.
3270935	3272417	It's just GameStop...
3272633	3280022	I mean, even when you go in looking for things, it's just very not what it used to be, obviously.
3280042	3281163	So, I don't know.
3281183	3282004	Don't give them money.
3282325	3284407	It is weird to me, though, if that's the reason.
3284427	3286550	Because TigerClaw says, why not print the box art?
3286610	3287671	And I do have to go.
3288111	3288432	Copyright.
3288732	3290494	It actually is a legal thing.
3290514	3293999	But wouldn't the publisher send a PDF?
3294359	3297302	I mean, they are trying to sell that publisher's game.
3297663	3297763	Yeah.
3298300	3317743	DarkSakura,
3318179	3340980	dating everybody here so it's kind of like the blockbuster model where you have you know your thing on the shelf with the game and you go up to me like I would like this game and they have all the games behind the counter but there's one copy that they use to make that display copy that then doesn't have the card in it well right no no that's I don't think that that's
3342023	3344066	is that what they were talking about?
3344087	3346050	just having the one up there?
3346110	3361416	I thought they were talking about putting the copies out on the shelves the used ones we're crossing our wires we're talking about both at the same time this is basically where they're taking a new copy
3361936	3367687	Opening it up, taking the game out, putting it behind the counter, and then someone wants to go purchase whatever game it is.
3367728	3369030	They're like, oh, it's the last copy.
3369551	3370072	It's open.
3370112	3372217	I'm going to put the game back in there, and here you go.
3372237	3373299	It's the same price as new.
3373339	3374140	It's like, well, hold on.
3374201	3375744	No, you opened that, though.
3376104	3377708	Yeah, but it's new.
3377728	3379030	It's never played, but it's new.
3379471	3380974	Yeah, but it's not sealed.
3380954	3382677	but you're trying to charge me the same price.
3382817	3384801	Yeah, but it's new.
3384821	3386483	Honestly, they should just take the hit for it.
3386844	3389368	I mean, because they're not selling used copies.
3389849	3391632	Exactly, because, I mean, I'm sorry.
3391652	3392473	It's not my problem.
3392994	3396080	But they don't, and a lot of people just take it.
3396480	3397201	They're like, whatever.
3397582	3398303	Tiger Claw.
3398323	3401088	Yeah, like, SSG100 Matt says it's like selling the 4 model.
3401489	3402110	Yeah.
3402130	3402270	Mm-hmm.
3402352	3410402	TigerClaw in chat says, I remember way back in the days at Toys R Us, they had something that looked like the box art and what was on the back of it so you can see what the game looks like.
3410722	3413666	Did you know in Japan they still use the slips?
3413686	3414827	Shane just told me that.
3414847	3416950	They still use the slips at Toys R Us in Japan.
3417651	3418652	What a time to be alive.
3420114	3422597	There's plenty of other places that do that too.
3423558	3424579	In Japan, that is.
3424610	3429975	TheGorilla72 says, I'm so old, I've been shopping at GameStop since they were Funkoland.
3429995	3433719	My friend, I remember when Funkoland only advertised in magazines.
3435221	3438504	I remember when you had to get the piece of paper to find out what the price of the game was.
3439845	3441206	I mean, it's GameStop.
3441226	3448233	By the way, you know that Dan managed GameStops for a long time, but he started with Funkoland.
3448534	3449875	Yeah, yeah.
3449990	3451832	Yeah, I mean, they're fine.
3451892	3456337	It's just like, I don't know, like, I find myself wanting to go into them less and less.
3456357	3461403	Like, every time I go in there to look at stuff, it's just like, eh.
3461423	3463525	It's like, there's no selection of anything.
3464126	3466028	It's just garbage I don't want.
3466348	3467489	And there's no deals.
3467990	3471914	What was that Garfield shirt I saw the last time I was in a game shop?
3472455	3473035	A game shop?
3473115	3473816	A game stop.
3473836	3475979	I was cracking up so fucking bad.
3476960	3477280	Um...
3478002	3479143	God, now I gotta find it.
3479364	3481807	I was so bored, I went to GameStop.
3483750	3484370	I'll find it.
3485412	3488496	I do like to look- I actually got my Kirby coin purse there.
3489497	3495465	Yeah, because they sell a lot of, like, crap now, but, you know, sometimes it's interesting crap.
3495485	3499270	They actually have, like, really good official merch, and they'll have them marked down.
3499490	3499730	Yeah.
3500912	3502474	Okay, I'm trying to see if I can find-
3503450	3507815	But when I lived in Alabama, we had EB and we had Babbage's.
3508736	3509477	Oh, I found it.
3509577	3510057	I found it.
3510077	3517085	It was a shirt with Garfield on it that said, Stay Chill, where Garfield's licking an ice cream cone.
3517506	3520129	And I was like, that's gamer merch?
3520789	3527517	This looks like what mom wears the oversized shirt to stay home with.
3528188	3530292	and sit on the couch all day.
3530312	3534440	Because they sell pop culture stuff now, and so there's a lot of that.
3535041	3539730	No, seriously, because I got, I think, an Office shirt for my wife from there.
3540090	3551091	They have lots of just... It's basically a Hot Topic merch now that they have in there because... I mean, to be honest, they're making...
3551712	3561299	No Margin on the games, and they have to make profit with higher margin stuff, like those Funko Pops and everything.
3561961	3565671	That said, though... Did somebody say Funko Pops at a GameStop?
3567068	3590646	I got pictures of those too I just don't I'll do a deal on them if you like buy like they'll let you do the buy one get one thing if it's like you know because they do that for the sale ones if you're buying a new one and you want to pick up a sale one at the free or half price they'll do that sometimes I will say though they did have a nice Sprigatito purse they had a nice Sprigatito purse I would have maybe bought that
3590626	3599018	Literally the last thing I bought at a GameStop was my little fuzzy Kirby coin purse and a squishy flying Kirby.
3599739	3601161	I'll put it on our Discord.
3601261	3602803	Alright, enough GameStop talk.
3602843	3603945	Let's move on to our next story.
3605767	3609212	But I like squishy Kirbys.
3609232	3612457	Me too, but... Alright, well.
3613258	3613518	So.
3615020	3619907	I know people who are into scary-ass freaky game subnautica.
3620292	3634110	and on July 2nd, Krafton had said they removed members of the Subnautica 2 leadership team after I think that there was a leak.
3634131	3640739	Yeah, they did confirm that there was a leak and the game is kind of in a little bit of trouble.
3640860	3644224	There's just a lot of drama around it.
3644947	3672540	But they got rid of the game director, Charlie Cleveland, the co-founder of Unknown Worlds, Max McGuire, and the studio CEO, Ted Gill And then they have since filed a lawsuit against the developer in South Korea for wrongful dismissal But they were canned because there was considered a lack of progress on the game and inadequate content
3672520	3700452	and that they were not fulfilling their leadership duties and so the game is behind the schedule because of it but I don't know but the leak on here it's like a state of development where the development progress was and them disagreeing on the release schedules it's some pretty interesting stuff
3701174	3710064	and while I don't, you know this is actually posted on Reddit and I mean, I'll tell you what, I'll repost it in our chat right now.
3710224	3713748	That's always lovely to have your corporate drama playing out on Reddit.
3713908	3716431	That's a lovely thing for these companies to have.
3717993	3728785	Yeah, but at the same time, I mean, it is an interesting look behind the curtain especially because I think that
3730064	3740395	DarkSakura, DarkSakura, DarkSakura, DarkSakura
3741590	3768981	they're even talking about like all of the list of changes from the launch specifications from 2023 to 2025 they're saying that there's a quote exactly on here it says the game's content volume has been scaled down compared to the initial EA spec target making it necessary to release the feasibility of the planned launch reassess sorry the feasibility of the planned launch but very
3770378	3771300	Very curious.
3773625	3777574	And it even talks about parts of what happens in the game.
3779819	3782806	So, very interesting.
3782826	3784409	Let me go ahead and spoil the plot.
3784429	3785091	I'm so annoyed.
3785271	3785592	Alright.
3788158	3789180	Loki, what do you got for us?
3790544	3799764	So, Destiny 2 apparently is getting some blowback from their upcoming The Edge of Fate expansion.
3801247	3808502	They were giving free loot for players, and apparently every day you can log in and get loot and all that stuff from...
3808482	3815254	The Emissary Vendor, and eventually claim an infinite nonary engram.
3815274	3818940	Wow, none of this makes any sense to me because I don't play any Destiny whatsoever.
3818960	3825131	I played it a few times and I sort of remember that stuff, but I... Okay.
3825151	3827976	But basically... Rare digital shit.
3829610	3852377	so apparently players had discovered a trick for farming them in mass and uh so because those nonary engrams or whatever drop cosmetics uh and Bungie basically said stop doing that uh so there's ways to essentially game the system to get all these unlimited cosmetics and you know
3853133	3860040	They don't want that because that cuts into their bread and butter of monetization of their free-to-play games.
3860180	3861962	So, yeah.
3862202	3867308	And then also, because they did that, they shut down the whole thing.
3868189	3869330	So this is due to an issue.
3869370	3873935	We have disabled the daily bonus of Nonary Engram available at the Emissary.
3874355	3876998	We are investigating a fix for the players.
3877018	3880321	And then because of that, people are now mass-deleting characters.
3880822	3882904	Basically saying that we are...
3882968	3887394	We are tired of this nonsense.
3887414	3887715	I don't know.
3888957	3890920	We're not gonna take it.
3892582	3895026	No, we're not gonna take it.
3895046	3898751	So, yeah, they said basically kill my drive for Luta Palooza.
3900493	3905481	Looks like tonight I finally check out that Mecha Break game.
3905501	3906702	Don't give them any more attention.
3907303	3909747	We already saw enough trailers for that.
3909767	3910087	Alright.
3910368	3910528	Alright.
3910660	3937107	Sheld Need for Speed
3937087	3941172	and is quietly parking, is that a pun, the series.
3941192	3951365	Speed Hunters was a site, by the way, that was partially funded by EA, or I think maybe it was funded in full by EA, and last had an update in April and is apparently ceasing operations.
3951986	3952687	Hmm.
3952707	3956952	No official statement yet from EA on the Need for Speed franchise, but...
3956932	3962102	The publisher did shut down online servers for Need for Speed Rivals on October 7th.
3962323	3963525	Or it will be shutting it down.
3964547	3968936	Criterion Games moved most of the employees to focus on the Battlefield franchise.
3969778	3978636	And Battlefield head Vince Zampella told Eurogamer that the Need for Speed team would be, quote, "...joining their colleagues working on Battlefield."
3978616	3984247	So if there is a need for speed going, we don't know who's working on it.
3984267	3989257	So signs are pointing to the fact that this franchise may be donezo, which is kind of sad.
3989337	3991461	I thought it really still had its fans.
3991481	3999557	I mean, I know Forza Horizon is a thing that a lot of people are playing, but that doesn't mean it can't exist at the same time with Need for Speed and some of the other big racing franchises out there.
3999938	4001080	That's kind of sad.
4001819	4006509	Sj100Matt says, listen, I'm a petty bitch when it comes to Need for Speed.
4006529	4011138	I always disliked the EA made Criterion Games work on the franchise rather than Burnout.
4011158	4014946	The Burnout franchise died for Need for Speed to live and I'm bitter about it.
4015467	4016609	Honestly, valid.
4016629	4017932	I really like Burnout too.
4018654	4022241	So I understand that frustration to be quite honest.
4024364	4032523	Well, with all of these dying games, sometimes we need to go back and recognize a classic, something we want to go back and play.
4032883	4035369	Although, I don't know, it might be difficult to check out this one, but we'll see.
4035730	4040601	Let's roll the Classic Game of the Week bump and let Jamie do her thing.
4051010	4058870	and now it's time to travel back to a simpler time where I'll dive into the vault and pull out a classic and tell you about it.
4058890	4062520	It's time for the classic game of the week.
4062540	4065407	Alright, DarkSakura, what did you pick for us this week?
4066383	4086265	Hell or Jigoku
4086245	4089930	You have to reach Buddha to have your fate decided.
4090110	4095457	Tarosuke has key bullets that he can fire at enemies and charge to increase his power.
4095958	4099142	Enemies can drop money and you can buy weapons and other stuff.
4100043	4101164	And there are two versions.
4101765	4105570	This is actually of the arcade release.
4105550	4129127	there's a Japanese version and an English version but that English version was only released in other Asian countries outside of Japan the arcade archives by the way have both versions of the game so Tarosuke was banished to Jigoku for causing mischief in the world of the living and so he has to go fight
4129107	4157646	the monsters in hell to reach Iyama who is the Buddhist deity that judges the dead to determine his fate and you have five different levels each taking place in different parts of Jigoku so there is Jigoku Iriguchi which is the gate to hell, Yukai the ghost sea, other levels like that and so the first four stages have a boss fight with an Oni
4157626	4175922	and then at the beginning of these Tarosuke has to kneel in a shrine and summon a spirit named Monmotaro to defeat the oni and you play as Monmotaro not Momotaro but Monmotaro and you can fly around and shoot pellets kind of you know
4176391	4183400	And then it gets harder as you go along and you have to find different secret items to unlock the way out.
4184261	4185722	All kinds of stuff.
4185802	4197457	And on top of that, the Famicom version has a pious meter that's filled when Tarosuke does good deeds, such as completing his objectives in the levels.
4197477	4200981	And the pious meter also determines which of the endings that you get.
4200961	4206674	So given that I did speak about a Famicom version, there are other releases.
4206694	4212347	It was ported to the PC Engine and Famicom with some changes, of course.
4212889	4219965	The PC Engine version and the arcade version were both re-released for the Japanese Virtual Console.
4219945	4230224	and a Japan-only spin-off called Kyukai Dolchiki, which is a baseball version of the game.
4230724	4233009	A yakyu, as it is.
4233169	4238258	And it's very similar to Namco's World Stadium series.
4238238	4255838	Tarosuke also appeared in Namco X Capcom on PS2 and he teamed up with Taira no Kagekiyo from Genpei Tomaden and he also has a cameo appearance in Project X Zone 2 for the 3DS.
4256799	4267131	At any rate, Game Machine publication said that Yokai Dolchiki was the most popular arcade game in the month of April 1987 and went on to be
4267111	4273359	The fifth highest grossing table arcade game in 1987 in Japan.
4273379	4275161	Also, Gamest gave it some awards.
4275201	4279426	It won the 8th Grand Prize and 4th Best Ending Award and 8th Best Graphics.
4279927	4282090	Famitsu gave it the Silver Hall of Fame.
4282630	4283932	That's for the Famicom version.
4285194	4285834	But there you go.
4286615	4290460	And it's a neat, fun little game.
4291662	4293604	I know not a lot of people have heard of it.
4294405	4296848	But it's worth checking out.
4296946	4301131	Yeah, this I, you know, again, I'm sorry, the podcast listeners can't see the visuals here.
4301151	4309620	But, you know, this is, this is a pretty neat looking game for the era, especially kind of the aesthetic with the gigantic mini map in the corner.
4310101	4315707	And just like one small, like, really, it's just like the bottom half of the screen is the actual game.
4316048	4319071	I don't know why it gives me kind of Rygar vibes with the setup like that.
4319131	4320793	Because like Rygar, Rygar...
4320773	4325420	The game kind of takes place in a strip through the middle and the rest is all like UI.
4325900	4330928	But I did not know much about this game, but I'm kind of intrigued, I got to admit.
4331849	4339240	It's also that era of Namco artwork that I think led to the Cosmo Gang style is what I like to call it.
4339340	4340421	Yeah.
4340662	4346410	You know, the Cosmo Gang and the Point Blank style is that same art style.
4346693	4372448	And again, we did get, you know, Makaimura and
4372715	4377240	Oh yeah, now that guy's praying in front of a statue and was breathing fire.
4377260	4378081	That's pretty wild.
4378141	4381946	This is where you have Mon Motaro to play for you.
4382166	4382466	Huh.
4382827	4384008	This is really cool, though.
4384088	4386691	As far as a piece of gaming's history, I bet not a lot of people heard of this.
4387012	4389354	So you said this is on a PS2 anthology.
4389394	4395341	Is it on any of the NAMCO discs from back in the day?
4395361	4400427	The PS2 is that Tarosuke has an appearance
4400407	4402369	Oh, oh, my bad, my bad.
4403190	4408796	He's a character in Namco X Capcom and he's in Cameo and Project X Zone 2.
4408816	4410438	Okay, okay, that's right.
4410839	4413702	It was in the Arcade Archives and Virtual Console.
4414142	4415704	Oh, Arcade Archives, okay.
4416805	4418107	Exactly, exactly.
4418227	4421150	So, which of course is available for PS4 and up.
4421170	4423253	Yeah, yeah, no, Arcade Archives is great.
4423393	4425095	So, okay, that's a way you could play this then.
4425115	4426376	I might have to check that out.
4426396	4426656	Yeah.
4426676	4427037	Interesting.
4427738	4427818	Yep.
4427838	4428218	All right.
4428238	4429840	But yeah, it's...
4430090	4433600	It's a fun little one.
4433700	4435405	I've played a little bit of it.
4437110	4442867	It's just one of those games that I pick up and play for a little bit, and then I'm like, okay, I played it, and I don't think about it for another year.
4443151	4444052	No, cool pick, though.
4444192	4444573	I like that.
4444613	4446436	I might actually check that out on Arcade Archives.
4446456	4448058	So thank you.
4448078	4448398	All right.
4448518	4451342	Well, at this point, though, I must apologize.
4451803	4456510	I need to bid everybody adieu because my migraine is now at that point.
4456710	4457110	I got you.
4457130	4459374	I'm sorry to hear that, but I do hope you feel better.
4460075	4463880	And do you have any parting words or final thoughts for our listeners tonight before we let you go?
4465883	4469007	Killers be stinky in DVD, and I'm a stinky killer.
4469341	4488379	I still have not played this anniversary event I haven't I don't even think the game's installed oh no I lost access to it on PS5 I still have the Steam version though but yeah well then Rob play with me on Tuesday um maybe I gotta see what my schedule is this week but maybe I got a lot of stuff going on in my day job this week but maybe late at night
4488562	4489844	One last little thing.
4490124	4499555	We did Swan Lake yesterday, and I felt like I was a den mother hanging out backstage because I was only in two minutes of the dance because I had been injured when we started rehearsals.
4501517	4512190	But for every dancer out there, for everyone who does any kind of sport, make sure there is somebody with an equipped first aid kit and bring scissors.
4513182	4514644	That's it.
4514684	4517448	We try to have that when performing the Rocky Horror Picture Show.
4517508	4520512	That's a good idea for any situation with a lot of people.
4520593	4521374	Have a first aid kit.
4521394	4522916	But yes, yes.
4522936	4528303	And everyone owes it to themselves to at least be first aid certified at one point in their life.
4529746	4533511	Because you never know when that's going to save somebody's life or prevent a worse injury.
4533531	4535133	And that's what I have to leave everyone with.
4535153	4537416	The beat to CPR is staying alive.
4537797	4540641	Do do do do do do do do do do do.
4540840	4545835	There's a lot of other songs, but Stayin' Alive is the one that I remember because literally that's what you're doing.
4545895	4547861	That's what you're doing with CPR, so it's easier to remember.
4549506	4550048	All right.
4550228	4550971	Feel better, DarkSakura.
4550991	4551412	Have a good night.
4552556	4552876	Thank you.
4552897	4553398	Bye.
4553463	4559289	Alright, I knew other people would start saying other games and all that stuff.
4559670	4563154	Alright, let's go over to Loki.
4563414	4565697	We have a question in chat, actually.
4565757	4569841	Chat wants to know, what is the game that is playing behind you tonight on stream?
4569861	4576969	Because usually, as we're taping live at VOG Network, you have a game that plays behind you, which this looks like some type of Zelda clone.
4576989	4579172	Is that that Dungeon Maker game?
4579192	4579572	It doesn't...
4579552	4606015	I didn't think it was Legally distinct, excuse me, legally distinct Sure
