start	end	text
4606214	4633960	hmm so yes it's just was this something they ran in the middle of the night at Summer Games Done Quick or something is that why it's in the bundle oh wow must have it must have been one of the games I haven't gotten a chance to check it out but yeah it certainly it looks like a link to the past for sure I didn't realize Humble Bundle was running a thing right now for Summer Games Done Quick um is it over at this point maybe no it's still going for another four days
4634007	4634515	Oh, nice.
4635653	4636710	I gotta try to find it.
4638412	4667136	I'm actually looking at their site right now to try to see what this is all about because I feel like oh there it is I feel like you know Humble Bundle just kind of turned into any other store at some point but I guess we can point out here real quick let's see they have okay leave me alone I hate these pop-ups they have yeah Collateral Damage that's a fun game oh Roller Coaster there's that Lena's Inception that you're talking about okay so they have like nine indie games for that that's kind of cute
4668162	4675052	Yeah, because Lenda's Inception itself is $10, and the bundle is basically $10 or more, so it makes sense.
4675293	4675593	All right.
4676795	4679459	Let's move on.
4679539	4683805	Let's get to some rapid-fire news and talk about some other things that are going on in the industry.
4683825	4685007	So, Loki, we'll go to you.
4685864	4698137	I guess this is silly, but GameStop is auctioning off for charity the stapler that ruined Nintendo Switch 2s in Staten Island.
4698257	4699738	This is so weird.
4699758	4704463	How desperate are they for money?
4704483	4705885	They're not even desperate for money.
4705925	4710910	It's desperate for attention because they're doing it for charity.
4711227	4713579	Oh, it's for charity?
4713719	4714986	Okay, then I'll let it go.
4715006	4717840	Yeah, it's for the Children's Miracle Network Hospitals.
4717860	4718262	Alright.
4718422	4719769	But, I mean...
4721707	4730316	If you really want to poo poo on their goodwill, which I'm always willing to do, it's a tax write off for them as well.
4731978	4736163	Would you like to round up your purchase today to save sick kids?
4736864	4739687	Would you like to round up your purchase today to feed hungry kids?
4740027	4743811	No, I would prefer billionaires feed them as opposed to you getting a tax write off.
4743871	4744592	Thank you.
4744910	4750962	Yeah, so as much as I like the idea of them raising money for taxes, this is just a big ol' attention thing.
4751543	4752365	Like, I don't know.
4752846	4755752	I just... I don't know.
4756353	4762084	I don't... I'd be surprised if this company lasts till 2030, let's be honest.
4762465	4762846	Fair enough.
4763367	4764589	What else do we have, Loki?
4765312	4772622	We also have Cyberpunk 2077 headed to July's PlayStation Plus for PlayStation 5.
4773043	4774184	So that's pretty awesome.
4774905	4777068	PlayStation Plus Extra and Premium.
4777489	4792790	You get Cyberpunk 2077, Abiotic Factor, Banishers, Ghosts of New Eden, Bluey the video game, Planet Zoo, Risk of Rain 2, Tropico 6, and New World... I don't know.
4792910	4793511	It's a made-up name.
4793651	4794212	ATRM?
4794692	4795133	I don't know.
4795653	4803150	PlayStation Plus Premium is also getting some older games, Twisted Metal 3 and 4 as well.
4803170	4804195	Cool!
4806031	4806672	All right.
4806952	4809215	Well, let's talk about Summer Games Done Quick.
4809235	4817445	We were mentioning it earlier in the show, but we wanted to share with you the official total that was raised, which is $2,436,614.
4817805	4823792	And that was all raised, of course, for Doctors Without Borders.
4824533	4829138	It was pointed out that that was a little bit under what was raised in 2025.
4829179	4832983	That was $2.5 million that was raised in 2025.
4832963	4843287	But, you know, there's a million factors that could go into that, and certainly raising $2.4-plus million for an awesome charity, I don't think there's any way you can frame that as a bad thing.
4843848	4848559	I think there's just a lot of other things vying for attention now.
4848539	4856272	Summer Games and Awesome Games Done Quick did their best years when everybody was stuck at home during COVID and couldn't go out and do other things.
4856292	4859857	So I would say probably things that impact the weather.
4860559	4866328	If the weather is pretty nice out, people are probably going to be less inclined to stay at home and watch Games Done Quick.
4866308	4869415	It just depends what else is going on.
4870076	4872622	And there's other competition in the charity space as well.
4873003	4875408	A lot of people raising money for various charities.
4875428	4881482	But I still think it's really rad that Games Done Quick, all of these years later, because it's been going on for a while, can still raise...
4881462	4885726	Well over $2 million for the charity, which is great.
4886987	4892671	Did you know $50 million all time over that raised in the history of all the Games Done Quick marathon events?
4893152	4894693	So pretty cool.
4895454	4900578	Direct donations, but also partner donations, fan gammer.
4900638	4902960	Did I really just almost read fan gamer as fan gammer?
4903601	4904702	Y'all, I'm getting old.
4905462	4909346	The Yeti, fan gammer, where every gammer has a voice.
4909566	4911047	And the Humble Bundle.
4911483	4912725	were all part of that.
4912746	4917655	So that also explains their tie-in there was that they were a partner with Summer Games Done Quick.
4917675	4927195	Of course, Summer Games Done Quick had runs like Super Mario Maker 2, Mario Kart World, Deltarune, some of the newer games that were included towards the end there.
4928257	4928918	So yeah,
4928898	4932121	There's other speedruns that Games Done Quick does.
4932522	4942271	We know the big ones, but do you know that Flame Fatales 2025 called Survive Her this year is running from September 7th through 14th.
4942352	4946015	The schedule is available for that over at gamesdonequick.com.
4946716	4949479	So there's other things to look forward to throughout the year.
4949999	4958668	Awesome Games Done Quick 2026 will be held January 4th through 10th in Pittsburgh, Pennsylvania.
4959340	4964148	One other quick thing to share here, which is really sad news, unfortunately.
4964349	4969337	At the age of 71, we have lost James Carter Cathcart.
4969397	4973304	James Carter Cathcart was the voice of James in Pokemon.
4973765	4974225	Pretty big.
4974346	4976910	Also Meowth Professor Oak.
4976890	4977911	and much more.
4977951	4981075	But of course, some of those Pokemon characters are pretty legendary.
4981996	4985080	Fergus was also one of the roles in Pokemon, the first movie.
4986061	4990586	Snubbull in Pikachu's Vacation, which was the short that accompanied the original movie.
4991227	4994791	Also, he was Weevil Underwood in Yu-Gi-Oh!
4994811	4995632	Duel Monsters.
4996073	5004062	He was on Kirby Right Back At Ya, One Piece and Sonic X. He was also part of the credits for Sonic, or excuse me, Shadow the Hedgehog.
5004042	5029965	DarkSakura, DarkSakura
5030705	5045524	So in the US, we have World's End Club on PlayStation 5, Arashi Gaiden on PC, Eden Zero on PC, PlayStation 5, and Xbox Series.
5045707	5066652	Eric Sholm, The Stolen Dream on PC, PlayStation 5 and Xbox Series Neverwinter Nights 2 Enhanced Edition on PC, Nintendo Switch, PlayStation 5 and Xbox Series Ready or Not on PlayStation 5 and Xbox Series Stronghold Crusader Definitive Edition on PC
5066632	5092875	Anomaly Collapse on Nintendo Switch Bridge Constructor Studio on PC, Mac, Linux, Nintendo Switch, PlayStation 4, PlayStation 5, Xbox One, Xbox Series, iOS, and Android Donkey Kong Bonanza on Nintendo Switch 2 Golden T Arcade Classics on PC, Nintendo Switch, PlayStation 4, PlayStation 5, Xbox One, and Xbox Series
5093783	5102600	HunterXHunter, NenXImpact on PC, Nintendo Switch, and PlayStation 5.
5103682	5110616	We have Puglia, Magi, Madoka, Magica, Magia Extra.
5112079	5113281	Yeah, that is extra.
5113301	5115285	On PC.
5115704	5122738	We've got a U-Pin and I-Pin Universe on PC, Nintendo Switch, PlayStation 4 and PlayStation 5.
5122778	5130574	And finally, Shadow Labyrinth on PC, Nintendo Switch, Nintendo Switch 2, PlayStation 5 and Xbox Series.
5131229	5139950	All righty, looking at Japan on the Nintendo Switch 2 this week, the big release, of course, Donkey Kong Bananas, which is out on July 17th.
5140011	5141474	That's a worldwide release, of course.
5141855	5146707	But we do also have Shadow Labyrinth is being released in Japan this week for the Switch 2.
5146687	5149470	and those are pretty much the only releases on Switch 2.
5149530	5171074	However, Switch 1 still seeing releases including Shadow Labyrinth getting its own version there as well as Snow Brothers Special, Distorted Code, Seija no Nokoriga also out on the 17th, Tevi in a multi-language release in Japan, also Busta Fellows Season 2, Hunter x Hunter and
5171054	5189299	Nen Cross Impact is out as well in a regular and a limited edition so there's a few versions of that there so that is all on the Nintendo Switch this week and then lastly Japan's on the PlayStation 5 has Eden's Zero is also released same day here as the US so you can look forward to that
5189279	5196989	and then Hunter x Hunter, Nen x Impact is also out in Japan this week, as well as Shadow Labyrinth and Tevi.
5197130	5204540	So a lot of those same games I was talking about, but also Dragon Ball Z Kakarot also out in Japan this week.
5204560	5205821	Those are your Japanese releases.
5206382	5209887	Since Jamie's not here, Loki, would you be willing to talk about the UK releases?
5210474	5235537	Yep, in the UK we have Arashi Gaiden on PC, Don Apart on PC, Kaizen, A Factory Story on PC and Mac OS, Stronghold Crusader Definitive Edition on PC, Lost in Prayer on PC, Noble Legacy on PC, Noobs Are Coming on PC, Ready or Not on PlayStation 5 and Xbox Series,
5236023	5251618	Destiny 2 Edge of Fate Neverwinter Nights 2 Enhanced Edition PC, Switch, PlayStation 5, Xbox Series
5251598	5272510	Eden Zero on PC, Switch, PlayStation 5, PlayStation 4, Xbox Series as well Eric Shulm, The Stolen Dream on PC, PlayStation 5, and Xbox Series Gaucho in the Grassland on PC Meta Valley Battle Simulator on PC
5272490	5293907	Worship on PC, The Wandering Village on Switch, Runa Illustra on PC, Neon Abyss 2 on PC, The Carters 2 Turbocharged on PC, Fretless, The Wrath of Riffson on PC,
5293887	5304065	The Necromancer's Tale on PC as well, Dreadzone, The Drifter, and He Is Coming on PC.
5305207	5306349	A lot of stuff this week.
5307270	5312680	Robocop, Rogue City, Unfinished Business on PlayStation 5, Xbox Series, and PC.
5313521	5315625	Hunter x Hunter, 9x9,
5315926	5318809	Impact on PlayStation 5, Switch, and PC.
5318849	5345578	So Ranma's telling us in chat that the X or cross is silent in Hunter, and I'm bitching about it's never consistent, because you have a title like Namco Cross Capcom, or then you have one where it's like, or Final Fantasy X, or it's the X means, or Final Fantasy X-2 specifically, not X-2, or you have something where it's, I'm trying to think of one where you actually do say X, Mortal Kombat X, like it's never fucking consistent, the usage of the X. I'm just gonna emphasize it even harder now.
5345558	5346379	is what I'm going to do.
5346820	5348282	Yeah.
5348302	5349524	Chunathem Crossverse.
5349564	5350486	Thank you, Ranmari.
5350947	5352169	Yeah, there you go.
5352469	5359080	Donkey Kong Bonanza on Switch 2, Forgotten 23 on PC, Phantom Squad on PC.
5359240	5361544	I read this completely wrong the first time.
5362065	5363968	It said, who's at the door?
5364088	5367413	I read that as who ate the door, which I was like, that's silly.
5367433	5368515	That's on PC as well.
5368735	5372882	And then Shadow Labyrinth on PC, Xbox Series X,
5372862	5375045	PlayStation 5, Switch, and Switch 2.
5375225	5377348	That is it.
5377368	5377909	All right.
5377929	5384297	Well, we're almost towards the part of the show where we'll take your calls over on our Discord server, but you should join our Discord server anyway.
5384317	5387001	You all have lovely conversations throughout the week.
5387081	5395853	That's over at vognetwork.com slash Discord, vognetwork.com slash Discord, and we will look to the green room to see if anybody wants to give us a chat later on.
5395913	5401080	But we do have one more story for you here, a very topical story from Loki.
5402258	5412573	Yes, and so, you know, Itch.io will do these different bundles for different charities and different things, usually stuff that's going on in the world.
5413174	5420344	So, you know, they did the bundle for racial justice, bundle for Ukraine, the California wildfires.
5420465	5425292	Well, now we have the No Ice in California Itch charity bundle.
5425893	5428236	500 games for a $10 donation.
5429057	5431000	That is...
5431655	5438423	basically going towards funding those, I guess, LA immigrants who are facing ICE invasions.
5440245	5440766	Topical.
5441567	5442588	Is Pixel Poops in it?
5443509	5445172	I know you were in one of these.
5445512	5449877	It was before in one of the other ones, but that's back when it cost something.
5449957	5452400	Remember, as a reminder, it is free forever now.
5452420	5453041	Oh, that's right.
5453061	5453341	That's right.
5453361	5454583	You made it free forever anyway.
5454663	5456025	So, yeah, nice.
5456425	5458708	So, I mean, yeah, you could put it in the bundle, but...
5458688	5460871	Yeah, it doesn't matter because it's free anyway, yeah.
5461051	5461411	Got it.
5461872	5463153	Yeah, no, I think that's a great deal.
5463173	5464615	Most of it's tabletop games, though.
5464635	5470802	They said 560 games that are in there, 427 of them are tabletop RPGs.
5470942	5472404	That's a lot of RPG.
5472464	5479512	Well, there's a lot of tabletop players out there, too, that, you know, might enjoy a little bit of diversity in their Friday night game club or whatever.
5479532	5484438	I like the games when they're talking about, like, which ones you should check out of the bundle.
5484578	5486841	One of them is Wrap Your Boyfriend, a high school romance.
5487161	5487261	Yeah.
5487663	5489526	It is exactly what you think it is.
5489546	5496215	Alright, well, definitely a worthy cause as far as I'm concerned.
5497137	5497717	Clever boy.
5498959	5501883	Alright, hope you'll check that out over on itch.io.
5502745	5512358	With that, we are towards the end of the show, but we want to open it up to any questions you might have for us in chat over at twitch.tv slash VOG Network.
5512739	5513620	And I forgot...
5513600	5517470	Jamie is not here to do the mailbag so I'm going to try to bring that up real quick.
5518233	5521461	In the meantime, Loki, do you have any last minute stories for us tonight?
5522865	5525432	I do not, actually.
5525817	5528060	Sorry, there's no last minute stories.
5528080	5529882	I know, I feel like we don't have anything to talk about.
5529962	5535049	Like I said at the top of the show, it wasn't exactly a busy, busy week, all things considered.
5535069	5540817	But yeah, I do want to thank, so we didn't officially get like any emails to read tonight.
5541157	5548026	But I do want to thank, we got an email from E3VL who actually sent a code for me for the Pokemon trading card game.
5548326	5551150	I have to be honest, I kind of fell off the wagon with that.
5551130	5554198	But I'll still redeem the codes because you never know when I might get back on that wagon.
5554218	5555903	So I do appreciate you sending that along.
5555923	5559353	But I did kind of fall off the trading card game bandwagon at some point.
5559894	5560235	I don't know.
5561218	5564607	I don't know if I was just getting annoyed I kept getting so many repeats or what it was.
5564627	5566793	I just found another game to...
5566773	5567614	Break the cycle.
5567634	5568215	Who knows?
5568235	5568976	Who knows?
5568996	5575426	So, well, if you want to send us an email for a future week, participate at orangelaundradio.com is the place to do that.
5575767	5578972	So I guess otherwise, we'll wrap things up for tonight.
5579332	5582277	So I want to thank you all, of course, for listening to Orange Lawns Radio.
5582297	5590189	Whether you were here live in our chat, listening to us live, or you downloaded us, streamed us on YouTube or whatever, we appreciate that.
5590349	5592713	If you enjoyed what you heard here at Orange Lawns Radio,
5592693	5593434	Spread the word.
5593454	5593995	Tell a friend.
5594255	5595717	We are the show where every gamer has a voice.
5595737	5597759	We need more voices to put out on air.
5598200	5607511	A nice five-star review on a site like Spotify, Apple Podcasts, YouTube, wherever it is you found this show, those go an awful long way, and we deeply appreciate it.
5607591	5611176	Again, another shout-out for our Discord over at vognetwork.com.
5611456	5613098	That's vognetwork.com.
5613078	5616664	and we would encourage you as well to support our other shows over at the Voice of Geeks Network.
5616965	5619990	If you enjoy video games, we have the Bobby Blackwolf Show is here.
5620230	5626220	Gamebuoy.org is back and producing new episodes and I would encourage you to check that show out if you haven't checked them out in a while.
5626300	5630327	Our good friends over there at Gamebuoy.org, video game podcast, doing a great job.
5630307	5655893	I also would give a shout out if you like British television don't forget to check out the British Invaders they do some great work some deep dive analysis on not just classic but some contemporary British television and of course our Pals Over Anime Jam session which is live Tuesday nights on Twitch but then also available as a podcast and for more information on that you can check out
5656700	5659532	Alright, with that, it's final thought time.
5659552	5660476	Loki, your final thought.
5662464	5666642	My final thought is that I'm going to be busy this week.
5667787	5669248	I have a lot of stuff to do.
5669348	5669889	Yeah, me too.
5669929	5670549	I got a lot.
5670950	5672271	But it'll be good.
5673272	5677576	My final thought is Fantasy Life 1.
5677596	5682740	I've got to keep, or I, whatever they call it, Fantasy Life, the girl that steals time.
5683501	5687905	I need to just focus and stop getting distracted by min-maxing everything.
5688005	5689907	But it's so hard in that game.
5689947	5691488	It's so hard!
5691508	5693930	Have a good night, everybody.
5693950	5694791	We'll see you next time.
5695511	5695852	Good night.
5696212	5696893	We'll see you in seven days.
5697033	5697253	Bye.
5700153	5702677	You've been listening to Orange Lounge Radio.
5704800	5709867	Orange Lounge Radio is a production of OLR Studios.
5709887	5715295	To join us for our live show, tune in to vognetwork.com Sunday nights at 6 p.m.
5715316	5716858	Pacific, 9 p.m.
5716878	5718721	Eastern.
5718741	5728455	The views and opinions expressed in this program do not necessarily reflect those of the staff of Orange Lounge Radio nor VOG Network, but you know they were all still true.
5731034	5732169	See you next week.
