start	end	text
1603983	1619882	at least they're trying I know, I know obviously we don't take delight in any studio really closing so it's good to hear that they're still at it so best of luck to them with whatever direction they end up going in but yeah, the
1619862	1637483	Those Microsoft closures really were a
1637463	1643193	You now have the labeled and standardized accessibility tags available to you.
1643213	1650004	We had talked about this before that Microsoft was going to be incorporating these into the Microsoft Store, but they are out now.
1650545	1657136	The goal is to, quote, provide players with clear and consistent information about the accessibility features in video games.
1657156	1662525	So for an example, let's take a game like South of Midnight, which is a relatively recent release.
1662505	1679586	DarkSakura.com
1679566	1691319	Visual features feature color alternatives, camera comfort, large and clear subtitles, and then input features include adjustable input sensitivity and playable without button holds.
1691720	1694588	And that's all I can read in the little screenshot.
1694568	1711480	DarkSakura, Luke,
1711460	1717167	maybe on-demand tutorials, that more strikes me as like a Bobby Blackwolf mode type of thing in a game.
1718249	1721994	And I'm not shading it whatsoever because I'm kind of thinking like, oh, I do like it.
1722094	1735251	Like, have you ever, and I'm sure you've all done this, have you ever played a game for like five hours, then you got distracted by something else, and you went back to that first game and you're like, I don't remember what the buttons do in this game.
1735431	1736753	I don't remember how to play this game.
1737233	1738816	I guess I'll have to start over.
1740438	1740758	Um...
1741936	1765615	I do that all of the time all of the time ask me why I've played Pokemon Sword and Shield like seven times at this point and haven't beaten it yet or not Sword and Shield sorry um Scarlet and Violet like seven times at this point and still haven't beaten it so on demand when I've like forgot like not how to play it but just like I barely started this game I'm just gonna start it over again yeah
1766219	1771949	So, well, I see a few people in chat, Fifth Dream and Bobby Blackwolf, ironically, are both with me saying all the time.
1772090	1772751	Yes.
1772771	1773532	So it does happen.
1773552	1773893	It does happen.
1774474	1779603	The standardized tags, this is being managed by the Entertainment Software Association.
1779663	1782969	So file this under good things that the ESA have done.
1783009	1786656	It's a very small file, but this is important to put in it.
1786676	1786776	Okay.
1786756	1796244	Input from companies included Nintendo, EA, Ubisoft, Sony, Microsoft, Amazon Games, Riot Games, Square Enix, and Warner Brothers Game have all signed on to the project.
1796524	1799086	There are 24 accessibility tags.
1799947	1803450	Nintendo and Sony have not yet updated their stores with these tags.
1803890	1806513	Microsoft is the first of the big three to do so.
1806933	1808735	So very interesting.
1808755	1811717	But I would imagine the other stores will follow soon.
1811737	1816341	So very cool feature for people that are looking for...
1816321	1818984	You know, specific accessibility needs in certain games.
1819465	1828856	So curious to see how this develops and really translates to, you know, allowing more people to play a game they may not otherwise have.
1829517	1829718	So.
1831199	1831460	All right.
1831480	1831640	Yeah.
1832000	1835425	S2100 Matt says, every once in a while, the ESA gets one clap.
1835585	1836566	Exactly.
1836586	1838589	A broken clock is still right twice a day.
1838629	1840331	We all know that old adage, right?
1840431	1843054	So, but I would say, I feel like the ESA...
1844333	1846475	I feel like they've had more wins lately.
1846695	1856344	Like, I feel like the last year especially, I've been like, okay, this isn't the end of the... This isn't alright to do, but maybe it was all stories related to this.
1857085	1857886	I wouldn't doubt that.
1857906	1859207	Maybe something lit the fire.
1859227	1859587	Maybe.
1859607	1861189	I mean, that's always a possibility.
1861329	1861669	Maybe.
1862610	1863071	Who knows?
1863091	1863571	Alright.
1864112	1864432	Anyway.
1864832	1870337	Speaking of people who should have a fire lit... We still have the industry doing a lot of crappy things though, right, Jamie?
1871278	1872079	It'd be soft.
1872447	1872908	Oh yes.
1873409	1891601	So Ubisoft, even though they just got the $1.25 billion Tencent investment, they've laid off 19 workers at Star Trek Bridge Crew and a Tom Clancy game, Red Storm, for Ubisoft Red Storm.
1892061	1892262	Yeah.
1893364	1893684	Anyway.
1894946	1896970	But they are like...
1897321	1900007	Like, yeah, it's part of our restructuring program.
1900047	1903534	We made the decision to eliminate 19 roles at Red Storm Entertainment.
1905779	1906360	That was the quote.
1907302	1908745	At least that's how I understood it.
1908785	1911151	Yeah, it's just summarized for context.
1911171	1913796	They say, this is not an easy decision.
1913977	1916943	It was a necessary one given our operational priorities.
1917163	1917945	Blah, blah.
1918381	1942178	um severance packages blowing you know smoke up their ass that kind of thing um they said that no other locations were impacted by the layoffs but they didn't comment when asked for more information about the head count um for uh for Red Storm and their projects so um yeah um
1943592	1961217	But they got all this money from Tencent, so... I mean, I understand it being an ongoing restructuring, but even so, when they have an influx of money, then should they not reevaluate that plan?
1961517	1965082	Unless this influx of money was a calculated part of that plan, I don't know.
1966304	1970089	But... I'm just like...
1971335	1985312	You do wish some of these companies would see that they could do a morally nice thing, correct thing I would even argue, by, you know, let's say you have these 19 people on Star Trek Bridge Crew, which I understand that game's been out a little while now.
1985873	1989197	VR gaming hasn't exactly launched into the stratosphere.
1989717	1992060	It's, you know, it's kind of there.
1992040	2001474	Although, you know, Beat Saber's still doing its thing, because I saw some of that during Summer Games Done Quick, too, and that was fun to watch.
2001534	2004619	I was going to say, they stopped their support for that game, but I know it.
2004779	2010167	On PlayStation, but that's because it's a meta thing now, so Facebook wants it all to itself.
2010890	2021868	Other stuff, you know, I mean, this was a studio in North Carolina, but we're also dealing with a lot of video game related research losing their funding.
2021888	2028378	A lot of schools losing their funding for their programs because of the turd in chief.
2029080	2029320	Mm hmm.
2030330	2041302	and you know library services losing their funding which also we're doing some cataloging of games so it's it's really not a good time
2041484	2065048	Well, just to quickly finish my thought too on what I wish Ubisoft would have done, if you know you're going to lay off these 19 people on this one game, why can't you invest just a little bit into the learning or the development of these folks to be able to put them on another project, to be able to assign them to another, you know, it's not like Ubisoft doesn't have tons of other projects out there that could use a little help in moving along.
2065088	2067330	It's just, it's just, it's unfortunate.
2067570	2067690	What?
2067931	2068111	What?
2068391	2068791	What?
2068952	2069432	What?
2069412	2070333	Look at who's in charge.
2070514	2072577	Oh, yeah.
2072597	2075982	I was going to say in charge of what, but it doesn't matter either way you slice it.
2076463	2076904	I get it.
2077104	2082953	I mean, but it's just... Yeah, and I'm sure the investors are happy because at the end of the day, it's more money in their pocket.
2083494	2085437	But, like, I don't know.
2085897	2086358	Just...
2087468	2094042	When in the fuck are billionaires going to start to feel the heat for once?
2094343	2096107	That's what I would like to know.
2096407	2097550	We start eating them.
2097930	2098692	Yummy, yummy.
2098953	2107030	Maybe when people walk in higher force and with torches.
2107010	2109014	I'm just saying.
2109034	2111599	It's just, it's a crazy world we live in.
2112080	2112401	All right.
2113202	2113743	Moving on.
2113763	2114525	Let's talk about.
2114565	2116529	Stupid world we live in is what it is.
2116549	2117871	It's a crazy, stupid world.
2119695	2124985	Loki, let's talk about deals going, you know, deals for the rest of us going away.
2125488	2133503	Yeah, you know, Nintendo used to have this thing, this voucher program where you'd pay $100 and it'd allow you to get two Nintendo games.
2133523	2139514	Saving you a little bit of money because, you know, the games were like $60 or, you know, in some cases now $70.
2139635	2146427	So, you know, that was a savings of potentially $40 if you played your cards right.
2147309	2147850	Um...
2148168	2161587	So Nintendo, you know, I guess thinking that somehow devaluing their $80 games, says, uh-uh-uh, we're gonna kill this, and it's going away January 2026.
2162309	2173046	Here's my question with all that, because this part would make a little more sense.
2173587	2178394	Are you able to use those Nintendo vouchers on Switch 2 games?
2178374	2185424	or are you using Nintendo vouchers on Switch 1 games and you are still going to have to pay the upgrade fee?
2185444	2192854	Because remember, Metroid Prime 4 and Pokemon ZA Legends, blah, blah, blah, are original Switch games, technically.
2192874	2196379	I would never want to play Pokemon Legends ZA on an original Switch.
2196479	2197040	I'm sorry.
2197060	2198903	The original cries enough.
2198963	2202247	I can't imagine what a shitshow Z to A is going to be.
2202267	2203810	But on the Switch 2, I'm sure it'll be great.
2204130	2204871	But...
2204851	2221020	if these vouchers only work on the original Nintendo Switch then I could see that maybe Nintendo is sunsetting them simply because there are not going to be as many original Switch first party titles coming like we know Tomodachi Life but that's probably the end of it
2222148	2226313	Yeah, right now it's basically talking about with the Switch vouchers.
2226373	2228756	It says, what are Nintendo Switch vouchers?
2228796	2229277	Blah, blah, blah.
2229297	2237387	It says that they, you know, obviously they purchased in sets of two and cannot be redeemed for Nintendo Switch 2 games.
2237407	2239329	So yes, you do have a point.
2239349	2241632	So that's what it is.
2242052	2250703	And you should be aware if you use this to get Metroid Prime 4 and
2250683	2269249	Pokemon Legends CA you're going to have to buy the upgrades so you're going to have to math this out and see if this still saves you money because the question would be are they $20 upgrades or are they $10 upgrades because if they're $10 upgrades you would probably save money if they're $20 upgrades you might not
2269229	2277239	It says they said spending $120 on vouchers and upgrades instead of the $140 is what they would normally be.
2277259	2280202	So I'm guessing the upgrades are $10 then?
2280623	2281203	That makes sense.
2281223	2283226	I just couldn't remember how much they were for the Zeldas.
2283366	2285669	I thought there were $20 for the Zelda games.
2286730	2287070	I don't know.
2287130	2287551	Maybe.
2287811	2289213	I mean, I don't know.
2289233	2290735	I can't keep track of it anymore.
2291656	2293798	Yeah, because the system is too complicated.
2294519	2295220	So...
2296803	2302774	That sucks, but I don't know if they're going to come out with anything similar to that for Switch 2.
2303275	2306161	DEF says $10 for Switch 2 upgrades.
2306742	2311110	So then it would still save you money because you would buy the vouchers.
2311431	2317562	Just like you said, it's $120 for the voucher way and $140 if you don't do the voucher way.
2317542	2320165	for Prime and Pokemon ZA.
2320626	2328016	So I have to think about if I might want to do this, actually, because my coworkers were kind enough to gift me $100 in Nintendo credit.
2328437	2331761	And I just kind of assumed I was going to get Donkey Kong Bananas with it.
2333403	2337829	But now I'm like, ooh, maybe I want to get the vouchers so that I can get Prime 4
2337809	2342634	and that because essentially my coworkers graciously already bought me that.
2342714	2345036	So really, I'd only be paying the 20 bucks to upgrade them.
2345296	2349600	So I guess and those are games I know I'm going to play the heck out of.
2349620	2352743	So the question is, am I going to be suckered into an impulse buy with Donkey Kong?
2353023	2353824	Probably.
2353844	2354645	Let's be real with ourselves.
2354665	2355105	Probably.
2355185	2356146	I probably will.
2356166	2360570	I probably I still want to get Bravely Default 2 or Bravely Default for Switch 2, which I still haven't purchased.
2360590	2365835	So because I'm forcing myself to beat some games I already own first, like Fantasy Life.
2366556	2367597	So.
2368336	2368716	All right.
2369277	2371320	S2100 Matt says, Rob has nice coworkers.
2371360	2371820	Yes, I do.
2371840	2373182	I actually thought that was really cool.
2373502	2375404	You know, and we try, we kind of tried to do that.
2375424	2379149	We know people's interests, like, you know, so we'll try to get a gift card.
2379670	2385076	If we know their interest, if we don't, then there's always like, you know, an Amazon card or a, you know, coffee, something.
2385096	2390082	But yeah, they knew that I was a gamer, probably because my boss has listened to this show before.
2390543	2391884	Hi, if you're out there listening.
2393426	2394027	What's that, Jamie?
2395148	2396790	I said, hi, Rob's boss.
2399065	2400086	Give them a raise.
2400286	2409295	No, the thing that I like is that work – and this was true about one of my older jobs too that I had.
2409315	2411897	And I'm very fortunate because this show has been on so damn long.
2411917	2415261	I've had multiple jobs during the course of being on this show.
2415661	2428093	But the thing that's in common with my current employer as well as an employer I've had in the past is that my boss would recognize that the skills that I use to put on this –
2428073	2436604	could be things that lend themselves in the workplace, such as we might be looking at trying to do a podcast at work.
2436624	2441050	Maybe Rob is somebody that knows a little something about that.
2441270	2445095	Or at my old job, it was Rob uses all those tech things.
2445115	2446978	We should get him into e-learning development.
2446998	2449421	And that's how I got my foot in the door when it came to e-learning development.
2449461	2451904	So that's...
2451884	2457436	You know, I'm very happy when an employer can sort of recognize those sort of strengths.
2457476	2473048	But I have also been fortunate and privileged enough to work at places that I do feel like do the morally correct thing we were talking about earlier and make those types of investment in their workforces to make stronger employees, which unfortunately in the video game industry... That's why I like where I work.
2473028	2473789	Yeah, exactly.
2473809	2475812	It leads to happy employees.
2475832	2483764	But unfortunately with so many companies in the video game industry, not all, it wouldn't be fair to say all, but so many companies in the video game industry is not the case.
2484085	2487009	People are just expendable and it's just, it's very unfortunate.
2487670	2489653	So, yeah.
2490443	2491084	All right, anyway.
2491324	2494588	Some people enjoy money more than other people.
2494608	2497691	S2100 Matt says, treating employees well, crazy talk, Rob.
2497711	2498312	I know, right?
2498372	2509225	But to put things in perspective, I worked at that former company for 14 years until the writing was on the wall that our jobs were going to be sent to another country.
2509645	2510446	And then I left.
2510987	2515852	And my current employer, I'll stay at until I'm 65 if they'll have me, quite honestly.
2516293	2517274	I don't plan to leave.
2517775	2519016	So...
2519215	2538304	I'm planning on staying where I am I'll tell you what, me talking about how I like to make spreadsheets to track my progress in some of the games I play actually did get me an assignment so I was very happy I'm doing that with Pokemon Go and Shinies You should see my Dead by Daylight tracking list
2538335	2539996	The funniest fucking thing.
2540017	2548604	I finally caved and bought an office subscription because I wanted PowerPoint for the thing we did at Southern Fried Gaming Expo.
2548624	2558033	I was like, and the reality is because I use PowerPoint so fucking much in my day job, I was like, I can't do this open office stuff anymore.
2558173	2560295	I can't do the Apple thing.
2560335	2561436	I just don't use enough, Jamie.
2561556	2562697	I don't use it enough.
2562717	2565159	And so I was like, I need to be able to do this fast.
2565179	2568342	So in times when you need the- Why don't you just get something-
2568322	2570205	Go with what you know.
2570546	2570927	With what?
2572249	2575595	OpenOffice or LibreOffice work exactly the same as PowerPoint.
2575815	2576737	No, they do not.
2577077	2577698	No, they don't.
2577839	2578860	I just said why.
2578940	2583629	Because the muscle memory that I have with PowerPoint doesn't work with OpenOffice.
2583929	2588918	Because I can tell you, I do this show role in OpenOffice, whatever their version of Excel is.
2589038	2589459	Numbers?
2589499	2590480	I don't know what they call it.
2590500	2591983	Whatever the OpenOffice is.
2591963	2593284	Oh, Numbers is Apple.
2593705	2594346	Sheets.
2594366	2595447	Sheets.
2595467	2596068	Holy sheets.
2596428	2601273	I do the show but then like honestly, but now I did a Pokemon Go.
2601394	2602415	I have my shiny.
2602495	2620715	I'm making a spreadsheet for all of my shinies so I can show what I'm willing to trade at a moment's notice in Excel because I just, again, when you spend so much time in Excel at your day job, I swear to God I can do it two times faster, three times faster in that than trying to use another program.
2621316	2621616	So,
2621596	2644650	I do much better presentations though with numbers and and keynote but which which is also am embedded in both of those with the projects I'm on I'm not saying I'm loyal to Excel because I love Microsoft I'm loyal to Excel because that's what my company chose to use during the day so that's what I know so it's that that's what it is yeah yeah if you want to use if you want to use the you know the boring
2644630	2645551	Oh, whatever.
2646413	2648356	S the show and Hunter Matt says, Shane taught you well.
2648376	2649858	This had nothing to do with Shane, actually.
2649878	2652281	I even texted him saying, you'd be proud of me.
2652302	2653744	I'm making a spreadsheet for Pokemon.
2654385	2656247	Def said, you made a spreadsheet for shinies.
2656267	2658010	You're deep and shiny hunting it seems now.
2658030	2659212	Yes, it's for Pokemon Go.
2659552	2667865	And because it's all in the office thing, I can send people a OneDrive link when we turn lucky friends and I can say like, here's my shiny list.
2667885	2671971	If it's in green, I have three or more and I'm willing to trade.
2673115	2679804	If it's yellow, I have two or more and I might be willing to trade for something that I'm missing type of thing.
2679904	2681446	So I have my whole little system.
2681486	2684330	So now when I go lucky friends and people are like, what do you have?
2684471	2686854	I can send a list and be like, here, this is what I have.
2686894	2687595	This is what I don't have.
2687995	2688236	Done.
2688596	2690839	Here's a detailed spreadsheet outlining everything.
2690979	2692702	Because I'm a gamer.
2694004	2698009	And people's eyes close over and they're like, what in the corporate America is this?
2701735	2703678	All right, where the hell were we?
2703839	2706023	Oh, we're going to get to this story about Nintendo.
2706363	2710570	So this isn't cute, and this plays into something we were talking about at the beginning of the show.
2710591	2720588	And this has to do with a Nintendo Switch 2 user who is claiming to be banned from their Switch 2 for a fault that they're saying is not their own.
2720568	2747419	so here's the thing it is an owner that posted on reddit and usually you would take these reddit stories and go does that make it true but thinking through this is where you have to bring in the wheel of plausibility thinking of everything this guy this this individual i should say this guy this individual is talking about it certainly adds up it adds up with everything we know about nintendo system and the way things work and it's worth talking about so here it is
2747753	2756248	Apparently, they downloaded patches for Switch game cards, Switch 1 cards, that they bought off a Facebook marketplace.
2756268	2757631	Well, there's your first mistake.
2757871	2760095	Never buy anything off Facebook marketplace.
2760175	2761598	That place is a shithole.
2762099	2762860	But...
2763970	2767735	I know people have used it successfully.
2767755	2770999	I'm sure chat is correcting me as I'm speaking.
2771300	2774664	I purchased a DDR machine off of Facebook Marketplace.
2775285	2777608	You know what a cesspool it can be there too.
2777748	2779751	You have to be very, very careful.
2779831	2780893	Buyer or seller.
2781033	2784257	One key word, Facebook.
2785570	2787472	That is a key part of the problem.
2788093	2790997	Honestly, Craigslist felt safer.
2791017	2794441	But here we are in this day and age where a lot of people are using Facebook Marketplace.
2794561	2797886	But it actually, at the end of the day, it doesn't matter where he bought it.
2797946	2807658	But the user on Reddit said they put the game into their Switch 2 to patch, but found out their online services were restricted the day after.
2807678	2813105	The Switch 2 user then called Nintendo, where they discovered they were banned.
2813125	2813265	Banned.
2813245	2828622	and DarkSakura.com.
2828602	2850745	DarkSakura, DarkSakura, DarkSakura
2850725	2859604	and then resell that physical game card so that's where you have to get a little distrusting of places like Facebook Marketplace you don't know if the card you're buying is even legit in the first place
2860748	2870163	Now, once Nintendo detects two instances of the unique code being online at the same time, it's going to ban any account that's using it.
2870183	2874529	And so, you know, if you are pirating Nintendo software, you know what's going on.
2874650	2889152	But if you're buying things secondhand, especially in a place full of casual buyers like Facebook, you may not know that this cartridge is actually a burned, essentially, image from online, and it may get your Switch 2 bricked.
2890904	2898805	Now, after proving that they bought the Switch games, the Redditors said they were told the cartridges are fine and able to be resold.
2898825	2907006	But this is still a very kind of interesting tale that's probably going to give people reservation about buying games secondhand.
2907678	2913105	So, Dr. Zia said, I've heard about folks being banned for using that device you were referring to.
2913905	2918791	Mish in chat says, I feel like at this point they're putting too many restrictions on the Switch 2 now.
2918811	2921695	Mind you, I don't condone pirating.
2921715	2924018	Exactly, and there's the rub.
2924038	2930125	I may not support pirating, but somebody may be able to make a really convincing fake.
2930105	2935714	If they have the right color cartridge and a good enough printer to make a little sticker, what am I going to do?
2936154	2938438	Lick that cartridge to tell if it's authentic or not?
2939279	2940681	Were you just reading my mind?
2940701	2942083	Because I was saying you could lick it.
2942344	2950716	No, literally, if I were ever to be at a point in my life where I'm buying Switch games off Facebook Marketplace, I would insist on doing the lick test.
2951117	2952719	I'm sorry, but I'm going to need to lick this game.
2952739	2954702	Yeah, but they could probably put that stuff on there.
2954763	2955724	That's just...
2955704	2957246	You can get that stuff.
2957386	2958388	But would they think to?
2958468	2960711	Would they think that the casual people would do it?
2960891	2964616	Don't put anything that you get from Facebook Marketplace in your mouth.
2964636	2965297	Yeah, that's true.
2965557	2967660	I might end up with more than a Switch game.
2967880	2969743	I might end up with more than a Switch game.
2970143	2971866	I might end up with a staff infection.
2971886	2972506	I would not trust that.
2972527	2975531	You know, maybe silverware.
2975591	2976932	We run that through the dishwasher.
2976952	2978134	But yeah, I'm not like...
2978789	2980656	That's true.
2981278	2982724	Free antibiotics.
2982744	2983587	You have malaria.
2985012	2989710	How else am I supposed to know if the game is legit or not without trying to eat it?
2991513	2993155	And let's just put it this way.
2993215	2999463	It's like those old cartoons of Porky Pig or Bugs Bunny or whoever biting down on the nickel to see if it's real.
3000164	3005971	Yeah, it's not even Facebook Marketplace though, because the same thing could happen anywhere you buy used games with the Switch.
3006392	3016385	Granted, you know, like say if I purchase it from GameStop or something like that, there's a little bit of recourse because they can go back and see, oh, this person traded it in.
3017346	3021351	Although technically it's not stolen, so they can't really...
3021331	3023715	It wouldn't be a matter for the police.
