start	end	text
4387380	4390700	the end of the day right yeah and the zapper looked different too yeah I
4390700	4394780	remember that so some of these things get so far along some of them don't but
4394780	4400100	what's interesting about this is that you know it's it's kind of a stylus but
4400100	4405940	not really it's a touch pen attachment that slides into the side of a joy con
4405940	4410300	and works with the controller so you don't put this on your switch and use it
4410300	4414740	like on the switch what you do once you've taken the controller out you put
4414740	4418260	the pen in the controller and so you have the controller but then you just
4418260	4422500	flip it upside down you have a pen so it turns your controller in both kind of
4422500	4426980	interesting the way I guess yeah I have the stylus plan with that so that is
4426980	4430980	what the patent basically says apparently the joy con will vibrate when
4430980	4435260	the pen comes into contact with an on-screen object so you could have oh
4435260	4439820	my god what was that game and it was so the incredible maze or so what was the
4439820	4443420	maze game irritating me here was that it yeah dark soccer I feel like you
4443420	4446820	brought this up on the show before it was a arcade game really a big stick and
4446820	4449420	you had to move through a maze irritating stick is that irritating
4449420	4454420	stick yeah that is it irritating stick that's I feel like this attachment could
4454420	4461740	get us an appropriate port of irritating stick everybody in chat is yelling out
4461740	4464900	the name yes thank you thank you that's what I want that's what I'm thinking
4464900	4470580	this could do is it could give us a proper port of irritating stick anyway
4470580	4474460	but it's also pointed out this could be great for things like Super Mario maker
4474460	4479500	2's course creator and things like that so I I think this would be neat who
4479500	4482660	somebody put somebody spoke it into the universe that this would be perfect to
4482660	4486340	bring back elite beat agents if they wanted to do that yes yes yes yes are
4486340	4491500	you paint or you know there's a variety although that doesn't look I don't know
4491500	4496500	if there's enough detail style of support I mean that's all you need yeah
4496500	4500540	I feel like it kind of already supports stylus I mean it doesn't specifically
4500540	4503900	support stylus but like we know there's a brain age game that just released in
4503900	4508220	Japan there's been that that was it Vox or something like that was like it you
4508220	4510940	had to play it on the touchpad like a music game that came out kind of early
4510940	4516220	on yeah you know this seems like a very logical step but a very Nintendo way to
4516220	4520500	do it is like it's not just a pen it's a pen that goes with your joy con so you
4520500	4530380	can have a vibrating pen just what you need thank you it's a voice vo easy or
4530380	4534780	like putting those like those additional things on the joy cons because I find
4534780	4539740	that they're so hard to take off so like yeah hopefully it's a very easy way to
4539740	4543020	release it all right anyway let's move on dark Sakura another another real
4543020	4549580	world kind of story this is fascinating kinda um and I even wonder if part of
4549580	4554340	this happened just out of coincidence but there's a little bit more to it
4554340	4560500	than what's listed in the article so after the advent of the corona virus
4560500	4566740	which is basically that big virus that's pretty much infecting a lot of a lot of
4566740	4572380	China right now we've had two reported cases in the u.s. and shut down like
4572380	4576420	Shanghai Disney or something for something yeah and there's I think nine
4576420	4583420	people in Alameda that are being tested do people die from this yeah there's
4583420	4587820	been deaths but not always it's like a really bad it's a real it's like West
4587820	4594660	Nile level like swine flu when it first hit okay you did and I did too but we
4594660	4599080	didn't get it at first yeah but you know I didn't know I had swine flu when I had
4599080	4601700	swine flu I'm sorry I didn't mean to give it to you know it's fine but you
4601700	4604940	know what early on cuz you know I knew somebody that passed away from it and it
4604940	4607880	was horrible she was only 24 but my point is I'm not trying to bring up bad
4607880	4612580	memories but I'm just I remember that like certain people but as the strain
4612580	4616660	got weaker it wasn't so bad like I'm just like how serious is this it's
4616660	4620860	pretty serious right now I on it like I've heard this is a thing but I didn't
4620860	4625300	know like is it you get it you're dead I don't think if you get it you're dead
4625300	4628940	but you're gonna be out of commission for a while I feel really a little bit
4628940	4632180	worried for my friend who I hung out with today is going to Thailand in a
4632180	4638900	week or so so at any rate there has been an uptick in people playing plague
4638900	4647060	Inc which is a real-time strategy game that has you releasing a pathogen and
4647060	4652540	making it spread to pretty much destroyed humanity it's a very kind of
4652540	4655700	black humor type of game well that's kind of morbid but that's how some
4655700	4660900	people cope it came out in 2012 and you pick your pathogen and you decide how to
4660940	4665700	transmit it and blah blah blah you know you start off with patient zero and to
4665700	4669480	quote the description the title now you must bring about the end of human
4669480	4674280	history by evolving a deadly global plague whilst adapting against anything
4674280	4681580	humanity can do to defend itself or everything sorry at any rate they have
4681580	4689180	actually repeated on their Twitter from endemic creations that their servers for
4689180	4692220	multiplayer and custom scenarios are trying to keep up with a high number of
4692220	4698660	players and the funny thing is someone you know happy to post it maybe a few
4698660	4703900	days ago that steam was having a sale for plague Inc and it could have just
4703900	4707360	been a coincidence the sales probably a coincidence those things have to be
4707360	4712140	planned out in advance a little bit but the popularity probably isn't as of
4712140	4716540	right now well as of this the the details I'm looking at the coronavirus
4716540	4724300	was detected in Wuhan it infected more than 1,300 people and killed over 40
4724300	4731340	with cases confirmed in all over Asia US Europe and Australia Bobby Black Wolf is
4731340	4735380	also pointing out that with lunar new year steam is doing a lunar sale right
4735380	4739460	now everything's on sale so that's yeah the very good point that lunar new year
4739460	4744740	probably comes into play there but one thing that endemic pretty much said is
4744740	4749060	that they said that the game shouldn't replace a scientific understanding of
4749060	4753140	the illness that it's just a game not a scientific model so please don't use
4753140	4758020	this to track how you think the virus would spread fascinating but it is it
4758020	4761900	does kind of bring up the interesting fascination that like you know some of
4761900	4766460	these things that video games have brought have actually been studied and
4766460	4770820	like you know my brain goes to the the early version of World of Warcraft or
4770820	4775900	more they had that event or pretty crazy yeah so if you this is news to you
4775900	4779100	like there was like an in-game plague type of thing basically when you when
4779100	4783100	you went and fought one of the bosses you would get like a plague and like it
4783100	4786540	would eventually like sap your health and could eventually kill you and some
4786540	4790140	people were actually trolling and running to big cities to spread this
4790140	4796260	plague and like this whole event was studied by real-life epidemiologist yeah
4796260	4801700	see like what would happen potentially if this like a big outbreak happens so
4801700	4811580	this was published on September 27th 2005 about the about yeah the the virus
4811580	4817420	like effects of the of the the thing I'm trying to see what the name of the
4817420	4821900	quest buster says the corrupted blood corrupted blood that was Warcraft thank
4821900	4828420	you and it was called by the demon Hakkar so yeah I kind of that was like
4828420	4833500	after I quit one of the first times but yeah it was a Zul'Gurub one interesting
4833500	4840700	yeah but but I mean at any rate I agree plague Inc is a game don't don't use it
4840700	4843340	to track like real epidemiology especially since they have like a
4843340	4847900	nanovirus that can affect your brain in it those don't exist you know nano
4847980	4855820	machines in your brain not right now not yet but at any rate it is rather
4855820	4860500	interesting just how kind of like those things kind of go hand in hand and maybe
4860500	4865900	some people are dealing with it oh no yeah wow all right well let's move on
4865900	4871780	and talk about I guess somewhat some less serious news but people are taking
4871780	4874900	this very seriously still what's happening here yeah definitely big news
4874900	4882540	so Activision is moving to YouTube to air their major competition so for
4882540	4889700	example they're going to start airing the Overwatch League on YouTube so
4889700	4893780	basically now they said that YouTube will host the official live broadcasts
4893780	4898580	of Activision Blizzard popular sports eat our eSports leagues and events
4898580	4903740	including the newly created Call of Duty League Overwatch League and hearthstone
4903780	4912060	eSports so yeah it's interesting that they are moving over to that platform
4912060	4918340	I'm wondering what kind of money they threw at them for that but yeah I
4918340	4923220	wonder what this means necessarily for twitch I mean I don't know like I don't
4923220	4927060	really watch these normally so it means nothing to me once in a while
4927060	4930860	especially the first year when I was playing more overwatch I really played
4930860	4934340	overwatch in a while but when I was playing it more often especially because
4934340	4936900	it would be in the Blizzard launcher you know I'd be like oh I'll check it out
4936900	4941620	and they would actually tie for a short time they tied like if you watch the
4941620	4945500	stream you might get in-game rewards oh yeah that was kind of and I imagine that
4945500	4948540	might still be a thing they're just gonna tie it to your Google account they
4948540	4953260	have that for YouTube though like that works I don't know either but we'll see
4953260	4960740	but yeah I mean I'm not really often on YouTube seeking out live game stream
4960740	4965180	content no I go to YouTube because somebody linked a funny one on on
4965180	4970340	Twitter or something like I don't really watch a lot of YouTube which by the way
4970340	4974340	speaking of funny stuff I don't know if you guys heard the that vine is
4974340	4978540	essentially back but it's got a new name called bite just throwing it out there
4978540	4981900	because I made a bite account I know I saw that you did that I was like what
4981900	4986260	social media platform is this six second video thing again it's interesting so
4986260	4991580	anyway um but sorry they couldn't they couldn't they couldn't stand seeing
4991580	4995300	tick-tock take off and kinda I think that's part of it actually damn it
4995300	4999620	close it down but honestly like sometimes when I was on Twitch I would
4999620	5002700	see Oh Overwatch League is streaming I'll go you know maybe watch a little
5002700	5005740	bit of that because you know there's not it's kind of interesting to watch video
5005740	5009340	games of sport sometimes but the point is I probably am NOT going to go to
5009340	5013060	YouTube to seek this out so like for me it's gonna be a loss I'm not gonna end
5013060	5016740	up watching as much of it as I would have on Twitch I understand money talks
5016740	5020620	and all that but I just I don't know Twitch was always to me a better
5020620	5025060	environment for that but I understand they had a contract contract was up they
5025060	5028600	didn't pony up the money to renew it so they went somewhere else that's business
5028600	5033080	but it'll be interesting to see if it maintains the type of numbers over on
5033080	5039140	YouTube so yeah but you know to be YouTube's are also incredibly easy to
5039140	5041860	link into and things like that even when live so they might just put it like
5041860	5045420	right in the launch or just embed the YouTube and you can kind of watch the
5045420	5049260	live events right there I don't know it'll be interesting to see that so all
5049260	5053060	right moving on talking a little bit about something else to look forward to
5053060	5057860	in 2020 and that is more game streaming different types of streaming one of them
5057860	5062380	is streaming your console to a device and this is something that you can
5062380	5069140	preview now if you have an Xbox and you are in the Xbox insider program you can
5069140	5074460	actually play with streaming Xbox game to an Android phone and tablet so you do
5074460	5078220	have to have an Android device that runs marshmallow or higher and you have to
5078220	5082780	have a Bluetooth Xbox one controller and of course a fast home network to be able
5082780	5086380	to stream things through but if you have all that you can test that now streaming
5086380	5091620	from your device to your phone and using your Bluetooth controller to play so
5091620	5095700	that could be very interesting yeah cool I don't well I don't maybe Alan has an
5095700	5098660	Android device maybe his tablet runs more I should see if his tablet will do
5098660	5102540	it but I also kind of feel like if it's within my house I'm just gonna play it
5102540	5107100	on my Xbox or my PC I don't really have a need for this myself but when they
5107100	5114420	start opening it up to Oh through the magic of you know 4G and LTE and someday
5114420	5118500	5g will be fast enough for it it'll be interesting to see what this is like
5118500	5123580	when it's on the go anywhere so it'll be cool yeah yeah now there's that industry
5123580	5127540	means there's that and then there's also X cloud which is kind of like the stadia
5127580	5131380	model where you're playing on someone else's in the cloud and then that's
5131380	5136580	coming to you down to your TV Microsoft is going to be expanding project X cloud
5136580	5142300	into Canada the testing will start in Canada on January 29th and you can
5142300	5147300	actually a register to try that if you want and if you're in the program you'll
5147300	5152420	have access to over 50 games through an Android phone or tablet so again you
5152420	5154740	have to be using the Android device because that's what Microsoft is testing
5154740	5162060	with I imagine everything else will roll out slowly later on so that's kind of
5162060	5165660	neat that that is expanding and I'm very much looking forward to seeing what more
5165660	5171940	streaming brings in the year 2020 so alright well let's let's go back to a
5171940	5175780	simpler time we're gonna take a trip down memory lane when you couldn't
5175780	5179300	stream video games you know you you had to have the cartridge you kind of could
5179300	5187380	I was gonna say there's Sega it was a Sega net or whatever and actually I
5187380	5191220	think tonight dark soccer has stepped into the gaming vault and found a game
5191220	5194860	and she does this sometimes so the qualifications is a game has to be 10
5194860	5198820	years or older to qualify and I looked on the list and this wasn't done this
5198820	5202380	well it was you know why it wasn't done because it's like it's it's like 11
5202380	5206060	years no it's not I think in the u.s. I think it's 10 years old this month yeah
5206060	5210700	and so I definitely had a note of like this is one of those selections tonight
5210700	5215940	where you're gonna go shit it's that I'm so old I remember talking about this
5215940	5220900	game on her time waits for no one that's right so there's our mortal dark soccer
5220900	5227820	what is the classic game of the week Bayonetta cuz it's fucking Bayonetta and
5228820	5239900	so at any rate the game came out in in Japan it was in October 2009 on Xbox
5239900	5246100	360 and PlayStation 3 it was developed by Platinum games and published by Sega
5246100	5251580	it later got a Wii U release along with Bayonetta 2 in September 2014 in Japan
5251580	5256020	and worldwide the next month there's an enhanced port for Windows that came on
5256500	5262820	April 2017 with 4k and a switch release along with Bayonetta 2 and a third game
5262820	5269140	is in development set to release on the switch as well and apparently there's
5269140	5277780	gonna be a another release of Bayonetta along with Vanquish on PlayStation 4 and
5277780	5284860	Xbox one next month so Bayonetta takes place in a fictional European city
5284860	5293980	called V grid and she is a witch well technically it's not a spoiler by now
5293980	5302700	she is the child of a Lumen sage and an Umbra witch so and she is in possession
5302700	5307540	of one of the the eyes of God or something I always forget the name like
5307540	5312700	for the stuff but anyway it's got a really kind of convoluted storyline but
5312700	5321500	she she does magic and shoots things and uses her hair for a lot of her magic it
5321500	5325500	functions a lot like Devil May Cry I think it was actually built on the same
5325500	5333700	engine and it was had the same creator Kamiya Hideki so you basically run
5333700	5338660	around hacking and slash and shooting things with with gun and kicking people
5338660	5343340	with giant high-heeled boots made out of a demon from another dimension that
5343340	5347940	you open with your hair and just kicking a bunch of ass there was even an anime
5347940	5353300	which I watched the anime it was really really fun you also have some special
5353300	5358420	commands including torture attacks where you can do like pretty hardcore damage
5358420	5364100	and you get chainsaws iron maidens it's pretty pretty crazy and she also has
5364100	5370020	witch time that lets you dodge attacks it slows down time as well for extra
5370020	5375020	attack she has double jumps and backflips and getting rid of background
5375020	5380660	objects and doing door things you know very interactive and then you have
5380660	5386100	different chapters with different verses in them as you're going through fighting
5386100	5391060	all of these angels and you also have a mini game called angel attack where you
5391060	5394620	can use arcade bullets that you find through the level to shoot angels and
5394620	5398660	earn points you can trade them in for items or trade them in for halos and
5398660	5402860	that one dude I don't know his name but in the game but he sounds a lot like Joe
5402860	5408940	Pesci that's the one takeaway they had from I don't think I've actually played
5408940	5415340	it in English dude right there oh yeah like Joe Pesci yeah I don't think I've
5415380	5422700	played this in English anyway your difficulties are very easy easy normal
5422700	5432300	hard and non-stop infinite climax I just think that that's a fun name and as far
5432300	5441060	as you know the various characters you have you have Bayonetta herself you have
5441700	5448820	a child that she meets you which I'm not gonna say any more about the child
5448820	5453300	because again if you played it you played it if not you haven't there's
5453300	5462900	another character named Luca there is Bayonetta's rival Jean there's Rodin who
5462900	5469900	is like her armorer there's Enzo the informant and yeah he's the one that
5469900	5475900	sounds like Joe Pesci and the little girl's name's Teresa but again we go
5475900	5484580	back into that later at any rate it kind of borrows a little bit from the divine
5484580	5490740	comedy if you've noticed where it's named the the various settings are named
5490740	5499860	after the books for the divine comedy a Paradiso Purgatorio and Inferno I can't
5499860	5503220	think of having ever maybe I'm thinking of the anime because that's the last
5503220	5506580	Bayonetta thing that I looked at so I didn't remember the English voices
5506580	5517300	anyway but at any rate the the way that you beat the game though is so
5517300	5522700	over-the-top and extra that I still can't get over it you literally punch
5522700	5532860	the soul out of God and into the Sun spoilers at any rate the the game was
5532860	5541380	meant to be fashionable and meant to be a little sexy and it really kind of
5541380	5547380	focused on that very high style and then of course when it came to creating
5547380	5554460	the characters their whole point come here said that the characters were the
5554460	5558460	Jean the one that he came up with was supposed to be his ideal woman I'm like
5558460	5565220	okay but okay I candy and that he actually took from a little bit of
5565220	5572260	Scandinavian mythology and and that he named Bayonetta's guns after the
5572260	5576380	Scarborough Fair ballad with her guns being named parsley sage rosemary and
5576380	5583580	thyme but at any rate the whole game was just meant to be sexy very very very
5583580	5590260	sexy and fun and it is a very fun game with a really weird freaking really
5590260	5593660	weird freaking storyline especially when you get to Bayonetta 2 and it's kind of
5593660	5605300	a weird post prequel on the level of the homestuck Dancestors type concept
5605300	5611140	but I mean there were so many things that came out afterward there was like a
5611140	5615220	bayonet a theme for chrome there's a song called reaping beauty by MC Lars
5615220	5622100	but I love MC Lars that was inspired by Bayonetta I'll kind of there's like a
5622100	5627100	hundred and fifty song five CD soundtrack for the game and then there's
5627100	5630340	another one that for they came with pre-orders the game called Rodin
5630340	5637220	selection and then there's like all this stuff I mean it's all crazy and then of
5637220	5640480	course there's the anime that came out at Bayonetta bloody fate which for me I
5640480	5644300	would I just I have that on my iTunes account I'll just pull that up and watch
5644300	5650860	it whenever because it's really fun but it was really really well received
5650860	5657700	Famitsu gave it for the 360 a 40 out of 40 the ps3 version got a 38 out of 40
5657700	5663420	but still like that's Famitsu giving it a 40 out of 40 which is an Xbox game at
5663420	5671660	that that's unheard of in Japan yeah and I I guess the the PlayStation 1 had a
5671660	5676700	few other issues with it like for control I have to dig deeper because I
5676700	5683380	mean it's it was yeah it was criticized for having a lesser visual quality frame
5683380	5688300	rate and control problems compared to the Xbox 360 version I remember that
5688300	5693460	the control had been part of it but yeah this is it was like an instant classic
5693460	5701220	and there you have it Bayonetta which also watching the Bayonetta 2 speed run
5701220	5712020	AGD Q pretty freaking rad I'm excited for part three yeah the story got extra
5712020	5716780	convoluted with Bayonetta to just saying all right and I loved this comment
5716780	5720100	actually made me laugh from a nifty 805 in our chat who usually says funny shit
5720100	5724100	in our chat nifty 805 says Bayonetta could totally host tonight at hamburger
5724100	5728460	Mary's mmm I mean Bayonetta is kind of like a drag icon like I Bayonetta is
5728500	5735020	like a bio queen basically I mean that and and to be fair Jean Valjean is Jean
5735020	5745300	Valjean is totally bad as well huh Jean Valjean was from Les Mis I was reading I
5745300	5752020	have my eyes on it Jean yes not not the Les Mis character J-E-A-N-N-E Jean Jean
5752060	5761580	sorry I'm saying things aloud but anyway monsieur the man I would be madame the
5761580	5768380	mayor but anyway they are totally bio queens and you know Lady Gaga has
5768380	5772740	tweeted about Bayonetta and how much she loves it and you know it's kind of funny
5772740	5777100	oh it's a good game all right there there's classic game of the week a real
5777100	5780860	classic there oh one other thing too is that there's just all kinds of references
5780860	5784820	to other Sega games in there too like you have the part where you're riding on
5784820	5788620	the plane that was oh sorry that we just had the car sequence that has I think
5788620	5795380	outrun music yeah so you did the game actually spawned the one like I think
5795380	5798380	three different climax mixes one of them was for afterburner when it was for
5798380	5803140	outrun and there was another one that I can't think of off the top of my head
5803140	5808260	but yeah there were the and they were called the climax mixes so there you go
5808380	5815020	all right good choice Bayonetta oh and thank you Seattle Barry the the prisoner
5815020	5819220	number was two four six oh one yes yes now I yes of course I remember they miss
5819220	5823300	anyway the film was the same guy that did cats
5823300	5827700	dar Sakura was Les Mis and cats were the same director so I think as was
5827700	5830340	brilliant and that well that's part of the reason why I wanted to see cats
5830340	5836140	because I loved Les Mis and cats was brilliant moving on to rapid-fire news
5836220	5840060	and talking about some things quickly that are happening in the gaming world
