start	end	text
0	7000	Orange Lounge Radio
7000	14000	With your hosts, DarkSakura, Skie, and Loki
14000	18000	This week, March 2020 just got a little bit easier on your wallet as more delays have been announced
18000	21000	The game I'm looking forward to is pushed into March, so I'm not worried about it
21000	23000	These are just a few headlines we'll hear again later
23000	28000	Join us for all the night's timely news, starting right now on the show where every gamer has a voice
28000	32000	Orange Lounge Radio
32000	34000	Hello, my friends out there on the internet
34000	37000	Welcome back to another week of the show where every gamer has a voice
37000	39000	It is Orange Lounge Radio live tonight
39000	44000	Episode number 807 for this January the 26th of 2020
44000	51000	My name is Rob Roberts and joining me as always, even if off cam because that's where she wants to be
51000	53000	Is DarkSakura or Jamie Summers
53000	55000	See my starry foot?
55000	56000	There you go
56000	62000	That our folks can see live at Twitch because we do tape live every Sunday night at 6 o'clock Pacific, 9 o'clock Eastern
62000	64000	Right after the Bobby Black Wolf show at Twitch TV
64000	65000	I have to show my shirt off
65000	67000	VOG Network, sure go ahead
67000	72000	I will just mention we had to do like a second start on Twitch tonight because we had a weird network error
72000	74000	So this is actually the second time we've been doing the intro
74000	77000	But the first time DarkSakura showed that shirt, so there you go, thank you
77000	80000	I freaking love this shirt, it's a little too small but I love it
80000	82000	We're returning back from after a week off
82000	85000	We were all busy last week just coincidentally
85000	89000	DarkSakura you were in the city as they say, you went out to San Francisco
89000	90000	I did
90000	91000	Did you have a good weekend?
91000	95000	I had a very busy weekend but I left unwell
95000	98000	I did the women's march in face so I went with the sisters
98000	102000	And then we actually stopped about a block away from the Embarcadero
102000	109000	They're having us walk all the way down to the Embarcadero from like, what is it Fulton?
110000	114000	But anyway we walked down and then we're like, you know what, we're not gonna go down there
114000	121000	So we went and had lunch at the Cove in the Castro and guess who was there?
121000	123000	Patton Oswalt
123000	125000	I kid you not
125000	130000	They were there for a film festival over at the Castro Theater
130000	133000	And he just came over and chatted with us, he's the nicest guy
133000	135000	I did sneak a little photo
135000	137000	But I didn't want to interrupt his meal or anything
137000	141000	But he was just a really nice guy and we actually joked back and forth about sister makeup
141000	143000	I was like, what do you mean I woke up like this?
143000	145000	Oh just a little dusting then right?
145000	147000	I'm like, yeah a little dust wink wink
147000	153000	He was just a really, really, he's as charming and nice in person as he seems in his interviews
153000	158000	That's always nice to hear when celebrities are like actual real people as opposed to divas
158000	160000	Yeah and he was just, he chatted with us
160000	163000	He's like, I love the sisters, I love what you do, I'm like yay
163000	167000	Speaking of divas, also say hello to Techmaster Holoke
167000	168000	Hello
168000	169000	I'm just kidding, how are you?
169000	170000	I'm good
170000	173000	So you last week went on your trip to the Broccoli Farm
173000	174000	Yes
174000	177000	Which is code for Disneyland, if you're newer to Orange Lounge Radio
177000	183000	It was about a year ago, you lied to the kids and said you were going on vacation to the Broccoli Farm
183000	184000	Yes
184000	187000	And in reality it was a trip to Disneyland they were trying to surprise the kids with
187000	190000	Which became this huge in-joke on OLR
190000	195000	So you went back to the Broccoli Farm and you got to do Star Wars Land and all that stuff now, right?
195000	196000	Yes
196000	197000	How's that new ride?
197000	204000	It's great, so yeah, it just had opened that weekend actually
204000	206000	So that Friday the 17th
206000	209000	And so they have this thing, it's a virtual queue
209000	213000	So basically you get in the park with everybody that's going with you
213000	217000	And then you have to bring up the Disney app on your phone
217000	222000	And then right at 9 o'clock you have to hit the button and hit join and hope that you get in
222000	223000	Wow
223000	227000	And so the first day I had no idea what the hell I was supposed to be doing
227000	229000	So we didn't go there at all
229000	231000	Second day I figured out what I was supposed to do
231000	237000	So it was one of the days I figured out what I was supposed to be doing there
237000	239000	And so I actually did join
239000	245000	And yeah, so we joined, I made a group
245000	250000	But it just so happened that it timed it with nap
250000	253000	And so we didn't get back to the park in time
253000	254000	Oh no
254000	256000	So we missed it the first day even though we got in
256000	260000	Second day after that we got in and went on the ride
260000	261000	Okay good
261000	262000	And then the last
262000	263000	So how's the ride? No one cares about the line
263000	264000	Sorry
264000	265000	The ride's awesome
265000	268000	It is the most immersive ride in the whole park
268000	269000	Ooh
269000	272000	Like the line, the queue itself
272000	275000	So you start off in this like rebel based thing
275000	280000	And you get this briefing from Ray from the new trilogy
280000	285000	And they're telling you that oh hey the empire is, they found our base
285000	286000	We need to evacuate
286000	287000	Don't spoil everything but
287000	288000	Right right right
288000	290000	Well basically you know we have to evacuate you
290000	294000	So they put you on this ship and then there's like the ship sequence that you're doing it
294000	296000	But that's still the queue
296000	304000	And then I mean then you get captured and then you're on a star destroyer
304000	309000	And it is goddamn awesome like and you're still in the queue there
309000	313000	But they're treating you like you're prisoners like that you're rebel scum and stuff like that
313000	314000	And it's hilarious
314000	316000	It's fun at Disneyland to be treated like a prisoner
316000	321000	Yeah so then they eventually they put you into a prison block and then the ride starts
321000	324000	But it's just the queue itself is really amazing
324000	329000	That's kind of cool that Disney you know when you recognize that like lining up is like half the experience
329000	335000	It is it's really cool and so you know the way they did it yeah
335000	342000	And so like the one of the last days we were there like I was like yeah what the hell you know like
342000	346000	I heard everyone cheering because I was picking out my son's gift he wanted to pick out a gift
346000	352000	So we were at the the star trader and we were picking out stuff there
352000	357000	And I heard everyone cheering like oh I was like oh crap I forgot you know to jump in again and see if we can get on the right again
357000	364000	Like ah what the hell I'll just join okay and you know 88 probably not going to get in because usually they they stop
364000	368000	But each day they got more efficient at getting people through the ride
368000	374000	Oh this is like practice so that last day I think they were up through like over 100 in the groups or whatever
374000	379000	But we got to go on the ride twice that day because the first time we went on it it broke down
379000	388000	So we also got to see the backstage too which is great so we did all that but my son he wanted to dress up like Kylo Ren
388000	395000	Because he watched episode 7 all the way down and just like fell in love with Kylo Ren as a character
395000	400000	And so he wanted to dress up like Kylo Ren he wanted to get you know the Kylo Ren lightsaber
400000	406000	So he had like the little lightsaber thing that we built like earlier that week and he was walking around full costume
406000	413000	Just dressed up like Kylo Ren it's great though because because it's Star Wars land stuff everyone treats him like the supreme leader
413000	420000	Kylo Ren and so I love that they do that for kids and so like the stormtroopers were talking to him and stuff
420000	426000	And they took pictures with him the um you know some of the people waiting in the line of the rebels are like
426000	435000	That's just a disguise right you know and then like or like in it on I have some Twitter video as well like follow me on Twitter
435000	443000	Where one of the guards or whatever one of the people and officers you know talk to them is that is everything to your liking
443000	447000	Supreme leader you know we'll make sure that everybody is interrogated and stuff like that
447000	453000	And if we'll get the torture device is going immediately it's great you know so like love it he loved it it was great
453000	458000	The only thing he didn't like is you know there there's a drop in the right and he's very afraid of everything
458000	463000	So like most of the rides like when we were there I didn't get to go on a lot of roller coasters because I had to stay with him
463000	467000	Which is fine I don't really like a lot of roller coasters anyways but I still want to go on some of it
467000	474000	So he didn't care for the drop too much but we got him to go on twice which is fine
474000	480000	So going to our chat because we do tape live every Sunday night like I mentioned earlier over at twitch.tv slash vog network
480000	484000	Questbuster in chat says that's great Loki's kid was the leader of the first order for the day yep
484000	488000	And act-def says that's awesome it must have been a wonderful experience for him so
488000	493000	Yeah he had they they had a lot of fun it was like we're trying to let him know like like this is a big deal
493000	498000	Because like this ride most when you come home none of your friends will have gone on this ride
498000	501000	You know this is that you got to do it first so
501000	511000	That was exactly how I treated Alan when we were first together and we went to club 33 together because we got like that rare opportunity to go into club 33 right
511000	518000	And I told Alan you don't understand this is a big deal I know you're not a Disney gay and this is a new thing for you
518000	523000	But you need to understand what a big deal this is and he said it didn't really hit him until we were actually there
523000	529000	And then he was like oh this is like kind of a big deal what we're doing right now so yeah it's it's just funny
529000	534000	We did we did lunch at the Blue Bayou and stuff I would not do that again it was
534000	536000	Oh I like Blue Bayou it's fun
536000	538000	Blue Bayou is a mainstay every time I go
538000	540000	I love now that Buck and the Meat's gone
540000	541000	What the the
541000	542000	Karthay
542000	546000	No no well yes I love Karthay but what's the gumbo I love the gumbo they have
546000	547000	Really my wife
547000	554000	Well there's a little gumbo place that's like on the side that place is pretty good if you want gumbo and don't want to pay a bajillion for it
554000	561000	But last time I went to Blue Bayou it was when because I don't think I didn't go on the last trip because I was there by myself
561000	567000	But when JJ was with me from Australia we had like a rack of lamb and just amazing stuff
567000	572000	Damn y'all now you're making me want to go back to the parks and it's been a few years last time I went was when Al and I got married
572000	576000	The one that he liked though the one ride in Star Wars landing he liked was the Millennium Falcon ride
576000	577000	Okay
577000	582000	And so that one's kind of funny because you have to work together as a team my wife did not want to do any of that
582000	583000	Like she is just like
583000	584000	Your wife's not a team player
584000	590000	She's like I don't want to play a ride I want to just ride the ride I want I want it done to me I don't want to like have to like participate
590000	592000	Your wife really hates video games
592000	598000	So she found out that she likes Gunner because Gunner all you have to do is just sit there and just like push the button once in a while
598000	603000	And like you don't have to look at anything so that that's fine so like my son and I were
603000	611000	My favorite rides at Disney my absolute favorite rides at Disney and yes it is a video game show I know we'll get to it we've been gone for a little bit
611000	619000	But this does tie to video games because my favorite stuff at Disney is like the Buzz Lightyear that's like a game and the Toy Story Midway Mania
620000	629000	Midway Mania is so hard to get on but like Buzz Lightyear we went on that a bunch of times and Midway Mania we went on once
629000	637000	We wanted to go on the Cars ride but didn't get to do that and once again because my son doesn't like you know faster you know rides a drop or anything like that
637000	647000	So it's like I don't know we did get lucky we did get to go on Haunted Mansion while still the Christmas stuff because they had just closed that down like the day after we got there
647000	651000	Which is cool so I've never seen it before so we went on that and that was neat
653000	663000	What else like yeah we went on the Millennium Falcon ride a few times I like how he calls it the the mammalian falcon because he can't pronounce stuff a lot
664000	675000	So that was fun so we did that a bunch of times and I don't know just like my wife and my oldest son they like roller coasters so they were on you know
675000	686000	Incredicoaster a bunch they went on Goofy Sky School Thunder Mountain I like Thunder Mountain sometimes I don't know I'm very kind of like
687000	693000	Problem is like I have to really desensitize myself to like these rides and because I don't get to ride them that much with
693000	702000	Staying with my youngest son that like I'm afraid to go on a lot of like anything just like kind of I don't like heights I don't like you know
702000	712000	They're like you should go on Incredicoaster I'm like no I am not doing that thing I don't need to be accelerated the 55 miles an hour like it's fun
713000	719000	It's fun if like that's the thing it's like I look at him like that looks like a lot of fun but I'm scared to death of that
719000	726000	Alright look we're turning into a theme park podcast I gotta steer us back towards video games but lots of lots of fun stuff it sounds like you were doing at the parks
726000	734000	And you had going on San Francisco and I'll quickly say that Alan and I went to a musical we saw Dear Evan Hansen the touring show because it just happened to be here in Sacramento
734000	746000	It was our anniversary on Sunday well timed I suppose and it was good we had a good time I was not super familiar with the show so it was good to see and it was a good night out
746000	756000	So yeah now I think it's gone I think it closed well it's off to another city it's probably like Salt Lake City or something now but it was here through like last Friday so yeah
756000	772000	So that's the second time I've missed Orange Lounge Radio due to a musical because you remember back in November we went to New York and saw Broadway shows and I was at Moulin Rouge while OLR would have been on usually
772000	778000	So we'll see I'll try to go for a record this year 2020 the year of me skipping the show to go to musicals
778000	790000	Alright let's get into gaming talk because we weren't here last week we had the pre-planned night off just because we all had kind of personal vacation going on and of course like clockwork that's when all this big video game news seemed to hit right
790000	805000	So one of the big stories that came out last week was kind of a follow up to something we've been talking about the week before so on our last episode on the last Orange Lounge Radio we were talking about this at the time rumor that was going around that Sony was preparing to skip E3 this year
805000	820000	And we talked about like how wow that would be kind of nuts if they did that you know we were talking about the feasibility of that happening well like clockwork the next day Monday sure enough it came out Sony is skipping E3 and it was confirmed for the second year in a row
820000	834000	Sony is going to not be going to E3 this year and this is for a variety of reasons nothing that Sony is really confirmed so people are left to speculate what are the reasons but things being cited are things that E3 isn't as relevant as it used to be anymore
834000	850000	Attendance was down last year it was down to 66,000 from 69,000 the year prior in contrast to that Gamescom 370,000 people went to Gamescom I had no idea Gamescom was that big I knew it was big
850000	872000	It's huge I just thought oh it's the E3 of Europe so I just assumed it was about the same size that is very low like Comic Con isn't even that big right that is right and like I kind of wonder like I don't know what game the environment of Gamescom is like if it's as hectic as like you know the E3 heyday or if they have that organized you know down to a T
872000	902000	where it's not like ridiculous I would imagine with those numbers they'd have to have some sort it must be really spread out I really don't know too much about it aside from watching the press conferences but yeah I don't know I I just kind of kind of think it's I don't know if it's a mistake that they're not there but I know like definitely the focus is going to be on Microsoft this year especially Microsoft and Nintendo and I don't know if it's a mistake that they're not there but I know like definitely the focus is going to be on Microsoft this year especially Microsoft and Nintendo and I don't know if it's a mistake that they're not there but I know like definitely the focus is going to be on Microsoft this year especially Microsoft and Nintendo and I don't know if it's a mistake that they're not there but I know like definitely the focus is going to be on Microsoft this year especially Microsoft and Nintendo and I don't know if it's a mistake that they're not there but I know like definitely the focus is going to be on Microsoft this year especially Microsoft
902000	932000	I mean you kind of want your console there to like show off some stuff in contrast I guess but I don't know I'm sure they'll do their own thing hopefully sooner rather than later
932000	962000	I can still read some of the comments the joys of doing a live presentation anyhow so we talked about E3's relevance decreasing that's also part of it the cost of exhibiting E3 is pretty high you know it costs a lot of money to get booth at E3 and maybe it's something that Sony determined was not very much cost effective and now there's this whole discussion that you can kind of just do things and not actually pay to be at E3 like how EA does their own thing across the street we had groups that did stuff in the past
962000	992000	parking lot for the longest time I actually don't think that parking lot's there anymore but for the longest time you remember like there was indie stuff in the parking lot and stuff I think that the Ouya are one of those things was in the parking lot one year and that was a big deal so yeah these are all reasons potentially even though Sony has not really said their own type of reason for why they're pulling out I think everything you've seen has been very you know like it's just veiled like niceties professionalism but not really
992000	1022000	telling us the tea for example a spokesperson talked to gamesindustry.biz saying quote we have great respect for the ESA as an organization but we do not feel the vision of E3 2020 is the right venue for what we are focused on this year so what is it that you're focused on this year but it's still a little early in the year it's hard to say there's rumors that Sony will unveil this console in a couple of weeks which would match the template of what they did with the PlayStation
1022000	1052000	before it would make a lot of sense and you brought up as we were doing the phone call with Bobby there a few minutes ago as well in between shows you mentioned about the retail thing right there's a big retail show that happens there was it used to be around February ish was when like you would have like GameStop and all the major retailers going to Sony it was destination PlayStation I think is what it was called I I think that that was something that they they used to do in February I don't remember
1052000	1082000	if it was the same time every year but I remember that's the year of the PlayStation 4 and everything that there was that because I got in trouble from that because I was kind of leaked a little bit information about Call of Duty at the time so yeah I remember that but yeah destination PlayStation I believe is what it was called.
1082000	1112000	you guys in chat as well like is this is Sony making a mistake or do you guys are you guys like not surprised at all by this news and just the fact that you know what E3 isn't really a necessary step along the way what do you think of this news Loki I mean I don't know it's not that different from last year but as far as there's a new console this time well right here was a lame duck but it was still like you know yeah they really have much to show last year I'd imagine but I mean there's
1112000	1142000	still other things they could be doing yeah I would think with a new console launch that they probably want to do something unique with it to get the attention directly on the console and not like share the limelight with other people but I don't know I kind of miss that competition that they have the back and forth like that we had with the Xbox one and PlayStation 4 yeah yeah I know that little the kind of the rivalry that goes on at E3 there's there's now you know there's that's
1142000	1172000	one thing that's gonna be eliminated this year finally that question of who won E3 is not really there it's irrelevant at this point right now I'll still be there it'll be which press conference was the best you know who had the best press conference and sadly most of the time it ends up being Ubisoft just saying I'm not a huge fan I'm not always the biggest fan of like their properties but it typically they have the best E3 press conference although hopefully
1172000	1202000	Microsoft maybe this year's Nintendo let me get to some comments from our chat room and then dark soccer I want to check with you as well hype mayhem says on one hand I can understand why Sony or other companies pulling out over the years but still I personally enjoy E3 coverage and I like seeing companies doing pressers and having boost there so I guess maybe that's kind of part of the bummer is that you know it was it was that one week we had to look forward to like everything happened and now maybe this year's just gonna be kind of spread out I don't know if that's really like a good thing or a bad thing I guess we'll find
1202000	1232000	out as we go through the years Zether in chat says I think E3 is just becoming less corporate I guess I don't know the best way to say it in some ways I think E3 is becoming less well I don't know how to say it it's almost more corporate it's not like it is less corporate because they've invited the fans I think that's one place where it's definitely not as corporate as it used to be but I think almost some of the rules that ESA has make it to corporate to be a pax or something
1232000	1262000	it's confused about its identity is it a corporate event meant to you get business done meant to you know inform your retail partners on what's coming out and make planning for you know releases down the road or is it a fan event that we're trying to get people hyped about the games coming out and that kind of thing what is it like we don't they don't seem to have any sort of agreement on what it is it's like almost like you're trying to make it both at the same time and it's just not working
1262000	1292000	for them it's not gonna it's not good either of the things and so that's why I think it's failing um let's see some other comments from our chat Bobby Blackwell says in television will be there so there's at least one other big car well that'll be sure yeah I hit stun says e3 isn't needed anymore videos online are good enough I don't care much about a game being showed off at a booth unless they bring it to my hometown let's see DJ Orwell in chat says I can't care about video games until Half-Life Alex comes out and
1292000	1322000	either obsoletes everything or makes me cope so hard I check into an asylum so it would be like just really focused on one thing and to be fair that game probably isn't gonna show up it would be out for you well it would be really cool if like say for example Microsoft got their cloud streaming platform like down and like hey guess what you want to check out the new Xbox games we'll stream them right to your device right to your Xbox one you can you can play the next generation
1322000	1352000	of games through the streaming service because since all that you know gonna be processed remotely or whatever then they could push the better graphics and that type of stuff so you can check out the next-gen games I remember in 2006 they did like that was one of the cool things that I liked about the Xbox 360 at the time is they had demos for a lot of the games a few of the games that they had at e3 so there was lost planet there was MotoGP and
