start	end	text
2882000	2912000	in the industry is not a smart thing to do and I think too because in a way they're all in it together a lot of people in that industry have worked the crunch time have done those types of things you know so it's like almost like it's a fraternity slash sorority of all these people who have kind of like been through it and so they support each other I think anyway back to the quote from Hugo Martin I'm so proud to work in the game industry and the fact that two games that are so completely different getting a ton of press come out on the same day
2912000	2942000	it's an incredible time to be in development and I'm excited to play Animal Crossing so yeah and you know what in the movie world don't we always get like you know the big like action blockbuster type thing coming out versus the sweet rom-com right and they come out the same day because it's like there's not a lot of audience that's going to be interested in both there might be some but you know there's not a lot of audience is going to be interested in both
2942000	2972000	day I'm not a huge fan of doom it looks like a good game though but I you know I'm more interested in Animal Crossing so we'll see I'm orange right in chat says the recent update with the first two doom games is definitely making me more interested in the doom 64 rerelease you know I didn't talk about it during my gaming week but I'm kind of same Z's on that with you because I downloaded the original doom on PlayStation 4 just to check out like the wad support and all that and it's it's fun to go back and visit it's it runs
2972000	3002000	man I wish my computer had been that good back in the 90s running that so it's fun to play it it does kind of make me interested in doom let's see zither says that game rules I feel like it's the real doom 3 fair enough let's see s2100 mat says cyberpunk being pushed inclines me to wait until the new consoles come out to play them there that's a really good thought hmm do we wait for PlayStation 5 at this point to check out cyberpunk
3002000	3032000	because we're kind of banking on the fact we know Xbox will do it and we're banking on the fact that PlayStation 5 is gonna play all the PlayStation 4 games because one of the big things they've been showing off on PlayStation 5 is the spider-man I think by the time we get to that point we'll know sure what the situation is and I think on the case in the case of like Xbox stuff that a lot of these like especially like the Series X stuff will still be playable on Xbox one so it could come out as an Xbox Series X game
3032000	3062000	and just that functionality won't be in place until the new system comes out or maybe they'll release a version of it that still works with the Xbox one it'll just replace the other one I don't know Bobby Blackwell says real cyberpunk players will play it on PC anyway now now I do love PC gaming but there's certain things I just prefer to do on console we'll see we'll see I haven't really thought that far ahead to cyberpunk yet I kind of want to see how it reviews like I expect it's going to do pretty well
3062000	3092000	but I just kind of want to hear some of the feedback on the game again 60 bucks is a lot of money doing this little podcast for y'all like as long as we've been around and everything that doesn't mean we're like showered in free games okay and even if we were then that creates all sorts of like you know ethics types of things and what have you so we we buy our own games so at 60 bucks a game like you know things start to get expensive right y'all feel the same struggle so you really have to think about like what games do I want to drop 60 bucks on but Animal Crossing is
3092000	3122000	one of those games and I know dark soccer is the same case for you you're not even gonna flinch dropping my orders already in yeah so I don't care I mean I already said I was gonna get Dan and I were talking about getting a switch light oh yeah so that I don't have to take our house switch with me to play I'm surprised they haven't announced like an Animal Crossing themes we're holding out for yeah and if they don't do it they don't do it so I but I'm super excited about it I'm in like
3122000	3152000	three different groups are like oh my god I just don't want to get a switch light because I have a lot of my games digital and like well and what I was saying is that the one of the groups that I'm in got some pictures from the trade show where they had like a brochure that was out in their scans the brochure they even has a little comic in there and the new Animal Crossing manga is following New Horizons
3152000	3182000	so do we know like how online is gonna work in the new game they haven't really talked about that right we don't like is it still like you got to open your gates type of thing with the old Nintendo talking about online like what I don't think it's gonna be like that but we'll see cuz I mean that you have like the the local play and then there's gonna be I don't know it look like it's gonna be a lot more of an interactive kind of thing so it might not be a gate thing now me I don't go online so y'all bitches can stay out of my village unless you come over
3182000	3212000	yeah I probably will let a few people come online right yes yeah that's why I thought DJ Orwell and Chad says someone give me a quick rundown on what's new on this new Animal Crossing so I mean some might say it's just the same format again somehow this one does feel different though because they've kind of changed the landscape right you're not like doing your own town it's like you're going on vacation and you have your own island and so it lends itself to these different types of mechanics so it's trying to kind of differentiate itself from the old formula right
3212000	3242000	if I'm understanding a little bit yeah their soccer is nodding there a little bit so I I would expect some point between now or well says no reset II know by that reset he's got to be in it come on come on well I mean reset II they're actually I think is nothing sing that reset II was gonna be in the game I don't think you should have been any of the material although they did confirm blathers which means Celeste is gonna be there there's the new airport which I have a feeling that the airport is gonna be more of the way to visit the
3242000	3272000	other islands but they had like as a sort of an Easter eggy kind of thing in you leave where you would if you placed a manhole then every so often you would find the manhole open and you would go into reset his house okay so so even if like autosave is now I think on the switch janitorial office there's no need to reset II they'll put him in the game yeah I know that they have in this one versus the other games is that you can decorate the
3272000	3302000	outside of your house oh yeah that's a huge news and like I think even like a garden in like pathways and stuff like that like you can actually change more the landscape in that sense it's almost like the creators of Animal Crossing are aware of Stardew Valley incredible that game yeah they are aware of that game wants to know are you doing any streaming of Animal Crossing dark soccer I can get it set up sure it's basically gonna be me you know walking around hitting people with a bug net
3302000	3332000	and you're not gonna build you a switch light just saying you can get a bug net and you can hit animals with the bug net I think any stream it's gonna be harder to stream but you you'll have both right you just move your game cartridge yeah cuz I always keep everything on my game cartridge so whatever all right well anyhow let's move on and talk about some other gaming news and a little bit more of gaming in the real world right dark soccer yeah so I don't know how much
3332000	3362000	many people remember this it was I think we kind of brought it up it happened in March but there was a guy who was trying to sue I'm trying to get his his full name out of here it doesn't actually this Oh amro Ellen sorry of Exton was suing that his civil rights were violated when he was muted out of an online video game
3362000	3392000	he did a hand written lawsuit that Jagex incorporated in the UK and several Chinese firms violated his free speech and due process of law when he was muted out of some streaming game in March of 2019 doesn't say the game is he said he had over 2,000 hours invested in the game when he was booted out Jagex denied the appeal of muting him without telling him why that's what he said
3392000	3422000	and he was looking for damages in quote whatever the jury sees fit plus D muting at any rate the US Eastern District Judge Mark A Kearney allowed Ansari to pursue the case as a pauper's case and then promptly dismissed it on grounds that there hadn't been any real constitutional claims and so he applied to circuit court and the circuit George was like
3422000	3452000	that it wasn't unequal treatment as compared to the other players who weren't muted and so basically they said that Jagex was perfectly fine to allow him to be muted that that was their policy it was fine and there have the guy has done this is the second in two months that they've killed a lawsuit by this guy and they also in November refused to reinstate a case he lodged claiming that he was
3452000	3482000	scanned by the tinder dating app so I think this guy's got problems I think he's just a frivolous lawsuit kind of person in 2016 the Superior Court denied appeal that he filed after he was arrested by the Bloomberg Bloomberg University Police for lighting up on campus in front of campus cops and he was also convicted on a marijuana felony and he has ten lawsuits in the US Eastern District Court
3482000	3512000	in the last year and a half he lodged four of them in 2019 in July 2019 alone so yeah he's he's one of those frivolous sewer sewers right and let's see they're confirming in chat that RuneScape is the game that was a question here SG100Matt says I just scrolled off the screen whoops you guys are very chatty SG100Matt says this dingleberry wasted everyone's time in tax dollars with this garbage lawsuit
3512000	3542000	yeah I mean and as that says perpetual victim and yeah I mean you know when it comes to the First Amendment I think we all know we all know but some people clearly don't the First Amendment does not protect you when it comes to private property you know when it comes to the RuneScape servers and stuff if you say something stupid they have a right to ban you and handwritten yeah you can't just say freedom of speech that isn't that freedom of speech means the government can't arrest me if I get up here and I say Donald Donald Trump is a fucking asshole I can't get arrested in the government because
3542000	3572000	you know in some countries I would get arrested for saying that good check the news sometimes you can't talk bad about the leaders of certain countries in those countries right but I can say that but what it doesn't protect me from is that if I say that somebody might go well that guy's an asshole for saying that about the president I don't want to follow him anymore block I can't sue that person for blocking me I said what I said but I think it's not freedom from consequence go that being said I think that this guy just seems like one of those perpetually
3572000	3602000	entitled little shits hey guess what dude I think you're a little shit and I can say that on air here in America because I can say what I think you're a little shit you can get mad and that's the consequence but it won't affect my life any Phoenix 7726 brings up you can't compare a certain leader of a major nation to Winnie the Pooh and we did see some well we saw a lot of that remember the Blizzcon protests with the Hong Kong issues and all that so I mean you know as there was a student
3602000	3632000	arrested when he returned to China because he had posted pictures of Winnie the Pooh on his Twitter yeah so that is an example of what happens without the First Amendment right so anyway y'all y'all know and I think pretty much most of us watching and listening kind of understand the same page like hey this guy is not you know able to just get himself on band with a lawsuit I suppose the furthest I could go to meet this guy is that most companies should have a system in place where if you
3632000	3662000	get banned you should have a way to appeal that ban that is fair but there's nothing that legally says a company has to do that it's just one of those you know if I'm gonna give a company money there should be a way to do that I kind of think about some of the GPS games I've played like Niantic Games and Ingress and like if somebody gets banned from Ingress for like spoofing or breaking the rules or something like that they should have a mechanism to say no I didn't do that and I want to state my case and so forth especially if they've spent a lot of money on the game you know cuz
3662000	3692000	even though false bans aren't the norm it can happen you know and even 1% of players getting falsely banned well that fucking sucks if you're the 1% so that's just my example for like there should be a mechanism there between the company and the individual but at the same time there's nothing legally that says they have to have one so it's something you have to think about before you spend your money on something like this what the fuck the dude was doing to get muted anyway he had to have been doing something wrong so
3692000	3722000	just I hate entitled people yeah so anyway all right moving on let's talk about the next story which has to do with another game subscription service yeah so this is interesting so paradox a company that normally makes a lot of these big paradox interactive they make some bigger PC strategy games that they are working on putting out like a that's a lot of
3722000	3752000	stuff a like they're testing the waters with like a streaming service basically you know and looking at like some of the DLC that they have for some of these games it's ridiculous the amount of money that would cost it by all of DLC so you basically they haven't really announced the details of the service yet but apparently some fans of what was it it was Europa
3752000	3782000	universe universes for have found out about the service because the game the code for the trial is in the game's latest update so maybe this is something that they're going to be announcing soon but right now it's not necessarily they don't know what the details of it are yet now Phoenix 7726 in chat wants to say to be fair to paradox their DLC
3782000	3812000	goes on sale for cheap often and EU for is on humble right now so it may not necessarily be the sign of this but I think it does beg the question because we have seen a lot of companies going down this path right we see Xbox game pass we see EA's what are they what the hell do they call that thing the EA access that's it Ubisoft has one now to write and they launch one my point being we all know these different things are out there right
3812000	3842000	but in the television movie world we're having a big conversation about the streaming services right because we got Netflix we got Hulu we got CBS all access and now what they just announced this week they announce we knew it was coming but now we've got a date for peacock another one that's coming out right so and a lot of people are starting to say yo fuck this like there's too many streaming services I'm gonna go back to piracy so one of the big television stories this past week
3842000	3872000	was Picard came out right now I haven't watched it yet I plan to in the coming days but I wonder how many of you all pirated the first episode of the card because you don't want to subscribe to CBS all access I have not I bet I bet there's I mean you don't have to out yourselves I understand you don't want to confess that but I bet there's a lot because they are not interested in anything else on CBS all access outside of that so they they likely have done that and so my point is now we're getting into this gaming I'm kind of watching
3872000	3902000	what's going on in the movie film world and kind of going like gaming needs to keep an eye on this too because what happens if gaming ends up in the same boat we might be rid of the $60 video game in the next few years if if gaming goes down the same route which I don't think is outside the realm of possibility again Xbox game pass point we may be done with the $60 video game in a few years but are we going to be splintered into way too many different subscription services
3902000	3932000	where it's too hard to like you're ending up paying more because you're having to subscribe to all these services I don't know how do you guys feel about the subscription service what would you do if the $60 video game went away but now you have all these different services like what's what's the answer here I would just have to look at what I'm playing the most of because I mean honestly at the end of the day like I have a lot of stuff I play on PC and so I think that words you may have a lot of subscription services on the console side of things I don't think PCs ever gonna go that way
3932000	3962000	so I mean at the end of the day it's gonna be which of these services would I get the most use out of and even still like I have a back catalog of games that are in my libraries that you know it may be more prudent for me to get like an Xbox you know games pass you know subscription because I don't I haven't gotten the free games from games of gold in a long time because I haven't subscribed to gold because I don't use my Xbox but
3962000	3992000	you know that might be more beneficial for me it would just have to depend on what's what each platform is offering really y'all are quite the model citizens I'm reading chat and you guys are for the most part like saying you did not resort to piracy for this Bobby Blackwell says if I don't want to pay for something I don't consume the content I'm not entitled content that probably the closest answer we got here Phoenix 77 26 says why pirate when you have free trials and disposable email addresses okay so not piracy but maybe
3992000	4022000	using the system perhaps hype mayhem says not me I want to see it and can't afford CBS all access but piracy is a road I won't go down yeah so sg100 Matt says that Harley Quinn show on that DC streaming service is great I hope it gets a second season but it sadly pirated a lot I didn't even know DC had a streaming service until I read that yeah they do see now there's so many of them I don't even know what's out there anymore so what happens if gaming ends up going down this route I hope we see some interesting alliances for
4022000	4052000	them and you know to be fair Xbox game pass seems to be doing a pretty good job of that where they not only have their own stuff but they're collecting a lot of different indie stuff some big third party stuff on there and I think that's one thing that Xbox has over yeah yeah and you play in that that type of stuff well and also with those I mean I like how they have all their new games on there it's a really good value for what you're paying but like at least with the streaming service since it's month to month for most that stuff unless you're prepaying for a bunch of it I mean if for whatever reason if it ends up going
4052000	4082000	the way of like Netflix where you know content leaves content comes in you know if it doesn't have what you're interested in at that time just stop subscribing to it or you know $10 a month honestly when you're looking at games and like how many games you buy like that's not a huge or even like $15 a month is not a huge that's like a game every four months that really when you look at it you probably spending more on games anyway
4082000	4097000	and so you're getting a lot more content here but at the same time like I don't want to get caught in the you know where as I happen like I'm paying for Hulu Netflix and Disney Plus right now but am I consuming a lot of that content nah you know it's just nice to have
4097000	4102000	what about when you weigh your family into it like do your kids consume Disney Plus even if you don't?
4102000	4131000	No we watch the Star Wars movies on it sometimes I'm trying to get them to go through the whole Marvel series the Marvel Cinematic Universe but like that's gonna be like pulling teeth it's hard enough to get them to go through Star Wars but they're finally getting caught up on Star Wars so that I can take them to see the new one in the theaters but like you know like with Hulu we watch a lot of Food Network stuff on there like it's just chopped all the time that's what we watch in there and Netflix is like kind of a smorgasbord of like also a lot of their original series
4131000	4136000	stuff a lot of just some of the unique content on there.
4136000	4160000	I hate to admit it but the circle was so fucking good. It's such trash but it was so good. As far as like trashy reality TV shows go it really was one of the better ones like the people they cast were not like like that's the problem I have with Big Brother these days they're casting horrific people like it's just there's there's never anyone to root for anymore on that show or anything
4160000	4171000	but like the circle was like okay some of you all are like very clearly like these little like niche things but like I really like the people like they weren't assholes
4171000	4183000	I'm just gonna I don't know what the circle I mean I've seen the stupid trailer I watched them like is this something we're gonna watch and my wife's like no let's watch Chopped
4183000	4210000	it's Big Brother meets that one episode of Black Mirror where you rate everybody that's what it is so but like they can just live out who they are and stuff like that because they they never see each other so what happens they're all playing in their own apartment rooms so they're all living in this big apartment complex and they all live in their own apartments and they only interact through this television thing that's the circle there's no camera there it's just like chatting and stuff so like for example and I won't spoil anything because this is in the very first episode
4210000	4238000	one of the guys going in is playing as his girlfriend because he thinks that he'll have an easier time meeting and connecting with people as a woman so he does this and playing and playing as a girlfriend and does a really good job of the catfish through the whole thing whereas there's another guy that is playing it's like a younger hotter version of himself who kind of screws it up like is not very good at being a catfish so it's just kind of interesting to see how that all works out and then the twist is
4238000	4267000	when one of them they have to rank everybody how they like everybody and then you know like I think it's like the top two get to kick somebody else out they get to block somebody so when somebody gets kicked out of the show on their way out they get to go to somebody's apartment meet one person face to face and so like in the case of like one there was like a romantic connection thing going on and like they met and they found out oh my god you really are you and they like they ended up making out and stuff because they're like you're hot you're hot oh my god I'm so happy
4267000	4296000	and so they did that whole thing but then there were other circumstances where like I want to go meet this person and when they went they were not who they said they were and it was like oh my like what the hell were you doing type of thing and like that person had to explain their reasons on why they didn't so it's interesting yeah anyway sorry but I will I will agree with Bobby Black Wolf who says the only good reality show was the mole with Anderson Cooper honestly I wouldn't say it was the only good one but it was by far the best one
4296000	4325980	there will never be a better reality-based competition show than the mole specifically when Anderson Cooper was the host absolutely correct so I would have I would have loved it like that was the show I would want to be on more than anything anyway all right it was like James Bond is a TV show but anyway let's move on okay I get excited when trashy reality shows come up there's a you know there's a real big season of Survivor coming up right that show has been on so fucking
4325980	4330900	long you ready for this the next season of Survivor is a bunch of people who
4330900	4336300	have already won the show competing to win again and now the prize is two
4336300	4341400	million dollars and that's the whole catch so it's but was the previous prize
4341400	4344420	one million dollars yeah one million dollars but now they already you've all
4344420	4348140	already won a million dollars but you've never won two million dollars this is
4348140	4351980	the biggest prize in reality histories I don't know so yeah but a lot of the fit
4351980	4354980	longtime fans of the show are like these are the best of the best people get in
4354980	4358420	to play so it's like the true all-stars anyway enough that back to games back
4358420	4363140	to you all right Nintendo switch an interesting patent that was filed for
4363140	4366700	the Nintendo switch a patent application that went to the United States patent
4366700	4370900	and trademark office you can't always read too much into these because
4370900	4374740	sometimes companies are piloting things that they end up never actually
4374740	4378660	releasing for example what was the thing for the weed the monitor of the pulse
4378660	4382420	thing on the vitality that's a little bit different cuz they actually show
4382420	4387380	that off I think they did but you know it didn't it didn't actually happen at
