start	end	text
3331949	3359172	it's like the largest gaming platform right now and there is so much rampant copyright theft just so much some of it is unintentional because it's kids making the game but that said, there's a lot of it that is adults making these games full well understanding that yeah, I'm ripping off the copyright for this so it's unfortunate
3360215	3368609	and apparently Cliff in the screenshot that was shared on social media already had 160,000 visits.
3368629	3370492	So it's not like this is some underground thing.
3370632	3373357	It's already very much out there.
3373978	3379928	Interesting point also made along these same lines about slop and AI.
3379908	3408531	and I know this we talked about this a couple weeks ago the PlayStation store AI generated bullshit that is meant to cash in on different trends in gaming right now so that's another you know place so yeah I I feel like this is all gonna come to an apex legally at some point so we'll see interesting interesting uh and a lot of folks comment giving the sorry a lot of folks in chat giving the appropriate comment here which is oof
3409777	3415296	Yes, that would be the appropriate comment to this story.
3415316	3418808	Let's go to our next segment and take a trip down memory lane, shall we?
3429470	3437362	and now it's time to travel back to a simpler time where I'll dive into the vault and pull out a classic and tell you about it.
3437382	3440166	It's time for the classic game of the week.
3440807	3441127	All right.
3441327	3450080	And once a month, DarkSakura puts a little twist on things and she picks a game that for 2025, it is a classic.
3450240	3453265	It was a game and now it's in the arcade.
3453525	3456810	So what is the classic game to arcade of the month, DarkSakura?
3457668	3460412	Well, I mean, it's been in the arcade for a hot minute.
3462034	3466560	So the game is Injustice Gods Among Us.
3468743	3475873	Now, this segment doesn't necessarily have to encompass the 10-year limit, you know what I mean?
3476694	3481400	Although Injustice does fall in the 10-year limit since the game came out in 2013.
3481480	3487388	But in 2017, the arcade version came out.
3487773	3510658	and uh you uh I mean it's a full-on arcade port of wait why is this saying the mobile game yeah of the mobile game interesting I didn't realize that part but it was made by Raw Thrills working with NetherRealm Studio and it first came out in Dave and Buster's before a worldwide release so um
3512292	3513454	You know what?
3514195	3518120	This is weird because it says that you have cards.
3519202	3522146	Yeah, you have cards that you scan for your character.
3523348	3528595	And then it plays like the mobile version with the push and hold buttons.
3528615	3529897	There's six buttons all together.
3530458	3533142	So you have quick attack block and a strong attack.
3533282	3534864	And then you have a special attack button.
3534904	3541253	And finally, you have your start and buy a card without playing the game.
3541233	3545244	And it also is your tag-in button during the battle.
3545866	3547892	But you can't choose what attack you want to use.
3548834	3555613	You just have to use the special button to do your special, no matter how much your bar is filled up.
3556808	3563059	It's kind of like weird mini-game-ish sort of shenanigans going on.
3563940	3564682	It's really weird.
3564822	3570993	I had remembered that there was some catch to this game because I saw it and really didn't want to play it.
3571914	3572235	Um...
3573194	3582883	But yeah, this is really the mobile version, just a lot more scaled.
3583223	3595334	The Series 4 update had an instant super move that you can use when the battle begins, and you do need an additional credit to use it, and it'll give you a bonus card with an additional reward.
3596135	3599077	So you have to basically spend twice as much on a single match.
3599778	3603201	It's definitely something to suck up money, is what it is.
3603181	3618152	um as for um the game uh beneath uh actually where your character's name is a player uh the character's name
3618605	3640714	DarkSakura, DarkSakura, DarkSakura
3640694	3657555	um you have many swapping games for different special attacks and you will always have a countdown um and then you have a single player ladder a medium ladder and a hard ladder um and then of course there's a
3658514	3664422	Your cards will also be different outfits for some of the characters.
3664522	3668808	You can get the same character just with different outfits.
3668848	3672512	They have different power levels.
3673233	3679562	For example, in the Silver set, if you had Bane, there's a Nightfall and then there's a Regime version.
3680102	3683627	The Nightfall has 65 power levels.
3683607	3686031	and 81 Defense.
3686231	3690157	And the Regime one has 63 power and 73 defense, so it's a little bit different.
3690177	3693142	However, it has higher speed than the Nightfall one.
3693182	3695004	So, you know, there's different trade-offs and everything.
3695064	3696867	It seems pretty balanced.
3696887	3700633	You get all kinds of different versions of the characters that way in different outfits.
3702696	3703337	So...
3705005	3710172	The cards themselves, of course, have different stats.
3710192	3714337	So like for the odds of pulling a card.
3714558	3724090	So for bronze, it's 20%, silver 26%, gold 46%, which is pretty good because the gold I think is the one that's got like Batman and all of that on there.
3724992	3725292	Yeah.
3726892	3740450	The team cards are 3%, boss cards are 2.5%, gear is 2.5%, and the foil cards are 33% overall split between bronze, silver, gold, team, and boss and gear.
3741231	3745217	So it's, yeah.
3745237	3750283	But anyway, this is a game that's definitely designed to suck up money.
3751525	3752967	So yeah, I just say play at home.
3755005	3764425	That's a lot.
3764759	3786160	that's more like the Dragon Ball Z game where you actually have your own character in the universe who goes on the different adventures trying to fix weird universal stuff but it's a lot more of an adventure game and I think a little bit less of a money sink yeah
3787152	3789014	It's definitely a lot more involved.
3789034	3795442	This is just fighting where that one is, I think, fighting and adventure and full story and everything.
3795682	3797144	And this looks like a mobile game.
3797525	3798406	It does.
3799187	3800488	I saw this not that long ago.
3800508	3801910	They have one of these at Roseville Golf Land.
3802230	3804834	My work had a thingy thing at Roseville Golf Land a couple months ago.
3805274	3806796	And I was like, oh, it's an Injustice game.
3806816	3807317	And it uses cards.
3807337	3809479	Because I thought, oh, the cards look like they might be neat.
3809499	3811942	But then I looked at the price and I was like, hmm.
3812643	3813524	And the game looked bad.
3813544	3815927	I think they had it when we all went there before.
3816208	3816448	Yeah.
3816468	3816568	Yeah.
3816937	3818019	Yeah, true, true.
3818700	3823009	I mean, if, I mean, Roosevelt Golf Land with money gobblers.
3823450	3823791	No.
3824031	3825774	No.
3825794	3826035	All right.
3826055	3826776	Never gasp.
3827277	3828440	Gasp, I say gasp.
3829041	3835634	There it is, your classic game to arcade, because not all of them are upgrades necessarily, of the month.
3836175	3837257	Injustice.
3837845	3838186	All right.
3839148	3841974	With that, we have some more things to get into.
3842315	3843417	Right.
3844039	3849110	Before we wrap up tonight, we have some rapid fire news, some quick headlines to talk about here.
3849230	3851736	So we'll go over to Loki with some rapid fire news.
3852458	3871378	DarkSakura, DarkSakura, DarkSakura
3871358	3876006	Can't forget the other Ubisoft project on Apple TV, Mythic Quest.
3876026	3889969	So obviously having several successful seasons of that series, it only makes sense that they would want to have him adapt one of their actual properties instead of just coming up with something brand new.
3890349	3896860	Then, of course, they're also going to feature Noah Hawley of Fargo, that series.
3896840	3925918	and apparently the collaboration they said is an embarrassment of riches because Far Cry you know they feel that it will let itself well to TV and yeah so interesting to see and it's apparently supposed to be on FX is where they're targeting that I don't know we'll see I'll be interested to check it out I do like some Far Cry early Far Cry so much newer stuff but
3926033	3946573	and then also really cool and kind of unexpected we got an announcement that Heretic and Hexen have been updated and then of course re-released now as part yep as part of this was a QuakeCon 2025 announcement finally so finally yep so um
3947127	3957061	Yeah, they're basically getting the full treatment, being updated and remastered for modern consoles and Steam.
3957621	3962248	And then also, along with that, they even have more campaigns as well.
3962268	3965011	There's, I think, a new campaign for both games.
3965813	3972802	And they have, of course, online cross-platform deathmatch co-op for up to 16 players, split-screen deathmatch and co-op for up to 8 players.
3973884	3974164	Um...
3975292	4003071	Toggleable soundtrack, they have an enhanced soundtrack, plus you have the original soundtrack as well 4K, 120 FPS, lots of accessibility stuff added into the game as well Modern controller support, widescreen support, save load All the bells and whistles Yeah, that's pretty cool, and it's on Game Pass, so if you have Game Pass, you can just pick it up Yep I totally forgot that this came out, and I need to check it out
4004823	4022562	well ain't this something because it's already in my library oh apparently if you had an earlier version of it you got the upgrade for free I heard it was they've done this with Doom and stuff before like when they recently if you had bought Doom previously that you got the new one for free so maybe you uh
4022542	4024724	I'm not at all sad about this.
4024744	4025545	Not at all.
4026065	4037717	And I don't know if you would ever have a scenario where you would need this, but they did include the original DOS versions of the game with the purchase of it as well.
4038117	4042141	So if you do pick up that collection on Steam or something like that, you still get the DOS versions.
4042161	4043963	Maybe you have a DOS machine.
4044103	4046646	If you have an old DOS machine that you want to play it on, I guess.
4046926	4047446	That'd be cool.
4047847	4050169	DOS emulator for Mac.
4050149	4052231	The DOS emulator for Mac.
4052271	4054654	The irony is not lost.
4054674	4061002	Gotta get my config sys and auto exec set up and I'll be ready to game soon.
4061662	4063805	As soon as I figure out how to allocate all that RAM.
4064446	4066988	All that 4 megabytes of RAM.
4067049	4068791	I don't actually know what this is.
4068811	4072114	This may have been 8 or 16 megabytes at the time.
4072975	4076880	Of it misreading the RAM and just going fast.
4077120	4078422	Oh, the game's already done.
4078442	4078722	Bye.
4079630	4085823	Orange Right and Chat says, check my GOG library.
4086003	4087326	I have the new remaster.
4087386	4090252	Well, you know those attention whores were not going to be left out.
4090272	4093538	As I've called them last week, girl, oh girl, they're not going to miss that boat.
4094661	4096845	Girl, oh girl, get on that trend.
4096960	4113822	DarkSakura
4115590	4129281	Well, one of my personal heroes, Hip Tanaka, also real name Tanaka Hirokazu, is interested in doing video game soundtracks again.
4130043	4134713	He's one of the absolute legends of chiptune music.
4134693	4141480	started with Nintendo in 1980 as an in-house composer during the 8-bit and 16-bit era.
4142000	4147726	And he actually helped design and program the audio hardware for the Famicom slash NES and the Game Boy.
4148166	4156695	He's also done the soundtracks for Super Mario Land, Metroid, Kid Icarus, Balloon Fight, Dr. Mario, the Game Boy version of Tetris.
4157055	4164683	Co-composed the soundtracks for Mother and for Mother 2 or Earthbound with Suzuki Keiichi.
4164663	4178074	and he wrote songs for the Pokemon anime and Nintendo said he wasn't allowed to do it anymore because it said he was working for another company so he resigned from Nintendo and worked with Creatures Inc.
4178094	4180900	instead and now he was the president of the company.
4181318	4184122	But now he's wanting to get back into game music.
4184503	4185945	And I think that's cool.
4188308	4194537	He made a soundtrack for a game called Oasis from a studio called 17-Bit.
4195619	4196961	And now I have to find that.
4197642	4199464	But, oh, it looks cute.
4201127	4203951	But anyway, yeah, he's ready to go.
4206158	4206719	All right.
4207019	4230073	Excited to see what he comes up with.
4230053	4250779	Diablo 4, Diablo 2 Remaster Diablo 3, Diablo 4 Remaster
4250759	4252922	Immortal, for better or worse, was under his launch.
4253002	4255787	So he's done a lot with driving the Diablo franchise.
4256468	4267324	But he says, after five years driving the Diablo franchise with four big launches, it's time to step away from Blizzard and Microsoft, sword in hand, and see what's next.
4267344	4271811	I'm proud of what we've built and excited of what's ahead for Diablo and for me.
4272332	4277119	And that was his post over on Blue Sky at rodferguson.bsky.
4277620	4279002	So, yeah.
4279383	4279483	Yeah.
4279463	4283790	Also of note, this comes right after a bunch of layoffs were done by Microsoft.
4284111	4288678	He was not technically part of the layoffs, but interesting.
4288738	4296031	Phil Spencer did reply and said you brought strength, hellfire, and vision to one of gaming's most iconic franchises.
4296451	4298374	Playing Diablo 4 with you was a blast.
4298395	4301019	Thanks for everything you gave to the game and the community.
4301039	4304104	So we will see where he pops up next.
4304928	4308060	Alright, let's travel around the world and check out some release dates.
4308462	4312698	I doubt there's a new Diablo game coming out this week, but maybe there is something else you want to check out.
4312718	4314264	So let's go to the US, Loki.
4314284	4315107	What's coming out?
4315795	4323846	We don't have a whole lot this week, but we've got Ra Ra Boom on PC, PlayStation 4, PlayStation 5, Xbox One, Xbox Series.
4325028	4328433	We've got Senua's Saga Hellblade 2 on PlayStation 5.
4329655	4336064	Let's see, Dwarf Romantic on PlayStation 4, PlayStation 5, Xbox One, and Xbox Series.
4337005	4341732	Drag X Drive on Nintendo Switch 2.
4342493	4344115	You can check that out.
4344095	4366255	Madden NFL 26 on PC, Nintendo Switch 2, PlayStation 5 and Xbox Series Midnight Murder Club on PC and PlayStation 5 Relic Hunters Legends on PC and Xbox Series Warhammer 40k Dawn of War Definitive Edition on PC
4367230	4377679	Bendy Lone Wolf on PC, Nintendo Switch, PlayStation 4, PlayStation 5, Xbox One, and Xbox Series and finally on PC, Nintendo Switch, off
4379144	4379905	I'm gonna play off.
4380325	4382107	Not on, but off.
4382127	4382928	Not on, but off.
4383409	4383889	That's right.
4385030	4386392	Bug off.
4386412	4405532	Alright, let's quickly, I wanted to mention before I go to Japanese releases, QuestBuster in chat made a comment about the Rod Ferguson bit that I thought was a really interesting prediction saying, there's speculation from some corners that Ferguson might go over to help Bioshock 4 after its recent shakeup given what he's done before.
4405932	4407514	That's a very...
4407494	4408535	Interesting.
4408575	4415244	We're going to have to bring out the wheel of plausibility for that one because I would rank that high on the wheel of plausibility, to be honest.
4415284	4417126	That's a really good guess.
4417146	4419409	So thank you for bringing that one to my attention, Quest Buster.
4420150	4423374	Anyway, let's go to Japan and check out the releases in Japan.
4423434	4430122	Although I will say on the PlayStation 5 and the Switch 2, it seems to be very quiet in Japan this week.
4430162	4431584	I'm not sure what the reason for that is.
4432645	4435729	Yeah, the only releases I have are on the 21st.
4435709	4440455	So we have a quiet week in Japan for releases for whatever reason.
4440775	4442117	Is there anything like on PlayStation 4?
4442317	4443598	No.
4443619	4444640	No games coming out this week.
4444660	4444940	I don't know.
4444960	4445821	It's not Golden Week.
4445921	4447083	I know when that is now.
4447103	4448705	After all these years, I figured that out.
4448725	4449305	It's not that.
4449405	4451108	It's just... It's April and May.
4451128	4452309	Yeah, not a big release week.
4453090	4453390	All right.
4453851	4455433	Well, then we'll go to Europe, DarkSakura.
4457035	4461480	I'm actually double-checking holidays for August.
4461562	4473446	On the 11th, we have Madden NFL 26 for PC Switch 2, PS5, Xboxes, Whisper Mountain Outbreak for PC.
4473466	4482625	On the 12th, Abyssus on PC, also Fallen City Brawl, RaRaBoom PC, PS5, Xboxes.
4482605	4502554	Viewfinder for Xbox's World War Z VR from MetaQuest PC Senua's Saga Hellblade 2 for PS5 EA Sports Med and NFL 26 for Switch 2 A Fistful of Yankees for PC
4502534	4529419	Iwakura Aria for PC and Switch, Beneath the Six for PC, Warhammer 40k, Dawn of War Definitive Edition for PC, Kevin Tom's Football Star Manager PC, and I am reckoning that this is real football and not American football, Ovis Loop for PC, Voxelgram 2 for PC, Drag X Drive for Switch 2 on the 15th, Robert on Earth for PC, and Off for PC and Switch.
4531323	4531864	All right.
4533087	4537057	Yeah, there was a comment in chat about, could it be back to school week in Japan?
4537158	4541188	And that was my initial thought, but it turns out, yeah, Japan's on it.
4541208	4544235	The culture in Japan is more spring-oriented for school starts.
4544255	4546080	Today is Mountain Day, but that's it.
4546361	4547323	That's it.
4547303	4562612	Thank you for watching!
4563200	4570886	I am one of those people that loves pretty much anything dropout, but Game Changer especially.
4570907	4572007	Big fan of Sam Reich.
4572668	4592785	So Sam Reich sat down for an interview with Kotaku talking about Game Changer and their seventh season, but one of the topics that got brought up was because they've been starting to implement video games into some of their challenges that they do on Game Changer that
4592765	4598191	It's like, well, hey, would you like to just adapt one of your dropout properties into a game?
4598391	4599532	And they're like, yeah, for sure.
4600373	4613848	The, I think, issue, and like most things with dropout, because it is a small independent company making all this stuff, it's just a matter of the time it would take to do all that and the resources it would take to do all that.
4613868	4617051	And that's kind of what Sam is saying here, basically, that...
4617031	4617613	Yeah, for sure.
4617954	4621283	I think we would be into that.
4621383	4622326	We've talked about it.
4622807	4632053	And I think it's like at this point, it's honestly more than anything just the bandwidth issue, which is if we're going to do it, we want it to feel like us, which means we need to work on it.
4632033	4634796	and we're not going to farm out the IP to some third party.
4634816	4642624	We want it to feel personal and it needs to be something therefore that we're excited about that feels different enough from what's out there and feels worth our time.
4643365	4656859	And that basically the two series that Sam at least envisions that could possibly be converted into a game would be Dimension 20 and of course Game Changer.
4656879	4661584	I could absolutely see Dimension 20 since it's rooted in kind of
4661564	4691233	High Fantasy Dungeons and Dragons type stuff so there's a lot you could do there with that but yeah I'd be excited to see that and they had some of the previous stuff with Game Changer they've done simple things like a maze game that they had and then a ski free clone that they featured in that as well so it's it'd be interesting to see if they did something with that interesting alright
4692412	4696857	Well, that was our last... I now have the weenus running through my head.
4698438	4699179	Thanks, Nick!
4699760	4703544	Honestly, like, you know, the dropout is just great.
4703584	4705105	Just go subscribe.
4705866	4709430	I only see the little clips that come through on TikTok, but it seems pretty humorous.
4710011	4711312	It's like $7 a month.
4711612	4715416	And it's like the, you know, Game Changer is a really fun series.
4715436	4716257	That's a Twitch site.
4716477	4719060	Dimension 20, you know, uh...
4719817	4722226	Dimension 20 is just absolutely worth it.
4722286	4725137	I'm just anywhere where Burnley Mulligan is going to be.
4725157	4728510	But yeah, absolutely worth checking out.
4729132	4729553	All right.
4730974	4732957	That is our last slotted story for tonight.
4733177	4735300	So we have some time for some last minute stories.
4735400	4737282	I always like to check in with the mailbag as well.
4737422	4739225	I don't think I saw anything in there, but you never know.
4739425	4740386	We ain't got shit.
4740626	4740907	All right.
4741087	4746253	Well, if you want to add shit, participate at Orangelandradar.com is the place where you can send us an email.
4746434	4747695	There was already shit in there.
4747715	4748496	I cleaned it out.
4748516	4749738	Oh, all the fucking spam.
4749758	4751059	Annoyed.
4751820	4753182	Annoyed.
4753162	4756165	Anyway, I was checking the blue sky as well.
4756185	4758747	We didn't really get any questions on blue sky, which you can follow us on blue sky.
4758767	4762310	If you want at orange on trader.com, we use our domain as our blue sky handle.
4762651	4770538	Although I will shout out our buddies over at game buoy.org because they always are so nice to shout us out and leave us a little tag on social media.
4770618	4776403	So I just want to shout out our friends over at game buoy.org video game podcast, another show here at the voice geeks network.
4777064	4778185	I have, I'm going to be honest.
4778205	4781548	I haven't checked out their latest episode yet, but I know it just went up.
4781528	4784851	So that will be probably something I'll listen to on my drive up to Oregon.
4784871	4785371	That'll be fun.
4786112	4787453	So, all right.
4788254	4793819	Anyhow, this is where we can open up for some calls.
4793839	4801326	If you want to join our Discord over at vognetwork.com slash Discord, which I would encourage you to join anyway and talk with us throughout the week.
4801366	4804108	You can also throw out some random questions in chat if you would like.
4804649	4806651	But otherwise, I will check with Loki.
4806871	4808933	I feel like there's a few stories that didn't make the cut tonight.
4809213	4811535	Was that game you were thinking of Dressed to Impress?
4811515	4814700	Yes, Dressed to Impress was the Roblox game I was trying to think of.
4817123	4818926	I have a little teeny news.
4818946	4819867	Oh, what's that?
4820929	4822030	It's a World of Warcraft thing.
4823893	4828700	They did a new patch and you can lean on a wall now.
4828720	4830843	Wall leaning.
4830863	4834348	So you can look brooding and nonchalant.
4834368	4839376	But they did also add new dungeons, a new raid, a new delve, new story stuff, new zone.
4839396	4840898	But you can lean against a wall now.
4841384	4854713	I would love to see Sassy Pants do that, though.
4855295	4856638	Aw, my old character.
4857720	4858161	Aw.
4859170	4888823	I did play World of Warcraft not that long ago I checked out the most recent expansion it was fine I just I don't really have interest in the long term like the rating and all that stuff going on to be fair Final Fantasy 14 I haven't really cared about this most recent patch like I'm I'm really done with this expansion I just want them to move on to the next one which I guess this patch finishes the story of the current expansion I know but I I'm just gonna be honest I've been a fan of 14 for over a decade I just don't care about this story I'm done
4888803	4908583	DarkSakura, DarkSakura, DarkSakura
4908563	4910165	for, you know, especially that type of stuff.
4910185	4919537	But also in Modern WoW, they really have added, I think because of 14, you know, they've added a lot to WoW that, you know, the UI is extremely customizable now.
4919557	4925465	I really like the Delves, which are kind of like their solo or small party content that they have in the game.
4925485	4926626	I think it's really interesting.
4926647	4930892	So, you know, there's plenty to do in Modern WoW.
4930872	4956728	retail wow it's just it's weird to get caught up with it I mean you you level a character through like a new tutorial island and then like you do like one expansion worth of content you pick where Chromie sends you or you do the most recent expansion if you don't have Chromie sends you somewhere else um and then like you get into the newest expansion from there but it's just it's it's interesting how contained the expansions are now I don't know
4956708	4975763	Yeah, I think they have to because they've moved the story so far ahead.
4975743	4980490	S, Joe and Hunter Matt says Rob, did you see or watch the new season of Wednesday?
4980951	4983234	Did you see who was cast as Grandmama?
4983755	4987420	No, I didn't, but was that where Joanna Lumley was supposed to be in it?
4988722	4990825	Maybe I'm wrong.
4991026	4992207	Is that who plays Grandmama?
4992328	4992928	Okay, yes.
4993629	4994991	I need to see it for that reason.
4995011	4997054	No, I haven't had Netflix in years, actually.
4997555	4998957	But I need to see it.
4998977	5001601	I heard good things about Wednesday.
5002763	5005227	Have you seen the new season?
5005247	5005547	No.
5005662	5006964	Oh, I need to see it.
