start	end	text
1749874	1755490	Speaking of Nintendo, a lot out of their camp this week yet again going into the holidays, right, Loki?
1756094	1759380	Yeah, they did their Nintendo Indie World Showcase.
1759400	1765290	So they're announcing a bunch of different indie games that are coming out on the different Switch platforms and stuff.
1765630	1767053	Some of these we've heard of before.
1767153	1768275	Some of these were new.
1769557	1772121	So kind of just we'll go over these really quickly.
1773904	1775807	Some of the stuff that's a little more familiar.
1775848	1780836	So we had Mina the Hollow Word, which of course is from the Shovel Knight folks.
1781103	1803313	and they showed off a new uh gameplay trailer and also that now so that demo is available for that uh there's uh Well Dweller which looks pretty cool it's kind of a dark fantasy metroidvania game that's coming out next year uh Neverway which is like a it almost reminds me of a um
1804306	1806049	Don't Starve type game.
1806129	1809655	It's basically a nightmarish life sim or something like that.
1810878	1811699	Kind of interesting.
1812701	1815005	And that's supposed to be coming out next year as well.
1815526	1818491	Hurtling, I think I've seen a trailer for this before.
1819172	1827006	The folks behind Firewatch, that's coming out in about a week or two on the 21st.
1827239	1850428	is this seat taken that's a cool puzzle game that was released that day they announced a new update for big kitty uh little kitty big city and they're going to be getting this uh a perfect picture update that's also going to have new areas new friends that you can meet new skills and uh of course a camera mode because
1850408	1874560	why the game didn't have a photo mode with cats that's what we use the internet for anyways um so yeah and that's coming out later this year that free content update uh speaking of content content warning is going to be coming to the Switch and Switch 2 as well sometime next year um Ball X Pit or Ball Pit from Devolver Digital looked pretty awesome it's kind of like a
1874540	1878819	Roguelike with Arkanoid style gameplay.
1879121	1881833	So you can now pay to spend extra time in the ball pit.
1882724	1883686	Yes, you can.
1883706	1884086	Hooray.
1884888	1889917	And that's launching on the Switch October 15th and on the Switch 2 sometime later.
1890618	1894966	Then we have Ultimate Sheep Raccoon, which is the sequel to Ultimate Chicken Horse.
1894986	1899534	It's like a racing platformer game instead of the traditional one.
1899935	1904022	And that's going to be coming out a little bit later this year, I think.
1905325	1906707	Glaciered
1906687	1914479	is a, it almost looks like a Subnautica type thing, but it's a RPG with aquatic monsters.
1915060	1918325	And that's going to be coming out this holiday on Switch 2.
1918346	1922652	And then they showed off just some quick trailers as well.
1923293	1932508	So we had a trailer for Winter Burrow, which is a kind of a cool looking survival game where you play a mouse living in the snow.
1932488	1933751	So that was kind of neat.
1934051	1944132	We had Undusted Letters from the Past, Tiny Bookshop, Caves of... I have no idea how to pronounce that.
1944332	1944693	Cud?
1945274	1945455	What?
1946216	1947038	Q-U-D?
1947423	1947864	Coode?
1948625	1949125	Who knows?
1950067	1953772	Strange Antiquities, Opus, Prism Peak, Go!
1953792	1954013	Go!
1954033	1956356	Town, UFO 50, which is awesome.
1956496	1959761	That actually was launching that day as well.
1959961	1961223	UFO 50 is a great game.
1961884	1965069	And then, of course, Demon's School and Go!
1965089	1965229	Go!
1965269	1966090	Town.
1966762	1969746	But yeah, lots of indie games we're checking out.
1969947	1979040	Nice to see Nintendo sort of dedicate a little time because I think sometimes, at least with the original Switch shop, it really felt overloaded and burdened.
1979060	1981443	I mean, I guess this is true to some extent with the Switch 2 shop too.
1982765	1984467	We know there's a bunch of shovelware on there.
1984487	1985048	We know where there is.
1985469	1991858	So it's nice of Nintendo to spend some of their official time really highlighting some things that are kind of worth a second look that can get lost.
1991838	1996745	I kind of wish they did these maybe once a month and a little more often.
1997065	1999869	Although I guess maybe they seem to do them about once every other month.
1999909	2001692	So maybe it's not as bad as I'm thinking in my mind.
2002052	2006078	So it's nice that they highlight those types of things because it's, you know, it's good.
2006879	2012327	Going to some comments over in our chat room over at twitch.tv slash VOG Network about some of the games in the pack.
2012307	2040981	DarkTetsuya says I admit most of these aren't really in my wheelhouse but I did notice UFO 50 so hope to pick that one up at some point Bobby Blackwolf also commenting on UFO 50 saying UFO 50 was the best announcement of the day and it was buried in a sizzle reel well that happens sometimes you know what what might not be a big deal to you is a big deal to someone else and then of course the whole infamous they spend too much time talking about this sports game I don't give a fuck about like that happens a lot too right so
2040961	2041922	Yeah, not in this thing.
2042903	2044305	Well, not in the indie thing.
2044705	2047809	Although, indie sports games tend to be the best ones.
2047829	2056318	Actually, I will say, one of our local little bars did their gamer night this week, and some of my friends were playing Windjammer for like an hour.
2056939	2061443	So, you know, although, is that really an indie?
2061464	2062224	I kind of think it is.
2063886	2067390	Let's see, another comment here from Seeger Starzik, who says...
2067370	2094508	is this seat taken is pretty good picked it up that day and have had a really good time with it so far seems like it could be very short though yeah sometimes those indie games especially if they're low cost may be kind of cheaper so there's that all right well uh hopefully y'all saw at least one thing in that showcase that you liked uh meanwhile a lot of people telling Nintendo what they like or don't like about a certain system that they have set up with their
2096108	2118285	Digital Game Keycards
2118265	2122631	So, yeah, I'm going to assume that people really jumped on this.
2122651	2138034	And honestly, because the whole game key card thing has garnered a lot of negative attention, like at least, you know, if the temperature on social media, on places like Blue Sky, Facebook, whatever TikToks to be believed, people don't really like this.
2138615	2144644	So I'm sure there were plenty of people that were jumping at the opportunity to give some feedback on this.
2144624	2172184	S, Actdeft, Drew, Carameldansen
2172164	2181262	Some of the questions that they were asking were, in general, when it comes to games for a Nintendo Switch system, do you prefer purchasing games in physical format or in digital formats?
2181984	2188958	And for which of the following reasons would you consider purchasing physical versions of Nintendo Switch games?
2189478	2191421	Because you never fucking discount them?
2191441	2192803	Is that a valid response?
2193404	2195167	It seems like that actually is.
2195707	2198552	Physical games tend to go on sale from the retailer and things like that.
2200154	2206043	If nothing else, it shows that Nintendo is looking at this and is taking an interest in it.
2207245	2215958	I'm left to believe they have to be hearing what people on the internet are saying even if they're not directly doing anything about it yet.
2216140	2231162	and I doubt they will for quite some time because I'm sure they have people are saying things they don't like well but there is another thing that could be playing into this as well and that could be the fact that physical games versus digital games is going to get more complicated because of tariffs
2231142	2237551	and all that stupidity that is now enacted is that it's going to make the cost of physical games more expensive.
2237932	2240175	So digital game for that reason is going to be more alluring.
2240195	2243079	So I think there's some advantage to maybe having that data as well.
2243099	2258681	And that may be completely outside the discussion of the game key cards, which actually, I mean, again, in the wake of tariffs, those game key cards are even like 10 times worse because now it's like you're paying more for a game.
2258881	2260103	For what?
2260083	2260844	for nothing.
2261345	2268174	So like, you know, I, I just, a lot is pretty screwy with all that system right now.
2268194	2270337	So, you know, we'll see what comes of it for sure.
2271038	2279629	So, but no, no, obviously no word on what's going to be done with the survey results yet, but Nintendo has obviously made it very clear.
2280090	2281051	They have enough data.
2281071	2281812	Thank you very much.
2283274	2283475	All right.
2283555	2284015	DarkSakura.
2284055	2284376	Thank you.
2284396	2285818	Drive through.
2285838	2285938	Yeah.
2286661	2292047	So there's something new from the Video Game History Foundation.
2293248	2296572	And you know, they're not just looking at games.
2296632	2298994	They're looking at anything related to games.
2299675	2306442	And so they have got the rights to release a computer entertainer.
2306843	2311107	Actually, it started as a video game update, which was a newsletter for U.S.
2311187	2314851	mail order retailer Video Takeout, which I had never heard of.
2314891	2316533	I don't think we had one where I lived.
2316513	2342487	and it ran from 1982 to 1990 and it actually was co-edited by Mary Lou Badeau and Celeste Dolan and means it is also one of the earliest console video game magazines run by women and so every issue of it is available through the Video Game History Foundation That's cool
2343665	2345790	Yeah, I think that's really neat.
2345810	2355233	And certainly I'm glad that they are looking at, you know, not just the games, but anything related to the culture, you know.
2355253	2355514	Yeah.
2355855	2360185	And this is a very important piece of women's history as well.
2360707	2360847	Mm-hmm.
2362092	2372163	Yeah, it is important to also have that sort of like snapshot in time because, you know, just being able to kind of explain to people what gaming was like in a different era.
2372304	2376889	You know, sometimes people don't really have that reference, you know, not to sound like the old man on the block, but it's true.
2377309	2382195	You know, people that didn't grow up on Atari 2600 don't have a sense of just how it was.
2382255	2387281	I mean, there's going to come a time when, you know, the gamers are like, oh, what was an instruction manual?
2387341	2387641	What's that?
2387661	2390044	You just go on the internet to find whatever you needed?
2390244	2390344	Yeah.
2390324	2397397	Like, you know, the art of the instruction manual is sadly going to be long gone, except for, I guess, niche collector's editions and things like that.
2397897	2405591	But yeah, it's definitely preserving a moment in time, which I think is really good.
2408276	2408376	Yeah.
2408396	2408516	Yeah.
2408536	2411181	But I mean, this is all what we grew up with.
2411501	2412223	Mm-hmm.
2412243	2412383	Mm-hmm.
2412751	2417619	Although I don't recall this particular magazine, so I'm excited to see more about it.
2418020	2424131	Because, you know, you used to have to buy those magazines and we couldn't afford them all.
2424251	2428017	So it's cool that we can sort of go back and revisit that now.
2429440	2429680	Yeah.
2429980	2435568	DarkTC in chat over at twitch.tv slash VOG Network says, definitely appreciate their preservation efforts.
2435588	2436409	Absolutely.
2436429	2439633	When we talk about games preservation, it needs to be all of it, right?
2439734	2446923	Questbuster says, I was curious and took a look and I found a Dragon Stomper release in their January 83 issue.
2447845	2448606	Wow, January 83.
2448986	2449547	What a throwback.
2450569	2450789	Okay.
2451770	2454674	Let's move on, I guess, to more modern sensibilities.
2454694	2455115	Yeah, Loki?
2456497	2456717	Yep.
2457618	2458840	So definitely...
2459292	2471268	You know, there comes a time that companies have to reflect upon their decisions and realize that maybe it wasn't the kids that are wrong.
2471468	2474432	Maybe I was a bit wrong, but not too much.
2474452	2476715	They don't want to take full responsibility, obviously.
2476735	2484405	But, you know, this focus with a lot of companies focusing on live service games, Sony being one of those.
2485043	2488808	Run into some hiccups, obviously, with some games like Concord and the like.
2490030	2497039	Basically saying during a, you know, financial Q&A that, yeah, it's not going entirely smoothly.
2498000	2502366	Somewhat negative news has been coming out if we look at the past five years.
2502386	2506631	Five years ago, live service games were almost non-existent from PlayStation Studios.
2507292	2511878	We have Helldivers 2, MLB The Show, Gran Turismo 7, and Destiny's 2.
2511858	2527588	um so we have four live service or four live services contributing to sales and profits in a stable manner but you know it's I think a little bit harder to get another like kind of
2528513	2553728	and so on.
2554298	2565842	And it says, of course, we recognize there are still many issues, so we should learn the lessons from our mistakes and make sure that we introduce live service content where there's less waste and it's more smooth.
2566644	2570552	And it's also something that people want because, you know, Concord sucked.
2570954	2573918	Well, and they are so nervous about Marathon.
2573938	2577663	And, you know, the early testing of Marathon, I don't think went super great.
2578123	2580687	So there's still a lot to be cooked with that game.
2580707	2583010	But that game has so much writing on it right now.
2583731	2593424	And I don't know if the gaming population is in the same space that they were for a game like Marathon to be truly successful.
2593584	2594024	I don't know.
2594044	2596067	I worry for that one.
2596047	2601157	It's because they focus more on the like, how are we going to monetize this?
2601177	2607850	How is this going to be, you know, how are we going to profit from this versus making a good game?
2607870	2609834	And that's the problem with like Concord.
2610194	2611818	That's the problem with Marathon.
2611998	2613060	It's like,
2613040	2633968	you take the live service part out of it if it was just hey here's a game we're going to release later this year and we're going to show it off to you in like a demo and the demo plays like garbage you're going to be like whoa hold on I don't want to purchase this and so that's the thing it's like it doesn't you can take the live service out of the equation stop putting out unfinished games
2633948	2647789	from anybody that goes to a lot of different companies stop putting out unfinished games and then when you do decide to not listen to the audience and do it anyways don't be surprised when it bites you in the ass
2648157	2654904	Well, and I think gamers are also just becoming a lot more aware that like video games are, you know, PlayStation 5 games are $70.
2655024	2659608	And then you're going to come out with a game that asks you for more money on top of that.
2659968	2666675	Like, I think gamers are becoming more and more aware, like it's going to take a really special kind of game for me to plunk down that kind of money.
2666695	2676004	And I have to either, you know, have a story that really fucking moves me or like a player versus player type of mode that really entices me to come back over and over and over again.
2675984	2698532	and I think that's just a riskier and riskier thing to do you know when games were $50 you know I think people are just becoming more and more aware especially and then versus of course the free to play games because I think the biggest competitor for a game like Marathon ends up being Fortnite because at the end of the day Fortnite is still free to put on your PlayStation and is a shooty bang bang game
2698715	2714293	so you have to give people that premium experience especially I would argue in a single player mode that that $70 is going to justify but I worry that especially in that single player mode it's not going to be there
2715269	2726263	Questbuster in chat over twitch.tv slash VOG Network says, Sony's efforts gave me the impression that they thought they couldn't fail by doing things like buying Bungie without realizing the luck part of success.
2726784	2730909	No one expected Helldivers 2 to explode the way it did, but there you are.
2731009	2736957	While Concord, which was created to bring that kind of success home, utterly collapsed.
2737780	2740748	And how's Overwatch 2 doing these days in that space?
2741310	2745661	Like, I feel like the team shooters in general are sort of declining.
2745681	2746143	Well, I don't know.
2746163	2750093	I guess Marvel Rivals is still kind of holding its own, especially with such a recognizable IP.
2750194	2751978	But I don't know, y'all.
2751998	2753342	Like, I just...
2753643	2757930	I know Marathon's a different kind of game, but I am worried.
2758070	2759953	I would love to be proven wrong.
2760534	2762858	I really do hope they take the time to get it right.
2763318	2769689	But I also know the budget to make a game like this isn't limitless.
2770430	2776259	And the longer it goes on, the more they're going to feel the need to nickel and dime the players to try to make the money back.
2776279	2776900	Yeah.
2778027	2782775	SD100 Matt in chat says, I sadly haven't gone back to Overwatch 2 since Marvel Rivals came out.
2782815	2783636	I don't think it's just you.
2784618	2785700	I do not think it's just you.
2787182	2788024	All right, well, moving on.
2789366	2794395	This is a very interesting patent that Nintendo has put out there.
2794415	2796458	It is for a crank.
2796877	2818142	DarkSakura, DarkSakura, DarkSakura
2818257	2825410	and perhaps the crank could be used in something like, I don't know, Animal Crossing when people go fishing or something.
2825430	2828094	Maybe there's some Dreamcast games they could bring back with this.
2828114	2828615	I don't know.
2829497	2835768	Or the interesting thing about a crank, maybe try to lure some ports of Playdate games.
2835888	2839755	Now, granted, the Playdate is a very different type of system.
2840236	2842780	It doesn't run things on the same level.
2843924	2848709	I don't even think they considered Playdate to be any sort of competition whatsoever.
2848869	2856017	I don't think so either, but certainly, you know, like, hey, we have the ability to put this game on our store too.
2856538	2856878	I don't know.
2856958	2864186	I don't know if the Playdate is as serious of a thing as it is, you know, some type of just new control accessory or maybe inspired by the Playdate.
2864566	2870193	Like, hey, what if we took that crank idea the Playdate has and put it on the Nintendo console?
2870473	2870573	Yeah.
2870553	2873519	What if we patent it and then we sue them for using the crank?
2873940	2874862	Because we're evil.
2875203	2875583	I hope not.
2875603	2882057	Well, the patent is for the Switch 2 and the way it interfaces with the Switch 2 controller specifically.
2882498	2885524	Yeah, but you know, I don't put anything past Nintendo, unfortunately.
2885684	2886165	Could be.
2887192	2888734	We'll see.
2890636	2896763	Just a reminder, there were a lot of wild accessories during the Wii because that Wiimote would click into a lot of things.
2896783	2898826	The plastic steering wheel, hello.
2899306	2901188	I remember there was a fishing rod for the Wii.
2901349	2904092	I remember that being a thing.
2904132	2905934	That was an official Mario Kart thing.
2905954	2908016	That was day one for the Switch 2.
2908137	2909318	That's right.
2909348	2911974	So, we'll see.
2911995	2913939	We'll see if anything comes to this.
2913959	2918972	Because again, just because it gets trademarked, it doesn't mean it's going to happen.
2920115	2920696	But it might.
2921518	2923343	Anyway, let's move on.
2923363	2924846	Some exciting stuff in retro news.
2924886	2925448	Yeah, DarkSakura?
2925468	2925568	Yeah.
2929396	2931960	Yeah, sorry, I had to swallow.
2933282	2947963	So for fans of Evercade, there is a new release coming out, which is the Rare Collection 1 and a ZX Spectrum set.
2947983	2948704	So...
2949815	2951878	It's actually looking pretty good.
2953139	2958146	It actually says it's the debut of ZX Spectrum emulation on Evercade.
2959068	2970563	So this is also going to include some of the early NES games, Cobra Triangle, RC Pro-Am, and Battletoads, and the arcade version of Battletoads, and then Conker's Pocket Tales from Game Boy Color.
2971504	2972926	So there you go.
2974568	2975069	I'm excited.
2975289	2978674	I think I want to pick up one of those rare cartridges.
2979127	2983495	All right, cool.
2985038	3002670	Loki.
3004253	3004614	All right.
3005395	3010022	Well, we got good news that Digital Foundry is now going to be going independent.
3010202	3019416	They've decided to leave IGN and have, I think, purchased back their company to be able to actually take it independent.
3019497	3028270	So, of course, if you're not familiar with Digital Foundry, they do a lot of these different kind of evaluations of games and see how well the visuals and everything run.
3028250	3057919	and like you'll even look at like frame timings and stuff like that it's where you get a lot of this news about oh yeah this Switch game was it was basically a postage stamp that they're upscaling to 1080p you know that type of stuff but it is exciting to see you know them out from underneath IGN and yeah so they announced that to everybody on their podcast and going forward they're going to be operating independently so that's
3058220	3058822	Pretty awesome.
3060967	3064397	Not the first company in the media space to go independent.
3064437	3066001	I feel like there's been quite a few this year.
3066041	3067104	It's like a little bit of a theme.
3067204	3068347	So congrats.
3068367	3069771	That's great.
3070052	3073341	I think it's almost always good news for these companies in these situations.
3073361	3074203	So that's great.
3075466	3091956	DarkSakura, DarkSakura
3091936	3110147	DarkSakura, DarkSakura, DarkSakura
3110127	3110628	That's right.
3110729	3112614	A new trailer was released this week.
3112634	3114138	So we don't know all the details.
3114158	3115642	We just know what's in the trailer.
3116344	3121338	And there was also, I guess, a cannibalism update that was done.
3121559	3123404	I think we talked about that on a prior episode.
3123424	3125149	Yeah, that was last week, I think.
3125129	3152537	DarkSakura
3152517	3154021	that you have to avoid.
3154201	3169041	Whereas the game has, for example, a jungle with rain that makes the surfaces slippery, the snow that has cold air or wind that you have to avoid and otherwise you freeze to death, the lava one that
3169662	3191063	you know don't fall into lava where the mountains will burst in the fire and that type of stuff so yeah it's it'll be interesting glad to see that they're still supporting it now for those of you that like to do your quests on discord because that's a thing now you play certain games you get little limited time things or little currency to buy you know flair on discord or what have you
3191043	3196788	Peak will be having a limited time exclusive quest in Discord or with Discord.
3196848	3198550	It will be live just for next week.
3198570	3200572	So between August 11th and August 17th.
3201132	3203474	And you get a Bing Bong avatar for that.
3203494	3203915	Bing Bong.
3204976	3207458	But I think that's what the little characters are called in that game.
3208138	3211041	Also new achievements apparently are coming as well.
3211201	3213984	So that is all happening tomorrow.
3214004	3215545	So please look forward to it.
3215565	3221050	Now I thought this is not directly related to the expansion, but I thought this was interesting.
3221030	3245130	Death by Daylight Death by Daylight
3245110	3252157	But then the most important Roblox game that is an original, at least as far as I know, is the fashion dress up game.
3252217	3253639	God, why can't I remember the name of that game?
3253659	3254580	There's so much.
3254660	3256302	Yeah, there's so good.
3256322	3256982	There's that.
3257062	3258524	There's Grow a Garden.
3258584	3262087	There's but there's knockoffs of other games all the time.
3262108	3265551	Like, I know I've seen the Dead by Daylight one, you know, so much.
3265571	3266152	Yeah.
3266172	3274240	So, of course, there is a peak as in the game we were just talking about a copy on Roblox.
3274388	3275774	It's not even a knockoff.
3275814	3280795	They've ripped off full... The assets look the same.
3280875	3282964	They're just straight up ripping it off.
3283315	3293271	Well, on the official X account, because unfortunately some companies still use X and support its current owner, but I realize there's a lot of companies doing it, so it is what it is.
3293912	3308175	AgroCrab Games put out a very interesting post on X saying, TBH would rather you pirate our game than play this microtransaction-riddled Roblox slop ripoff.
3308155	3331834	so we're hearing that word slop a lot with AI related things in this day and age but now it's being thrown at this too like Roblox knockoffs being slop which I mean I could see that they kind of are I am like honestly so surprised that they haven't cracked that copyright holders haven't cracked down on Roblox like yeah
