start	end	text
4771000	4772000	Who knows?
4772000	4774000	Or Junkrat, I think would be...
4774000	4776000	He's not your stereotypical...
4776000	4777000	Okay, fan wank all you want.
4777000	4779000	They might release some stuff later, though.
4779000	4781000	But anyway, so people are upset.
4781000	4785000	They're like 76. They made 76 gay for no reason.
4785000	4787000	I'm going to let all of you watching on Twitch
4787000	4789000	and listening on the podcast in on a little secret.
4789000	4794000	I, myself, am gay for no reason.
4794000	4795000	Wait, what, you're gay?
4795000	4796000	Yes.
4796000	4797000	Oh, my God.
4797000	4803000	Just is how I turned out.
4803000	4808000	So the reason why stuff like this is important is
4808000	4812000	people say, who cares, why does it matter?
4812000	4817000	There's nothing in the canon to suggest that 76 was heterosexual.
4817000	4820000	There's no official girlfriend. There's no dead wife story.
4820000	4823000	He has a few lines of conversation with Anna
4823000	4826000	that one could maybe infer was flirtatious.
4826000	4829000	But unless someone says, oh, by the way...
4829000	4830000	I flirt with girls.
4830000	4833000	Oh, by the way, this character is gay.
4833000	4836000	The default is to assume that he's straight
4836000	4838000	even though there isn't any evidence
4838000	4840000	because, again, this is a video game.
4840000	4842000	Some characters, of course, have the dead wife story
4842000	4844000	where you're like, okay, he was married to a woman.
4844000	4848000	He's probably, you know, at least bi.
4848000	4850000	So for them to say, oh, yeah, 76 is gay,
4850000	4853000	for people to get so upset about that,
4853000	4857000	it's because the 14-year-olds
4857000	4859000	that are upset about this announcement
4859000	4862000	don't see a character whose sexuality is ambiguous
4862000	4864000	and go, oh, I can't make assumptions about this
4864000	4865000	because they haven't said either way.
4865000	4867000	No, they're going to assume, unless they're told otherwise,
4867000	4870000	the character is straight, and that is why
4870000	4873000	announcements like this is sort of like,
4873000	4876000	hey, you make up like 85% of the population,
4876000	4878000	so we're not really worried about
4878000	4881000	you not seeing enough of yourself in media.
4881000	4884000	So let's pick a character and just say,
4884000	4887000	hey, I mean, there's already a ton of fanfic
4887000	4891000	that him and Reaper have a very sordid past
4891000	4894000	now that, you know, Reaper is dead and everything
4894000	4897000	and an edgelord in that Hot Topic mask.
4897000	4902000	But, yeah, it's been fun watching people say,
4902000	4906000	oh, I don't care that 76 is gay, why does it matter?
4906000	4907000	But then the same people will also say,
4907000	4909000	I don't want to play 76 anymore
4909000	4912000	because I don't want people to think that I'm a Fraggle,
4912000	4913000	but not a Fraggle.
4913000	4916000	It's another word with an F and two Gs.
4916000	4920000	So it's funny, and I'm glad Blizzard did it
4920000	4924000	just to stir shit, honestly,
4924000	4926000	because ultimately it doesn't matter,
4926000	4932000	and it's like the whole thing about people being triggered
4932000	4933000	and the unique snowflakes,
4933000	4935000	but once something like this comes out,
4935000	4937000	the people that accuse people of being too sensitive
4937000	4940000	lose their goddamn minds is hilarious to me.
4940000	4941000	That's all.
4941000	4943000	Well, Alan, the chat room would like me
4943000	4945000	to do this on your behalf.
4945000	4946000	No.
4946000	4950000	So the one thing that I would like to see,
4950000	4954000	because you could get a spray of 76 and his partner,
4954000	4955000	who we've never heard of before,
4955000	4956000	so this really is like something
4956000	4959000	that Blizzard pulled out of their ass.
4959000	4961000	I thought, wasn't there like a picture
4961000	4963000	from an earlier thing that was brought up?
4963000	4966000	That could be true because the Overwatch lore
4966000	4971000	is so filled with like huge gaps of contradictory nonsense
4971000	4973000	that you don't really follow the story
4973000	4974000	of Overwatch that much,
4974000	4980000	but I would love a dial, because 76, he's like a dad.
4980000	4984000	He wears awful, clashy, plaid polka dot clothes,
4984000	4985000	and he like is a...
4985000	4988000	He wears socks with sandals, for God's sake.
4988000	4990000	Yeah, and he's all about the barbecue,
4990000	4992000	and he dances with like no rhythm,
4992000	4994000	and he's kind of like, you know, this.
4994000	4998000	So I would love it if they still snuck in.
4998000	5001000	Like if Ana says,
5001000	5003000	76, how about after the mission we go to brunch?
5003000	5007000	And he says, you know I love brunch, or whatever.
5007000	5010000	I would find that hilarious
5010000	5013000	if they gave him more little dog whistle things
5013000	5016000	aside from a spray of him and his boyfriend,
5016000	5018000	because it wouldn't make him effeminate or anything.
5018000	5020000	Just say, hey, the man loves his brunch.
5020000	5023000	He likes a French toast.
5023000	5025000	Right. Oh, my God.
5025000	5027000	Sia Tabiri says, bottomless mimosas.
5027000	5028000	That could be a line, yeah.
5028000	5029000	Anyway, sorry.
5029000	5030000	Some of the chatters are saying,
5030000	5032000	ow, that mic drop hurt my ears.
5032000	5033000	I'm very sorry.
5033000	5035000	I had to get the effect for the podcast.
5035000	5037000	I'm sorry. I didn't think it would be that loud.
5037000	5040000	And just if you're worried, there is carpet down here.
5040000	5041000	It's a solid floor.
5041000	5042000	There's like a rug here.
5042000	5045000	So it did not drop on a solid floor.
5045000	5047000	All right, anyway.
5047000	5048000	Uh-oh.
5048000	5050000	Oh, there you go.
5050000	5052000	So isn't that funny?
5052000	5055000	Nifty in chat says, smoosh is breaking our hearts
5055000	5057000	by refusing to make a cameo tonight.
5057000	5059000	And so Dark Soccer just made it happen for you guys.
5059000	5060000	There you go.
5060000	5061000	So that's all.
5061000	5063000	Smoosh will let me hold him sometimes.
5063000	5066000	Blizzard did something really random,
5066000	5071000	and people that claim to be above it all lost their minds,
5071000	5074000	and I found that to be hilarious.
5074000	5076000	And the Lunar New Year event is coming next week.
5076000	5077000	All right.
5077000	5078000	That's all.
5078000	5080000	I don't know if you'll find this hilarious as well,
5080000	5081000	but probably not.
5081000	5083000	But Assassin's Creed Odyssey, you know,
5083000	5085000	I don't know how much you know about this game,
5085000	5086000	but they took the BioWare approach
5086000	5089000	where you could kind of select a lot of different paths
5089000	5092000	for your character and that whole thing.
5092000	5096000	And you can also openly romance whatever gender you want
5096000	5099000	because it's 2019, and so we have that kind of reflection
5099000	5103000	of fluid sexualities in the game.
5103000	5109000	So anyway, the controversy is coming from this first DLC,
5109000	5111000	or excuse me, the latest DLC that just came out,
5111000	5113000	Legacy of the First Blade Part II,
5113000	5120000	because in this DLC, you have a baby with another character.
5120000	5124000	Now, that's not to say that gay folks cannot adopt babies,
5124000	5127000	but you have a baby the old-fashioned way
5127000	5129000	with another character.
5129000	5132000	And so the child grows up and so forth,
5132000	5134000	so some folks are kind of pissed about that
5134000	5136000	because it broke the cannons that they had
5136000	5138000	for their characters before.
5138000	5141000	Now, to be fair, Ubisoft has come out since and said,
5141000	5143000	we missed the mark with the DLC,
5143000	5148000	and they wanted to, according to the creative director
5148000	5150000	named Jonathan Demont, players should not be forced
5150000	5152000	to engage in a lasting romantic relationship
5152000	5154000	with the DLC character.
5154000	5158000	The player can engage to carry on the assassin's bloodline.
5158000	5159000	They can choose to move on afterwards
5159000	5161000	and continue their relationship.
5161000	5163000	So I guess that's something they're going to be changing
5163000	5166000	with the DLC and making that work out.
5166000	5171000	So anyway, not handled the best way to be like,
5171000	5174000	hey, you've got choice, psych.
5174000	5178000	One of the best games that has done this right,
5178000	5181000	I think, is Sims 4, because in Sims 3 or 4,
5181000	5184000	you can be like, can this character have kids?
5184000	5186000	It doesn't ask you what gender they are.
5186000	5188000	Can this character have kids? Yes.
5188000	5192000	How do you want them to, like, whatever?
5192000	5195000	Because it's a video game. It's not real.
5195000	5200000	If they just say, if there's the main character
5200000	5204000	and his male gay romance and they have a baby,
5204000	5207000	just don't explain it.
5207000	5209000	Just don't explain where this baby came from.
5209000	5211000	Oh, we had it the biological way.
5211000	5214000	It's a video game. It's not real.
5214000	5218000	It's not hard in this day and age to figure out
5218000	5221000	how two people of the same gender end up with a kid.
5221000	5223000	There's many different ways to do it.
5223000	5225000	Many, many, many. Anyway.
5225000	5227000	I realize, though, this is a game set in history,
5227000	5229000	but still, come on.
5229000	5233000	You can't do so much of this and then take two steps back.
5233000	5238000	Assassin's Creed is based off of,
5238000	5240000	what's the main storyline? Genetic memory.
5240000	5243000	Where you're going back through your DNA to the memories.
5243000	5246000	That's not real.
5246000	5247000	Good point. That's not real.
5247000	5252000	So, they don't need to make things make sense
5252000	5255000	when it comes to stuff like this, in my opinion.
5255000	5257000	Fair enough. No, I agree. Fair enough.
5257000	5259000	All right. Well, let's move on.
5259000	5261000	Let's get to another segment we like to do here.
5261000	5264000	Every week on the show, we step into the gaming vault.
5264000	5266000	I'm sorry, I did not yet bring in the music,
5266000	5268000	so I don't have the cute little music.
5268000	5269000	Just this week, I'll work on that.
5269000	5270000	I see how it is.
5270000	5272000	I'll work on a proper bumper for next time.
5272000	5274000	Well, technically, tonight's segment is a little different anyway.
5274000	5277000	So, tonight, usually once a week, we have Dark Sakura
5277000	5280000	step into the gaming vault and find a game that she thinks,
5280000	5282000	hey, you kids should be playing this game
5282000	5284000	and find a classic game of the week.
5284000	5287000	But, we mentioned at the end of last year, once a month,
5287000	5290000	so what, in 2017, you did classic consoles, right?
5290000	5291000	Mm-hmm.
5291000	5292000	2018, you did classic peripherals.
5292000	5293000	Mm-hmm.
5293000	5297000	In 2019, she's going to do classic soundtracks.
5297000	5298000	So, Dark Sakura.
5298000	5299000	Specific this year.
5299000	5300000	Specific.
5300000	5301000	8-bit soundtracks.
5301000	5302000	Oh, okay.
5302000	5304000	Oh, I didn't know you were going that far.
5304000	5305000	Don't box yourself in, girl.
5305000	5307000	No, because next year, I'm going to do 16-bit.
5307000	5308000	All right.
5308000	5309000	All right.
5309000	5310000	Because I'm lazy.
5310000	5314000	Well, what is the classic soundtrack of the week?
5314000	5315000	Duh.
5315000	5316000	The Guardian Legend.
5316000	5317000	Great pick.
5317000	5321000	Because it has really good music, but since the game,
5321000	5325000	people don't always recognize the game, you know?
5325000	5330000	And it's got such good music that I really am just like,
5330000	5335000	why do not enough people give this game's soundtrack its due?
5335000	5343000	So, the music was composed by Miyamoto Masatomo,
5343000	5345000	and Sanz Takashi.
5345000	5351000	And it actually, so much of this, I mean,
5351000	5353000	it's still popular today that one of the most popular
5353000	5358000	of the OC remixes is a Guardian Legend remix.
5359000	5364000	It was like the second most popular track they had in 2002.
5364000	5365000	It was pretty crazy.
5365000	5371000	And then even several cover bands,
5371000	5373000	like video game cover bands,
5373000	5376000	have done tunes from the Guardian Legend.
5376000	5378000	But as for the composers themselves,
5378000	5383000	just to give them some attention is Miyamoto did,
5383000	5387000	he actually was one of the music designers for Gardick,
5387000	5392000	and Zanac, and Govellius for MSX2.
5392000	5395000	I'm trying to look at some others that might have been
5395000	5398000	known a little bit better outside of Japan.
5398000	5400000	Xevious Faudrot Saga for MSX2.
5400000	5405000	He mostly did NES, SMS, and NES music.
5405000	5409000	But also, sorry, MSX is what I meant.
5409000	5414000	But is really just like, mostly did the compile stuff.
5414000	5416000	He also did some Godzilla games.
5417000	5425000	As far as Santo, he basically worked on the same music tracks
5425000	5429000	like Govellius for MSX, Guardian Legend for NES,
5429000	5432000	Tombs and Treasure, and Govellius Valley of Doom
5432000	5433000	for the Sega Master System.
5433000	5436000	He also was sound effects designer for Psycho Chaser
5436000	5438000	for PC Engine and Override for PC Engine.
5440000	5444000	But at any rate, I don't know who would argue with me
5444000	5447000	that this doesn't have a place amongst one of the top
5447000	5450000	underrated video game soundtracks out there.
5450000	5453000	I love this soundtrack. It is so underrated.
5453000	5455000	I wish I had found the music for you that's my favorite.
5455000	5457000	It's one of, I think it's like, whatever the point is.
5457000	5459000	I hate the bullet noises in this. They're so loud.
5459000	5461000	So I'm sorry if that's overpowering things a little bit.
5461000	5464000	This is something I'll listen to at the soundtrack in my car.
5464000	5465000	Yeah. Oh no, it's so good.
5465000	5466000	It's pretty amazing.
5466000	5468000	There's some good shout out to OC Remix,
5468000	5469000	because we've been trying to feature them
5469000	5472000	and their talents more and more as we've moved over to Twitch.
5472000	5473000	They've got some great remixes there.
5473000	5475000	They have this orchestral one.
5475000	5477000	It's been up there for years, but I love it.
5477000	5479000	It makes it sound like this game could be a frickin' movie.
5479000	5480000	Yeah.
5480000	5485000	But, you know, we've all ranted and raved about this game,
5485000	5489000	but the thing that, for all of the stuff that this game does,
5489000	5492000	to have such an amazing soundtrack on top of it,
5492000	5498000	it's just like, this is like the Monte Cristo at Disneyland.
5498000	5500000	The perfect sandwich.
5500000	5501000	That's what this is.
5501000	5503000	It's the perfect, perfect game.
5503000	5504000	Do you have like a favorite song?
5504000	5506000	Well, yeah, so I was saying, it's one in,
5506000	5508000	I can't remember the level it is, but it's like,
5508000	5510000	I think the blue background where it's all,
5510000	5513000	it's one of the walking levels, one of the adventure levels,
5513000	5516000	and it's just really chill.
5516000	5519000	It's just a chill piece, and I'll listen to that just over and over.
5519000	5521000	I think my very favorite is the one we just heard
5521000	5525000	with the very first corridor, Area Zero.
5525000	5526000	Yeah.
5526000	5527000	Yeah, I love it.
5527000	5530000	And I like this music too, because it sets the mood for the game.
5531000	5533000	And also, you find Lolo.
5533000	5534000	You do?
5534000	5540000	Yeah, but again, it's just one of, I think,
5540000	5542000	the best soundtracks there are.
5542000	5546000	And like I said, you know, now I guess a month ago,
5546000	5549000	this segment is going to be to highlight soundtracks
5549000	5551000	that you might not be familiar with,
5551000	5554000	or might not have thought of amongst the best,
5554000	5556000	but they really deserve the attention.
5556000	5558000	So you probably will not be highlighting Super Mario Brothers,
5558000	5559000	because everybody knows that one.
5559000	5562000	Everyone knows it, or the Zelda games, or Mega Man.
5562000	5563000	Okay.
5563000	5566000	You know, I'm not going to go in those directions.
5566000	5570000	I'm going to go with the stuff that people don't often think of.
5570000	5573000	And with as much as we talk about Guardian Legend,
5573000	5575000	usually we're talking about how it plays.
5575000	5577000	Yeah, and to be fair, you know, again,
5577000	5580000	we've been doing the Classic Game of the Week since Episode 250,
5580000	5582000	and I'm sure this was one of the first ten.
5582000	5584000	I don't think it was the first.
5584000	5585000	I don't think it was the first.
5585000	5592000	I think you did the game with the witches that you love, scrolling.
5592000	5594000	Not Cotton. I didn't do Cotton, did I?
5594000	5596000	I thought you did do Cotton was one of your first picks.
5596000	5597000	Hold on, hold on.
5597000	5598000	But I'm looking at it.
5598000	5599000	It's Fantasy Zone.
5599000	5600000	It's Fantasy Zone.
5600000	5601000	It's Fantasy Zone.
5601000	5602000	Oh, it's Fantasy Zone?
5602000	5603000	Okay.
5603000	5604000	Yeah.
5604000	5606000	But Guardian Legend had to have been one of the first ten.
5606000	5608000	Guardian Legend was six episodes in.
5608000	5610000	Okay, so yeah, we haven't talked about it in several years.
5610000	5612000	I can't believe I did Blazing Star before that,
5612000	5614000	but I love Blazing Star in Kid Dracula.
5614000	5615000	I think it was one of those things,
5615000	5617000	you were saving Guardian Legend for a week,
5617000	5619000	then you couldn't come up with anything else,
5619000	5622000	and six weeks in, you couldn't come up with anything else.
5622000	5624000	Well, then you did the week after.
5624000	5625000	I did.
5625000	5626000	And then Loki did the week after that.
5626000	5628000	You probably weren't here for a little bit.
5628000	5630000	You probably took a break, so it happens.
5630000	5633000	All right, anyway, anything else to say about the soundtrack here
5633000	5636000	for our Classic Soundtrack of the Month, the Guardian Legend?
5636000	5641000	I am still super pissed that the fan remake got C&D'd, because...
5641000	5644000	Oh, yeah, there's some footage of it out on YouTube, you can see.
5644000	5647000	But I just wish that they would just still do it under the table
5647000	5648000	and release it anyway.
5648000	5649000	Well, you know.
5649000	5650000	That's Lolo.
5650000	5652000	Isn't it Lunar or something?
5652000	5655000	I don't know, but I just bought Lolo because it looks like Lolo.
5655000	5656000	It does.
5656000	5658000	But anyway, all right, I'm going to go ahead and kill the music there,
5658000	5660000	take it back to us in the studio.
5660000	5661000	There it is, your classic soundtrack.
5661000	5664000	Everybody's reading me because it says Classic Game of the Week on the side.
5664000	5665000	I didn't want to ruin it.
5665000	5668000	If I'd put Classic Soundtrack, you would have known you'd get a soundtrack tonight,
5668000	5669000	so just deal with it.
5669000	5670000	All right, anyway.
5670000	5671000	You wrote you.
5671000	5673000	Without any Roxy, thank you.
5673000	5676000	All right, I love the Guardian Legend, it's a great soundtrack.
5676000	5679000	Anyway, we're going to take a little break here in studio,
5679000	5681000	but what's awesome about tonight,
5681000	5684000	so what we've been doing on Twitch the past few weeks,
5684000	5686000	because Dark Soccer has been working Sundays,
5686000	5689000	she's kind of had a segment that fills in here,
5689000	5691000	she's been doing her Classic Game of the Week as a segment.
5691000	5693000	Well, tonight we have something very special.
5693000	5697000	We actually have a viewer video that's going to be talking about MAGFest.
5697000	5700000	So sg100matt sent us a video, and I'm going to play it for you guys now.
5700000	5704000	He did a great job on it, where he's actually going to take you guys to MAGFest
5704000	5706000	to get to experience a little bit of it.
5706000	5711000	And I love this, and with Jamie hopefully coming back to the show full time in March,
5711000	5714000	if everything goes her way with the work situation,
5714000	5720000	I really want to invite other people to kind of help build this segment with us,
5720000	5722000	like a little halfway point during the show,
5722000	5724000	so we have a chance to get up and refill our waters
5724000	5726000	and use the restroom and all that stuff,
5726000	5729000	and hopefully we can feature other Twitch streamers.
5729000	5732000	We can feature maybe some indie games or some other things.
5732000	5739000	So anyway, I'll let sg100matt take it from here with a special look at MAGFest,
5739000	5741000	and we'll be back after this.
5741000	5744000	Hello, LR and VOG Network.
5744000	5746000	This is sg100matt.
5746000	5750000	I am sending you the first ever video email to the mailbag.
5750000	5752000	Now that the show is on Twitch,
5752000	5756000	I figure this will be a fun way to send an email.
5756000	5760000	It also gives Rob's voice a little bit of a rest so he doesn't have to read anything.
5760000	5763000	So for years you've heard me and along with many others talk about MAGFest.
5763000	5767000	I know that I've called in several times over the years to talk about it,
5767000	5771000	and the one thing I always notice is that I've had a hard time articulating
5771000	5775000	and explaining what MAGFest is all about.
5775000	5777000	Now that we have this wonderful platform and video,
5777000	5781000	I figured why don't I just show you what MAGFest is all about.
5781000	5785000	Now over the course of the weekend I took some pictures and shot some video
5785000	5790000	to kind of really show what my experience is there.
5790000	5792000	Now don't worry, podcast listeners.
5792000	5795000	I'll do my best to explain what I'm showing.
5795000	5797000	But enough about me. Let's get to it.
5797000	5801000	So MAGFest is short for Music and Gaming Festival,
5801000	5803000	and it takes place just outside of Washington, D.C.
5803000	5806000	at the Gaylord National Hotel and Convention Center.
5806000	5810000	The show runs 24 hours nonstop from Thursday to Sunday.
5810000	5814000	The place hosts the panels, concerts, and various forms of gaming and fandom.
5814000	5816000	The show is run by fans for fans.
5816000	5821000	It's not corporate run, and none of the major studios or console makers are there.
5821000	5823000	It has a strong, independent feel,
5823000	5827000	and almost feels like a big video game party with your friends.
5827000	5830000	The first thing I'm going to talk about is the music portion of the festival.
5830000	5832000	Throughout the weekend in the Grand Ballroom at the Convention Center,
5832000	5836000	various video game cover bands and chiptune artists took the stage.
5836000	5839000	This year's group of talent was a stacked roster of artists,
5839000	5842000	such as MC Frontalot of the Tiberian Sons,
5842000	5845000	featuring Command & Conquer composer Frank Klepacki,
5845000	5847000	and friend of the VOG network, Megaran.
5847000	5852000	There was also Chiptune Rave hosted by a slew of DJs.
5852000	5855000	One concert that I really enjoyed was the Bit Brigade,
5855000	5857000	who played the entire Mega Man 2 soundtrack,
5857000	5860000	while a player speedran the entire game.
5860000	5862000	It was definitely a fun experience.
5867000	5870000	Now the last concert I really enjoyed was performed by Bernalfoss.
5870000	5873000	He performed at the Gaylord Hotel Lobby Bar,
5873000	5875000	which was the first for the festival.
5875000	5879000	It was really cool to kind of see him perform in a piano bar sort of environment.
5892000	5894000	Now the cute aspect that I like about MAGFest
5894000	5897000	is the music wasn't just dedicated to the concert halls.
5897000	5900000	In these little squared off spaces known as Jam Pods,
5900000	5904000	people can bring in an instrument or DJ setup to just jam out.
5904000	5906000	It's kind of like MAGFest's take on street performers,
5906000	5911000	but it's just regular attendees playing a DJ set or an artist covering gaming tunes.
5913000	5915000	Moving on to the rest of the festival.
5915000	5918000	One of the big draws to MAGFest is downstairs at the Expo Hall.
5918000	5921000	The Expo Hall is home to the Vendor's Hall,
5921000	5923000	the MAGFest Indie Games Showcase,
5923000	5926000	as well as the console, free play, and arcade room.
5926000	5929000	Now both the arcade and console room are open,
5929000	5933000	free to play, 24 hours non-stop during the duration of the festival.
5933000	5938000	There are over 100 arcade machines that are provided by collectors and vendors
5938000	5941000	from around the area, and they're all set on free play.
5941000	5943000	No quarters or tokens required, and again,
5943000	5946000	they're running 24 hours the whole weekend.
5946000	5950000	If you have an itch to play a game at 3 AM, you certainly could.
5951000	5953000	So the arcade hall was split up into different sections.
5953000	5958000	There was an area called Candyland that had a lot of Japanese-style sit-down arcade cabinets
5958000	5962000	which had various fighting games and bullet-hell shooters all loaded onto them.
