start	end	text
6087404	6090886	And those are actually kind of hard to find, the games where that happens.
6091006	6094889	Because, like, yes, you have voice chat in WoW, but nobody uses it.
6095009	6096310	I'm telling you, nobody uses it.
6097430	6098271	I didn't even know it was there.
6099032	6100753	And it's not in the public chat channels anyway.
6102774	6103074	Okay.
6103134	6104075	Ooh, we have one from Silk.
6105854	6106054	Ready?
6107595	6107775	Yes.
6126304	6130467	Anyhow, I started to play this game and even if it is an older game, I really love the story.
6130887	6137012	The options where you can choose how to respond and that it actually has an effect on the story of the game is something that I really enjoy.
6137412	6140834	It makes me want to replay the game and try different things just to see how the story changes.
6141355	6150201	Perhaps I'm also just happy to see some proper blood-sucking vampires instead of the woo me and my curse and stare at you while you're sleeping glittery twats that seem to be ruling the media now.
6150701	6151182	I love her.
6153023	6155685	For the record, the email's titled non-sparkly vampires.
6157170	6163434	Did you ever start playing a game thinking it would be okay, but nothing mind-blowing, but the more you played it, the more you loved it?
6164395	6165155	Guardian Legend?
6166416	6169298	Because when you start playing that game, it's like, oh, I'm shooting shit.
6169358	6170259	Whoa, there's an RPG!
6173734	6181141	Have you ever started a game thinking that it would be okay but nothing mind-blowing, but the more you played it, the more you loved it?
6182662	6187646	Mr. Final Fantasy XIII No, but those games I kind of already had the bar set high.
6187687	6189808	I'm really trying to think of something kind of outside the norm.
6190469	6191450	Let me think on that for a minute.
6193336	6217912	I'm trying to think of any others actually when I got back into WoW yeah I gotta say World of Warcraft actually kind of jumps out at me when I first played WoW I didn't think it was really all that and I didn't think I was going to get that into it but you know when all my friends were playing and it became a lot more of a chat room with fire spells and swords so to speak I think that was actually a game for me when I started questing
6219681	6222324	I guess you could say VVVVV that I played this week.
6222564	6224806	I didn't think I was going to like it as much as I did.
6226167	6229950	Well, I knew I was going to like Portal 2, but I didn't know that I'd like it as much as I did.
6230791	6233413	So, yeah, I mean, I'm sure there's a bunch of games.
6233973	6236556	But I'm still loving this show and I'm still waiting for my biscuits, Rob.
6238037	6238837	I'll work on that.
6238897	6240239	They're with the tea and crumpets.
6241820	6242180	P.S.
6242320	6244642	If you're an MMO player, you'll love the attached image, I hope.
6244742	6245423	Okay, let's have a look.
6247011	6248672	The Nine Circles of MMO Hell.
6249412	6249752	You know what?
6249792	6253394	I'm actually going to save this and post it on our Tumblr.
6253474	6255315	There you go.
6255776	6258357	OrangeLawnsRadio.tumblr.com Image.
6259137	6260978	I'll do MMO Hell.
6260998	6262699	You can do it after the mailbag segment.
6262959	6265060	I'm just saving the image because I'm going to close the email.
6266561	6268082	So, bite my behind, Rob.
6269282	6269583	You ready?
6270543	6271263	Newsflash!
6271964	6273565	The Tester Season 3 is casting.
6273645	6274265	Info below.
6274365	6275666	I'll be watching, not auditioning.
6275706	6276026	Robaba.
6276764	6283772	Oh yes, I heard about this on Twitter this week and I sent it over to LokiOLR and I was like, Loki, weren't you saying something about you'd like to try a new career?
6283792	6290139	Well, I will link it in the chat room and if any of you make it on there, plug the crap out of us.
6291380	6292741	Actually, I want to say...
6294356	6298522	They were saying that the prize for the winner this season isn't like a testing thing.
6299042	6301305	It's like actually a role in production.
6302066	6305010	So they're kind of up in the ante on prize this year a little bit.
6305030	6306192	Okay, Jamie's trying out.
6306973	6307433	For real?
6307453	6308214	Why not?
6308234	6309356	Oh my God, you should.
6309516	6310097	Oh my God.
6310898	6311458	Sign up now.
6311498	6311839	Why not?
6312796	6315258	Look into it and see if the prize is something you'd actually want.
6315579	6321766	Well, because if they can get me in any level of art production, that says my career right there.
6322466	6327132	I believe the prize is like actual on the production team this time.
6327532	6328814	And it better not be peon.
6329995	6331697	Because I actually have some skills to offer.
6332062	6333903	DarkSakura, DarkSakura, DarkSakura, DarkSakura, DarkSakura, DarkSakura,
6361092	6362753	DarkSakura, DarkSakura, DarkSakura, DarkSakura
6385180	6388581	I just... It's kind of crazy, but I love it.
6388681	6389462	I hope you get on.
6389702	6391002	I actually watched The Tester.
6392583	6395404	Might I go so far as to say I enjoyed the last season of The Tester.
6395424	6403907	I think they could do a little more with it, but... You might also want to watch the show to see... Oh, they give you an option for them not to share your shit.
6403967	6404407	That's good.
6404827	6406868	You have an idea what to expect just saying?
6410971	6413413	Oh man, I can't wait.
6414034	6415335	I hope DarkSakura gets on the show.
6415735	6418798	Of course, that means she won't be on OLR for a few weeks while they're taping the show.
6420199	6421340	Party at Jamie's house.
6422001	6424683	Well, yeah, but I'll be famous and you won't.
6426705	6429167	Wow, you'll get booted off first.
6429367	6430148	No, I won't.
6432129	6433250	It doesn't like my password.
6434491	6435452	All right, let's move on.
6435853	6437354	Do we have any more emails or is it the last one?
6437774	6438495	All right.
6440615	6441516	DarkSakura, DarkSakura, DarkSakura
6465672	6470715	As Loki predicted, GameStop has decided not to honor the price guarantee thing, which does not surprise me at all.
6470815	6475238	In fact, I'm not even sure I'll be able to get the 80 back from where I purchased it.
6475919	6483784	I bought it at Best Buy, and they didn't know about the price drop or didn't say anything about not honoring their policy when I bought it, but I have this feeling that it won't work.
6483884	6488106	Either way, in my mind, it's totally worth it just for the GBA titles alone.
6488587	6490408	I really miss the Game Boy as a platform.
6490928	6495591	I never really got into the DS like I did with the Game Boy and ended up selling the one I had three years ago.
6496492	6499154	So I've been out of the DS world for three years.
6499634	6500474	That's where you come in.
6500875	6508460	I'd like to keep my DS for more than just retro GBA titles I bought it for, so I would like to hear some of your favorite DS games that might suit my interests.
6508980	6513563	What do you recommend as games that appeal to everyone and what specific titles would interest someone like me?
6514143	6515824	I'm not a fan of RPGs anymore.
6515884	6516325	Oh, hang up.
6516365	6516705	No, I'm kidding.
6517245	6518666	Since I don't have the time to play them.
6519206	6521348	I'm more into shooters, arcade games, and platformers.
6521388	6524249	I plan on getting Geometry Wars Galaxies, a Castlevania title.
6524289	6524930	Which one is best?
6525370	6526150	Oh, what was that one?
6526511	6527831	Order of Ecclesia was really good.
6529032	6532375	Um, Retro Game Challenge, WarioWare Touch, Trauma Center 2.
6533175	6536938	I picked up Ocarina of Time, obviously, and Plants vs. Zombies download version so far.
6537298	6540601	Oh, Mario Kart DS is my favorite DS game from when I owned one before.
6541482	6544244	Um, I like, I got Puyo Pop, I mean Puyo Puyo.
6544984	6548347	I've got Osutatakai Oendan, um, or you could get Elite Beat Agents.
6548547	6550088	I actually really prefer the Japanese one.
6551029	6553450	Um, what else is in my thing?
6553551	6557193	Oh, yeah, um, what was that Professor Hatsworth game?
6557313	6558074	Professor Layton?
6558374	6559514	No, it was Hatsworth.
6561355	6565357	It's like a combination puzzle game and investigation game.
6565757	6566637	It's really interesting.
6566757	6568538	Yeah, I kind of know what you're talking about, yeah.
6568618	6569458	That game was pretty fun.
6569478	6570579	I don't know.
6570719	6571179	What else, Rob?
6572179	6573380	He named a lot of them.
6573440	6575861	I mean, gosh, you got a whole full plate there.
6576161	6578522	Retro Game Challenge was one of the ones that came to my mind, too.
6580943	6583564	Really good games on DS.
6584024	6586925	I need more time to think.
6588159	6589940	I should just go grab my DS case and see what's in it.
6590140	6590701	I know, right?
6590781	6593102	I'm like, I can't see my DS collection right in front of me.
6593923	6596825	A lot of people are really into the Pokemon games.
6596845	6597866	I play a lot of Cooking Mama.
6599507	6602990	Since he's talking about Trauma Center, Cooking Mama's like that with food.
6603971	6604831	So it's really fun.
6604972	6606753	And don't worry, Mama will fix it.
6607614	6610196	I liked the Kirby game where you draw the lines.
6611196	6611737	Oh, um...
6613131	6614392	and Kirby's... Epic Yarn.
6614892	6616152	No, no, that was the Wii game.
6617593	6620374	It was a different Kirby game where you would draw all the lines and stuff.
6620414	6621175	I don't remember.
6621195	6622975	You're making me think.
6623876	6624876	What am I, a talk show host?
6626437	6629618	Some of the old school, like even the Mario 64 port is actually really good too.
6630238	6632499	Oh, Elite Beat Agents says Dungeon Buster and Chat.
6632539	6633320	Well, I said that.
6633480	6637462	So I said Oendan, but I said you can get it as Elite Beat Agents, although I prefer Oendan.
6637482	6638182	Mm-hmm, mm-hmm.
6641224	6642205	Oh, there's Ragnarok.
6643085	6645247	That's RPG though.
6646167	6646768	I liked it though.
6646868	6648529	Breakman Civilization Revolution.
6648589	6649450	I really liked that game.
6649950	6652372	But I liked it on the consoles.
6652452	6654394	I don't know how well I should get my DS custom look.
6655694	6657496	Then again, I've got like a box of games.
6657696	6660098	So I'll lend you one.
6660538	6662880	Maybe I'll sell you some of them.
6664031	6692155	I might not be listening live because of work early in the morning I'm on the east coast so if the chat has any good recommendations too I would love to hear those in the podcast which we just did oh he said he's not into RPGs but the Final Fantasy 4 remake is so fucking good like you might want to think about going back to RPGs for that keep up the great work with the podcast it's still my favorite out there by a long shot thanks guys SonicM88 oh and by the way I am playing Final Fantasy 3 and it's pretty good on the game see there you go
6694472	6695013	Oh, great.
6696254	6697214	My profile's made.
6698335	6699636	Oh, I love what Zether says here.
6699716	6700777	Meteos is awesome.
6701758	6702959	Meteos was an amazing DS game.
6702979	6703899	Electroplankton was kind of fun.
6704600	6705921	That was a great DS game.
6707442	6708343	All right, is that it for emails?
6708863	6709144	Yeah.
6709404	6710805	And by the way, I've got a profile now.
6711125	6713607	Mailbag at orangeloungeradio.com.
6713627	6715729	I ain't got a picture, but I'll link it in the chat room.
6715769	6716810	You should put a picture.
6716850	6719492	You need to start filling it out with why you need to be on the tester.
6720272	6721293	I will, but I'm linking it already.
6721333	6722094	I need a job.
6724551	6732517	you have to talk about how much you love Sony and how you've been a gaming girl all your life I bet you'll get on I bet you will
6735000	6735620	Alright, anyhow.
6736141	6736681	Moving on.
6736801	6738242	We got some more news stories for you guys.
6738322	6739303	Oh, we got the FUs of the week.
6739683	6740283	We gotta do those.
6740684	6749129	As much fun as I would like to join the tester, I would hate to have to move to LA to be a game tester.
6750050	6753932	Yeah, you do know you have to move to Santa Monica to be a game, to do the production, right?
6754612	6755053	She doesn't care.
6755073	6755753	I don't care.
6757074	6758055	She'll be closer to Disneyland.
6758755	6759936	We'll be closer to Disneyland.
6760757	6766341	But see, the problem is though, it's a judging panel that decides whether... Or is it challenges?
6766461	6766721	I don't know.
6766761	6767582	I've never watched the show.
6768823	6771725	It's weird challenges that sometimes have nothing to do with games.
6771745	6778510	Yeah, it's like we challenge you to like, you know... It's not like... See, because when I first heard about the tester, I was thinking it's that...
6779751	6788800	I own more than 40 different video game systems and have decades of experience I'm also a graphic designer with a focus on video games and an experience in 3D design and Maya I could use a job!
6808547	6809068	How's that sound?
6809468	6830810	You should give a shout out to the podcast too Just for when you uh Just for, you know When I am on I'll do it in my video Oh my god, I gotta do a video I better be super cute Better get your hair did I need to get my hair did, my nails did
6831678	6833320	They're still naming DS games in the chat.
6833940	6834761	Zether says Contra 4.
6834801	6836883	That was pretty good.
6837584	6842028	Breakman in chat says, Loki couldn't do the tester because Loki doesn't take orders.
6842128	6843029	Loki gives orders.
6843609	6844170	Mwahaha.
6845311	6846332	There you go.
6847773	6848714	What are you looking at there?
6848734	6850575	Are you doing a Tiny Tower cheat?
6850696	6851396	Is that what's happening?
6852998	6856841	Did you cheat and you have 6 million gold in Tiny Tower, you damn cheater?
6856881	6857382	What the crap?
6858160	6858860	I am a cheater.
6858880	6860241	You are a damn dirty cheater.
6860261	6860621	How did you do it?
6860741	6861621	No, I'm not cheating.
6861701	6862101	I don't want to know.
6862121	6863281	I have a jailbroken device.
6863301	6864842	I can do whatever the fuck I want.
6866402	6867642	And it's completely legal.
6867902	6872884	You're a lying, cheating sack of shit.
6873004	6876224	That's why you're not going to be a fucking game tester.
6877405	6878905	Because you can't play by the rules.
6878945	6879385	Bullshit.
6879545	6880805	I could be an awesome tester.
6880865	6881326	You know what?
6881406	6882926	In fact, there was a thing that I saw.
6883286	6884787	My picture, and it's cute.
6884867	6885547	Alright, there you go.
6885768	6887249	There's a... I mean, shit.
6887429	6892592	I've played so much Grand Theft Auto, I could easily be a tester for their goddamn multiplayer stuff.
6892992	6897255	I know the ins and outs of all of their Grand Theft Auto games, including the PSP.
6897555	6899416	I know shit that they probably don't even know.
6900417	6905580	But then, again, I don't want to compete on a show where I have to compare images to see what's different.
6905840	6907701	If I wanted to do that, I'd buy a DS. ...
6911986	6917074	Alright, Breakman says when you apply for the job, DarkSakura, just tell them you know the Bobby Blackwolf.
6917094	6918075	You'll be hired on right away.
6918315	6918736	That's true.
6918816	6921300	After all, he is a trending topic in Sacramento this evening.
6921640	6921861	Yep.
6924665	6926648	Alright, let's get to the FUs of the week.
6942983	6947595	Um, my FU of the week goes to me not having a copy of Black Matrix.
6948978	6950061	I found it on eBay.
6950101	6951184	No one will buy it for me.
6951244	6951665	Boo hoo.
6953531	6968343	My FU of the week goes to Loki for cheating on Tiny Tower and I hope his tower, because it's so cheaply made, I hope that the material that his Tiny Tower was made out of just collapses on itself and the whole building just implodes.
6969043	6970865	Have the blood of his bitizens on his hands.
6971085	6974667	Exactly, and you'll have the blood of all those bitizens on your hands.
6975408	6979011	Otherwise, I give an FU to tacos for being so delicious and making me fat.
6980172	6980412	Loki.
6982393	7006072	I guess my F you would go to the tester because if I were to win the tester I'd end up working at Sony and I'd look at the sheet of things that they want me to test I'm sorry, I'm supposed to test to see if this game doesn't suck I don't know, I got nothing I'm not really mad at anything
7008371	7011393	It was surprisingly easy to do with the jailbroken device.
7013314	7014015	I might add.
7015335	7017417	Download a file, copy it over, done.
7017817	7019238	And it didn't even erase my progress.
7019318	7020799	It just added six million money.
7021179	7024801	All right, so I see that DarkSakura has a profile.
7024861	7025922	Like, how do I vote for you?
7026062	7028143	Oh, there's a big clock in the corner.
7028243	7030285	Voting begins in 16 days.
7030345	7032246	Like, I can't actually vote for you yet, I guess.
7034420	7034820	DarkSakura.com
7060462	7080863	I've added a second picture of what my hair looks like curly You know, it just occurred to me Derek H, I think on Dead Pixel Live last year had the casting dude for the tester on his show You need to talk to Derek and get dude's email address and just be like, yo, cast me That's what you need to do You need to just bypass this whole system right here
7083704	7085065	Go directly to show.
7085565	7086505	Do not pass go.
7087366	7088847	We should all be on the test.
7088987	7090067	No, we're not all going on.
7090287	7091868	I'm not going on that goddamn show.
7091948	7093309	Come on, it'd be hilarious.
7093369	7100072	If I go on the show, it is to be a judge because I would enjoy nothing more than the judge, the two of you sitting up there getting ready for elimination.
7100132	7102613	I think that guy doesn't know shit about testing games.
7103594	7106295	He wasn't even a trending topic in Sacramento.
7107793	7110354	Well, Loki, you're a goddamn cheater at all your video games.
7110394	7111895	Explain why you should be on the tester.
7112095	7116217	Because I know where to find the information that you're looking for.
7116478	7122361	I know to find all the exploits and backdoors for your games and how to get around this stuff.
7122701	7125242	If you don't fix this shit, other people are going to do it.
7125602	7127723	DarkSakura, your Kinect is still in a box.
7127803	7129264	Why should you be the tester?
7130045	7131465	Because my Kinect's in the box.
7131706	7133807	My move is fucking on the TV.
7134087	7136188	That is why I need to be a fucking tester.
7138217	7144038	Because we have a goddamn Gran Turismo setup built in our house where we can play in a fucking race car.
7144218	7145399	Is your name DarkSakura?
7145419	7145939	That's funny.
7145959	7147359	You don't sound like DarkSakura.
7148739	7152020	Well, because we have a $400 rig setup to play Gran Turismo 5.
7154981	7160982	And that we've built seats to play the setup out of the seats from a Honda Prelude.
7161342	7161842	Two of them.
7162862	7165543	I have every Sony system ever made.
7165563	7166663	Okay, here...
7167970	7173637	This is fine radio and all, but there's a part of me that is legit worried you're actually going to get on this show.
7174218	7176100	I have legitimate concerns.
7176141	7178203	If I get a job out of this, fuck yeah.
7178564	7180887	But this could also end up very bad.
7180967	7182529	You could end up being the bitch.
7183049	7185352	I've seen you go without eating for some time.
7187293	7197757	It is not going to be pretty if you have to do something Yes, Rob knows what low blood sugar Jamie is like And you might have to do something that you don't like on this program And I am very worried I should sign up too, it would be hilarious Like what?
7197837	7200178	Play Imagine Babies?
7200358	7215463	Okay, one last season they had some fucking challenge where they were out there doing army stuff Okay, I know, I know what will piss you off Working together as a team with people who are idiots That is going to piss you off beyond belief See, you're already fretting
7215763	7220326	No, I will tell you this, because I worked with idiots at my job and I hid it very well.
7222347	7224149	I know how to be a team fucking player.
7226390	7226891	I am good.
7227011	7227131	Really?
7227151	7228532	Can you teach Loki a thing or two?
7229852	7230033	No.
7230373	7231534	I am my own team.
7232314	7234476	No, because his team is the voices in his head.
7235917	7238198	I can take a picture of the vault.
7239850	7240730	and show it to them.
7241531	7244412	This is why you need to have me because I've played all this shit.
7244492	7250654	Legitimate concern that you actually may make a case for yourself to be on this show and you will actually be on this program.
7250674	7251414	Look at this face.
7252235	7253315	Look at this adorable face.
7253355	7254215	I try not to.
7254956	7255316	Shut up.
7255636	7256496	I gave you ice cream.
7256516	7256876	Look at me.
7258297	7258737	I'm looking.
7259597	7260278	I'm serious.
7261338	7262418	I am for real serious.
7262599	7263579	I want to be on the tester.
7264807	7268428	You do realize this is for a minimum wage job in Santa Monica, right?
7268488	7269328	It could be.
7269428	7272389	But know that Annie's up this season.
7272449	7273970	It's a production job this year.
7274190	7276010	Which means that I would be... A production job?
7276171	7276931	So what's that mean?
7276951	7277911	I'll put it this way.
7278031	7290475	Production is like... For a graphic designer, production would be like color editing, color correction, adjusting textures, that type of thing.
7290575	7291915	Here's a bunch of spindles of discs.
7292015	7292936	Here's a bunch of cases.
7293016	7295176	We need you to produce the finished product.
7295436	7295616	No.
7295976	7296716	That's not how it works.
7297417	7301397	Anyone that's in production is in the actual building part of the game.
7301557	7303438	You may be crunching numbers or doing some data entry.
7304438	7308359	It would be something that's the equivalent of the job that I was just fucking doing.
7309239	7311380	Except I actually have skills to bring to the table.
7311500	7313000	They could put me to work in art production.
7313880	7314460	And guess what?
7314680	7317701	I would be good at it because that's what I'm trying to do with my life.
7318865	7319266	You know what?
7320408	7323433	If I sign up for the tester, I'm going to do it in my costume.
7325339	7327440	Why are you people trying out for the tester?
7327660	7329380	You used to make fun of this show two years ago.
7329400	7330101	It's the whole point.
7330121	7330901	Don't you understand?
7330921	7331821	Because I need a job.
7332841	7333742	Don't you understand?
7333782	7334502	That's the whole point.
7334522	7335882	That's the funniest part about it.
7336463	7343485	What better way to get back at something that you hate than to be part of it and then be a complete asshole on it?
7343985	7344905	It would be awesome.
7345005	7346126	Rob, for real though.
7346246	7347146	I don't want to win.
7347506	7349147	I just want to be on the show.
7350583	7351804	And see, I want a job.
7352805	7353625	Thank you, Frisbee.
7353765	7356767	I want to be the very best that no one ever was.
7357128	7357928	I want a job.
7358268	7361191	Hey, any of you people listening to the show, I'm talented.
7361431	7361991	Hire me.
7362852	7372178	Because honestly though, because I was thinking about it, I would, if the job equivalency is what I'm thinking of, I would be making about what I made at my old job.
7372238	7374180	Will you be able to tighten up the graphics on level three?
7375621	7375981	I could try.
7376814	7377735	No, hold on, hold on.
7377755	7379876	I want to just show DarkSakura this real quick here.
7380296	7381737	DarkSakura, I just want to show you this.
7381777	7383297	I mean, look at all those douchebags.
7383338	7386419	You really are going to have to team play with them.
7386459	7389681	You do know that, right?
7405103	7412371	Well, see, as Rob, as the one of superior intellect, I would actually manipulate them into failure.
7413051	7414273	Pick one of the contestants.
7414533	7417256	Congratulations, 8-Bit Mickey.
7417336	7421040	These 12 gamers will be living together in PlayStation Paradise.
7421200	7424263	I am one with the video games.
7424484	7426285	I want to hurt him so bad.
7427745	7431409	I just have to murder these people.
7431449	7433411	They had to do a dancing competition.
7433472	7435774	Are you going to do a dancing competition, DarkSakura?
7435814	7437977	I got rhythm.
7438037	7439098	I'll do all para para.
7439358	7440880	She didn't even miss a beat in saying that.
7440940	7441441	I got rhythm.
7443062	7451424	Dude, have you seen... Now, this is hilarious because Joystick decided that they made casting videos for each one of the people on their staff.
7451504	7451805	Nice.
7452465	7452925	Well played.
7452945	7454285	They have some really funny ones.
7454365	7454905	Well played.
7455366	7456146	No, seriously, Rob.
7456246	7456986	I'll do Parapara.
7458066	7458426	Alright.
7458807	7459847	It's fine.
7460947	7461867	I hope you get the job.
7462088	7463648	I legit hope you get the job.
7463668	7466269	We'll bring the video camera and show off my bemani.
7467549	7470571	and all this other quality PlayStation shit I have.
7471252	7480898	I mean, quality PlayStation products that I've spent my good hard-earned money on and my first generation PlayStation 3 so I can say, look, Linux!
7481618	7484240	I mean, look at PlayStation 1 games.
7485441	7489323	Zether is linking me to a YouTube saying this was a tester contestant.
