start	end	text
14078	23235	Tonight, August 7th, 2011, the Vita gets bumped to 2012, the Humble Indie Bundle adds even more games, and can you soon make a living playing Diablo 3?
31468	38673	Hello my friends out there on the internet and welcome back to another week of the show where every gamer has a voice, Orange Lounge Radio.
39133	42575	My name is Rob Roberts and I'll be joining you over the next few hours with my co-hosts.
42936	46478	First off, the one, the only, Dark Sakura, Jamie Summers.
46618	46898	Hi.
47238	47839	How are you, Jamie?
47939	49460	I'm a culinary fucking goddess.
50580	51561	Congratulations.
51841	53522	What makes you a culinary fucking goddess?
53602	55804	Because I'm sharing one of my favorite recipes with you guys today.
56135	57216	And what would that recipe be?
57496	58137	Monkey's brains?
58417	58537	No.
59958	63941	While, you know, famous in Cantonese cuisine is rarely seen in the United States.
64722	65222	Touche.
65302	66523	Or in Washington, D.C., I should say.
67564	76771	No, they are blue potatoes baked instead of fried, but baked with garlic, marjoram, oregano, Himalayan salt, pepper.
77371	78292	Himalayan salt?
78392	79953	I asked for Mongolian salt.
80013	80834	God damn it.
81114	84577	Lots of garlic and plenty of Italian cheeses.
85197	87358	Oh, well, garlic salt always makes things better.
87378	89259	Okay, I will, I will, but I've got to set up the show first.
89939	90179	All right.
90959	95761	Say hello as well to less of a culinary goddess, but still pretty awesome, Tech Master Loki.
96802	97302	How's it going?
97642	98002	I'm good.
98022	98642	How are you, Loki?
99082	99583	Pretty good.
99843	100103	Yeah?
100363	100983	What's new with you?
102424	102844	Not much.
102944	105245	Has there been any culinary works in your life?
105305	110327	I know you used to deep fry everything in good times.
111347	113188	Yeah, I haven't really done any deep frying in a while.
114398	114995	Well that's too bad.
116491	138878	Alright, well, let's start talking about games with you guys in our chatroom at chat.orangeloungeradio.com If you've never joined us for a live show, you should sometime Sunday nights, 6 o'clock Pacific, 9 o'clock Eastern, right after the Bobby Blackwolf show at AllGamesRadio, www.allgames.com And, yep, we have our chatters there Let's see, TigerClaw says Rob, did you just say monkeys?
139078	146100	Then you must have seen the new Planet of the Apes Nope, didn't see the new Planet of the Apes I heard it was number one in the box office, so it did way better than everyone thought it would
146300	147401	And they threw lots of number two.
147781	151043	I used to hate those movies actually growing up.
151183	155785	Like, I think my dad or my brother or somebody really liked those movies and I always thought they were terrible.
156025	156866	Like the Charlton Heston.
157146	158647	I really don't like Charlton Heston.
159027	163429	Like it has nothing to do with the politics side or the gun, my cold dead hands on stuff.
163749	166311	Just, I just, God, I don't know.
166391	168832	Like something about him in movies just irritates me.
169192	169653	I don't know.
170133	171974	I'm sure there's a lot of people that would disagree and that's fine.
172674	173835	Sometimes we disagree on this show.
174244	174784	DarkSakura, DarkSakura
198086	204771	There's also, I saw Bobby posted on Twitter, there's a Bad Dudes reference in there somewhere.
204831	207953	Like a bad enough dude to take on, or to save the president or whatever.
208314	209855	Was that line from the original Bad Dudes game?
210235	211316	Yeah, it's pretty funny though.
212297	216380	And I actually didn't play any Groove Coaster.
216800	217320	That's too bad.
217700	218101	It's fine.
218641	219422	I played a lot of WoW.
220483	222744	Mostly because I've been forever alone.
223805	224886	My husband's gone.
225646	226467	He'll be back next week though.
227318	228839	You've been neglecting your consoles.
229619	230019	A little bit.
230039	234242	I actually was going to go in and play the Saturn, and I was like, I gotta do what to hook it up?
234362	234782	Never mind.
236403	236663	Alright.
236983	242226	There's actually an email that I was reading in the emails, we'll have to get to later on, that kind of asks you about playing the old games in the vault.
242506	242746	Yep.
242806	243766	Curious to hear about that later.
244227	247008	But we'll get to that in part B. Alright, well Loki, how was your gaming week?
248772	249472	It was okay.
249633	252114	I played lots of Groove Coaster.
252274	253115	That game's pretty fun.
253955	258558	Almost seems like it should be like a Q Games game, but here it's not.
260559	264261	More Grand Theft Auto and more Earth Defense Force.
266282	268963	Actually, a lot of Earth Defense Force this week, which is kind of cool.
269744	271725	Leveling up my tactical guy.
271985	275647	Finished going through... Well, I had already gone through all the...
278442	278962	Normal Mode Level Up
299893	300634	So that's pretty much it.
301134	302735	Oh, and now, of course, Tiny Tower.
303055	305537	Because I have to join the cult that is Tiny Tower.
305597	306378	Are you on Game Center?
306538	307198	No, you don't use that.
307318	307799	Yeah, I use that.
308039	309039	Oh, you have to add me on there.
309200	309520	Oh, no, no.
310380	311281	I do have you on there.
311521	313603	You are the only person that's on my Game Center.
313643	316845	But I don't see your tower yet because you didn't start playing until today.
316945	317805	So I got it.
318146	318326	Yes.
318726	320349	Alright, my game of the week.
320569	326578	I picked up the Humble Indie Bundle, which I know is going to come up in the show later, so I'll talk more about the bundle itself when it comes up in the news later.
326979	332607	But one of the games in the Humble Indie Bundle has been taking up a lot of my time, and that's because I think it's terrific.
332687	333489	It's a terrific game.
334129	358476	and it's one of those games it's been brought up on the show before and I distinctly remember somebody had called in at the end of the year last year to say that this was their favorite game of the year and I was like oh I'll have to check that out at some point you know and amongst all the other games I try to fit into today I just never got around to it until now but now that I play this game it's just like taking up all my time that I'm not playing like WoW or an MMO or something and that's VVVVVV
360156	360556	Oh my god.
360576	361557	The game is fucking cracked.
361577	363678	This game is outstanding.
364138	372982	It is like Super Metroid meets the Commodore 64 meets an incredibly simple premise of you press button, flip gravity.
373582	375423	I mean, this game could have been on the Commodore 64.
376284	378125	That's obviously kind of like the style they're going for.
378645	382847	But the music adds like...
383807	386410	So much to it because the music is amazing in the game.
386670	387851	It's all chiptune type stuff.
387871	392115	If you like the Scott Pilgrim soundtrack, Super Meat Boy, that type of stuff, you'll love the soundtrack to this.
392635	396699	And obviously it takes a lot of influences from more recent gaming.
397359	406747	I think if you like Super Meat Boy, this type of game is right up your alley because it's about dying over and over and over again on a level until you get it just right.
407028	409710	But then there's that whole exploration and open world thing.
409990	410550	Thanks for watching!
439318	443842	Like one dungeon or whatever you want to call it that I was in had tripwires.
444162	446584	And whenever you hit the tripwire, the gravity automatically flipped.
446904	452769	And so you really had to kind of maneuver your character to hit tripwires, sometimes sequentially, to get through the room without landing on spikes.
453429	457692	Another area I was in was all about warping from one side of the room to the other.
458073	462076	Like the only way to escape a room would be from one predetermined exit.
462256	462957	DarkSakura, DarkSakura, DarkSakura
477253	477733	Thanks for watching!
495085	497746	I guess it all just kind of makes a mood.
497807	498127	I don't know.
498207	502989	I honestly think if the game had just done new graphics, it would have been horribly overlooked.
503389	508070	I think sometimes that whole little retro catch kind of adds a lot to the game.
508351	511372	There's not just, by the way, the open world Metroid-y part of the game.
511392	513813	There's also time trial levels that you can play and...
515773	543765	you can play made up worlds like there's like a little level packs in it and so forth so yeah amazing deal because right now you could get this game for a dollar if you wanted to I think you're kind of cheap if you do but I understand some people are broke and in school and what have you it's honestly if you miss the Humble Indie Bundle altogether it's worth the $10 on Steam I think so especially if you like like if you like Super Meat Boy and those type of games retro fan this game is right up your alley
544185	545266	I bought it when it was two bucks.
545806	546887	Oh nice, during the Steam sales?
547388	547948	Way back.
548328	548989	I've had it for a while.
549329	549569	Cool.
550150	550810	It's really good.
551010	551671	It's a great game.
552131	554053	So yeah, that was taking up a lot of my time this week.
554073	555314	I played some of the other stuff in the bundle.
555354	561098	I played COGS for a little bit, which is kind of like a puzzle game that's all about, like you know the sliding puzzles, right?
561278	561919	You know when you have
563260	564140	The picture ones.
578247	586152	It's just like you have to move, instead of making a picture, it's like the dual puzzle of line up the wheels right so that way it powers the machine.
586553	589895	It's kind of got that whole like steampunk-ish vibe, but not really.
589915	590175	I don't know.
590195	594117	It's a very puzzle-y interface and so forth.
594158	595478	So yeah, that was fun.
596859	597980	Those are kind of the big ones I've checked out.
598040	599140	Otherwise, most of the same stuff.
599421	601182	Warcraft, Final Fantasy XIII.
601222	602862	Randomly played Wipeout this week.
603063	606724	I don't know, just wanted to play F-Zero and didn't feel like cooking up the GameCube.
606745	607785	So I'm like, oh, let's play Wipeout.
607825	608746	It's about the next best thing.
609426	611407	Yeah, there you go.
611427	612468	That was my gaming week.
613468	616109	So, let's get into some gaming news.
617109	619830	After I mention real quick, you should always be following us on Twitter.
619850	621010	Twitter.com slash OLR.
621630	622211	Or Facebook.
622231	624231	Facebook.com slash Orange Lounge Radio.
624251	625492	Those are places to follow us online.
625512	628893	Of course, there's always our website at OrangeLoungeRadio.com where the forums are as well.
629613	630773	Please always help out the show.
630913	631573	Spread the word.
631974	634414	Five-star reviews on iTunes are much, much, much appreciated.
635615	637675	Because we don't make anything off the show.
637695	639236	We don't even ask you to pay what you want.
639336	639956	It's just free.
640356	640896	Question for you.
640956	641156	Yes.
641556	642156	What did you think?
642976	643056	Of?
643657	644017	The dish.
644357	644957	Oh, what you made?
644977	646257	Am I a culinary goddess or what?
647037	650498	Well, I've been talking most times, so I haven't been able to really eat it, but it's really good.
650618	650978	I like it.
651218	651918	See, everybody?
651978	652598	I'm awesome.
653278	655699	I don't want to inflate your ego too much.
656479	659739	You're going to have to go on Hell's Kitchen or something and get your ego kicked out a little bit.
659779	662620	No, because I would punch What's-His-Face.
663400	666500	I'd be like, you're much nicer to the people on MasterChef.
669001	669661	Gordon Ramsay.
670632	670952	All right.
671813	672193	Let's see.
673113	675635	Going to the chat room at chat.orangeloungeradio.com.
675975	681058	Spazinator PC in chat says, if there was a sequel to VVVVVV, would it be called VVVVVV2?
682279	683920	VVVV was 70s or WWWW?
684180	686121	I think it would be WWWW.
686221	688022	I think it would probably be a letter repeated.
688062	691024	The soundtrack is called PPPPPPP.
692224	692825	PPPPPPP.
695146	697849	But all the songs on the soundtrack start with P, so it's kind of cute.
699090	703976	Actdeft in the chatroom says, VVVVVV is like Portal, but in 8-bit goodness.
704937	708861	Blackwolf said he just paid $25 for the Humble Indie Bundle, split between the devs.
710222	712285	Breakman says, sliding tile puzzles?
712585	715628	Ugh, I think I'd rather glue my forehead to a donkey's ass.
716069	716890	An ass's ass.
718471	721153	Uh, it's, it's neater than it sounds.
721253	724315	I don't think this, it really depends what types of games you're into.
724375	728077	Like, if you like action-y type of games, you're probably not going to get so much out of COGS.
728357	731579	But there's some people that just, to kill time, like to sit there and play a little puzzler.
732060	736102	Like, you know, some of you probably play Plants vs. Zombies, Bejeweled, those are puzzlers.
736422	737723	This is kind of right up that same alley.
739084	739764	Alright, there you go.
739784	743206	Uh, chat.orangelaunchradio.com if you want to join us live on this Sunday night.
743286	744887	Let's get to some gaming news.
744967	745708	We'll start off with Loki.
746963	747243	Ah, yes.
748284	752087	Um, apparently, the PlayStation Vita will not be coming out this year.
753148	753548	Too bad.
753708	758712	At least, not over here in the United States or North America or in Europe.
759792	761173	It said it'll be coming out in early 2012.
761293	766978	Of course, I'm assuming, Sony being a Japanese company, the Japanese will get theirs holiday, 2011.
767018	767118	Um...
770535	782119	But yeah, right now, no real reason given other than, you know, I don't know that they're delaying it.
782219	795883	I think it's a good idea because if it means either more units being produced so that they don't have shortages or, you know, to have better games coming out at launch, I mean, both of those things would definitely help them out.
797203	804226	and of course they were asked whether they'd be lowering their price because Nintendo did it on the 3DS.
804266	807047	They lowered their price to compete with the Vita.
807907	812168	They basically said we packed so much into the device and made it very affordable.
812668	819911	There's no need to lower the price just because somebody else happens to be in the video game business and decided that they were going to lower their price.
821889	829133	And honestly, there is a lot of components in the Vita, but if that shit isn't going to sell at launch, they will lower the price.
830634	832275	That's just the way things are.
834697	844283	Something else that got delayed to early 2012 as well, that'd be Twisted Metal, which was supposed to be coming out in October, and now it's early 2012.
844923	844963	Um...
848430	854273	They basically said, you know, late game is only late until it ships.
854934	857315	A bad game is bad until the end of time.
858956	860517	Great quote.
862178	869422	If we ship Twisted Metal tomorrow, going off the response from folks who have played it, I assure you it would never be a bad game.
872924	876066	But yes, they're spending the extra time polishing the game.
879562	879982	I can wait.
880703	881223	It'll be awesome.
882104	884486	Yeah, that game's been in development for quite some time now, hasn't it?
885246	885587	Yep.
887148	889069	So let's go back to the Vita being delayed.
889510	891251	What does it boil down to, the cost for delay?
891331	891911	It's parts?
892452	893893	It's strategical?
894013	894713	What's going on?
895214	899597	Because you kind of knew about this before the rest of the internet did, didn't you?
899857	900077	Yes.
900938	901438	So what's up?
902840	904241	Nothing really, they didn't say.
904641	906302	They said it's 2012. 2012.
909403	913907	Part of me wondered if maybe they saw what the 3DS was doing wrong.
914567	918711	And that was that the 3DS launched without really having any good games at launch.
919491	919932	Debatable.
920012	925276	I understand Street Fighter 4 has its fans, but let's face it, that was a port of a game that had already been out for a couple years, right?
925336	928299	And if that's your strongest release title, something's up.
929299	934304	So maybe they were looking at that going, well, what do we have coming out at launch on the Vita?
935205	939350	If these developers aren't really ready to put out all-star games, maybe now's not the time to put out the Vita.
939930	942333	Because that was where my mind went.
943255	946619	I said, well, maybe the Uncharted people weren't ready to put out the game.
947160	951205	And if that's your biggest game and that's going to get delayed, let's just delay the whole damn thing.
953427	953688	Could be.
954068	978348	Let's call the whole thing off Apparently So Alright, well Going to chat.orangeloungeradio.com Black Lab is in chat tonight saying I can tell Rob started talking mid-chew Hey, I gotta eat sometime When I got something to say, I'm gonna say it Let's see Breakman in chat says I got a PSP at full price, if only I'd waited
978948	981170	Well, here's a newsflash.
981650	988915	You could wait to get a Vita, too, but it's probably going to take a long time for the price to drop on that, especially if it comes out in the first part of next year.
990676	995359	There could be a small price drop at the end of next year going into holiday 2012.
997563	998383	But that's not for sure.
998943	1001604	I'd be interested in the Vita if they had Saints Row on that.
1002564	1003484	Or Grand Theft Auto.
1003844	1004745	Might just be a matter of time.
1004765	1006865	Either one of those is very interchangeable.
1007125	1008285	Or Earth Defense Force.
1009906	1012986	Any of those three, I would definitely be down for a Vita.
1013026	1020508	But as of right now, I've seen how much I play my 3DS, which is not at all.
1022029	1024109	So I just don't need another system cluttering up.
1025689	1035201	My bank account Alright, well let's talk about the other handheld The 3DS Oh, before we get to 3DS actually Let me ask one more question Does this change your opinion at all about the Vita?
1035461	1039106	And I asked this to chat too Does it change your opinion thus far of the Vita?
1039166	1041168	Does it change the fact whether you want one or not?
1042209	1043550	For me, I'll start.
1043670	1045292	No, it doesn't really change my opinion of the Vita.
1045352	1049715	In fact, I actually kind of say, you know what, if you're not ready, then that's cool.
1049775	1051916	Take your time until you've got a really solid launch lineup.
1052517	1061343	And B, the fact that the holidays are going to be killer anyway, I'm kind of glad to not have to spend $250 right now on a Vita as well because you know I'll have to have it.
1061803	1064765	So actually, I'm not so bothered by this.
1065586	1066166	What about you guys?
1066526	1066786	Loki?
1068127	1077550	I was kind of just warm about the Vita to begin with, and nothing really stood out so far with the Vita that says, I gotta have that system.
1078670	1082511	So until I see something like that, then I don't really have to have that system.
1085686	1087108	It depends on finances.
1087288	1095057	I mean, the Vita looks nice, hooray, but I hardly touch my PSP, so why would I want to touch the new one?
1095458	1099903	I really didn't play the PSP that much except for Popolo Cross and Loco Roco.
1100695	1102517	There's gonna have to be those must-have games.
1102817	1105099	Yeah, it's really gonna be more of a matter of games.
1105139	1109944	I mean, even Dissidia wasn't really enough to make me really want to play my PSP.
1110184	1117310	See, I got on board with PSP early because the very first time I played Luminous, I was like, oh my god, this is the best music puzzle game ever.
1117330	1119032	We had a PSP the day they came out.
1119252	1121654	DarkSakura, DarkSakura, DarkSakura, DarkSakura
1141654	1147416	And, but, I mean, I've played stuff that I've liked, but it's never been really enough to keep me.
1147536	1149736	I mean, I've taken it on trips and watched movies on it.
1150477	1153617	Now I have a netbook, so I watch movies on that instead.
1154258	1155878	Let's go to the chatters and see what they have to say.
1155938	1161360	Defective Candy in our chatroom says, Kudos to them for taking the time and trying to launch something solid instead of rushing it like Nintendo.
1162280	1164180	SonicM88 says, Vita doesn't interest me.
1164220	1165381	I've never liked Sony's games.
1167122	1171505	Kitsune says, it may not carry all your favorite games yet, but it definitely has a lot more than 3DS.
1171545	1172606	I'm psyched about the Vita.
1173187	1175448	DungeonBuster says, doesn't really change my opinion either.
1175789	1177290	I have the same opinion that Loki does.
1177490	1178991	I just don't play handhelds all that much.
1179571	1183114	Miklatov says, having played it at E3 this year, it doesn't change my opinion.
1183414	1185096	Just makes me sad I have to wait longer.
1185456	1188398	Need sound shapes, since it's like the Vita's luminous to me.
1189139	1194303	Spazinator says, I'd be interested in the Vita if it'll print money, make me a sandwich, and order me several slutty strippers every night.
1194875	1222257	you might be a little bit disappointed I don't think these slutty strippers will be in right away that could be in the 2.0 firmware though so stay tuned Breakman says it's a smart move for Sony to move the Vita to next year they don't want to compare its sales to the sales of the 3DS which I think will be one of the biggest Christmas gifts interesting theory maybe they did it to not compete with the 3DS maybe they want to hand this Christmas to Nintendo maybe they're a little afraid of the competition
1223119	1226953	is that is does that sound too fanboy motivated or or what
1231582	1246198	I think it really just is a matter of putting out a polished product because especially with the mistakes that Nintendo's made with bringing the system out and not having the right games for it, that's really hurt their sales.
1247800	1251004	So I think that they're really just trying to avoid that trap.
1251044	1252886	They've seen how it's bit Nintendo in the ass.
1254096	1256098	All right, well, let's move over and talk Nintendo then.
1256118	1257880	I was going to move on and talk about the 3DS.
1258820	1263725	With the 3DS, there's some more comments from Nintendo CEO Satoru Iwata.
1263765	1265186	Of course, you all know who Iwata is.
1265567	1266628	He's the man at Nintendo.
1268089	1272673	He's talking about the 3DS and talking about kind of the GameCube and how the two relates.
1273634	1279720	He said in an interview that the GameCube suffered because Nintendo did not take opportunities when they were available.
1280621	1287809	The general feeling within the company's management is that the console had a chance to succeed, but that the chance was not taken advantage of.
1288670	1294076	Iwata has said that the company learned its lesson, and that's why they did a price cut so soon after launch.
1295617	1298399	Interesting that they've kind of brought up the comparisons to the GameCube there.
1300860	1303221	Also wanted to mention this with the 3DS price drop.
1303481	1307303	There's some rumors going around that Walmart is going to drop the price early.
1308524	1317708	So if you want to go to Walmart on August 9th, that's the rumor anyway, they are supposedly dropping the suggested retail price down a little early to the $170.
1318788	1323591	What this means is that you might be able to get your cake and eat it too, meaning...
1324091	1341772	if you can buy one of these things in that window between the early price drop and the price drop for everybody else quickly get it on the Nintendo eShop then you will be an early adopter so not only did you get the cheap 3DS but you got the $80 worth of games too so that's one way of working the system
1343013	1345597	So, I guess call your local Walmart or check.
1346017	1346358	Who knows?
1346418	1348320	Nintendo may put the smack down on that, though.
1348400	1349121	I don't know if they can.
1350263	1353367	Loki, I don't know if you know from the retail angle, but could Nintendo stop this?
1353948	1357813	Like, if Walmart wants to cut the price three days early, can Nintendo stop that or no?
1359771	1362632	Here's a couple factors that they have in that.
1362652	1369675	One, whether there is map pricing on it or not, which is the minimum advertised price.
1369895	1378318	So if they have map pricing in place on it, it may prevent them from advertising it lower than a certain amount.
1378859	1381700	Also, if they're being price protected on it, any of those...
1385211	1396389	Any of those units that they sold prior to it dropping in price, they don't get any of the money from when it dropped in price.
1396409	1398312	So they would be eating the cost on that.
1400808	1412958	Now, I wouldn't see Walmart as a company doing this, but I know that, and none of the people I know or work with in the industry do this, but I know there's people out there to do that.
1413398	1425708	You can manipulate your price protection by fudging the numbers, if you will, and saying, oh, I didn't really sell as many units as I did, and then you get the price protection, and then you sold those units, you know.
1427090	1430435	It's kind of ways to work the system, but Walmart's probably too big to do that.
1430715	1432498	I wouldn't think they would be able to do that.
1435780	1436140	I don't know.
