start	end	text
0	17160	This week, the next era of video games and non-interactive media is here on the heels
17160	21120	of a critically successful and renewed Castlevania series comes announcements of additional series,
21120	22120	movies and more.
22120	24700	Tonight, the next episode of Orange Island Radio is here, chock full of the week's gaming
24700	31700	news starting right now on the show where every gamer has a voice.
31700	35100	Hello my friends out there on the internet and welcome back to another week of the show
35100	36780	where every gamer has a voice.
36780	39780	It is Orange Lounge Radio.
39780	46500	Live tonight, episode number 695 for this July the 23rd of 2017.
46500	51420	We of course are three folks here based out of Sacramento, California to talk about video
51420	53580	games, gaming culture and the gamer lifestyle.
53580	54920	I am Rob Roberts.
54920	55920	She is DarkSakura.
55920	56920	Hi.
56920	57920	Hi.
57920	58920	How are you?
58920	59920	I'm okay.
59920	62500	So this is the last Sunday with Das Boot on your foot, right?
62500	63500	Yes.
63500	67700	So I'm going to decorate it with stars on Tuesday so that when they cut it off, it'll
67700	70500	be sparkly and my foot will be free.
70500	73800	And what's going to happen is I'm going for a pedicure.
73800	77660	Right when it's done, right after my doctor's appointment, I'm going to have a pedicure.
77660	79440	I don't care how gross my foot is.
79440	83180	As a lady should treat herself once in a while or a gentleman actually.
83180	84180	I had a pedicure once.
84180	86180	I was like, my toenails never looked better.
86180	88860	Well, it's really relaxing though to have someone scrub your feet.
88860	90820	Well, also there's that chair that.
90820	91820	Right.
91820	92820	Yeah.
92820	99500	And the other thing too is that I like that it's, well, the tips of my toes are actually
99500	101900	because I haven't been able to wear anything over my toes.
101900	105600	So the tips of my toes are actually really kind of scuffed up.
105600	107780	So it'll be nice to have like human feet again.
107780	112900	I'm kind of surprised no one has thought of a way to sell like bro-dicures or like target
112900	114660	men in that market somehow.
114660	115660	Like that.
115660	116660	Just call it metricures.
116660	120660	Look, I'm all for, you know, screw your gender norms and all that stuff.
120660	125220	But I understand the reality is most men view it as a girly thing.
125220	128220	But like, what if, what if like you fragile masculine?
128220	129220	I know.
129220	130220	I know.
130220	131220	I know.
131220	132220	Look, that's a whole nother issue.
132220	133220	But the reality is the society we live in.
133220	134220	Right.
134220	138060	So I mean, could, could there be a thing where like you could go like play games, video,
138060	141160	you're like playing Xbox while getting your feet scrubbed?
141160	142160	I don't know.
142160	143160	Yes.
143160	145160	Well, having, you know, a pedicure.
145160	148080	So how many people do text messages when they do it?
148080	149080	Right.
149080	150080	I don't know.
150080	151080	I could just do Pokemon go.
151080	152080	Like I'm doing right now.
152080	153080	All right.
153080	154540	I'm trying to get to level 29.
154540	155540	Tech master.
155540	156540	Loki is here.
156540	157540	Loki, would you get a bro-dicure?
157540	158540	No, no.
158540	159540	Why not?
159540	160540	It's expensive.
160540	166560	I accidentally, I accidentally wandered into like during like jury duty one year, I wandered
166560	174460	into a barbershop that was like a, a men's spa cause me like 40 bucks for a fucking
174460	175460	haircut.
175460	176460	So no thank you.
176460	184240	I just said the only men's spas I know ever the hookup joints, like an upscale, like get
184240	189480	your hair cut, get, you know, your, you know, face shade and stuff like fuck that.
189480	192520	I can just go to the bowling alley that has a barbershop in there and they'll charge you
192520	195360	like $20 for that.
195640	199600	Just as a rule of thumb, Loki, if a men's club is offering a steam room and they're
199600	202840	charging you 40 bucks to get in there, Loki, I don't think it's your cup of tea.
202840	205200	You don't want to go in there.
205200	206200	Duly noted.
206200	207280	All right.
207280	208360	Just a public service.
208360	213400	The advertisements are going to be pretty obvious what, Hey, you never know.
213400	214400	All right.
214400	215400	Going to our chat.
215400	216400	We do tape live.
216400	219120	Of course, believe it or not, it's a video game show and we do tape live every Sunday
219120	223280	night at the voice of geeks network vog network.com six o'clock Pacific nine o'clock Eastern
223320	227040	right after the Bobby black Wolf show, although not tonight, he's going through the whole
227040	228040	home transition.
228040	229480	He's talked about on his show.
229480	232280	So he wasn't able to join us tonight, but usually he's there and you can of course check
232280	236280	out his podcast feed or the podcast feed of many of the great shows that we share the
236280	237280	network with.
237280	240320	Like as far as gaming shows go, we have girls gone, wow.
240320	242040	Game buoy electric sisterhood.
242040	246000	And that's just, that's just some of many shows that we have that are great at the voice
246000	247000	of geeks network.
247000	248200	So check that out.
248200	253720	Going to our chat over at live.vognetwork.com, uh, JD and chat says gender is a construct
253720	254720	tear it apart.
254720	255720	Yes.
255720	256720	There you go.
256720	257720	There you go.
257720	258720	Darcy.
258720	259720	Oh, it's not just tearing it apart.
259720	260720	It's disintegration time.
260720	263200	Um, let's see, which was also a great album by the cure.
263200	269800	Speaking of defying gender norms, that was disintegration.
269800	270800	It wasn't disintegration time.
270800	274000	It was, I thought that was an album was disintegration in time.
274000	275800	Oh, I'll look it up now.
275800	276800	All right.
277400	278920	What are you thinking of fascination street?
278920	279920	Am I, I don't know.
279920	284440	Anyway, I'm also looking at an SSG100 Matt who says I had a pedicure once also my toenails
284440	285680	were never cut so well.
285680	286680	Yeah.
286680	287740	It just happens sometimes.
287740	289800	It was just called disintegration.
289800	291400	Athletes get pedicures all the time.
291400	294040	It's better on their feet to have someone work on them regularly.
294040	299120	And yeah, I think, um, certain types of diabetics have to get kind of pro feet treatment.
299120	301360	Also I am too ticklish for any of that.
301360	302360	Are you really?
302360	303360	Yeah, I can't.
303360	306360	That's kind of cute in an awkward way.
306920	308200	So the album was disintegration.
308200	309760	I know my cure albums.
309760	312360	Well I do too, but I knew I had my phase in high school.
312360	314760	I had said disintegration time and that wasn't it.
314760	315760	All right.
315760	316760	Fair enough.
316760	317760	All right.
317760	319560	So anyway, uh, we want to get to the kickoff topic tonight.
319560	320760	Look, it is a video game show.
320760	324440	I want to get to video games because we actually, we have a little bit of a cameo tonight.
324440	326160	I'm going to talk about that in a minute.
326160	327960	And yes, we'll talk about Comic-Con as well.
327960	332040	I know some of y'all are at Comic-Con so there was a few festivals going on this weekend.
332040	336840	So one of them was the Pokemon go festival that was happening in Chicago.
336840	342040	The very first time Niantic was doing an event live based on Pokemon go, but not the first
342040	343040	live Niantic event.
343040	348100	In fact, I feel like maybe I need to get a shirt made that says I survived a successful
348100	349360	Niantic event in Chicago.
349360	352400	You might be confused that this isn't their first event, but yeah.
352400	353400	All right.
353400	357880	Loki from the media perspective, from the news, what's been going on, what's being reported
357880	359400	on out there in the bloggy world.
359400	362400	It was a fucking shit show.
362400	365480	Is that the, is that the official Tom Brokaw line?
365480	367120	Yeah, basically.
367120	371640	So they had problems with it being very unplayable.
371640	378200	Apparently they did not have enough server space available for the players in the area
378200	384080	and it caused them not to be able to catch different Pokemon that were in there or to
384080	390480	battle some of these, you know, legendary Pokemon that they had.
390480	393160	So it was just, it was bad.
393160	397520	I mean, people were chanting, you know, fix the game, you know, that type of stuff.
397520	402600	So did you watch any of the feed on Twitch as it was going on?
402600	407160	I had logged into that like early and they hadn't actually shown anything yet.
407160	410840	And I was like, fuck, this ain't sitting here all day to watch this shit.
410840	411840	Yeah.
411880	416000	It was weird to me how the live stream was on and off, like it was like they would show
416000	419040	something for 10 minutes and then they'd be like, we're just going to show this static
419040	423520	image and you can hear the noises of the festival, but you can't see anything.
423520	427160	Now I had, I probably can't stream it with all the bandwidth.
427160	431960	I guess, I guess now I had always planned on Saturday because they did this whole thing
431960	436200	where they were like, okay, the people at Grant Park are going to be catching Pokemon
436200	441320	and the types of Pokemon that they catch are going to drive these bonuses.
441360	445560	And if everybody else in the world can catch a ton of Pokemon, although they never gave
445560	449240	numbers, if every everybody in the world catches these Pokemon, we're going to roll out these
449240	454280	bonuses for 24, 48 hours and who knows a mystery challenge, which we all fucking know was going
454280	455960	to be legendaries, right?
455960	461280	So I had always planned to go out with a pal downtown and we were going to go catch Pokemon.
461280	466760	And honestly, Saturday when we were out doing Pokemon during the measurement windows of
466760	472200	the event, which was our time, 9 AM to 9 30, then it was like 11, 11 31 to one 30.
472200	474280	So we went to, we didn't really know where to go.
474280	476120	So we were like, let's just go to the Capitol.
476120	479560	Cause that's a really crowded area and it has a ton of pokey stops, right?
479560	483640	So we went down there and there was, there was like a lot of people there playing the
483640	484640	game.
484640	490220	And for all those people that are like, Pokemon go is dead, which I'm sorry, but if you go
490220	494760	to a news site and they're running a headline that says Pokemon go is dead and I'm not going
494760	495760	to name names.
495760	496760	Okay.
496760	497760	I will.
497760	498760	It's Forbes.
498760	500800	But if you're going to go to a site like that, that runs those types of headlines, like you
500800	506800	need to be skeptical about how much this website, um, how would you say it?
506800	507800	Games exaggerates.
507800	512120	I think the gamers that like to exaggerate, when you're looking for your video game news,
512120	515640	do you think first, man, I got to go to Forbes and see what they've had with that.
515640	519600	Well, but Forbes is great at writing real fucking clickbait headlines and I'm, I'm in
519600	524680	a mood today, so I'm calling people out this week and I'm starting with Forbes because
524680	525680	I'm sick.
525680	526680	Yes.
526680	527680	Let the hatred fill.
527680	529820	No, I'm just, I'm fucking sick at the clickbait on that website.
529820	531600	It's not as bad as Motley fool.
531600	533180	That's the fucking worst.
533180	539080	But Forbes has some of the most clickbaity Nintendo hate boner things that they published
539080	541420	just to get Nintendo fans to click on their website.
541420	543200	So I'm just, I'm calling it like it is tonight.
543200	544360	I don't care.
544360	551940	So anyway, so if I see another Forbes article with a link that says Pokemon go is dead,
551940	554740	my eyes are going to roll so far back in my head, I can see my brain.
554740	557260	My point is people are still playing this game.
557260	562460	Is it as many as we're playing it when we had this cultural event back in July of last
562460	563460	year?
563460	568100	No, but is it pretty strong right now, especially compared to maybe three months ago when there
568100	569900	was, you know, not as much going on.
569900	570900	Yeah.
570900	571900	Yeah.
571900	574940	I mean, I think there's a lot of mobile games out there that would love to have what Niantic
574940	575940	has.
575940	576940	Right.
577740	582140	You know, from that perspective of what we were doing downtown, like it was actually
582140	583140	a lot of fun.
583140	587920	The game was running mostly fine except for the fact that the game has a tendency to crash
587920	592780	a lot on my iPhone, which is, I don't know if that's an Niantic issue or a phone issue
592780	593780	or like a phone issue.
593780	594780	I don't know.
594780	598040	Cause my other friends, like it crashes a lot.
598040	599720	Even an Allen, Allen has Android.
599720	603580	I have, I don't play it long enough for the crash maybe, or you don't use the Pogo plus,
603580	604580	which could be one of it.
604580	605580	I don't know.
606220	611340	But anyway, my point is, is that yes, there are still quite a few people playing the game,
611340	612340	right?
612340	614400	So of course there was a great interest in this event.
614400	615780	It sold out very quickly.
615780	619040	They had 20,000 people, some odd that were going to this event.
619040	622940	And so to hear that it turned out like, Oh, I don't know that fire festival that happened
622940	626140	in the Bahamas in some ways was, was pretty disappointing.
626140	629580	At least so unlike that fire festival, they got their money back.
629580	631700	Well, they also weren't trapped on a desert island.
631700	632700	Right.
632700	634420	So, I mean, there's that to be thankful for.
634460	638500	So anyway, here's my thing I could sit here and continue to theorize, well, based on what
638500	641300	I saw or based on what did, this is what must be happening at the festival.
641300	646100	Then I was like, wait a minute, Rob, wait a minute, Rob, you idiot, you know, somebody
646100	649580	that went to Chicago Pokemon go Fest.
649580	653720	Why don't you invite him on the show to talk about what it was really like at Pokemon go
653720	654720	Fest?
654720	659300	Cause you know, there's all this stuff in these publications that tend to games, exaggerate
659300	662860	things or focus on just the worst of it.
663620	665740	There may be some good that went with the bad.
665740	671820	So I reached out to my buddy Charles, also known as rock god of podcast or rock god of
671820	673080	pod on Twitter.
673080	677420	He is one of the hosts of the Pokemon go podcast, which is a show I plugged here a couple weeks
677420	679780	ago cause they were good enough to have me on it.
679780	684540	So I reached out to Charles, unfortunately he had another paying gig tonight so he could
684540	686440	not be here on the show live.
686440	688120	So we had to kind of work real fast.
688120	695560	He sent us a really lengthy audio clip explaining like his time at the festival.
695560	699080	Unfortunately I wanted to scale it back a little bit cause it was, you know, it is only
699080	700080	a three hour show here.
700080	701360	So I wanted to scale it back a little bit.
701360	705760	So I kind of cut out some of these parts that I want you guys to hear here.
705760	710600	So let's check in with, Oh, but if the audio is a little weird, it's because I edited it
710600	711700	like an hour ago.
711700	714540	So if there's any sloppiness, it's on my part.
714540	717360	So I apologize to Charles and to listeners for that.
717520	721720	Let's check in with Charles and check and see how his day kind of started over there
721720	722720	in Chicago.
722720	726680	Hey Rob, Jamie and Loki at Orange Lounge Radio.
726680	731200	It's the rock out of podcasting Charles Mcfall from Pokemon Go podcast.
731200	734640	And let me tell you what it was really like being there at Pokemon Go Fest.
734640	740800	Now line started at 6 AM and there were people out there, I'm sure at 6 AM, lined up.
740800	745240	Myself and the people I was traveling with, we walked from the hood that was about two
745240	747000	blocks away from the park.
747000	753240	And so we were walking down and as we came up on the park, there's this massive line
753240	756600	stretched out and we're like, Oh crap.
756600	759500	Because a lot of people, we had somebody standing in line for us for the early entry.
759500	765140	We did have early entry badges, which were supposed to get you in starting at 9 AM.
765140	768200	The general public started at 10 AM.
768200	772900	And the line, basically the short version is, that line was not for early entry.
772900	777000	That was for the regular entry people and it was already super long.
777000	784180	We got in, say 9.30, it took us about 30-ish minutes to make it around the fence and into
784180	785180	the entranceway.
785180	788740	And they were checking bags in, but it was honestly, they weren't checking them that
788740	789740	much.
789740	790740	They were just kind of moving people through.
790740	796740	Got in and everybody, we're all hyped, everybody's excited and you get this envelope, as you
796740	800940	walk in the door, you're handed an envelope and it has a real world patch that is the
800940	806600	exact same thing that you get in the game that's the medal in the game for being there
806600	808460	is a patch version of the medal.
808460	813500	And on the other side is a QR code and you had to go to any stop inside the park that
813500	819700	had a lot of temporary cool stops, which, and gyms, which tells us they can absolutely
819700	826100	do the stop slash gym for pay idea that we've been talking about on our show forever.
826100	829700	Anyway, and right down the middle as you come in is all the concessions and everything.
829700	834940	It was really actually, I'm going to say from a functional human being standpoint,
834940	837100	they did an amazing job setting this up.
837100	841720	It was easy to find the food, they had water stations, they had at least two if not three
841720	844900	water stations around to get you free water.
844900	848700	So you brought your own bottle, you can bring in two bottles of water sealed or empty pouches
848700	853140	or, and they actually didn't really think that strict about it.
853140	859260	The price is, I expected eight to ten dollars per person to eat and I'm talking about, you
859300	863820	know, you go to a festival and you're talking about, hey, pizza, pizza is ten bucks, water
863820	871300	is five dollars, don't you, no, my pizza, my honest to God, real Chicago restaurant,
871300	874620	you know, they made it in the restaurant and brought it to the park very quickly.
874620	877140	It was still hot when it got there.
877140	883180	Real Chicago slice pizza, now hold up my fingers like you can see me, but a big huge triangle,
883180	886500	five bucks, five bucks, a bottle of water was like two dollars.
886500	888860	It was insanely cheap to be there.
888860	890060	That was really cool.
890060	894220	Let me jump, let me, let me jump in here for a minute to talk about some of what Charles
894220	895740	said there.
895740	898380	And obviously, sorry about some of the audio there.
898380	902200	There's some tearing effects in audio and the audio that we got sent.
902200	906760	But my understanding is that Charles like actually recorded that in a car in a parking
906760	908680	lot on the way to one of his gigs.
908680	911800	So really appreciate him taking the time out to do that.
911800	915720	But some of the audio was a little shaky, I didn't have time to clean it, clean it up.
916520	919260	On that note, I noticed there was some bad and there was some good in there.
919260	920600	So it sounds like Charles was fortunate.
920600	922780	He had this early entry thing and a buddy.
922780	924860	So he got into this thing early.
924860	928720	But there was this huge line, you guys all saw this on the media and some of the Twitter,
928720	929720	right?
929720	934960	There was this huge line, sorry, this huge line going around the whole place that was
934960	937040	it was hard for people to get in and stuff, right?
937040	940960	So I mean, it was taking like forever for people to get into this place.
940960	944400	And what blew my mind about it is that it sounded like from what Charles is saying there,
944400	945520	they really weren't doing much.
945520	949480	They weren't really like scanning the bags that deeply or whatever.
949480	950600	So what was taking so long?
950600	952400	And here's the other thing.
952400	955900	So now comparing Charles's experience to my experience a little bit when I went to Niantic's
955900	960520	Ingress anomaly over Veterans Day weekend last year when I missed the show.
960520	961520	That's where I was at.
961520	963600	I was at a Niantic event in Chicago.
963600	969240	They did check ins the night before for the Ingress event, you were able to go to a bar
969240	974320	that was in the downtown area and you could check in at the bar the night before and get
974320	975320	your stuff.
975320	977200	And then, you know, we all went to the anomaly.
977200	982000	Now granted, I understand there was maybe 1,500 people that did the Ingress event compared
982000	983320	to what, 20,000.
983320	985320	So I obviously understand the size.
985320	988560	Which I think would be all the more reason they have to check in the night before.
988560	992120	That's what blew my mind is I was like, why didn't they do check ins the night before?
992120	996320	Were they that concerned about resales, spoofers?
996320	1000600	I don't know what it was, but it really blew my mind that like for this smaller event Niantic
1000600	1004240	did something, but then for this larger event they didn't.
1004240	1007800	But then Charles does point out there is some good stuff that you're not hearing about in
1007800	1008800	these news stories.
1008800	1013480	It sounds like from a functional standpoint, you know, the vendors were reasonable and
1013480	1016560	they weren't trying to price gouge people or any of that stuff.
1016560	1021320	And that, you know, as far as like a, am I going to get food and water situation?
1021320	1022320	It was fine.
1022320	1025600	Unlike, you know, even though we're joking about Fire Festival, those people that were
1025600	1029180	trapped in the Bahamas were having a food and water situation as well, which is a lot
1029180	1030180	more serious.
1030220	1035540	But it sounds like that was never an issue with the Pokemon Go Fest and that that was
1035540	1036720	doing very well.
1036720	1039140	So let me continue on with another clip from Charles.
1039140	1044540	And so we get over this all at 930 in the morning and we get over there and I'm spending
1044540	1047100	some stuff and the game starts kind of getting clunky.
1047100	1051060	I'm trying to go into a raid and I'm like, well, I'm going to fight this Pikachu raid.
1051060	1053820	Raid battles were free all day long.
1053820	1056020	Did not take any passes at all.
1056020	1060220	Raid battles inside the park, 100% free.
1060220	1061220	And they were doing them.
1061220	1066500	They would be a 10 minute warning time, like a regular start in 10 minutes and then pop
1066500	1069580	into 14 minute uptime.
1069580	1071700	And they had gyms.
1071700	1074260	I think they had eight gyms in there.
1074260	1078340	So there's plenty of places for people to play and get to.
1078340	1081900	And I started to do the Pikachu raid and I hit the thing and put me in a room and it
1081900	1085180	kind of locked and didn't do anything and the game crashed.
1085180	1087460	And somebody else was like, I can't get the QR code work.
1087460	1091060	They were having issues and they finally got theirs to work.
1091060	1092980	And that's at 930 in the morning.
1092980	1098880	So already it's like, hmm, at 10 o'clock, I don't know when they actually started the
1098880	1100860	actual public coming in.
1100860	1104760	They had a big enough gate that you could funnel both lines in easily.
1104760	1109900	But the thing is that nine o'clock early band, they gave out way too many of those bands
1109900	1117820	because at 1030, almost 11 on the backside of the park, I mean, the line would be super,
1117820	1118820	super long.
1118820	1123220	People were still there and we didn't go up and ask, are you in the early entry line?
1123220	1129860	But this is, this is at 11 o'clock almost, no, it is about 1030, I guess it's about 1030.
1129860	1133940	And the early entry quotey fingers people seem to be still lined up and trying to come
1133940	1135300	in.
1135300	1139020	I've heard that it took three hours of standing in line.
1139140	1144980	I'm not talking about the early guy here at 6 a.m. people from the time 10 o'clock hit,
1144980	1150300	it took three hours to get through the general public line and get into the park.
1150300	1152940	But that's, that was frustrating for a lot of people.
1152940	1155700	And I was tweeting that we had some friends who did not get early passes that were in
1155700	1159380	the general and they were tweeting, they spoke among their radio.
1159380	1163460	And we're telling them, you're not missing anything, we can't play, nothing's connecting
1163460	1164460	here.
1164900	1168220	1030, 11, maybe it's closer to 11.
