start	end	text
5843720	5849520	game called super clash brothers it basically takes the characters in smash brothers and
5849520	5854720	puts them in their wonderful 8 and 16 bit iterations and then of course there's a whole
5854720	5858840	game based on that so this one they've only got a few characters so far you've got mario
5858840	5866760	luigi princess peach link sonic tales knuckles and mega man and of course you know every
5866760	5871480	character looks just like their you know sprite versions and i think even operates sort of
5871480	5877440	like their sprite versions as well so it's available to check out online until of course
5877440	5883520	it is um you know taken down by nintendo eventually so that would be terrible um the other fun
5883520	5890720	thing there's a new mod for link to the past allows two people to share items online so
5890720	5896640	i guess it's somehow it it adds some some special code to allow a couple players to
5896640	5904040	actually coordinate items through the progress of the game and can change each other's inventory
5904040	5911160	that's kind of kind of weird um and they're saying that even i guess you can communicate
5911160	5917920	with your teams over skype and stuff um that's definitely a unique mod for that too bad it's
5917920	5924080	not like co-op though in zelda that'd be pretty cool yeah it's kind of a bummer they don't
5924080	5927360	like officially release something like that that's like when they like put multiplayer
5927360	5931320	in skyrim with a mod you know something that people kind of wanted but bethesda didn't
5931320	5936920	i guess think the balance would work right but at modders to the rescue right yeah so
5937160	5943160	neat well uh maybe uh maybe ubisoft will be looking at a zelda-like game on the nintendo
5943160	5947320	switch who knows what they're working on we don't know but ubisoft has said that they are working
5947320	5951800	on more titles for nintendo switch this is during a recent earnings call but of course no more
5951800	5956440	details just that the games will be announced soon we don't know if they're ports we don't know if
5956440	5961080	they're new games all together or like you know new uh platforms for games that are scheduled
5961080	5965800	to come out like maybe the south park game but that's you know obviously i'm i'm totally making
5965800	5970520	shit up right now um but we'll see we'll find out i would imagine gamescom might be a good time in
5970520	5975000	the near future to announce that stuff obviously i would imagine yeah ubisoft has a lot of operations
5975000	5980440	in france uh so that's only a few weeks away yeah so that'll be a good time but we'll see we'll see
5980440	5986440	uh but that would make a lot of sense uh also could the end of me verse be coming um i guess
5986440	5990280	it would make a lot of sense after all since the wii u has kind of been kicked to the curb at this
5990280	5996360	point nintendo did do an update to the wii u this update contains text now keep in mind this text
5996360	6000200	is not displayed on the screen somebody's gone through the files and found this that says the
6000200	6004680	me verse service has ended me verse and any software features that make use of me verse
6004680	6009080	are now unavailable again nintendo has announced anything official yet it's just it seems like the
6009080	6013560	wording is in there in their most recent software updates that's really all we know right now
6013560	6019800	but again i mean it kind of makes sense that it would go away except it's it's on the 3ds as well
6019800	6024600	and the 3ds is still supported by me just you know break it for the wii u i want to know what
6024600	6028680	this breaks so when they get rid of this what's this going to break everything is it going to
6028680	6032440	break like mario maker i mean how does that work yeah i don't know if it breaks mario maker and
6032440	6039480	splatoon or what happens with that um and how far out is it it could be maybe this is the last major
6039480	6043400	system patch for the wii u or something and so they're putting that text in there preemptively
6043400	6052360	i don't know but again this is all still really premature so all right uh moving on dark sakura
6053400	6060280	well um we know we uh all enjoy our super mario maker at least we some of us are still giving it
6060280	6064680	the time of day yeah i did uh i did the post show stream last week was mario maker we had a lot of
6064680	6074680	fun well now um a fan has made a mario 64 maker basically um you use your camera perspective and
6074680	6080520	put things where you want and you would play them through emulation or through you know like
6080520	6090680	a rom writer or something so pretty neat um it is available um online um you just have to look it up
6091480	6099080	um and you know before someone takes it down so and in other news for folks who are fans of
6099080	6105400	ultra street fighter 2 they have released now or figured out how to play as shin akuma
6106200	6114040	or as he was in japan goki so to do this you choose you highlight color one press cancel
6114040	6118200	then choose ken highlight number uh color nine then press cancel
6118200	6124200	choose sagat highlight color eight then press cancel choose m bison highlight color seven
6124200	6129800	press cancel highlight the random select then press l and r simultaneously good lord you have
6129800	6137080	to do that each time you want to play oh oh that's fucking hell that's stupid so well it's an arcade
6137080	6141800	ish thing to do i guess no it's stupid it's an arcade thing arcade ish thing to do in an arcade
6141880	6147400	that has no sort of like static memory to know that it's updated you know an unlock or something
6147400	6155560	like that that's on capcom not nintendo that is just stupid all right well anyhow i do want to
6155560	6159480	go to our chat over at live.vognetwork.com because some interesting uh insight the me verse thing
6159480	6163800	really struck a chord with a lot of people in chat uh when we were talking about that uh jd
6163800	6169160	and chat says the my nintendo thing still gives weekly me verse check-ins i don't expect them to
6169160	6174840	disable that until they roll out switch rewards on my nintendo uh act dev points out there's a me
6174840	6183160	verse stage in smash wii u so uh let's see uh also in chat at live.vognetwork.com dark tetsuya
6183160	6188040	theorizes maybe it'll tie into nintendo's new online maybe have a me verse style service on
6188040	6192920	switch well what's interesting to see if you haven't already seen splatoon 2 kind of built
6192920	6197160	its own me verse within the game and that's where you're seeing a lot of these pictures that look a
6197160	6202200	lot like me verse show up but they're just kind of embedded in splatoon 2 so that's kind of weird
6202200	6207560	but anyway uh dark tetsuya saying about the code by the way what i thought really neat about this
6207560	6214920	code this is the street fighter code is the color numbers spell out 1987 get it and hey to be fair
6214920	6219400	you have to do the same type of thing to unlock akuma in street fight excuse me street fighter
6219400	6225640	originally so i remember all the drama you had to go through to unlock roll it is it is it is
6225640	6229080	one of those things that once you do it once it should kind of be permanent but whatever all right
6229080	6235240	anyway enough of that let's talk about what is out in stores this week starting with the us loki so we
6235240	6240280	have a few things coming out this week um starting off with avon colony that's coming out on pc
6240280	6247160	playstation 4 and xbox one fable fortune on xbox one and pc i guess they got held back a little bit
6247160	6254840	uh pyre on pc and playstation 4 super or super cloud built on pc playstation 4 and xbox one
6255480	6264600	caller x or i guess caller cross malice on playstation vita hey pikmin is coming out on 3ds
6266040	6275800	metopia also on 3ds and then sundered on pc and playstation 4 and last but not least uh looks
6275800	6284680	like we've got dragon quest 9 on 3ds and playstation 4 that's it all right uh traveling
6284680	6289720	over to japan there's some releases to check out including on friday naruto shippuden ultimate
6289720	6294360	ninja storm trilogy uh gets a release on playstation 4 as well as call of duty modern
6294360	6298760	warfare remastered gets japanese released this week it's worth pointing out this isn't uh specific
6298760	6303480	to japan it's actually a korean game but it's coming out in the asian territories so i bring
6303480	6308440	it up here because a lot of import stuff uh and import stores it's on that list as well dj max
6308440	6313640	respect uh which i know some of you music game fans are looking forward to and then kind of a
6313640	6321880	big deal in japan dragon quest 11 on the playstation 4 dragon quest 11 sugishar sugi
6321880	6329160	sarishi toki o moto mette comes out uh um there's a regular one uh there's a controller that comes
6329160	6334920	out with that there's an entire freaking piece ps4 in a dragon quest edition that is all out
6334920	6339960	this week if you want to look on the vita however there's some releases there as well uh including
6339960	6347640	uh hiro no kakara omiiro no kyoku comes out in regular limited edition and waga mama high spec
6347640	6352200	in regular and limited edition uh checking out to see if there's anything on the switch or 3ds
6352200	6358920	japan this week doesn't look like we have anything this week except except some accessories um but
6358920	6366040	on the 3ds we do have um dragon quest 11 is also on the 3ds i forgot about that so there's actually
6366040	6371800	a metal slime 2ds xl that is coming out to go with that so i'm sure a lot of people are going
6371800	6379640	to be checking out dragon quest 11 how about the uk dark sakura we have a few um well really just
6379640	6388520	one thing on the 25th is fortnite for playstation 4 and xbox one uh hitstun in chat talking about
6388520	6394440	dragon quest 11 says yeah we still don't have dragon quest 10 i don't care until we have it
6394440	6400600	agree just saying all right dark sakura we're gonna go back right over to you to get into the
6400600	6407240	mailbag every week you guys send us emails participate at orange lounge radio.com and dark
6407240	6411640	sakura dives in the mailbag and finds some letters that she thinks maybe this one's worth reading
6411640	6417320	dear lord y'all all right all right i'm just trying to make sure that this isn't one no that's
6417320	6424440	fairly recent okay evening rob jamie and loki first of all let me say again happy 15th this
6424440	6428840	email i have been meaning to send y'all a couple of wait did i already read this one i think if
6428840	6433880	it's from rama you did do this last week okay then why does it have an earlier date on it or
6433880	6440680	a later date on it i don't know mailbox shenanigans because that other one i know when
6440680	6447480	was the 16th uh 16th was before the last year last show was was on the 16th so read anything 17th and
6447480	6456600	after okay well sorry rama well we complemented his email a lot last week so yeah but this seems
6456600	6464520	to be different oh well maybe he sent a revised version with an attachment i meant none of that
6465240	6469880	hell with all you i meant it all i didn't mean any of it i'll move forward that's fine
6470440	6478680	hi there i wait wait wait wait oh this is another thing about the fire pro wrestling thing oh hi
6478680	6485400	there is your penis small dude even enlargement no because i was like i saw spike chun soft
6486040	6492360	and i'm like what oh not danganronpa don't care how did that wow i guess that's a compliment
6492360	6496360	though that our new email address got picked up by some companies already that's well actually i
6496360	6501560	do care because then maybe yeah you wanted to check out that game right danganronpa v3 freebies
6501560	6506440	there's there's you read yeah i'm gonna play dangan i'm gonna play the fight about a fire
6506440	6512440	pro wrestling game with danganronpa characters dude read that email offline because there's
6512520	6521480	something in it that you're gonna want and take it okay ooh navy seals next email please okay sorry
6523960	6530840	this is called fucking stupid splatfest battles oh i already know what this is gonna be about i
6530840	6535720	know this is gonna be about somebody is trying to get me to fucking rant tonight read it okay
6535720	6542040	hello humanoids there's a link to a twitter thing on friday nintendo announced the next
6542120	6548120	platoon 2 splatfest battle will be team mayo versus team ketchup to which sky remarked
6550360	6557240	fuck off this is disgusting and an attack and i stand by my statement personally i just think
6557240	6562920	it's fucking stupid can you agree of any other fucking stupid splatfest battles they could do
6562920	6569320	how about team pinot noir versus team savignon block uh stable stay black writer dude i would
6569320	6574440	participate i i think a good splatfest would be team red wines versus white wines i think that's
6574440	6577880	a decent one worth having except that this is supposed to be a kids game but they can find a
6577880	6581880	creative way to word it like what's your favorite grape you like red grapes or white grapes that's
6581880	6587720	how you do it it would be and i think it's team box wine versus team bottle wine i it's all
6587720	6592840	delicious i just want to remind people the reason why i feel so strongly about this is i really
6592840	6598440	fucking hate mayonnaise and what what drives me bonkers about it is that it's not this well it
6598440	6605720	isn't it isn't splatfest itself this is an excuse for people to tag me on twitter talking about team
6605720	6612440	mayo and i'm just like shut up it's not fun i don't know if i'd be comfortable with a lot of
6612440	6619080	squid shooting substances that are similar to mayo around in that game you know what i hate ketchup
6619080	6624360	well here here's here's the thing i'm i i don't even really like ketchup i guess i'm team ketchup
6624360	6630680	by default but i am with the emailer i am team this is just ridiculous in general but i i'm only
6630680	6638040	team ketchup because i have to be but in the reality i'm going to california extreme this
6638040	6645080	weekend anyway right preach splatfest can kind of kiss my submarine sandwich guess what what
6645080	6649400	i'm not going to be in the cast at california extreme we can play ddr that'll be fun wait
6649400	6653880	splatfest is this weekend right not next weekend you know i'm also team not playing splatoon yeah
6654440	6661240	i'm just just forget that's splatfest i don't need the shell stuff that badly i can skip one
6661240	6667560	and i swear to god if you tag me in mayo bullshit on twitter i'm gonna block you like i it's not
6667560	6674760	funny i'm telling you right now it's not funny i have a letter from me to spike chinsoft okay
6674760	6680760	can we please give me don can run the v3 for free it's super professional i will i will review it
6680760	6687560	for you and tell you that i love it because i love all things danganronpa okay um oh sorry jd
6687560	6693160	just to be fair jd is pointing out splatfest his first weekend of august it's not next weekend well
6693160	6699480	i'm gonna fucking make plans the first weekend of august i am doing something other than splatfest
6699480	6706600	what let's go to a museum i would i team art team art let's go to the rosa crucial museum read a
6706600	6710280	book we're going to sit we're going to san jose and we're going to go to the rosa crucial team
6710360	6715080	science win that time oh that's right they did an art versus science thing didn't they god damn it
6715080	6720600	all right anyway hi olr it's reginator again with another seemingly random question thank you for
6720600	6729640	saving us he said semen you know is it seemingly why don't they just do team tits and team ass
6729640	6734040	why don't they just do that is uh team i want to see the shirts to come along with that one
6734040	6739000	why can't you have both can we get like the like the boob like hats you know that they have
6739640	6743880	so what would it be team dick versus team ass no why not team tits and ass
6743880	6750760	team no no we need team dick too there are plenty of women that would still pick tits
6750760	6757240	there are not many men who have boobs like that all right team we'll do uh team eggplant emoji
6757240	6763400	versus team peach emoji okay okay okay okay so we'll have one week of team tits and ass and one
6763400	6767880	tea tea week of peach emoji and i'll just i'll just set them all up i'll set them all up okay
6767880	6772680	because nintendo can't possibly handle the i love this idea what we should do on the show
6773320	6777160	if we i'm sorry to derail the email but you know what this is far more important than whatever sale
6777160	6783720	he's going to talk about so love your agent here so here's the thing i think when splatfest is lame
6784280	6793400	we replace it and we say these are the new teams we overrule nintendo and their inferior online
6793400	6799160	system and we are officially overruling this week's team mayo like they could have done
6799160	6807000	instead of mayo and ketchup they could have done alfredo and marinara okay oh and i would still
6807000	6811880	i would still be team marinara so anyway so but i think we should overthrow with team peach emoji
6811880	6816440	and team uh eggplant emoji that's a good one pesto versus marinara that even better anyway
6817320	6824040	i was just gonna break it but but but but i also will go out and and say there are men with nice
6824040	6831320	racks sure but i'm just saying it's not exactly and there's men with great asses just saying
6831960	6838360	it's all about the hip groove that's it okay so reginator talking about sales um
6839240	6844440	obviously most of us within the vog community enjoy video games to one extent or another
6844440	6851880	be it on console handheld or pc can't stand them but obviously we all don't have the time and or
6851880	6857080	energy to play games nearly as much as we would probably like and for various reasons that being
6857080	6863160	said is there any gaming specific gaming related media that you all like and make use of to fill
6863160	6872600	the void and what specifically um my iphone gaming related media i guess podcasts just
6872600	6878760	will pop yeah that goes without saying i just have my iphone yeah iphone is awfully convenient
6878760	6885080	i catch the pokemans at my desk gaming in your pocket and twitter and all that uh social media
6885080	6890840	i think is huge it's it's good and it's bad you know obviously there's a lot of good that comes
6890840	6895480	from social media and there's a lot of garbage so it's just kind of one of those depending on what
6895480	6899480	color glasses you're wearing on twitter i found a youtube channel that i absolutely fall in love
6899480	6905320	with and it's relaxing nintendo music which has like our tracks of nothing but the most relaxing
6905320	6910760	tracks from different games i like that i like three hour youtubes of people dissecting a two
6910760	6915560	minute pokemon trailer that was something shane introduced me to i was like wow this is uh this
6915560	6922200	is something i just discovered and i'm like it's our it's basically our show i discovered a channel
6922200	6927960	i think it's called like totally not jake who does like this dragon ball power level thing
6927960	6932200	and just listening that someone had the time to break down all the episodes and the manga and
6932200	6939880	try to figure it out i'm like dude i'm completely listening to this fascinated wrapped even and i
6939880	6946120	don't know why it's like well then usually i'm playing xenoverse at the same time so it's like
6946120	6950360	it's like when you eat food and watch cartoon network not cartoon network food network why
6950360	6956040	they say cartoon network or when you're like for people of that persuasion doing it while watching
6956040	6961800	important sure so i kind of miss g4 tv in that sense i mean not the later years but the earlier
6961800	6967560	years i missed tech and all that stuff i kind of missed that when that was more in its heyday both
6967560	6972360	those channels because you know that would be like i'm gonna zone out watch food network or i'm gonna
6972360	6977000	you know zone out watch uh cartoon network is like oh i can zone out watch the video game channel but
6977000	6983480	now it's i suppose it's twitch is kind of that now so i mean twitch is a decent answer and if
6983480	6987960	when i say twitch i mean mixer i mean youtube and all of it in one big bucket but the video game
6987960	6993560	social streaming is is huge obviously twitch is a generic yeah i like kleenex like clean yeah
6993560	7000200	exactly uh loki really real quick gaming media i watched him i will even during work like as i'm
7000200	7004760	working stuff he watches the ready player one trailer over and over and over again no i already
7004760	7011560	did that today um so uh no i watch um well funny enough it's not really game really i watch a lot
7011560	7017320	of red letter media because they do funny reviews of movies and i like that um but like gaming
7017320	7023640	related stuff usually at home i'll watch a few different uh youtube channels so like ollie43
7023640	7029080	does a lot of grants without a mod videos and just like silly shit that's just like small um i'll
7029080	7036040	watch some of the replays of um awesome games on quick because those are pretty fun and then uh
7036040	7043320	helix snake because of his uh skate 3 glitch videos are just fucking hilarious and um you
7043320	7050920	occasionally i'll watch reviews from um oh what is it uh angry joe show although sometimes he
7050920	7057240	gets on my nerves um and then i've been listening i don't know uh jim sterling the jimquisition
7057800	7061560	you know i just like listening to a lot of i guess those are almost like podcasts well
7062440	7066440	especially uh jim sterling show and stuff is more like a podcast but
7067000	7070680	i don't know i like their like opinions on stuff and it's entertaining to listen to
7070680	7073720	i don't listen to a whole time podcast occasionally i'll listen to the
7073720	7078520	uh completely unnecessary podcast with pat the nes punk and he talks about like stuff
7078520	7082440	and retro games and things i like the one where he talks to his neighbor
7084680	7088360	yeah they do that sometimes by the way it's totally not mark is the channel
7088440	7092200	so i linked one of them in the chat so that people know who i was talking about
7092200	7095400	i'm just going to chat because i noticed people in chat are also talking about
7095400	7101480	non-gaming things they zone out to dr tsuya says i think my non-gaming thing is dead malls lol
7101480	7106440	a dude abandoned theme parks i've watched a few videos of those those are pretty fun um or for
7106440	7114200	me for me wow presents oh honey or the ben heck show i like the ben heck show a lot honey oh
7114200	7123880	honey honey honey honey contact anyway i will not jody foster this behavior i need to watch
7123880	7130120	contact so i get katya's references you haven't seen contact yet no i haven't okay i'm not gonna
7130120	7134760	suggest to you there's a joke like there's a youtube series i still need to see always
7134760	7140200	reference the other the other movie that was like that um it wasn't a nolan film or something like
7140200	7145000	that it just came out not too long it's interstellar oh yeah i did see that it was
7145000	7150360	interesting anyway oh yes reginator yes for me i enjoy reading books be it physical ebooks or
7150360	7156280	audiobooks based on games listen to game soundtracks and read the comics when i find them
7156280	7162840	or watch twitch or reruns of old school gaming based tv shows you know i did actually read a lot
7162840	7169800	of comics based on i i had the first series of street fighter comics that came out before udon
7169800	7179480	was a thing the the publisher so those were pretty cool anyway i'm gonna go back and read
7179480	7185880	really clear one again probably maybe good good all right that's it for our uh our mailbag tonight
7185880	7190520	participate at orange laundry.com if you would like to send us an email in the future for us to
7190520	7197880	read here so all right uh let's move on with some more gaming news loki so nintendo has filed a
7197960	7207400	trademark application in the eu for a graphical representation of nintendo controllers including
7207400	7214920	the nintendo 64 the previous time that they had done this was for the nes and the snes which
7215480	7223240	you may remember have now mini systems for them so the thought is hey they're gonna release a mini
7223240	7230200	n64 classic edition that you won't be able to buy maybe in 2018 or something to that effect
7230840	7234600	so that might be something to look forward to what can print money next
7234600	7239720	although how i mean not to be too shady but how many nintendo 64 games are going to be
7241000	7245880	worthy of a collection are they going to cut it down to 15 games because i'm not i i mean how
7245880	7252600	many games are worth revisiting i'm sorry it sounds so shady but there's probably not quite
7252600	7258360	as rich of a collection as nintendo maybe they'll put the was it animal woods or whatever the fuck
