start	end	text
14224	25872	Tonight, March 23, 2008, Puzzle Quest on Xbox Live gets a new expansion, GIFs ensues even more businesses over Guitar Hero, and could Kid Icarus be really making a comeback this year?
32861	33701	DarkSakura, Jamie Summers
52486	53427	I'm full of waffles.
53767	54687	Full of waffles.
55087	56388	Enjoying the Easter waffles.
56428	57909	Isn't this a tradition in your fam?
58709	62511	You and Dan always... With our big group of people.
63131	68434	Although it seems that every year there's a new baby added with our friends who join us.
68854	70435	Because like one year they had Bob.
70815	73236	The next year they have Tatiana is her name.
73816	74457	They call her Tater.
76057	77998	That's a nice name for a child, Tater.
78419	79059	She's cute.
79159	79759	She's a cutie.
79899	80520	I don't doubt it.
80560	81160	Babies are cute.
81946	110193	and um um we basically just you know went to Marie Calendars and got well everyone goes to I finally learned my lesson after doing this for eight years is um they always go through the um the omelette line and I get sick on the omelettes every year for some reason so I was like screw your omelettes I'm having eggs benedict and waffles and I had waffles and chocolate eclairs
111087	112347	DarkSakura, DarkSakura, DarkSakura, DarkSakura
134994	136155	All right, then happy Equinox.
136215	136916	Happy whatever.
137396	138056	Happy day.
138637	139317	Just happy day.
139578	140398	Happy day, Loki.
140659	142220	Tech Master Loki also here every week.
142560	142860	Hello.
143080	143461	How are you?
143481	144742	I'm okay.
144902	146383	Did you do anything special today?
146423	147924	Did the Easter Bunny leave you anything good?
148165	151467	No, I just went over to my mom's house and we barbecued ribs.
152248	152968	Mmm, ribs.
153889	155610	You guys have interesting ways of spending Easter.
156851	158453	I mean, interesting good, not like interesting bad.
159213	160314	But more food.
161435	163557	Or as Frisbee in chat room says...
164281	169047	Chat.OrangeLawnTrainer.com, the always present fourth guest on the show, Waffle Lounge Foodio.
171069	173192	That could be the name of the show, Waffle Lounge Foodio.
173432	175415	You could play the Waffle song from Mystery Science Theater.
175754	177094	No, we're not going to play the Waffle song right now.
177114	181075	We're going to get into how was your gaming week, but first a teaser, a little teaser.
182216	186297	We have big news to talk about, like big, like we just found out 30 minutes ago big.
187077	188257	We'll be talking about that in just a moment.
188277	193598	I know a lot of people in chat are kind of going like WTF because they can hear us on Justin TV talking and like want to know what's up.
193758	194599	And yes, someone died.
194699	195139	I killed them.
195379	196279	No, no one died.
197315	198436	The ferret died.
198476	200058	Where has he been for the past year?
200859	203942	Actually, I found the ferret the other day, and then I put him back in the dusty corner I found him in.
204302	206445	Hey, you should have brought the ferret out.
207105	209788	All right, DarkSakura, how was your gaming week?
210889	212651	It was uneventful.
215054	215354	Really.
215735	216055	That's it?
217074	217894	It was uneventful.
217954	218614	No DSing?
218694	219414	No Ragnarok?
219515	219875	No nothing?
219895	220775	Well, I played Ragnarok.
220795	221915	Well, of course!
221995	222535	Of course!
222655	223955	I mean, that goes without saying.
224395	226456	But I actually did not touch my DS all week.
226596	227416	I moved that game.
229256	231497	That game that Dan brought me home that I'm not going to play.
232057	233477	The Professor whatever the fuck it is.
233657	234598	Professor Layton?
235118	235358	Yeah.
235458	237038	You know, I've heard a lot of good things about that game.
237078	238938	You might actually want to check it out at some point.
238958	239679	I'm not going to play it.
241479	241779	Well...
242273	244515	DarkSakura's House DarkSakura's House DarkSakura's House
270652	272154	DarkSakura, DarkSakura, DarkSakura, DarkSakura
290862	291362	DarkSakura, DarkSakura
317081	320142	One of the ones that's been removed on there, so I'm going to slap that back on there.
320542	324003	And they can fucking replace the thing, because I'm not touching it.
325164	325624	Bastards.
326604	329505	Yeah, and I'm addressing this comment in chat, because some people may not know.
329585	332346	Mike W. says, how many 360s does Loki have again?
332406	333266	So please refresh us.
333566	334807	How many 360s do you have?
334827	335267	I have six.
335327	336207	And why that many?
336407	338928	Because we land them in a game room.
339868	340929	And I got them for that.
340949	341629	That's amazing.
343166	343746	That's amazing.
343906	351007	Well, I had five originally, but then I bought one to replace another one, but I ended up fixing the original, so we have six.
352308	352548	Wow.
353648	362429	One that hopefully will be fixed here pretty soon, because like I said, it's not three-ringed anymore, but I think it may have overheated so many times that it's damaged, but we'll see.
364910	369411	And then this last one, which I'm sending to Microsoft, so that will be fixed.
370331	371911	So hopefully it will all be fixed at one point.
372932	379437	But it's not very promising that three out of the six have died within the last three months.
381238	381519	I don't know.
381779	381979	Nice.
382279	384621	So that's all I really got around to playing this week.
385502	393228	I do have a lot of stuff lined up for this week, including K Project, which is that res beta that got released out there.
393268	394809	So I want to try that because that looks cool.
395109	397471	I've got to dig out my Dreamcast for that.
397970	401291	and then Final Fantasy VII Crisis Core.
401931	403291	Oh, actually, I played a little bit of Smash Bros.
403331	406432	this week, but just Space Emissary stuff.
407092	411413	Oh, and I added everybody in the goddamn friends code list, so stop your bitching.
411893	412953	Okay, seriously.
413593	416674	Nobody was online when I was online earlier, so you know what?
417234	417814	Stop complaining.
417854	421315	Talking about the Orange Lounge Radio forum thread, right?
421695	421995	Of course.
422295	422495	Yeah.
422695	422775	No.
423407	425549	So I thought, yeah, I added everyone.
425589	428311	No, I didn't add everyone, but I added most people.
428792	430133	No, I think I might have added everyone.
431323	432484	DarkSakura, DarkSakura, DarkSakura
456244	458005	and trying to unlock everything in the gallery.
458385	463687	Like, you know, play Five Brawls with Princess Peach to get Super Mario 2 and things like that.
463707	465227	I've been trying to do as much of that stuff as I can.
465787	468368	So, good times.
468748	470909	And otherwise, I haven't been playing a whole lot.
470929	474190	I went back to the Xbox 360 and just played some random old stuff.
474971	482793	Nothing really of note was playing some World of Warcraft, but I was out of town this weekend and I was staying about a block from the Metreon.
483254	484234	Didn't even think to go there.
485459	486779	It's just not what it used to be.
486799	490782	You know, if you were there next week, you could actually go to a Crisis Core launch party.
491002	491463	That's alright.
492163	494805	Well, actually, I do have to go back to San Francisco next week anyway.
495285	497147	So, maybe I'll check it out.
497347	498308	Well, it's like Tuesday.
498788	499288	Oh, never mind.
499328	500189	I'm not going on a weekday.
501190	501910	Hmm, interesting.
503531	507834	Alright, so that does... Yeah, no new games to review this week.
507874	508515	That's kind of odd.
509415	511377	I've been playing Scrabulous on Facebook.
511817	512938	It's just like Scrabble.
513979	515279	It just depends on your bandwidth.
543359	544700	If you have dial-up, you might have a problem.
545140	548643	Well, if you have dial-up, I don't think you're going to fucking be watching or downloading a movie.
548683	549364	That would suck.
550044	551305	One gigabyte file?
551385	551665	Yeah.
551865	552306	No thanks.
554707	555028	I don't know.
555408	555868	It was okay.
556369	558610	I just... Oh, I want to hear something funny, too.
559091	565135	Actually, I have a friend at work right now who's really into rock band, and he keeps playing all the hard songs for me and unlocking me achievements.
566056	566276	Nice.
566897	569258	Because, you know, I can't fucking play the game on hard.
569358	570139	What am I talking about?
571253	571993	I can play guitar.
572013	572834	I can't do drums.
573234	574834	Oh, I played Rock Band this week.
574854	576355	I played a lot of Rock Band this week, actually.
576375	577555	That's why you take it to parties.
578195	584917	Because of that new, and I don't want to spoil the story that's coming up, but some of you guys know Rock Band had some enhancements this week, and we'll talk about them a little more a little later on.
585278	587458	But I went on to check them out.
587518	594300	And I haven't checked the Rock Band store in a long time, and I forgot that you can get some Nine Inch Nails songs that are pretty cool, and I got that.
594320	597121	And then the B-52s have a song on there, so I had to get that.
597181	599382	So I went shopping on Rock Band.
600097	602137	because I heart microtransactions.
603038	603778	I've spent way too much money.
603798	605458	Not really, but yeah, I've spent way too much money.
605498	607299	Yeah, way too much on Rock Band, seriously.
607939	612280	But just think, the next party we have is going to be so bitchin' with Rock Band.
613140	614340	So we need a Rock Band party.
614620	618161	The thing though, they don't make it very easy because of that stupid digital rights management.
618301	623503	You know, anything I download and if I bring it over here or whatever, I have to be logged in on live in order for all that content to be available.
623823	624123	Sucks.
624583	625423	Yeah, it really blows.
625979	627480	Actdeft is crying in chat.
627500	630621	He says, Mexico still can't access the music store and rock band.
630922	631662	So, you know what?
631742	636004	In some ways, it's a good thing because then you just start spending money so stupidly because you're like, oh, I have points.
636084	636825	I could just spend them.
636845	637585	That sad face.
638245	638445	Yeah.
639126	639326	What?
639726	640446	That is sad face.
640507	641167	That is sad face.
641187	641807	Very sad face.
642427	643488	So, there you have it.
644409	644669	Okay.
646109	650292	So, let's get to the big news and it actually really sucks.
650372	653053	Like, there's really no easy way for us to kind of mention this.
654494	654694	This...
655959	677120	and literally we just heard about some of the changes that have been going on with our streaming provider which is Live 365 literally about 30 minutes before our show went live tonight and the long and the short of it is that Live 365 is making some obscene changes in their pricing policies and they are going to be upping their
678536	681077	They're going to be upping their rates to these obscene amounts.
681197	688160	Basically, right now, we pay about $60 a month to have about 100 live listeners.
689121	697225	We would have to pay under this new plan $120 a month for 60 live listeners, which would only barely accommodate what we do on Sundays.
698105	700106	Usually, we don't talk about ratings.
700406	705008	We get about 50 to 60 live people on a good Sunday night, and we've actually gone beyond that before.
705048	706309	I think our highest show had 70 or 80 people.
707009	710572	I want to say we have, but I don't know.
711673	714596	It just sucks because it kind of came out of nowhere.
714636	716838	Supposedly, Live365 sent an email a month ago.
716978	717238	I don't know.
717358	719640	I never got it, so whatever.
720020	723964	They're upping these rates, and even if we could afford it, we kind of don't want to.
724684	727547	We've made a decision that we will be leaving Live365 effective April 12th.
731936	739321	and so that really sucks because that means the feed that we started in May of 2002 is going away.
740201	742923	And I wish this was an April Fool's joke, chat.
743003	743443	It's not.
743463	744884	This is completely legitimate.
744904	749026	It is not an April Fool's joke like a preemptive strike or something because it's not even April yet.
750087	752728	But we have no choice but to leave Life365.
754178	755619	DJ Ranma S, Actdeft, Drew, Carameldansen
778114	779816	We found out about this 30 minutes to an hour ago.
797717	826700	so we're still trying to kind of scramble too but regardless our live feed will be closing effective April 12th meaning that those of you guys that listen at work to the lovely video game music that plays all day long and the retro lunch and all that it's going away and what I feel most horrible for are the other live folks that we've had bless our stream with their presence for their hard work in live shows over the years including
827671	845628	DMN, including Travis Donovan, of course, including, you know, Extifer back when he had his show, including the three of us that do our spinoff shows when we feel like it, and the things that we had planned that we wanted to do with the live feed that now we're, all those plans are effectively off, unfortunately.
846212	873832	and obviously we'll do whatever we can for our friends that broadcast as well but we have to kind of like our number one priority right now is relocating our Sunday show first and then we'll see what we can do after that so Actdeft asks what's going to happen to DM Insanity and TDL I hope they keep going I hope they keep going somehow but unfortunately Orange Lounge Radio won't be around for them to do that with so
875057	881841	Orange Lounge Radio kind of ends in a way on April 12th because Orange Lounge Radio was the radio station.
881921	887704	This show is actually Orange Lounge Radio Live, but obviously over the years it's just been Orange Lounge Radio.
888285	890466	So yeah, I don't know.
891066	893668	The next week's going to be very interesting.
893928	895349	So that's the news.
895982	900823	If you have suggestions or offers, I guess, I don't know, send us an email.
900863	907065	You can contact me in my personal email box, rob at orangelaunchrader.com or our general email bag, mailbag at orangelaunchrader.com.
908485	910146	We think we know what we want to do.
910226	913587	We think we know the option that makes the most sense to us, but it involves other people.
913627	914867	We have to make sure they want to do it too.
915347	917428	So that's that.
918288	919649	You got anything else you guys want to add?
920009	920289	I don't know.
920309	920889	I've kind of been dying.
920909	921209	I don't know.
921229	923790	If you don't like what's going on, you send your emails.
923850	924550	I'd say the life...
926299	934067	And then, you know, in turn, they hopefully will send emails to whomever is charging them, you know.
934428	939433	Unfortunately, I think that they probably know what's going to happen because they're raising all the rates on their stations.
939533	943237	Obviously, a lot of people are just going to forego paying those rates and just quit.
943457	943577	Mm-hmm.
944289	948031	or find elsewhere, and that's unfortunately... I imagine we're not the only station that's doing this.
948192	961700	And I'm sure that they didn't have, you know, it wasn't really their choice to do that, but that's kind of, they have to... It does go back to the royalty things you've probably heard about from the past year, at least that's what they're blaming it on, but I still think it was kind of a bit out of left field.
961720	965543	Because they're taking advantage of that situation for their own personal gain.
965663	967344	I can't help but feel there's a little of that going on.
967364	971046	Anything you want to add, Jamie, as somebody who's been a live broadcaster for this long?
971807	971907	Um...
973143	973563	Not really.
973763	975044	Not that it hasn't already been said.
975724	977365	So, it sucks.
977585	977785	Wah, wah.
977845	978645	I'll make some refuse.
979906	982027	No.
982107	986868	RossDLUT says, Live365 is simply using the RAA boogeyman as an excuse to screw people.
989209	992951	I don't want to knock them right now, but let me put it this way.
993815	997158	We have the money to keep going if we wanted to.
997238	1000721	We could do the 60 listener limit, but we just kind of don't want to.
1000781	1003062	We think we can do – this is more of an incentive.
1003122	1007266	It kind of shows us that like, hey, Orange Launch Radio, you guys have been kind of lazy the past six years.
1007306	1012069	Just stay on on Life's Just Five because it was convenient and it was there, and you could just touch a button and everything is all set up.
1012490	1016753	So this is really going to kind of force us to explore alternatives, and it could be exciting.
1016793	1019515	It could be the beginning of big change, big change.
1019716	1021177	When one door closes, another opens.
1021317	1022077	Absolutely right.
1022278	1022778	I was just going to –
1023493	1024294	Check us out.
1024314	1025897	This is also another option right here.
1025957	1029742	They have actually people that do hosting for our unlimited listeners.
1030203	1030583	We'll see.
1031124	1031284	Maybe.
1031324	1031645	We'll see.
1031825	1032326	Maybe, maybe.
1032747	1033047	I don't know.
1034249	1035691	So we'll see over the next week.
1035771	1037614	We're exploring lots and lots of ideas.
1038942	1039462	So that's that.
1039522	1041943	Obviously our number one priority is keeping this show going.
1042343	1047184	I don't think that many people's worlds will be crushed without a 24-7 music feed.
1047804	1050585	I apologize to those that have been listening to our 24-7 music feed.
1050605	1055706	I know there are some that do, but obviously Sunday shows the priority for us right now.
1056567	1057227	So we'll see.
1058047	1058307	All right.
1059318	1060059	DarkSakura, DarkSakura
1082850	1084512	All right, let's get into other housekeeping tonight.
1084532	1088697	The other housekeeping tonight, of course, a happy Easter or whatever it is you celebrate today.
1089958	1091760	If nothing at all, then happy Sunday to you.
1092140	1097566	To all of our Orange Lounge Radio listeners, yes, we are here live on Easter because everybody, I guess, did their stuff this morning.
1097606	1100469	I went to the Bay Area this weekend, had a very lovely weekend in San Francisco.
1100490	1100830	It was good.
1101810	1102491	Thank you for watching!
1119525	1120486	Actdeft, Drew, Carameldansen
1144605	1173259	and the thing is that they do Rocky Horror Picture Show and I've been involved with that for a long time you know the show I did before Orange Lounge Radio actually started because of Travis and I's mutual love of Rocky Horror Picture Show under Station Live I still am involved with that not as heavily as I used to be but I still respect the scene and the counterculture that it provides this is very rare to have this show on the big screen this is probably the only time this year outside of a convention this will show on the big screen anywhere
1173599	1175041	Gary Shale, Oscar Drill, Live at the Show
1193809	1194609	The Orange Lounge Radio Wiki
1224053	1225494	Jamie, I showed you that before the show.
1225554	1226955	Isn't that awesome, the Orange Lounge Radio Wiki?
1227015	1228736	I love it, but you're missing some jokes.
1230338	1231679	You need to go old school.
1231719	1235782	We have, like, you know, death cake.
1236942	1244028	There's lots of old school jokes, but I've got to say, I'm very impressed with the work that the folks that have been working on the Wiki have done.
1244068	1249391	Again, the place that the Orange Lounge Radio Wiki is at, orangeloungeradio.wikia.com.
1251855	1256401	and just to give you an idea what's there, and this is all the listeners that have been doing this.
1256422	1256982	This is incredible.
1257323	1264212	They have a page of like inside jokes from the show that includes like the Loki is tingle bet and just some of the other things that have come up on the show.
1264813	1265574	And there's been...
1267594	1269776	They can hear the plane over the live feed right?
1269796	1270757	Can they hear that on the podcast?
1270777	1271897	Are they hearing that on Justin.TV?
1272258	1274559	Probably Justin.TV because the mic's right by the window.
1274579	1275660	Oh, yeah, because the window's open.
1275700	1276861	Yeah, they probably can hear the plane outside.
1277141	1280264	Okay, yes, we live by an Air Force base.
1280584	1281285	Well, it's not actually.
1281345	1282686	It's a helicopter.
1282726	1284027	It was an Air Force base.
1284107	1285228	It used to be an Air Force base.
1285308	1285928	Is it CHP?
1286028	1287510	Oh, somebody's breaking the law.
1287530	1288170	We don't live that far.
1288250	1288690	Sorry.
1288811	1291433	Isn't it now like a business airport is what they use it for primarily?
1291453	1292073	Yeah, it's a commercial airport.
1292093	1292974	Like FedEx and air shows.
1293094	1293915	Yeah, and air shows.
1293935	1294795	Oh, God, the air shows.
1295216	1295696	Oh, God.
1296877	1300718	I mean, the Blue Angels kind of get old to me after the first couple times and they're so loud.
1301139	1304000	I used to go see the Blue Angels when I was a kid, okay?
1304020	1305980	That's how fucking old they are.
1306061	1307521	It's just, really.
1307681	1314944	No, we've always lived by the airport, but now it's just tonight the window's open because it's hot here now, so we have the fan on in the window.
1315044	1316765	Yeah, I think it's bad now.
1316785	1319446	It only gets to like 110 outside.
1319806	1322987	By the way, I found out the information for you in an air conditioner.
1323687	1324307	Alright, excellent.
1324508	1325628	We'll talk about that later.
1326035	1326495	DarkSakura, DarkSakura
1353802	1355663	DarkSakura's Classic Game of the Week
1380396	1380616	BD Live
1403574	1416241	and it will allow you to do different things with your movies including they will have additional downloadable interactive content as well as like interactive games with leaderboards and that kind of stuff.
1416361	1421644	All stuff that you can kind of throw together on a Blu-ray disc which is pretty cool.
1422164	1429508	Other cool stuff that they're enhancing, you'll be able to play DivX in Windows Media files larger than 2 GB.
1431230	1435613	Also, the music and photo playlist can be exported from the PS3 to the PSP.
1437134	1440937	DVDs and Blu-rays will resume playback for the moment you last stopped them.
1441477	1446301	The PSP can be used as a remote control to play music on the PS3.
1447222	1454647	And the web browser will feature a faster page loading times and the ability to save links and stream linked videos.
1455828	1456348	That's pretty cool.
1456937	1464459	and also I guess another thing they called Mosquito Noise Reduction will be added to AV Control Panel for Blu-rays and DVDs.
1465599	1469261	I don't know what the fuck that last part is, but I'm sure someone out there does.
1471561	1472641	I have no idea what that means either.
1473242	1473822	What was that called?
1473862	1474462	Mosquito?
1474562	1475822	Mosquito Noise Reduction.
1476102	1480444	My guess may be like... Is that to like filter out the planes that fly by while you're watching the movies?
1480724	1481604	I don't know about that one.
1481997	1484219	Maybe like line humming or something like that.
1484260	1485601	It removes the hum off the line.
1485961	1486342	Interesting.
1486362	1488624	Well, I thought Blu-ray was supposed to be perfect anyway.
1488825	1490646	What the hell is there doing line noise?
1490727	1495191	Your Blu-ray may be perfect, but your theater setup may not be perfect.
1495592	1496072	Ah, I see.
1496132	1496473	Okay.
1497254	1497514	All right.
1498783	1501604	And my god, that sun is so fucking bright.
1501684	1501984	I know.
1502144	1502904	Through that window.
1503044	1504884	I'm just like blinded by that.
1505404	1508505	I'm sure the Justin TV people that are watching us on there can see.
1508905	1511985	But as we're taping, you know, just the way the sun is.
1512005	1512285	I'm just fine.
1512645	1517166	The sun is shining like right on Loki and I during the entirety of tonight's show.
1517186	1518186	I'm hiding in shadows.
1518847	1519947	Yes, we know, DarkSakura.
1519967	1520267	We know.
1520667	1521047	You know what?
1521107	1523327	Why don't you just like duct tape a towel up there?
1524087	1524648	That's cool.
1525588	1526608	Loki's just re-situating.
1526628	1527108	I'm moving the sun.
1527631	1531396	See, what'll be funny is that then later the sun will move slowly and hit you in the eyes again.
1532317	1533158	Isn't it going that way?
1533398	1535540	Well, like last week, it kind of went down.
1535801	1537923	It's shining through the last window right now.
1538404	1540927	Constant exposure to your eyes will eventually give me a headache.
1541187	1541367	Yes.
1541548	1542809	And I'm already starting to get one.
1543069	1544331	Maybe that's why I had a headache earlier.
1544371	1544671	I don't know.
1545352	1545773	Stories!
1546013	1546794	Alright, anyway, sorry.
1547901	1548922	PSP 3.93 Internet Radio Feature
1567026	1568027	and that's really it.
1568187	1574329	Although I imagine it probably closed some loopholes in the hacking world but my other question would be has this already been hacked, Loki?
1574810	1586175	No, it hasn't because really all it did was add just those 20 stations so they have a workaround to add those 20 stations if you want but otherwise they're not worrying about cracking it because it's basically just that.
