start	end	text
4724530	4732172	All right, there it is, your classic game of the week, Jackal, in this case on the NES, but on a variety of systems, as DarkSakura pointed out.
4732432	4732812	Check it out.
4734713	4737675	Alright, and that's our cue to take a quick break.
4737855	4739536	So that's exactly what we're going to do.
4739576	4745581	We're going to take a break and we'll be back with more of Orange Lounge Radio right after this break.
4746301	4751285	Orange Lounge Radio is taped live on Sunday nights and is podcast to the world twice a week.
4751765	4756048	Stay tuned to our podcast feed for the conclusion of this week's Orange Lounge Radio.
