start	end	text
1587776	1595099	That seems a little silly to do a whole firmware upgrade just to add those better be 20 damn good stations 20 damn good stations better be in there
1597682	1600363	I don't know, does 3 Speech have their own radio station?
1600403	1610825	I'm sure No, I think all games where we're syndicated on Monday nights and Tuesday mornings I think they're on there So that's all you really need, right?
1611265	1616067	We're not on there because Live 365 doesn't go on Shoutcast So we've been paying all that money, why?
1617167	1624909	When we can't even get listed on PSPs Oh, forget it It's old hat now Things are going to be changing soon I have two words for that
1625715	1629378	Alpha Canogram says it's not stations, it's players.
1630499	1632842	So I guess I'm what, like different skins and stuff?
1634043	1634943	Well, that's even lamer.
1637265	1638186	Tony, play us.
1638947	1641529	Rosteel UT says OLR should be on three-speech radio.
1642210	1642870	That would be fun.
1643631	1646694	Then we could talk about all the great things in the Sony world and nothing else.
1647543	1649344	Let's talk about all the good things in the Sony world.
1649364	1650964	And our show would be only five minutes long.
1651024	1654106	Hey, I have some great things in the Sony world to talk about.
1654126	1655566	All right, then please do share.
1656226	1658127	More like Sony being fucking stupid.
1658447	1659028	Ha ha.
1659508	1659988	No, um.
1660928	1679604	basically EA put out a patch for the orange box on PS3 that's supposed to address these problems with connectivity and frame rate issues and slow loading times but they haven't put out any other documentation to really say what else it's supposed to do and the thing is like 128 meg so it's kind of big and
1683900	1685321	No one else really knows what else it does.
1685441	1690763	And the whole thing is, it's not really Valve that did it, it's from their third party, so, whatever.
1693484	1701408	Well, at least it's not like, um, I was gonna say, like, Bully got patched recently, and apparently the patch didn't do anything.
1701768	1705470	See, see, see, Valve, this is what you get for having software on PlayStation 3.
1705730	1708171	I don't know, RustyLUT in chat says the patch does nothing.
1709895	1713196	Well, they said what the patch did, it's just, um, I don't know.
1713216	1713976	It's supposed to do.
1714637	1726561	Well, I am looking that up right now, because I don't remember off the top of my head, because I don't own the PS3 version of the Orange Box, and you know me, I don't care about anybody but myself, so, I don't know.
1726601	1735444	Well, I don't have the PS3 version either, I have the Xbox 360 version, and keep in mind, the only version worth having is either PC or Xbox 360.
1735844	1739425	PlayStation 3 is, it's not meant to be online.
1741359	1742960	I guess that's true.
1766380	1794764	and I don't know if they're going to actually scale it back resolution wise I mean after all they did allow them to break the barrier for Street Fighter 2 HD Turbo Remix whatever the fuck it's called now I think that that was the last announced thing though that they were having to scale it back because the game wasn't quite working at the full resolution I'm sure Microsoft will let them bend the rules a little bit to make it work with a big game like that okay
1795598	1799520	Anyways, since we've wasted enough time, now I can tell you what was in that patch.
1800481	1808466	They fixed graphical issues where a player would have the explosion effect left on the end of their rocket launcher while attempting to rocket jump.
1809166	1810767	Some memory leaks fixed.
1811187	1815250	Fixed an issue where the player's name would not appear on the stats comparison screen.
1816551	1821994	There's an issue that would cause the vote tallies to disappear when you viewed a scoreboard between rounds.
1822574	1823735	Online server issue.
1823755	1825016	Um...
1826799	1832303	An issue with players not always being added to the player's menu across MediaBar.
1834085	1839969	Fixed a bug where a player viewing a friend without an EA account would have an empty entry in their friend's leaderboard.
1840610	1846195	And fixed an issue where it was not possible to connect to EA's servers if you have more than 30 friends.
1846715	1855182	So it sounds like they fixed a lot of issues, but nothing really important like frame rate issues or anything that really needed to be fixed.
1857930	1858811	Huh, unfortunate.
1858831	1860572	You know, speaking of Valve, you know what I checked out?
1861192	1865495	Finally, after all this time, and I know some of you guys are going to be like, oh my god, Rob, you're behind the times.
1865915	1868557	I finally downloaded and checked out Steam this week.
1869518	1870278	After all this time.
1870339	1872060	It's a nice little front-end program.
1872120	1876743	It kind of reminds me of X-Fire, but like with game purchases available inside it.
1877043	1881086	And I actually thought about getting Portal, just so I can have it on the computer.
1881626	1885009	Because I'm a sucker for that game, as a lot of people are, what can I say?
1885029	1885069	Um,
1887691	1888311	Persona 4 Persona 4
1906989	1908510	All sorts of stuff from the new game.
1908750	1912072	Apparently, Persona 4 is coming to Japan in July.
1912813	1917636	Interesting enough, it's actually coming out on the PlayStation 2 and not the PS3.
1918797	1920177	So, it's pretty cool.
1920297	1924900	And it looks, you know, to me, I think it looks 100 times better than Persona 3.
1925241	1928963	So, I'm sure a lot of people will be very happy about that.
1929303	1934206	No word of what's coming over to the US, but seeing as they've brought over Persona 3 and Persona 3 FES...
1936465	1937466	DarkSakura, DarkDeft, Drew, Carameldansen
1967657	1973463	That is pretty interesting that they're packing all that in a PlayStation 2 game, you know what I mean?
1973563	1978228	That they're still cranking them out for the quote-unquote old system.
1978348	1981531	But, you know, I guess there's still tons and tons of PS2s out there.
1981571	1984574	It's still one of the better-selling game systems, eh?
1985175	1985455	Yeah.
1985635	1986015	Why not?
1986796	1987557	I guess it makes sense.
1989192	1989872	Thanks for watching!
2011187	2013508	It has some more in common with Street Fighter 2.
2013928	2019849	This game is starting to sound more and more like just another Street Fighter 2 port, but just like completely new graphics and everything.
2020029	2020309	Really?
2020389	2023430	Just like Street Fighter 2 Turbo HD Remix.
2025510	2031372	Well, but yet, you know, it's got the whole, it's 3D-ish element and, you know, the whole new characters and all that.
2031392	2036153	So, you know, the fighter guy and the, what was her name?
2036573	2037033	Crimson...
2038215	2039316	Viper, whatever her name was.
2040917	2041798	I think it'll be very cool.
2042058	2054526	But the news that was announced this week is that not only are there some small cosmetic changes in the game, but that the old combos will work exactly the same way in the new game.
2054926	2056728	And that means the old combos from Street Fighter 2.
2058769	2066134	And if you got a Guile combo down that you used to use in Street Fighter 2, apparently you can use them in Street Fighter 4 as well.
2067361	2070564	I love Killer Instinct.
2095069	2100313	But that's just... Have you ever played against, though, one of those people who are just like the combo people?
2100953	2101794	It's painful.
2101954	2107838	You know, strangely enough, not so much in Street Fighter II, but in Mortal Kombat, I used to get those people all the time, and it used to piss me off.
2108218	2113642	I was one of those people on the beta version, though, just because I learned Kitana's infinite combo.
2114222	2116104	Which was funny, because people get mad.
2116344	2116584	Anyway...
2117136	2119418	Speaking of pain... I gotta say this real quick in chat.
2119458	2122921	Rob D says, uh, there's no way they could get away with skipping those combos.
2122941	2123682	This is nothing new.
2123722	2125203	They never change mechanics that much.
2126184	2129267	True, but when you consider the age of Street Fighter 2, you know what I mean?
2130347	2131328	It's kinda, kinda cool.
2131909	2132750	Can I get on with the pain?
2132830	2133170	You may.
2133470	2133991	Bring on the pain.
2135172	2143319	Well, pain is gonna be on PlayStation Network, um, at least for, uh, the PAL PSN, um, for, uh, 499 pounds.
2143339	2143379	Um...
2145598	2149119	Basically, it's a game where you throw stuff for points.
2150520	2152641	I can't really describe it much else than that.
2152941	2153801	Didn't you buy Pain?
2154501	2154621	No.
2155121	2155882	I thought you did.
2155982	2157082	I have not bought anything.
2157162	2162164	Well, other than Flow, I bought that on there.
2162364	2168686	But other than that, I have not bought a game on the PSN because I do not like their payment method.
2168886	2170167	It's like jackass in the game.
2170227	2171367	I don't like using real money.
2171567	2172208	I like points.
2172568	2172988	Sorry, Jamie.
2173994	2183237	Basically, the whole point of pain is that, you know, you're causing misfortune in people, and people grow up and laugh at them.
2183717	2184617	They get laughed at.
2184817	2187978	So basically, that's sort of what pain is about.
2188698	2202082	Anyway, to get back to the story, there are also additional packs that are 69 pence each, and it will be the Scurvdog Muffy pack.
2202521	2207344	Santa, Hung Lo, Ginger, Cookie, and Fun With Explosives packs.
2208185	2209545	The last one is supposed to be a freebie.
2210246	2215469	You know, but any game that combines Santa and Fun With Explosives you think would be instant win.
2215689	2218291	If they had a band, it would be named Fun With Explosives.
2222834	2223174	Really?
2224174	2228897	But also, the store also has the Stranglehold pack for $9.99. $9.99.
2230536	2232157	That's, again, in pounds.
2232877	2235538	That has multiplayer maps.
2235598	2237679	It actually should be the one they got on Xbox Live.
2238559	2240579	You should see if that name is taken in Rock Band.
2241360	2242300	Fun with explosives.
2243240	2248902	Well, if not, then I would be stealing the one from Clerks that Dan came up with this morning.
2249002	2249402	What's that?
2249522	2250143	Making Fuck.
2252063	2253024	It's probably taken.
2253764	2254344	I wouldn't doubt it.
2254484	2258125	I think I have the name Emergency Kittens, but there's no one in the band.
2258746	2259946	So, whatever.
2260686	2267713	Anyhow, let's move on to some release dates for other things coming out around the world in the regular stores, the big box stores.
2268373	2271797	Yes, this week we've got some pretty cool stuff coming out.
2272137	2277502	Of course, winding down a little bit until we get to Mario Kart and Grand Theft Auto.
2278055	2282517	Dark Sector on PS3 and Xbox 360 Viking Battle for Asgard on PS3 and Xbox 360 Final Fantasy VII Crisis Core on PSP
2308145	2333358	also this week we've got Opuna on the Wii that's that Koei RPG that you can actually control the entire game with the nun check only I'm actually very curious to check out Opuna I definitely want to check out that game there's a little budget puzzle game called Octomania $19.99 for this game and you can play it online with other people so that's not bad at all
2334571	2337712	Also this week, Naruto The Ultimate Ninja 3 on PlayStation 2.
2339193	2343174	Obscure the Aftermath on PlayStation 2 and the Wii.
2344794	2345475	Let's see here.
2345495	2351796	A really crappy game called Backyard Baseball 2009 for the DS.
2353717	2363460	I don't know what number release this is this year, but one of the billion releases for Harvest Moon this year with Harvest Moon DS Cute.
2365166	2366587	That's going to be coming out on the DS.
2367007	2369788	Ninja Gaiden Dragon Sword, also on the DS.
2370589	2371449	Ooh, that'll be fun too.
2371729	2376111	Does Ninja Gaiden still have the epic cinema scenes like the old school games have?
2376131	2376731	I'm not sure.
2377172	2378472	God, I hope so, on the DS.
2378552	2384395	It is the DS, but the whole game is controlled with the stylus, so that's pretty cool.
2385475	2386276	And let's see here.
2386776	2391498	We've also got just some more crap here.
2393105	2396147	I guess, oh, this is also coming out on the 31st.
2397128	2400089	Monochemia, Alchemists of Al Rivas.
2400469	2403431	And that is a new RPG by Koei as well.
2404792	2406413	And that's pretty much it.
2407874	2408854	Yeah, for right now.
2409014	2414137	And I know next week there's absolutely shit coming out, so... Enjoy it while you last.
2414938	2415378	Alrighty.
2415856	2420019	Well, let's travel to Japan and check out some of the releases that will be coming out in Japan very soon.
2420059	2431207	On the Xbox 360, you get Dark Sector comes out, as well as Raiden Fighters Aces and Tomb Raider Anniversary all come out in Japan on the Xbox 360 this week.
2431587	2437171	Also, a DVD lens cleaner, if you need one of those for your Xbox 360.
2438683	2439103	Lyra Nobuken
2468297	2468938	is the name of it.
2470300	2478550	Coming out on other systems on the Nintendo Wii, Lego Star Wars The Complete Saga also on the Nintendo Wii, Ninja Reflex, Nitro Bike makes its way out of there.
2479091	2482095	Here's a spoiler for Japan, Nitro Bike sucks.
2482655	2483637	And how do you know that?
2484077	2486140	Because I played it and it sucks.
2486886	2487746	What Sucks About It
2514358	2518600	GS68, by the way, refers to one of the earlier titles we mentioned in chat.
2519100	2520821	He says, Golden Kump Ass.
2522242	2522522	Get it?
2523182	2524523	Golden Kump Ass.
2525803	2540010	PlayStation 2 sees Guilty Gear XX Accent Core Plus comes out, as well as Neo Angelique Full Voice in a premium box and a super premium box, as well as the original.
2541767	2549033	Silent Hill Origins makes its way to some Asian regions this week, but Korea is the only one we see mentioned, so be sure to check.
2549093	2551995	It might be a little bit longer before it makes its way to Japan.
2553036	2558140	Nobunaga no Yabu Online comes out in Japan this week as well.
2559020	2559761	Lots of fun stuff.
2561124	2563826	Let's see real quickly what's coming out on the handheld systems.
2563886	2569109	On the Nintendo DS, we have Business Ryoku Kente DS comes out.
2571471	2573752	Katekushi Hitman Reborn.
2574272	2579096	Bungle Shiki Taisen Battle Sugoruku comes out.
2579156	2579616	Baseball game.
2580336	2583198	I like that it says Hitman Reborn in it, in the middle of it, though.
2586881	2588281	Kind of makes me think of a different type of game.
2588302	2589542	Maybe it's baseball with Hitman.
2589562	2590103	That would be fun.
2590323	2590523	No.
2591469	2592869	They need Battlefield Baseball.
2592929	2593830	That'd be pretty awesome.
2594510	2594830	Let's see.
2594910	2598311	Simple DS Series gets volume 35, the Genshin this week.
2599011	2600991	Lost in Blue 2 gets a price reduction.
2601551	2604232	And Mobile Suit Gundam 00 comes out.
2605352	2607372	Mina de Flash Anzen DS.
2607472	2610833	Mina no Atsumare Quiz Party comes out.
2611473	2614734	And, wait for it, the Golden Compass on Nintendo DS.
2616038	2617159	PSP.
2617279	2619419	Check in real quick to see if anything's coming out of note there.
2619820	2623621	Monster Hunter Portable 2nd G. That might be kind of cool.
2624162	2627763	As well as Tomb Raider Anniversary comes out on the Sony PSP.
2627823	2628604	That's it for Japan.
2630524	2631125	That's all.
2631445	2636387	Okay, well I have for our UK listeners another set of release dates.
2637412	2639833	On the 27th, the Gran Turismo 5 Prologue.
2641834	2643395	You've heard us talk about this, so don't worry about it.
2644435	2645916	The Golden Horde on PC.
2646937	2663204	On the 28th, we have Coded Arms Contagion, Football Manager 2008, God of War, Chains of Olympus, King of Clubs, Naruto, Clash of Ninja Revolution, Powershot Pinball Constructor, which sounds pretty fun, that's on DS.
2664051	2680136	Pro Evolution Soccer 2008 on Wii, Sega Bass Fishing, Universe at War Earth Assault, Viking Battle for Asgard, Warriors of the Lost Empire, Warriors Orochi on PC and PSP, and Worms Space Oddity.
2682896	2683116	Cool.
2684097	2684897	That would be it.
2686349	2689152	Coming out here not very soon, but soon enough.
2689593	2695999	In June, Activision actually announced that they will be bringing Guitar Hero on tour to the Nintendo DS.
2696620	2699042	Now, you may be wondering, how the hell are they going to do that?
2699142	2703667	Well, there's actually a brand new peripheral that they're releasing along with it called the Guitar Grip.
2704147	2708612	It has four fret buttons and a wonderful little hand strap to put your hand through.
2709119	2713620	So you use that just like you would, you know, the fret buttons on an actual guitar.
2714300	2721682	And then you strum on the touch screen with a stylus, or actually a pick stylus that comes with the game to do that kind of stuff.
2722322	2724923	And of course, you know, plays just like Guitar Hero.
2725303	2729024	It's supposed to have 20 songs, or more than 20 songs in the game.
2729364	2732244	And 80% of the songs will be original master recordings.
2733285	2734385	So that's pretty cool.
2734405	2734485	I've
2735609	2739552	My memory serves me right, it's $49.99, comes out June 22nd.
2740453	2742094	Oh, just in time for my birthday!
2743255	2746477	By the way, they've wasted no time in whoring this game to the masses.
2746537	2753823	I don't know if you guys ever visit Yahoo.com, like just, you know, out of the blue, but it's one of the pages I'll go to, you know, for like news and search and stuff.
2754263	2756805	And there's a little flash ad that pops right up there.
2756905	2759027	It's already whoring the Guitar Hero on tour.
2759067	2759427	Oh yeah.
2759487	2760628	They are wasting no time.
2761164	2772381	And I would recommend pre-ordering this if you're really interested in it because like most other Activision games that include peripherals, especially brand new peripherals that they're breaking ground on, this thing will be hard to find.
2773683	2776928	Frisbee asks, is anyone honestly going to buy this crap?
2777734	2779196	I actually have mine pre-ordered already.
2779396	2783340	But I'm not going to probably play it because that's what I do.
2784702	2785903	It looks interesting.
2786023	2787945	I'm interested enough where I at least want to play it.
2788005	2789527	I don't know if I want to drop, what you said, $49.95?
2789807	2789527	$49.99.
2789867	2794212	I don't know if I want to drop $50 on it, especially if it's only 20 songs.
2794292	2796294	But I'm interested in checking it out.
2797990	2798330	I don't know.
2798350	2799091	I think it's neat.
2799171	2805376	I don't think it would be that difficult if it's only four buttons if I can already play five-button mode on the... Dude, Konami really missed out, man.
2805396	2807357	They could have done Guitar Freeze with three buttons.
2807377	2808959	I'm saying that for a long time.
2808999	2809559	Just saying.
2810520	2810820	All right.
2811240	2812221	Well, I'm interested.
2812261	2812982	Actually, I'm interested.
2813022	2813782	Let me ask chat.
2814062	2817965	How many folks in chat are interested in picking this game up?
2818226	2819126	Guitar Hero on tour.
2819186	2825311	Quick poll of chat because I imagine most of you that own DSs or if you don't own a DS, imagine you did.
2825371	2826312	Would you pick up this game?
2828522	2831123	and Frisbee says, please just smack yourself.
2831203	2832264	Elite Beat Agents.
2832664	2833264	Okay, thanks.
2834865	2836766	Oh, I feel so sorry for Elite Beat Agents.
2836786	2839167	I was in Fry's the other day and that game's like on clearance.
2839528	2839728	Yeah.
2839808	2840628	Tons and tons of copies.
2840648	2841529	You can't buy it anymore, actually.
2841569	2842149	It's kind of sad.
2842169	2842909	It's so sad.
2842969	2843990	That game is awesome.
2845751	2853757	But, you know, hey, here's the thing, and I don't know if you should start getting worried about this or not, but they're really whoring Guitar Hero out.
2853937	2864725	I mean, Activision, I don't know if they're going to drive it into the ground or what, but, I mean, we've got, actually, literally a week after this, Guitar Hero Aerosmith coming out.
2865265	2872130	Then you've got Guitar Hero 4, and who knows how many other shit, you know, games that they're going to throw in the middle there.
2872605	2877069	They're really whoring that franchise out, and people are kind of really buying into it, unfortunately.
2877229	2879851	Alright, let's look at our instant poll results in chatroom.
2879891	2883213	I'm not going to read the nicknames because that will take me too long, but really quickly, here's some of the comments.
2883574	2887437	Question was, are you going to buy Guitar Hero on Tour DS?
2887997	2888418	I'm not.
2889438	2888418	0%.
2889699	2889979	No.
2890659	2890940	No.
2891380	2891900	Not me.
2893141	2894843	Just get a PSP and DJ Max.
2895523	2896624	Depends on the song list.
2897165	2897585	Maybe.
2897605	2897705	Maybe.
2899033	2901796	Only for the peripheral to make it easier to play Puzzle League.
2902516	2903457	Strap for the win.
2904838	2907840	If the game has songs I like, I might download, I mean pick it up.
2909922	2913705	I may get it if they guarantee cheap expansion pack song cards minus peripheral.
2916247	2917368	Never, ever, ever, ever.
2919609	2922772	I will purchase Guitar Hero on tour after I'm done burning $100 bills.
2923833	2926034	No, nope, you'd look like a damn fool playing it.
2926415	2928196	No, no, not ripped off.
2928846	2929808	and Khan.
2932031	2933734	There's your instant poll results.
2934155	2939924	Well, I was just thinking, I mean, this is a good game for kids, you know, especially when you're taking them on the road and stuff.
2939944	2941086	They can play their Guitar Hero.
2941522	2942443	Thanks for watching!
2960456	2962417	Look, you can play Guitar Hero in the car.
2962497	2963057	Have fun.
2963077	2963757	Shut up.
2963777	2966198	The only reason I'm buying it is so we can show it on the show.
2966258	2967718	That's pretty much the only reason.
2967919	2968979	Oh, don't waste your money.
2969299	2973140	Well, hey, just because I ordered it doesn't mean I'm going to actually buy it, okay?
2973180	2975561	Because I don't have to.
2975581	2978322	I just put it on order to kind of hold my spot.
2980703	2983404	RossDLUT says, Loki, you're high.
2983484	2986825	They'll bug mommy even more with this game by singing along.
2988444	2990946	No, maybe my wife would do that, but, you know.
2993187	2995029	Just don't put songs with words in them.
2995349	2995789	There you go.
2996510	2996870	Alright.
2998291	3002294	Let's go into more lawsuit news from Gibson.
3002334	3008018	We already kind of talked about this last week, but if you can believe it, even more lawsuits coming out from Gibson.
3008038	3017205	You remember Gibson sued Activision, they sued Harmonix last week, all over the fact that Gibson says they have had a patent for electronic guitars for...
3019541	3033948	And get this, this week, now they've sued GameStop, Walmart, Target, Kmart, Amazon, Toys R Us All these major retailers that sell Guitar Hero games Seeking basically to stop the sale of the games Did you see they also sued EA?
3034409	3046055	Even though EA doesn't make Guitar Hero at all It's crazy, yeah I was going to say in the next piece here They sued Harmonix, Viacom, and EA now as well
3048041	3051404	Just because I guess they want to sue as many people as possible.
3052985	3053906	I don't understand this.
3053926	3054986	This makes no sense at all.
3055427	3055767	I don't know.
3056267	3057128	They're looking for money.
3057969	3061832	But why would you sue the retailers to get them to try to stop selling the game?
3062712	3064534	Because they're trying to make a big stink.
3064554	3066155	They're trying to file an injunction.
3066175	3069077	They're trying to make a big stink and seeing who will give them money.
3070358	3072360	Loki says the EA suit is over Rock Band.
3073800	3078804	I don't know if it's over Rock Band because they mentioned Guitar Hero in the lawsuit.
3078844	3079845	It's not Rock Band.
3080886	3084669	Is it because now Harmonix is a part of... Oh no, I guess it was just an agreement.
3084769	3085129	I don't know.
3085789	3086330	That just sucked.
3086390	3087391	Let's sue everything.
3088071	3089592	I like that comment from Gerardimo in chat.
3089893	3093816	Well, you gotta wonder, is this Gibson thing legitimate or not?
3093936	3095657	And there's actually an analyst out there.
3095677	3097398	Of course, we love analysts.
3097799	3101101	But this is actually a legal analyst working for...
3102509	3112873	Wedbush Morgan, he's an analyst, he says this about the lawsuits, quote, this is, Michael Pastors' name, quote, this is a poorly masked attempt to extort money.
3113253	3116714	They are using any way they can to have Activision write them a check.
3117615	3124758	I mean, seriously, this is the third game, I mean, well, the third major release of the game that's been out so far.
3125058	3130220	I think at one time they had Gibson guitars in the game, I want to say, I don't know, I may be wrong.
3130960	3131080	Um,
3131752	3132752	DarkSakura, DarkSakura,
3156337	3165067	It was Konami, and if I remember correctly, I thought Activision was licensing the rights to use that from Konami, and not Gibson.
3169772	3173856	All I gotta say is the next fucking guitar games you guys put out, just forget about Gibson.
3173896	3177380	There's plenty of other guitar manufacturers out there you can license guitars for.
